{
  "query": "Analyze the causes of occupational burnout syndrome among teachers and healthcare workers.",
  "chain_of_research": {
    "plan_1": {
      "title": "Defining Burnout\nCauses in Teaching\nCauses in Healthcare\nNext Steps",
      "description": "I'm starting my research by establishing a clear and authoritative definition of occupational burnout syndrome. I'll be looking for definitions from leading psychological and health organizations to understand its core dimensions: emotional exhaustion, depersonalization, and reduced personal accomplishment.\nI'll then delve into the specific causes of burnout within the teaching profession. My focus will be on factors like excessive workload, large class sizes, administrative pressures, limited autonomy, student behavior challenges, and insufficient resources.\nIn parallel, I'll investigate the primary drivers of burnout among healthcare workers. This will include examining long work hours, high-pressure environments, the emotional impact of patient care, administrative burdens from electronic health records, and broader systemic issues within healthcare.\nOnce I have a solid understanding of the causes in both professions, I'll move on to comparing and contrasting these triggers, analyzing systemic factors, exploring the consequences of burnout, and identifying potential solutions."
    },
    "search_1": [
      "https://en.wikipedia.org/wiki/Occupational_burnout#:~:text=The%20ICD%2D11%20of%20the,has%20not%20been%20successfully%20managed.",
      "https://www.who.int/standards/classifications/frequently-asked-questions/burn-out-an-occupational-phenomenon",
      "https://minoritynurse.com/navigating-the-emotional-struggles-of-compassion-fatigue-in-nursing",
      "https://www.apa.org/gradpsych/2011/03/corner",
      "https://dictionary.apa.org/burnout",
      "https://academic.oup.com/occmed/article/74/9/630/7958938?rss=1",
      "https://www.frontiersin.org/journals/psychology/articles/10.3389/fpsyg.2023.1084329/full",
      "https://cpa.ca/psychology-works-fact-sheet-workplace-burnout",
      "https://en.wikipedia.org/wiki/Maslach_Burnout_Inventory",
      "https://www.nursingworld.org/content-hub/resources/workplace/what-is-nurse-burnout-how-to-prevent-it",
      "https://pmc.ncbi.nlm.nih.gov/articles/PMC11281910",
      "https://pmc.ncbi.nlm.nih.gov/articles/PMC8101694",
      "https://www.usa.edu/blog/nurse-burnout",
      "https://www.ama-assn.org/practice-management/physician-health/12-factors-drive-physician-burnout",
      "https://ccphp.net/blog/whats-causing-physician-burnout-how-to-address-it",
      "https://www.hhs.gov/surgeongeneral/reports-and-publications/health-worker-burnout/index.html",
      "https://www.hhs.gov/surgeongeneral/reports-and-publications/health-worker-burnout/index.html#:~:text=Some%20examples%20include%3A%20excessive%20workloads,and%20lack%20of%20organizational%20support.",
      "https://www.adonis.io/news/causes-of-burnout-in-the-healthcare-industry",
      "https://paper.co/blog/teacher-burnout-also-impacts-students-heres-how",
      "https://moreland.edu/resources/blog-insights/empowering-educators-why-teachers-need-autonomy-in-2025",
      "https://files.eric.ed.gov/fulltext/ED612141.pdf",
      "https://business.talkspace.com/articles/how-to-prevent-teacher-burnout",
      "https://pmc.ncbi.nlm.nih.gov/articles/PMC9689976",
      "https://www.graduateprogram.org/blog/how-to-navigate-burnout-as-an-administrator",
      "https://www.educationsupport.org.uk/resources/for-individuals/articles/teacher-burnout-and-how-to-avoid-it",
      "https://www.devlinpeck.com/content/teacher-burnout-statistics",
      "https://digitalcommons.csumb.edu/cgi/viewcontent.cgi?article=2905&context=caps_thes_all",
      "https://crowncounseling.com/statistics/teacher-burnout",
      "https://www.nea.org/nea-today/all-news-articles/class-sizes-growing-issue-among-educators",
      "https://www.ebsco.com/research-starters/education/teacher-burnout",
      "https://source.cognia.org/issue-article/teacher-burnout-creating-a-culture-of-support",
      "https://everfi.com/blog/k-12/teacher-burnout",
      "https://soeonline.american.edu/blog/teacher-burnout"
    ],
    "observation_1": "I've started by gathering definitions of occupational burnout syndrome from authoritative sources like the World Health Organization (WHO) and the American Psychological Association (APA). The WHO defines burnout as a syndrome resulting from chronic workplace stress that hasn't been successfully managed, characterized by feelings of energy depletion or exhaustion, increased mental distance from one's job (or negativism/cynicism), and reduced professional efficacy. The APA's definition aligns with this, emphasizing emotional exhaustion, negative attitudes, and decreased motivation, often seen in service-oriented vocations. I also learned about the Maslach Burnout Inventory (MBI), a widely recognized tool for measuring burnout across three dimensions: emotional exhaustion, depersonalization (or cynicism), and reduced personal accomplishment (or professional efficacy).",
    "plan_2": {
      "title": "Causes of Teacher Burnout\nCauses of Healthcare Worker Burnout\nNext Steps in Understanding",
      "description": "My research into teacher burnout reveals several key contributing factors. These include excessive workload, often exacerbated by staff shortages and additional duties, leading to long working hours and insufficient planning time. Large class sizes and challenging student behavior are also significant stressors. Furthermore, a lack of administrative support, limited teacher autonomy in decision-making, inadequate compensation, and insufficient resources contribute to feelings of being overwhelmed and unappreciated. The emotional demands of caring for students and the pressure to achieve high test scores also play a role.\nFor healthcare workers, similar themes emerge. Prolonged working hours, high patient loads, and insufficient breaks are major physical contributors to exhaustion. The emotional and psychological stresses of making life-and-death decisions, witnessing suffering, and dealing with adverse patient outcomes are profound. Administrative burdens, such as extensive paperwork, electronic health record (EHR) entries, and the pressure to meet targets, significantly reduce time for patient care and contribute to frustration. A lack of autonomy and control over their work, coupled with chaotic work environments due to staffing shortages, further intensifies burnout.\nI'm now synthesizing this information to identify commonalities and distinctions in the causes of burnout across both professions. This will allow me to move towards a comparative analysis, exploring systemic factors that contribute to these issues and ultimately, potential solutions."
    },
    "search_2": [
      "https://academic.oup.com/occmed/article/74/9/630/7958938?rss=1",
      "https://www.who.int/standards/classifications/frequently-asked-questions/burn-out-an-occupational-phenomenon",
      "https://www.apa.org/gradpsych/2011/03/corner",
      "https://www.nea.org/nea-today/all-news-articles/class-sizes-growing-issue-among-educators",
      "https://soeonline.american.edu/blog/teacher-burnout",
      "https://everfi.com/blog/k-12/teacher-burnout",
      "https://www.ebsco.com/research-starters/education/teacher-burnout",
      "https://www.devlinpeck.com/content/teacher-burnout-statistics",
      "https://www.adonis.io/news/causes-of-burnout-in-the-healthcare-industry",
      "https://www.usa.edu/blog/nurse-burnout",
      "https://pmc.ncbi.nlm.nih.gov/articles/PMC9689976",
      "https://www.frontiersin.org/journals/psychology/articles/10.3389/fpsyg.2023.1084329/full",
      "https://files.eric.ed.gov/fulltext/ED612141.pdf",
      "https://minoritynurse.com/navigating-the-emotional-struggles-of-compassion-fatigue-in-nursing"
    ],
    "observation_2": "I'm synthesizing the information gathered so far and observing significant overlap in the causes of burnout for both teachers and healthcare workers. Key commonalities include excessive workloads, often stemming from staff shortages and increased demands, leading to prolonged working hours and insufficient time for essential tasks. Both professions also experience considerable emotional and psychological stress due to the nature of their work – caring for others, witnessing suffering, and dealing with challenging situations. Furthermore, administrative burdens, a lack of autonomy, and insufficient organizational support are prevalent issues contributing to burnout in both fields.",
    "plan_3": {
      "title": "Specific Stressors for Each Profession\nNext Research Steps",
      "description": "While many causes are shared, I'm also noting stressors unique to each profession. For teachers, these include large class sizes, student behavior issues, pressure to achieve high test scores, and a perceived lack of respect for the profession. For healthcare workers, specific challenges involve making life-and-death decisions, navigating complex electronic health record systems, and the emotional toll of adverse patient outcomes, sometimes leading to 'compassion fatigue'.\nMy next steps involve a deeper dive into systemic and organizational factors contributing to burnout, such as government policies, funding models, and workplace culture. I will also begin to explore the broader consequences of high burnout rates, including staff turnover and impacts on the quality of services. Finally, I will identify and synthesize proposed strategies and interventions to mitigate burnout at various levels for both professions."
    },
    "search_3": [
      "https://spark.bethel.edu/etd/1144",
      "https://www.ebsco.com/research-starters/education/teacher-burnout",
      "https://www.acponline.org/practice-career/physician-well-being-and-professional-fulfillment/top-10-culture-change-interventions-to-reduce-burnout-and-improve-physician-well-being",
      "https://pubmed.ncbi.nlm.nih.gov/11507994",
      "https://www.aaspa.org/news/how-to-avoid-teacher-burnout-and-increase-teacher-retention-2025",
      "https://www.devlinpeck.com/content/teacher-burnout-statistics",
      "https://www.hawaii.edu/news/2025/01/16/health-care-workers-mental-health",
      "https://www.acpjournals.org/doi/10.7326/M18-1422#:~:text=At%20an%20organizational%20level%2C%20the,per%20employed%20physician%20each%20year.",
      "https://www.bmj.com/content/365/bmj.l2361",
      "https://pubmed.ncbi.nlm.nih.gov/33901940",
      "https://psnet.ahrq.gov/primer/burnout",
      "https://scholarworks.calstate.edu/downloads/ng451s65g",
      "https://son.rochester.edu/newsroom/2024/preventing-nursing-burnout.html",
      "https://files.eric.ed.gov/fulltext/ED498001.pdf",
      "https://digitalcommons.csumb.edu/cgi/viewcontent.cgi?article=2905&context=caps_thes_all",
      "https://smithchason.edu/blog/combatting-nurse-burnout-7-strategies-and-tips",
      "https://varthana.com/school/imapcts-and-prevention-of-teacher-burnout",
      "https://www.nyssba.org/news/2025/01/10/on-board-online-january-13-2025/exploring-the-financial-impact-of-teacher-turnover",
      "https://www.medpro.com/culture-of-wellbeing-resiliency-removed",
      "https://news.harvard.edu/gazette/story/2019/07/doctor-burnout-costs-health-care-system-4-6-billion-a-year-harvard-study-says",
      "https://www.ama-assn.org/practice-management/physician-health/nearly-1-billion-excess-patient-costs-tied-physician-turnover",
      "https://www.congress.gov/bill/118th-congress/house-resolution/1089/text",
      "https://www.cdc.gov/media/releases/2024/p0318-Worker-Burnout.html",
      "https://pmc.ncbi.nlm.nih.gov/articles/PMC11781124",
      "https://www.droracle.ai/articles/37453/factors-affecting-physician-burnout-focus-on-internal-medicine-and-primary-care-",
      "https://www.simbo.ai/blog/exploring-the-systemic-causes-of-health-worker-burnout-and-their-impact-on-patient-care-quality-3530164",
      "https://www.toddleapp.com/learn/blog-post/reduce-teacher-burnout-and-improve-your-school-culture",
      "https://www.thosewhocan.org/teacher-burnout-prevention-management",
      "https://www.frontiersin.org/journals/psychology/articles/10.3389/fpsyg.2024.1406562/full",
      "https://www.educationsupport.org.uk/resources/for-individuals/articles/teacher-burnout-and-how-to-avoid-it"
    ],
    "observation_3": "I've continued to refine my understanding of the causes of occupational burnout in both teaching and healthcare. For teachers, I've confirmed that factors like excessive workload, large class sizes, student behavior issues, lack of administrative support, and limited autonomy are significant contributors. In healthcare, I've identified prolonged working hours, high patient loads, the emotional toll of patient care (including compassion fatigue), and administrative burdens as key drivers. There's a clear pattern of high demands coupled with insufficient resources and support across both professions.",
    "plan_4": {
      "title": "Addressing Information Gaps\nNext Steps: Interventions and Comparison",
      "description": "I'm now focusing on filling in the remaining information gaps, particularly regarding specific, evidence-based interventions for both teachers and healthcare workers. My previous searches provided a good foundation on the causes and consequences, but I need more detailed information on actionable strategies at individual, organizational, and policy levels. I also need to find a comprehensive resource detailing physician burnout factors, as a previous attempt to access an AMA article was unsuccessful.\nMy immediate next steps involve conducting targeted searches for interventions and best practices to mitigate burnout in both professions. Once I have this information, I will be well-positioned to synthesize all findings and perform a detailed comparison of the burnout triggers, systemic factors, consequences, and solutions for teachers and healthcare workers."
    },
    "search_4": [
      "https://www.cdc.gov/niosh/learning/publichealthburnoutprevention/default.html",
      "https://nam.edu/publications/national-plan-for-health-workforce-well-being",
      "https://www.graduateprogram.org/blog/5-ways-to-build-teacher-well-being",
      "https://www.colorincolorado.org/article/extinguishing-teacher-burnout-strategies-and-resources-educators",
      "https://www.mdpi.com/2076-328X/15/5/649",
      "https://pmc.ncbi.nlm.nih.gov/articles/PMC10178023",
      "https://pmc.ncbi.nlm.nih.gov/articles/PMC8986160",
      "https://www.hhs.gov/surgeongeneral/reports-and-publications/health-worker-burnout/index.html",
      "https://lifelonglearning.waldenu.edu/resource/5-ways-to-manage-employee-burnout-as-a-healthcare-manager.html",
      "https://www.ama-assn.org/practice-management/physician-health/advocacy-action-reducing-physician-burnout",
      "https://pmc.ncbi.nlm.nih.gov/articles/PMC11342329",
      "https://www.rehabiljournal.com/articles/addressing-health-worker-burnout-to-improve-the-quality-of-patient-care.html",
      "https://www.edutopia.org/article/leaders-teacher-wellbeing-action",
      "https://www.nursingworld.org/content-hub/resources/workplace/positive-work-environment",
      "https://business.talkspace.com/articles/how-to-prevent-teacher-burnout",
      "https://www.sermo.com/resources/physician-burnout-solutions",
      "https://www.mywellbeingindex.org/blog/7-ways-to-improve-well-being-among-nurses",
      "https://www.keragon.com/blog/physician-burnout-treatment",
      "https://www.pointloma.edu/resources/education/5-ways-prevent-burnout-teacher",
      "https://www.shiftmed.com/insights/knowledge-center/ensuring-nurse-well-being-and-job-satisfaction",
      "https://www.ama-assn.org/practice-management/physician-health/physician-burnout-4-types-interventions-and-how-they-can-help",
      "https://www.icevonline.com/blog/best-ways-to-avoid-teacher-burnout",
      "https://www.cdc.gov/niosh/healthcare/impactwellbeing/professional-wellbeing.html",
      "https://www.educationsupport.org.uk/resources/for-individuals/articles/teacher-burnout-and-how-to-avoid-it",
      "https://soeonline.american.edu/blog/teacher-burnout",
      "https://www.nea.org/nea-today/all-news-articles/whats-causing-teacher-burnout",
      "https://spark.bethel.edu/etd/1144",
      "https://www.congress.gov/bill/118th-congress/house-resolution/1089/text",
      "https://www.ebsco.com/research-starters/education/teacher-burnout",
      "https://www.simbo.ai/blog/exploring-the-systemic-causes-of-health-worker-burnout-and-their-impact-on-patient-care-quality-3530164",
      "https://pmc.ncbi.nlm.nih.gov/articles/PMC11781124",
      "https://www.toddleapp.com/learn/blog-post/reduce-teacher-burnout-and-improve-your-school-culture",
      "https://www.aaspa.org/news/how-to-avoid-teacher-burnout-and-increase-teacher-retention-2025",
      "https://pubmed.ncbi.nlm.nih.gov/33901940",
      "https://psnet.ahrq.gov/primer/burnout",
      "https://news.harvard.edu/gazette/story/2019/07/doctor-burnout-costs-health-care-system-4-6-billion-a-year-harvard-study-says",
      "https://www.nyssba.org/news/2025/01/10/on-board-online-january-13-2025/exploring-the-financial-impact-of-teacher-turnover",
      "https://www.acponline.org/practice-career/physician-well-being-and-professional-fulfillment/top-10-culture-change-interventions-to-reduce-burnout-and-improve-physician-well-being",
      "https://scholarworks.calstate.edu/downloads/ng451s65g"
    ],
    "observation_4": "I have now gathered a comprehensive understanding of occupational burnout syndrome, including its definition from the WHO and APA, and its measurement through the Maslach Burnout Inventory (MBI). I've identified the core dimensions as emotional exhaustion, depersonalization/cynicism, and reduced personal accomplishment/professional efficacy. My research has thoroughly explored the causes in both teaching and healthcare, highlighting commonalities such as excessive workload, administrative burdens, and lack of autonomy, alongside profession-specific stressors like student behavior issues for teachers and the emotional toll of patient care for healthcare workers.",
    "plan_5": {
      "title": "Information Saturation Achieved\nTransition to Synthesis",
      "description": "I've successfully addressed the initial information gaps, particularly by finding alternative sources for previously inaccessible articles, ensuring a robust collection of data on systemic and organizational factors, economic and societal impacts, and a range of intervention strategies. I believe I have reached a point of information saturation, meaning further searches are unlikely to yield significantly new overarching themes or insights beyond what has already been covered.\nWith a solid foundation of information on the causes, consequences, and interventions for burnout in both teachers and healthcare workers, I am now ready to conclude the research phase. My next step will be to synthesize all the gathered information into a detailed and comprehensive report, addressing all aspects of the initial query."
    }
  },
  "final_report": "# **A Systemic Analysis of Occupational Burnout in Education and Healthcare: Causes, Consequences, and Pathways to Well-being**\n\n### **Executive Summary**\n\nOccupational burnout has escalated from a personal affliction to a systemic crisis, posing a direct threat to the integrity and sustainability of two of society's most vital sectors: education and healthcare. This report provides an exhaustive analysis of the causes, consequences, and potential remedies for burnout syndrome among teachers and healthcare workers. Drawing upon an extensive body of research, it argues that burnout is not an issue of individual weakness but an occupational phenomenon rooted in dysfunctional organizational systems and policies.\n\nThe World Health Organization (WHO) defines burnout as a syndrome resulting from chronic, unmanaged workplace stress, characterized by three core dimensions: overwhelming emotional exhaustion, increased mental distance or cynicism toward one's job, and a diminished sense of professional efficacy. This definition critically shifts the focus from individual resilience to organizational responsibility.\n\nFor teachers, who represent the single most burned-out profession in the United States, the crisis is driven by a convergence of factors that constitute a systemic \"de-professionalization\" of their field. Excessive workloads, averaging 54 hours per week, are compounded by a heavy administrative burden that diverts time from teaching. This is exacerbated by a profound lack of professional autonomy, where educators are constrained by rigid curricula and high-stakes testing mandates. Large class sizes, challenging student behaviors, and inadequate resources due to poor funding further intensify stress. These factors are situated within school cultures that often lack administrative support and fail to provide adequate compensation, creating a professional incongruence where teachers are held accountable for outcomes they lack the agency and resources to achieve.\n\nHealthcare workers face a parallel crisis, driven by unrelenting workloads, chronic staffing shortages, and long, disruptive hours. Their \"hidden workload\" includes burdensome electronic health record (EHR) documentation and administrative tasks that consume as much time as patient care. The emotional toll is immense, manifesting as compassion fatigue and, more precisely, moral injury—a profound psychological distress that occurs when systemic barriers prevent clinicians from providing the care they know is ethically right. This is compounded by a loss of clinical autonomy, interdepartmental conflicts, and a healthcare ecosystem that often prioritizes productivity metrics over patient well-being.\n\nWhile the specific pressures differ—the chronic, developmental stress of teaching versus the acute, traumatic stress of healthcare—the underlying drivers are remarkably convergent. Both professions suffer from a \"crisis of purpose,\" where organizational priorities of efficiency, standardization, and cost-control clash with the core professional values of teaching and healing.\n\nThe consequences of this crisis are severe and far-reaching. For the workforce, it means high rates of attrition, absenteeism, and a decline in physical and mental health. For society, it translates directly into diminished quality of services. In education, teacher burnout is linked to lower student academic achievement and motivation. In healthcare, clinician burnout is associated with increased medical errors, reduced patient safety, and lower patient satisfaction. The economic costs are staggering: teacher turnover costs the U.S. over $7 @https://cpa.ca/psychology-works-fact-sheet-workplace-burnout/>  billion annually, while physician burnout costs the healthcare system an estimated $4 @https://academic.oup.com/occmed/article/74/9/630/7958938?rss=1>  billion per year, figures that do not capture the full downstream costs of degraded care and learning.\n\nAddressing this crisis requires a fundamental shift from blaming individuals to fixing systems. This report outlines a blueprint for intervention centered on systemic responsibility. For both sectors, this involves organizational-level strategies focused on reducing workloads, streamlining administrative tasks, restoring professional autonomy, and fostering supportive, collaborative cultures led by committed leadership. It also requires policy-level changes, including increased and equitable funding for schools, reform of high-stakes testing policies, simplification of healthcare regulations, and legislation that protects and promotes workforce well-being. Investing in the well-being of teachers and healthcare workers is not an optional expense; it is a direct and necessary investment in the quality, safety, and future of education and healthcare.\n\n## **Section 1: Understanding Occupational Burnout Syndrome**\n\nTo analyze the causes of burnout in high-stress professions, it is first essential to establish a precise and universally accepted conceptual framework. The term \"burnout\" has often been used colloquially to describe general fatigue or stress. However, decades of psychological research and recent classifications by global health bodies have refined it into a specific, measurable occupational phenomenon with distinct characteristics and dimensions. This section synthesizes the authoritative definitions from the World Health Organization (WHO) and the American Psychological Association (APA), details the three core dimensions that constitute the syndrome, and introduces the primary instrument used for its assessment, the Maslach Burnout Inventory (MBI).\n\n### **1 @https://en.wikipedia.org/wiki/Occupational_burnout#:~:text=The%20ICD%2D11%20of%20the,has%20not%20been%20successfully%20managed.>  Defining the Phenomenon: A Synthesis of WHO and APA Frameworks**\n\nThe World Health Organization's 11th Revision of the International Classification of Diseases (ICD-11) provides the most authoritative and impactful definition of occupational burnout. Critically, the WHO classifies burnout not as a medical condition or mental disorder, but as an \"occupational phenomenon\" @https://en.wikipedia.org/wiki/Occupational_burnout#:~:text=The%20ICD%2D11%20of%20the,has%20not%20been%20successfully%20managed.>  It is located in the chapter on 'Factors influencing health status or contact with health services,' signifying that it is a reason people may seek care but is not an illness itself @https://www.who.int/standards/classifications/frequently-asked-questions/burn-out-an-occupational-phenomenon>  The official definition is: “Burn-out is a syndrome conceptualized as resulting from chronic workplace stress that has not been successfully managed” @https://en.wikipedia.org/wiki/Occupational_burnout#:~:text=The%20ICD%2D11%20of%20the,has%20not%20been%20successfully%20managed.> \n\nThis definition represents a critical paradigm shift in understanding the issue. By explicitly stating that burnout results from stress \"that has not been successfully managed,\" the WHO moves the locus of the problem from the individual's perceived lack of resilience to the organization's failure to create a sustainable work environment. This framing firmly establishes burnout as a systemic issue of organizational health and a failure of workplace management, rather than an individual pathology @https://en.wikipedia.org/wiki/Occupational_burnout#:~:text=The%20ICD%2D11%20of%20the,has%20not%20been%20successfully%20managed.>  The WHO further clarifies that the term \"burn-out refers specifically to phenomena in the occupational context and should not be applied to describe experiences in other areas of life,” reinforcing its direct link to the workplace @https://www.who.int/standards/classifications/frequently-asked-questions/burn-out-an-occupational-phenomenon> \n\nComplementing the WHO's classification, the American Psychological Association (APA) offers a rich description of the experience of burnout. The APA dictionary defines it as \"physical, emotional, or mental exhaustion accompanied by decreased motivation, lowered performance, and negative attitudes toward oneself and others\" @https://dictionary.apa.org/burnout>  This definition highlights the multifaceted nature of the exhaustion and its corrosive effect on motivation and attitude. The term was first coined in this context in 1975 by psychologist Herbert J. Freudenberger, who observed it in workers at clinics with heavy caseloads, presciently identifying its prevalence in service-oriented vocations like social work and teaching @https://dictionary.apa.org/burnout> \n\nFurthermore, the APA connects the occupational phenomenon to tangible health consequences, noting its association with job dissatisfaction, low commitment, absenteeism, and a range of physical ailments, including headaches, gastrointestinal disorders, muscle tension, hypertension, increased susceptibility to illness, and sleep disturbances @https://www.apa.org/gradpsych/2011/03/corner>  This bridges the gap between the work-related syndrome and its severe impact on an individual's overall health and well-being.\n\n### **1 @https://www.who.int/standards/classifications/frequently-asked-questions/burn-out-an-occupational-phenomenon>  The Three Core Dimensions: Emotional Exhaustion, Depersonalization/Cynicism, and Reduced Efficacy**\n\nThe consensus definition of burnout, adopted by the WHO and rooted in the foundational research of Christina Maslach and her colleagues, is characterized by three distinct yet interrelated dimensions @https://www.who.int/standards/classifications/frequently-asked-questions/burn-out-an-occupational-phenomenon>  Understanding these components is crucial for diagnosing the syndrome and targeting interventions.\n\n**1. Emotional Exhaustion:** This is universally considered the core component of burnout @https://academic.oup.com/occmed/article/74/9/630/7958938?rss=1>  It is defined as feelings of being emotionally overextended, depleted, drained, and exhausted by one's work @https://www.who.int/standards/classifications/frequently-asked-questions/burn-out-an-occupational-phenomenon>  Individuals experiencing this dimension report persistent fatigue, feeling tired almost all the time, and a sense that their emotional resources are completely spent @https://cpa.ca/psychology-works-fact-sheet-workplace-burnout/>  It is the feeling of having nothing left to give on a psychological level. Research shows that this dimension is the most reliable component of burnout measurement and the strongest predictor of stress-related health outcomes @https://academic.oup.com/occmed/article/74/9/630/7958938?rss=1> \n\n**2. Depersonalization/Cynicism:** The second dimension is characterized by an \"increased mental distance from one's job, or feelings of negativism or cynicism related to one's job\" @https://www.who.int/standards/classifications/frequently-asked-questions/burn-out-an-occupational-phenomenon>  This manifests as an unfeeling, impersonal, and detached response toward the recipients of one's services, such as students or patients @https://en.wikipedia.org/wiki/Maslach_Burnout_Inventory>  It can involve developing negative or inappropriate attitudes towards clients and colleagues @https://cpa.ca/psychology-works-fact-sheet-workplace-burnout/>  This psychological distancing is often an unconscious coping mechanism to protect oneself from the overwhelming demands of emotional exhaustion @https://en.wikipedia.org/wiki/Maslach_Burnout_Inventory>  In some contexts, particularly outside of human services, this dimension is referred to as \"cynicism,\" measuring an attitude of indifference or distance towards one's work in general @https://en.wikipedia.org/wiki/Maslach_Burnout_Inventory> \n\n**3. Reduced Professional Efficacy/Personal Accomplishment:** The third dimension involves a decline in feelings of competence and successful achievement in one's work @https://www.who.int/standards/classifications/frequently-asked-questions/burn-out-an-occupational-phenomenon>  Individuals experience a growing sense of inefficacy, inadequacy, and reduced productivity @https://cpa.ca/psychology-works-fact-sheet-workplace-burnout/>  They begin to feel they are no longer effective in their role, are not making a meaningful impact, and struggle to cope with the demands of the job @https://cpa.ca/psychology-works-fact-sheet-workplace-burnout/>  This is distinct from actual incompetence; it is a subjective feeling of failed accomplishment and a loss of purpose in one's professional life.\n\n### **1 @https://cpa.ca/psychology-works-fact-sheet-workplace-burnout/>  Measurement and Assessment: The Maslach Burnout Inventory (MBI) as the Gold Standard**\n\nThe scientific study and organizational assessment of burnout have been made possible largely through the development of the Maslach Burnout Inventory (MBI) @https://academic.oup.com/occmed/article/74/9/630/7958938?rss=1>  Created by Christina Maslach and Susan E. Jackson, the MBI is the most widely recognized, validated, and standardized psychological instrument for measuring the syndrome @https://academic.oup.com/occmed/article/74/9/630/7958938?rss=1>  It is a self-administered questionnaire, typically comprising 16 to 22 items, that assesses an individual's experience of burnout symptoms @https://en.wikipedia.org/wiki/Maslach_Burnout_Inventory> \n\nA key feature of the MBI is its recognition of the diverse contexts of work. Several versions of the inventory have been developed for specific occupational groups, ensuring the language and scenarios are relevant to the respondent's experience @https://academic.oup.com/occmed/article/74/9/630/7958938?rss=1>  These include:\n\n* **MBI-Human Services Survey (MBI-HSS):** The original version, designed for professionals in helping roles like social workers and police officers @https://academic.oup.com/occmed/article/74/9/630/7958938?rss=1> \n* **MBI-Human Services Survey for Medical Personnel (MBI-HSS: MP):** A specialized version for physicians, nurses, and other medical staff @https://academic.oup.com/occmed/article/74/9/630/7958938?rss=1> \n* **MBI-Educators Survey (MBI-ES):** A version tailored specifically for teachers and other educators @https://academic.oup.com/occmed/article/74/9/630/7958938?rss=1> \n* **MBI-General Survey (MBI-GS):** A version for use in a broader range of occupations not primarily focused on human services @https://academic.oup.com/occmed/article/74/9/630/7958938?rss=1> \n\nThe MBI assesses the three core dimensions of burnout—Emotional Exhaustion (EE), Depersonalization (DP), and Personal Accomplishment (PA)—using separate subscales @https://en.wikipedia.org/wiki/Maslach_Burnout_Inventory>  For example, the MBI-ES includes nine items for EE, five for DP, and eight for PA @https://academic.oup.com/occmed/article/74/9/630/7958938?rss=1>  Respondents rate the frequency of their feelings on a 7-point Likert scale, from \"never\" to \"daily\" @https://academic.oup.com/occmed/article/74/9/630/7958938?rss=1> \n\nCritically, the MBI's scoring protocol reflects the multidimensional nature of the syndrome. The three subscales are scored independently and are not meant to be combined into a single, overarching \"burnout score\" @https://academic.oup.com/occmed/article/74/9/630/7958938?rss=1>  This is because an individual can experience high levels of one dimension without necessarily experiencing another. The MBI treats burnout as a continuous experience rather than a binary, present-or-absent condition. A higher degree of burnout is indicated by high scores on the Emotional Exhaustion and Depersonalization subscales and low scores on the Personal Accomplishment subscale @https://academic.oup.com/occmed/article/74/9/630/7958938?rss=1>  This nuanced approach allows organizations and researchers to identify specific profiles of burnout and target interventions more effectively.\n\n## **Section 2: The Burnout Crisis in the Teaching Profession**\n\nThe teaching profession is at the epicenter of the burnout crisis. Data consistently shows that K-12 teachers are the most burned-out professional group in the United States, experiencing symptoms of stress, anxiety, and depression at rates significantly higher than workers in other industries @https://www.devlinpeck.com/content/teacher-burnout-statistics>  A 2022 Gallup poll found that 44% of K-12 teachers reported feeling burned out \"often\" or \"always,\" a rate 14 percentage points higher than other professions @https://www.devlinpeck.com/content/teacher-burnout-statistics>  This is not simply the result of a \"hard job\"; rather, it is the outcome of a confluence of systemic, organizational, and classroom-level factors that create an unsustainable work environment. These factors effectively de-professionalize teaching by stripping educators of their core professional assets: time, autonomy, and resources, leading to a profound sense of exhaustion, cynicism, and inefficacy.\n\n### **2 @https://en.wikipedia.org/wiki/Occupational_burnout#:~:text=The%20ICD%2D11%20of%20the,has%20not%20been%20successfully%20managed.>  The Epicenter of Stress: Workload, Administrative Burdens, and Time Poverty**\n\nThe most frequently cited driver of teacher burnout is an overwhelming and multifaceted workload @https://everfi.com/blog/k-12/teacher-burnout/>  This workload extends far beyond the hours spent in front of students and is characterized by an ever-expanding list of responsibilities that create a state of chronic time poverty.\n\n**Excessive Workload:** Research indicates that teachers work, on average, 54 hours per week @https://www.nea.org/nea-today/all-news-articles/class-sizes-growing-issue-among-educators>  A study cited by Talkspace reveals a startling allocation of this time: only 46% is spent on the core task of teaching @https://business.talkspace.com/articles/how-to-prevent-teacher-burnout>  The majority of their time is consumed by a host of other duties, including lesson planning, grading assignments, communicating with parents, attending meetings, and fulfilling administrative requirements @https://business.talkspace.com/articles/how-to-prevent-teacher-burnout>  This relentless demand leaves insufficient time to complete tasks integral to successful teaching, leading directly to exhaustion @https://soeonline.american.edu/blog/teacher-burnout/>  Over 78% of teachers identify excessive workload as a primary reason for leaving the profession @https://crowncounseling.com/statistics/teacher-burnout/> \n\n**Administrative Overload:** A significant and particularly frustrating component of this workload is administrative burden. Teachers are often inundated with non-instructional tasks such as data entry, compliance paperwork, and navigating proprietary software mandated by their districts @https://soeonline.american.edu/blog/teacher-burnout/>  These tasks are frequently perceived as bureaucratic and disconnected from the meaningful work of educating students, creating a sense of defeat and frustration @https://soeonline.american.edu/blog/teacher-burnout/>  Schoolwide systems that fail to minimize administrative paperwork place immense pressure on teachers and are a key contributor to burnout @https://www.aaspa.org/news/how-to-avoid-teacher-burnout-and-increase-teacher-retention-2025> \n\n**Time Poverty and Lack of Planning Time:** The combination of excessive instructional and administrative demands results in severe \"time poverty.\" A critical manifestation of this is the lack of protected, uninterrupted planning time during the school day @https://business.talkspace.com/articles/how-to-prevent-teacher-burnout>  This forces educators to sacrifice their personal time—evenings, weekends, and holidays—simply to keep up with basic job requirements, blurring the lines between work and life and preventing necessary rest and recovery @https://soeonline.american.edu/blog/teacher-burnout/>  The problem is dramatically exacerbated by chronic staff shortages. With a predicted teacher shortage looming and thousands of positions unfilled, remaining teachers are forced to take on extra duties @https://crowncounseling.com/statistics/teacher-burnout/>  Surveys show that 74% of teachers have had to assume additional responsibilities, and 80% report doing more work than their expected roles due to these vacancies @https://www.devlinpeck.com/content/teacher-burnout-statistics>  This often involves giving up what little planning time they have to cover other classes, creating a vicious cycle of overwork and exhaustion @https://everfi.com/blog/k-12/teacher-burnout/> \n\n### **2 @https://www.who.int/standards/classifications/frequently-asked-questions/burn-out-an-occupational-phenomenon>  The Erosion of Professionalism: Lack of Autonomy and Administrative Control**\n\nBeyond the sheer volume of work, a core driver of teacher burnout is the systemic erosion of their professional standing, characterized by a profound lack of autonomy and oppressive administrative control. This transforms the role of an educator from a skilled professional into a technician expected to execute top-down mandates, fueling cynicism and a sense of powerlessness.\n\n**Lack of Autonomy:** The ability to exercise professional judgment is a cornerstone of job satisfaction and well-being. However, teachers consistently report having very little control over their work @https://www.apa.org/gradpsych/2011/03/corner>  A Pew Research survey found that teachers feel they have the least control over their schedules, school policies, the resources they need, and, most critically, the curriculum they teach @https://moreland.edu/resources/blog-insights/empowering-educators-why-teachers-need-autonomy-in-2025>  When teachers are micromanaged, given rigid instructional scripts, or denied the freedom to innovate and tailor their teaching to their students' needs, their creativity is stifled and stress levels soar @https://business.talkspace.com/articles/how-to-prevent-teacher-burnout>  This lack of autonomy is a significant predictor of burnout, with 52% of teachers citing it as a reason for leaving @https://crowncounseling.com/statistics/teacher-burnout/>  Conversely, research demonstrates a powerful positive link between teacher autonomy and improved outcomes. When teachers are empowered to make instructional decisions, they experience higher job satisfaction, increased productivity, greater teaching efficacy, and better mental health @https://pmc.ncbi.nlm.nih.gov/articles/PMC9689976/> \n\n**Administrative Pressure and Unrealistic Expectations:** Many teachers operate within rigid, hierarchical school environments where they feel their professional expertise is devalued and disregarded @https://www.ebsco.com/research-starters/education/teacher-burnout>  Unrealistic expectations from administration contribute to a culture where teachers feel perpetually overworked and underappreciated @https://everfi.com/blog/k-12/teacher-burnout/>  A major source of this pressure is the emphasis on high-stakes standardized testing @https://soeonline.american.edu/blog/teacher-burnout/>  This creates a culture of accountability where teachers are pressured to produce high test scores, often without the necessary resources or the autonomy to use teaching methods they believe are most effective @https://www.ebsco.com/research-starters/education/teacher-burnout>  This creates a fundamental professional incongruence: teachers are held responsible for outcomes but are denied the professional agency to achieve them. This conflict between accountability and autonomy is a potent recipe for burnout.\n\n### **2 @https://cpa.ca/psychology-works-fact-sheet-workplace-burnout/>  The Classroom Environment: Student Behavior, Class Size, and Emotional Demands**\n\nThe daily reality of the classroom presents its own unique and intense set of stressors. The interplay between challenging student behavior, unmanageable class sizes, and the high emotional demands of the job creates a volatile environment that can quickly deplete a teacher's psychological resources.\n\n**Challenging Student Behavior:** Managing student behavior consistently ranks as one of the top sources of job-related stress for teachers @https://everfi.com/blog/k-12/teacher-burnout/>  A 2022 study found that 80% of schools reported a post-pandemic increase in negative student behaviors, including classroom disruptions and disrespect towards staff @https://www.devlinpeck.com/content/teacher-burnout-statistics>  This issue is particularly acute in high-poverty schools, where students may be dealing with significant trauma and socio-economic challenges outside of school @https://digitalcommons.csumb.edu/cgi/viewcontent.cgi?article=2905&context=caps_thes_all>  The connection between student behavior and teacher burnout is bidirectional. Challenging behaviors increase teacher stress, and an emotionally exhausted teacher has fewer resources to manage the classroom effectively @https://files.eric.ed.gov/fulltext/ED612141.pdf>  This can lead to a negative cycle, or \"burnout cascade,\" where teacher emotional exhaustion is associated with an increased use of punitive and exclusionary discipline practices, which in turn can worsen the classroom climate and student behavior @https://files.eric.ed.gov/fulltext/ED612141.pdf> \n\n**Large Class Sizes:** Overcrowded classrooms are a direct and powerful contributor to teacher burnout @https://everfi.com/blog/k-12/teacher-burnout/>  When a teacher is responsible for 30, 35, or even 40 students, it becomes physically and logistically impossible to provide the individualized attention necessary for effective learning @https://www.nea.org/nea-today/all-news-articles/class-sizes-growing-issue-among-educators>  Large classes amplify classroom management challenges, increase the grading workload, and heighten overall teacher stress @https://everfi.com/blog/k-12/teacher-burnout/>  The national teacher shortage directly fuels this problem, as schools are forced to combine classes or increase enrollment caps to compensate for unfilled positions, placing an even greater burden on the remaining educators @https://www.nea.org/nea-today/all-news-articles/class-sizes-growing-issue-among-educators> \n\n**High Emotional Demands:** The role of a teacher extends far beyond academic instruction. Educators are on the front lines of addressing students' complex social and emotional needs @https://soeonline.american.edu/blog/teacher-burnout/>  They often act as de facto counselors, social workers, and mentors, supporting students who have experienced trauma, poverty, and abuse @https://soeonline.american.edu/blog/teacher-burnout/>  This constant emotional labor is incredibly taxing, and teachers often lack the formal training or institutional support to manage these demands effectively @https://soeonline.american.edu/blog/teacher-burnout/>  The experience of caring for traumatized children without being able to control the tragic events in their home lives can lead to secondary traumatic stress, a significant contributor to emotional exhaustion @https://soeonline.american.edu/blog/teacher-burnout/> \n\n### **2 @https://dictionary.apa.org/burnout>  The Organizational and Systemic Context: Culture, Support, and Compensation**\n\nThe stressors of workload and classroom environment are embedded within a larger organizational and systemic context that can either buffer against burnout or accelerate it. The school's culture, the level of administrative and collegial support, and the fundamental issues of compensation and resources are critical determinants of a teacher's well-being and longevity in the profession.\n\n**School Culture and Community:** A toxic, unsupportive, or isolating school culture is a major catalyst for burnout @https://www.apa.org/gradpsych/2011/03/corner>  When teachers feel isolated from their peers, lack a sense of community, or work in an environment of distrust, the risk of depersonalization and cynicism increases significantly @https://www.ebsco.com/research-starters/education/teacher-burnout>  Conversely, a positive and supportive working environment, characterized by strong social support from supervisors, collaborative relationships with colleagues, and a shared sense of purpose, is one of the most powerful protective factors against burnout @https://cpa.ca/psychology-works-fact-sheet-workplace-burnout/> \n\n**Lack of Support and Recognition:** Insufficient support from school administration is one of the most frequently cited causes of burnout and attrition @https://crowncounseling.com/statistics/teacher-burnout/>  This includes a lack of backing when dealing with difficult student discipline issues or demanding parents, as well as a general feeling of being undervalued, unappreciated, and unfairly criticized @https://everfi.com/blog/k-12/teacher-burnout/>  A lack of meaningful recognition and reward for hard work erodes motivation and contributes to feelings of inefficacy @https://cpa.ca/psychology-works-fact-sheet-workplace-burnout/> \n\n**Inadequate Compensation and Resources:** Financial stress is a major component of teacher burnout. Teachers consistently cite poor compensation as the top reason they feel burned out and plan to leave the profession @https://everfi.com/blog/k-12/teacher-burnout/>  In 2022, the average teacher earned 26 @https://dictionary.apa.org/burnout> % less than other professionals with the same level of education @https://scholarworks.calstate.edu/downloads/ng451s65g>  This financial strain is compounded by systemic underfunding of public schools. Many districts lack sufficient funds for updated textbooks, technology, and basic classroom supplies @https://soeonline.american.edu/blog/teacher-burnout/>  This places a huge burden on teachers, who often spend hundreds of dollars of their own money to equip their classrooms and feel perpetually ill-equipped to meet their students' needs, fostering a sense of hopelessness and defeat @https://soeonline.american.edu/blog/teacher-burnout/> \n\n## **Section 3: The Burnout Crisis in the Healthcare Profession**\n\nThe healthcare sector is facing a burnout crisis of staggering proportions, a long-simmering issue that was dangerously exacerbated by the COVID-19 pandemic @https://pmc.ncbi.nlm.nih.gov/articles/PMC11281910/>  Healthcare workers, from physicians and nurses to support staff, are exposed to a unique and intense combination of extreme workloads, profound emotional trauma, and systemic inefficiencies. These pressures converge to create an environment ripe for burnout, threatening not only the well-being of the workforce but the very safety and quality of patient care. The core of this crisis can be understood through the lens of moral injury—a state of psychological distress that arises when professionals are repeatedly forced by systemic constraints to act in ways that violate their deeply held ethical commitments to their patients.\n\n### **3 @https://en.wikipedia.org/wiki/Occupational_burnout#:~:text=The%20ICD%2D11%20of%20the,has%20not%20been%20successfully%20managed.>  The Weight of the Work: Unrelenting Workloads, Long Hours, and Staffing Deficits**\n\nAt the heart of healthcare burnout lies a fundamental mismatch between the demands of the job and the resources available to meet them. This is most evident in the crushing workloads, extended hours, and chronic understaffing that define the modern healthcare landscape.\n\n**Excessive Workloads and Long Hours:** An overwhelming workload is a primary and pervasive driver of burnout across all healthcare roles @https://www.hhs.gov/surgeongeneral/reports-and-publications/health-worker-burnout/index.html>  Research establishes a direct, positive correlation between long working hours and the prevalence of burnout and depressive symptoms @https://www.frontiersin.org/journals/psychology/articles/10.3389/fpsyg.2023.1084329/full>  One study found that 57% of frontline medical staff worked more than 8 hours per day, a practice linked to increased mental health problems @https://www.frontiersin.org/journals/psychology/articles/10.3389/fpsyg.2023.1084329/full>  These long and often irregular shifts disrupt circadian rhythms, leading to chronic sleep deprivation @https://www.adonis.io/news/causes-of-burnout-in-the-healthcare-industry>  A lack of adequate sleep not only causes physical and mental fatigue but also impairs cognitive function and has been shown to increase the risk of medical errors to a level comparable to alcohol intoxication @https://www.usa.edu/blog/nurse-burnout/> \n\n**Staffing Shortages:** The pressure of long hours is magnified by persistent staffing shortages @https://www.simbo.ai/blog/exploring-the-systemic-causes-of-health-worker-burnout-and-their-impact-on-patient-care-quality-3530164/>  High patient-to-provider ratios force clinicians to care for more patients than they can handle safely or effectively, a problem that existed long before the pandemic but has since become critical @https://pmc.ncbi.nlm.nih.gov/articles/PMC11281910/>  In nursing, unmanageable nurse-to-patient ratios are directly correlated with higher rates of burnout @https://www.usa.edu/blog/nurse-burnout/>  This environment of being constantly overwhelmed not only accelerates exhaustion but also diminishes the quality of patient interaction, forcing rushed and often impersonal encounters that are unsatisfying for both the provider and the patient @https://www.adonis.io/news/causes-of-burnout-in-the-healthcare-industry> \n\n### **3 @https://www.who.int/standards/classifications/frequently-asked-questions/burn-out-an-occupational-phenomenon>  The \"Hidden Workload\": Administrative Burdens and Technological Friction**\n\nBeyond the visible work of direct patient care, healthcare professionals are encumbered by a massive \"hidden workload\" of administrative tasks and technological friction. This bureaucratic burden is a major source of frustration and a key contributor to burnout because it diverts time and energy away from the core mission of healing.\n\n**Administrative Pressures:** The modern healthcare system imposes an immense administrative load on clinicians. This includes extensive medical record documentation, complex coding for billing purposes, navigating insurance claims, and, most notoriously, the process of obtaining prior authorization for tests and treatments @https://www.adonis.io/news/causes-of-burnout-in-the-healthcare-industry>  Physicians report that this paperwork can consume as much, if not more, of their time as direct patient care @https://www.adonis.io/news/causes-of-burnout-in-the-healthcare-industry>  This administrative sludge drains morale, interferes with patient care, and fosters a sense of being a clerk rather than a clinician @https://www.ama-assn.org/practice-management/physician-health/12-factors-drive-physician-burnout>  In a 2024 survey, 62% of physicians cited administrative burdens as the primary cause of their burnout @https://www.sermo.com/resources/physician-burnout-solutions/> \n\n**Technological Challenges:** Electronic health records (EHRs) and other health information technologies, while intended to improve efficiency, have often become a significant source of stress @https://pmc.ncbi.nlm.nih.gov/articles/PMC11281910/>  Many EHR systems are clunky, are not user-friendly, and lack interoperability, forcing clinicians to navigate multiple, poorly integrated platforms @https://www.hhs.gov/surgeongeneral/reports-and-publications/health-worker-burnout/index.html>  These systems are frequently implemented without adequate clinician input or training, leading to inefficient workflows and increased clerical burden @https://www.ama-assn.org/practice-management/physician-health/physician-burnout-4-types-interventions-and-how-they-can-help>  Instead of serving as a tool to support care, technology often becomes another barrier, adding to the frustration and cognitive load experienced by providers @https://www.adonis.io/news/causes-of-burnout-in-the-healthcare-industry> \n\n### **3 @https://cpa.ca/psychology-works-fact-sheet-workplace-burnout/>  The Emotional Crucible: Compassion Fatigue, Moral Injury, and High-Stakes Decisions**\n\nHealthcare is an inherently emotionally demanding profession. Clinicians are routinely confronted with human suffering in its most acute forms, a reality that exacts a profound psychological toll. This emotional strain manifests in specific forms of distress that go beyond simple exhaustion.\n\n**Emotional and Psychological Stress:** The daily work of healthcare involves making high-stakes, life-or-death decisions under immense time pressure @https://www.adonis.io/news/causes-of-burnout-in-the-healthcare-industry>  Clinicians in critical care, emergency departments, and oncology are constantly exposed to trauma, pain, and death @https://www.adonis.io/news/causes-of-burnout-in-the-healthcare-industry>  This regular exposure to the suffering of others can erode emotional resilience over time, leading to a state of emotional burnout @https://www.adonis.io/news/causes-of-burnout-in-the-healthcare-industry> \n\n**Compassion Fatigue:** This condition, also known as \"secondary traumatic stress,\" is a specific form of burnout directly tied to the emotional strain of caregiving @https://minoritynurse.com/navigating-the-emotional-struggles-of-compassion-fatigue-in-nursing/>  It is a cumulative process where the provider's capacity for empathy becomes overwhelming, leading to emotional and physical exhaustion @https://minoritynurse.com/navigating-the-emotional-struggles-of-compassion-fatigue-in-nursing/>  Symptoms include emotional numbness, decreased empathy, detachment from patients, and a feeling of having nothing left to give @https://minoritynurse.com/navigating-the-emotional-struggles-of-compassion-fatigue-in-nursing/>  It is a protective but ultimately maladaptive response to the constant emotional investment required in caring for the sick and dying.\n\n**Moral Injury:** Perhaps the most precise and powerful concept for understanding the distress of modern healthcare workers is moral injury. This is the psychological harm that occurs when systemic constraints force a professional to act in a way that violates their core moral and ethical commitments @https://www.simbo.ai/blog/exploring-the-systemic-causes-of-health-worker-burnout-and-their-impact-on-patient-care-quality-3530164/>  For a clinician, this happens when an insurance company denies a necessary procedure, when staffing shortages prevent them from providing safe care, or when administrative policies force them to prioritize billing metrics over patient needs. They know the right thing to do for their patient, but the system prevents them from doing it. This is not simply stress from overwork; it is a profound sense of helplessness, guilt, and betrayal by the very system they are meant to serve. This repeated violation of their professional identity is a devastating driver of cynicism and burnout.\n\n### **3 @https://dictionary.apa.org/burnout>  The Systemic Environment: Organizational Culture, Interdepartmental Conflict, and Regulatory Pressures**\n\nThe individual experiences of workload and emotional strain are shaped by the larger systemic environment. The culture of the organization, the efficiency of its processes, and the external pressures from regulatory bodies all play a crucial role in either mitigating or exacerbating burnout.\n\n**Organizational Culture:** A toxic workplace culture is a significant catalyst for burnout @https://www.simbo.ai/blog/exploring-the-systemic-causes-of-health-worker-burnout-and-their-impact-on-patient-care-quality-3530164/>  Environments that are highly competitive, that assign blame for errors rather than treating them as learning opportunities, and that lack psychological safety create intense and chronic stress @https://www.simbo.ai/blog/exploring-the-systemic-causes-of-health-worker-burnout-and-their-impact-on-patient-care-quality-3530164/>  A lack of support from leadership, poor communication, and a sense that clinicians' well-being is not a priority are consistently identified as key problems @https://pmc.ncbi.nlm.nih.gov/articles/PMC11781124/>  Feeling undervalued by the organization is a major contributing factor to burnout @https://pmc.ncbi.nlm.nih.gov/articles/PMC11781124/> \n\n**Loss of Autonomy and Control:** Like teachers, healthcare professionals are experiencing a significant erosion of their clinical autonomy @https://www.adonis.io/news/causes-of-burnout-in-the-healthcare-industry>  Their decisions are increasingly constrained by bureaucratic rules, complex government and insurance regulations, and administrative oversight @https://ccphp.net/blog/whats-causing-physician-burnout-how-to-address-it>  This loss of control over their practice environment and clinical decision-making leads to deep frustration and a sense of powerlessness, which are strong predictors of burnout @https://ccphp.net/blog/whats-causing-physician-burnout-how-to-address-it> \n\n**Interdepartmental Conflict and System Inefficiencies:** Burnout is also fueled by the chaotic nature of many healthcare settings. Frequent interruptions from calls and pages, disruptive ambient noise, and inefficient workflows all add to the cognitive burden on clinicians @https://pmc.ncbi.nlm.nih.gov/articles/PMC11781124/>  Furthermore, conflicts between different hospital departments—for example, disputes over which service should admit a patient—waste valuable time and energy and add unnecessary stress and pressure to an already demanding job @https://pmc.ncbi.nlm.nih.gov/articles/PMC11781124/>  These systemic inefficiencies are a constant source of frustration and a clear sign of an organization that is not functioning optimally.\n\n## **Section 4: A Comparative Analysis: Convergent and Divergent Drivers of Burnout**\n\nWhile the daily work of a teacher in a classroom and a nurse in an intensive care unit may seem worlds apart, a comparative analysis of burnout drivers reveals a striking convergence of systemic failures. Both professions, essential to the functioning of a healthy society, are being crushed by similar forces of bureaucratic overreach, resource scarcity, and a fundamental disconnect between their professional values and organizational priorities. This shared experience points to a deep, structural crisis in how society manages its \"caring\" professions. At the same time, the unique nature of their work—interacting with developing students versus acutely ill patients—creates distinct emotional pressures that require tailored understanding and intervention.\n\n### **4 @https://en.wikipedia.org/wiki/Occupational_burnout#:~:text=The%20ICD%2D11%20of%20the,has%20not%20been%20successfully%20managed.>  Common Ground: The Universal Stressors of Workload, Bureaucracy, and Lack of Control**\n\nThe foundational causes of burnout are remarkably similar across education and healthcare, pointing to common flaws in the management and structure of large, complex public-service organizations.\n\n* **Overwhelming Workload:** The most evident parallel is the crushing workload. Both teachers and healthcare workers report excessive hours and a volume of work that is simply unsustainable @https://everfi.com/blog/k-12/teacher-burnout/>  This is not merely a perception; it is a quantifiable reality of long shifts, after-hours work, and a constant feeling of being overwhelmed.\n* **Burdensome Bureaucracy:** Both professions are plagued by a \"hidden workload\" of administrative tasks that are disconnected from their core purpose. For teachers, it is data entry, compliance paperwork, and endless meetings @https://soeonline.american.edu/blog/teacher-burnout/>  For healthcare workers, it is EHR documentation, prior authorizations, and complex billing codes @https://www.simbo.ai/blog/exploring-the-systemic-causes-of-health-worker-burnout-and-their-impact-on-patient-care-quality-3530164/>  In both cases, this bureaucratic sludge is a primary source of frustration, as it steals time and energy that should be dedicated to students and patients.\n* **Erosion of Autonomy:** A profound loss of professional autonomy is a central theme in both fields. Teachers feel constrained by standardized curricula and testing mandates, while clinicians are hamstrung by administrative protocols and insurance regulations @https://www.ebsco.com/research-starters/education/teacher-burnout>  This lack of control and the feeling of being micromanaged by non-expert administrators erodes professionalism and fuels cynicism.\n* **Resource Scarcity:** Both teachers and healthcare workers often operate in environments defined by a scarcity of essential resources. Schools suffer from inadequate funding for supplies, technology, and support staff 9, while hospitals and clinics grapple with chronic staffing shortages that compromise care @https://www.usa.edu/blog/nurse-burnout/>  This forces professionals to do more with less, a constant source of stress and a barrier to effective practice.\n* **Lack of Supportive Leadership:** In both sectors, a perceived lack of support from direct supervisors and organizational leadership is a critical factor in burnout @https://crowncounseling.com/statistics/teacher-burnout/>  Feeling undervalued, unheard, and unappreciated by management is a universal experience that corrodes morale and commitment.\n\nThis convergence of drivers suggests that the burnout crisis is rooted in a crisis of purpose, driven by a systemic misalignment between professional values and organizational priorities. Both teachers and healthcare workers are drawn to their fields by a strong service orientation and a desire to help others @https://dictionary.apa.org/burnout>  However, the systems they work within increasingly prioritize conflicting values: efficiency, standardization, cost-control, and data-driven accountability @https://www.ebsco.com/research-starters/education/teacher-burnout>  The daily work experience thus becomes a battle between these value systems. Time that should be spent building a relationship with a struggling student or comforting a frightened patient is instead spent on paperwork. Professional judgment, honed over years of training and experience, is overruled by a rigid protocol or an administrative mandate. This constant conflict erodes the very sense of purpose that motivates these professionals, leading directly to the cynicism and mental distance that define burnout. It is a psychological retreat from a system that seems to have lost its moral compass.\n\n### **4 @https://www.who.int/standards/classifications/frequently-asked-questions/burn-out-an-occupational-phenomenon>  Distinctive Pressures: The Nature of Student Interaction vs. Patient Care**\n\nDespite the common ground, the specific nature of the emotional demands in teaching and healthcare creates distinct burnout profiles.\n\n* **Teaching: The Stress of Chronic Development:** The emotional demand on teachers is typically chronic, relational, and developmental. Their stress stems from the long-term responsibility for a group of students' academic, social, and emotional growth over an entire school year or longer @https://files.eric.ed.gov/fulltext/ED612141.pdf>  The pressure is in managing complex classroom dynamics, addressing persistent behavioral challenges, and feeling accountable for the developmental trajectory of dozens of young people. The emotional investment is deep but spread over time, and the \"trauma\" is often the slow, grinding frustration of being unable to meet every child's needs.\n* **Healthcare: The Stress of Acute Trauma:** The emotional demand on healthcare workers is often acute, intense, and traumatic. Their stress stems from high-stakes, life-or-death situations, direct exposure to horrific injuries and death, and the need to make critical decisions under extreme pressure @https://www.adonis.io/news/causes-of-burnout-in-the-healthcare-industry>  The emotional investment is concentrated and can lead to profound, immediate distress, as seen in the concepts of compassion fatigue and moral injury. The \"trauma\" is often event-driven, linked to a specific adverse patient outcome or a harrowing clinical encounter.\n\n### **4 @https://cpa.ca/psychology-works-fact-sheet-workplace-burnout/>  Contrasting Organizational Structures and Cultures**\n\nThe organizational ecosystems in which these professionals work also differ, shaping the specific pathways through which systemic pressures are applied.\n\n* **Education: The Hierarchical Silo:** The typical school structure is a relatively contained, top-down hierarchy within a single building or district @https://www.ebsco.com/research-starters/education/teacher-burnout>  Pressure flows downward from federal and state mandates (e.g., standardized testing), through the district office, to the school principal, and finally to the teacher. The \"customer\" relationship with students and parents is complex, long-term, and highly personal, adding another layer of relational stress.\n* **Healthcare: The Interconnected Web:** The healthcare structure is a vast, interconnected, and often chaotic web of competing entities. A clinician's work is influenced not only by their direct employer (the hospital or clinic) but also by a multitude of external actors, including private insurance companies, government payers (Medicare/Medicaid), pharmaceutical companies, and various federal and state regulatory bodies @https://www.ama-assn.org/practice-management/physician-health/12-factors-drive-physician-burnout>  This creates a complex matrix of pressure, characterized by interdepartmental conflicts within the hospital, bureaucratic hurdles with payers, and the constant, looming threat of malpractice litigation, a stressor less prevalent in education @https://www.sermo.com/resources/physician-burnout-solutions/> \n\nThe following table provides a comparative summary of these convergent and divergent drivers.\n\n**Table 1: Comparative Analysis of Burnout Drivers in Education and Healthcare**\n\n| Causal Factor Category | Manifestation in Teaching | Manifestation in Healthcare |\n| --- | --- | --- |\n| **Workload & Time Pressure** | Excessive hours (avg. 54/week), large class sizes, insufficient planning time, unpaid after-hours work for grading and lesson prep @https://everfi.com/blog/k-12/teacher-burnout/>  | Long and irregular shifts, high patient-to-nurse ratios, chronic staffing shortages, on-call duties leading to sleep deprivation @https://www.adonis.io/news/causes-of-burnout-in-the-healthcare-industry>  |\n| **Administrative Burden** | Extensive paperwork for compliance, data entry into district-mandated software, non-instructional duties @https://soeonline.american.edu/blog/teacher-burnout/>  | Voluminous EHR documentation, complex medical coding, prior authorization battles with insurers, extensive paperwork @https://www.adonis.io/news/causes-of-burnout-in-the-healthcare-industry>  |\n| **Autonomy & Control** | Lack of control over curriculum, teaching methods, and school policies; micromanagement by administrators; pressure from high-stakes testing mandates @https://business.talkspace.com/articles/how-to-prevent-teacher-burnout>  | Loss of clinical autonomy due to administrative protocols, insurance company rules, and government regulations; limited control over scheduling and work environment @https://www.adonis.io/news/causes-of-burnout-in-the-healthcare-industry>  |\n| **Emotional Demands** | Chronic emotional labor of managing student behavior, addressing social-emotional needs, secondary trauma from students' home lives, long-term developmental responsibility @https://files.eric.ed.gov/fulltext/ED612141.pdf>  | Acute emotional trauma from witnessing death and suffering, making life-or-death decisions, compassion fatigue, and moral injury from systemic barriers to care @https://www.adonis.io/news/causes-of-burnout-in-the-healthcare-industry>  |\n| **Organizational Culture** | Unsupportive administration, lack of collegial community, feelings of isolation, lack of recognition and appreciation @https://www.apa.org/gradpsych/2011/03/corner>  | Blame-oriented culture, lack of psychological safety, interdepartmental conflict, feeling undervalued by leadership, competition over collaboration @https://www.simbo.ai/blog/exploring-the-systemic-causes-of-health-worker-burnout-and-their-impact-on-patient-care-quality-3530164/>  |\n| **Systemic & External Pressures** | Inadequate and inequitable school funding, societal pressure for test scores, declining public respect for the profession @https://soeonline.american.edu/blog/teacher-burnout/>  | Complex and changing payment policies, burdensome government regulations, threat of malpractice litigation, influence of private payers @https://www.sermo.com/resources/physician-burnout-solutions/>  |\n\n## **Section 5: The Far-Reaching Consequences of Burnout**\n\nThe burnout crisis in education and healthcare is not a contained, internal workforce problem. It is a systemic poison with devastating consequences that cascade from the individual professional to the students and patients they serve, and ultimately to the economic and social fabric of the nation. The evidence clearly demonstrates that when teachers and healthcare workers are unwell, the core missions of their respective sectors—education and healing—are directly compromised. Ignoring burnout is not just a failure of leadership; it is an implicit acceptance of lower educational standards, compromised patient safety, and staggering financial waste.\n\n### **5 @https://en.wikipedia.org/wiki/Occupational_burnout#:~:text=The%20ICD%2D11%20of%20the,has%20not%20been%20successfully%20managed.>  Impact on the Workforce: Attrition, Absenteeism, and Declining Professional Well-being**\n\nThe most immediate consequence of burnout is the toll it takes on the professionals themselves, leading to a mass exodus from their fields and a severe decline in their physical and mental health.\n\n* **Attrition and Turnover:** Burnout is a primary catalyst for the alarming rates of attrition in both professions. In education, a stunning 55% of teachers report that burnout is causing them to plan to leave the profession sooner than they had intended @https://www.devlinpeck.com/content/teacher-burnout-statistics>  This has led to a post-pandemic deficit of over 500,000 educators in public schools @https://www.devlinpeck.com/content/teacher-burnout-statistics>  Similarly, in healthcare, approximately 40% of the workforce plans to leave their current role within the next five years 47, and job quitting among healthcare workers in 2023 was over 9% higher than pre-pandemic levels @https://www.congress.gov/bill/118th-congress/house-resolution/1089/text>  This constant churn creates a vicious cycle: high turnover exacerbates the very staff shortages that cause burnout in the first place, placing even greater strain on those who remain @https://everfi.com/blog/k-12/teacher-burnout/> \n* **Absenteeism:** Burnout is directly linked to increased absenteeism @https://www.ebsco.com/research-starters/education/teacher-burnout>  Chronically exhausted and stressed employees are more likely to miss work, further disrupting the continuity of care and instruction and adding to the burden on their colleagues @https://www.hawaii.edu/news/2025/01/16/health-care-workers-mental-health/> \n* **Health Consequences:** The chronic stress of burnout has severe consequences for physical and mental health. Teachers experiencing burnout report higher rates of depression, anxiety, sleep disturbances, and physical symptoms like headaches and hypertension @https://www.apa.org/gradpsych/2011/03/corner>  The situation is equally dire in healthcare, where burnout is associated with depression, anxiety, substance use disorders, and an elevated risk of suicide, particularly among physicians @https://www.hawaii.edu/news/2025/01/16/health-care-workers-mental-health/> \n\n### **5 @https://www.who.int/standards/classifications/frequently-asked-questions/burn-out-an-occupational-phenomenon>  Impact on Service Recipients: Student Achievement and Patient Safety**\n\nThe degradation of the workforce's well-being translates directly into a degradation of the quality of services provided to the public. This is where the burnout crisis becomes a societal crisis.\n\n* **Student Achievement:** There is a robust and direct negative correlation between teacher burnout and student outcomes @https://digitalcommons.csumb.edu/cgi/viewcontent.cgi?article=2905&context=caps_thes_all>  Research systematically shows that as teacher burnout increases, student academic achievement decreases @https://digitalcommons.csumb.edu/cgi/viewcontent.cgi?article=2905&context=caps_thes_all>  Emotionally exhausted and cynical teachers are less able to create supportive, engaging, and well-managed learning environments @https://digitalcommons.csumb.edu/cgi/viewcontent.cgi?article=2905&context=caps_thes_all>  Their instruction is less effective, and their students exhibit lower motivation and more disruptive behaviors @https://digitalcommons.csumb.edu/cgi/viewcontent.cgi?article=2905&context=caps_thes_all>  In short, the quality of a student's education is inextricably linked to the well-being of their teacher.\n* **Patient Safety:** The link between healthcare worker burnout and patient safety is clear, direct, and dangerous @https://www.simbo.ai/blog/exploring-the-systemic-causes-of-health-worker-burnout-and-their-impact-on-patient-care-quality-3530164/>  Large-scale systematic reviews have confirmed a strong association between high levels of clinician burnout and an increase in medical errors @https://psnet.ahrq.gov/primer/burnout>  Emotionally exhausted, depersonalized, and cynical providers are more likely to make mistakes, practice unsafely, and provide a lower quality of care @https://psnet.ahrq.gov/primer/burnout>  Burnout leads to a deterioration of teamwork and communication, which are essential for a strong safety culture. This results in reduced patient satisfaction and, most critically, a higher risk of adverse events and patient harm @https://psnet.ahrq.gov/primer/burnout> \n\nThis evidence reframes investment in workforce well-being as a non-negotiable component of quality control and risk management. Any organization or government body that fails to address the root causes of burnout is, by extension, failing to protect the students and patients who depend on these essential services.\n\n### **5 @https://cpa.ca/psychology-works-fact-sheet-workplace-burnout/>  The Economic Toll: Quantifying the Costs of Turnover and Lost Productivity**\n\nBeyond the human cost, burnout exacts a staggering economic toll on the nation. The costs associated with recruiting, hiring, and training replacements for professionals who leave their jobs, combined with lost productivity, amount to billions of dollars annually.\n\n* **Cost of Teacher Turnover:** The National Commission on Teaching and America's Future (NCTAF) estimated the annual national cost of public school teacher turnover to be over **$7 @https://cpa.ca/psychology-works-fact-sheet-workplace-burnout/>  billion** @https://files.eric.ed.gov/fulltext/ED498001.pdf>  The per-teacher replacement cost for a school district varies by size, with estimates ranging from\n  **$11,860** for small districts to **$24,930** for large urban districts @https://www.nyssba.org/news/2025/01/10/on-board-online-january-13-2025/exploring-the-financial-impact-of-teacher-turnover/>  These figures include costs for separation, recruitment efforts (advertising, hiring committees), and training and onboarding for the new teacher @https://www.nyssba.org/news/2025/01/10/on-board-online-january-13-2025/exploring-the-financial-impact-of-teacher-turnover/>  These billions of dollars are drained from public education budgets each year, diverting resources that could be used to improve instruction, reduce class sizes, or enhance student services.\n* **Cost of Physician Burnout:** A landmark study published in the *Annals of Internal Medicine* estimated that physician burnout costs the U.S. healthcare system **$4 @https://academic.oup.com/occmed/article/74/9/630/7958938?rss=1>  billion annually** @https://news.harvard.edu/gazette/story/2019/07/doctor-burnout-costs-health-care-system-4-6-billion-a-year-harvard-study-says/>  This figure, which researchers consider a conservative estimate, is based on costs from physician turnover and reduced clinical hours. At the organizational level, the cost of burnout is approximately\n  **$7,600 per employed physician each year** @https://www.bmj.com/content/365/bmj.l2361>  Furthermore, a separate analysis found that burnout-related turnover among primary care physicians (PCPs) leads to an additional\n  **$979 million** in excess annual healthcare spending for patients, as they lose continuity of care and increase their use of more expensive specialty and emergency services @https://www.ama-assn.org/practice-management/physician-health/nearly-1-billion-excess-patient-costs-tied-physician-turnover>  When combined, these figures show that physician burnout costs the nation nearly $5 @https://academic.oup.com/occmed/article/74/9/630/7958938?rss=1>  billion per year, and this does not even include the downstream costs of medical errors, malpractice claims, and decreased patient satisfaction @https://www.ama-assn.org/practice-management/physician-health/nearly-1-billion-excess-patient-costs-tied-physician-turnover> \n\nThe following table summarizes these quantifiable economic impacts, making a powerful business case for investing in burnout prevention.\n\n**Table 2: The Quantifiable Economic Impact of Burnout**\n\n| Metric | Education Sector | Healthcare Sector (Physicians Only) |\n| --- | --- | --- |\n| **Annual National Cost of Burnout/Turnover** | Over **$7 @https://cpa.ca/psychology-works-fact-sheet-workplace-burnout/>  billion** 51 | **$4 @https://academic.oup.com/occmed/article/74/9/630/7958938?rss=1>  billion** from turnover and reduced hours 53 + | **$979 million** in excess patient costs from PCP turnover 56 = | **~$5 @https://academic.oup.com/occmed/article/74/9/630/7958938?rss=1>  billion** |\n| **Per-Professional Annual Cost** | **$11,860 to $24,930** per replaced teacher, depending on district size 52 | **$7,600** per employed physician in organizational costs 54 |\n| **Key Attrition and Workforce Impact** | - 55% of teachers plan to leave the profession early due to burnout @https://crowncounseling.com/statistics/teacher-burnout/>  | - National teacher turnover rate is 16 @https://files.eric.ed.gov/fulltext/ED612141.pdf> %, and over 20% in urban schools @https://files.eric.ed.gov/fulltext/ED498001.pdf>  | - 40% of healthcare workers plan to leave their roles in the next 5 years @https://www.congress.gov/bill/118th-congress/house-resolution/1089/text>  | - 54% of physicians reported at least one symptom of burnout @https://news.harvard.edu/gazette/story/2019/07/doctor-burnout-costs-health-care-system-4-6-billion-a-year-harvard-study-says/>  |\n\nThese figures demonstrate unequivocally that inaction is not a cost-neutral option. The financial drain caused by burnout is immense, providing a compelling economic rationale for leaders and policymakers to allocate significant resources toward the systemic interventions required to solve this crisis.\n\n## **Section 6: A Blueprint for Intervention: Systemic Strategies for Fostering Well-being**\n\nAddressing the burnout crisis requires a decisive shift in perspective and strategy. The evidence overwhelmingly indicates that the root causes are systemic, and therefore, the solutions must be as well. This section outlines a blueprint for intervention grounded in evidence-based practices, moving beyond individual-focused coping mechanisms to target the organizational and policy-level dysfunctions that fuel burnout in education and healthcare.\n\n### **6 @https://en.wikipedia.org/wiki/Occupational_burnout#:~:text=The%20ICD%2D11%20of%20the,has%20not%20been%20successfully%20managed.>  Foundational Principle: Shifting from Individual Blame to Systemic Responsibility**\n\nThe cornerstone of any effective anti-burnout strategy is the recognition that burnout is an organizational problem, not an individual failing @https://soeonline.american.edu/blog/teacher-burnout/>  For decades, the default response from many institutions has been to offer individual-level solutions like self-care workshops, mindfulness apps, or resilience training @https://www.thosewhocan.org/teacher-burnout-prevention-management/>  While these practices can be beneficial for managing stress, they are fundamentally inadequate for solving burnout because they do not address its sources @https://pmc.ncbi.nlm.nih.gov/articles/PMC10178023/>  Telling a teacher working 60 hours a week with 35 students and no supplies to \"practice more self-care\" is not only ineffective but can also breed cynicism and resentment, as it implicitly blames the victim for their exhaustion @https://soeonline.american.edu/blog/teacher-burnout/> \n\nAn effective approach, therefore, must be system-focused. It must target the six key areas of work-life identified by researchers as the primary domains where mismatches lead to burnout: workload, control, reward, community, fairness, and values @https://www.apa.org/gradpsych/2011/03/corner>  The goal is to create work environments that are sustainable, supportive, and aligned with the professional values of the workforce. This requires a cultural transformation championed by leadership, re-centering the organization on its core mission and valuing the professionals who deliver it.\n\n### **6 @https://www.who.int/standards/classifications/frequently-asked-questions/burn-out-an-occupational-phenomenon>  Organizational-Level Interventions for Educational Institutions**\n\nSchool and district leaders have the power to implement concrete changes that directly impact the daily work lives of teachers and mitigate the primary drivers of burnout.\n\n* **Reduce Workload & Protect Time:** The most urgent need is to address the unsustainable workload. This can be achieved by actively streamlining administrative processes, auditing paperwork requirements to eliminate redundancies, and adopting technology that genuinely saves time rather than adding to the burden @https://business.talkspace.com/articles/how-to-prevent-teacher-burnout>  Critically, administrators must build master schedules that guarantee protected, uninterrupted planning time for every teacher and enforce policies that limit non-essential meetings and interruptions during these blocks @https://business.talkspace.com/articles/how-to-prevent-teacher-burnout>  Addressing class size through strategic staffing and enrollment management is also a fundamental step @https://crowncounseling.com/statistics/teacher-burnout/> \n* **Increase Autonomy & Empower Voice:** To combat the de-professionalization of teaching, leaders must restore professional autonomy. This means giving teachers more control over curriculum implementation, instructional methods, and classroom design, within the bounds of state standards @https://soeonline.american.edu/blog/teacher-burnout/>  It also means creating formal structures to involve teachers in school-level decision-making, especially on policies that affect them directly. When teachers have a voice and feel their expertise is respected, their sense of ownership, engagement, and job satisfaction increases dramatically @https://www.aaspa.org/news/how-to-avoid-teacher-burnout-and-increase-teacher-retention-2025> \n* **Foster a Supportive Culture:** Leaders must intentionally cultivate a school culture built on trust, collaboration, and appreciation @https://www.aaspa.org/news/how-to-avoid-teacher-burnout-and-increase-teacher-retention-2025>  This involves establishing robust peer support and mentorship programs, especially for new teachers, and implementing systems for regular, specific, and meaningful recognition of teachers' hard work @https://www.aaspa.org/news/how-to-avoid-teacher-burnout-and-increase-teacher-retention-2025>  School leaders play a vital role in modeling healthy work-life boundaries and normalizing conversations about mental health, reducing the stigma that prevents many from seeking help @https://www.aaspa.org/news/how-to-avoid-teacher-burnout-and-increase-teacher-retention-2025> \n* **Provide Resources & Support:** Administrators must advocate fiercely for adequate funding to ensure teachers have the necessary supplies, materials, and technology to do their jobs effectively, reducing the need for them to spend their own money @https://soeonline.american.edu/blog/teacher-burnout/>  Furthermore, schools must provide robust, consistent, and well-resourced support systems for managing challenging student behavior, ensuring teachers do not feel isolated in this difficult task @https://www.aaspa.org/news/how-to-avoid-teacher-burnout-and-increase-teacher-retention-2025> \n\n### **6 @https://cpa.ca/psychology-works-fact-sheet-workplace-burnout/>  Organizational-Level Interventions for Healthcare Systems**\n\nHealthcare leaders must move beyond performative wellness initiatives and commit to fundamental operational changes that address the root causes of clinician burnout.\n\n* **Address Workload & Staffing:** The most critical intervention is to ensure safe staffing levels, particularly through evidence-based nurse-to-patient ratios @https://son.rochester.edu/newsroom/2024/preventing-nursing-burnout.html>  Organizations must also actively manage workloads by limiting excessive work hours, enforcing uninterrupted breaks, and offering flexible scheduling options to improve work-life balance @https://www.keragon.com/blog/physician-burnout-treatment> \n* **Reduce Administrative Burdens:** To combat the \"hidden workload,\" organizations must redesign clinical workflows. This includes expanding team-based care models, utilizing medical scribes to handle EHR data entry, and empowering support staff to take on more clerical responsibilities, freeing up clinicians to focus on patient care @https://www.sermo.com/resources/physician-burnout-solutions/>  Investing in user-friendly technology that is co-designed with and vetted by clinicians is essential to ensure it serves as a tool, not a hindrance @https://www.ama-assn.org/practice-management/physician-health/physician-burnout-4-types-interventions-and-how-they-can-help> \n* **Cultivate a Culture of Safety & Support:** Leaders must champion a culture of psychological safety where errors and system flaws can be discussed openly and without blame, fostering an environment of continuous learning and improvement @https://www.simbo.ai/blog/exploring-the-systemic-causes-of-health-worker-burnout-and-their-impact-on-patient-care-quality-3530164/>  Promoting teamwork, establishing peer support programs, and ensuring open, two-way communication are vital for building community and reducing feelings of isolation @https://smithchason.edu/blog/combatting-nurse-burnout-7-strategies-and-tips/>  Executive leadership must make workforce well-being a visible and tangible organizational priority, backed by real investment @https://www.medpro.com/culture-of-wellbeing-resiliency-removed> \n* **Support Mental Health & Reduce Stigma:** A crucial step is to reform institutional policies that create barriers to care. This includes removing intrusive and stigmatizing mental health questions from credentialing, privileging, and licensure applications @https://www.hhs.gov/surgeongeneral/reports-and-publications/health-worker-burnout/index.html>  Organizations must ensure that high-quality, confidential mental health and substance use care is easily accessible and affordable for all employees and actively encourage its use @https://www.hhs.gov/surgeongeneral/reports-and-publications/health-worker-burnout/index.html> \n\n### **6 @https://dictionary.apa.org/burnout>  Policy-Level Recommendations for Government and Regulatory Bodies**\n\nWhile organizational change is critical, many of the pressures on teachers and healthcare workers are systemic and require intervention at the state and federal policy levels.\n\n* **For Education:**\n  + **Funding:** Policymakers must address the chronic underfunding of public education. Increased and more equitable funding formulas are necessary to reduce class sizes, provide competitive salaries, and ensure all schools have adequate resources @https://soeonline.american.edu/blog/teacher-burnout/> \n  + **Accountability Reform:** Federal and state governments should re-evaluate accountability systems that rely heavily on high-stakes standardized tests, which narrow the curriculum and strip teachers of professional autonomy @https://soeonline.american.edu/blog/teacher-burnout/> \n  + **Workforce Development:** Governments should invest in strengthening the teacher pipeline through high-quality preparation programs, teacher residencies, and \"grow-your-own\" initiatives that recruit and train talented individuals from the community @https://www.nyssba.org/news/2025/01/10/on-board-online-january-13-2025/exploring-the-financial-impact-of-teacher-turnover/> \n* **For Healthcare:**\n  + **Legislation:** Support and expand legislation designed to promote workforce well-being, such as the Dr. Lorna Breen Health Care Provider Protection Act, which provides federal funding for mental health support programs and research @https://www.congress.gov/bill/118th-congress/house-resolution/1089/text> \n  + **Regulatory Simplification:** Government agencies and payers (including Medicare and Medicaid) must work to simplify and streamline the burdensome documentation, coding, and prior authorization requirements that contribute significantly to administrative workload @https://www.hhs.gov/surgeongeneral/reports-and-publications/health-worker-burnout/index.html> \n  + **Staffing Standards:** State governments should consider and enact evidence-based safe staffing standards, such as mandated nurse-to-patient ratios, which have been shown to improve both patient outcomes and nurse well-being @https://www.cdc.gov/niosh/healthcare/impactwellbeing/professional-wellbeing.html> \n  + **Research and Data:** Federal agencies like the CDC, NIOSH, and AHRQ should continue to invest in national research to measure burnout, evaluate the effectiveness of interventions, and track workforce well-being over time @https://www.hhs.gov/surgeongeneral/reports-and-publications/health-worker-burnout/index.html> \n\n## **Conclusion**\n\nThe pervasive burnout among teachers and healthcare workers is not an inevitable cost of their demanding professions; it is a systemic failure. This report has demonstrated that the syndrome—characterized by emotional exhaustion, cynicism, and a sense of inefficacy—is the direct result of chronic, unmanaged stress originating from dysfunctional organizational structures, misguided policies, and unsustainable work environments. The causes are strikingly convergent across both sectors, rooted in overwhelming workloads, a crippling administrative burden, the erosion of professional autonomy, and a profound misalignment between the core values of the professions and the operational priorities of the institutions they serve.\n\nFor teachers, this manifests as a crisis of de-professionalization, where they are held accountable for results without the agency, time, or resources to achieve them. For healthcare workers, it culminates in a crisis of moral injury, where systemic barriers prevent them from providing the ethical care they are sworn to deliver. In both cases, the result is a workforce that is exhausted, demoralized, and fleeing their professions in record numbers.\n\nThe consequences of this inaction are catastrophic. Burnout directly degrades the quality of education and the safety of patient care. It fuels a vicious cycle of attrition that exacerbates staff shortages and strains the capacity of our most essential public services. The economic toll, measured in the billions of dollars annually from turnover and lost productivity, represents a staggering misallocation of national resources.\n\nHowever, the evidence also points toward a clear path forward. The solution lies in a fundamental paradigm shift: from blaming individuals for their lack of resilience to holding systems accountable for their lack of sustainability. This requires courageous and committed leadership at all levels. Organizational leaders in schools and hospitals must champion a culture of well-being by redesigning workflows, reducing administrative burdens, restoring professional autonomy, and fostering supportive, collaborative communities. Policymakers at the state and federal levels must enact reforms that provide adequate funding, simplify regulatory complexities, and establish standards that protect the workforce.\n\nInvesting in the well-being of our teachers and healthcare workers is not a soft initiative or a peripheral concern. It is a critical investment in our nation's future. It is a direct investment in the academic achievement of our children, the health and safety of our families, and the long-term stability of our society. The cost of continued neglect is unacceptably high. The time for systemic, meaningful, and sustained action is now.\n\n#### 引用的著作\n\n1. en.wikipedia.org, 访问时间为 八月 5, 2025， <https://en.wikipedia.org/wiki/Occupational_burnout#:~:text=The%20ICD%2D11%20of%20the,has%20not%20been%20successfully%20managed.>\n2. Burn-out an occupational phenomenon, 访问时间为 八月 5, 2025， <https://www.who.int/standards/classifications/frequently-asked-questions/burn-out-an-occupational-phenomenon>\n3. “Psychology Works” Fact Sheet: Workplace Burnout, 访问时间为 八月 5, 2025， <https://cpa.ca/psychology-works-fact-sheet-workplace-burnout/>\n4. Burnout - APA Dictionary of Psychology, 访问时间为 八月 5, 2025， <https://dictionary.apa.org/burnout>\n5. Avoid the burn - American Psychological Association, 访问时间为 八月 5, 2025， <https://www.apa.org/gradpsych/2011/03/corner>\n6. Maslach Burnout Inventory | Occupational Medicine | Oxford Academic, 访问时间为 八月 5, 2025， <https://academic.oup.com/occmed/article/74/9/630/7958938?rss=1>\n7. en.wikipedia.org, 访问时间为 八月 5, 2025， <https://en.wikipedia.org/wiki/Maslach_Burnout_Inventory>\n8. Does Teacher Emotional Exhaustion and Efficacy Predict ... - ERIC, 访问时间为 八月 5, 2025， <https://files.eric.ed.gov/fulltext/ED612141.pdf>\n9. Addressing Teacher Burnout: Causes, Symptoms, and Strategies | American University, 访问时间为 八月 5, 2025， <https://soeonline.american.edu/blog/teacher-burnout/>\n10. Teacher Burnout: Stats, Causes, and Prevention for 2025 | EVERFI, 访问时间为 八月 5, 2025， <https://everfi.com/blog/k-12/teacher-burnout/>\n11. Teacher Burnout Statistics: Why Teachers Quit in 2025 | Devlin Peck, 访问时间为 八月 5, 2025， <https://www.devlinpeck.com/content/teacher-burnout-statistics>\n12. 25+ Teacher Burnout Statistics: A Crisis We Can't Ignore - Crown Counseling, 访问时间为 八月 5, 2025， <https://crowncounseling.com/statistics/teacher-burnout/>\n13. Class Sizes: A Growing Issue Among Educators | NEA, 访问时间为 八月 5, 2025， <https://www.nea.org/nea-today/all-news-articles/class-sizes-growing-issue-among-educators>\n14. How School Administrators Can Prevent Teacher Burnout - Talkspace for Business, 访问时间为 八月 5, 2025， <https://business.talkspace.com/articles/how-to-prevent-teacher-burnout>\n15. Effects of Teacher Burnout on Elementary School Students' Learning - Digital Commons @ CSUMB, 访问时间为 八月 5, 2025， <https://digitalcommons.csumb.edu/cgi/viewcontent.cgi?article=2905&context=caps_thes_all>\n16. How to Avoid Teacher Burnout and Increase Teacher Retention ..., 访问时间为 八月 5, 2025， <https://www.aaspa.org/news/how-to-avoid-teacher-burnout-and-increase-teacher-retention-2025>\n17. Teacher Burnout and How To Avoid It - Education Support, 访问时间为 八月 5, 2025， <https://www.educationsupport.org.uk/resources/for-individuals/articles/teacher-burnout-and-how-to-avoid-it/>\n18. Teacher Burnout | EBSCO Research Starters, 访问时间为 八月 5, 2025， <https://www.ebsco.com/research-starters/education/teacher-burnout>\n19. Empowering Educators | Why Teachers Need Autonomy in 2025 - Moreland University, 访问时间为 八月 5, 2025， <https://moreland.edu/resources/blog-insights/empowering-educators-why-teachers-need-autonomy-in-2025>\n20. 访问时间为 一月 1, 1970， <https://business.talkspace.com/articles/how-to-prevent-teacher-burnout/>\n21. The Relationship between Teacher Autonomy and Mental Health in ..., 访问时间为 八月 5, 2025， <https://pmc.ncbi.nlm.nih.gov/articles/PMC9689976/>\n22. Physician burnout: Proven solutions to reduce burnout in 2025 - Sermo, 访问时间为 八月 5, 2025， <https://www.sermo.com/resources/physician-burnout-solutions/>\n23. Teacher Burnout: Creating a Culture of Support - Cognia - The Source, 访问时间为 八月 5, 2025， <https://source.cognia.org/issue-article/teacher-burnout-creating-a-culture-of-support/>\n24. What's Causing Teacher Burnout? | NEA - National Education Association, 访问时间为 八月 5, 2025， <https://www.nea.org/nea-today/all-news-articles/whats-causing-teacher-burnout>\n25. Transform School Culture and Reduce Teacher Burnout - Toddle, 访问时间为 八月 5, 2025， <https://www.toddleapp.com/learn/blog-post/reduce-teacher-burnout-and-improve-your-school-culture/>\n26. \"Organizational Factors and Teachers' Burnout and Attrition\" by Tony ..., 访问时间为 八月 5, 2025， <https://spark.bethel.edu/etd/1144/>\n27. The Enduring Impact of Teacher Burnout on ... - ScholarWorks, 访问时间为 八月 5, 2025， <https://scholarworks.calstate.edu/downloads/ng451s65g>\n28. 5 Ways to Build Teacher Well-Being - Graduate Programs for Educators, 访问时间为 八月 5, 2025， <https://www.graduateprogram.org/blog/5-ways-to-build-teacher-well-being/>\n29. Addressing burnout in the healthcare workforce: current realities and mitigation strategies, 访问时间为 八月 5, 2025， <https://pmc.ncbi.nlm.nih.gov/articles/PMC11281910/>\n30. Health care workers' burnout, mental distress may impact patient outcomes | University of Hawaiʻi System News, 访问时间为 八月 5, 2025， <https://www.hawaii.edu/news/2025/01/16/health-care-workers-mental-health/>\n31. Health Worker Burnout | HHS.gov, 访问时间为 八月 5, 2025， <https://www.hhs.gov/surgeongeneral/reports-and-publications/health-worker-burnout/index.html>\n32. www.hhs.gov, 访问时间为 八月 5, 2025， <https://www.hhs.gov/surgeongeneral/reports-and-publications/health-worker-burnout/index.html#:~:text=Some%20examples%20include%3A%20excessive%20workloads,and%20lack%20of%20organizational%20support.>\n33. Causes Of Burnout In The Healthcare Industry | Adonis, 访问时间为 八月 5, 2025， <https://www.adonis.io/news/causes-of-burnout-in-the-healthcare-industry>\n34. Exploring the Systemic Causes of Health Worker Burnout and Their ..., 访问时间为 八月 5, 2025， <https://www.simbo.ai/blog/exploring-the-systemic-causes-of-health-worker-burnout-and-their-impact-on-patient-care-quality-3530164/>\n35. Impact of long working hours on depressive symptoms ... - Frontiers, 访问时间为 八月 5, 2025， <https://www.frontiersin.org/journals/psychology/articles/10.3389/fpsyg.2023.1084329/full>\n36. Long working hours and burnout in health care workers: Non‐linear dose‐response relationship and the effect mediated by sleeping hours—A cross‐sectional study - PubMed Central, 访问时间为 八月 5, 2025， <https://pmc.ncbi.nlm.nih.gov/articles/PMC8101694/>\n37. Nursing Burnout: What It Is and How to Prevent It | USAHS, 访问时间为 八月 5, 2025， <https://www.usa.edu/blog/nurse-burnout/>\n38. What's Causing Physician Burnout & How to Address It, 访问时间为 八月 5, 2025， <https://ccphp.net/blog/whats-causing-physician-burnout-how-to-address-it>\n39. The 12 factors that drive up physician burnout | American Medical Association, 访问时间为 八月 5, 2025， <https://www.ama-assn.org/practice-management/physician-health/12-factors-drive-physician-burnout>\n40. Physician burnout: 4 types of interventions and how they can help, 访问时间为 八月 5, 2025， <https://www.ama-assn.org/practice-management/physician-health/physician-burnout-4-types-interventions-and-how-they-can-help>\n41. Navigating the Emotional Struggles of Compassion Fatigue in ..., 访问时间为 八月 5, 2025， <https://minoritynurse.com/navigating-the-emotional-struggles-of-compassion-fatigue-in-nursing/>\n42. How to Prevent Nursing Burnout | University of Rochester School of Nursing, 访问时间为 八月 5, 2025， <https://son.rochester.edu/newsroom/2024/preventing-nursing-burnout.html>\n43. Five Ways Healthcare Organizations Can Confront Burnout and Build Cultures of Well-Being and Resiliency | MedPro Group, 访问时间为 八月 5, 2025， <https://www.medpro.com/culture-of-wellbeing-resiliency-removed>\n44. Organisational factors associated with burnout among emergency ..., 访问时间为 八月 5, 2025， <https://pmc.ncbi.nlm.nih.gov/articles/PMC11781124/>\n45. Combatting Nurse Burnout: 7 Strategies and Tips - Smith Chason College, 访问时间为 八月 5, 2025， <https://smithchason.edu/blog/combatting-nurse-burnout-7-strategies-and-tips/>\n46. Physician Burnout Treatment: Proven Strategies and Useful Programs for 2025 - Keragon, 访问时间为 八月 5, 2025， <https://www.keragon.com/blog/physician-burnout-treatment>\n47. Text - H.Res.1089 - 118th Congress (2023-2024): Recognizing the ..., 访问时间为 八月 5, 2025， <https://www.congress.gov/bill/118th-congress/house-resolution/1089/text>\n48. Burnout | PSNet, 访问时间为 八月 5, 2025， <https://psnet.ahrq.gov/primer/burnout>\n49. What Are The Impacts Of Teacher Burnout On The Education System? - Varthana, 访问时间为 八月 5, 2025， <https://varthana.com/school/imapcts-and-prevention-of-teacher-burnout>\n50. Relationship between nurse burnout, patient and organizational ..., 访问时间为 八月 5, 2025， <https://pubmed.ncbi.nlm.nih.gov/33901940/>\n51. Policy Brief The High Cost of Teacher Turnover - ERIC, 访问时间为 八月 5, 2025， <https://files.eric.ed.gov/fulltext/ED498001.pdf>\n52. Exploring the financial impact of teacher turnover - New York State ..., 访问时间为 八月 5, 2025， <https://www.nyssba.org/news/2025/01/10/on-board-online-january-13-2025/exploring-the-financial-impact-of-teacher-turnover/>\n53. Doctor burnout costs health care system $4 @https://academic.oup.com/occmed/article/74/9/630/7958938?rss=1>  billion a year, Harvard ..., 访问时间为 八月 5, 2025， <https://news.harvard.edu/gazette/story/2019/07/doctor-burnout-costs-health-care-system-4-6-billion-a-year-harvard-study-says/>\n54. Physician burnout costs US $4 @https://academic.oup.com/occmed/article/74/9/630/7958938?rss=1> bn a year, study finds | The BMJ, 访问时间为 八月 5, 2025， <https://www.bmj.com/content/365/bmj.l2361>\n55. www.acpjournals.org, 访问时间为 八月 5, 2025， <https://www.acpjournals.org/doi/10.7326/M18-1422#:~:text=At%20an%20organizational%20level%2C%20the,per%20employed%20physician%20each%20year.>\n56. Nearly $1 billion in excess patient costs tied to physician turnover | American Medical Association, 访问时间为 八月 5, 2025， <https://www.ama-assn.org/practice-management/physician-health/nearly-1-billion-excess-patient-costs-tied-physician-turnover>\n57. Teacher Burnout - Prevention & Management - those who can, 访问时间为 八月 5, 2025， <https://www.thosewhocan.org/teacher-burnout-prevention-management/>\n58. Interventions to Reduce Stress and Burnout among Teachers: A Scoping Review - PMC, 访问时间为 八月 5, 2025， <https://pmc.ncbi.nlm.nih.gov/articles/PMC10178023/>\n59. Addressing Health Worker Burnout to Improve the Quality of Patient Care, 访问时间为 八月 5, 2025， <https://www.rehabiljournal.com/articles/addressing-health-worker-burnout-to-improve-the-quality-of-patient-care.html>\n60. Interventions to Reduce Burnout Among University Lecturers: A Systematic Literature Review - MDPI, 访问时间为 八月 5, 2025， <https://www.mdpi.com/2076-328X/15/5/649>\n61. Leaders Must Address Teacher Well-Being With Action, Not Just Self-Care Talk - Edutopia, 访问时间为 八月 5, 2025， <https://www.edutopia.org/article/leaders-teacher-wellbeing-action/>\n62. 7 Ways to Create a Positive Work Environment for Nurses, 访问时间为 八月 5, 2025， <https://www.nursingworld.org/content-hub/resources/workplace/positive-work-environment/>\n63. Culture Change Interventions to Reduce Physician Burnout | ACP, 访问时间为 八月 5, 2025， <https://www.acponline.org/practice-career/physician-well-being-and-professional-fulfillment/top-10-culture-change-interventions-to-reduce-burnout-and-improve-physician-well-being>\n64. 5 Ways To Manage Employee Burnout as a Healthcare Manager, 访问时间为 八月 5, 2025， <https://lifelonglearning.waldenu.edu/resource/5-ways-to-manage-employee-burnout-as-a-healthcare-manager.html>\n65. CDC's National Institute for Occupational Safety and Health's Impact Wellbeing™ Campaign Releases Hospital-Tested Guide to Improve Healthcare Worker Burnout | CDC Online Newsroom, 访问时间为 八月 5, 2025， <https://www.cdc.gov/media/releases/2024/p0318-Worker-Burnout.html>\n66. Advocacy in action: Reducing physician burnout | American Medical Association, 访问时间为 八月 5, 2025， <https://www.ama-assn.org/practice-management/physician-health/advocacy-action-reducing-physician-burnout>\n67. National Plan for Health Workforce Well-Being - NAM, 访问时间为 八月 5, 2025， <https://nam.edu/publications/national-plan-for-health-workforce-well-being/>\n68. Professional Wellbeing | Healthcare Workers - CDC, 访问时间为 八月 5, 2025， <https://www.cdc.gov/niosh/healthcare/impactwellbeing/professional-wellbeing.html>\n",
  "all_source_links": [
    "https://academic.oup.com/occmed/article/74/9/630/7958938?rss=1",
    "https://accounts.google.com/SignOutOptions?hl=zh-CN&continue=https://gemini.google.com/app/b018ec52094f7b88&ec=GBRAkgU",
    "https://business.talkspace.com/articles/how-to-prevent-teacher-burnout",
    "https://ccphp.net/blog/whats-causing-physician-burnout-how-to-address-it",
    "https://cpa.ca/psychology-works-fact-sheet-workplace-burnout",
    "https://crowncounseling.com/statistics/teacher-burnout",
    "https://dashscope.aliyuncs.com/compatible-mode/v1",
    "https://dictionary.apa.org/burnout",
    "https://digitalcommons.csumb.edu/cgi/viewcontent.cgi?article=2905&context=caps_thes_all",
    "https://en.wikipedia.org/wiki/Maslach_Burnout_Inventory",
    "https://en.wikipedia.org/wiki/Occupational_burnout#:~:text=The%20ICD%2D11%20of%20the,has%20not%20been%20successfully%20managed.",
    "https://everfi.com/blog/k-12/teacher-burnout",
    "https://files.eric.ed.gov/fulltext/ED498001.pdf",
    "https://files.eric.ed.gov/fulltext/ED612141.pdf",
    "https://lifelonglearning.waldenu.edu/resource/5-ways-to-manage-employee-burnout-as-a-healthcare-manager.html",
    "https://minoritynurse.com/navigating-the-emotional-struggles-of-compassion-fatigue-in-nursing",
    "https://moreland.edu/resources/blog-insights/empowering-educators-why-teachers-need-autonomy-in-2025",
    "https://nam.edu/publications/national-plan-for-health-workforce-well-being",
    "https://news.harvard.edu/gazette/story/2019/07/doctor-burnout-costs-health-care-system-4-6-billion-a-year-harvard-study-says",
    "https://paper.co/blog/teacher-burnout-also-impacts-students-heres-how",
    "https://pmc.ncbi.nlm.nih.gov/articles/PMC10178023",
    "https://pmc.ncbi.nlm.nih.gov/articles/PMC11281910",
    "https://pmc.ncbi.nlm.nih.gov/articles/PMC11342329",
    "https://pmc.ncbi.nlm.nih.gov/articles/PMC11781124",
    "https://pmc.ncbi.nlm.nih.gov/articles/PMC8101694",
    "https://pmc.ncbi.nlm.nih.gov/articles/PMC8986160",
    "https://pmc.ncbi.nlm.nih.gov/articles/PMC9689976",
    "https://psnet.ahrq.gov/primer/burnout",
    "https://pubmed.ncbi.nlm.nih.gov/11507994",
    "https://pubmed.ncbi.nlm.nih.gov/33901940",
    "https://scholarworks.calstate.edu/downloads/ng451s65g",
    "https://smithchason.edu/blog/combatting-nurse-burnout-7-strategies-and-tips",
    "https://soeonline.american.edu/blog/teacher-burnout",
    "https://son.rochester.edu/newsroom/2024/preventing-nursing-burnout.html",
    "https://source.cognia.org/issue-article/teacher-burnout-creating-a-culture-of-support",
    "https://spark.bethel.edu/etd/1144",
    "https://varthana.com/school/imapcts-and-prevention-of-teacher-burnout",
    "https://www.aaspa.org/news/how-to-avoid-teacher-burnout-and-increase-teacher-retention-2025",
    "https://www.acpjournals.org/doi/10.7326/M18-1422#:~:text=At%20an%20organizational%20level%2C%20the,per%20employed%20physician%20each%20year.",
    "https://www.acponline.org/practice-career/physician-well-being-and-professional-fulfillment/top-10-culture-change-interventions-to-reduce-burnout-and-improve-physician-well-being",
    "https://www.adonis.io/news/causes-of-burnout-in-the-healthcare-industry",
    "https://www.ama-assn.org/practice-management/physician-health/12-factors-drive-physician-burnout",
    "https://www.ama-assn.org/practice-management/physician-health/advocacy-action-reducing-physician-burnout",
    "https://www.ama-assn.org/practice-management/physician-health/nearly-1-billion-excess-patient-costs-tied-physician-turnover",
    "https://www.ama-assn.org/practice-management/physician-health/physician-burnout-4-types-interventions-and-how-they-can-help",
    "https://www.apa.org/gradpsych/2011/03/corner",
    "https://www.bmj.com/content/365/bmj.l2361",
    "https://www.cdc.gov/media/releases/2024/p0318-Worker-Burnout.html",
    "https://www.cdc.gov/niosh/healthcare/impactwellbeing/professional-wellbeing.html",
    "https://www.cdc.gov/niosh/learning/publichealthburnoutprevention/default.html",
    "https://www.colorincolorado.org/article/extinguishing-teacher-burnout-strategies-and-resources-educators",
    "https://www.congress.gov/bill/118th-congress/house-resolution/1089/text",
    "https://www.devlinpeck.com/content/teacher-burnout-statistics",
    "https://www.droracle.ai/articles/37453/factors-affecting-physician-burnout-focus-on-internal-medicine-and-primary-care-",
    "https://www.ebsco.com/research-starters/education/teacher-burnout",
    "https://www.educationsupport.org.uk/resources/for-individuals/articles/teacher-burnout-and-how-to-avoid-it",
    "https://www.edutopia.org/article/leaders-teacher-wellbeing-action",
    "https://www.frontiersin.org/journals/psychology/articles/10.3389/fpsyg.2023.1084329/full",
    "https://www.frontiersin.org/journals/psychology/articles/10.3389/fpsyg.2024.1406562/full",
    "https://www.graduateprogram.org/blog/5-ways-to-build-teacher-well-being",
    "https://www.graduateprogram.org/blog/how-to-navigate-burnout-as-an-administrator",
    "https://www.hawaii.edu/news/2025/01/16/health-care-workers-mental-health",
    "https://www.hhs.gov/surgeongeneral/reports-and-publications/health-worker-burnout/index.html",
    "https://www.hhs.gov/surgeongeneral/reports-and-publications/health-worker-burnout/index.html#:~:text=Some%20examples%20include%3A%20excessive%20workloads,and%20lack%20of%20organizational%20support.",
    "https://www.icevonline.com/blog/best-ways-to-avoid-teacher-burnout",
    "https://www.keragon.com/blog/physician-burnout-treatment",
    "https://www.mdpi.com/2076-328X/15/5/649",
    "https://www.medpro.com/culture-of-wellbeing-resiliency-removed",
    "https://www.mywellbeingindex.org/blog/7-ways-to-improve-well-being-among-nurses",
    "https://www.nea.org/nea-today/all-news-articles/class-sizes-growing-issue-among-educators",
    "https://www.nea.org/nea-today/all-news-articles/whats-causing-teacher-burnout",
    "https://www.nursingworld.org/content-hub/resources/workplace/positive-work-environment",
    "https://www.nursingworld.org/content-hub/resources/workplace/what-is-nurse-burnout-how-to-prevent-it",
    "https://www.nyssba.org/news/2025/01/10/on-board-online-january-13-2025/exploring-the-financial-impact-of-teacher-turnover",
    "https://www.pointloma.edu/resources/education/5-ways-prevent-burnout-teacher",
    "https://www.rehabiljournal.com/articles/addressing-health-worker-burnout-to-improve-the-quality-of-patient-care.html",
    "https://www.sermo.com/resources/physician-burnout-solutions",
    "https://www.shiftmed.com/insights/knowledge-center/ensuring-nurse-well-being-and-job-satisfaction",
    "https://www.simbo.ai/blog/exploring-the-systemic-causes-of-health-worker-burnout-and-their-impact-on-patient-care-quality-3530164",
    "https://www.thosewhocan.org/teacher-burnout-prevention-management",
    "https://www.toddleapp.com/learn/blog-post/reduce-teacher-burnout-and-improve-your-school-culture",
    "https://www.usa.edu/blog/nurse-burnout",
    "https://www.who.int/standards/classifications/frequently-asked-questions/burn-out-an-occupational-phenomenon"
  ],
  "summary_citations": [
    "https://academic.oup.com/occmed/article/74/9/630/7958938?rss=1",
    "https://accounts.google.com/SignOutOptions?hl=zh-CN&continue=https://gemini.google.com/app/b018ec52094f7b88&ec=GBRAkgU",
    "https://business.talkspace.com/articles/how-to-prevent-teacher-burnout",
    "https://ccphp.net/blog/whats-causing-physician-burnout-how-to-address-it",
    "https://cpa.ca/psychology-works-fact-sheet-workplace-burnout",
    "https://crowncounseling.com/statistics/teacher-burnout",
    "https://dashscope.aliyuncs.com/compatible-mode/v1",
    "https://dictionary.apa.org/burnout",
    "https://digitalcommons.csumb.edu/cgi/viewcontent.cgi?article=2905&context=caps_thes_all",
    "https://en.wikipedia.org/wiki/Maslach_Burnout_Inventory",
    "https://en.wikipedia.org/wiki/Occupational_burnout#:~:text=The%20ICD%2D11%20of%20the,has%20not%20been%20successfully%20managed.",
    "https://everfi.com/blog/k-12/teacher-burnout",
    "https://files.eric.ed.gov/fulltext/ED498001.pdf",
    "https://files.eric.ed.gov/fulltext/ED612141.pdf",
    "https://lifelonglearning.waldenu.edu/resource/5-ways-to-manage-employee-burnout-as-a-healthcare-manager.html",
    "https://minoritynurse.com/navigating-the-emotional-struggles-of-compassion-fatigue-in-nursing",
    "https://moreland.edu/resources/blog-insights/empowering-educators-why-teachers-need-autonomy-in-2025",
    "https://nam.edu/publications/national-plan-for-health-workforce-well-being",
    "https://news.harvard.edu/gazette/story/2019/07/doctor-burnout-costs-health-care-system-4-6-billion-a-year-harvard-study-says",
    "https://paper.co/blog/teacher-burnout-also-impacts-students-heres-how",
    "https://pmc.ncbi.nlm.nih.gov/articles/PMC10178023",
    "https://pmc.ncbi.nlm.nih.gov/articles/PMC11281910",
    "https://pmc.ncbi.nlm.nih.gov/articles/PMC11342329",
    "https://pmc.ncbi.nlm.nih.gov/articles/PMC11781124",
    "https://pmc.ncbi.nlm.nih.gov/articles/PMC8101694",
    "https://pmc.ncbi.nlm.nih.gov/articles/PMC8986160",
    "https://pmc.ncbi.nlm.nih.gov/articles/PMC9689976",
    "https://psnet.ahrq.gov/primer/burnout",
    "https://pubmed.ncbi.nlm.nih.gov/11507994",
    "https://pubmed.ncbi.nlm.nih.gov/33901940",
    "https://scholarworks.calstate.edu/downloads/ng451s65g",
    "https://smithchason.edu/blog/combatting-nurse-burnout-7-strategies-and-tips",
    "https://soeonline.american.edu/blog/teacher-burnout",
    "https://son.rochester.edu/newsroom/2024/preventing-nursing-burnout.html",
    "https://source.cognia.org/issue-article/teacher-burnout-creating-a-culture-of-support",
    "https://spark.bethel.edu/etd/1144",
    "https://varthana.com/school/imapcts-and-prevention-of-teacher-burnout",
    "https://www.aaspa.org/news/how-to-avoid-teacher-burnout-and-increase-teacher-retention-2025",
    "https://www.acpjournals.org/doi/10.7326/M18-1422#:~:text=At%20an%20organizational%20level%2C%20the,per%20employed%20physician%20each%20year.",
    "https://www.acponline.org/practice-career/physician-well-being-and-professional-fulfillment/top-10-culture-change-interventions-to-reduce-burnout-and-improve-physician-well-being",
    "https://www.adonis.io/news/causes-of-burnout-in-the-healthcare-industry",
    "https://www.ama-assn.org/practice-management/physician-health/12-factors-drive-physician-burnout",
    "https://www.ama-assn.org/practice-management/physician-health/advocacy-action-reducing-physician-burnout",
    "https://www.ama-assn.org/practice-management/physician-health/nearly-1-billion-excess-patient-costs-tied-physician-turnover",
    "https://www.ama-assn.org/practice-management/physician-health/physician-burnout-4-types-interventions-and-how-they-can-help",
    "https://www.apa.org/gradpsych/2011/03/corner",
    "https://www.bmj.com/content/365/bmj.l2361",
    "https://www.cdc.gov/media/releases/2024/p0318-Worker-Burnout.html",
    "https://www.cdc.gov/niosh/healthcare/impactwellbeing/professional-wellbeing.html",
    "https://www.cdc.gov/niosh/learning/publichealthburnoutprevention/default.html",
    "https://www.colorincolorado.org/article/extinguishing-teacher-burnout-strategies-and-resources-educators",
    "https://www.congress.gov/bill/118th-congress/house-resolution/1089/text",
    "https://www.devlinpeck.com/content/teacher-burnout-statistics",
    "https://www.droracle.ai/articles/37453/factors-affecting-physician-burnout-focus-on-internal-medicine-and-primary-care-",
    "https://www.ebsco.com/research-starters/education/teacher-burnout",
    "https://www.educationsupport.org.uk/resources/for-individuals/articles/teacher-burnout-and-how-to-avoid-it",
    "https://www.edutopia.org/article/leaders-teacher-wellbeing-action",
    "https://www.frontiersin.org/journals/psychology/articles/10.3389/fpsyg.2023.1084329/full",
    "https://www.frontiersin.org/journals/psychology/articles/10.3389/fpsyg.2024.1406562/full",
    "https://www.graduateprogram.org/blog/5-ways-to-build-teacher-well-being",
    "https://www.graduateprogram.org/blog/how-to-navigate-burnout-as-an-administrator",
    "https://www.hawaii.edu/news/2025/01/16/health-care-workers-mental-health",
    "https://www.hhs.gov/surgeongeneral/reports-and-publications/health-worker-burnout/index.html",
    "https://www.hhs.gov/surgeongeneral/reports-and-publications/health-worker-burnout/index.html#:~:text=Some%20examples%20include%3A%20excessive%20workloads,and%20lack%20of%20organizational%20support.",
    "https://www.icevonline.com/blog/best-ways-to-avoid-teacher-burnout",
    "https://www.keragon.com/blog/physician-burnout-treatment",
    "https://www.mdpi.com/2076-328X/15/5/649",
    "https://www.medpro.com/culture-of-wellbeing-resiliency-removed",
    "https://www.mywellbeingindex.org/blog/7-ways-to-improve-well-being-among-nurses",
    "https://www.nea.org/nea-today/all-news-articles/class-sizes-growing-issue-among-educators",
    "https://www.nea.org/nea-today/all-news-articles/whats-causing-teacher-burnout",
    "https://www.nursingworld.org/content-hub/resources/workplace/positive-work-environment",
    "https://www.nursingworld.org/content-hub/resources/workplace/what-is-nurse-burnout-how-to-prevent-it",
    "https://www.nyssba.org/news/2025/01/10/on-board-online-january-13-2025/exploring-the-financial-impact-of-teacher-turnover",
    "https://www.pointloma.edu/resources/education/5-ways-prevent-burnout-teacher",
    "https://www.rehabiljournal.com/articles/addressing-health-worker-burnout-to-improve-the-quality-of-patient-care.html",
    "https://www.sermo.com/resources/physician-burnout-solutions",
    "https://www.shiftmed.com/insights/knowledge-center/ensuring-nurse-well-being-and-job-satisfaction",
    "https://www.simbo.ai/blog/exploring-the-systemic-causes-of-health-worker-burnout-and-their-impact-on-patient-care-quality-3530164",
    "https://www.thosewhocan.org/teacher-burnout-prevention-management",
    "https://www.toddleapp.com/learn/blog-post/reduce-teacher-burnout-and-improve-your-school-culture",
    "https://www.usa.edu/blog/nurse-burnout",
    "https://www.who.int/standards/classifications/frequently-asked-questions/burn-out-an-occupational-phenomenon"
  ]
}