{
  "query": "Conduct a systematic, comprehensive, and in-depth analysis of Lincoln's role in the Civil War and complete the related research report.",
  "chain_of_research": {
    "plan_1": {
      "title": "Research Approach\nInitial Research Focus\nNext Steps",
      "description": "I'm starting a comprehensive and in-depth analysis of Lincoln's role in the Civil War. My approach will involve systematically researching key areas and gathering information from reputable historical sources. I'll be prepared to explore additional relevant details as they emerge during the research process.\nMy initial focus will be on understanding the political climate and Lincoln's stance before the war. This includes researching the political landscape leading up to 1860, particularly concerning slavery and states' rights. I'll also investigate Lincoln's pre-presidency political career, his position on slavery as seen in the Lincoln-Douglas debates and his 'House Divided' speech, and the 1860 election's impact, including Southern secession. Finally, I'll analyze his inaugural address and initial policies towards the seceding states.\nI will begin by performing searches to identify key historical resources and reputable academic sites related to these initial topics."
    },
    "search_1": [
      "https://www.nps.gov/liho/learn/historyculture/secessiontableofcontents.htm",
      "https://encyclopediavirginia.org/entries/states-rights",
      "https://cwnc.omeka.chass.ncsu.edu/exhibits/show/benjamin-hedrick/polticalclimate",
      "https://cla.purdue.edu/academic/history/debate/lincolndouglas/LincolnDouglas.html",
      "https://www.battlefields.org/learn/articles/lincoln-douglas-debates",
      "https://www.ebsco.com/research-starters/history/analysis-abraham-lincolns-first-inaugural-address",
      "https://www.nps.gov/liho/learn/historyculture/political.htm#:~:text=Pre%2DPresidential%20Political%20Career%201830%2D1860&text=In%201834%20he%20was%20elected,Springfield%2C%20the%20new%20State%20capital.",
      "https://www.gilderlehrman.org/history-resources/spotlight-primary-source/president-lincolns-first-inaugural-address-1861",
      "https://en.wikipedia.org/wiki/Abraham_Lincoln",
      "https://en.wikipedia.org/wiki/1860_United_States_presidential_election",
      "https://constitutioncenter.org/the-constitution/historic-document-library/detail/south-carolina-declaration-of-secession-1860",
      "https://www.ebsco.com/research-starters/history/analysis-lincolns-house-divided-speech",
      "https://library.fiveable.me/key-terms/hs-speech-debate/house-divided-speech"
    ],
    "observation_1": "I've completed my initial research into the political landscape leading up to the Civil War and Lincoln's early involvement. I've learned that the 1850s were marked by intense division over slavery and states' rights, with events like the Compromise of 1850, the Kansas-Nebraska Act, and the Dred Scott decision significantly escalating tensions. While states' rights were a prominent argument, the underlying and paramount issue was slavery itself.",
    "plan_2": {
      "title": "Lincoln's Emergence\nInitial Presidential Stance\nNext Research Focus",
      "description": "My research shows that Abraham Lincoln, initially a Whig and then a key figure in the Republican Party, consistently opposed the expansion of slavery into new territories. His 'House Divided' speech and the Lincoln-Douglas debates, though he lost the Senate race, were pivotal in elevating his national profile and articulating his belief that the nation could not endure half slave and half free. His victory in the 1860 presidential election, secured primarily with Northern votes, directly triggered the secession of Southern states, who viewed his election as a direct threat to the institution of slavery.\nUpon assuming the presidency, Lincoln's first inaugural address aimed to de-escalate tensions by assuring Southern states he would not interfere with slavery where it already existed. However, he firmly declared the Union's perpetuity and the illegality of secession, emphasizing his constitutional duty to preserve the nation. He made it clear that any conflict would be initiated by the seceding states.\nHaving established a solid foundation on the pre-war context and Lincoln's initial actions, I will now shift my focus to his strategic decisions and leadership as Commander-in-Chief during the war. This will involve investigating his role in the response to Fort Sumter, his military strategies, his management of generals, and his application of presidential powers."
    },
    "search_2": [
      "https://www.archives.gov/publications/prologue/2010/spring/lincoln-and-guerrillas",
      "https://presidentlincoln.illinois.gov/Blog/Posts/184/Civil-War/2024/5/Lincolns-Critical-Month-April-1861/blog-post/#:~:text=Seeking%20advice%20from%20General%20Winfield,control%20of%20the%20Mississippi%20River.",
      "https://en.wikipedia.org/wiki/George_B._McClellan",
      "https://www.senate.gov/artandhistory/history/common/civil_war/LincolnEmergencySession_FeaturedDoc.htm",
      "https://presidentlincoln.illinois.gov/Blog/Posts/184/Civil-War/2024/5/Lincolns-Critical-Month-April-1861/blog-post",
      "https://quod.lib.umich.edu/j/jala/2629860.0007.104/--lincoln-s-presidential-example-in-dealing-with-the-military?rgn=main;view=fulltext",
      "https://ndupress.ndu.edu/Media/News/News-Article-View/Article/581883/union-success-in-the-civil-war-and-lessons-for-strategic-leaders",
      "https://emergingcivilwar.com/2024/07/30/commander-in-chief-at-civil-war-abraham-lincoln/#:~:text=Lincoln's%20most%20important%20role%20as,objectives%20he%20sought%20to%20achieve.",
      "https://cupola.gettysburg.edu/cwfac/53"
    ],
    "observation_2": "I've gathered initial information on Lincoln's strategic decisions and leadership as Commander-in-Chief. I have some details on his response to Fort Sumter, the adoption of the Anaconda Plan, and his relationships with key generals like McClellan and Grant. I also have a general understanding of his role as Commander-in-Chief.",
    "plan_3": {
      "title": "Key Areas for Further Exploration\nNext Steps in Research",
      "description": "To provide a more comprehensive analysis, I need to delve deeper into several specific areas. For Fort Sumter, I'll investigate the decision-making process behind his call for 75,000 troops and the immediate consequences, such as further secessions. Regarding the Anaconda Plan, I'll explore its specific components, how it evolved over time, and its overall effectiveness. My research on Lincoln's relationships with his generals will focus on understanding the reasons for his distrust of McClellan, the specific shortcomings he perceived, and the number of times McClellan was removed or reinstated. For Grant, I'll examine why he succeeded where others failed, the nature of their collaboration, and how Lincoln empowered him. I also plan to look into Lincoln's views on Sherman's campaigns, such as the March to the Sea, and his broader challenges in finding effective commanders. Finally, I will explore specific instances where Lincoln exercised his Commander-in-Chief powers, such as the suspension of habeas corpus and military arrests, and the controversies or justifications surrounding these actions. I'll also look for other significant strategic or tactical decisions he influenced, including his shift in policy regarding guerrilla warfare in 1862.\nMy next steps will involve refining my research on these specific points by browsing existing relevant URLs and conducting new searches to gather more detailed information."
    },
    "search_3": [
      "https://www.archives.gov/publications/prologue/2010/spring/lincoln-and-guerrillas",
      "https://www.archives.gov/files/publications/prologue/2010/spring/civil-war-lincoln-guerrillas.pdf",
      "https://blogs.dickinson.edu/hist-288pinsker/close-readings/close-reading-letter-to-george-mcclellan",
      "https://www.abrahamlincolnsclassroom.org/abraham-lincolns-contemporaries/abraham-lincoln-and-george-b-mcclellan/index.html",
      "https://www.historyonthenet.com/lincoln-and-grant-winning-civil-war-us-presidency",
      "https://ndupress.ndu.edu/Media/News/News-Article-View/Article/581883/union-success-in-the-civil-war-and-lessons-for-strategic-leaders",
      "https://www.history.com/this-day-in-history/january-27/lincoln-orders-armies-to-advance#:~:text=On%20January%2027%2C%201862%2C%20President,the%20offensive%20against%20Confederate%20forces.",
      "https://www.presidency.ucsb.edu/documents/executive-order-general-war-order-no-1",
      "https://quod.lib.umich.edu/j/jala/2629860.0029.205/--lincoln-s-suspension-of-the-writ-of-habeas-corpus?rgn=main;view=fulltext#:~:text=Lincoln's%20power%20to%20suspend%20the,their%20uncertain%20grounding%20in%20the",
      "https://quod.lib.umich.edu/j/jala/2629860.0029.205/--lincoln-s-suspension-of-the-writ-of-habeas-corpus?rgn=main;view=fulltext",
      "https://www.nps.gov/articles/union-command-trouble.htm",
      "https://digitalcommons.georgiasouthern.edu/cgi/viewcontent.cgi?article=1086&context=aujh",
      "https://www.battlefields.org/learn/articles/shermans-march-sea",
      "https://www.georgiaencyclopedia.org/articles/history-archaeology/shermans-march-to-the-sea",
      "https://presidentlincoln.illinois.gov/Blog/Posts/184/Civil-War/2024/5/Lincolns-Critical-Month-April-1861/blog-post",
      "https://www.senate.gov/artandhistory/history/common/civil_war/LincolnEmergencySession_FeaturedDoc.htm"
    ],
    "observation_3": "I've made significant progress in understanding Lincoln's role as Commander-in-Chief. I now have a clearer picture of the political climate leading up to the war, Lincoln's pre-presidency stance on slavery, and the immediate aftermath of his election, including the Southern states' secession. I've also started to gather information on his initial military strategies, such as the Anaconda Plan, and his interactions with key generals like McClellan, Grant, and Sherman.",
    "plan_4": {
      "title": "Refining Key Details\nNext Research Actions",
      "description": "While I have a good overview, I'm focusing on filling in specific details to ensure a comprehensive analysis. For instance, I'm looking for more in-depth information on the decision-making process behind Lincoln's response to Fort Sumter and the subsequent wave of secessions. I also want to understand the long-term effectiveness and evolution of the Anaconda Plan. Regarding his generals, I'm seeking precise dates and reasons for McClellan's removals and explicit confirmation of Lincoln's support for Sherman's March to the Sea. Furthermore, I'm exploring additional examples and constitutional justifications for Lincoln's use of Commander-in-Chief powers beyond the suspension of habeas corpus, and how his overall strategic thinking evolved throughout the war.\nMy next steps will involve targeted searches and deeper dives into existing information to address these specific gaps and provide a more nuanced understanding of Lincoln's wartime leadership."
    },
    "search_4": [
      "https://ndupress.ndu.edu/Media/News/Article/581883/union-success-in-the-civil-war-and-lessons-for-strategic-leaders",
      "https://warroom.armywarcollege.edu/articles/lincoln-as-strategist",
      "https://en.wikipedia.org/wiki/Confederate_States_of_America#:~:text=The%20Civil%20War%20began%20in,seceded%20and%20joined%20the%20Confederacy.",
      "https://www.armyupress.army.mil/Portals/7/educational-services/military-history/CSI_BM_CivilWarPreludeAnalysis.docx",
      "https://www.usni.org/magazines/naval-history-magazine/2021/october/economic-warfare-union-blockade-civil-war",
      "https://www.reddit.com/r/AskHistorians/comments/1sfpbg/how_effective_was_the_anaconda_plan_during_the",
      "https://theimaginativeconservative.org/2021/07/lincolns-uncertain-decision-fort-sumter-1861-bradley-birzer.html",
      "https://press.uchicago.edu/Misc/Chicago/237931in.html",
      "http://www.longwood.edu/fileshare/civilwar150/media/civilwar150-episode25.pdf",
      "https://scholarlycommons.law.northwestern.edu/cgi/viewcontent.cgi?article=1363&context=nulr",
      "https://housedivided.dickinson.edu/sites/lincoln/letter-to-william-sherman-december-26-1864",
      "https://www.smithsonianmag.com/smart-news/general-sherman-offered-savannah-as-a-christmas-gift-to-president-lincoln-the-victory-signaled-the-end-of-his-brutal-march-to-the-sea-180985720",
      "https://encyclopediavirginia.org/primary-documents/order-relieving-general-g-b-mcclellan-and-making-other-changes-by-abraham-lincoln-1862",
      "https://www.battlefields.org/learn/biographies/george-b-mcclellan",
      "https://www.senate.gov/artandhistory/history/common/civil_war/LincolnEmergencySession_FeaturedDoc.htm",
      "https://presidentlincoln.illinois.gov/Blog/Posts/184/Civil-War/2024/5/Lincolns-Critical-Month-April-1861/blog-post"
    ],
    "observation_4": "I've significantly advanced my understanding of Lincoln's strategic decisions and leadership as Commander-in-Chief. I've confirmed that his decision to resupply Fort Sumter was a calculated risk, and the subsequent Confederate attack effectively initiated the war, allowing him to galvanize Northern support and leading to the secession of four more states. I've also gained a clearer picture of the Anaconda Plan's components and its long-term strategic importance, despite initial skepticism. My research has also clarified the issues with General McClellan, including his slowness and overestimation of enemy forces, leading to his removal after Antietam in November 1862. I've also noted the effective partnership between Lincoln and Grant, with Grant's appointment as General-in-Chief in February 1864 marking a crucial turning point. Furthermore, I've confirmed Lincoln's initial anxiety but ultimate acquiescence and praise for Sherman's March to the Sea, demonstrating his trust in his commanders.",
    "plan_5": {
      "title": "Evolving Strategy and Presidential Powers\nNext Research Phase: Union Policy and Emancipation",
      "description": "A key insight is the evolution of Lincoln's military strategy. Initially, his commanders pursued objectives without a unifying strategic goal, but with Grant's appointment in 1864, a comprehensive national strategy emerged, integrating all aspects of U.S. power. I've also gathered more details on Lincoln's exercise of Commander-in-Chief powers, such as the suspension of habeas corpus and the expansion of the army and declaration of a blockade without initial congressional approval. I'm now focusing on ensuring I capture the controversies and legal challenges associated with these actions and how he navigated them.\nMy next step is to examine Lincoln's role in shaping and implementing Union policy, particularly the Emancipation Proclamation. I will research his evolving views on slavery, the motivations behind the Proclamation (military, moral, foreign policy), and its immediate and long-term effects, including its impact on enslaved people, the recruitment of Black soldiers, and international perception. I will also investigate other significant Union policies he implemented, such as conscription and key economic legislation."
    },
    "search_5": [
      "https://www.senate.gov/artandhistory/history/common/generic/PacificRailwayActof1862.htm",
      "https://www.loc.gov/exhibits/african-american-odyssey/reconstruction.html",
      "https://nmaahc.si.edu/explore/stories/emancipation-proclamation-striking-mighty-blow-slavery",
      "https://www.archives.gov/exhibits/featured-documents/emancipation-proclamation",
      "https://library.fiveable.me/united-states-history-1865/unit-11/emancipation-proclamation-impact/study-guide/hVVIUybj2XmBgn2D",
      "https://library.fiveable.me/hs-honors-us-history/unit-7/emancipation-proclamation-impact/study-guide/FrgRKBNYo6BxaNoH",
      "https://www.nps.gov/liho/learn/historyculture/slavery.htm",
      "https://www.loc.gov/collections/abraham-lincoln-papers/articles-and-essays/abraham-lincoln-and-emancipation",
      "https://www.battlefields.org/learn/biographies/george-b-mcclellan",
      "https://press.uchicago.edu/Misc/Chicago/237931in.html"
    ],
    "observation_5": "I've now consolidated and refined the information regarding Lincoln's strategic decisions and leadership as Commander-in-Chief. I have a clear understanding of his response to Fort Sumter, which effectively initiated the war and led to further secessions. I've also detailed his adoption and the long-term effectiveness of the Anaconda Plan. My research has clarified the reasons for General McClellan's repeated removals due to his caution and reluctance to engage, and highlighted the crucial and effective collaboration between Lincoln and Ulysses S. Grant, who became General-in-Chief in 1864. I also understand Lincoln's initial apprehension but ultimate trust in Sherman's March to the Sea. A significant insight is the evolution of Lincoln's overall strategy from an initial focus on preserving the Union to a more comprehensive, relentless approach aimed at destroying the Confederacy's capacity to fight, particularly after Grant's appointment.",
    "plan_6": {
      "title": "Expansion of Presidential Powers\nShaping Union Policy and Emancipation\nNext Research Steps",
      "description": "I've gathered substantial information on how Lincoln expanded presidential war powers, including calling for volunteers, declaring a naval blockade without initial congressional approval, and most notably, the suspension of habeas corpus. I've noted the legal challenges, such as *Ex parte Merryman*, and Lincoln's justification for these extraordinary measures as necessary to preserve the Union. His willingness to directly intervene in military operations, as seen with General War Order No. 1, and his shift in policy regarding guerrilla warfare, also demonstrate his assertive leadership.\nI've begun to delve into Lincoln's role in shaping Union policy, with a particular focus on the Emancipation Proclamation. I understand his evolving views on slavery, moving from a focus on preventing its expansion to recognizing the military and moral necessity of abolition. I've identified the key motivations behind the Proclamation, its immediate effects on enslaved people and the recruitment of Black soldiers, and its long-term impact on the war's aims and international perception. I've also identified other crucial Union policies to research, including conscription, the Homestead Act, the National Banking Act, the Morrill Land-Grant Act, and tariffs, to provide a comprehensive overview of his domestic agenda during the war.\nMy next steps will involve conducting targeted searches to gather detailed information on the remaining Union policies, ensuring a thorough understanding of their purpose and impact, and further refining the nuances of the Emancipation Proclamation's effects."
    },
    "search_6": [
      "https://www.essentialcivilwarcurriculum.com/tariffs-and-the-american-civil-war.html",
      "https://mises.org/mises-daily/lincolns-tariff-war",
      "https://www.history.com/this-day-in-history/march-3/congress-passes-civil-war-conscription-act",
      "https://www.senate.gov/artandhistory/history/common/civil_war/NationalBankActs.htm",
      "https://www.federalreservehistory.org/essays/national-banking-acts",
      "https://www.senate.gov/artandhistory/history/common/civil_war/Homestead_Act.htm",
      "https://www.archives.gov/milestone-documents/homestead-act",
      "https://www.pritzkermilitary.org/explore/museum/past-exhibits/dignity-duty-journals-erasmus-corwin-gilbreath/riots-new-york",
      "https://www.archives.gov/milestone-documents/morrill-act#:~:text=Passed%20on%20July%202%2C%201862,tribal%20lands%20of%20Native%20communities.",
      "https://www.senate.gov/artandhistory/history/common/civil_war/MorrillLandGrantCollegeAct_FeaturedDoc.htm"
    ],
    "observation_6": "I've now thoroughly covered Lincoln's role in shaping and implementing Union policy. This includes a detailed understanding of his evolving stance on slavery, which shifted from prioritizing Union preservation to embracing emancipation as a military and moral imperative. I've also analyzed the Emancipation Proclamation's context, motivations (military, diplomatic, moral), and its immediate and long-term effects, such as the enlistment of Black soldiers, the transformation of war aims, and its influence on the 13th Amendment and international relations.",
    "plan_7": {
      "title": "Key Wartime Legislation\nNext Research Focus: Maintaining Unity and Public Support",
      "description": "Beyond emancipation, I've gathered comprehensive information on other significant Union policies enacted under Lincoln's leadership. These include the controversial Conscription Act of 1863, the Homestead Act of 1862 which promoted westward expansion, the Pacific Railway Act of 1862 for transcontinental connectivity, the National Banking Acts of 1863 and 1864 for financial stability, the Morrill Land-Grant Act of 1862 for higher education, and the Morrill Tariff of 1861 which provided crucial war revenue. This broad range of policies demonstrates Lincoln's comprehensive approach to governing during wartime.\nHaving completed my analysis of Union policies, I will now shift my focus to evaluating Lincoln's efforts to maintain political unity and public support within the Union. This will involve researching how he handled political opposition, his use of executive power to suppress dissent, his communication strategies to rally public support, the challenges to his authority, and his efforts to keep the border states within the Union."
    },
    "search_7": [
      "https://library.fiveable.me/key-terms/apush/lincoln-and-the-border-states#:~:text=Lincoln's%20policies%20towards%20the%20border%20states%20were%20instrumental%20in%20shaping,strategic%20advantages%20for%20the%20Confederacy.",
      "https://library.fiveable.me/key-terms/apush/lincoln-and-the-border-states",
      "https://library.fiveable.me/key-terms/apush/habeas-corpus-suspension#:~:text=The%20suspension%20of%20habeas%20corpus,dangerous%20precedent%20for%20future%20governments.",
      "https://prologue.blogs.archives.gov/2010/11/04/censorship-and-the-c-w",
      "https://personal.tcu.edu/swoodworth/trefousse-rr.htm",
      "https://en.wikipedia.org/wiki/Radical_Republicans#:~:text=After%20the%201860%20elections%2C%20moderate,including%20Radicals%20like%20Salmon%20P.",
      "https://researchrepository.wvu.edu/wvuhistoricalreview/vol2/iss1/7",
      "https://brainly.com/question/55526433#:~:text=President%20Lincoln%20primarily%20relied%20on,policies%20during%20this%20critical%20period.",
      "https://repository.lsu.edu/cgi/viewcontent.cgi?article=2340&context=cwbr",
      "https://www.history.com/this-day-in-history/november-8/lincoln-reelected",
      "https://www.battlefields.org/learn/articles/election-1864-and-soldiers-vote",
      "https://quod.lib.umich.edu/j/jala/2629860.0013.104/--abraham-lincoln-and-the-border-states?rgn=main;view=fulltext",
      "https://www.abrahamlincolnonline.org/lincoln/speeches/corning.htm#:~:text=I%20concede%20that%20the%20class,they%20may%20prevent%20the%20rebellion",
      "https://www.gilderlehrman.org/sites/default/files/inline-pdfs/Hannah%20Teller_Snakes%20Lurking%20in%20the%20Grass_0.pdf",
      "https://www.loc.gov/collections/abraham-lincoln-papers/articles-and-essays/abraham-lincoln-and-emancipation",
      "https://millercenter.org/president/lincoln/campaigns-and-elections",
      "https://encompass.eku.edu/cgi/viewcontent.cgi?article=1027&context=tcj",
      "https://researchrepository.wvu.edu/cgi/viewcontent.cgi?article=1012&context=wvuhistoricalreview",
      "https://quod.lib.umich.edu/j/jala/2629860.0005.103/--lincoln-administration-and-arbitrary-arrests?rgn=main;view=fulltext",
      "https://www.abrahamlincolnonline.org/lincoln/speeches/corning.htm",
      "https://chicagounbound.uchicago.edu/cgi/viewcontent.cgi?referer=&httpsredir=1&article=2953&context=journal_articles",
      "https://digitalcommons.chapman.edu/cgi/viewcontent.cgi?article=1045&context=vocesnovae",
      "https://en.wikipedia.org/wiki/Diplomacy_of_the_American_Civil_War",
      "https://www.napoleon.org/en/history-of-the-two-empires/articles/the-second-empire-and-the-american-civil-war",
      "https://en.wikipedia.org/wiki/Trent_Affair",
      "https://www.essentialcivilwarcurriculum.com/union-and-confederate-diplomacy-during-the-civil-war.html",
      "https://www.thoughtco.com/emancipation-proclamation-was-also-foreign-policy-3310345",
      "https://www.journalofthecivilwarera.org/2017/11/lessons-diplomacy-reassessing-trent-affair",
      "https://www.portal.hsp.org/unit-plan-items/unit-plan-34",
      "https://en.wikipedia.org/wiki/France_and_the_American_Civil_War"
    ],
    "observation_7": "I've begun to research Lincoln's diplomatic strategies during the Civil War, focusing on preventing foreign recognition of the Confederacy and deterring intervention. I've learned about the significance of the Trent Affair in 1861, where Lincoln's pragmatic decision to release Confederate envoys from a British ship averted a potential war with Great Britain. A key insight is how the Emancipation Proclamation, issued later, served as a powerful diplomatic tool, making it morally difficult for European powers, particularly Britain and France, to support the slaveholding Confederacy.",
    "plan_8": {
      "title": "Information Gaps in Diplomacy\nNext Research Actions",
      "description": "While I have a good overview, I need to delve deeper into the specific motivations and hesitations of Great Britain and France regarding intervention. This includes understanding their economic and political interests, such as Britain's reliance on Northern grain and its own anti-slavery sentiments, and how these factors influenced their neutrality. I also need to investigate how Lincoln's administration countered the Confederacy's 'King Cotton Diplomacy' and whether there were other significant diplomatic incidents or ongoing negotiations beyond the Trent Affair. Finally, I will explore how French intervention in Mexico intersected with U.S. Civil War diplomacy.\nMy next steps will involve targeted searches to fill these identified gaps in Lincoln's diplomatic strategies and interactions with foreign powers. After this, I will move on to researching his efforts to maintain political unity and public support within the Union."
    },
    "search_8": [
      "https://www.nps.gov/articles/000/general-grant-and-the-fight-to-remove-emperor-maximilian-from-mexico.htm",
      "https://lincolnandmexicoproject.wordpress.com/2016/12/05/lincoln-helped-mexico-defeat-the-french",
      "https://www.tandfonline.com/doi/full/10.1080/09592296.2020.1721059",
      "https://en.wikipedia.org/wiki/Cotton_diplomacy",
      "https://en.wikipedia.org/wiki/Non-intervention_in_the_Spanish_Civil_War",
      "https://www.chegg.com/homework-help/questions-and-answers/initially-confederacy-sought-king-cotton-diplomacy-strategy-based-belief-raising-price-cot-q215200665",
      "https://library.unr.edu/places/knowledge-center/basque-library/projects/gernika/the-bombing-of-gernika/non-intervention-committee",
      "https://online.ucpress.edu/currenthistory/article-pdf/49/3/26/663986/curh.1938.49.3.26.pdf",
      "https://www.senate.gov/artandhistory/history/common/civil_war/TrentAffair_FeaturedDoc.htm",
      "https://history.state.gov/milestones/1861-1865/trent-affair"
    ],
    "observation_8": "I've made significant progress in understanding Lincoln's diplomatic strategies during the Civil War. I've confirmed that his primary goals were to prevent foreign recognition of the Confederacy and deter intervention, particularly from Great Britain and France. The Trent Affair in 1861 highlighted his pragmatic approach, as he prioritized avoiding war with Britain by releasing Confederate envoys, even against public sentiment. A crucial insight is the Emancipation Proclamation's profound impact on international relations; it transformed the war into a moral crusade against slavery, making it politically and morally untenable for European powers to support the Confederacy.",
    "plan_9": {
      "title": "Addressing Diplomatic Gaps\nNext Research Focus",
      "description": "While I have a solid foundation, I'm now focusing on filling specific gaps to provide a more comprehensive analysis of Lincoln's diplomacy. I need to understand the precise economic and political motivations that influenced Great Britain and France's decisions regarding intervention, including Britain's reliance on Northern grain and its domestic anti-slavery movement. I also need to investigate how Lincoln's administration countered the Confederacy's 'King Cotton Diplomacy' and explore any other notable diplomatic incidents or ongoing negotiations beyond the Trent Affair. Finally, I will examine the intersection of French imperial ambitions in Mexico with U.S. Civil War diplomacy.\nMy next steps will involve targeted searches to gather detailed information on these remaining diplomatic aspects. Once this is complete, I will shift my focus to Lincoln's efforts to maintain political unity and public support within the Union."
    },
    "search_9": [
      "https://www.nps.gov/articles/000/general-grant-and-the-fight-to-remove-emperor-maximilian-from-mexico.htm",
      "https://lincolnandmexicoproject.wordpress.com/2016/12/05/lincoln-helped-mexico-defeat-the-french",
      "https://www.tandfonline.com/doi/full/10.1080/09592296.2020.1721059",
      "https://en.wikipedia.org/wiki/Non-intervention_in_the_Spanish_Civil_War",
      "https://library.unr.edu/places/knowledge-center/basque-library/projects/gernika/the-bombing-of-gernika/non-intervention-committee",
      "https://online.ucpress.edu/currenthistory/article-pdf/49/3/26/663986/curh.1938.49.3.26.pdf",
      "https://en.wikipedia.org/wiki/Cotton_diplomacy",
      "https://www.gauthmath.com/solution/1818162008805573/Initially-the-Confederacy-pursued-King-Cotton-diplomacy-a-strategy-based-on-the-",
      "https://history.state.gov/milestones/1861-1865/trent-affair",
      "https://www.reddit.com/r/AskHistorians/comments/336rh7/did_the_united_kingdom_ever_consider_intervening"
    ],
    "observation_9": "I've now thoroughly researched Lincoln's diplomatic strategies during the Civil War. I've confirmed that preventing foreign recognition of the Confederacy and deterring intervention from powers like Great Britain and France were paramount. The Trent Affair demonstrated Lincoln's pragmatic leadership in averting conflict with Britain, while the Emancipation Proclamation proved to be a masterstroke, shifting international opinion against the Confederacy by framing the war as a fight against slavery. This made it morally difficult for European nations to support the South.",
    "plan_10": {
      "title": "Key Diplomatic Successes\nNext Research Focus: Reconstruction Plans",
      "description": "My research has highlighted several key factors that contributed to the Union's diplomatic success. Britain's economic reliance on Northern grain, coupled with its strong anti-slavery public sentiment, ultimately outweighed its initial sympathy for the Confederacy and its need for cotton. The Confederacy's 'King Cotton Diplomacy' largely failed as Britain and France found alternative cotton sources and had existing stockpiles. Another significant victory was the Laird Rams Affair, where the Union successfully pressured Britain to prevent the sale of powerful ironclad warships to the Confederacy, avoiding a major escalation. While France, under Napoleon III, had ambitions in Mexico, it was unwilling to intervene without British support, and Lincoln's administration consistently signaled its long-term opposition to French presence in Mexico, even while preoccupied with the Civil War.\nHaving completed my analysis of Lincoln's diplomatic efforts, I will now shift my focus to his vision and plans for Reconstruction and the post-war reunification of the country. This will involve researching his '10 Percent Plan,' his views on the status of seceded states, his approach to pardons and loyalty oaths, his stance on Black suffrage and rights, and how his plans differed from those of the Radical Republicans. I will also explore his overarching philosophy of reconciliation."
    },
    "search_10": [
      "https://library.fiveable.me/key-terms/apush/proclamation-of-amnesty-and-reconstruction",
      "https://www.archives.gov/milestone-documents/wade-davis-bill",
      "https://www.americanbar.org/groups/dispute_resolution/resources/magazine/2024-september/lincolns-vision-reconciliation-all-americans/#:~:text=Lincoln's%20second%20inaugural%20address%20called,more%20just%20and%20unified%20nation.",
      "https://www.nps.gov/liho/learn/historyculture/secessiontableofcontents.htm",
      "https://www.pbs.org/wgbh/americanexperience/features/reconstruction-timeline",
      "https://civilwaronthewesternborder.org/encyclopedia/lincoln-abraham",
      "https://www.niskanencenter.org/abraham-lincoln-as-a-pragmatist-and-peacemaker-with-john-avalon",
      "https://en.wikipedia.org/wiki/Ten_percent_plan#:~:text=A%20component%20of%20President%20Lincoln's,the%20U.S.%20and%20pledged%20to",
      "https://library.fiveable.me/key-terms/apush/congress-and-wade-davis-reconstruction",
      "https://www.lincolncottage.org/first-civil-rights-act-1866",
      "https://www.rbhayes.org/hayes/lincoln-s-evolving-racial-views",
      "https://en.wikipedia.org/wiki/Reconstruction_era#:~:text=Radical%20and%20moderate%20Republicans%20disagreed,proposed%20strict%20conditions%20for%20readmission.",
      "https://en.wikipedia.org/wiki/Ten_percent_plan#:~:text=Most%20moderate%20Republicans%20in%20Congress,re%2Denslavement%20or%20systemic%20oppression.",
      "https://courses.lumenlearning.com/wm-ushistory1/chapter/lincolns-plan",
      "https://library.fiveable.me/key-terms/apush/lincolns-ten-percent-plan",
      "https://www.nps.gov/liho/learn/historyculture/slavery.htm",
      "https://en.wikipedia.org/wiki/Abraham_Lincoln_and_slavery",
      "https://www.digitalhistory.uh.edu/disp_textbook.cfm?smtID=2&psid=3096",
      "https://presidentlincoln.illinois.gov/Resources/8cbe6700-ce47-4ff8-a5d8-7fda74b05c64/gettysburg-address-lessons.pdf",
      "https://news.stthomas.edu/publication-article/the-power-of-brevity",
      "https://www.nps.gov/articles/000/-with-malice-toward-none-lincoln-s-second-inaugural.htm",
      "https://en.wikipedia.org/wiki/Abraham_Lincoln%27s_second_inaugural_address",
      "https://www.ebsco.com/research-starters/history/gettysburg-address",
      "https://cptl.asu.edu/gettysburg-address"
    ],
    "observation_10": "I've now gathered comprehensive information on the impact and significance of Lincoln's major speeches and writings during the war. The Gettysburg Address, delivered in November 1863, was a pivotal moment, redefining the war's purpose from merely preserving the Union to also achieving human equality and freedom, encapsulated in its call for a 'new birth of freedom' and 'government of the people, by the people, for the people.' His Second Inaugural Address in March 1865, delivered as victory was imminent, offered a profound theological reflection on the war, acknowledging slavery as its undeniable cause and calling for national reconciliation 'with malice toward none, with charity for all.' Both speeches are considered masterpieces of American rhetoric, showcasing his brevity, clarity, and powerful use of language.",
    "plan_11": {
      "title": "Connecting Speeches to Broader Themes\nNext Research Focus: Post-War Reconstruction",
      "description": "While the policy impact of the Emancipation Proclamation was covered earlier, I'm now considering its significance as a foundational document in terms of its language and symbolic power, further solidifying the war's moral dimension. Similarly, his 'House Divided' speech, though pre-war, can be highlighted here for its prophetic nature and rhetorical force in framing the national conflict. I'm also looking to briefly identify any other significant writings or letters that exemplify his communication style and influence on public opinion.\nMy next step is to perform targeted searches to ensure I capture the full rhetorical and literary significance of these documents, including any other notable writings or letters. Following this, I will move on to analyze Lincoln's vision and plans for Reconstruction and the post-war reunification of the country."
    },
    "search_11": [
      "https://www.cram.com/essay/Rhetorical-Analysis-Of-A-House-Divided-Address/FJSJ8P9QWT",
      "https://www.owleyes.org/text/house-divided-speech/analysis/rhetorical-devices",
      "https://library.fiveable.me/key-terms/united-states-history-1865/letter-to-horace-greeley",
      "https://presidentlincoln.illinois.gov/exhibits/online-exhibits/emancipationproclamation",
      "https://www.ebsco.com/research-starters/history/analysis-exchange-letters-between-horace-greeley-and-abraham-lincoln",
      "https://www.archives.gov/exhibits/featured-documents/emancipation-proclamation"
    ]
  },
  "final_report": "# **Abraham Lincoln's Transformative Leadership During the American Civil War**\n\n## **I. Introduction: Lincoln's Ascent and the Nation Divided**\n\nThe American Civil War, a watershed moment in the nation's history, was fundamentally shaped by the leadership of Abraham Lincoln. His presidency, commencing amidst an unprecedented national crisis, navigated the complex interplay of political ideologies, military exigencies, and profound social transformations. Understanding Lincoln's pivotal role necessitates a comprehensive analysis of his pre-war political evolution, his strategic responses to secession, his command of the Union war effort, his evolving stance on slavery, his domestic policies, and his diplomatic engagements, culminating in his vision for national reconciliation.\n\n### **Pre-War Political Landscape: Slavery, States' Rights, and Sectionalism**\n\nThe 1850s witnessed an escalating polarization of the United States, primarily driven by starkly divergent regional identities concerning the expansion of slavery into western territories. The Southern states maintained a pro-slavery identity, advocating vigorously for the institution's westward spread, while the Northern states increasingly harbored abolitionist sentiments and opposed such expansion @https://cwnc.omeka.chass.ncsu.edu/exhibits/show/benjamin-hedrick/polticalclimate>  This fundamental disagreement over slavery was the central force behind the growing sectionalism.\n\nThe political philosophy of \"states' rights,\" frequently invoked as a primary justification for secession, was, in practice, a flexible and often opportunistic argument employed by both Northern and Southern politicians to advance their sectional interests @https://encyclopediavirginia.org/entries/states-rights/>  Southern leaders, particularly the \"fire-eating\" Democrats of the Deep South, exhibited a pragmatic inconsistency: they readily acquiesced to federal power when it protected slavery, such as through the Fugitive Slave Act, but vehemently asserted states' rights when federal attempts to regulate or limit slavery's spread into new territories were questioned @https://cwnc.omeka.chass.ncsu.edu/exhibits/show/benjamin-hedrick/polticalclimate>  This demonstrates that the preservation and expansion of slavery, rather than abstract constitutional principles, remained the paramount concern for Southern politicians. The opportunistic application of \"states' rights\" by Southern politicians, who prioritized the protection and expansion of slavery, underscores that this constitutional argument served as a strategic means to an end, rather than the ultimate cause of the conflict. The underlying economic and social imperative of slavery consistently drove Southern political actions, even when it meant contradicting their own stated principles of limited federal power.\n\nEarlier legislative attempts to manage the slavery issue, such as the Missouri Compromise of 1820, had sought to maintain a delicate balance by prohibiting slavery in parts of the Louisiana Territory @https://cwnc.omeka.chass.ncsu.edu/exhibits/show/benjamin-hedrick/polticalclimate>  However, the acquisition of vast new lands following the Mexican War (1846–1848) reignited these deep-seated tensions, as the question of whether and how slavery would spread to these new territories became paramount @https://encyclopediavirginia.org/entries/states-rights/>  This led to the Compromise of 1850, which, while admitting California as a free state and abolishing the slave trade in Washington D.C., included provisions like a tougher Fugitive Slave Act and \"popular sovereignty\" for the New Mexico and Utah territories, allowing residents to decide on slavery @https://cwnc.omeka.chass.ncsu.edu/exhibits/show/benjamin-hedrick/polticalclimate>  The subsequent Kansas-Nebraska Act of 1854, championed by Illinois Senator Stephen A. Douglas, further extended popular sovereignty, effectively repealing the Missouri Compromise and exacerbating the North-South divide, pushing the nation closer to civil conflict @https://cwnc.omeka.chass.ncsu.edu/exhibits/show/benjamin-hedrick/polticalclimate> \n\n### **Lincoln's Early Political Career and Anti-Slavery Stance**\n\nAbraham Lincoln's trajectory from humble beginnings in Kentucky to national prominence was marked by self-education and a burgeoning legal and political career in Illinois @https://en.wikipedia.org/wiki/Abraham_Lincoln>  He served as an Illinois state legislator and later as a U.S. representative @https://en.wikipedia.org/wiki/Abraham_Lincoln> \n\nEarly in his political life, elected as a Whig in 1834, Lincoln publicly denounced slavery as \"founded on both injustice and bad policy\" @https://www.nps.gov/liho/learn/historyculture/political.htm#:~:text=Pre%2DPresidential%20Political%20Career%201830%2D1860&text=In%201834%20he%20was%20elected,Springfield%2C%20the%20new%20State%20capital.>  However, he initially opposed the proliferation of abolition societies, indicating a more cautious approach to the immediate eradication of slavery. He also supported the American Colonization Society, a Whig-favored initiative that advocated for the abolition of slavery in conjunction with the resettlement of freed slaves in Liberia @https://en.wikipedia.org/wiki/Abraham_Lincoln>  During his time in the Illinois House of Representatives, Lincoln championed economic modernization through internal improvements, such as the Illinois and Michigan Canal, and supported expanding suffrage to all white men @https://en.wikipedia.org/wiki/Abraham_Lincoln>  As the sole Whig in the Illinois delegation to the U.S. House in 1846, he aligned himself with the Wilmot Proviso, a failed proposal to ban slavery in any territory acquired from Mexico @https://en.wikipedia.org/wiki/Abraham_Lincoln>  He also critically questioned President James K. Polk's motives for the Mexican-American War @https://en.wikipedia.org/wiki/Abraham_Lincoln> \n\nThe Kansas-Nebraska Act of 1854, which controversially opened new territories to slavery, proved to be a pivotal moment for Lincoln. Angered by this legislation, he emerged as a prominent leader of the newly formed Republican Party, which was founded largely in opposition to the expansion of slavery @https://cla.purdue.edu/academic/history/debate/lincolndouglas/LincolnDouglas.html>  Lincoln's early political journey reveals a consistent moral opposition to slavery, yet his tactical approach to its abolition was markedly pragmatic. His initial reluctance to embrace immediate abolitionism and his support for colonization reflected a strategic understanding of the political landscape, aiming for gradual change while prioritizing the prevention of slavery's expansion. This adaptability in his methods, driven by his core conviction, allowed him to emerge as a national leader within the Republican Party, which was singularly focused on containing the institution.\n\n### **The Lincoln-Douglas Debates and \"House Divided\" Speech**\n\nThe 1858 debates between Abraham Lincoln and Stephen A. Douglas for the Illinois Senate seat were not merely a local contest but a nationally significant political event that propelled Lincoln into the national spotlight @https://cla.purdue.edu/academic/history/debate/lincolndouglas/LincolnDouglas.html>  These debates unfolded against a backdrop of intense national tensions, exacerbated by the Supreme Court's 1857 Dred Scott decision, which ruled that slaves were property and not citizens, and the controversial Kansas-Nebraska Act @https://cla.purdue.edu/academic/history/debate/lincolndouglas/LincolnDouglas.html> \n\nDuring these debates, Lincoln delivered his iconic \"House Divided\" speech, famously asserting, \"I believe this government cannot endure permanently half Slave and half Free\" @https://www.ebsco.com/research-starters/history/analysis-lincolns-house-divided-speech>  This powerful biblical metaphor, drawing from Matthew 12:25 and Mark 3:25, underscored the inherent instability of a nation fundamentally divided over slavery and framed the conflict as an existential threat to the principles of self-government and democracy @https://www.ebsco.com/research-starters/history/analysis-lincolns-house-divided-speech>  Douglas, the incumbent, advocated for \"popular sovereignty,\" arguing that the power to permit or prohibit slavery in territories should reside with the settlers themselves, reflecting his belief in local control @https://cla.purdue.edu/academic/history/debate/lincolndouglas/LincolnDouglas.html>  Lincoln, however, viewed the combined effects of the Kansas-Nebraska Act and the Dred Scott decision as a dangerous extension of slavery, which he passionately condemned as an \"unnecessary evil\" @https://cla.purdue.edu/academic/history/debate/lincolndouglas/LincolnDouglas.html> \n\nThe debates were characterized by sharp accusations: Douglas labeled Lincoln an abolitionist, while Lincoln countered by accusing Douglas of seeking to nationalize slavery @https://cla.purdue.edu/academic/history/debate/lincolndouglas/LincolnDouglas.html>  Despite his personal opposition to slavery, Lincoln reiterated his support for a \"free-soil platform,\" aiming to prevent the spread of slavery into new territories rather than advocating for immediate emancipation, in an effort to avert a war between free and slave states @https://www.battlefields.org/learn/articles/lincoln-douglas-debates>  He acknowledged slaves as humans deserving of fundamental rights like \"life, liberty, and the pursuit of happiness,\" but interpreted this primarily as the right not to be enslaved, not necessarily the right to full citizenship, and maintained a belief in the \"superior position assigned to the white race\" @https://www.battlefields.org/learn/articles/lincoln-douglas-debates>  Douglas, while also believing in the inferiority of African Americans, did not necessarily equate this with a right to enslavement and, unlike Lincoln, did not view slavery as a moral issue that would inevitably tear the Union apart @https://www.battlefields.org/learn/articles/lincoln-douglas-debates> \n\nAlthough Douglas ultimately won the Senate seat, the widespread attention garnered by the debates and Lincoln's compelling performance significantly elevated his national reputation, directly leading to his nomination as the Republican presidential candidate in 1860 @https://cla.purdue.edu/academic/history/debate/lincolndouglas/LincolnDouglas.html>  Douglas's \"Freeport Doctrine\" during the debates, which attempted to reconcile popular sovereignty with the Dred Scott decision, further alienated him from the Southern wing of the Democratic Party @https://www.battlefields.org/learn/articles/lincoln-douglas-debates>  The \"House Divided\" speech was a deliberate strategic maneuver, designed not only to articulate Lincoln's principled opposition to slavery's expansion but also to forge unity within the Republican Party. By casting the national division in such stark, existential terms, Lincoln effectively elevated a regional political contest into a national referendum on the future of slavery and the very survival of the Union. The speech's powerful rhetoric, though not immediately securing him the Senate seat, significantly amplified his national visibility and prepared the public for the profound choices that lay ahead, even as he publicly sought to avoid armed conflict.\n\n### **The Election of 1860 and Southern Secession**\n\nThe 1860 presidential election was a fractured four-way contest, with the primary sectional division centered on the contentious issue of extending slavery into the western territories @https://en.wikipedia.org/wiki/1860_United_States_presidential_election>  Abraham Lincoln, a relatively less-known figure on the national stage, secured the Republican nomination, partly due to his consistent anti-slavery expansion stance and his support for protectionist tariffs, which appealed to key Northern industrial states like Pennsylvania @https://mises.org/mises-daily/lincolns-tariff-war> \n\nLincoln's victory was achieved with an electoral majority derived exclusively from Northern states where slavery had already been abolished. He received no popular votes in ten Southern states, as the Republican Party lacked a presence there @https://en.wikipedia.org/wiki/1860_United_States_presidential_election>  His national popular vote plurality of 39 @https://www.battlefields.org/learn/articles/lincoln-douglas-debates> % was, notably, one of the lowest for any winning presidential candidate in U.S. history @https://en.wikipedia.org/wiki/1860_United_States_presidential_election> \n\nLincoln's election served as the \"main catalyst for Southern secession\" @https://en.wikipedia.org/wiki/1860_United_States_presidential_election>  In the immediate aftermath, seven Southern states, all of which had voted for Southern Democratic candidate John C. Breckinridge, declared their secession from the Union even before Lincoln's inauguration in March 1861 @https://en.wikipedia.org/wiki/1860_United_States_presidential_election>  South Carolina's Declaration of Secession explicitly articulated the perceived threat, citing \"an increasing hostility on the part of the non-slaveholding states to the institution of slavery\" and the election of a president \"whose opinions and purposes are hostile to slavery\" as the direct reasons for their departure @https://constitutioncenter.org/the-constitution/historic-document-library/detail/south-carolina-declaration-of-secession-1860>  Southern leaders viewed Lincoln's ascendancy as an existential threat to their \"power of self-government\" and feared that the federal government would initiate a \"war against slavery until it shall cease throughout the United States\" @https://constitutioncenter.org/the-constitution/historic-document-library/detail/south-carolina-declaration-of-secession-1860>  Lincoln's election, while serving as the immediate trigger for Southern secession, must be understood as the culmination of decades of escalating sectional tensions over slavery and states' rights. His victory, achieved without Southern electoral support, confirmed the fears of a permanent political minority and an existential threat to the institution of slavery, which Southern leaders saw embodied in his anti-expansionist platform. This suggests that the election was not the singular cause but the decisive event that fractured a nation already teetering on the brink of conflict due to deep-seated structural divisions.\n\n**Table 1: Key Pre-War Legislation and Their Impact on Sectionalism**\n\n| Legislation/Event | Year(s) | Key Provisions/Outcome | Impact on Sectionalism |\n| --- | --- | --- | --- |\n| Missouri Compromise | 1820 | Prohibited slavery north of 36°30' in Louisiana Territory (except Missouri) | Temporarily defused tensions but revealed deep fissures between North and South @https://cwnc.omeka.chass.ncsu.edu/exhibits/show/benjamin-hedrick/polticalclimate>  |\n| Mexican War | 1846–1848 | Gained approximately 500,000 sq miles of western land (California, Nevada, Utah, parts of CO, AZ, NM, WY) | Reignited intense debate over whether and how slavery would spread to new territories @https://encyclopediavirginia.org/entries/states-rights/>  |\n| Compromise of 1850 | 1850 | Admitted California as free state; abolished slave trade in Washington D.C.; passed new Fugitive Slave Act; popular sovereignty in New Mexico/Utah territories | Temporary truce but deepened North-South divide, Southern leaders abandoned states' rights when it protected slavery @https://cwnc.omeka.chass.ncsu.edu/exhibits/show/benjamin-hedrick/polticalclimate>  |\n| Kansas-Nebraska Act | 1854 | Applied popular sovereignty to Kansas and Nebraska territories, effectively repealing Missouri Compromise | Intensified conflict, led to \"Bleeding Kansas\" as pro- and anti-slavery forces clashed; deepened gulf between North and South, leading to formation of Republican Party @https://cwnc.omeka.chass.ncsu.edu/exhibits/show/benjamin-hedrick/polticalclimate>  |\n| Dred Scott Decision | 1857 | Supreme Court ruled slaves were property, not citizens; denied Black people rights; nullified popular sovereignty | Further inflamed tensions, seen by Northerners as a declaration of war on their ideals, contributed to political breakdown @https://cla.purdue.edu/academic/history/debate/lincolndouglas/LincolnDouglas.html>  |\n| Lincoln's Election | 1860 | Republican Abraham Lincoln elected president with electoral majority only from Northern states | Directly triggered Southern secession, as Southern states viewed his anti-slavery platform as an existential threat to their institution and way of life @https://en.wikipedia.org/wiki/1860_United_States_presidential_election>  |\n\n## **II. Preserving the Union: Initial Responses and Challenges**\n\n### **Lincoln's Stance Against Secession and the Fort Sumter Crisis**\n\nUpon his inauguration in March 1861, Lincoln faced an unprecedented crisis: seven Southern states had already declared their secession from the Union @https://en.wikipedia.org/wiki/1860_United_States_presidential_election>  Lincoln held an unwavering belief that secession was unconstitutional. He argued that states could not physically separate, that allowing secession would inevitably lead to anarchy, and that it would ultimately destroy the world's only existing democracy, thereby extinguishing the hope for self-government globally @https://www.nps.gov/liho/learn/historyculture/secessiontableofcontents.htm>  He viewed the preservation of the Union as a \"simple duty\" explicitly mandated by his presidential oath and the Constitution @https://www.gilderlehrman.org/history-resources/spotlight-primary-source/president-lincolns-first-inaugural-address-1861> \n\nThe situation at Fort Sumter, a federal outpost in Charleston Harbor, presented Lincoln with a profound \"no-win decision\" @http://civilwar150.longwood.edu,  Abandoning the fort would be a humiliating concession, emboldening secessionists and undermining federal authority @http://civilwar150.longwood.edu,  Conversely, resupplying it carried an \"excellent chance that immediate civil war would be the result\" @http://civilwar150.longwood.edu,  His cabinet was deeply divided, with some advocating for military action and others, notably Secretary of State William Seward, pushing for peace and evacuation @https://theimaginativeconservative.org/2021/07/lincolns-uncertain-decision-fort-sumter-1861-bradley-birzer.html> \n\nDespite the risks and internal dissent, Lincoln ultimately decided to resupply Fort Sumter. He framed this decision not as an act of aggression, but as an obvious and stated purpose of the Union: to hold, occupy, and possess federal property and collect duties @https://theimaginativeconservative.org/2021/07/lincolns-uncertain-decision-fort-sumter-1861-bradley-birzer.html>  He explicitly stated his intention to avoid bloodshed or violence \"unless it be forced upon the national authority\" @https://theimaginativeconservative.org/2021/07/lincolns-uncertain-decision-fort-sumter-1861-bradley-birzer.html>  This decision was a highly calculated strategic maneuver. By refusing to abandon the fort, Lincoln upheld the Union's claim to federal property and sovereignty, thereby denying legitimacy to the act of secession @https://www.nps.gov/liho/learn/historyculture/secessiontableofcontents.htm>  Crucially, by ensuring the Confederacy fired the first shot, Lincoln successfully shifted the moral and political high ground to the Union side. This act portrayed the South as the aggressor, which was vital for unifying Northern sentiment and justifying the subsequent invocation of executive war powers and military mobilization @https://www.senate.gov/artandhistory/history/common/civil_war/LincolnEmergencySession_FeaturedDoc.htm>  This move, while initiating the conflict, was a strategic masterstroke that solidified the Union's narrative and provided the necessary public and constitutional basis for a full-scale military response. The Confederate attack on Fort Sumter on April 12, 1861, served as the decisive act that transformed the secession crisis into an open armed rebellion, initiating the Civil War @https://en.wikipedia.org/wiki/1860_United_States_presidential_election> \n\n### **Mobilization and the Call for Troops**\n\nIn the immediate aftermath of the attack on Fort Sumter, just three days later on April 15, 1861, President Lincoln issued a proclamation calling forth the state militias, totaling 75,000 troops, \"to suppress the rebellion\" @https://www.senate.gov/artandhistory/history/common/civil_war/LincolnEmergencySession_FeaturedDoc.htm>  This call was met with an \"extraordinary\" and \"remarkable uprising of a great people,\" demonstrating widespread loyalty in the Northern states @https://www.senate.gov/artandhistory/history/common/civil_war/LincolnEmergencySession_FeaturedDoc.htm> \n\nThis initial force, combined with the standing 16,000 officers and men of the \"regular army,\" formed the foundational core of what would become the Union Army, eventually numbering approximately a million soldiers by the war's conclusion @https://presidentlincoln.illinois.gov/Blog/Posts/184/Civil-War/2024/5/Lincolns-Critical-Month-April-1861/blog-post/>  Lincoln also took the significant step of summoning Congress to return for an extraordinary session on July 4, 1861, emphasizing the urgency \"to consider, and determine, such measures as, in their wisdom, the public safety, and interest, may seem to demand\" @https://www.senate.gov/artandhistory/history/common/civil_war/LincolnEmergencySession_FeaturedDoc.htm>  Lincoln's initial call for 75,000 volunteers strongly suggests an early belief, shared by many, that the rebellion would be a limited affair, quickly suppressed @https://civilwaronthewesternborder.org/encyclopedia/lincoln-abraham>  However, the overwhelming public response, with twice the needed number of volunteers 24, and the subsequent necessity of building a Union Army of a million soldiers 22, reveal a significant miscalculation of the war's true magnitude on both sides @https://civilwaronthewesternborder.org/encyclopedia/lincoln-abraham>  This disparity between initial expectations and the grim reality of a prolonged, total war highlights Lincoln's rapid adaptation from a limited law enforcement action to a full-scale national conflict. It demonstrates his pragmatic leadership in swiftly escalating the Union's response in the face of unforeseen and unprecedented challenges.\n\n### **The Critical Role of the Border States**\n\nA paramount concern for Lincoln was retaining the loyalty of the slave-holding border states: Missouri, Kentucky, Maryland, and Delaware @http://civilwar150.longwood.edu,  These states were strategically indispensable, providing vital military and economic resources to the Union @https://library.fiveable.me/key-terms/apush/lincoln-and-the-border-states>  Maryland was particularly critical as it served as the direct access corridor to Washington, D.C., necessitating its secure control @https://civilwaronthewesternborder.org/encyclopedia/lincoln-abraham>  Kentucky's adherence to the Union was crucial for controlling access to the Ohio River, while Missouri protected key transits along the Mississippi and Missouri Rivers @https://civilwaronthewesternborder.org/encyclopedia/lincoln-abraham> \n\nLincoln adopted a highly cautious and nuanced approach regarding these states, carefully balancing his personal moral opposition to slavery with the overriding political and military necessity of preventing their secession @https://library.fiveable.me/key-terms/apush/lincoln-and-the-border-states>  He initially avoided federally imposed emancipation, believing that the authority to abolish involuntary servitude resided with the individual states, not the federal government @https://civilwaronthewesternborder.org/encyclopedia/lincoln-abraham>  He actively attempted to persuade border states to voluntarily adopt gradual, compensated emancipation, even drafting a pilot bill for Delaware, which had a small slave population @https://civilwaronthewesternborder.org/encyclopedia/lincoln-abraham>  To prevent alienation, Lincoln even revoked emancipation edicts issued by Union generals (such as Frémont in Missouri and Hunter in the Department of the South) who had overstepped their authority in freeing slaves @https://www.loc.gov/collections/abraham-lincoln-papers/articles-and-essays/abraham-lincoln-and-emancipation/>  Despite his persistent appeals, the border states largely resisted compensated emancipation, and Congress proved unwilling to fund such a plan @https://civilwaronthewesternborder.org/encyclopedia/lincoln-abraham> \n\nLincoln's exceptionally cautious policy toward the border states reveals a sophisticated understanding of strategic necessity that, for a time, superseded his immediate moral impulses regarding slavery. His willingness to tolerate slavery in these crucial states and even overturn his generals' emancipation orders demonstrates a pragmatic prioritization: the physical preservation of the Union was the *sine qua non* for any future moral progress. Losing these states would have severely weakened the Union's strategic position, potentially making Washington D.C. indefensible and providing the Confederacy with significant advantages. This highlights Lincoln's remarkable ability to compartmentalize his personal anti-slavery sentiments from his immediate wartime objective, recognizing that a premature or aggressive emancipation policy could fracture the Union further, making ultimate victory impossible. It underscores the delicate and often difficult balance he maintained between deeply held moral principles and military/political expediency.\n\n## **III. Commander-in-Chief: Shaping Union Military Strategy**\n\n### **Defining Presidential War Powers**\n\nThe U.S. Constitution's designation of the President as \"commander in chief\" created an \"awkward and undefined area of presidential prerogative,\" particularly in times of national crisis @https://cupola.gettysburg.edu/cwfac/53/>  Abraham Lincoln, as the first president to confront a full-scale civil war, developed an expansive presidential \"war powers\" doctrine. This doctrine was rooted in his presidential oath to \"preserve, protect and defend\" the Constitution, the \"republican guarantee\" clause, and the sheer necessity imposed by the unprecedented nature of a civil war @https://www.gilderlehrman.org/history-resources/spotlight-primary-source/president-lincolns-first-inaugural-address-1861> \n\nLincoln believed his actions were constitutionally justifiable in a rebellion, asserting his authority to act unilaterally when the country was attacked @https://press.uchicago.edu/Misc/Chicago/237931in.html>  In the immediate aftermath of Fort Sumter, he took decisive executive actions without prior congressional approval, including calling up militia forces, expanding the regular army, declaring a blockade on Southern ports, and suspending habeas corpus @https://press.uchicago.edu/Misc/Chicago/237931in.html>  The aggressive and, at times, unprecedented expansion of executive power by Lincoln is clearly evident. His justification for actions like suspending habeas corpus or initiating military action without initial congressional approval stemmed from a profound belief that the survival of the nation in an existential crisis superseded normal constitutional procedures. Without Lincoln's assertive use of his powers, the Confederacy would have won the war by default @https://press.uchicago.edu/Misc/Chicago/237931in.html>  This demonstrates Lincoln's pragmatic and decisive leadership; he was willing to push the boundaries of constitutional authority to preserve the Union, even at the risk of being labeled a \"dictator\" by his critics @https://scholarlycommons.law.northwestern.edu/cgi/viewcontent.cgi?article=1363&context=nulr>  This highlights a foundational principle of his wartime leadership: the Union's existence was the ultimate constitutional value, and extraordinary measures were justified to secure it.\n\n### **The Anaconda Plan: Conception, Implementation, and Effectiveness**\n\nEarly in the war, Lincoln adopted the \"Anaconda Plan,\" a strategic proposal advised by General Winfield Scott, the veteran commander of U.S. forces @https://presidentlincoln.illinois.gov/Blog/Posts/184/Civil-War/2024/5/Lincolns-Critical-Month-April-1861/blog-post/>  The plan's core objective was to \"strangle the seceded states like a great snake\" by imposing a comprehensive coastal blockade and seizing control of the Mississippi River. Following this economic and logistical weakening, a large force of U.S. troops would \"penetrate and occupy the economically weakened Confederacy\" @https://presidentlincoln.illinois.gov/Blog/Posts/184/Civil-War/2024/5/Lincolns-Critical-Month-April-1861/blog-post/> \n\nLincoln swiftly enacted key components of the Anaconda Plan using his executive power immediately after the Fort Sumter attack. This involved issuing proclamations for 75,000 volunteers and, four days later, declaring a blockade of the rebelling states @https://presidentlincoln.illinois.gov/Blog/Posts/184/Civil-War/2024/5/Lincolns-Critical-Month-April-1861/blog-post/>  The blockade, however, faced initial challenges and controversy. Lincoln's refusal to recognize the Confederacy as an independent nation created a \"thorny situation\" as he was effectively blocking trade with a part of his own country @https://presidentlincoln.illinois.gov/Blog/Posts/184/Civil-War/2024/5/Lincolns-Critical-Month-April-1861/blog-post/>  Furthermore, the U.S. Navy in 1861 was not large enough to fully enforce the blockade, rendering it an initial \"paper blockade\" @https://presidentlincoln.illinois.gov/Blog/Posts/184/Civil-War/2024/5/Lincolns-Critical-Month-April-1861/blog-post/>  Early on, blockade runners often evaded Union ships with relative ease @https://www.usni.org/magazines/naval-history-magazine/2021/october/economic-warfare-union-blockade-civil-war> \n\nDespite these initial limitations and criticisms, the blockade proved to be a crucial and increasingly effective component of the Confederate defeat @https://presidentlincoln.illinois.gov/Blog/Posts/184/Civil-War/2024/5/Lincolns-Critical-Month-April-1861/blog-post/>  It succeeded not necessarily by being airtight, but by fracturing Confederate distribution and sustainment capabilities, forcing their economy to adapt in unsustainable ways, and ultimately crippling their ability to supply forces in the field @https://www.usni.org/magazines/naval-history-magazine/2021/october/economic-warfare-union-blockade-civil-war>  While not an immediate knockout blow, it \"slowly asphyxiated the South as the war dragged on\" @https://www.reddit.com/r/AskHistorians/comments/1sfpbg/how_effective_was_the_anaconda_plan_during_the/>  The Anaconda Plan's initial derision and early operational limitations, such as being a \"paper blockade,\" do not diminish its long-term strategic importance. The plan's effectiveness lay not in immediate, total enforcement, but in its cumulative, indirect impact on the Confederate economy and logistical infrastructure. By consistently pressuring Southern ports and controlling the Mississippi, the Union gradually eroded the Confederacy's ability to sustain its war effort, demonstrating a patient and persistent application of economic warfare that ultimately proved decisive. The \"bones of the Anaconda Plan stayed in place\" throughout the conflict, even as other aspects of Union strategy, particularly regarding slavery, evolved @https://presidentlincoln.illinois.gov/Blog/Posts/184/Civil-War/2024/5/Lincolns-Critical-Month-April-1861/blog-post/> \n\n### **Navigating Command: Lincoln's Relationship with Key Generals (McClellan, Grant, Sherman)**\n\nOne of Lincoln's most significant challenges as Commander-in-Chief was finding and effectively managing military leadership capable of prosecuting the war to a successful conclusion @https://digitalcommons.georgiasouthern.edu/cgi/viewcontent.cgi?article=1086&context=aujh>  His relationships with his generals were often complex and fraught with tension, particularly in the early years of the war.\n\n**George B. McClellan:** Lincoln and General George B. McClellan developed a mutual distrust @https://en.wikipedia.org/wiki/George_B._McClellan>  McClellan, though skilled at military organization and preparation, was notoriously cautious and reluctant to engage the enemy offensively @https://blogs.dickinson.edu/hist-288pinsker/close-readings/close-reading-letter-to-george-mcclellan/>  He infuriated Lincoln and his administration by delaying attacks, such as during the Peninsula Campaign, and by failing to aggressively pursue Confederate forces after battles like Antietam @https://blogs.dickinson.edu/hist-288pinsker/close-readings/close-reading-letter-to-george-mcclellan/>  McClellan often held a condescending and patronizing opinion of Lincoln, viewing himself as intellectually and militarily superior to the President @https://www.abrahamlincolnsclassroom.org/abraham-lincolns-contemporaries/abraham-lincoln-and-george-b-mcclellan/index.html>  This lack of respect and his consistent inaction led to his removal as General-in-Chief in spring 1862 and his final removal from command of the Army of the Potomac in November 1862, following the midterm elections @https://en.wikipedia.org/wiki/George_B._McClellan>  Lincoln's frustration stemmed from McClellan's inability to translate organizational prowess into decisive battlefield action, perceiving missed opportunities to deliver crippling blows to the Confederate army @https://blogs.dickinson.edu/hist-288pinsker/close-readings/close-reading-letter-to-george-mcclellan/> \n\n**Ulysses S. Grant:** The turning point in Union military leadership came in February 1864 when Lincoln appointed General Ulysses S. Grant as the commander of all Union forces @https://ndupress.ndu.edu/Media/News/News-Article-View/Article/581883/union-success-in-the-civil-war-and-lessons-for-strategic-leaders/>  This appointment marked a significant shift in Union strategy, moving away from short-term objectives and towards a unifying strategic goal @https://ndupress.ndu.edu/Media/News/News-Article-View/Article/581883/union-success-in-the-civil-war-and-lessons-for-strategic-leaders/>  Lincoln and Grant forged a highly effective partnership, characterized by \"extraordinary interpersonal respect and loyalty\" and a cooperative working relationship @https://www.historyonthenet.com/lincoln-and-grant-winning-civil-war-us-presidency>  They combined all elements of Union power into a comprehensive national strategy, aiming to make continued resistance more painful for the Confederate population than rejoining the Union @https://ndupress.ndu.edu/Media/News/News-Article-View/Article/581883/union-success-in-the-civil-war-and-lessons-for-strategic-leaders/>  Grant took charge of military operations and tactics, with significant input from Lincoln, while Lincoln directed national policy @https://www.historyonthenet.com/lincoln-and-grant-winning-civil-war-us-presidency>  Their shared traits of humility, decisiveness, moral courage, and perseverance were crucial to their success @https://www.historyonthenet.com/lincoln-and-grant-winning-civil-war-us-presidency>  This collaboration enabled the Union to overcome previous strategic shortcomings, leading to Lee's eventual surrender @https://ndupress.ndu.edu/Media/News/News-Article-View/Article/581883/union-success-in-the-civil-war-and-lessons-for-strategic-leaders/>  The successful collaboration between Lincoln and Grant, contrasting sharply with Lincoln's earlier struggles with commanders like McClellan, highlights the critical importance of a unified strategic vision and mutual trust at the highest levels of military and political leadership. Lincoln's persistence in finding a general who shared his aggressive approach and understood the necessity of continuous pressure, rather than piecemeal engagements, ultimately unlocked the Union's numerical and industrial advantages, transforming the war into a coordinated effort to dismantle the Confederacy's will to fight.\n\n**William T. Sherman:** General William T. Sherman, a key subordinate to Grant, played a crucial role in the Union's final campaigns. His \"March to the Sea\" in late 1864, from Atlanta to Savannah, was a highly destructive campaign aimed at breaking the Confederate will to fight by demonstrating their government's inability to protect its citizens @https://www.battlefields.org/learn/articles/shermans-march-sea>  Sherman abandoned his supply lines and practiced psychological warfare, destroying food stores and infrastructure @https://www.georgiaencyclopedia.org/articles/history-archaeology/shermans-march-to-the-sea/>  Although Lincoln was initially \"anxious, if not fearful\" about Sherman's plan to move into enemy territory before the 1864 presidential election, he ultimately did not interfere, trusting Sherman's judgment after Grant's assurances @https://www.georgiaencyclopedia.org/articles/history-archaeology/shermans-march-to-the-sea/>  Upon the capture of Savannah, Sherman famously telegraphed Lincoln, offering the city as a \"Christmas gift\" @https://www.georgiaencyclopedia.org/articles/history-archaeology/shermans-march-to-the-sea/>  Lincoln was delighted by the success, acknowledging that \"the honor is all yours\" for an undertaking he had only acquiesced to @https://housedivided.dickinson.edu/sites/lincoln/letter-to-william-sherman-december-26-1864/>  Sherman's campaign, while brutal, was seen as a necessary means to shorten the war and reduce battlefield slaughter @https://www.battlefields.org/learn/articles/shermans-march-sea> \n\n### **Evolution of Union Military Policy and Directives**\n\nLincoln's military strategy evolved significantly throughout the war, moving from an initial conservative and conciliatory approach to one that embraced more drastic measures. Initially, Lincoln assumed that the sheer presence of overwhelming Union troops would turn Southerners against the rebel government @https://www.archives.gov/publications/prologue/2010/spring/lincoln-and-guerrillas>  However, the growing menace of guerrilla warfare, particularly in Missouri and across the Upper South, and rising public criticism of the conventional war's futility, especially in the East, prompted a substantial shift in Union policy by the summer of 1862 @https://www.archives.gov/publications/prologue/2010/spring/lincoln-and-guerrillas> \n\nLincoln began to adopt measures previously employed by generals like John C. Frémont and John Pope, which he had initially balked at due to concerns about retaliation cycles @https://www.archives.gov/publications/prologue/2010/spring/lincoln-and-guerrillas>  He reassigned Frémont to West Virginia and brought Pope to command a new Union Army in Virginia, approving stricter orders that allowed for executions, financial assessments, and property destruction against guerrillas and their supporters @https://www.archives.gov/publications/prologue/2010/spring/lincoln-and-guerrillas>  In July 1862, Lincoln publicly warned Confederate soldiers and civilians that aiding the rebel cause would result in \"forfeitures and seizures\" of their property @https://www.archives.gov/publications/prologue/2010/spring/lincoln-and-guerrillas>  While Lincoln sometimes sent mixed signals to commanders, perhaps granting them wider latitude than advisable, this shift reflected a growing understanding that the war required a more aggressive and comprehensive approach to cripple Confederate resources and morale @https://www.archives.gov/publications/prologue/2010/spring/lincoln-and-guerrillas> \n\nBeyond specific campaigns, Lincoln's overarching strategic goal was always the preservation of the Union @https://warroom.armywarcollege.edu/articles/lincoln-as-strategist/>  He understood that the Union's numerical superiority needed to be leveraged to overcome the Confederacy's ability to concentrate forces and utilize interior lines @https://quod.lib.umich.edu/j/jala/2629860.0007.104/--lincoln-s-presidential-example-in-dealing-with-the-military?rgn=main;view%3Dfulltext  His \"general idea of the war\" was to menace the enemy at multiple points, preventing their concentration and forcing them to bear the \"wastage\" of coming to the Union, rather than the Union bearing the wastage of going to them @https://quod.lib.umich.edu/j/jala/2629860.0007.104/--lincoln-s-presidential-example-in-dealing-with-the-military?rgn=main;view%3Dfulltext  This matured strategy, encompassing both Eastern and Western theaters, was a sophisticated variation of Scott's Anaconda Plan, integrating naval blockades, control of key waterways like the Mississippi River, and political actions like amnesty and reconstruction to lure rebels away from the Confederacy @https://quod.lib.umich.edu/j/jala/2629860.0007.104/--lincoln-s-presidential-example-in-dealing-with-the-military?rgn=main;view%3Dfulltext  He also recognized the potential of African Americans as a new source of soldiers, a policy that harmonized with the Anaconda strategy @https://quod.lib.umich.edu/j/jala/2629860.0007.104/--lincoln-s-presidential-example-in-dealing-with-the-military?rgn=main;view%3Dfulltext  Lincoln's strategic acumen, developed through a deep engagement with military logistics and operational realities, allowed him to adapt and refine Union war efforts, ultimately leading to victory @https://ndupress.ndu.edu/Media/News/Article/581883/union-success-in-the-civil-war-and-lessons-for-strategic-leaders/> \n\n## **IV. Emancipation and the Transformation of War Aims**\n\n### **Lincoln's Evolving Views on Slavery and Emancipation**\n\nAbraham Lincoln's stance on slavery evolved significantly throughout his public life, moving from a personal moral opposition to its expansion to a presidential commitment to its complete abolition as a war measure. Early in his career, as an Illinois legislator, he denounced slavery as \"injustice and bad policy\" @https://www.nps.gov/liho/learn/historyculture/political.htm#:~:text=Pre%2DPresidential%20Political%20Career%201830%2D1860&text=In%201834%20he%20was%20elected,Springfield%2C%20the%20new%20State%20capital.>  However, he initially opposed the spread of abolition societies and supported the American Colonization Society, which advocated for settling freed slaves in Liberia, reflecting a cautious approach to immediate, universal emancipation @https://en.wikipedia.org/wiki/Abraham_Lincoln>  In his 1854 Peoria speech, Lincoln expressed his hatred for slavery's \"monstrous injustice\" but confessed uncertainty about how to end it where it already existed, believing neither colonization nor racial equality were practical at the time @https://www.nps.gov/liho/learn/historyculture/slavery.htm>  He acknowledged the South's predicament, stating, \"If it did now exist amongst us, we should not instantly give it up\" @https://www.nps.gov/liho/learn/historyculture/slavery.htm> \n\nUpon entering the presidency, Lincoln's primary objective was to preserve the Union, not to abolish slavery where it legally existed @https://www.loc.gov/collections/abraham-lincoln-papers/articles-and-essays/abraham-lincoln-and-emancipation/>  He famously stated in his 1862 letter to Horace Greeley, \"My paramount object in this struggle is to save the Union, and is not either to save or to destroy slavery\" @https://www.loc.gov/collections/abraham-lincoln-papers/articles-and-essays/abraham-lincoln-and-emancipation/>  This pragmatic approach was heavily influenced by his desire to retain the loyalty of the crucial border states, which he believed were indispensable to the Union cause @https://library.fiveable.me/key-terms/apush/lincoln-and-the-border-states>  He even overturned emancipation orders issued by generals like Frémont and Hunter to avoid alienating these states @https://www.loc.gov/collections/abraham-lincoln-papers/articles-and-essays/abraham-lincoln-and-emancipation/> \n\nHowever, as the war progressed, military necessity and growing public acceptance of emancipation as a war measure pushed Lincoln towards a more radical stance @https://www.loc.gov/collections/abraham-lincoln-papers/articles-and-essays/abraham-lincoln-and-emancipation/>  The Second Confiscation Act and the Militia Act, both passed in July 1862, provided a critical signal, freeing slaves of disloyal owners and authorizing the employment of African Americans in the military @https://www.loc.gov/collections/abraham-lincoln-papers/articles-and-essays/abraham-lincoln-and-emancipation/>  This legislative action demonstrated increasing congressional and public readiness for executive action on emancipation. Lincoln's evolving perspective, from a primary focus on Union preservation to the eventual embrace of emancipation, illustrates his capacity for strategic adaptation in response to both military realities and shifts in public sentiment. His initial caution was a calculated effort to maintain unity among diverse Northern factions and border states, but as the conflict deepened, he recognized that emancipation could become a powerful tool to weaken the Confederacy and gain international moral support, ultimately aligning his personal convictions with the strategic imperatives of the war.\n\n### **The Emancipation Proclamation: Context, Motivations, and Immediate Impact**\n\nThe Emancipation Proclamation, issued by President Lincoln on January 1, 1863, was a pivotal executive order that fundamentally transformed the character of the Civil War @https://www.archives.gov/exhibits/featured-documents/emancipation-proclamation>  Its issuance was a complex decision, driven by a confluence of military, moral, and foreign policy motivations.\n\n**Context and Motivations:** The proclamation emerged during a period of significant military setbacks for the Union and increasing pressure from abolitionists and Radical Republicans @https://www.loc.gov/collections/abraham-lincoln-papers/articles-and-essays/abraham-lincoln-and-emancipation/>  Secretary of State William Seward had advised Lincoln to wait for a major Union military victory before issuing such a proclamation to avoid it appearing as an act of desperation @https://www.loc.gov/collections/abraham-lincoln-papers/articles-and-essays/abraham-lincoln-and-emancipation/>  The Battle of Antietam in September 1862, though not a decisive Union victory, provided the necessary strategic opening @https://www.loc.gov/collections/abraham-lincoln-papers/articles-and-essays/abraham-lincoln-and-emancipation/>  Lincoln personally abhorred slavery, viewing it as a \"monstrous injustice\" and a \"sin\" @https://www.nps.gov/liho/learn/historyculture/slavery.htm>  However, his constitutional authority as president confined him to challenging slavery primarily within the context of necessary war measures @https://www.loc.gov/collections/abraham-lincoln-papers/articles-and-essays/abraham-lincoln-and-emancipation/>  The proclamation was framed as a military necessity, designed to deprive the Confederacy of its enslaved labor force and to bring additional manpower into the Union army @https://www.loc.gov/collections/abraham-lincoln-papers/articles-and-essays/abraham-lincoln-and-emancipation/> \n\n**Immediate Impact:** The Emancipation Proclamation declared \"that all persons held as slaves\" within the rebellious states \"are, and henceforward shall be free\" @https://www.archives.gov/exhibits/featured-documents/emancipation-proclamation>  It was, however, limited in its immediate effect: it applied only to states that had seceded and were still in rebellion, explicitly exempting loyal border states and parts of the Confederacy already under Union control @https://www.archives.gov/exhibits/featured-documents/emancipation-proclamation>  Despite these limitations, its psychological and political impact was profound. It \"captured the hearts and imagination of millions of Americans\" and fundamentally redefined the war's purpose from merely preserving the Union to actively fighting for freedom and the destruction of slavery @https://www.archives.gov/exhibits/featured-documents/emancipation-proclamation> \n\n### **The Role of Black Soldiers in the Union War Effort**\n\nA critical immediate consequence of the Emancipation Proclamation was its announcement of the acceptance of black men into the Union Army and Navy, enabling the liberated to become liberators @https://www.archives.gov/exhibits/featured-documents/emancipation-proclamation>  This policy was a strategic masterstroke, addressing the Union's manpower difficulties and tapping into a vast, previously unutilized force @https://quod.lib.umich.edu/j/jala/2629860.0007.104/--lincoln-s-presidential-example-in-dealing-with-the-military?rgn=main;view%3Dfulltext \n\nBy the end of the war, approximately 180,000 to 200,000 African American men had served in the Union armed forces, constituting roughly 10% of the Union's total military strength @https://www.archives.gov/exhibits/featured-documents/emancipation-proclamation>  The bravery and dedication of these soldiers, exemplified by units like the 54th Massachusetts Infantry Regiment, played a crucial role in the Union victory and helped to dispel racist stereotypes prevalent at the time @https://library.fiveable.me/united-states-history-1865/unit-11/emancipation-proclamation-impact/study-guide/hVVIUybj2XmBgn2D>  Their service not only contributed militarily but also added immense moral force to the Union cause, strengthening it both militarily and politically @https://www.archives.gov/exhibits/featured-documents/emancipation-proclamation>  Frederick Douglass, a prominent abolitionist, had long advocated for black military service as a pathway to citizenship for formerly enslaved people @https://nmaahc.si.edu/explore/stories/emancipation-proclamation-striking-mighty-blow-slavery>  The Emancipation Proclamation confirmed the insistence of enslaved individuals that the war for the Union must become a war for freedom, as many had already been \"seizing freedom through their actions including running away from enslavement and towards freedom\" @https://nmaahc.si.edu/explore/stories/emancipation-proclamation-striking-mighty-blow-slavery>  The integration of Black soldiers into the Union Army represented a significant shift in both military strategy and societal norms. It not only provided a vital new source of manpower for the Union war effort but also fundamentally altered the moral calculus of the conflict. The participation of formerly enslaved individuals fighting for their own freedom and the Union's cause lent undeniable moral authority to the Union, making it increasingly difficult for European powers to justify any intervention on behalf of the Confederacy. This transformation solidified the war's new objective: not merely reunion, but the eradication of slavery itself.\n\n### **Shifting War Aims and the Path to the 13th Amendment**\n\nThe Emancipation Proclamation fundamentally altered the nature and objectives of the Civil War, transforming it from a conflict primarily aimed at preserving the Union into a war for freedom and the destruction of slavery @https://library.fiveable.me/united-states-history-1865/unit-11/emancipation-proclamation-impact/study-guide/hVVIUybj2XmBgn2D>  The abolition of slavery became an explicit goal of the Union war effort, boosting morale among abolitionists and anti-slavery advocates in the North @https://library.fiveable.me/united-states-history-1865/unit-11/emancipation-proclamation-impact/study-guide/hVVIUybj2XmBgn2D>  In the Confederacy, the proclamation fueled outrage and defiance, as Southern leaders viewed it as a direct threat to their way of life and a violation of states' rights @https://library.fiveable.me/united-states-history-1865/unit-11/emancipation-proclamation-impact/study-guide/hVVIUybj2XmBgn2D> \n\nWhile the Emancipation Proclamation did not immediately end slavery nationwide, as it only applied to rebellious states, it paved the way for the Thirteenth Amendment to the United States Constitution @https://library.fiveable.me/united-states-history-1865/unit-11/emancipation-proclamation-impact/study-guide/hVVIUybj2XmBgn2D>  Lincoln vigorously supported this amendment, which formally abolished slavery and involuntary servitude throughout the United States, except as punishment for a crime @https://www.nps.gov/liho/learn/historyculture/slavery.htm>  Ratified in December 1865, after Lincoln's death, the 13th Amendment codified the end of slavery, making it a permanent constitutional change @https://library.fiveable.me/united-states-history-1865/unit-11/emancipation-proclamation-impact/study-guide/hVVIUybj2XmBgn2D>  The proclamation laid the groundwork for this constitutional change by making the abolition of slavery a central goal of the Union war effort @https://library.fiveable.me/united-states-history-1865/unit-11/emancipation-proclamation-impact/study-guide/hVVIUybj2XmBgn2D>  The shift in war aims, from Union preservation to emancipation, profoundly influenced international perception, making it harder for European nations to recognize or support the Confederacy @https://library.fiveable.me/united-states-history-1865/unit-11/emancipation-proclamation-impact/study-guide/hVVIUybj2XmBgn2D>  This moral imperative solidified the Union's position as the righteous authority in the conflict, undermining the Confederacy's international standing @https://library.fiveable.me/united-states-history-1865/unit-11/emancipation-proclamation-impact/study-guide/hVVIUybj2XmBgn2D> \n\n## **V. Domestic Governance Amidst Conflict**\n\n### **Wartime Economic Policies: Tariffs, Banking, and Western Expansion (Homestead Act, Pacific Railway Act)**\n\nDespite the immense demands of the Civil War, the Lincoln administration pursued a proactive domestic agenda that aimed to strengthen the Union's economic foundation and facilitate westward expansion. These policies, largely driven by the Republican Party's platform, reshaped the American economy for decades to come.\n\nThe **Morrill Tariff of 1861**, passed just two days before Lincoln's inauguration, significantly raised tariff rates and reintroduced a specific duties-based system, largely defining American international trade policy for the next fifty years @https://mises.org/mises-daily/lincolns-tariff-war>  Lincoln, a long-time proponent of protectionism, owed his nomination and election in part to Northern protectionists, particularly in Pennsylvania, who sought to benefit the state's manufacturing industries @https://mises.org/mises-daily/lincolns-tariff-war>  While tariffs did not cause the Civil War, they played a role in the early development of secessionist constitutional theory and were a central component of the federal government's revenue system, accounting for almost 95% of tax receipts in 1860 @https://www.essentialcivilwarcurriculum.com/tariffs-and-the-american-civil-war.html> \n\nThe **National Banking Acts of 1863 and 1864** were crucial wartime expedients designed to help finance the war effort and promote a stable, uniform currency @https://www.senate.gov/artandhistory/history/common/civil_war/NationalBankActs.htm>  These acts replaced the decentralized system of state banks and banknotes, creating a market for war bonds and reestablishing a central banking system. The 1863 act applied a 2% annual tax to state bank notes to discourage their issuance, and the 1864 act allowed federally chartered banks to issue national bank notes backed by U.S. Treasury bonds @https://www.senate.gov/artandhistory/history/common/civil_war/NationalBankActs.htm>  A subsequent 1865 measure increased the tax on state bank notes to 10%, effectively eliminating them and establishing a national banking era that persisted until the Federal Reserve System in 1913 @https://www.federalreservehistory.org/essays/national-banking-acts> \n\nThe **Homestead Act of 1862** was passed to develop the American West and spur economic growth @https://www.senate.gov/artandhistory/history/common/civil_war/Homestead_Act.htm>  It provided 160 acres of federal land to any adult head of family who agreed to farm the land for five years and had not borne arms against the U.S. government @https://www.senate.gov/artandhistory/history/common/civil_war/Homestead_Act.htm>  This legislation, long opposed by Southern legislators who feared it would prevent slavery in new territories, finally passed after Southern secession @https://www.senate.gov/artandhistory/history/common/civil_war/Homestead_Act.htm>  While intended to provide land for ordinary citizens, a significant portion of the land ultimately went to speculators, cattle owners, miners, loggers, and railroads due to ambiguities in the act @https://www.archives.gov/milestone-documents/homestead-act> \n\nConcurrently, the **Pacific Railway Act of 1862** authorized the construction of the nation's first transcontinental railroad and telegraph line, providing government bonds and vast land grants to the Union Pacific and Central Pacific railroad companies @https://www.senate.gov/artandhistory/history/common/generic/PacificRailwayActof1862.htm>  This landmark legislation, previously stalled by sectional competition over the route, was enacted once Southern states seceded, enabling a northern route to the Pacific @https://www.senate.gov/artandhistory/history/common/generic/PacificRailwayActof1862.htm>  This act, along with the\n\n**Morrill Land-Grant Act of 1862**, which established public colleges funded by federal land grants to promote agricultural and mechanical arts, further demonstrated the Union's commitment to national development even amidst conflict @https://www.archives.gov/milestone-documents/morrill-act#:~:text=Passed%20on%20July%202%2C%201862,tribal%20lands%20of%20Native%20communities.>  These wartime economic policies reflect a broader Republican vision for a free-labor society modeled on Northern capitalism, aiming to bind the nation together through economic integration and westward expansion @https://millercenter.org/president/lincoln/campaigns-and-elections>  The implementation of these ambitious economic policies during the Civil War, rather than deferring them until peace, demonstrates Lincoln's long-term strategic vision for the Union. By strengthening the national financial system, promoting westward settlement, and investing in infrastructure, Lincoln aimed to create a more robust and unified nation, not just win the war. This forward-looking approach suggests a deep understanding that military victory alone would be insufficient without a strong, integrated economic foundation for the reunited country.\n\n### **Managing Dissent: Suspension of Habeas Corpus, Military Arrests, and Censorship**\n\nDuring the Civil War, President Lincoln faced significant internal dissent, particularly from \"Copperheads\" or Peace Democrats, who opposed the war and advocated for immediate peace negotiations with the Confederacy @https://www.gilderlehrman.org/sites/default/files/inline-pdfs/Hannah%20Teller_Snakes%20Lurking%20in%20the%20Grass_0.pdf>  In response to these threats to the war effort and public safety, Lincoln took extraordinary measures, including the suspension of habeas corpus, military arrests of civilians, and, at times, actions that bordered on censorship.\n\nThe **suspension of habeas corpus** was one of Lincoln's earliest and most controversial executive actions @https://scholarlycommons.law.northwestern.edu/cgi/viewcontent.cgi?article=1363&context=nulr>  He argued that this suspension was constitutionally permissible \"when, in cases of Rebellion or Invasion, the public Safety may require them\" @https://www.abrahamlincolnonline.org/lincoln/speeches/corning.htm#:~:text=I%20concede%20that%20the%20class,they%20may%20prevent%20the%20rebellion>  This allowed military officials to arrest and detain suspected Confederate sympathizers without immediate judicial review @https://library.fiveable.me/key-terms/apush/habeas-corpus-suspension#:~:text=The%20suspension%20of%20habeas%20corpus,dangerous%20precedent%20for%20future%20governments.>  Lincoln justified this by asserting that the enemy \"hoped to keep on foot among us a most efficient corps of spies, informers, supplyers, and aiders and abettors of their cause\" under the cover of civil liberties @https://encompass.eku.edu/cgi/viewcontent.cgi?article=1027&context=tcj>  He believed that no single law, including the writ of habeas corpus, was worth the failure of the Union @https://www.gilderlehrman.org/sites/default/files/inline-pdfs/Hannah%20Teller_Snakes%20Lurking%20in%20the%20Grass_0.pdf> \n\nThe scale of military arrests was substantial, with over 15,000 civilians arrested by military authority under the Lincoln administration during the war, often on suspicion of being deserters or aiding the Confederacy @https://encompass.eku.edu/cgi/viewcontent.cgi?article=1027&context=tcj>  These arrests, while causing some public outcry, particularly in cases like that of John Merryman, who was arrested in Maryland for recruiting for Confederate service, were defended by Lincoln as essential for national survival @https://quod.lib.umich.edu/j/jala/2629860.0029.205/--lincoln-s-suspension-of-the-writ-of-habeas-corpus?rgn=main;view%3Dfulltext  Chief Justice Roger Brooke Taney, acting independently, challenged Lincoln's authority to suspend habeas corpus, arguing it was a congressional power, but Lincoln refused to comply, asserting the extreme threat to the nation justified his actions @https://quod.lib.umich.edu/j/jala/2629860.0029.205/--lincoln-s-suspension-of-the-writ-of-habeas-corpus?rgn=main;view%3Dfulltext \n\nCensorship also occurred, with a congressional investigation into the government's control of telegraph lines in 1861 @https://prologue.blogs.archives.gov/2010/11/04/censorship-and-the-c-w/>  Generals, with Lincoln's approval, issued orders forbidding \"sympathy for the enemy\" and authorizing arrests @https://www.gilderlehrman.org/sites/default/files/inline-pdfs/Hannah%20Teller_Snakes%20Lurking%20in%20the%20Grass_0.pdf>  While Lincoln understood the importance of dissent in a democratic republic and generally showed restraint towards the press, he and his Secretary of War, Edwin Stanton, did struggle with the balance between tolerance and suppression of news reporters, at times leaking or planting news to influence public opinion @https://repository.lsu.edu/cgi/viewcontent.cgi?article=2340&context=cwbr>  The decision to suspend habeas corpus and implement military arrests, though controversial and pushing the boundaries of executive power, was a strategic calculation by Lincoln to counter internal threats that he believed could undermine the Union war effort. This demonstrates his willingness to prioritize national security and the preservation of the Union above traditional civil liberties during an unprecedented crisis. The backlash and debates surrounding these actions underscore the inherent tension between wartime necessity and constitutional principles, a tension Lincoln navigated by asserting that the very survival of the republic was at stake.\n\n### **Political Opposition: The Copperheads and Radical Republicans**\n\nLincoln's presidency was characterized by significant political opposition from both within and outside his own party, requiring astute management to maintain a unified war effort.\n\nThe **Copperheads**, or Peace Democrats, represented a formidable internal threat to the Union @https://researchrepository.wvu.edu/wvuhistoricalreview/vol2/iss1/7/>  They advocated for immediate peace negotiations with the Confederacy, opposed the war, and attacked Lincoln's actions and character, often deeming his expansion of power unconstitutional and dangerous @https://www.gilderlehrman.org/sites/default/files/inline-pdfs/Hannah%20Teller_Snakes%20Lurking%20in%20the%20Grass_0.pdf>  Their propaganda, which depicted Lincoln as \"Abraham Africanus I\" and accused him of tyranny for suspending habeas corpus and using martial law, resonated with a war-weary public, contributing to social unrest and distrust of the government @https://www.gilderlehrman.org/sites/default/files/inline-pdfs/Hannah%20Teller_Snakes%20Lurking%20in%20the%20Grass_0.pdf>  The New York City draft riots of 1863, which involved mobs attacking symbols of the draft, assaulting African Americans, and overwhelming police, demonstrated the impact of Copperhead agitation @https://www.gilderlehrman.org/sites/default/files/inline-pdfs/Hannah%20Teller_Snakes%20Lurking%20in%20the%20Grass_0.pdf>  Lincoln viewed the Copperheads as a \"fire in the rear\" that undermined his war effort @https://prologue.blogs.archives.gov/2010/11/04/censorship-and-the-c-w/>  His response, while firm, also showed political calculation; for example, instead of martyring Clement Vallandigham, a prominent Copperhead leader, by jailing him, Lincoln had him sent to the Confederacy @https://prologue.blogs.archives.gov/2010/11/04/censorship-and-the-c-w/> \n\n**Radical Republicans**, while part of Lincoln's own party, often found themselves in an uneasy alliance with the President @https://personal.tcu.edu/swoodworth/trefousse-rr.htm>  They were generally more critical of Lincoln, viewing him as too conservative and too slow in freeing slaves and supporting legal equality for African Americans @https://personal.tcu.edu/swoodworth/trefousse-rr.htm>  Radical Republicans insisted on harsher terms for the defeated Confederacy and stronger protections for former slaves, often clashing with Lincoln's more lenient plans for Reconstruction @https://courses.lumenlearning.com/wm-ushistory1/chapter/lincolns-plan/>  Despite these differences, Lincoln maintained a working relationship with them, including Radicals like Salmon P. Chase in his cabinet @https://en.wikipedia.org/wiki/Radical_Republicans#:~:text=After%20the%201860%20elections%2C%20moderate,including%20Radicals%20like%20Salmon%20P.>  Historians suggest that the relationship was mutual: Lincoln cautiously aligned himself with radical goals, and in return, the Radicals \"supported for vital measures, constituted the shock troops of the Republican party, and provided a spur for laggard generals and politicians\" @https://personal.tcu.edu/swoodworth/trefousse-rr.htm>  Their constant \"prodding\" helped push Lincoln towards more radical aims, such as the Emancipation Proclamation and, later, the enfranchisement of Black men @https://www.loc.gov/collections/abraham-lincoln-papers/articles-and-essays/abraham-lincoln-and-emancipation/>  Lincoln's adept management of both the Copperhead opposition and the Radical Republican faction within his own party was crucial for maintaining a cohesive war effort. His ability to neutralize internal dissent while strategically incorporating the more progressive demands of the Radicals allowed him to broaden the war's objectives and sustain public support, preventing the nation from fracturing from within. This demonstrates a sophisticated political skill in balancing competing ideologies and pressures to achieve the ultimate goal of Union preservation and the eventual abolition of slavery.\n\n### **Lincoln's Communication Strategies and Public Support**\n\nLincoln understood that \"public sentiment is everything\" and recognized the profound influence of newspapers in shaping public opinion during the Civil War era @https://repository.lsu.edu/cgi/viewcontent.cgi?article=2340&context=cwbr>  He employed a variety of communication strategies to rally public support, counter dissent, and convey his policies.\n\nLincoln primarily relied on **public speeches and written documents** to communicate with the public @https://brainly.com/question/55526433#:~:text=President%20Lincoln%20primarily%20relied%20on,policies%20during%20this%20critical%20period.>  His most famous examples include the Gettysburg Address and the Emancipation Proclamation, which effectively conveyed his ideas and policies @https://brainly.com/question/55526433#:~:text=President%20Lincoln%20primarily%20relied%20on,policies%20during%20this%20critical%20period.>  He was a master of rhetoric, employing literary tools such as grammatical parallelism, antithesis, alliteration, repetition, contrast, balance, and metaphor @https://presidentlincoln.illinois.gov/Resources/8cbe6700-ce47-4ff8-a5d8-7fda74b05c64/gettysburg-address-lessons.pdf>  His writing style, influenced by his legal background, was characterized by clarity, brevity, and the use of simple, often one-syllable words, making his messages accessible and impactful to a broad audience @https://news.stthomas.edu/publication-article/the-power-of-brevity/> \n\nLincoln actively cultivated relationships with editors and reporters, sometimes providing \"scoops\" on policy or even penning anonymous editorials for Republican newspapers @https://repository.lsu.edu/cgi/viewcontent.cgi?article=2340&context=cwbr>  While he never granted formal interviews or press conferences, he frequently invited correspondents for informal, off-the-record conversations @https://repository.lsu.edu/cgi/viewcontent.cgi?article=2340&context=cwbr>  He understood the importance of dissent in a democratic republic and largely refrained from personally engaging in the suppression of the press, fearing it would set a dangerous precedent for journalistic freedom @https://repository.lsu.edu/cgi/viewcontent.cgi?article=2340&context=cwbr> \n\nIn countering the \"fire in the rear\" from Copperheads, Lincoln used his public letters, such as the one to Erastus Corning, to defend his civil liberties position. He argued that military arrests were constitutional when \"public Safety may require them\" in cases of rebellion, and that those who protested were inadvertently aiding the insurgent cause by creating a \"clamor\" that served the enemy @https://www.abrahamlincolnonline.org/lincoln/speeches/corning.htm>  He framed the war as a struggle for the survival of democracy itself, a message that resonated deeply with the Northern public @https://www.nps.gov/liho/learn/historyculture/secessiontableofcontents.htm>  Lincoln's ability to articulate the Union cause in compelling moral and existential terms, combined with his strategic use of various media, was instrumental in sustaining public morale and political will throughout the protracted and costly conflict. His communication was not merely informative; it was persuasive, designed to unify a divided populace and justify the extraordinary measures taken to preserve the nation.\n\n**Table 2: Major Union Wartime Policies and Their Objectives**\n\n| Policy/Act | Year(s) | Primary Objective(s) | Key Provisions/Impact |\n| --- | --- | --- | --- |\n| Morrill Tariff | 1861 | Increase federal revenue; protect Northern industries | Raised tariff rates; defined trade policy for decades; major source of federal income @https://mises.org/mises-daily/lincolns-tariff-war>  |\n| Homestead Act | 1862 | Encourage westward settlement; spur economic growth | Granted 160 acres of federal land to settlers; distributed millions of acres; facilitated development of American West @https://www.senate.gov/artandhistory/history/common/civil_war/Homestead_Act.htm>  |\n| Pacific Railway Act | 1862 | Facilitate transcontinental transportation; connect East and West | Authorized construction of transcontinental railroad and telegraph line; provided land grants and bonds to companies @https://www.senate.gov/artandhistory/history/common/generic/PacificRailwayActof1862.htm>  |\n| Morrill Land-Grant Act | 1862 | Establish public colleges for agriculture and mechanical arts | Provided federal land grants to states for college creation; promoted practical education @https://www.archives.gov/milestone-documents/morrill-act#:~:text=Passed%20on%20July%202%2C%201862,tribal%20lands%20of%20Native%20communities.>  |\n| National Banking Acts | 1863, 1864 | Finance war effort; create stable national currency; reestablish central banking system | Established federal bank charters; allowed national bank notes backed by U.S. bonds; taxed state bank notes out of existence @https://www.senate.gov/artandhistory/history/common/civil_war/NationalBankActs.htm>  |\n| Enrollment Act (Conscription) | 1863 | Address manpower shortages in Union Army | Mandated registration for males 20-45; allowed exemptions for $300 or substitutes; led to draft riots in NYC @https://www.pritzkermilitary.org/explore/museum/past-exhibits/dignity-duty-journals-erasmus-corwin-gilbreath/riots-new-york>  |\n| Suspension of Habeas Corpus | 1861-1865 | Suppress dissent; maintain public safety; prevent aid to Confederacy | Allowed military detention without judicial review; controversial but deemed necessary by Lincoln for national survival @https://press.uchicago.edu/Misc/Chicago/237931in.html>  |\n| Emancipation Proclamation | 1863 | Weaken Confederacy; transform war aims; increase Union manpower | Declared slaves in rebellious states free; allowed Black men to join Union Army; shifted war to a moral crusade against slavery @https://www.archives.gov/exhibits/featured-documents/emancipation-proclamation>  |\n\n## **VI. Foreign Policy and International Diplomacy**\n\n### **Union Diplomatic Goals: Preventing Foreign Recognition and Intervention**\n\nA critical aspect of Lincoln's wartime leadership involved navigating the complex landscape of international diplomacy, with the primary objective of preventing foreign recognition of the Confederacy and deterring intervention by European powers, particularly Great Britain and France @https://en.wikipedia.org/wiki/Diplomacy_of_the_American_Civil_War>  The Union understood that official diplomatic recognition would lend credibility to the Confederacy's bid for independence and potentially pave the way for financial and military support, which could decisively alter the war's outcome @https://en.wikipedia.org/wiki/Diplomacy_of_the_American_Civil_War> \n\nLincoln's administration, led by Secretary of State William H. Seward, adopted a firm stance, warning both Britain and France that recognition of the Confederacy would be tantamount to a declaration of war against the Union @https://en.wikipedia.org/wiki/Diplomacy_of_the_American_Civil_War>  This strong diplomatic posture was crucial in deterring potential intervention. While major European nations recognized the Confederacy as a belligerent power, granting them certain rights under international law (e.g., floating loans, buying arms), they stopped short of recognizing them as a sovereign state @https://en.wikipedia.org/wiki/Diplomacy_of_the_American_Civil_War> \n\nThe Union's diplomatic efforts proved generally effective, with experienced diplomats adeptly handling numerous crises @https://en.wikipedia.org/wiki/Diplomacy_of_the_American_Civil_War>  The Union also benefited from Europe's economic considerations, as trade with the North, particularly wheat imports to Great Britain, often trumped the need for Southern cotton @https://en.wikipedia.org/wiki/Diplomacy_of_the_American_Civil_War>  Furthermore, the continent's general aversion to privateering and slavery, especially after the Emancipation Proclamation, helped solidify the Union's moral standing @https://www.thoughtco.com/emancipation-proclamation-was-also-foreign-policy-3310345>  The Union's success in preventing foreign recognition of the Confederacy was not merely a diplomatic achievement but a strategic triumph that directly influenced the war's duration and outcome. By skillfully leveraging the threat of war, economic interdependence, and the moral weight of emancipation, Lincoln's administration denied the Confederacy the external legitimacy and material support it desperately needed. This diplomatic isolation played a significant role in the Confederacy's eventual collapse, demonstrating that the war was fought on international as well as domestic fronts.\n\n### **Key Diplomatic Incidents: The Trent Affair**\n\nThe **Trent Affair** in November 1861 represented the most dangerous foreign policy dilemma for the Lincoln administration, threatening to escalate into a war between the United States and the United Kingdom @https://en.wikipedia.org/wiki/Trent_Affair>  The incident occurred when Union Captain Charles Wilkes intercepted the British mail steamer\n\n*Trent* and forcibly removed two Confederate envoys, James M. Mason and John Slidell, who were en route to Britain and France to lobby for diplomatic recognition and support @https://history.state.gov/milestones/1861-1865/trent-affair> \n\nPublic reaction in the United States was largely celebratory, hailing Wilkes as a hero for striking a blow against Britain @https://history.state.gov/milestones/1861-1865/trent-affair>  In the Confederacy, there was hope that the incident would lead to a permanent rupture in Anglo-American relations and possibly British intervention @https://en.wikipedia.org/wiki/Trent_Affair>  However, in Britain, the seizure was widely condemned as a violation of neutral rights and an affront to national honor @https://history.state.gov/milestones/1861-1865/trent-affair>  The British government demanded the immediate release of the envoys and a suitable apology, moving additional troops to Canada and readying its navy @https://history.state.gov/milestones/1861-1865/trent-affair> \n\nPresident Lincoln and his top advisors, including Secretary Seward, recognized that the Union could not afford a war with Great Britain while prosecuting the Civil War @https://history.state.gov/milestones/1861-1865/trent-affair>  After several tense weeks and Christmas cabinet meetings, Lincoln ultimately agreed to release the envoys and disavowed Captain Wilkes's actions, though without a formal apology @https://history.state.gov/milestones/1861-1865/trent-affair>  This diplomatic resolution, facilitated by Lincoln's and Prince Albert's cautious leadership, allowed tempers to cool and prevented a potentially disastrous conflict @https://www.journalofthecivilwarera.org/2017/11/lessons-diplomacy-reassessing-trent-affair/>  The resolution of the Trent Affair demonstrated Lincoln's capacity for pragmatic de-escalation in the face of international crisis. Despite domestic pressure to stand firm, he prioritized the long-term strategic goal of avoiding a two-front war, recognizing that alienating a major European power like Britain would severely jeopardize the Union's chances of victory. This highlights a crucial element of his leadership: the ability to make unpopular but strategically necessary decisions to preserve the Union.\n\n### **Countering \"King Cotton Diplomacy\"**\n\nThe Confederacy's primary diplomatic strategy was \"King Cotton Diplomacy,\" based on the belief that Great Britain and France, heavily dependent on Southern cotton for their textile industries, would be compelled to intervene on the Confederacy's behalf if cotton exports were restricted @https://en.wikipedia.org/wiki/Cotton_diplomacy>  Southern leaders, like Senator James Hammond, famously declared that \"Cotton is king\" and that no power would dare make war on it @https://en.wikipedia.org/wiki/Cotton_diplomacy> \n\nIn response, the Union implemented a coastal blockade of Confederate ports, ordered by Lincoln on April 16, 1861 @https://en.wikipedia.org/wiki/Cotton_diplomacy>  This blockade, a key component of the Anaconda Plan, aimed to weaken the Confederacy's economy by cutting off its primary source of revenue @https://en.wikipedia.org/wiki/Cotton_diplomacy>  While the Confederacy attempted a de facto cotton embargo by withholding exports, believing it would coerce European intervention, this strategy ultimately failed @https://en.wikipedia.org/wiki/Cotton_diplomacy> \n\nEuropean nations, particularly Britain and France, found alternative cotton supplies from places like Egypt and the East Indies by 1862 @https://en.wikipedia.org/wiki/Cotton_diplomacy>  Furthermore, continental Europe had an interest in maintaining a strong United States to balance British economic and military power @https://en.wikipedia.org/wiki/Cotton_diplomacy>  The Emancipation Proclamation also played a significant role in undermining King Cotton Diplomacy; by making the abolition of slavery a central war aim, it became morally difficult for European powers, especially Britain which had abolished slavery, to support the Confederacy @https://library.fiveable.me/united-states-history-1865/unit-11/emancipation-proclamation-impact/study-guide/hVVIUybj2XmBgn2D>  The blockade, despite its initial permeability, proved effective in fracturing Confederate distribution and sustainment, crippling their economy and hindering their ability to supply forces @https://www.usni.org/magazines/naval-history-magazine/2021/october/economic-warfare-union-blockade-civil-war>  The failure of \"King Cotton Diplomacy\" was a testament to the Union's effective counter-strategy and the evolving international landscape. The Confederacy's miscalculation of European dependency on its cotton, coupled with the Union's naval blockade and the moral leverage gained by the Emancipation Proclamation, collectively prevented the foreign intervention that the South desperately sought. This demonstrates Lincoln's administration's success in anticipating and neutralizing a critical Confederate diplomatic gambit, thereby isolating the rebellion on the international stage.\n\n### **Addressing French Intervention in Mexico**\n\nDuring the Civil War, France, under Emperor Napoleon III, took advantage of the American conflict to intervene in Mexico. French troops invaded Mexico in early 1862, eventually capturing Mexico City and installing an Austrian Hapsburg prince, Maximilian, as Emperor of Mexico in 1864 @https://www.nps.gov/articles/000/general-grant-and-the-fight-to-remove-emperor-maximilian-from-mexico.htm>  This move was a clear violation of the Monroe Doctrine, which warned European nations against meddling in the Western Hemisphere @https://www.nps.gov/articles/000/general-grant-and-the-fight-to-remove-emperor-maximilian-from-mexico.htm> \n\nLincoln's administration refused to recognize Maximilian's government and viewed French meddling as an act of hostility against the United States @https://www.nps.gov/articles/000/general-grant-and-the-fight-to-remove-emperor-maximilian-from-mexico.htm>  The Confederacy, conversely, welcomed Maximilian's government as a potential ally, hoping to secure French recognition @https://www.nps.gov/articles/000/general-grant-and-the-fight-to-remove-emperor-maximilian-from-mexico.htm>  Indeed, Napoleon III, while refusing to formally recognize the Confederacy, approved the transshipment of arms and munitions from Mexico into Texas, aiding Confederate forces @https://lincolnandmexicoproject.wordpress.com/2016/12/05/lincoln-helped-mexico-defeat-the-french/> \n\nDespite these provocations, Lincoln had to \"walk a tight rope\" in his dealings with France, prioritizing winning the Civil War first @https://www.nps.gov/articles/000/general-grant-and-the-fight-to-remove-emperor-maximilian-from-mexico.htm>  While he did not give immediate military intervention in Mexico much thought, his administration, particularly through generals like Grant and Sheridan, began covertly helping Mexican resistance forces under Benito Juárez @https://www.nps.gov/articles/000/general-grant-and-the-fight-to-remove-emperor-maximilian-from-mexico.htm>  After the Civil War, General Grant strongly advocated for the removal of Maximilian, viewing it as an act of hostility against the U.S. and arguing that it prolonged the Civil War due to illicit trade and rebel refuge @https://www.nps.gov/articles/000/general-grant-and-the-fight-to-remove-emperor-maximilian-from-mexico.htm>  Ultimately, direct military confrontation between the U.S. and French forces in Mexico was avoided. French resources were strained, and growing tensions with Germany drew France's attention back to Europe @https://www.nps.gov/articles/000/general-grant-and-the-fight-to-remove-emperor-maximilian-from-mexico.htm>  Benito Juárez's forces, supported by the U.S., successfully defeated the French, who withdrew by 1867 @https://www.nps.gov/articles/000/general-grant-and-the-fight-to-remove-emperor-maximilian-from-mexico.htm>  Lincoln's cautious and indirect approach to French intervention in Mexico demonstrates his strategic patience and prioritization of the Union's immediate survival. Rather than opening a second front, he adeptly managed the diplomatic tightrope, providing covert support to Mexican resistance while focusing Union resources on the Civil War. This approach allowed the Union to uphold the Monroe Doctrine in the long term without diverting critical resources or risking a premature international conflict, showcasing a nuanced understanding of geopolitical leverage.\n\n## **VII. Vision for Reconstruction and Reconciliation**\n\n### **Lincoln's Ten Percent Plan vs. Congressional Approaches (Wade-Davis Bill)**\n\nAs the Civil War neared its end, Lincoln began to articulate his vision for Reconstruction, aiming for a swift and lenient reintegration of the Southern states into the Union. In December 1863, he announced his **Proclamation of Amnesty and Reconstruction**, commonly known as the **Ten Percent Plan** @https://en.wikipedia.org/wiki/Ten_percent_plan#:~:text=A%20component%20of%20President%20Lincoln's,the%20U.S.%20and%20pledged%20to>  This plan offered pardons and restoration of property (except slaves) to Confederates who swore an oath of allegiance to the Union and accepted emancipation @https://library.fiveable.me/key-terms/apush/proclamation-of-amnesty-and-reconstruction>  A state could be readmitted once 10% of its 1860 voters took this oath and the state recognized the permanent freedom of formerly enslaved people @https://en.wikipedia.org/wiki/Ten_percent_plan#:~:text=A%20component%20of%20President%20Lincoln's,the%20U.S.%20and%20pledged%20to>  Lincoln's objective was to encourage Southern states to surrender quickly and rejoin the Union without harsh penalties, fostering reconciliation and healing @https://library.fiveable.me/key-terms/apush/proclamation-of-amnesty-and-reconstruction> \n\nThis lenient approach, however, met with significant criticism from a faction within his own Republican Party, particularly the **Radical Republicans** @https://library.fiveable.me/key-terms/apush/congress-and-wade-davis-reconstruction>  They viewed Lincoln's plan as too forgiving towards former Confederates and believed it did not adequately protect the civil rights of freed slaves @https://courses.lumenlearning.com/wm-ushistory1/chapter/lincolns-plan/>  In response, Senator Benjamin F. Wade and Representative Henry Winter Davis proposed a more stringent alternative in February 1864: the\n\n**Wade-Davis Bill** @https://library.fiveable.me/key-terms/apush/congress-and-wade-davis-reconstruction>  This bill required a majority (50%) of a state's white male citizens to take a loyalty oath to the U.S. (and swear they had never assisted the Confederacy) for readmission @https://library.fiveable.me/key-terms/apush/congress-and-wade-davis-reconstruction>  It also demanded the abolition of slavery, repudiation of secessionist acts, and refusal to honor wartime debts, and aimed to limit political participation for many former Confederates @https://library.fiveable.me/key-terms/apush/congress-and-wade-davis-reconstruction> \n\nLincoln ultimately pocket-vetoed the Wade-Davis Bill, believing that no Southern state would meet its criteria and that its passage would only delay Reconstruction @https://courses.lumenlearning.com/wm-ushistory1/chapter/lincolns-plan/>  The conflict over these differing approaches highlighted deep divisions within the government regarding how to handle post-war America, setting the stage for future political battles during the Reconstruction Era @https://library.fiveable.me/key-terms/apush/congress-and-wade-davis-reconstruction>  The divergence between Lincoln's Ten Percent Plan and the Wade-Davis Bill reveals a fundamental tension in Reconstruction policy: Lincoln prioritized rapid national reunification and reconciliation, while Radical Republicans emphasized punitive measures and a more robust guarantee of civil rights for formerly enslaved people. Lincoln's pragmatic leniency was a calculated attempt to minimize post-war resentment and accelerate the healing process, even if it meant deferring some aspects of racial justice. This strategic difference ultimately shaped the trajectory of Reconstruction, leading to ongoing conflicts between the executive and legislative branches over the terms of readmission and the future of African Americans in the South.\n\n### **Evolving Stance on Black Suffrage and Rights**\n\nLincoln's views on black rights, particularly suffrage, evolved significantly by the end of his life, demonstrating a progression from his earlier, more cautious positions. While he had long expressed moral opposition to slavery, his initial public career did not call for immediate emancipation or robust objections to laws marginalizing free black men and women @https://www.nps.gov/liho/learn/historyculture/slavery.htm>  He even supported colonization schemes for freed slaves, though these proved impractical and unpopular @https://www.loc.gov/collections/abraham-lincoln-papers/articles-and-essays/abraham-lincoln-and-emancipation/> \n\nHowever, the experience of the Civil War, particularly the Emancipation Proclamation and the vital service of African American troops, compelled Lincoln to alter his attitudes regarding race and citizenship @https://library.fiveable.me/united-states-history-1865/unit-11/emancipation-proclamation-impact/study-guide/hVVIUybj2XmBgn2D>  In his last public speech on April 11, 1865, just days before his assassination, Lincoln became the first president to advocate for any measure of black voting rights @https://www.lincolncottage.org/first-civil-rights-act-1866/>  He proposed extending the vote to African American males who had fought in the U.S. military or were deemed \"intelligent\" @https://www.lincolncottage.org/first-civil-rights-act-1866/>  This was a watershed moment in American politics, signaling a shift towards greater inclusion, despite his earlier statements about not being in favor of making voters or jurors of \"negroes\" @https://www.rbhayes.org/hayes/lincoln-s-evolving-racial-views/> \n\nLincoln's support for the 13th Amendment, which abolished slavery nationwide, further underscored his commitment to ending the institution @https://www.nps.gov/liho/learn/historyculture/slavery.htm>  While he did not live to see its ratification, his actions laid the groundwork for this constitutional change @https://courses.lumenlearning.com/wm-ushistory1/chapter/lincolns-plan/>  His evolving stance, though not fully egalitarian by modern standards, demonstrated a profound shift towards recognizing the rights and aspirations of all Americans to enjoy the nation's promise @https://www.rbhayes.org/hayes/lincoln-s-evolving-racial-views/>  Lincoln's late-stage advocacy for black suffrage, albeit limited, represents a crucial development in his political thought and a significant departure from prevailing racial attitudes of the time. This progression suggests that the immense sacrifices of the Civil War, particularly the contributions of Black soldiers, compelled him to reconsider the parameters of American citizenship and the promise of equality. His final public statements on suffrage, delivered at the precipice of victory, indicate a nascent vision for a more inclusive post-war society, even if the full realization of those rights would require a much longer struggle during Reconstruction.\n\n### **Philosophy of \"Malice Toward None, With Charity For All\"**\n\nLincoln's philosophy for national reconciliation is most powerfully encapsulated in his **Second Inaugural Address**, delivered on March 4, 1865, with the end of the Civil War in sight @https://www.nps.gov/articles/000/-with-malice-toward-none-lincoln-s-second-inaugural.htm>  This speech is widely hailed as one of the most significant presidential addresses in American history, offering a profound reflection on the war's causes and meaning @https://www.nps.gov/articles/000/-with-malice-toward-none-lincoln-s-second-inaugural.htm> \n\nIn this address, Lincoln deliberately avoided placing blame or rejoicing in the imminent Northern victory @https://www.nps.gov/articles/000/-with-malice-toward-none-lincoln-s-second-inaugural.htm>  Instead, he offered conciliatory words to citizens in both the North and the South, emphasizing healing and unity @https://www.nps.gov/articles/000/-with-malice-toward-none-lincoln-s-second-inaugural.htm>  He articulated his belief that the war was best understood as divine punishment for the \"sin of slavery,\" a sin for which all Americans, North and South, were complicit @https://www.nps.gov/articles/000/-with-malice-toward-none-lincoln-s-second-inaugural.htm>  His famous lines, \"With malice toward none, with charity for all, with firmness in the right as God gives us to see the right, let us strive on to finish the work we are in, to bind up the nation's wounds, to care for him who shall have borne the battle and for his widow and his orphan, to do all which may achieve and cherish a just and lasting peace among ourselves and with all nations,\" exemplify his magnanimous approach @https://en.wikipedia.org/wiki/Abraham_Lincoln%27s_second_inaugural_address> \n\nLincoln's vision for peace required decisive victory and unconditional surrender from the Confederacy, but this was to be followed by a magnanimous peace, not retribution or punishment @https://www.nps.gov/articles/000/-with-malice-toward-none-lincoln-s-second-inaugural.htm>  He saw himself as a \"reconciler in a time of radicals and reactionaries,\" seeking to heal a divided nation @https://www.niskanencenter.org/abraham-lincoln-as-a-pragmatist-and-peacemaker-with-john-avalon/>  His use of inclusive language and biblical references throughout the address aimed to connect people to their common responsibility for the war and to move the nation forward towards reconciliation @https://www.nps.gov/articles/000/-with-malice-toward-none-lincoln-s-second-inaugural.htm>  This philosophy stood in stark contrast to the punitive sentiments held by many in the North and provided a moral framework for binding the nation's wounds, even as the path to full reconciliation proved long and arduous after his assassination @https://www.nps.gov/articles/000/-with-malice-toward-none-lincoln-s-second-inaugural.htm>  Lincoln's philosophy of \"malice toward none, with charity for all\" was a deliberate and forward-looking strategy designed to facilitate national healing and prevent prolonged bitterness after the war. By framing the conflict as a shared national burden and divine retribution for slavery, rather than solely a Southern transgression, he sought to create a moral foundation for a magnanimous peace. This approach aimed to reintegrate the Confederate states with minimal resentment, demonstrating his deep understanding that a lasting Union required not just military victory, but also a profound psychological and moral reconciliation among its people.\n\n## **VIII. Conclusion: Lincoln's Enduring Legacy in the Civil War**\n\nAbraham Lincoln's role in the American Civil War was multifaceted and profoundly transformative, extending far beyond that of a mere wartime president. His leadership was characterized by a remarkable blend of unwavering commitment to the Union, pragmatic adaptability, strategic foresight, and an evolving moral compass that ultimately redefined the nation's purpose.\n\nFrom his pre-presidential career, Lincoln consistently opposed the expansion of slavery, viewing it as a moral wrong and an existential threat to the republic, as powerfully articulated in his \"House Divided\" speech. His election in 1860, a culmination of decades of escalating sectionalism driven by slavery, served as the immediate catalyst for Southern secession. In response, Lincoln demonstrated an unyielding resolve to preserve the Union, interpreting his presidential oath as a mandate to defend federal authority and property. His calculated decision to resupply Fort Sumter, ensuring the Confederacy fired the first shot, was a strategic maneuver that solidified Northern resolve and justified the subsequent military mobilization.\n\nAs Commander-in-Chief, Lincoln expanded presidential war powers, taking decisive executive actions to suppress the rebellion, including the implementation of the Anaconda Plan. His persistent search for effective military leadership, culminating in his partnership with Ulysses S. Grant, proved pivotal. This collaboration allowed the Union to develop and execute a comprehensive national strategy that leveraged its superior resources to systematically weaken the Confederacy. Simultaneously, Lincoln's views on slavery evolved significantly, driven by military necessity and growing public sentiment. The Emancipation Proclamation, a bold executive order, fundamentally transformed the war's aims, shifting it from solely preserving the Union to a moral crusade against slavery. This act also strategically bolstered the Union war effort by enabling the enlistment of nearly 200,000 African American soldiers, who played a crucial role in securing victory and advancing the cause of freedom.\n\nDomestically, Lincoln's administration pursued a vigorous agenda of wartime economic policies, including tariffs, national banking acts, and initiatives for western expansion like the Homestead and Pacific Railway Acts. These policies not only financed the war but also laid the groundwork for a stronger, more integrated post-war national economy. Concurrently, he navigated intense political opposition from Copperheads, whom he viewed as a threat to the war effort, and managed the often-contentious relationship with Radical Republicans, whose persistent advocacy for emancipation and black rights pushed his administration towards more progressive stances. His masterful communication strategies, characterized by clarity, brevity, and powerful rhetoric, were instrumental in maintaining public support and unifying a fractured nation.\n\nIn the realm of foreign policy, Lincoln's administration skillfully prevented European recognition of the Confederacy, effectively countering \"King Cotton Diplomacy.\" His diplomatic handling of incidents like the Trent Affair and French intervention in Mexico demonstrated a keen understanding of international relations, prioritizing the avoidance of additional conflicts while subtly supporting Union interests abroad.\n\nFinally, Lincoln's vision for Reconstruction, as articulated in his Ten Percent Plan and his Second Inaugural Address, emphasized reconciliation and healing over retribution. While his approach to black suffrage was evolving and not fully realized at the time of his death, his final public statements indicated a commitment to expanding political rights for African Americans. His philosophy of \"malice toward none, with charity for all\" provided a moral blueprint for reuniting a nation deeply scarred by civil war.\n\nLincoln's enduring legacy in the Civil War lies in his unparalleled ability to adapt, innovate, and lead a nation through its darkest hour. He not only preserved the Union but also fundamentally reshaped its moral foundation by initiating the process that would lead to the abolition of slavery. His strategic acumen, political dexterity, and profound moral conviction cemented his place as a transformative figure in American history, whose actions continue to resonate in discussions of national unity, civil rights, and executive power.\n\n#### 引用的著作\n\n1. A Nation Divided: The Political Climate of 1850s America · The Benjamin Hedrick Ordeal - Civil War Era NC, 访问时间为 八月 4, 2025， <https://cwnc.omeka.chass.ncsu.edu/exhibits/show/benjamin-hedrick/polticalclimate>\n2. States' Rights - Encyclopedia Virginia, 访问时间为 八月 4, 2025， <https://encyclopediavirginia.org/entries/states-rights/>\n3. Analysis: Lincoln's \"House Divided\" Speech | EBSCO Research Starters, 访问时间为 八月 4, 2025， <https://www.ebsco.com/research-starters/history/analysis-lincolns-house-divided-speech>\n4. Historical Analysis of the Lincoln Douglas Debates - College of Liberal Arts, 访问时间为 八月 4, 2025， <https://cla.purdue.edu/academic/history/debate/lincolndouglas/LincolnDouglas.html>\n5. Abraham Lincoln - Wikipedia, 访问时间为 八月 4, 2025， <https://en.wikipedia.org/wiki/Abraham_Lincoln>\n6. www.nps.gov, 访问时间为 八月 4, 2025， <https://www.nps.gov/liho/learn/historyculture/political.htm#:~:text=Pre%2DPresidential%20Political%20Career%201830%2D1860&text=In%201834%20he%20was%20elected,Springfield%2C%20the%20new%20State%20capital.>\n7. Lincoln-Douglas Debates | American Battlefield Trust, 访问时间为 八月 4, 2025， <https://www.battlefields.org/learn/articles/lincoln-douglas-debates>\n8. House Divided Speech - (Speech and Debate) - Vocab, Definition, Explanations - Fiveable, 访问时间为 八月 4, 2025， <https://library.fiveable.me/key-terms/hs-speech-debate/house-divided-speech>\n9. Rhetorical Analysis Of A House Divided Address By Lincoln - Cram, 访问时间为 八月 4, 2025， <https://www.cram.com/essay/Rhetorical-Analysis-Of-A-House-Divided-Address/FJSJ8P9QWT>\n10. 1860 United States presidential election - Wikipedia, 访问时间为 八月 4, 2025， <https://en.wikipedia.org/wiki/1860_United_States_presidential_election>\n11. Lincoln's Tariff War - Mises Institute, 访问时间为 八月 4, 2025， <https://mises.org/mises-daily/lincolns-tariff-war>\n12. Abraham Lincoln: Campaigns and Elections | Miller Center, 访问时间为 八月 4, 2025， <https://millercenter.org/president/lincoln/campaigns-and-elections>\n13. Civil War Prelude Analysis - Army University Press, 访问时间为 八月 4, 2025， <https://www.armyupress.army.mil/Portals/7/educational-services/military-history/CSI_BM_CivilWarPreludeAnalysis.docx>\n14. South Carolina Declaration of Secession (1860) - The National Constitution Center, 访问时间为 八月 4, 2025， <https://constitutioncenter.org/the-constitution/historic-document-library/detail/south-carolina-declaration-of-secession-1860>\n15. The Emancipation Proclamation: Striking a Mighty Blow to Slavery, 访问时间为 八月 4, 2025， <https://nmaahc.si.edu/explore/stories/emancipation-proclamation-striking-mighty-blow-slavery>\n16. The Reaction to the Dred Scott Decision - Chapman University Digital Commons, 访问时间为 八月 4, 2025， <https://digitalcommons.chapman.edu/cgi/viewcontent.cgi?article=1045&context=vocesnovae>\n17. Lincoln on Secession - Lincoln Home National Historic Site (U.S. National Park Service), 访问时间为 八月 4, 2025， <https://www.nps.gov/liho/learn/historyculture/secessiontableofcontents.htm>\n18. President Lincoln's First Inaugural Address, 1861, 访问时间为 八月 4, 2025， <https://www.gilderlehrman.org/history-resources/spotlight-primary-source/president-lincolns-first-inaugural-address-1861>\n19. Lincoln's Uncertain Decision: Fort Sumter, 1861 - The Imaginative Conservative, 访问时间为 八月 4, 2025， <https://theimaginativeconservative.org/2021/07/lincolns-uncertain-decision-fort-sumter-1861-bradley-birzer.html>\n20. Lincoln Resupplies Fort Sumter http://civilwar150.longwood.edu, 访问时间为 八月 4, 2025， <http://www.longwood.edu/fileshare/civilwar150/media/civilwar150-episode25.pdf>\n21. The Civil War: The Senate's Story - U.S. Senate, 访问时间为 八月 4, 2025， <https://www.senate.gov/artandhistory/history/common/civil_war/LincolnEmergencySession_FeaturedDoc.htm>\n22. Lincoln's Critical Month: April 1861 | Abraham Lincoln Presidential ..., 访问时间为 八月 4, 2025， <https://presidentlincoln.illinois.gov/Blog/Posts/184/Civil-War/2024/5/Lincolns-Critical-Month-April-1861/blog-post/>\n23. Lincoln, Abraham | Civil War on the Western Border, 访问时间为 八月 4, 2025， <https://civilwaronthewesternborder.org/encyclopedia/lincoln-abraham>\n24. An Unguaranteed Victory: Military Challenges in the Union Army and Lincoln's Call for a Militia - Digital Commons@Georgia Southern, 访问时间为 八月 4, 2025， <https://digitalcommons.georgiasouthern.edu/cgi/viewcontent.cgi?article=1086&context=aujh>\n25. library.fiveable.me, 访问时间为 八月 4, 2025， <https://library.fiveable.me/key-terms/apush/lincoln-and-the-border-states#:~:text=Lincoln's%20policies%20towards%20the%20border%20states%20were%20instrumental%20in%20shaping,strategic%20advantages%20for%20the%20Confederacy.>\n26. Lincoln & the Border States - (AP US History) - Vocab, Definition, Explanations | Fiveable, 访问时间为 八月 4, 2025， <https://library.fiveable.me/key-terms/apush/lincoln-and-the-border-states>\n27. Lincoln's Suspension of the Writ of Habeas Corpus: An Historical and Constitutional Analysis - University of Michigan, 访问时间为 八月 4, 2025， [https://quod.lib.umich.edu/j/jala/2629860.0029.205/--lincoln-s-suspension-of-the-writ-of-habeas-corpus?rgn=main;view=fulltext](https://quod.lib.umich.edu/j/jala/2629860.0029.205/--lincoln-s-suspension-of-the-writ-of-habeas-corpus?rgn=main;view%3Dfulltext)\n28. Abraham Lincoln and the Border States - University of Michigan, 访问时间为 八月 4, 2025， [https://quod.lib.umich.edu/j/jala/2629860.0013 @https://library.fiveable.me/key-terms/apush/proclamation-of-amnesty-and-reconstruction> /--abraham-lincoln-and-the-border-states?rgn=main;view=fulltext](https://quod.lib.umich.edu/j/jala/2629860.0013 @https://library.fiveable.me/key-terms/apush/proclamation-of-amnesty-and-reconstruction> /--abraham-lincoln-and-the-border-states?rgn=main;view%3Dfulltext)\n29. Abraham Lincoln and Emancipation | Articles and Essays - Library of Congress, 访问时间为 八月 4, 2025， <https://www.loc.gov/collections/abraham-lincoln-papers/articles-and-essays/abraham-lincoln-and-emancipation/>\n30. \"Abraham Lincoln and the Development of the \"War Powers\" of the Preside\" by Allen C. Guelzo - The Cupola: Scholarship at Gettysburg College, 访问时间为 八月 4, 2025， <https://cupola.gettysburg.edu/cwfac/53/>\n31. Lincoln's Constitution: an interview with Daniel Farber, 访问时间为 八月 4, 2025， <https://press.uchicago.edu/Misc/Chicago/237931in.html>\n32. LINCOLN, PRESIDENTIAL POWER, AND THE RULE OF LAW - Scholarly Commons, 访问时间为 八月 4, 2025， <https://scholarlycommons.law.northwestern.edu/cgi/viewcontent.cgi?article=1363&context=nulr>\n33. presidentlincoln.illinois.gov, 访问时间为 八月 4, 2025， <https://presidentlincoln.illinois.gov/Blog/Posts/184/Civil-War/2024/5/Lincolns-Critical-Month-April-1861/blog-post/#:~:text=Seeking%20advice%20from%20General%20Winfield,control%20of%20the%20Mississippi%20River.>\n34. Economic Warfare: The Union Blockade in the Civil War | Naval History Magazine, 访问时间为 八月 4, 2025， <https://www.usni.org/magazines/naval-history-magazine/2021/october/economic-warfare-union-blockade-civil-war>\n35. How effective was the Anaconda Plan during the American Civil War? - Reddit, 访问时间为 八月 4, 2025， <https://www.reddit.com/r/AskHistorians/comments/1sfpbg/how_effective_was_the_anaconda_plan_during_the/>\n36. Union Command Trouble - National Park Service, 访问时间为 八月 4, 2025， <https://www.nps.gov/articles/union-command-trouble.htm>\n37. George B. McClellan - Wikipedia, 访问时间为 八月 4, 2025， <https://en.wikipedia.org/wiki/George_B._McClellan>\n38. Close Reading –Letter to George McClellan – History 288 - Dickinson Blogs, 访问时间为 八月 4, 2025， <https://blogs.dickinson.edu/hist-288pinsker/close-readings/close-reading-letter-to-george-mcclellan/>\n39. Abraham Lincoln and George B. McClellan, 访问时间为 八月 4, 2025， <https://www.abrahamlincolnsclassroom.org/abraham-lincolns-contemporaries/abraham-lincoln-and-george-b-mcclellan/index.html>\n40. George B. McClellan | American Battlefield Trust, 访问时间为 八月 4, 2025， <https://www.battlefields.org/learn/biographies/george-b-mcclellan>\n41. \"Order Relieving General G. B. McClellan and Making Other Changes\" by Abraham Lincoln (1862) - Encyclopedia Virginia, 访问时间为 八月 4, 2025， <https://encyclopediavirginia.org/primary-documents/order-relieving-general-g-b-mcclellan-and-making-other-changes-by-abraham-lincoln-1862/>\n42. Union Success in the Civil War and Lessons for Strategic Leaders - NDU Press, 访问时间为 八月 4, 2025， <https://ndupress.ndu.edu/Media/News/News-Article-View/Article/581883/union-success-in-the-civil-war-and-lessons-for-strategic-leaders/>\n43. Union Success in the Civil War and Lessons for Strategic Leaders - NDU Press, 访问时间为 八月 4, 2025， <https://ndupress.ndu.edu/Media/News/Article/581883/union-success-in-the-civil-war-and-lessons-for-strategic-leaders/>\n44. Lincoln and Grant: Winning the Civil War & the US Presidency - History on the Net, 访问时间为 八月 4, 2025， <https://www.historyonthenet.com/lincoln-and-grant-winning-civil-war-us-presidency>\n45. Sherman's March to the Sea | American Battlefield Trust, 访问时间为 八月 4, 2025， <https://www.battlefields.org/learn/articles/shermans-march-sea>\n46. Sherman's March to the Sea - New Georgia Encyclopedia, 访问时间为 八月 4, 2025， <https://www.georgiaencyclopedia.org/articles/history-archaeology/shermans-march-to-the-sea/>\n47. Letter to William Sherman (December 26, 1864) – Lincoln's Writings - House Divided, 访问时间为 八月 4, 2025， <https://housedivided.dickinson.edu/sites/lincoln/letter-to-william-sherman-december-26-1864/>\n48. General Sherman Offered Savannah as a 'Christmas Gift' to President Lincoln. The Victory Signaled the End of His Brutal March to the Sea - Smithsonian Magazine, 访问时间为 八月 4, 2025， <https://www.smithsonianmag.com/smart-news/general-sherman-offered-savannah-as-a-christmas-gift-to-president-lincoln-the-victory-signaled-the-end-of-his-brutal-march-to-the-sea-180985720/>\n49. Abraham Lincoln and the Guerrillas | National Archives, 访问时间为 八月 4, 2025， <https://www.archives.gov/publications/prologue/2010/spring/lincoln-and-guerrillas>\n50. Abraham Lincoln AND THE Guerrillas - National Archives, 访问时间为 八月 4, 2025， <https://www.archives.gov/files/publications/prologue/2010/spring/civil-war-lincoln-guerrillas.pdf>\n51. LINCOLN AS STRATEGIST: EXERCISING THE ELEMENTS OF NATIONAL POWER, 访问时间为 八月 4, 2025， <https://warroom.armywarcollege.edu/articles/lincoln-as-strategist/>\n52. Lincoln's Presidential Example in Dealing with the Military - University of Michigan, 访问时间为 八月 4, 2025， [https://quod.lib.umich.edu/j/jala/2629860.0007 @https://library.fiveable.me/key-terms/apush/proclamation-of-amnesty-and-reconstruction> /--lincoln-s-presidential-example-in-dealing-with-the-military?rgn=main;view=fulltext](https://quod.lib.umich.edu/j/jala/2629860.0007 @https://library.fiveable.me/key-terms/apush/proclamation-of-amnesty-and-reconstruction> /--lincoln-s-presidential-example-in-dealing-with-the-military?rgn=main;view%3Dfulltext)\n53. Lincoln on Slavery - Lincoln Home National Historic Site (U.S. National Park Service), 访问时间为 八月 4, 2025， <https://www.nps.gov/liho/learn/historyculture/slavery.htm>\n54. General Grant and the Fight to Remove Emperor Maximilian from Mexico, 访问时间为 八月 4, 2025， <https://www.nps.gov/articles/000/general-grant-and-the-fight-to-remove-emperor-maximilian-from-mexico.htm>\n55. Letter to Horace Greeley - (US History – Before 1865) - Vocab, Definition, Explanations | Fiveable, 访问时间为 八月 4, 2025， <https://library.fiveable.me/key-terms/united-states-history-1865/letter-to-horace-greeley>\n56. The Emancipation Proclamation - National Archives, 访问时间为 八月 4, 2025， <https://www.archives.gov/exhibits/featured-documents/emancipation-proclamation>\n57. Emancipation Proclamation and its impact | US History – Before 1865 Class Notes | Fiveable, 访问时间为 八月 4, 2025， <https://library.fiveable.me/united-states-history-1865/unit-11/emancipation-proclamation-impact/study-guide/hVVIUybj2XmBgn2D>\n58. SNAKES LURKING IN THE GRASS: LINCOLN AND THE COPPERHEADS IN THE CIVIL WAR In January 1863, Abraham Lincoln was confronted with a - Gilder Lehrman Institute of American History |, 访问时间为 八月 4, 2025， <https://www.gilderlehrman.org/sites/default/files/inline-pdfs/Hannah%20Teller_Snakes%20Lurking%20in%20the%20Grass_0.pdf>\n59. \"With Malice Toward None...\": Lincoln's Second Inaugural Address - National Park Service, 访问时间为 八月 4, 2025， <https://www.nps.gov/articles/000/-with-malice-toward-none-lincoln-s-second-inaugural.htm>\n60. The Emancipation Proclamation and Its Impact | Honors US History Class Notes - Fiveable, 访问时间为 八月 4, 2025， <https://library.fiveable.me/hs-honors-us-history/unit-7/emancipation-proclamation-impact/study-guide/FrgRKBNYo6BxaNoH>\n61. Lincoln's Plan | United States History I - Lumen Learning, 访问时间为 八月 4, 2025， <https://courses.lumenlearning.com/wm-ushistory1/chapter/lincolns-plan/>\n62. America's First Civil Rights Act - President Lincoln's Cottage | A Home for Brave Ideas, 访问时间为 八月 4, 2025， <https://www.lincolncottage.org/first-civil-rights-act-1866/>\n63. The Emancipation Proclamation Was Also Foreign Policy - ThoughtCo, 访问时间为 八月 4, 2025， <https://www.thoughtco.com/emancipation-proclamation-was-also-foreign-policy-3310345>\n64. Tariffs and the American Civil War, 访问时间为 八月 4, 2025， <https://www.essentialcivilwarcurriculum.com/tariffs-and-the-american-civil-war.html>\n65. National Bank Acts - The Civil War - Senate.gov, 访问时间为 八月 4, 2025， <https://www.senate.gov/artandhistory/history/common/civil_war/NationalBankActs.htm>\n66. National Banking Acts of 1863 and 1864 | Federal Reserve History, 访问时间为 八月 4, 2025， <https://www.federalreservehistory.org/essays/national-banking-acts>\n67. The Homestead Act of 1862 - The Civil War - Senate.gov, 访问时间为 八月 4, 2025， <https://www.senate.gov/artandhistory/history/common/civil_war/Homestead_Act.htm>\n68. Homestead Act (1862) | National Archives, 访问时间为 八月 4, 2025， <https://www.archives.gov/milestone-documents/homestead-act>\n69. Landmark Legislation: The Pacific Railway Act of 1862 - Senate.gov, 访问时间为 八月 4, 2025， <https://www.senate.gov/artandhistory/history/common/generic/PacificRailwayActof1862.htm>\n70. www.archives.gov, 访问时间为 八月 4, 2025， <https://www.archives.gov/milestone-documents/morrill-act#:~:text=Passed%20on%20July%202%2C%201862,tribal%20lands%20of%20Native%20communities.>\n71. Morrill Land Grant College Act - The Civil War - Senate.gov, 访问时间为 八月 4, 2025， <https://www.senate.gov/artandhistory/history/common/civil_war/MorrillLandGrantCollegeAct_FeaturedDoc.htm>\n72. \"Lincoln and the Copperheads: The War for the North\" by Anthony Kellar - The Research Repository @ WVU - West Virginia University, 访问时间为 八月 4, 2025， <https://researchrepository.wvu.edu/wvuhistoricalreview/vol2/iss1/7/>\n73. quod.lib.umich.edu, 访问时间为 八月 4, 2025， [https://quod.lib.umich.edu/j/jala/2629860.0029.205/--lincoln-s-suspension-of-the-writ-of-habeas-corpus?rgn=main;view=fulltext#:~:text=Lincoln's%20power%20to%20suspend%20the,their%20uncertain%20grounding%20in%20the](https://quod.lib.umich.edu/j/jala/2629860.0029.205/--lincoln-s-suspension-of-the-writ-of-habeas-corpus?rgn=main;view%3Dfulltext#:~:text=Lincoln's%20power%20to%20suspend%20the,their%20uncertain%20grounding%20in%20the)\n74. www.abrahamlincolnonline.org, 访问时间为 八月 4, 2025， <https://www.abrahamlincolnonline.org/lincoln/speeches/corning.htm#:~:text=I%20concede%20that%20the%20class,they%20may%20prevent%20the%20rebellion>\n75. Letter by Abraham Lincoln to Erastus Corning, 访问时间为 八月 4, 2025， <https://www.abrahamlincolnonline.org/lincoln/speeches/corning.htm>\n76. library.fiveable.me, 访问时间为 八月 4, 2025， <https://library.fiveable.me/key-terms/apush/habeas-corpus-suspension#:~:text=The%20suspension%20of%20habeas%20corpus,dangerous%20precedent%20for%20future%20governments.>\n77. Lincoln and the Constitution: From the Civil War to the War on Terror - Encompass, 访问时间为 八月 4, 2025， <https://encompass.eku.edu/cgi/viewcontent.cgi?article=1027&context=tcj>\n78. The Lincoln Administration and Arbitrary Arrests: A Reconsideration - University of Michigan, 访问时间为 八月 4, 2025， [https://quod.lib.umich.edu/j/jala/2629860.0005 @https://en.wikipedia.org/wiki/Ten_percent_plan#:~:text=A%20component%20of%20President%20Lincoln's,the%20U.S.%20and%20pledged%20to> /--lincoln-administration-and-arbitrary-arrests?rgn=main;view=fulltext](https://quod.lib.umich.edu/j/jala/2629860.0005 @https://en.wikipedia.org/wiki/Ten_percent_plan#:~:text=A%20component%20of%20President%20Lincoln's,the%20U.S.%20and%20pledged%20to> /--lincoln-administration-and-arbitrary-arrests?rgn=main;view%3Dfulltext)\n79. Censorship and the C\\*\\*\\* W - Pieces of History, 访问时间为 八月 4, 2025， <https://prologue.blogs.archives.gov/2010/11/04/censorship-and-the-c-w/>\n80. Lincoln and the Power of the Press: The War for Public Opinion - LSU Scholarly Repository, 访问时间为 八月 4, 2025， <https://repository.lsu.edu/cgi/viewcontent.cgi?article=2340&context=cwbr>\n81. Lincoln and the Copperheads: The War for the North - The Research Repository @ WVU - West Virginia University, 访问时间为 八月 4, 2025， <https://researchrepository.wvu.edu/cgi/viewcontent.cgi?article=1012&context=wvuhistoricalreview>\n82. The Enrollment Act Riots in New York - Pritzker Military Museum & Library, 访问时间为 八月 4, 2025， <https://www.pritzkermilitary.org/explore/museum/past-exhibits/dignity-duty-journals-erasmus-corwin-gilbreath/riots-new-york>\n83. Abraham Lincoln's First Amendment - Chicago Unbound, 访问时间为 八月 4, 2025， [https://chicagounbound.uchicago.edu/cgi/viewcontent.cgi?referer=&httpsredir=1&article=2953&context=journal\\_articles](https://chicagounbound.uchicago.edu/cgi/viewcontent.cgi?referer&httpsredir=1&article=2953&context=journal_articles)\n84. The Radical Republicans - Texas Christian University, 访问时间为 八月 4, 2025， <https://personal.tcu.edu/swoodworth/trefousse-rr.htm>\n85. en.wikipedia.org, 访问时间为 八月 4, 2025， <https://en.wikipedia.org/wiki/Radical_Republicans#:~:text=After%20the%201860%20elections%2C%20moderate,including%20Radicals%20like%20Salmon%20P.>\n86. Congress and Wade-Davis Reconstruction - (AP US History) - Vocab, Definition, Explanations | Fiveable, 访问时间为 八月 4, 2025， <https://library.fiveable.me/key-terms/apush/congress-and-wade-davis-reconstruction>\n87. brainly.com, 访问时间为 八月 4, 2025， <https://brainly.com/question/55526433#:~:text=President%20Lincoln%20primarily%20relied%20on,policies%20during%20this%20critical%20period.>\n88. presidentlincoln.illinois.gov, 访问时间为 八月 4, 2025， <https://presidentlincoln.illinois.gov/Resources/8cbe6700-ce47-4ff8-a5d8-7fda74b05c64/gettysburg-address-lessons.pdf>\n89. The Power of Brevity - Newsroom | University of St. Thomas, 访问时间为 八月 4, 2025， <https://news.stthomas.edu/publication-article/the-power-of-brevity/>\n90. Congress passes Civil War Conscription Act | March 3, 1863 - History.com, 访问时间为 八月 4, 2025， <https://www.history.com/this-day-in-history/march-3/congress-passes-civil-war-conscription-act>\n91. Diplomacy of the American Civil War - Wikipedia, 访问时间为 八月 4, 2025， <https://en.wikipedia.org/wiki/Diplomacy_of_the_American_Civil_War>\n92. Union and Confederate Diplomacy During the Civil War, 访问时间为 八月 4, 2025， <https://www.essentialcivilwarcurriculum.com/union-and-confederate-diplomacy-during-the-civil-war.html>\n93. The Trent Affair, 1861 - Milestones in the History of U.S. Foreign Relations - Office of the Historian, 访问时间为 八月 4, 2025， <https://history.state.gov/milestones/1861-1865/trent-affair>\n94. France and the American Civil War - Wikipedia, 访问时间为 八月 4, 2025， <https://en.wikipedia.org/wiki/France_and_the_American_Civil_War>\n95. Immediate Effects of the Emancipation Proclamation - Historical Society of Pennsylvania, 访问时间为 八月 4, 2025， <https://www.portal.hsp.org/unit-plan-items/unit-plan-34>\n96. Trent Affair - Wikipedia, 访问时间为 八月 4, 2025， <https://en.wikipedia.org/wiki/Trent_Affair>\n97. Lessons in Diplomacy: Reassessing the Trent Affair - The Journal of the Civil War Era, 访问时间为 八月 4, 2025， <https://www.journalofthecivilwarera.org/2017/11/lessons-diplomacy-reassessing-trent-affair/>\n98. U.S. Senate: The Civil War: The Senate's Story, 访问时间为 八月 4, 2025， <https://www.senate.gov/artandhistory/history/common/civil_war/TrentAffair_FeaturedDoc.htm>\n99. Did the United Kingdom ever consider intervening in the American Civil War? Did any world power? If so, why? - Reddit, 访问时间为 八月 4, 2025， <https://www.reddit.com/r/AskHistorians/comments/336rh7/did_the_united_kingdom_ever_consider_intervening/>\n100. Cotton diplomacy - Wikipedia, 访问时间为 八月 4, 2025， <https://en.wikipedia.org/wiki/Cotton_diplomacy>\n101. Solved Initially the Confederacy sought King Cotton | Chegg.com, 访问时间为 八月 4, 2025， <https://www.chegg.com/homework-help/questions-and-answers/initially-confederacy-sought-king-cotton-diplomacy-strategy-based-belief-raising-price-cot-q215200665>\n102. Lincoln Helped Mexico Defeat the French, 访问时间为 八月 4, 2025， <https://lincolnandmexicoproject.wordpress.com/2016/12/05/lincoln-helped-mexico-defeat-the-french/>\n103. en.wikipedia.org, 访问时间为 八月 4, 2025， <https://en.wikipedia.org/wiki/Ten_percent_plan#:~:text=A%20component%20of%20President%20Lincoln's,the%20U.S.%20and%20pledged%20to>\n104. Proclamation of Amnesty and Reconstruction - (AP US History) - Vocab, Definition, Explanations | Fiveable, 访问时间为 八月 4, 2025， <https://library.fiveable.me/key-terms/apush/proclamation-of-amnesty-and-reconstruction>\n105. Reconstruction Timeline | American Experience | Official Site - PBS, 访问时间为 八月 4, 2025， <https://www.pbs.org/wgbh/americanexperience/features/reconstruction-timeline/>\n106. Lincoln's Ten Percent Plan - (AP US History) - Vocab, Definition, Explanations | Fiveable, 访问时间为 八月 4, 2025， <https://library.fiveable.me/key-terms/apush/lincolns-ten-percent-plan>\n107. Wade-Davis Bill (1864) | National Archives, 访问时间为 八月 4, 2025， <https://www.archives.gov/milestone-documents/wade-davis-bill>\n108. en.wikipedia.org, 访问时间为 八月 4, 2025， <https://en.wikipedia.org/wiki/Ten_percent_plan#:~:text=Most%20moderate%20Republicans%20in%20Congress,re%2Denslavement%20or%20systemic%20oppression.>\n109. Reuniting the Union: A Chronology - Digital History, 访问时间为 八月 4, 2025， <https://www.digitalhistory.uh.edu/disp_textbook.cfm?smtID=2&psid=3096>\n110. en.wikipedia.org, 访问时间为 八月 4, 2025， <https://en.wikipedia.org/wiki/Reconstruction_era#:~:text=Radical%20and%20moderate%20Republicans%20disagreed,proposed%20strict%20conditions%20for%20readmission.>\n111. \"Lincoln's Evolving Racial Views\" - Rutherford B. Hayes Presidential Library & Museums, 访问时间为 八月 4, 2025， <https://www.rbhayes.org/hayes/lincoln-s-evolving-racial-views/>\n112. www.americanbar.org, 访问时间为 八月 4, 2025， <https://www.americanbar.org/groups/dispute_resolution/resources/magazine/2024-september/lincolns-vision-reconciliation-all-americans/#:~:text=Lincoln's%20second%20inaugural%20address%20called,more%20just%20and%20unified%20nation.>\n113. Abraham Lincoln's second inaugural address - Wikipedia, 访问时间为 八月 4, 2025， <https://en.wikipedia.org/wiki/Abraham_Lincoln%27s_second_inaugural_address>\n114. Abraham Lincoln as a Pragmatist and Peacemaker, with John Avlon - Niskanen Center, 访问时间为 八月 4, 2025， <https://www.niskanencenter.org/abraham-lincoln-as-a-pragmatist-and-peacemaker-with-john-avalon/>\n",
  "all_source_links": [
    "http://civilwar150.longwood.edu,",
    "http://civilwar150.longwood.eduscholarlycommons.law.northwestern.eduLINCOLN,",
    "http://www.longwood.edu/fileshare/civilwar150/media/civilwar150-episode25.pdf",
    "https://accounts.google.com/SignOutOptions?hl=zh-CN&continue=https://gemini.google.com/app%3Fis_sa%3D1%26is_sa%3D1%26android-min-version%3D301356232%26ios-min-version%3D322.0%26campaign_id%3Dbkws%26utm_source%3Dsem%26utm_source%3Dgoogle%26utm_medium%3Dpaid-media%26utm_medium%3Dcpc%26utm_campaign%3Dbkws%26utm_campaign%3D2024enAU_gemfeb%26pt%3D9008%26mt%3D8%26ct%3Dp-growth-sem-bkws%26gclsrc%3Daw.ds%26gad_source%3D1%26gad_campaignid%3D22437964261%26gbraid%3D0AAAAApk5BhmTIKeu82GeBI85qNScnwP3m%26gclid%3DCjwKCAjwkvbEBhApEiwAKUz6-ybVgRKghbvMe_m6J9HfhKccGbx5pv_fQCiPXewPYkQWthYXErb2txoClPAQAvD_BwE&ec=GBRAkgU",
    "https://blogs.dickinson.edu/hist-288pinsker/close-readings/close-reading-letter-to-george-mcclellan",
    "https://brainly.com/question/55526433#:~:text=President%20Lincoln%20primarily%20relied%20on,policies%20during%20this%20critical%20period.",
    "https://chicagounbound.uchicago.edu/cgi/viewcontent.cgi?referer&httpsredir=1&article=2953&context=journal_articles",
    "https://chicagounbound.uchicago.edu/cgi/viewcontent.cgi?referer=&httpsredir=1&article=2953&context=journal",
    "https://chicagounbound.uchicago.edu/cgi/viewcontent.cgi?referer=&httpsredir=1&article=2953&context=journal\\_articles",
    "https://chicagounbound.uchicago.edu/cgi/viewcontent.cgi?referer=&httpsredir=1&article=2953&context=journal_articles",
    "https://civilwaronthewesternborder.org/encyclopedia/lincoln-abraham",
    "https://cla.purdue.edu/academic/history/debate/lincolndouglas/LincolnDouglas.html",
    "https://constitutioncenter.org/the-constitution/historic-document-library/detail/south-carolina-declaration-of-secession-1860",
    "https://courses.lumenlearning.com/wm-ushistory1/chapter/lincolns-plan",
    "https://cptl.asu.edu/gettysburg-address",
    "https://cupola.gettysburg.edu/cwfac/53",
    "https://cwnc.omeka.chass.ncsu.edu/exhibits/show/benjamin-hedrick/polticalclimate",
    "https://digitalcommons.chapman.edu/cgi/viewcontent.cgi?article=1045&context=vocesnovae",
    "https://digitalcommons.georgiasouthern.edu/cgi/viewcontent.cgi?article=1086&context=aujh",
    "https://emergingcivilwar.com/2024/07/30/commander-in-chief-at-civil-war-abraham-lincoln/#:~:text=Lincoln's%20most%20important%20role%20as,objectives%20he%20sought%20to%20achieve.",
    "https://en.wikipedia.org/wiki/1860_United_States_presidential_election",
    "https://en.wikipedia.org/wiki/Abraham_Lincoln",
    "https://en.wikipedia.org/wiki/Abraham_Lincoln%27s_second_inaugural_address",
    "https://en.wikipedia.org/wiki/Abraham_Lincoln_and_slavery",
    "https://en.wikipedia.org/wiki/Confederate_States_of_America#:~:text=The%20Civil%20War%20began%20in,seceded%20and%20joined%20the%20Confederacy.",
    "https://en.wikipedia.org/wiki/Cotton_diplomacy",
    "https://en.wikipedia.org/wiki/Diplomacy_of_the_American_Civil_War",
    "https://en.wikipedia.org/wiki/France_and_the_American_Civil_War",
    "https://en.wikipedia.org/wiki/George_B._McClellan",
    "https://en.wikipedia.org/wiki/Non-intervention_in_the_Spanish_Civil_War",
    "https://en.wikipedia.org/wiki/Radical_Republicans#:~:text=After%20the%201860%20elections%2C%20moderate,including%20Radicals%20like%20Salmon%20P.",
    "https://en.wikipedia.org/wiki/Reconstruction_era#:~:text=Radical%20and%20moderate%20Republicans%20disagreed,proposed%20strict%20conditions%20for%20readmission.",
    "https://en.wikipedia.org/wiki/Ten_percent_plan#:~:text=A%20component%20of%20President%20Lincoln's,the%20U.S.%20and%20pledged%20to",
    "https://en.wikipedia.org/wiki/Ten_percent_plan#:~:text=Most%20moderate%20Republicans%20in%20Congress,re%2Denslavement%20or%20systemic%20oppression.",
    "https://en.wikipedia.org/wiki/Trent_Affair",
    "https://encompass.eku.edu/cgi/viewcontent.cgi?article=1027&context=tcj",
    "https://encyclopediavirginia.org/entries/states-rights",
    "https://encyclopediavirginia.org/primary-documents/order-relieving-general-g-b-mcclellan-and-making-other-changes-by-abraham-lincoln-1862",
    "https://history.state.gov/milestones/1861-1865/trent-affair",
    "https://housedivided.dickinson.edu/sites/lincoln/letter-to-william-sherman-december-26-1864",
    "https://library.fiveable.me/hs-honors-us-history/unit-7/emancipation-proclamation-impact/study-guide/FrgRKBNYo6BxaNoH",
    "https://library.fiveable.me/key-terms/apush/congress-and-wade-davis-reconstruction",
    "https://library.fiveable.me/key-terms/apush/habeas-corpus-suspension#:~:text=The%20suspension%20of%20habeas%20corpus,dangerous%20precedent%20for%20future%20governments.",
    "https://library.fiveable.me/key-terms/apush/lincoln-and-the-border-states",
    "https://library.fiveable.me/key-terms/apush/lincoln-and-the-border-states#:~:text=Lincoln's%20policies%20towards%20the%20border%20states%20were%20instrumental%20in%20shaping,strategic%20advantages%20for%20the%20Confederacy.",
    "https://library.fiveable.me/key-terms/apush/lincolns-ten-percent-plan",
    "https://library.fiveable.me/key-terms/apush/proclamation-of-amnesty-and-reconstruction",
    "https://library.fiveable.me/key-terms/hs-speech-debate/house-divided-speech",
    "https://library.fiveable.me/key-terms/united-states-history-1865/letter-to-horace-greeley",
    "https://library.fiveable.me/united-states-history-1865/unit-11/emancipation-proclamation-impact/study-guide/hVVIUybj2XmBgn2D",
    "https://library.unr.edu/places/knowledge-center/basque-library/projects/gernika/the-bombing-of-gernika/non-intervention-committee",
    "https://lincolnandmexicoproject.wordpress.com/2016/12/05/lincoln-helped-mexico-defeat-the-french",
    "https://millercenter.org/president/lincoln/campaigns-and-elections",
    "https://mises.org/mises-daily/lincolns-tariff-war",
    "https://myactivity.google.com/product/gemini?utm_source=gemini",
    "https://ndupress.ndu.edu/Media/News/Article/581883/union-success-in-the-civil-war-and-lessons-for-strategic-leaders",
    "https://ndupress.ndu.edu/Media/News/News-Article-View/Article/581883/union-success-in-the-civil-war-and-lessons-for-strategic-leaders",
    "https://news.stthomas.edu/publication-article/the-power-of-brevity",
    "https://nmaahc.si.edu/explore/stories/emancipation-proclamation-striking-mighty-blow-slavery",
    "https://online.ucpress.edu/currenthistory/article-pdf/49/3/26/663986/curh.1938.49.3.26.pdf",
    "https://personal.tcu.edu/swoodworth/trefousse-rr.htm",
    "https://policies.google.com/terms",
    "https://presidentlincoln.illinois.gov/Blog/Posts/184/Civil-War/2024/5/Lincolns-Critical-Month-April-1861/blog-post",
    "https://presidentlincoln.illinois.gov/Blog/Posts/184/Civil-War/2024/5/Lincolns-Critical-Month-April-1861/blog-post/#:~:text=Seeking%20advice%20from%20General%20Winfield,control%20of%20the%20Mississippi%20River.",
    "https://presidentlincoln.illinois.gov/Resources/8cbe6700-ce47-4ff8-a5d8-7fda74b05c64/gettysburg-address-lessons.pdf",
    "https://presidentlincoln.illinois.gov/exhibits/online-exhibits/emancipationproclamation",
    "https://press.uchicago.edu/Misc/Chicago/237931in.html",
    "https://prologue.blogs.archives.gov/2010/11/04/censorship-and-the-c-w",
    "https://quod.lib.umich.edu/j/jala/2629860.0005.103/--lincoln-administration-and-arbitrary-arrests?rgn=main;view%3Dfulltext",
    "https://quod.lib.umich.edu/j/jala/2629860.0005.103/--lincoln-administration-and-arbitrary-arrests?rgn=main;view=fulltext",
    "https://quod.lib.umich.edu/j/jala/2629860.0007.104/--lincoln-s-presidential-example-in-dealing-with-the-military?rgn=main;view%3Dfulltext",
    "https://quod.lib.umich.edu/j/jala/2629860.0007.104/--lincoln-s-presidential-example-in-dealing-with-the-military?rgn=main;view=fulltext",
    "https://quod.lib.umich.edu/j/jala/2629860.0013.104/--abraham-lincoln-and-the-border-states?rgn=main;view%3Dfulltext",
    "https://quod.lib.umich.edu/j/jala/2629860.0013.104/--abraham-lincoln-and-the-border-states?rgn=main;view=fulltext",
    "https://quod.lib.umich.edu/j/jala/2629860.0029.205/--lincoln-s-suspension-of-the-writ-of-habeas-corpus?rgn=main;view%3Dfulltext",
    "https://quod.lib.umich.edu/j/jala/2629860.0029.205/--lincoln-s-suspension-of-the-writ-of-habeas-corpus?rgn=main;view%3Dfulltext#:~:text=Lincoln's%20power%20to%20suspend%20the,their%20uncertain%20grounding%20in%20the",
    "https://quod.lib.umich.edu/j/jala/2629860.0029.205/--lincoln-s-suspension-of-the-writ-of-habeas-corpus?rgn=main;view=fulltext",
    "https://quod.lib.umich.edu/j/jala/2629860.0029.205/--lincoln-s-suspension-of-the-writ-of-habeas-corpus?rgn=main;view=fulltext#:~:text=Lincoln's%20power%20to%20suspend%20the,their%20uncertain%20grounding%20in%20the",
    "https://repository.lsu.edu/cgi/viewcontent.cgi?article=2340&context=cwbr",
    "https://researchrepository.wvu.edu/cgi/viewcontent.cgi?article=1012&context=wvuhistoricalreview",
    "https://researchrepository.wvu.edu/wvuhistoricalreview/vol2/iss1/7",
    "https://scholarlycommons.law.northwestern.edu/cgi/viewcontent.cgi?article=1363&context=nulr",
    "https://support.google.com/bard/answer/13594961",
    "https://support.google.com/gemini/answer/13594961#location&zippy=%2Cwhat-location-information-do-gemini-apps-collect-why-and-how-is-it-used",
    "https://theimaginativeconservative.org/2021/07/lincolns-uncertain-decision-fort-sumter-1861-bradley-birzer.html",
    "https://warroom.armywarcollege.edu/articles/lincoln-as-strategist",
    "https://www.abrahamlincolnonline.org/lincoln/speeches/corning.htm",
    "https://www.abrahamlincolnonline.org/lincoln/speeches/corning.htm#:~:text=I%20concede%20that%20the%20class,they%20may%20prevent%20the%20rebellion",
    "https://www.abrahamlincolnsclassroom.org/abraham-lincolns-contemporaries/abraham-lincoln-and-george-b-mcclellan/index.html",
    "https://www.americanbar.org/groups/dispute_resolution/resources/magazine/2024-september/lincolns-vision-reconciliation-all-americans/#:~:text=Lincoln's%20second%20inaugural%20address%20called,more%20just%20and%20unified%20nation.",
    "https://www.archives.gov/exhibits/featured-documents/emancipation-proclamation",
    "https://www.archives.gov/files/publications/prologue/2010/spring/civil-war-lincoln-guerrillas.pdf",
    "https://www.archives.gov/milestone-documents/homestead-act",
    "https://www.archives.gov/milestone-documents/morrill-act#:~:text=Passed%20on%20July%202%2C%201862,tribal%20lands%20of%20Native%20communities.",
    "https://www.archives.gov/milestone-documents/wade-davis-bill",
    "https://www.archives.gov/publications/prologue/2010/spring/lincoln-and-guerrillas",
    "https://www.armyupress.army.mil/Portals/7/educational-services/military-history/CSI_BM_CivilWarPreludeAnalysis.docx",
    "https://www.battlefields.org/learn/articles/election-1864-and-soldiers-vote",
    "https://www.battlefields.org/learn/articles/lincoln-douglas-debates",
    "https://www.battlefields.org/learn/articles/shermans-march-sea",
    "https://www.battlefields.org/learn/biographies/george-b-mcclellan",
    "https://www.chegg.com/homework-help/questions-and-answers/initially-confederacy-sought-king-cotton-diplomacy-strategy-based-belief-raising-price-cot-q215200665",
    "https://www.cram.com/essay/Rhetorical-Analysis-Of-A-House-Divided-Address/FJSJ8P9QWT",
    "https://www.digitalhistory.uh.edu/disp_textbook.cfm?smtID=2&psid=3096",
    "https://www.ebsco.com/research-starters/history/analysis-abraham-lincolns-first-inaugural-address",
    "https://www.ebsco.com/research-starters/history/analysis-exchange-letters-between-horace-greeley-and-abraham-lincoln",
    "https://www.ebsco.com/research-starters/history/analysis-lincolns-house-divided-speech",
    "https://www.ebsco.com/research-starters/history/gettysburg-address",
    "https://www.essentialcivilwarcurriculum.com/tariffs-and-the-american-civil-war.html",
    "https://www.essentialcivilwarcurriculum.com/union-and-confederate-diplomacy-during-the-civil-war.html",
    "https://www.federalreservehistory.org/essays/national-banking-acts",
    "https://www.gauthmath.com/solution/1818162008805573/Initially-the-Confederacy-pursued-King-Cotton-diplomacy-a-strategy-based-on-the-",
    "https://www.georgiaencyclopedia.org/articles/history-archaeology/shermans-march-to-the-sea",
    "https://www.gilderlehrman.org/history-resources/spotlight-primary-source/president-lincolns-first-inaugural-address-1861",
    "https://www.gilderlehrman.org/sites/default/files/inline-pdfs/Hannah%20Teller_Snakes%20Lurking%20in%20the%20Grass_0.pdf",
    "https://www.history.com/this-day-in-history/january-27/lincoln-orders-armies-to-advance#:~:text=On%20January%2027%2C%201862%2C%20President,the%20offensive%20against%20Confederate%20forces.",
    "https://www.history.com/this-day-in-history/march-3/congress-passes-civil-war-conscription-act",
    "https://www.history.com/this-day-in-history/november-8/lincoln-reelected",
    "https://www.historyonthenet.com/lincoln-and-grant-winning-civil-war-us-presidency",
    "https://www.journalofthecivilwarera.org/2017/11/lessons-diplomacy-reassessing-trent-affair",
    "https://www.lincolncottage.org/first-civil-rights-act-1866",
    "https://www.loc.gov/collections/abraham-lincoln-papers/articles-and-essays/abraham-lincoln-and-emancipation",
    "https://www.loc.gov/exhibits/african-american-odyssey/reconstruction.html",
    "https://www.napoleon.org/en/history-of-the-two-empires/articles/the-second-empire-and-the-american-civil-war",
    "https://www.niskanencenter.org/abraham-lincoln-as-a-pragmatist-and-peacemaker-with-john-avalon",
    "https://www.nps.gov/articles/000/-with-malice-toward-none-lincoln-s-second-inaugural.htm",
    "https://www.nps.gov/articles/000/general-grant-and-the-fight-to-remove-emperor-maximilian-from-mexico.htm",
    "https://www.nps.gov/articles/union-command-trouble.htm",
    "https://www.nps.gov/liho/learn/historyculture/political.htm#:~:text=Pre%2DPresidential%20Political%20Career%201830%2D1860&text=In%201834%20he%20was%20elected,Springfield%2C%20the%20new%20State%20capital.",
    "https://www.nps.gov/liho/learn/historyculture/secessiontableofcontents.htm",
    "https://www.nps.gov/liho/learn/historyculture/slavery.htm",
    "https://www.owleyes.org/text/house-divided-speech/analysis/rhetorical-devices",
    "https://www.pbs.org/wgbh/americanexperience/features/reconstruction-timeline",
    "https://www.portal.hsp.org/unit-plan-items/unit-plan-34",
    "https://www.presidency.ucsb.edu/documents/executive-order-general-war-order-no-1",
    "https://www.pritzkermilitary.org/explore/museum/past-exhibits/dignity-duty-journals-erasmus-corwin-gilbreath/riots-new-york",
    "https://www.rbhayes.org/hayes/lincoln-s-evolving-racial-views",
    "https://www.reddit.com/r/AskHistorians/comments/1sfpbg/how_effective_was_the_anaconda_plan_during_the",
    "https://www.reddit.com/r/AskHistorians/comments/336rh7/did_the_united_kingdom_ever_consider_intervening",
    "https://www.senate.gov/artandhistory/history/common/civil_war/Homestead_Act.htm",
    "https://www.senate.gov/artandhistory/history/common/civil_war/LincolnEmergencySession_FeaturedDoc.htm",
    "https://www.senate.gov/artandhistory/history/common/civil_war/MorrillLandGrantCollegeAct_FeaturedDoc.htm",
    "https://www.senate.gov/artandhistory/history/common/civil_war/NationalBankActs.htm",
    "https://www.senate.gov/artandhistory/history/common/civil_war/TrentAffair_FeaturedDoc.htm",
    "https://www.senate.gov/artandhistory/history/common/generic/PacificRailwayActof1862.htm",
    "https://www.smithsonianmag.com/smart-news/general-sherman-offered-savannah-as-a-christmas-gift-to-president-lincoln-the-victory-signaled-the-end-of-his-brutal-march-to-the-sea-180985720",
    "https://www.tandfonline.com/doi/full/10.1080/09592296.2020.1721059",
    "https://www.thoughtco.com/emancipation-proclamation-was-also-foreign-policy-3310345",
    "https://www.usni.org/magazines/naval-history-magazine/2021/october/economic-warfare-union-blockade-civil-war"
  ],
  "summary_citations": [
    "http://civilwar150.longwood.edu,",
    "http://civilwar150.longwood.eduscholarlycommons.law.northwestern.eduLINCOLN,",
    "http://www.longwood.edu/fileshare/civilwar150/media/civilwar150-episode25.pdf",
    "https://accounts.google.com/SignOutOptions?hl=zh-CN&continue=https://gemini.google.com/app%3Fis_sa%3D1%26is_sa%3D1%26android-min-version%3D301356232%26ios-min-version%3D322.0%26campaign_id%3Dbkws%26utm_source%3Dsem%26utm_source%3Dgoogle%26utm_medium%3Dpaid-media%26utm_medium%3Dcpc%26utm_campaign%3Dbkws%26utm_campaign%3D2024enAU_gemfeb%26pt%3D9008%26mt%3D8%26ct%3Dp-growth-sem-bkws%26gclsrc%3Daw.ds%26gad_source%3D1%26gad_campaignid%3D22437964261%26gbraid%3D0AAAAApk5BhmTIKeu82GeBI85qNScnwP3m%26gclid%3DCjwKCAjwkvbEBhApEiwAKUz6-ybVgRKghbvMe_m6J9HfhKccGbx5pv_fQCiPXewPYkQWthYXErb2txoClPAQAvD_BwE&ec=GBRAkgU",
    "https://blogs.dickinson.edu/hist-288pinsker/close-readings/close-reading-letter-to-george-mcclellan",
    "https://brainly.com/question/55526433#:~:text=President%20Lincoln%20primarily%20relied%20on,policies%20during%20this%20critical%20period.",
    "https://chicagounbound.uchicago.edu/cgi/viewcontent.cgi?referer&httpsredir=1&article=2953&context=journal_articles",
    "https://chicagounbound.uchicago.edu/cgi/viewcontent.cgi?referer=&httpsredir=1&article=2953&context=journal",
    "https://chicagounbound.uchicago.edu/cgi/viewcontent.cgi?referer=&httpsredir=1&article=2953&context=journal\\_articles",
    "https://chicagounbound.uchicago.edu/cgi/viewcontent.cgi?referer=&httpsredir=1&article=2953&context=journal_articles",
    "https://civilwaronthewesternborder.org/encyclopedia/lincoln-abraham",
    "https://cla.purdue.edu/academic/history/debate/lincolndouglas/LincolnDouglas.html",
    "https://constitutioncenter.org/the-constitution/historic-document-library/detail/south-carolina-declaration-of-secession-1860",
    "https://courses.lumenlearning.com/wm-ushistory1/chapter/lincolns-plan",
    "https://cptl.asu.edu/gettysburg-address",
    "https://cupola.gettysburg.edu/cwfac/53",
    "https://cwnc.omeka.chass.ncsu.edu/exhibits/show/benjamin-hedrick/polticalclimate",
    "https://digitalcommons.chapman.edu/cgi/viewcontent.cgi?article=1045&context=vocesnovae",
    "https://digitalcommons.georgiasouthern.edu/cgi/viewcontent.cgi?article=1086&context=aujh",
    "https://emergingcivilwar.com/2024/07/30/commander-in-chief-at-civil-war-abraham-lincoln/#:~:text=Lincoln's%20most%20important%20role%20as,objectives%20he%20sought%20to%20achieve.",
    "https://en.wikipedia.org/wiki/1860_United_States_presidential_election",
    "https://en.wikipedia.org/wiki/Abraham_Lincoln",
    "https://en.wikipedia.org/wiki/Abraham_Lincoln%27s_second_inaugural_address",
    "https://en.wikipedia.org/wiki/Abraham_Lincoln_and_slavery",
    "https://en.wikipedia.org/wiki/Confederate_States_of_America#:~:text=The%20Civil%20War%20began%20in,seceded%20and%20joined%20the%20Confederacy.",
    "https://en.wikipedia.org/wiki/Cotton_diplomacy",
    "https://en.wikipedia.org/wiki/Diplomacy_of_the_American_Civil_War",
    "https://en.wikipedia.org/wiki/France_and_the_American_Civil_War",
    "https://en.wikipedia.org/wiki/George_B._McClellan",
    "https://en.wikipedia.org/wiki/Non-intervention_in_the_Spanish_Civil_War",
    "https://en.wikipedia.org/wiki/Radical_Republicans#:~:text=After%20the%201860%20elections%2C%20moderate,including%20Radicals%20like%20Salmon%20P.",
    "https://en.wikipedia.org/wiki/Reconstruction_era#:~:text=Radical%20and%20moderate%20Republicans%20disagreed,proposed%20strict%20conditions%20for%20readmission.",
    "https://en.wikipedia.org/wiki/Ten_percent_plan#:~:text=A%20component%20of%20President%20Lincoln's,the%20U.S.%20and%20pledged%20to",
    "https://en.wikipedia.org/wiki/Ten_percent_plan#:~:text=Most%20moderate%20Republicans%20in%20Congress,re%2Denslavement%20or%20systemic%20oppression.",
    "https://en.wikipedia.org/wiki/Trent_Affair",
    "https://encompass.eku.edu/cgi/viewcontent.cgi?article=1027&context=tcj",
    "https://encyclopediavirginia.org/entries/states-rights",
    "https://encyclopediavirginia.org/primary-documents/order-relieving-general-g-b-mcclellan-and-making-other-changes-by-abraham-lincoln-1862",
    "https://history.state.gov/milestones/1861-1865/trent-affair",
    "https://housedivided.dickinson.edu/sites/lincoln/letter-to-william-sherman-december-26-1864",
    "https://library.fiveable.me/hs-honors-us-history/unit-7/emancipation-proclamation-impact/study-guide/FrgRKBNYo6BxaNoH",
    "https://library.fiveable.me/key-terms/apush/congress-and-wade-davis-reconstruction",
    "https://library.fiveable.me/key-terms/apush/habeas-corpus-suspension#:~:text=The%20suspension%20of%20habeas%20corpus,dangerous%20precedent%20for%20future%20governments.",
    "https://library.fiveable.me/key-terms/apush/lincoln-and-the-border-states",
    "https://library.fiveable.me/key-terms/apush/lincoln-and-the-border-states#:~:text=Lincoln's%20policies%20towards%20the%20border%20states%20were%20instrumental%20in%20shaping,strategic%20advantages%20for%20the%20Confederacy.",
    "https://library.fiveable.me/key-terms/apush/lincolns-ten-percent-plan",
    "https://library.fiveable.me/key-terms/apush/proclamation-of-amnesty-and-reconstruction",
    "https://library.fiveable.me/key-terms/hs-speech-debate/house-divided-speech",
    "https://library.fiveable.me/key-terms/united-states-history-1865/letter-to-horace-greeley",
    "https://library.fiveable.me/united-states-history-1865/unit-11/emancipation-proclamation-impact/study-guide/hVVIUybj2XmBgn2D",
    "https://library.unr.edu/places/knowledge-center/basque-library/projects/gernika/the-bombing-of-gernika/non-intervention-committee",
    "https://lincolnandmexicoproject.wordpress.com/2016/12/05/lincoln-helped-mexico-defeat-the-french",
    "https://millercenter.org/president/lincoln/campaigns-and-elections",
    "https://mises.org/mises-daily/lincolns-tariff-war",
    "https://myactivity.google.com/product/gemini?utm_source=gemini",
    "https://ndupress.ndu.edu/Media/News/Article/581883/union-success-in-the-civil-war-and-lessons-for-strategic-leaders",
    "https://ndupress.ndu.edu/Media/News/News-Article-View/Article/581883/union-success-in-the-civil-war-and-lessons-for-strategic-leaders",
    "https://news.stthomas.edu/publication-article/the-power-of-brevity",
    "https://nmaahc.si.edu/explore/stories/emancipation-proclamation-striking-mighty-blow-slavery",
    "https://online.ucpress.edu/currenthistory/article-pdf/49/3/26/663986/curh.1938.49.3.26.pdf",
    "https://personal.tcu.edu/swoodworth/trefousse-rr.htm",
    "https://policies.google.com/terms",
    "https://presidentlincoln.illinois.gov/Blog/Posts/184/Civil-War/2024/5/Lincolns-Critical-Month-April-1861/blog-post",
    "https://presidentlincoln.illinois.gov/Blog/Posts/184/Civil-War/2024/5/Lincolns-Critical-Month-April-1861/blog-post/#:~:text=Seeking%20advice%20from%20General%20Winfield,control%20of%20the%20Mississippi%20River.",
    "https://presidentlincoln.illinois.gov/Resources/8cbe6700-ce47-4ff8-a5d8-7fda74b05c64/gettysburg-address-lessons.pdf",
    "https://presidentlincoln.illinois.gov/exhibits/online-exhibits/emancipationproclamation",
    "https://press.uchicago.edu/Misc/Chicago/237931in.html",
    "https://prologue.blogs.archives.gov/2010/11/04/censorship-and-the-c-w",
    "https://quod.lib.umich.edu/j/jala/2629860.0005.103/--lincoln-administration-and-arbitrary-arrests?rgn=main;view%3Dfulltext",
    "https://quod.lib.umich.edu/j/jala/2629860.0005.103/--lincoln-administration-and-arbitrary-arrests?rgn=main;view=fulltext",
    "https://quod.lib.umich.edu/j/jala/2629860.0007.104/--lincoln-s-presidential-example-in-dealing-with-the-military?rgn=main;view%3Dfulltext",
    "https://quod.lib.umich.edu/j/jala/2629860.0007.104/--lincoln-s-presidential-example-in-dealing-with-the-military?rgn=main;view=fulltext",
    "https://quod.lib.umich.edu/j/jala/2629860.0013.104/--abraham-lincoln-and-the-border-states?rgn=main;view%3Dfulltext",
    "https://quod.lib.umich.edu/j/jala/2629860.0013.104/--abraham-lincoln-and-the-border-states?rgn=main;view=fulltext",
    "https://quod.lib.umich.edu/j/jala/2629860.0029.205/--lincoln-s-suspension-of-the-writ-of-habeas-corpus?rgn=main;view%3Dfulltext",
    "https://quod.lib.umich.edu/j/jala/2629860.0029.205/--lincoln-s-suspension-of-the-writ-of-habeas-corpus?rgn=main;view%3Dfulltext#:~:text=Lincoln's%20power%20to%20suspend%20the,their%20uncertain%20grounding%20in%20the",
    "https://quod.lib.umich.edu/j/jala/2629860.0029.205/--lincoln-s-suspension-of-the-writ-of-habeas-corpus?rgn=main;view=fulltext",
    "https://quod.lib.umich.edu/j/jala/2629860.0029.205/--lincoln-s-suspension-of-the-writ-of-habeas-corpus?rgn=main;view=fulltext#:~:text=Lincoln's%20power%20to%20suspend%20the,their%20uncertain%20grounding%20in%20the",
    "https://repository.lsu.edu/cgi/viewcontent.cgi?article=2340&context=cwbr",
    "https://researchrepository.wvu.edu/cgi/viewcontent.cgi?article=1012&context=wvuhistoricalreview",
    "https://researchrepository.wvu.edu/wvuhistoricalreview/vol2/iss1/7",
    "https://scholarlycommons.law.northwestern.edu/cgi/viewcontent.cgi?article=1363&context=nulr",
    "https://support.google.com/bard/answer/13594961",
    "https://support.google.com/gemini/answer/13594961#location&zippy=%2Cwhat-location-information-do-gemini-apps-collect-why-and-how-is-it-used",
    "https://theimaginativeconservative.org/2021/07/lincolns-uncertain-decision-fort-sumter-1861-bradley-birzer.html",
    "https://warroom.armywarcollege.edu/articles/lincoln-as-strategist",
    "https://www.abrahamlincolnonline.org/lincoln/speeches/corning.htm",
    "https://www.abrahamlincolnonline.org/lincoln/speeches/corning.htm#:~:text=I%20concede%20that%20the%20class,they%20may%20prevent%20the%20rebellion",
    "https://www.abrahamlincolnsclassroom.org/abraham-lincolns-contemporaries/abraham-lincoln-and-george-b-mcclellan/index.html",
    "https://www.americanbar.org/groups/dispute_resolution/resources/magazine/2024-september/lincolns-vision-reconciliation-all-americans/#:~:text=Lincoln's%20second%20inaugural%20address%20called,more%20just%20and%20unified%20nation.",
    "https://www.archives.gov/exhibits/featured-documents/emancipation-proclamation",
    "https://www.archives.gov/files/publications/prologue/2010/spring/civil-war-lincoln-guerrillas.pdf",
    "https://www.archives.gov/milestone-documents/homestead-act",
    "https://www.archives.gov/milestone-documents/morrill-act#:~:text=Passed%20on%20July%202%2C%201862,tribal%20lands%20of%20Native%20communities.",
    "https://www.archives.gov/milestone-documents/wade-davis-bill",
    "https://www.archives.gov/publications/prologue/2010/spring/lincoln-and-guerrillas",
    "https://www.armyupress.army.mil/Portals/7/educational-services/military-history/CSI_BM_CivilWarPreludeAnalysis.docx",
    "https://www.battlefields.org/learn/articles/election-1864-and-soldiers-vote",
    "https://www.battlefields.org/learn/articles/lincoln-douglas-debates",
    "https://www.battlefields.org/learn/articles/shermans-march-sea",
    "https://www.battlefields.org/learn/biographies/george-b-mcclellan",
    "https://www.chegg.com/homework-help/questions-and-answers/initially-confederacy-sought-king-cotton-diplomacy-strategy-based-belief-raising-price-cot-q215200665",
    "https://www.cram.com/essay/Rhetorical-Analysis-Of-A-House-Divided-Address/FJSJ8P9QWT",
    "https://www.digitalhistory.uh.edu/disp_textbook.cfm?smtID=2&psid=3096",
    "https://www.ebsco.com/research-starters/history/analysis-abraham-lincolns-first-inaugural-address",
    "https://www.ebsco.com/research-starters/history/analysis-exchange-letters-between-horace-greeley-and-abraham-lincoln",
    "https://www.ebsco.com/research-starters/history/analysis-lincolns-house-divided-speech",
    "https://www.ebsco.com/research-starters/history/gettysburg-address",
    "https://www.essentialcivilwarcurriculum.com/tariffs-and-the-american-civil-war.html",
    "https://www.essentialcivilwarcurriculum.com/union-and-confederate-diplomacy-during-the-civil-war.html",
    "https://www.federalreservehistory.org/essays/national-banking-acts",
    "https://www.gauthmath.com/solution/1818162008805573/Initially-the-Confederacy-pursued-King-Cotton-diplomacy-a-strategy-based-on-the-",
    "https://www.georgiaencyclopedia.org/articles/history-archaeology/shermans-march-to-the-sea",
    "https://www.gilderlehrman.org/history-resources/spotlight-primary-source/president-lincolns-first-inaugural-address-1861",
    "https://www.gilderlehrman.org/sites/default/files/inline-pdfs/Hannah%20Teller_Snakes%20Lurking%20in%20the%20Grass_0.pdf",
    "https://www.history.com/this-day-in-history/january-27/lincoln-orders-armies-to-advance#:~:text=On%20January%2027%2C%201862%2C%20President,the%20offensive%20against%20Confederate%20forces.",
    "https://www.history.com/this-day-in-history/march-3/congress-passes-civil-war-conscription-act",
    "https://www.history.com/this-day-in-history/november-8/lincoln-reelected",
    "https://www.historyonthenet.com/lincoln-and-grant-winning-civil-war-us-presidency",
    "https://www.journalofthecivilwarera.org/2017/11/lessons-diplomacy-reassessing-trent-affair",
    "https://www.lincolncottage.org/first-civil-rights-act-1866",
    "https://www.loc.gov/collections/abraham-lincoln-papers/articles-and-essays/abraham-lincoln-and-emancipation",
    "https://www.loc.gov/exhibits/african-american-odyssey/reconstruction.html",
    "https://www.napoleon.org/en/history-of-the-two-empires/articles/the-second-empire-and-the-american-civil-war",
    "https://www.niskanencenter.org/abraham-lincoln-as-a-pragmatist-and-peacemaker-with-john-avalon",
    "https://www.nps.gov/articles/000/-with-malice-toward-none-lincoln-s-second-inaugural.htm",
    "https://www.nps.gov/articles/000/general-grant-and-the-fight-to-remove-emperor-maximilian-from-mexico.htm",
    "https://www.nps.gov/articles/union-command-trouble.htm",
    "https://www.nps.gov/liho/learn/historyculture/political.htm#:~:text=Pre%2DPresidential%20Political%20Career%201830%2D1860&text=In%201834%20he%20was%20elected,Springfield%2C%20the%20new%20State%20capital.",
    "https://www.nps.gov/liho/learn/historyculture/secessiontableofcontents.htm",
    "https://www.nps.gov/liho/learn/historyculture/slavery.htm",
    "https://www.owleyes.org/text/house-divided-speech/analysis/rhetorical-devices",
    "https://www.pbs.org/wgbh/americanexperience/features/reconstruction-timeline",
    "https://www.portal.hsp.org/unit-plan-items/unit-plan-34",
    "https://www.presidency.ucsb.edu/documents/executive-order-general-war-order-no-1",
    "https://www.pritzkermilitary.org/explore/museum/past-exhibits/dignity-duty-journals-erasmus-corwin-gilbreath/riots-new-york",
    "https://www.rbhayes.org/hayes/lincoln-s-evolving-racial-views",
    "https://www.reddit.com/r/AskHistorians/comments/1sfpbg/how_effective_was_the_anaconda_plan_during_the",
    "https://www.reddit.com/r/AskHistorians/comments/336rh7/did_the_united_kingdom_ever_consider_intervening",
    "https://www.senate.gov/artandhistory/history/common/civil_war/Homestead_Act.htm",
    "https://www.senate.gov/artandhistory/history/common/civil_war/LincolnEmergencySession_FeaturedDoc.htm",
    "https://www.senate.gov/artandhistory/history/common/civil_war/MorrillLandGrantCollegeAct_FeaturedDoc.htm",
    "https://www.senate.gov/artandhistory/history/common/civil_war/NationalBankActs.htm",
    "https://www.senate.gov/artandhistory/history/common/civil_war/TrentAffair_FeaturedDoc.htm",
    "https://www.senate.gov/artandhistory/history/common/generic/PacificRailwayActof1862.htm",
    "https://www.smithsonianmag.com/smart-news/general-sherman-offered-savannah-as-a-christmas-gift-to-president-lincoln-the-victory-signaled-the-end-of-his-brutal-march-to-the-sea-180985720",
    "https://www.tandfonline.com/doi/full/10.1080/09592296.2020.1721059",
    "https://www.thoughtco.com/emancipation-proclamation-was-also-foreign-policy-3310345",
    "https://www.usni.org/magazines/naval-history-magazine/2021/october/economic-warfare-union-blockade-civil-war"
  ]
}