{
  "query": "What mathematical foundation is required for conducting research in machine learning and deep learning, and how to find the best quality resources online to quickly complete the learning of artificial intelligence mathematics foundations.",
  "chain_of_research": {
    "plan_1": {
      "title": "Understanding the Mathematical Landscape\nNext Steps in Research",
      "description": "I'm starting to explore the mathematical foundations necessary for conducting research in machine learning and deep learning. My initial focus is on identifying the core mathematical disciplines and the specific concepts within each that are most relevant to these fields. This will help me build a comprehensive understanding of the theoretical underpinnings.\nMy next step involves searching for reputable online resources such as university syllabi, academic papers, and established educational platforms. I'll be looking for information on essential math for AI, deep learning mathematical foundations, and general mathematics for machine learning research. Following this, I'll broaden my search to find high-quality online courses, textbooks, and other learning materials, paying close attention to reviews and expert-curated learning paths."
    },
    "search_1": [
      "https://www.geeksforgeeks.org/dsa/mathematics-concept-required-for-deep-learning",
      "https://ai.stackexchange.com/questions/23433/what-are-the-mathematical-prerequisites-needed-to-understand-research-papers-on",
      "https://www.goodreads.com/book/show/74963630-essential-math-for-ai",
      "https://medium.com/@richardhightower/the-mathematical-foundation-of-deep-learning-your-complete-guide-to-understanding-ai-66dea318a4c7",
      "https://developers.google.com/machine-learning/crash-course/prereqs-and-prework",
      "https://www.preprints.org/manuscript/202502.0272/v1",
      "https://www.reddit.com/r/OMSCS/comments/ggpzlw/mathematics_needed_to_do_a_phd_in_machine",
      "https://www.geeksforgeeks.org/machine-learning/machine-learning-mathematics",
      "https://oar.princeton.edu/bitstream/88435/pr1cg32/1/MachineLearningMathematics.pdf"
    ],
    "observation_1": "I've started by identifying the core mathematical disciplines essential for machine learning and deep learning research. These include Linear Algebra (vectors, matrices, SVD, eigenvalues), Calculus (differentiation, gradients, optimization techniques like gradient descent), and Probability and Statistics (probability theory, Bayes' theorem, various distributions, statistical learning theory). I also noted the importance of Optimization Theory, Dimensionality Reduction (PCA, t-SNE), and for more advanced deep learning research, Functional Analysis and Approximation Theory. Some sources also mentioned Discrete Math, Graph Theory, Information Theory, and Numerical Methods, though these appear less central for general ML/DL research compared to the others.",
    "plan_2": {
      "title": "Next Steps for Resource Discovery",
      "description": "My next steps will focus on finding high-quality online resources to facilitate learning these mathematical foundations. I'll be searching for highly-rated online courses, specializations, and university programs, as well as widely recommended textbooks and lecture notes. I'll also prioritize resources that emphasize practical application and intuitive understanding, looking for reviews and curated learning paths to ensure the best quality recommendations."
    },
    "search_2": [
      "https://extendedstudies.ucsd.edu/courses-certificates/data-analysis-mathematics/applied-mathematics",
      "https://www.coursera.org/courses?query=mathematics%20for%20machine%20learning",
      "https://www.coursera.org/courses?query=math%20for%20machine%20learning",
      "https://www.coursera.org/specializations/deep-learning",
      "https://www.coursera.org/specializations/machine-learning-introduction",
      "https://www.d2l.ai/chapter_appendix-mathematics-for-deep-learning/index.html",
      "https://www.reddit.com/r/learnmachinelearning/comments/1ijvw7u/mentally_visualizing_some_mathematical_concepts",
      "https://learn.mit.edu/c/department/mathematics?resource=4007",
      "https://www.reddit.com/r/learnmachinelearning/comments/jlm472/mit_fundamental_maths_courses_for_machine",
      "https://probability4datascience.com",
      "https://www.kingsbookstore.com/book/9783031532818",
      "https://www.youtube.com/watch?v=KgolhE7p-KY&pp=0gcJCfwAo7VqN5tD",
      "https://www.reddit.com/r/deeplearning/comments/1bb2p6w/intuitive_math_for_deep_learning_mastery",
      "https://www.routledge.com/Linear-Algebra-With-Machine-Learning-and-Data/Arangala/p/book/9780367458393",
      "https://www.barnesandnoble.com/w/linear-algebra-and-optimization-for-machine-learning-charu-c-aggarwal/1135871957",
      "https://www.goodreads.com/list/show/163734.Mathematics_for_Machine_Learning",
      "https://www.datacamp.com/blog/top-10-deep-learning-books-to-read-in-2022",
      "https://online.stanford.edu/courses/xcs229-machine-learning",
      "https://medium.com/data-science/from-linear-algebra-to-deep-learning-in-7-books-winter-2023-update-8df2b706a0b1",
      "https://online.stanford.edu/courses/math51-linear-algebra-multivariable-calculus-and-modern-applications"
    ],
    "observation_2": "I've further refined my understanding of the mathematical prerequisites for machine learning and deep learning research. Beyond the core areas of linear algebra, calculus, and probability/statistics, I've noted that for advanced research, concepts like functional approximation, optimization theory, and statistical learning theory become increasingly critical. Specific topics like measurable function spaces, risk functionals, and approximation theory are highlighted for a rigorous mathematical framework in deep learning. It's also clear that the depth of mathematical understanding required scales with the level of research, from basic understanding for entry-level applications to advanced comprehension for developing custom algorithms and conducting cutting-edge research.",
    "plan_3": {
      "title": "Identifying Key Learning Resources\nNext Steps in Resource Evaluation",
      "description": "I've begun to identify specific high-quality online courses and textbooks. For online courses, I'm looking into specializations from Imperial College London and DeepLearning.AI, as well as courses from MIT OpenCourseWare and Stanford Online. For textbooks, I've noted 'Mathematics for Machine Learning' by Deisenroth et al., 'The Elements of Statistical Learning' by Hastie et al., and 'Deep Learning' by Goodfellow et al., among others. I'm also keeping an eye out for resources that provide intuitive explanations, such as 'three blue one brown', and practical tools like 'matrixcalculus.org'.\nMy next steps involve systematically browsing the identified online courses and textbooks to gather more detailed information on their content, target audience, and suitability for self-study. I'll also be actively searching for comprehensive reviews, community discussions, and expert opinions to assess the quality and effectiveness of these resources. Additionally, I'll be looking for curated learning paths and supplementary learning tools like interactive tutorials and problem sets to provide a well-rounded set of recommendations."
    },
    "search_3": [
      "https://online.stanford.edu/courses/xcs229-machine-learning",
      "https://www.coursera.org/specializations/machine-learning-introduction",
      "https://online.stanford.edu/courses/math51-linear-algebra-multivariable-calculus-and-modern-applications",
      "https://learn.mit.edu/c/department/mathematics?resource=4007",
      "https://www.coursera.org/specializations/deep-learning",
      "https://www.coursera.org/courses?query=math%20for%20machine%20learning",
      "https://medium.com/enjoy-algorithm/detailed-maths-topics-in-machine-learning-ca55cd537709",
      "https://en.wikipedia.org/wiki/3Blue1Brown",
      "https://tutorial.math.lamar.edu/problems/calci/calci.aspx",
      "https://www.wolfram.com/wolfram-u/courses/mathematics/introduction-to-linear-algebra",
      "https://tutorial.math.lamar.edu/problems/calcii/calcii.aspx",
      "https://www.understandthemath.com/linear-algebra",
      "https://github.com/jasmcaus/ai-math-roadmap",
      "https://www.mathworks.com/products/statistics.html",
      "https://www.goodreads.com/list/show/163734.Mathematics_for_Machine_Learning",
      "https://www.youtube.com/watch?v=KgolhE7p-KY&pp=0gcJCfwAo7VqN5tD",
      "https://ocw.mit.edu/courses/18-657-mathematics-of-machine-learning-fall-2015/pages/lecture-notes",
      "https://www.scribd.com/document/759198661/The-Elements-of-Statistical-Learning-Data-Mining-I",
      "https://www.doc.ic.ac.uk/~dfg/ProbabilisticInference/InferenceAndMachineLearningNotes.pdf",
      "https://freecomputerbooks.com/The-Elements-of-Statistical-Learning.html",
      "https://github.com/janishar/mit-deep-learning-book-pdf",
      "https://www.reddit.com/r/learnmachinelearning/comments/1kqoptw/roadmap_for_learning_ml",
      "https://www.scribd.com/document/856377201/Deep-Learning-1st-Edition-by-Ian-Goodfellow-Yoshua-Bengio-Aaron-Courville-0262035618-9780262035613-pdf-download",
      "https://www.reddit.com/r/learnmachinelearning/comments/1lbs4qi/a_clear_roadmap_to_complete_learning_aiml_by_the",
      "https://news.ycombinator.com/item?id=19771771",
      "https://www.youtube.com/watch?v=Ri-CkjnhRRo",
      "https://www.jamesbower.com/the-elements-of-statistical-learning-data-mining-inference-and-prediction-book-review",
      "https://www.learningmachines101.com/book-review-elements-statistical-learning-data-mining-inference-prediction",
      "https://www.reddit.com/r/MachineLearning/comments/9nsbna/d_am_i_the_only_one_stumbled_at_the_recent_book",
      "https://www.youtube.com/watch?v=fp5tqPlgJxs",
      "https://www.coursera.org/specializations/mathematics-for-machine-learning-and-data-science",
      "https://community.deeplearning.ai/t/best-course-for-machine-learning-mathematics/761877",
      "https://medium.com/javarevisited/is-mathematics-for-machine-learning-and-data-science-specialization-by-deeplearning-ai-f60aa31867b6",
      "https://m.youtube.com/watch?v=JPHS10dt_CY&pp=ygUHI2FpbWF0aA%3D%3D",
      "https://quickmath.com",
      "https://www.mathpapa.com/algebra-calculator.html",
      "https://www.geeksforgeeks.org/machine-learning/machine-learning-mathematics",
      "https://www.onlinemathtraining.com/math-for-machine-learning-practice-problems",
      "https://www.youtube.com/c/3blue1brown",
      "https://www.3blue1brown.com",
      "https://www.coursera.org/learn/machine-learning-probability-and-statistics",
      "https://www.mygreatlearning.com/academy/learn-for-free/courses/probability-and-probability-distributions-for-machine-learning",
      "https://deeplearning.cs.cmu.edu",
      "https://mit-6861.github.io/supplemental",
      "https://www.reddit.com/r/statistics/comments/1bek2ba/e_demystifying_elements_of_statistical_learning",
      "https://seeing-theory.brown.edu/probability-distributions/index.html",
      "https://www.reddit.com/r/learnmachinelearning/comments/1kc45fc/hows_this_any_reviews",
      "https://probstats.org",
      "https://allenkim67.github.io/bayes-demo",
      "https://www.youtube.com/watch?v=cqTwHnNbc8g",
      "https://www.mathgptpro.com/app/calculator/linear-algebra-visualizer",
      "https://www.maplesoft.com/support/help/Maple/view.aspx?path=examples%2FLinearAlgebraVisualization1",
      "https://www.reddit.com/r/learnmachinelearning/comments/1k0fnol/deeplearningai_courses_are_far_superior_to_any",
      "https://www.reddit.com/r/learnmachinelearning/comments/1k1zb61/mathematics_for_ml_book",
      "https://www.reddit.com/r/learnmachinelearning/comments/14878zd/mathematics_courses_for_machine_learningdeep",
      "https://www.reddit.com/r/learnmachinelearning/comments/1l3sw6u/mathheavy_machine_learning_book_with_exercises",
      "https://reddsera.com/specializations/mathematics-machine-learning",
      "https://www.kaggle.com/datasets/thedevastator/dataset-for-solving-math-word-problems",
      "https://www.reddit.com/r/MLQuestions/comments/kwftqv/is_the_mathematics_for_machine_learning",
      "https://www.reddit.com/r/kaggle/comments/1m667v5/map_charting_student_math_misunderstandings",
      "https://github.com/hrnbot/Basic-Mathematics-for-Machine-Learning",
      "https://github.com/ilmoi/MML-Book",
      "https://www.youtube.com/@3blue1brown"
    ],
    "observation_3": "I've now gathered a comprehensive understanding of the mathematical foundations required for machine learning and deep learning research. This includes core areas like linear algebra (vectors, matrices, SVD, eigenvalues, tensor operations), calculus (derivatives, gradients, optimization techniques like gradient descent, backpropagation), and probability and statistics (distributions, Bayes' theorem, hypothesis testing, statistical learning theory). For advanced research, I've noted the importance of functional approximation, optimization theory, and statistical learning theory, including concepts like measurable function spaces and VC-dimension theory. The depth of understanding required varies from basic for entry-level applications to advanced for research and custom algorithm development.",
    "plan_4": {
      "title": "Key Resources Identified\nNext Steps: Finalizing the Report",
      "description": "I've identified a range of high-quality online resources and textbooks. For online learning, I've found highly-rated courses and specializations from institutions like Imperial College London, DeepLearning.AI, MIT OpenCourseWare, and Stanford Online. Recommended textbooks include 'Mathematics for Machine Learning' by Deisenroth et al., 'The Elements of Statistical Learning' by Hastie et al., and 'Deep Learning' by Goodfellow et al. I've also noted resources that emphasize practical application and intuition, such as 'three blue one brown' for visual explanations and 'matrixcalculus.org' for practical computations.\nHaving completed the information gathering phase and reached saturation on all requested points, I have sufficient information to construct a comprehensive report. My next action will be to finalize the research and generate the report."
    }
  },
  "final_report": "# **The Mathematical Bedrock of Machine Learning and Deep Learning: A Comprehensive Guide to Foundations and Accelerated Online Learning**\n\nMathematics serves as the indispensable foundation for machine learning (ML) and deep learning (DL), providing the underlying principles for how models learn, represent complex data, and optimize their performance.1 Without a robust mathematical understanding, engagement with artificial intelligence (AI) tools remains superficial, significantly hindering the capacity to conduct original research, diagnose intricate model behaviors, or innovate novel algorithms.4 Furthermore, mathematics offers the precise formal language required to articulate algorithms, rigorously prove their properties, and analyze their behavior, particularly in addressing the computational and statistical challenges inherent in high-dimensional data environments.2\n\nIt is crucial to differentiate between the mathematical depth required for practical application versus that for research. A basic to intermediate understanding—encompassing a high-level grasp of derivatives for gradient-based optimization, fundamental linear algebra, and descriptive statistics—may suffice for practical implementation and the effective use of pre-built libraries.1 However, conducting cutting-edge research in ML/DL demands a significantly more profound theoretical understanding. This includes delving into advanced topics such as functional analysis, statistical learning theory, and sophisticated optimization techniques, which are essential to contribute new knowledge and advance the frontiers of the field.1\n\n## **I. Core Mathematical Foundations for ML/DL Research**\n\nThis section meticulously details the essential mathematical disciplines, outlining specific concepts within each and elucidating their direct relevance and application in machine learning and deep learning research.\n\n### **A. Linear Algebra: The Language of Data and Transformations**\n\nLinear algebra is universally recognized as the most fundamental mathematical topic in machine learning and deep learning.1 It provides the framework for representing and manipulating data, which in AI often exists in high-dimensional spaces.\n\n#### **Vectors, Matrices, and Tensors: Data Structures of AI**\n\nVectors, matrices, and tensors are the fundamental building blocks for representing all forms of data within machine learning and deep learning paradigms.3 Vectors, as one-dimensional arrays of numbers, can effectively represent individual features of a product, daily stock prices, or the semantic meaning of a word in an embedding space.3 For instance, in natural language processing, word embeddings are essentially vectors that capture the meaning of words in a mathematical form.3\n\nMatrices extend this concept to two dimensions, akin to a complete spreadsheet with rows and columns. In machine learning, a matrix might store a batch of word embeddings where each row represents a different word, or it could contain pixel intensities in a grayscale image.3 Tensors represent the most powerful generalization, extending vectors and matrices to any number of dimensions. This abstract concept is pervasive in AI; for example, a batch of color images forms a four-dimensional tensor (batch size, height, width, color channels), while video data creates a five-dimensional tensor by adding time as another dimension.3 The ability to represent complex, real-world data in these multi-dimensional structures is crucial for modern AI systems.1\n\n#### **Key Operations: Matrix Multiplication, Dot Products, Transpose**\n\nMatrix multiplication stands as perhaps the single most fundamental operation in neural networks, underpinning nearly every computation from combining input data with model weights to producing activations in successive layers.3 This operation is central to how information flows and is transformed within a neural network. The dot product, another core linear algebra operation, is crucial for measuring similarity between two vectors, a concept central to attention mechanisms found in modern large language models.3 Transpose operations are frequently necessary for correctly aligning data dimensions during computations within neural networks, ensuring that mathematical operations are performed on compatible shapes.3 These operations enable the efficient implementation of algorithms and the management of multidimensional datasets.1\n\n#### **Advanced Concepts: Eigenvalues, Eigenvectors, Singular Value Decomposition (SVD), Matrix Factorization, Dimensionality Reduction (PCA, LDA)**\n\nEigenvalues and eigenvectors are critical for a deeper understanding of data transformations and the intrinsic properties of matrices, particularly in dimensionality reduction techniques such as Principal Component Analysis (PCA) and Linear Discriminant Analysis (LDA).1 These techniques are vital for simplifying large, high-dimensional datasets by identifying and retaining only the most important information, thereby reducing computational complexity and mitigating the \"curse of dimensionality\".1 Singular Value Decomposition (SVD) is a powerful matrix factorization technique essential in various applications, including image compression, recommender systems, and topic modeling.11 More broadly, matrix factorization techniques are widely applied in numerous ML contexts, such as spectral clustering, kernel-based classification, and outlier detection.12\n\nThe rapid empirical success and scalability of modern AI systems, particularly deep learning, are a direct consequence of their ability to process and learn from massive, high-dimensional datasets, such as millions of images or billions of social media posts.2 Linear algebra provides the precise mathematical structures (vectors, matrices, tensors) and efficient operations (matrix multiplication, SVD) that make handling such vast and complex data computationally feasible and conceptually manageable. Without these tools, the efficient implementation and optimization of AI algorithms, especially neural networks, would be intractable. The evolution from simple 2D matrices to multi-dimensional \"tensors\" directly reflects the increasing complexity and dimensionality of real-world data that AI systems are designed to process, establishing a clear link between linear algebra's capabilities and AI's advancements. This underscores a fundamental and ongoing trend in AI development: the continuous demand for mathematical frameworks that can effectively manage increasing data complexity, scale, and computational efficiency. Linear algebra is not merely a foundational prerequisite; it is the enabling technological paradigm for the data-intensive nature of contemporary AI. Furthermore, the continuous development of novel ML/DL architectures often involves innovative applications or extensions of existing linear algebraic principles, highlighting its enduring relevance as a dynamic area of mathematical inquiry within AI research.\n\n**Table 1: Key Linear Algebra Concepts and Their Direct Applications in ML/DL**\n\n| Concept | Concise Description | Direct Application in ML/DL |\n| --- | --- | --- |\n| **Vectors** | One-dimensional arrays of numbers. | Representing features, word embeddings, single data points. |\n| **Matrices** | Two-dimensional arrays of numbers. | Storing batches of data, images, model weights. |\n| **Tensors** | Generalization of vectors and matrices to any number of dimensions. | Handling complex, multi-dimensional data (e.g., color images, video). |\n| **Matrix Multiplication** | Core operation combining matrices. | Underpins nearly every computation in neural network layers (input-weight interactions). |\n| **Dot Product** | Measures similarity between two vectors. | Crucial for attention mechanisms in modern language models. |\n| **Transpose Operations** | Swapping rows and columns in matrices. | Aligning data dimensions correctly for computations. |\n| **Eigenvalues & Eigenvectors** | Special scalars and vectors revealing intrinsic properties of linear transformations. | Understanding data transformations, central to PCA and LDA. |\n| **Singular Value Decomposition (SVD)** | Factorization of a matrix into three constituent matrices. | Image compression, recommender systems, topic modeling, dimensionality reduction. |\n| **Principal Component Analysis (PCA)** | A dimensionality reduction technique. | Reducing high-dimensional data by finding principal components, feature extraction. |\n| **Linear Discriminant Analysis (LDA)** | A dimensionality reduction and classification technique. | Maximizing class separability in reduced dimensions. |\n| **Matrix Factorization** | Decomposing a matrix into a product of other matrices. | Spectral clustering, kernel-based classification, outlier detection. |\n\n### **B. Calculus: The Engine of Learning and Optimization**\n\nCalculus provides the dynamic tools necessary for model training and optimization, enabling algorithms to learn from data and improve performance.\n\n#### **Fundamental Concepts: Differentiation, Partial Derivatives, Chain Rule**\n\nCalculus is aptly described as the \"engine of learning\" in deep learning, providing the mathematical tools necessary for model training.3 Differentiation and partial derivatives are absolutely critical for optimization tasks, as they are used to compute gradients—vectors that indicate the direction and rate of steepest improvement—and subsequently adjust model parameters during training processes like gradient descent.1 The Chain Rule is a cornerstone concept, fundamental for understanding backpropagation, the highly efficient algorithm that computes these gradients across multiple layers in neural networks.7 This rule allows for the efficient calculation of how changes in early layers of a neural network affect the final output, a process vital for effective learning.\n\n#### **Optimization Techniques: Gradient Descent and its Variants (SGD, Adam)**\n\nGradient descent is the quintessential algorithm for minimizing loss functions and identifying the optimal model parameters that best fit the data.1 For research and practical implementation, understanding its various forms—such as stochastic gradient descent (SGD) for large datasets, mini-batch gradient descent, and adaptive optimizers like Adam—is essential for achieving efficient and stable training of complex models.1 These variations address challenges like computational cost and convergence speed, making large-scale deep learning feasible.\n\n#### **Multivariable Calculus: Jacobians, Hessians, and their Role in Neural Networks**\n\nVector calculus extends the principles of single-variable calculus to multivariable systems, proving invaluable for understanding how changes propagate and affect outcomes in multi-dimensional spaces.1 Specifically, Jacobians and Hessians are crucial for advanced optimization techniques and for analyzing the curvature of loss surfaces in the high-dimensional parameter spaces characteristic of neural networks. Jacobians represent the first-order partial derivatives of a vector-valued function, while Hessians provide second-order derivative information, vital for more sophisticated optimization methods that can navigate complex landscapes more effectively.1\n\nThe iterative nature of training modern machine learning models, especially deep neural networks, relies entirely on the ability to quantify the impact of infinitesimal changes in model parameters on the overall performance (i.e., the loss function). Calculus furnishes the necessary mathematical machinery—derivatives and gradients—to precisely measure this sensitivity and determine the optimal direction for \"steepest improvement\".3 Backpropagation, the cornerstone algorithm for training neural networks, is a direct and highly efficient application of the chain rule, allowing gradients to be computed across hundreds or thousands of layers.7 Without calculus, the very concept of gradient-based \"learning\" in these models would be mathematically undefined and practically impossible. The continuous evolution and refinement of optimization algorithms (e.g., the progression from basic gradient descent to more sophisticated adaptive methods like Adam) are direct consequences of applying increasingly advanced calculus and numerical analysis techniques to navigate the complex, often non-convex, loss landscapes encountered in deep learning.6 This highlights a vibrant research frontier focused on developing more robust, efficient, and generalizable optimization methods, a pursuit that inherently demands a deep and nuanced understanding of calculus and optimization theory from researchers.\n\n**Table 2: Essential Calculus Concepts for ML/DL Optimization**\n\n| Concept | Purpose in ML/DL | Key Application/Relevance |\n| --- | --- | --- |\n| **Differentiation** | Quantifying the rate of change of a function. | Fundamental for understanding how model output changes with respect to parameters. |\n| **Partial Derivatives** | Measuring the rate of change of a multivariable function with respect to one variable, holding others constant. | Computing gradients to update individual model parameters (weights, biases). |\n| **Chain Rule** | A rule for differentiating composite functions. | Enables efficient computation of gradients across multiple layers in neural networks (backpropagation). |\n| **Gradient** | A vector of partial derivatives indicating the direction of steepest ascent. | Directs the optimization process (e.g., gradient descent) to minimize loss functions. |\n| **Gradient Descent (and variants)** | An iterative optimization algorithm for finding function minima. | The primary method for training machine learning models by iteratively adjusting parameters to reduce error. |\n| **Jacobians** | Matrix of all first-order partial derivatives of a vector-valued function. | Used in advanced optimization and transformations of multi-dimensional inputs. |\n| **Hessians** | Matrix of all second-order partial derivatives of a multivariable function. | Analyzing the curvature of loss surfaces, crucial for second-order optimization methods and understanding local minima/saddle points. |\n| **Loss Functions** | A mathematical function that quantifies the error between predicted and actual values. | Defines the objective to be minimized during model training (empirical risk minimization). |\n\n### **C. Probability and Statistics: Understanding Uncertainty and Data Patterns**\n\nProbability and statistics are foundational disciplines for comprehending data patterns, quantifying uncertainty, and constructing robust probabilistic models.1\n\n#### **Core Probability Theory: Distributions (Gaussian, Bernoulli, etc.), Bayes' Theorem, Joint/Conditional Probability**\n\nKey concepts such as random variables, expectation (mean), variance, and various probability distributions (e.g., Normal/Gaussian for continuous data, Bernoulli for binary outcomes, Poisson for event counts, Exponential for waiting times) are crucial for modeling diverse data types, initializing neural network weights, and interpreting model outputs.1 Understanding probability distributions is essential for building probabilistic models and algorithms like Bayesian networks or Markov chains.1 Bayes' Theorem, a cornerstone of probabilistic reasoning, is fundamental for Bayesian methods and plays a critical role in updating beliefs based on evidence, which is essential for sophisticated pattern recognition and decision-making systems.1\n\n#### **Statistical Inference: Hypothesis Testing, Confidence Intervals, Maximum Likelihood Estimation (MLE)**\n\nThese statistical inference techniques are vital for drawing robust conclusions from sample data, assessing the stability and reliability of machine learning models, and making informed business or research decisions.1 Hypothesis testing, for example, allows researchers to evaluate the significance of findings, while confidence intervals provide a range within which a true parameter is likely to lie, indicating the precision of estimates.1 Maximum Likelihood Estimation (MLE), for instance, is a widely used and powerful method for estimating the parameters of a statistical model by finding the parameter values that maximize the likelihood of observing the given data.1\n\n#### **Statistical Learning Theory (SLT): Generalization, Bias-Variance Tradeoff, VC-Dimension, Rademacher Complexity**\n\nStatistical Learning Theory (SLT) provides the rigorous mathematical foundation for understanding the behavior of machine learning algorithms, including deep learning models, particularly concerning their ability to generalize from finite training data to unseen data.6 Advanced concepts within SLT, such as generalization bounds, VC-dimension theory for discrete hypothesis classes, and Rademacher complexity for continuous function spaces, are critical for advanced research into model capacity, complexity, and the theoretical limits of learning.6 A deep understanding of the bias-variance tradeoff is also essential for diagnosing and effectively improving model performance, by identifying whether a model is underfitting (high bias) or overfitting (high variance).14 For instance, high variance in a model indicates less predictable results, which can be particularly risky in domains like finance or healthcare.3\n\nMachine learning inherently operates under conditions of uncertainty and incomplete information, as data used for training is merely a sample drawn from an unknown underlying distribution.2 Probability theory offers the indispensable tools to formally model this inherent uncertainty, while statistics provides the methods to extract robust and reliable conclusions from noisy or partial data. The paramount importance of a model's ability to generalize—performing well on new data rather than merely memorizing the training set—is directly addressed by Statistical Learning Theory. SLT provides the theoretical bounds and frameworks, such as VC-dimension and Rademacher complexity, that are crucial for designing and analyzing provably robust and generalizable algorithms, a hallmark of theoretical research in ML.6 The contemporary drive towards developing Explainable AI (XAI) and certifiably Robust AI systems is a direct outgrowth of the need for deeper statistical understanding and stronger theoretical guarantees that extend beyond mere empirical success. Researchers working at this frontier heavily rely on SLT to provide formal assurances about model behavior, actively striving to bridge the gap where \"rapid empirical success currently outstrips mathematical understanding\".2 This points to a critical and evolving research direction where mathematical rigor in probability and statistics is not just beneficial, but absolutely paramount for scientific advancement.\n\n**Table 3: Core Probability & Statistics Topics and Their Relevance to ML/DL Models**\n\n| Concept | Purpose in ML/DL | Key Application/Relevance |\n| --- | --- | --- |\n| **Probability Distributions** | Describing how likely different outcomes are in various scenarios. | Modeling continuous (Gaussian) and discrete (Categorical, Bernoulli) data, initializing weights, understanding data characteristics. |\n| **Bayes' Theorem** | Calculating the validity of beliefs by updating probabilities based on new evidence. | Fundamental for Bayesian inference, Naive Bayes classifiers, and probabilistic graphical models. |\n| **Statistical Inference** | Drawing conclusions about a population from sample data. | Hypothesis testing, confidence intervals for assessing model stability and reliability. |\n| **Maximum Likelihood Estimation (MLE)** | A method for estimating parameters of a statistical model. | Finding optimal parameters for models by maximizing the likelihood of observed data. |\n| **Statistical Learning Theory (SLT)** | Providing the mathematical foundation for understanding ML algorithm behavior. | Understanding generalization, model capacity, and theoretical limits of learning. |\n| **Bias-Variance Tradeoff** | A fundamental concept describing the relationship between model complexity, error, and generalization. | Diagnosing underfitting (high bias) and overfitting (high variance) to improve model performance. |\n| **VC-Dimension & Rademacher Complexity** | Measures of the capacity or complexity of a hypothesis class. | Providing theoretical bounds on generalization error, crucial for advanced research in learning theory. |\n\n### **D. Optimization Theory: Minimizing Error and Maximizing Performance**\n\nOptimization theory is central to deep learning, as the goal of training deep neural networks is essentially to find the optimal set of parameters (weights and biases) that minimize a predefined objective, often called the loss function.6\n\n#### **Loss Functions and Empirical Risk Minimization**\n\nAt its core, the objective of training deep neural networks is to discover the optimal set of parameters (weights and biases) that minimize a predefined objective function, commonly referred to as the loss function.6 This fundamental process is known as empirical risk minimization, where the model aims to minimize the error on the training data.6 A comprehensive understanding of various loss functions (e.g., L2 loss for regression, cross-entropy loss for classification) is crucial, as the choice of loss function directly influences the model's learning behavior and suitability for different problem types.2 For instance, the least squares method is a classic approach for finding the best fit in linear models by minimizing the squared differences between predicted and actual values.2\n\n#### **Convex vs. Non-Convex Optimization**\n\nWhile classical optimization theory often focuses on convex problems due to their guarantees of global optima, training deep neural networks frequently involves navigating complex, high-dimensional non-convex optimization problems.6 Researchers must grapple with the inherent challenges of non-convexity, including the presence of numerous local minima, saddle points, and the complexities of ensuring convergence to a satisfactory solution.6 This distinction is vital as it dictates the applicability and guarantees of various optimization algorithms.\n\n#### **Advanced Optimization Algorithms and Convergence**\n\nBeyond basic gradient descent, a deep understanding of optimization theory necessitates familiarity with advanced algorithms. These include variants like stochastic gradient descent (SGD) for large datasets, mini-batch gradient descent, and adaptive learning rate methods such as Adaptive Moment Estimation (Adam).6 These algorithms are designed to improve convergence speed and stability in complex, high-dimensional spaces. For advanced research, grasping concepts related to convergence proofs—demonstrating that an algorithm will eventually reach a minimum—and understanding the intricate geometry of loss surfaces in high-dimensional spaces are vital.1\n\nThe practical effectiveness, efficiency, and scalability of any ML/DL model are inextricably linked to the underlying optimization algorithm employed. The judicious selection of an optimizer, the fine-tuning of its parameters, and its inherent capability to navigate the complex, often non-convex, high-dimensional loss landscapes directly determine how effectively a model can learn from data and generalize to unseen examples. Research in optimization theory thus has a profound and direct impact on the empirical performance and scalability of real-world AI systems. For example, the development of sophisticated adaptive optimizers like Adam was a direct response to the practical challenges of training extremely deep neural networks on massive datasets, leading to significantly faster convergence and superior performance in applied contexts. This clear causal link between theoretical advancements in optimization and tangible improvements in AI performance is a primary driver of ongoing research in this domain. The continuous and active research in optimization, particularly concerning non-convex problems, large-scale distributed training, and the development of optimizers robust to noisy gradients, represents a critical area for pushing the boundaries of AI capabilities. This research involves not only proposing new algorithms but also rigorously proving their convergence properties, analyzing their computational complexity, and understanding their behavior across diverse problem settings. This is precisely where a deep, nuanced mathematical understanding of optimization theory becomes an indispensable asset for any aspiring researcher in the field.\n\n### **E. Advanced Mathematical Concepts for Cutting-Edge Research**\n\nBeyond the core pillars, advanced mathematical concepts become increasingly relevant for those pursuing cutting-edge research in theoretical machine learning and deep learning.\n\n#### **Functional Approximation and Measurable Spaces**\n\nDeep learning models, particularly neural networks, can be conceptualized as highly sophisticated functional approximators, possessing the remarkable ability to represent complex, non-linear, and high-dimensional functions that are often intractable for traditional mathematical techniques.6 A rigorous mathematical framework for deep learning, especially in theoretical contexts, often involves delving into measurable function spaces and measure theory. This abstract framework provides the foundational backdrop for probability theory and integration, crucial for understanding concepts like the universal approximation theorem and the theoretical limits and capabilities of neural networks.6 Measurable spaces are not merely abstract structures; they are the backbone of measure theory, probability, and integration, enabling the definition of a measure that assigns non-negative values to sets, adhering to axioms like countable additivity.6\n\n#### **Information Theory (Entropy, Cross-Entropy, KL Divergence)**\n\nInformation theory offers a powerful suite of tools for quantifying and analyzing information. It provides measures for uncertainty (Entropy), for comparing the similarity between two probability distributions (Cross-Entropy and Kullback-Leibler (KL) Divergence), and for understanding the flow of information within systems.9 These concepts are fundamental for designing and understanding various aspects of ML/DL, including the formulation of loss functions (e.g., cross-entropy loss in classification tasks) and the principles underlying generative models (e.g., Variational Autoencoders (VAEs) and Generative Adversarial Networks (GANs)).9 Information theory can be thought of as an amalgamation of calculus, statistics, and probability, providing a unified perspective on data and uncertainty.9\n\n#### **Discrete Mathematics, Graph Theory, Numerical Methods**\n\nDiscrete mathematics forms a foundational pillar for computer science and the design and analysis of algorithms.16 This includes topics such as set theory, logic, and combinatorics, which are essential for understanding computational complexity and algorithm design. Graph theory is gaining increasing prominence and relevance for understanding and developing Graph Neural Networks (GNNs), which are designed to process data structured as graphs (e.g., social networks, molecular structures), and for analyzing relational data.4 Numerical methods are highly beneficial for comprehending the computational aspects of algorithms, including their stability, efficiency, and error propagation.16 While potentially advanced, tensor calculus can also provide a deeper, more generalized understanding of multi-dimensional data transformations.16\n\nWhile the core mathematical topics (linear algebra, calculus, probability/statistics) are consistently listed as essential, conducting cutting-edge research in ML/DL, especially theoretical work, necessitates a mathematical background that extends significantly beyond a standard undergraduate curriculum in applied mathematics or computer science.6 This often requires immersion in highly abstract mathematical concepts like measurable spaces, functional analysis, VC-dimension, Rademacher complexity, and information theory.6 This highlights a potential, and often challenging, gap between the mathematical content offered by many popular \"math for ML\" courses and the rigorous depth actually required for making significant theoretical contributions to the field. The observation that \"rapid empirical success in this field currently outstrips mathematical understanding\" 2 directly implies that the research frontier is actively engaged in bridging this very gap, which inherently requires the application of more advanced and abstract mathematical tools. The increasing complexity of AI models and the demand for formal guarantees about their behavior continue to push the boundaries of the mathematical foundations required for research.\n\n## **II. Strategies for Accelerated and Quality Online Learning**\n\nAcquiring a solid mathematical foundation for ML/DL research can be accelerated by leveraging high-quality online resources and adopting effective learning strategies.\n\n### **A. Structured Curricula from Reputable Institutions**\n\nFormal online programs from leading universities and AI organizations offer structured learning paths that cover essential mathematical concepts for machine learning and deep learning.\n\n#### **Specializations and Programs**\n\nCoursera hosts several highly-rated specializations that cater to different levels of mathematical proficiency. The **DeepLearning.AI Mathematics for Machine Learning and Data Science Specialization** is an intermediate-level program that covers descriptive statistics, Bayesian statistics, statistical hypothesis testing, probability distributions, linear algebra, and calculus.19 This specialization is designed to help learners understand the math behind algorithms intuitively, using visualizations and hands-on Python labs.5 It is particularly recommended for those who may not have taken these courses in college or need a refresher.22\n\nAnother highly regarded option is the **Imperial College London Mathematics for Machine Learning Specialization**, which focuses on linear algebra, dimensionality reduction, calculus, probability & statistics, and regression analysis.19 This program is noted for its application-oriented approach and use of geometrical intuition over rigorous proofs for basic concepts, making it accessible while still providing a robust understanding.23\n\nFor those looking for a broader introduction to machine learning with integrated math, **DeepLearning.AI's Machine Learning Specialization** (updated from Andrew Ng's original course) covers supervised and unsupervised learning, neural networks, and reinforcement learning, with optional videos for deeper mathematical understanding.24 Similarly, the\n\n**DeepLearning.AI Deep Learning Specialization** delves into neural network architectures, optimization, and regularization, providing foundational knowledge for advanced AI applications.25\n\n#### **University OpenCourseWare**\n\nLeading universities provide free access to their course materials, offering a rigorous academic approach. **MIT OpenCourseWare** offers a wealth of relevant mathematics courses, including \"Mathematics for Computer Science,\" \"Linear Algebra,\" \"Introduction to Probability and Statistics,\" \"Real Analysis,\" and \"Introduction to Functional Analysis\".26 These courses provide a deep theoretical grounding that is invaluable for research.\n\n**Stanford Online** also offers courses highly relevant to ML/DL mathematics. The **CS229 Machine Learning** course requires proficiency in college calculus and linear algebra, and familiarity with probability theory, emphasizing statistical and mathematical comprehension.14 The\n\n**MATH51 Linear Algebra, Multivariable Calculus, and Modern Applications** course provides unified coverage of linear algebra (orthogonality, SVD, least squares) and multivariable calculus (gradients, Hessians, gradient descent, Chain Rule), explicitly recommended as preparation for CS229 and CS230.11 These university-level resources are particularly beneficial for those seeking a comprehensive, proof-based understanding.\n\n### **B. Complementary Resources for Intuition and Practice**\n\nTo quickly and effectively grasp complex mathematical concepts, supplementing structured courses with visual, interactive, and practice-oriented resources is highly beneficial.\n\n#### **Visual Learning**\n\nVisual explanations can significantly enhance intuition for abstract mathematical concepts. **3Blue1Brown**, a YouTube channel by Grant Sanderson, is widely acclaimed for its visually intuitive explanations of higher mathematics, including linear algebra and neural networks.27 His \"Essence of Linear Algebra\" series, for instance, provides a geometric understanding that can be a great starting point for grasping concepts like rank and transformations.27 The channel's emphasis on visualizing core ideas helps make difficult problems simpler through changes in perspective.31\n\n#### **Interactive Tools**\n\nInteractive tools allow for experimentation and direct manipulation of mathematical concepts, fostering a deeper understanding than passive learning.34 For linear algebra, tools like\n\n**Wolfram U's Introduction to Linear Algebra** and **Understand The Math** offer interactive video lessons and guided notes that allow users to solve systems of equations, compute matrix operations, and work with eigenvalues and eigenvectors.35\n\n**Mathos AI's Linear Algebra Visualizer** and **Maple's Student[LinearAlgebra] subpackage** provide dynamic visualizations of vectors, matrices, and linear transformations, aiding in the comprehension of their effects on data.34\n\nFor probability and statistics, **Seeing Theory (Brown University)** offers interactive visualizations of various discrete and continuous probability distributions, allowing users to explore probability mass/density functions and cumulative distribution functions.38 Similarly,\n\n**Allen Kim's Intuitive Interactive Bayes' Theorem Visualization** provides a dynamic way to understand how Bayes' Theorem updates probabilities based on evidence.40 These interactive resources promote a deeper understanding of underlying principles rather than rote memorization.20\n\n#### **Practice Problems & Solutions**\n\nConsistent practice is paramount for solidifying mathematical understanding. **Pauls Online Math Notes** offers extensive practice problems with solutions for Calculus I, II, and III, covering topics from differentiation to integration and multivariable calculus.42 For machine learning-specific math problems, platforms like\n\n**Onlinemathtraining.com** provide problem sets and solutions for concepts like linear regression, LDA, logistic regression, and neural networks, often demonstrating their application in ML algorithms.44\n\nGitHub repositories, such as ilmoi/MML-Book, provide code and solutions for exercises from prominent textbooks like \"Mathematics for Machine Learning\".45 Other repositories, like\n\nhrnbot/Basic-Mathematics-for-Machine-Learning, offer Python notebooks demonstrating basic algebra, calculus, statistics, and probability concepts relevant to ML.15 Engaging with these resources and attempting to code concepts from scratch using libraries like NumPy can significantly strengthen comprehension.27 Additionally, platforms like\n\n**Kaggle** offer datasets and challenges that involve applying mathematical concepts to real-world problems, such as math word problem solving, providing a practical testing ground for acquired knowledge.46\n\n### **C. Recommended Textbooks for Deep Dive**\n\nTextbooks offer comprehensive and rigorous treatments of mathematical subjects, serving as invaluable references for researchers.\n\n#### **Foundational Texts**\n\n* **\"Mathematics for Machine Learning\" by Marc Peter Deisenroth, A. Aldo Faisal, and Cheng Soon Ong:** This book is widely recommended and is freely available online.48 It aims to bridge the gap between AI applications and their mathematical foundations, covering regression, neural networks, optimization, probability, and more within an AI context.49 While some find it challenging for beginners without a strong proof-based math background, it is highly valued as a refresher or reference.50 It is particularly useful for understanding how concepts fit into the bigger picture of ML algorithms.53\n* **\"The Elements of Statistical Learning: Data Mining, Inference, and Prediction\" by Trevor Hastie, Robert Tibshirani, and Jerome Friedman:** This is a classic and highly regarded book in the field, freely available online.48 It covers a broad range of topics from supervised to unsupervised learning, including neural networks, support vector machines, and boosting.55 The book is dense and mathematically rigorous, making it a foundational resource for statisticians and those interested in data mining.55 An associated book, \"An Introduction to Statistical Learning\" (ISL), by the same authors, offers a less mathematical and more application-focused approach, which can serve as a gentler entry point.56\n\n#### **Deep Learning Specific**\n\n* **\"Deep Learning\" by Ian Goodfellow, Yoshua Bengio, and Aaron Courville:** This is considered the most comprehensive book on deep learning, available as a free HTML book online.48 It covers mathematical and conceptual background, industry techniques, and research perspectives.48 While some reviewers note it can be dense and fragmented, it is highly useful for mathematicians and mathematically-trained practitioners seeking a rigorous framework for deep learning, particularly for its strong linear algebra review and treatment of Monte Carlo methods.61 It provides a solid foundation on deep learning techniques and vocabulary.62\n\n#### **Specialized Texts**\n\nFor deeper dives into specific areas, additional textbooks are recommended:\n\n* **\"Linear Algebra Done Right\" by Sheldon Axler:** Praised for its conceptual approach to linear algebra, moving beyond determinants.54\n* **\"Mathematical Statistics and Data Analysis\" by John A. Rice:** A standard text for statistical theory.54\n* **\"Convex Optimization\" by Stephen Boyd and Lieven Vandenberghe:** Essential for a thorough understanding of optimization problems in ML, especially those with convex structures.48\n* **\"Linear Algebra With Machine Learning and Data\" by Crista Arangala:** Offers a case study approach to linear algebra applications in data analytics, with Python and R syntax.18\n* **\"Linear Algebra and Optimization for Machine Learning\" by Charu C. Aggarwal:** Integrates linear algebra and optimization directly within the context of machine learning, with numerous examples and exercises.12\n* **\"Introduction to Probability for Data Science\" by Stanley H. Chan:** An undergraduate textbook focused on probability for data science, available for free download.63\n\nIt is important to acknowledge that some \"math for ML\" books, despite their titles, can be quite challenging for individuals without a strong background in proof-based mathematics.50 These texts are often better suited as refreshers or reference materials for those with prior mathematical maturity, rather than as initial learning resources for beginners.50 The value of these books for research lies in their rigorous treatment and comprehensive coverage, which can fill gaps in knowledge and provide a deeper understanding necessary for solving a wider range of problems.53\n\n### **D. Effective Learning Strategies for Researchers**\n\nTo quickly and thoroughly acquire the mathematical foundations for ML/DL research, specific learning strategies are highly effective.\n\n#### **Prioritize Foundational Understanding**\n\nFor research, a deep understanding of the underlying mathematical principles is necessary, not just rote memorization of formulas or how to use libraries.27 The ability to understand how things work at a fundamental level, such as the parameters of a Gaussian mixture model or the concept of a probability density function, is a huge asset.53 This foundational knowledge empowers researchers to troubleshoot algorithms, create efficient models, and incorporate creative thinking, moving beyond simply using out-of-the-box tools.5\n\n#### **Learn by Doing (Code from Scratch)**\n\nActively implementing mathematical concepts and algorithms from scratch is a powerful way to solidify understanding. Coding fundamental algorithms like gradient descent or logistic regression using only numerical libraries such as NumPy forces a deeper engagement with the mathematics.27 This practical application helps in visualizing the algebra and statistics and reveals how mathematical concepts are translated into executable code.23 Employers are often more interested in practical application skills than in memorized formulas.27\n\n#### **Iterative Learning and \"Pay-as-You-Go\"**\n\nThe vastness of mathematics relevant to AI can be daunting. An effective approach is to treat mathematical concepts as a \"pay-as-you-go\" system: whenever an unfamiliar concept arises in research or advanced studies, dedicate time to understanding it thoroughly.9 This iterative learning process, driven by immediate need, provides strong motivation and ensures that the acquired knowledge is directly relevant to current challenges.27 It is not necessary to learn everything at once; instead, focus on consolidating fundamentals and then expanding knowledge as required by specific problems.9\n\n#### **Focus on Concepts over Memorization**\n\nGrasping the intuition and underlying concepts is more valuable than memorizing formulas.20 Visual aids, interactive tools, and geometric interpretations (e.g., 3Blue1Brown's approach to linear algebra) can significantly aid in building this intuition.20 The goal is to develop a mental model of how the mathematics behaves, even in high-dimensional spaces, by starting with 2D and 3D visualizations.66\n\n#### **Roadmaps as Guides**\n\nWhile comprehensive learning roadmaps can be helpful for navigation, it is important to recognize that \"completing\" learning in machine learning is an ongoing process, not a finite destination.67 The field is constantly evolving, requiring continuous learning and adaptation of one's mathematical toolkit.49 Roadmaps serve as valuable guides to essential topics, but the depth of exploration should be driven by research goals and the demands of specific problems.8\n\n## **III. Conclusion and Recommendations**\n\nConducting research in machine learning and deep learning demands a robust and multi-faceted mathematical foundation that extends significantly beyond what is required for practical application. The core disciplines of linear algebra, calculus, probability, statistics, and optimization theory form the bedrock upon which all advanced AI models are built and understood. Linear algebra provides the essential framework for data representation and transformation, enabling the handling of complex, high-dimensional datasets that characterize modern AI. Calculus acts as the driving force behind model learning, allowing for the precise adjustment of parameters through gradient-based optimization. Probability and statistics offer the critical lens for interpreting data, quantifying uncertainty, and ensuring the reliability and generalization capabilities of models. Finally, optimization theory translates these mathematical principles into actionable learning processes, guiding models to minimize errors and maximize performance.\n\nFor aspiring researchers, the journey to mastering these mathematical foundations is continuous and iterative. It necessitates a strategic approach to learning that prioritizes deep conceptual understanding over rote memorization, actively engages with practical implementation, and leverages a diverse array of high-quality online resources.\n\n**Recommendations for Accelerated and Quality Learning:**\n\n1. **Prioritize Deep, Conceptual Understanding:** Focus on *why* mathematical concepts work and *how* they apply to ML/DL, rather than just memorizing formulas. Utilize visual learning resources like 3Blue1Brown to build strong intuition.20\n2. **Engage with Structured Online Curricula:** Enroll in specializations from reputable institutions such as DeepLearning.AI, Imperial College London, and Stanford Online. These programs offer comprehensive, well-structured learning paths with practical exercises.19\n3. **Leverage University OpenCourseWare:** For a rigorous, academic-level understanding, explore free courses from MIT OpenCourseWare and Stanford Online that delve into advanced linear algebra, multivariable calculus, real analysis, and functional analysis.11\n4. **Practice Actively with Interactive Tools and Problem Sets:** Supplement theoretical learning with hands-on practice. Utilize interactive visualization tools for linear algebra and probability, and work through problem sets with solutions from resources like Pauls Online Math Notes and GitHub repositories.1\n5. **Implement Algorithms from Scratch:** To truly internalize the mathematical mechanics, code core ML/DL algorithms (e.g., gradient descent, logistic regression) using fundamental libraries like NumPy. This \"learning by doing\" approach solidifies theoretical knowledge.27\n6. **Consult Foundational Textbooks as References:** While some foundational textbooks may be challenging for initial learning, they serve as indispensable references for deeper theoretical exploration and problem-solving. Key examples include \"Mathematics for Machine Learning\" by Deisenroth et al., \"The Elements of Statistical Learning\" by Hastie et al., and \"Deep Learning\" by Goodfellow et al., many of which are freely available online.48\n7. **Adopt an Iterative, Problem-Driven Learning Approach:** Embrace a \"pay-as-you-go\" strategy where deeper mathematical concepts are explored as specific research problems or advanced topics demand them. This ensures relevance and maintains motivation.9\n\nBy systematically building these mathematical pillars and adopting effective learning strategies, aspiring researchers can quickly and comprehensively acquire the necessary foundations to contribute meaningfully to the rapidly evolving fields of machine learning and deep learning. The continuous advancement of AI relies on a deep, nuanced understanding of its mathematical underpinnings, making this pursuit an essential investment for any serious researcher.\n\n#### 引用的著作\n\n1. Maths for Machine Learning - GeeksforGeeks, 访问时间为 七月 29, 2025， <https://www.geeksforgeeks.org/machine-learning/machine-learning-mathematics/>\n2. Mathematics of Machine Learning: An introduction, 访问时间为 七月 29, 2025， <https://oar.princeton.edu/bitstream/88435/pr1cg32/1/MachineLearningMathematics.pdf>\n3. The Mathematical Foundation of Deep Learning: Your Complete Guide to Understanding AI, 访问时间为 七月 29, 2025， [https://medium.com/@richardhightower/the-mathematical-foundation-of-deep-learning-your-complete-guide-to-understanding-ai-66dea318a4c7](https://medium.com/%40richardhightower/the-mathematical-foundation-of-deep-learning-your-complete-guide-to-understanding-ai-66dea318a4c7)\n4. Detailed Maths Topics and Their Direct Use In Machine Learning | by Ravish Kumar, 访问时间为 七月 29, 2025， <https://medium.com/enjoy-algorithm/detailed-maths-topics-in-machine-learning-ca55cd537709>\n5. Mathematics for Machine Learning and Data Science Specialization - Coursera, 访问时间为 七月 29, 2025， <https://www.coursera.org/specializations/mathematics-for-machine-learning-and-data-science>\n6. Mathematical Foundations of Deep Learning[v1] - Preprints.org, 访问时间为 七月 29, 2025， <https://www.preprints.org/manuscript/202502.0272/v1>\n7. Prerequisites and prework | Machine Learning - Google for Developers, 访问时间为 七月 29, 2025， <https://developers.google.com/machine-learning/crash-course/prereqs-and-prework>\n8. What are the mathematical prerequisites needed to understand research papers on neural networks? [closed] - AI Stack Exchange, 访问时间为 七月 29, 2025， <https://ai.stackexchange.com/questions/23433/what-are-the-mathematical-prerequisites-needed-to-understand-research-papers-on>\n9. jasmcaus/ai-math-roadmap: Your no-nonsense guide to the Math used in Artificial Intelligence - GitHub, 访问时间为 七月 29, 2025， <https://github.com/jasmcaus/ai-math-roadmap>\n10. www.geeksforgeeks.org, 访问时间为 七月 29, 2025， <https://www.geeksforgeeks.org/dsa/mathematics-concept-required-for-deep-learning/>\n11. Linear Algebra, Calculus, & Applications I Stanford Online, 访问时间为 七月 29, 2025， <https://online.stanford.edu/courses/math51-linear-algebra-multivariable-calculus-and-modern-applications>\n12. Linear Algebra and Optimization for Machine Learning: A Textbook - Barnes & Noble, 访问时间为 七月 29, 2025， <https://www.barnesandnoble.com/w/linear-algebra-and-optimization-for-machine-learning-charu-c-aggarwal/1135871957>\n13. 11-785 Deep Learning - Carnegie Mellon University, 访问时间为 七月 29, 2025， <https://deeplearning.cs.cmu.edu/>\n14. Machine Learning Course | Stanford Online, 访问时间为 七月 29, 2025， <https://online.stanford.edu/courses/xcs229-machine-learning>\n15. hrnbot/Basic-Mathematics-for-Machine-Learning: The motive behind Creating this repo is to feel the fear of mathematics and do what ever you want to do in Machine Learning , Deep Learning and other fields of AI - GitHub, 访问时间为 七月 29, 2025， <https://github.com/hrnbot/Basic-Mathematics-for-Machine-Learning>\n16. Mathematics needed to do a PhD in machine learning at a top ranked university - Reddit, 访问时间为 七月 29, 2025， <https://www.reddit.com/r/OMSCS/comments/ggpzlw/mathematics_needed_to_do_a_phd_in_machine/>\n17. Lecture Notes | Mathematics of Machine Learning - MIT OpenCourseWare, 访问时间为 七月 29, 2025， <https://ocw.mit.edu/courses/18-657-mathematics-of-machine-learning-fall-2015/pages/lecture-notes/>\n18. Linear Algebra With Machine Learning and Data - 1st Edition - Crista A - Routledge, 访问时间为 七月 29, 2025， <https://www.routledge.com/Linear-Algebra-With-Machine-Learning-and-Data/Arangala/p/book/9780367458393>\n19. Top Math for Machine Learning Courses Online [2025] | Coursera ..., 访问时间为 七月 29, 2025， [https://www.coursera.org/courses?query=math%20for%20machine%20learning](https://www.coursera.org/courses?query=math+for+machine+learning)\n20. Probability & Statistics for Machine Learning & Data Science | Coursera, 访问时间为 七月 29, 2025， <https://www.coursera.org/learn/machine-learning-probability-and-statistics>\n21. Review — Is Mathematics for Machine Learning and Data Science Specialization on Coursera worth it? | by javinpaul | Javarevisited | Medium, 访问时间为 七月 29, 2025， <https://medium.com/javarevisited/is-mathematics-for-machine-learning-and-data-science-specialization-by-deeplearning-ai-f60aa31867b6>\n22. Best course for machine learning mathematics - MLS Resources - DeepLearning.AI, 访问时间为 七月 29, 2025， <https://community.deeplearning.ai/t/best-course-for-machine-learning-mathematics/761877>\n23. Is the Mathematics for Machine Learning specialization offered by Imperial College London on coursera sufficient for someone with non CS background? : r/MLQuestions - Reddit, 访问时间为 七月 29, 2025， <https://www.reddit.com/r/MLQuestions/comments/kwftqv/is_the_mathematics_for_machine_learning/>\n24. Machine Learning | Coursera, 访问时间为 七月 29, 2025， <https://www.coursera.org/specializations/machine-learning-introduction>\n25. Deep Learning | Coursera, 访问时间为 七月 29, 2025， <https://www.coursera.org/specializations/deep-learning>\n26. Artificial Intelligence | MIT Learn - Learn with MIT, 访问时间为 七月 29, 2025， <https://learn.mit.edu/c/department/mathematics?resource=4007>\n27. How To Learn Math for Machine Learning FAST (Even With Zero Math Background), 访问时间为 七月 29, 2025， <https://www.youtube.com/watch?v=KgolhE7p-KY&pp=0gcJCfwAo7VqN5tD>\n28. Intuitive Math for Deep Learning mastery : r/deeplearning - Reddit, 访问时间为 七月 29, 2025， <https://www.reddit.com/r/deeplearning/comments/1bb2p6w/intuitive_math_for_deep_learning_mastery/>\n29. 22. Appendix: Mathematics for Deep Learning, 访问时间为 七月 29, 2025， <https://www.d2l.ai/chapter_appendix-mathematics-for-deep-learning/index.html>\n30. 3Blue1Brown - Wikipedia, 访问时间为 七月 29, 2025， <https://en.wikipedia.org/wiki/3Blue1Brown>\n31. 3Blue1Brown - YouTube, 访问时间为 七月 29, 2025， <https://www.youtube.com/c/3blue1brown>\n32. 3Blue1Brown, 访问时间为 七月 29, 2025， <https://www.3blue1brown.com/>\n33. 3Blue1Brown - YouTube, 访问时间为 七月 29, 2025， [https://www.youtube.com/@3blue1brown](https://www.youtube.com/%403blue1brown)\n34. Free Linear Algebra Visualizer - Mathos AI, 访问时间为 七月 29, 2025， <https://www.mathgptpro.com/app/calculator/linear-algebra-visualizer>\n35. Introduction to Linear Algebra, Interactive Online Video Course - Wolfram, 访问时间为 七月 29, 2025， <https://www.wolfram.com/wolfram-u/courses/mathematics/introduction-to-linear-algebra/>\n36. Linear Algebra Made Simple | Step-by-Step Lessons, Examples & Free Guided Notes, 访问时间为 七月 29, 2025， <https://www.understandthemath.com/linear-algebra>\n37. Linear Algebra Visualization 1 - Maple Help - Maplesoft, 访问时间为 七月 29, 2025， [https://www.maplesoft.com/support/help/Maple/view.aspx?path=examples%2FLinearAlgebraVisualization1](https://www.maplesoft.com/support/help/Maple/view.aspx?path=examples/LinearAlgebraVisualization1)\n38. Probability Distributions - Seeing Theory, 访问时间为 七月 29, 2025， <https://seeing-theory.brown.edu/probability-distributions/index.html>\n39. Interactive visualization of probability distributions, 访问时间为 七月 29, 2025， <https://probstats.org/>\n40. Intuitive Interactive Bayes' Theorem Visualization - Allen Kim, 访问时间为 七月 29, 2025， <https://allenkim67.github.io/bayes-demo/>\n41. Bayes' Theorem EXPLAINED with Examples - YouTube, 访问时间为 七月 29, 2025， <https://www.youtube.com/watch?v=cqTwHnNbc8g>\n42. Calculus I (Practice Problems) - Pauls Online Math Notes, 访问时间为 七月 29, 2025， <https://tutorial.math.lamar.edu/problems/calci/calci.aspx>\n43. Calculus II (Practice Problems) - Pauls Online Math Notes, 访问时间为 七月 29, 2025， <https://tutorial.math.lamar.edu/problems/calcii/calcii.aspx>\n44. MML Practice Problems - Online Math Training, 访问时间为 七月 29, 2025， <https://www.onlinemathtraining.com/math-for-machine-learning-practice-problems/>\n45. Code / solutions for Mathematics for Machine Learning (MML Book) - GitHub, 访问时间为 七月 29, 2025， <https://github.com/ilmoi/MML-Book>\n46. MathQA (Math Problems) - Kaggle, 访问时间为 七月 29, 2025， <https://www.kaggle.com/datasets/thedevastator/dataset-for-solving-math-word-problems>\n47. MAP - Charting Student Math Misunderstandings competition on Kaggle - Reddit, 访问时间为 七月 29, 2025， <https://www.reddit.com/r/kaggle/comments/1m667v5/map_charting_student_math_misunderstandings/>\n48. Mathematics for Machine Learning (120 books) - Goodreads, 访问时间为 七月 29, 2025， <https://www.goodreads.com/list/show/163734.Mathematics_for_Machine_Learning>\n49. Essential Math for AI: Next-Level Mathematics for Efficient and Successful AI Systems, 访问时间为 七月 29, 2025， <https://www.goodreads.com/book/show/74963630-essential-math-for-ai>\n50. [D] Am I the only one stumbled at the recent book Mathematics for Machine Learning : r/MachineLearning - Reddit, 访问时间为 七月 29, 2025， <https://www.reddit.com/r/MachineLearning/comments/9nsbna/d_am_i_the_only_one_stumbled_at_the_recent_book/>\n51. Mathematics for ML book : r/learnmachinelearning - Reddit, 访问时间为 七月 29, 2025， <https://www.reddit.com/r/learnmachinelearning/comments/1k1zb61/mathematics_for_ml_book/>\n52. Math-heavy Machine Learning book with exercises : r/learnmachinelearning - Reddit, 访问时间为 七月 29, 2025， <https://www.reddit.com/r/learnmachinelearning/comments/1l3sw6u/mathheavy_machine_learning_book_with_exercises/>\n53. Mathematics for Machine Learning (book review) - YouTube, 访问时间为 七月 29, 2025， <https://www.youtube.com/watch?v=fp5tqPlgJxs>\n54. medium.com, 访问时间为 七月 29, 2025， <https://medium.com/data-science/from-linear-algebra-to-deep-learning-in-7-books-winter-2023-update-8df2b706a0b1>\n55. The Elements of Statistical Learning: Data Mining, Inference, and Prediction, Second Edition, 访问时间为 七月 29, 2025， <https://freecomputerbooks.com/The-Elements-of-Statistical-Learning.html>\n56. Book Review - The Elements of Statistical Learning: Data Mining, Inference, and Prediction, 访问时间为 七月 29, 2025， <https://www.learningmachines101.com/book-review-elements-statistical-learning-data-mining-inference-prediction/>\n57. The Elements of Statistical Learning: Data Mining, Inference, and Prediction - Book Review, 访问时间为 七月 29, 2025， <https://www.jamesbower.com/the-elements-of-statistical-learning-data-mining-inference-and-prediction-book-review/>\n58. [E] Demystifying Elements of Statistical Learning - Stats Post Pt. 1 - Covering Introduction - Chapter 2.3.1 Linear Models and Least Squares Included - Reddit, 访问时间为 七月 29, 2025， <https://www.reddit.com/r/statistics/comments/1bek2ba/e_demystifying_elements_of_statistical_learning/>\n59. How's this? Any reviews? : r/learnmachinelearning - Reddit, 访问时间为 七月 29, 2025， <https://www.reddit.com/r/learnmachinelearning/comments/1kc45fc/hows_this_any_reviews/>\n60. MIT Deep Learning Book in PDF format (complete and parts) by Ian Goodfellow, Yoshua Bengio and Aaron Courville - GitHub, 访问时间为 七月 29, 2025， <https://github.com/janishar/mit-deep-learning-book-pdf>\n61. Ian Goodfellow's Deep Learning book pretty much useless. I own it and have read - Hacker News, 访问时间为 七月 29, 2025， <https://news.ycombinator.com/item?id=19771771>\n62. The Only Deep Learning Book You Need - YouTube, 访问时间为 七月 29, 2025， <https://www.youtube.com/watch?v=Ri-CkjnhRRo>\n63. Introduction to Probability for Data Science, 访问时间为 七月 29, 2025， <https://probability4datascience.com/>\n64. MIT fundamental maths courses for machine learning study group : r/learnmachinelearning, 访问时间为 七月 29, 2025， <https://www.reddit.com/r/learnmachinelearning/comments/jlm472/mit_fundamental_maths_courses_for_machine/>\n65. Math for Machine Learning and Data Science Specialization Review - YouTube, 访问时间为 七月 29, 2025， <https://m.youtube.com/watch?v=JPHS10dt_CY&pp=ygUHI2FpbWF0aA%3D%3D>\n66. Mentally Visualizing Some Mathematical Concepts : r/learnmachinelearning - Reddit, 访问时间为 七月 29, 2025， <https://www.reddit.com/r/learnmachinelearning/comments/1ijvw7u/mentally_visualizing_some_mathematical_concepts/>\n67. Roadmap for learning ml : r/learnmachinelearning - Reddit, 访问时间为 七月 29, 2025， <https://www.reddit.com/r/learnmachinelearning/comments/1kqoptw/roadmap_for_learning_ml/>\n68. A Clear roadmap to complete learning AI/ML by the end of 2025 : r/learnmachinelearning, 访问时间为 七月 29, 2025， <https://www.reddit.com/r/learnmachinelearning/comments/1lbs4qi/a_clear_roadmap_to_complete_learning_aiml_by_the/>\n69. www.coursera.org, 访问时间为 七月 29, 2025， [https://www.coursera.org/courses?query=mathematics%20for%20machine%20learning](https://www.coursera.org/courses?query=mathematics+for+machine+learning)\n70. Statistics and Machine Learning Toolbox - MATLAB - MathWorks, 访问时间为 七月 29, 2025， <https://www.mathworks.com/products/statistics.html>\n",
  "all_source_links": [
    "https://accounts.google.com/SignOutOptions?hl=zh-CN&continue=https://gemini.google.com/app%3Fis_sa%3D1%26is_sa%3D1%26android-min-version%3D301356232%26ios-min-version%3D322.0%26campaign_id%3Dbkws%26utm_source%3Dsem%26utm_source%3Dgoogle%26utm_medium%3Dpaid-media%26utm_medium%3Dcpc%26utm_campaign%3Dbkws%26utm_campaign%3D2024enAU_gemfeb%26pt%3D9008%26mt%3D8%26ct%3Dp-growth-sem-bkws%26gclsrc%3Daw.ds%26gad_source%3D1%26gad_campaignid%3D22437964261%26gbraid%3D0AAAAApk5BhmTIKeu82GeBI85qNScnwP3m%26gclid%3DCjwKCAjwkvbEBhApEiwAKUz6-ybVgRKghbvMe_m6J9HfhKccGbx5pv_fQCiPXewPYkQWthYXErb2txoClPAQAvD_BwE&ec=GBRAkgU",
    "https://ai.stackexchange.com/questions/23433/what-are-the-mathematical-prerequisites-needed-to-understand-research-papers-on",
    "https://allenkim67.github.io/bayes-demo",
    "https://community.deeplearning.ai/t/best-course-for-machine-learning-mathematics/761877",
    "https://deeplearning.cs.cmu.edu",
    "https://developers.google.com/machine-learning/crash-course/prereqs-and-prework",
    "https://en.wikipedia.org/wiki/3Blue1Brown",
    "https://extendedstudies.ucsd.edu/courses-certificates/data-analysis-mathematics/applied-mathematics",
    "https://freecomputerbooks.com/The-Elements-of-Statistical-Learning.html",
    "https://github.com/hrnbot/Basic-Mathematics-for-Machine-Learning",
    "https://github.com/ilmoi/MML-Book",
    "https://github.com/janishar/mit-deep-learning-book-pdf",
    "https://github.com/jasmcaus/ai-math-roadmap",
    "https://learn.mit.edu/c/department/mathematics?resource=4007",
    "https://m.youtube.com/watch?v=JPHS10dt_CY&pp=ygUHI2FpbWF0aA%3D%3D",
    "https://medium.com/%40richardhightower/the-mathematical-foundation-of-deep-learning-your-complete-guide-to-understanding-ai-66dea318a4c7",
    "https://medium.com/@richardhightower/the-mathematical-foundation-of-deep-learning-your-complete-guide-to-understanding-ai-66dea318a4c7",
    "https://medium.com/data-science/from-linear-algebra-to-deep-learning-in-7-books-winter-2023-update-8df2b706a0b1",
    "https://medium.com/enjoy-algorithm/detailed-maths-topics-in-machine-learning-ca55cd537709",
    "https://medium.com/javarevisited/is-mathematics-for-machine-learning-and-data-science-specialization-by-deeplearning-ai-f60aa31867b6",
    "https://mit-6861.github.io/supplemental",
    "https://myactivity.google.com/product/gemini?utm_source=gemini",
    "https://news.ycombinator.com/item?id=19771771",
    "https://oar.princeton.edu/bitstream/88435/pr1cg32/1/MachineLearningMathematics.pdf",
    "https://ocw.mit.edu/courses/18-657-mathematics-of-machine-learning-fall-2015/pages/lecture-notes",
    "https://online.stanford.edu/courses/math51-linear-algebra-multivariable-calculus-and-modern-applications",
    "https://online.stanford.edu/courses/xcs229-machine-learning",
    "https://policies.google.com/terms",
    "https://probability4datascience.com",
    "https://probstats.org",
    "https://quickmath.com",
    "https://reddsera.com/specializations/mathematics-machine-learning",
    "https://seeing-theory.brown.edu/probability-distributions/index.html",
    "https://support.google.com/bard/answer/13594961",
    "https://support.google.com/gemini/answer/13594961#location&zippy=%2Cwhat-location-information-do-gemini-apps-collect-why-and-how-is-it-used",
    "https://tutorial.math.lamar.edu/problems/calci/calci.aspx",
    "https://tutorial.math.lamar.edu/problems/calcii/calcii.aspx",
    "https://www.3blue1brown.com",
    "https://www.barnesandnoble.com/w/linear-algebra-and-optimization-for-machine-learning-charu-c-aggarwal/1135871957",
    "https://www.coursera.org/courses?query=math%20for%20machine%20learning",
    "https://www.coursera.org/courses?query=math+for+machine+learning",
    "https://www.coursera.org/courses?query=mathematics%20for%20machine%20learning",
    "https://www.coursera.org/courses?query=mathematics+for+machine+learning",
    "https://www.coursera.org/learn/machine-learning-probability-and-statistics",
    "https://www.coursera.org/specializations/deep-learning",
    "https://www.coursera.org/specializations/machine-learning-introduction",
    "https://www.coursera.org/specializations/mathematics-for-machine-learning-and-data-science",
    "https://www.d2l.ai/chapter_appendix-mathematics-for-deep-learning/index.html",
    "https://www.datacamp.com/blog/top-10-deep-learning-books-to-read-in-2022",
    "https://www.doc.ic.ac.uk/~dfg/ProbabilisticInference/InferenceAndMachineLearningNotes.pdf",
    "https://www.geeksforgeeks.org/dsa/mathematics-concept-required-for-deep-learning",
    "https://www.geeksforgeeks.org/machine-learning/machine-learning-mathematics",
    "https://www.goodreads.com/book/show/74963630-essential-math-for-ai",
    "https://www.goodreads.com/list/show/163734.Mathematics_for_Machine_Learning",
    "https://www.jamesbower.com/the-elements-of-statistical-learning-data-mining-inference-and-prediction-book-review",
    "https://www.kaggle.com/datasets/thedevastator/dataset-for-solving-math-word-problems",
    "https://www.kingsbookstore.com/book/9783031532818",
    "https://www.learningmachines101.com/book-review-elements-statistical-learning-data-mining-inference-prediction",
    "https://www.maplesoft.com/support/help/Maple/view.aspx?path=examples%2FLinearAlgebraVisualization1",
    "https://www.maplesoft.com/support/help/Maple/view.aspx?path=examples/LinearAlgebraVisualization1",
    "https://www.mathgptpro.com/app/calculator/linear-algebra-visualizer",
    "https://www.mathpapa.com/algebra-calculator.html",
    "https://www.mathworks.com/products/statistics.html",
    "https://www.mygreatlearning.com/academy/learn-for-free/courses/probability-and-probability-distributions-for-machine-learning",
    "https://www.onlinemathtraining.com/math-for-machine-learning-practice-problems",
    "https://www.preprints.org/manuscript/202502.0272/v1",
    "https://www.reddit.com/r/MLQuestions/comments/kwftqv/is_the_mathematics_for_machine_learning",
    "https://www.reddit.com/r/MachineLearning/comments/9nsbna/d_am_i_the_only_one_stumbled_at_the_recent_book",
    "https://www.reddit.com/r/OMSCS/comments/ggpzlw/mathematics_needed_to_do_a_phd_in_machine",
    "https://www.reddit.com/r/deeplearning/comments/1bb2p6w/intuitive_math_for_deep_learning_mastery",
    "https://www.reddit.com/r/kaggle/comments/1m667v5/map_charting_student_math_misunderstandings",
    "https://www.reddit.com/r/learnmachinelearning/comments/14878zd/mathematics_courses_for_machine_learningdeep",
    "https://www.reddit.com/r/learnmachinelearning/comments/1ijvw7u/mentally_visualizing_some_mathematical_concepts",
    "https://www.reddit.com/r/learnmachinelearning/comments/1k0fnol/deeplearningai_courses_are_far_superior_to_any",
    "https://www.reddit.com/r/learnmachinelearning/comments/1k1zb61/mathematics_for_ml_book",
    "https://www.reddit.com/r/learnmachinelearning/comments/1kc45fc/hows_this_any_reviews",
    "https://www.reddit.com/r/learnmachinelearning/comments/1kqoptw/roadmap_for_learning_ml",
    "https://www.reddit.com/r/learnmachinelearning/comments/1l3sw6u/mathheavy_machine_learning_book_with_exercises",
    "https://www.reddit.com/r/learnmachinelearning/comments/1lbs4qi/a_clear_roadmap_to_complete_learning_aiml_by_the",
    "https://www.reddit.com/r/learnmachinelearning/comments/jlm472/mit_fundamental_maths_courses_for_machine",
    "https://www.reddit.com/r/statistics/comments/1bek2ba/e_demystifying_elements_of_statistical_learning",
    "https://www.routledge.com/Linear-Algebra-With-Machine-Learning-and-Data/Arangala/p/book/9780367458393",
    "https://www.scribd.com/document/759198661/The-Elements-of-Statistical-Learning-Data-Mining-I",
    "https://www.scribd.com/document/856377201/Deep-Learning-1st-Edition-by-Ian-Goodfellow-Yoshua-Bengio-Aaron-Courville-0262035618-9780262035613-pdf-download",
    "https://www.understandthemath.com/linear-algebra",
    "https://www.wolfram.com/wolfram-u/courses/mathematics/introduction-to-linear-algebra",
    "https://www.youtube.com/%403blue1brown",
    "https://www.youtube.com/@3blue1brown",
    "https://www.youtube.com/c/3blue1brown",
    "https://www.youtube.com/watch?v=KgolhE7p-KY&pp=0gcJCfwAo7VqN5tD",
    "https://www.youtube.com/watch?v=Ri-CkjnhRRo",
    "https://www.youtube.com/watch?v=cqTwHnNbc8g",
    "https://www.youtube.com/watch?v=fp5tqPlgJxs"
  ],
  "summary_citations": [
    "https://accounts.google.com/SignOutOptions?hl=zh-CN&continue=https://gemini.google.com/app%3Fis_sa%3D1%26is_sa%3D1%26android-min-version%3D301356232%26ios-min-version%3D322.0%26campaign_id%3Dbkws%26utm_source%3Dsem%26utm_source%3Dgoogle%26utm_medium%3Dpaid-media%26utm_medium%3Dcpc%26utm_campaign%3Dbkws%26utm_campaign%3D2024enAU_gemfeb%26pt%3D9008%26mt%3D8%26ct%3Dp-growth-sem-bkws%26gclsrc%3Daw.ds%26gad_source%3D1%26gad_campaignid%3D22437964261%26gbraid%3D0AAAAApk5BhmTIKeu82GeBI85qNScnwP3m%26gclid%3DCjwKCAjwkvbEBhApEiwAKUz6-ybVgRKghbvMe_m6J9HfhKccGbx5pv_fQCiPXewPYkQWthYXErb2txoClPAQAvD_BwE&ec=GBRAkgU",
    "https://ai.stackexchange.com/questions/23433/what-are-the-mathematical-prerequisites-needed-to-understand-research-papers-on",
    "https://allenkim67.github.io/bayes-demo",
    "https://community.deeplearning.ai/t/best-course-for-machine-learning-mathematics/761877",
    "https://deeplearning.cs.cmu.edu",
    "https://developers.google.com/machine-learning/crash-course/prereqs-and-prework",
    "https://en.wikipedia.org/wiki/3Blue1Brown",
    "https://extendedstudies.ucsd.edu/courses-certificates/data-analysis-mathematics/applied-mathematics",
    "https://freecomputerbooks.com/The-Elements-of-Statistical-Learning.html",
    "https://github.com/hrnbot/Basic-Mathematics-for-Machine-Learning",
    "https://github.com/ilmoi/MML-Book",
    "https://github.com/janishar/mit-deep-learning-book-pdf",
    "https://github.com/jasmcaus/ai-math-roadmap",
    "https://learn.mit.edu/c/department/mathematics?resource=4007",
    "https://m.youtube.com/watch?v=JPHS10dt_CY&pp=ygUHI2FpbWF0aA%3D%3D",
    "https://medium.com/%40richardhightower/the-mathematical-foundation-of-deep-learning-your-complete-guide-to-understanding-ai-66dea318a4c7",
    "https://medium.com/@richardhightower/the-mathematical-foundation-of-deep-learning-your-complete-guide-to-understanding-ai-66dea318a4c7",
    "https://medium.com/data-science/from-linear-algebra-to-deep-learning-in-7-books-winter-2023-update-8df2b706a0b1",
    "https://medium.com/enjoy-algorithm/detailed-maths-topics-in-machine-learning-ca55cd537709",
    "https://medium.com/javarevisited/is-mathematics-for-machine-learning-and-data-science-specialization-by-deeplearning-ai-f60aa31867b6",
    "https://mit-6861.github.io/supplemental",
    "https://myactivity.google.com/product/gemini?utm_source=gemini",
    "https://news.ycombinator.com/item?id=19771771",
    "https://oar.princeton.edu/bitstream/88435/pr1cg32/1/MachineLearningMathematics.pdf",
    "https://ocw.mit.edu/courses/18-657-mathematics-of-machine-learning-fall-2015/pages/lecture-notes",
    "https://online.stanford.edu/courses/math51-linear-algebra-multivariable-calculus-and-modern-applications",
    "https://online.stanford.edu/courses/xcs229-machine-learning",
    "https://policies.google.com/terms",
    "https://probability4datascience.com",
    "https://probstats.org",
    "https://quickmath.com",
    "https://reddsera.com/specializations/mathematics-machine-learning",
    "https://seeing-theory.brown.edu/probability-distributions/index.html",
    "https://support.google.com/bard/answer/13594961",
    "https://support.google.com/gemini/answer/13594961#location&zippy=%2Cwhat-location-information-do-gemini-apps-collect-why-and-how-is-it-used",
    "https://tutorial.math.lamar.edu/problems/calci/calci.aspx",
    "https://tutorial.math.lamar.edu/problems/calcii/calcii.aspx",
    "https://www.3blue1brown.com",
    "https://www.barnesandnoble.com/w/linear-algebra-and-optimization-for-machine-learning-charu-c-aggarwal/1135871957",
    "https://www.coursera.org/courses?query=math%20for%20machine%20learning",
    "https://www.coursera.org/courses?query=math+for+machine+learning",
    "https://www.coursera.org/courses?query=mathematics%20for%20machine%20learning",
    "https://www.coursera.org/courses?query=mathematics+for+machine+learning",
    "https://www.coursera.org/learn/machine-learning-probability-and-statistics",
    "https://www.coursera.org/specializations/deep-learning",
    "https://www.coursera.org/specializations/machine-learning-introduction",
    "https://www.coursera.org/specializations/mathematics-for-machine-learning-and-data-science",
    "https://www.d2l.ai/chapter_appendix-mathematics-for-deep-learning/index.html",
    "https://www.datacamp.com/blog/top-10-deep-learning-books-to-read-in-2022",
    "https://www.doc.ic.ac.uk/~dfg/ProbabilisticInference/InferenceAndMachineLearningNotes.pdf",
    "https://www.geeksforgeeks.org/dsa/mathematics-concept-required-for-deep-learning",
    "https://www.geeksforgeeks.org/machine-learning/machine-learning-mathematics",
    "https://www.goodreads.com/book/show/74963630-essential-math-for-ai",
    "https://www.goodreads.com/list/show/163734.Mathematics_for_Machine_Learning",
    "https://www.jamesbower.com/the-elements-of-statistical-learning-data-mining-inference-and-prediction-book-review",
    "https://www.kaggle.com/datasets/thedevastator/dataset-for-solving-math-word-problems",
    "https://www.kingsbookstore.com/book/9783031532818",
    "https://www.learningmachines101.com/book-review-elements-statistical-learning-data-mining-inference-prediction",
    "https://www.maplesoft.com/support/help/Maple/view.aspx?path=examples%2FLinearAlgebraVisualization1",
    "https://www.maplesoft.com/support/help/Maple/view.aspx?path=examples/LinearAlgebraVisualization1",
    "https://www.mathgptpro.com/app/calculator/linear-algebra-visualizer",
    "https://www.mathpapa.com/algebra-calculator.html",
    "https://www.mathworks.com/products/statistics.html",
    "https://www.mygreatlearning.com/academy/learn-for-free/courses/probability-and-probability-distributions-for-machine-learning",
    "https://www.onlinemathtraining.com/math-for-machine-learning-practice-problems",
    "https://www.preprints.org/manuscript/202502.0272/v1",
    "https://www.reddit.com/r/MLQuestions/comments/kwftqv/is_the_mathematics_for_machine_learning",
    "https://www.reddit.com/r/MachineLearning/comments/9nsbna/d_am_i_the_only_one_stumbled_at_the_recent_book",
    "https://www.reddit.com/r/OMSCS/comments/ggpzlw/mathematics_needed_to_do_a_phd_in_machine",
    "https://www.reddit.com/r/deeplearning/comments/1bb2p6w/intuitive_math_for_deep_learning_mastery",
    "https://www.reddit.com/r/kaggle/comments/1m667v5/map_charting_student_math_misunderstandings",
    "https://www.reddit.com/r/learnmachinelearning/comments/14878zd/mathematics_courses_for_machine_learningdeep",
    "https://www.reddit.com/r/learnmachinelearning/comments/1ijvw7u/mentally_visualizing_some_mathematical_concepts",
    "https://www.reddit.com/r/learnmachinelearning/comments/1k0fnol/deeplearningai_courses_are_far_superior_to_any",
    "https://www.reddit.com/r/learnmachinelearning/comments/1k1zb61/mathematics_for_ml_book",
    "https://www.reddit.com/r/learnmachinelearning/comments/1kc45fc/hows_this_any_reviews",
    "https://www.reddit.com/r/learnmachinelearning/comments/1kqoptw/roadmap_for_learning_ml",
    "https://www.reddit.com/r/learnmachinelearning/comments/1l3sw6u/mathheavy_machine_learning_book_with_exercises",
    "https://www.reddit.com/r/learnmachinelearning/comments/1lbs4qi/a_clear_roadmap_to_complete_learning_aiml_by_the",
    "https://www.reddit.com/r/learnmachinelearning/comments/jlm472/mit_fundamental_maths_courses_for_machine",
    "https://www.reddit.com/r/statistics/comments/1bek2ba/e_demystifying_elements_of_statistical_learning",
    "https://www.routledge.com/Linear-Algebra-With-Machine-Learning-and-Data/Arangala/p/book/9780367458393",
    "https://www.scribd.com/document/759198661/The-Elements-of-Statistical-Learning-Data-Mining-I",
    "https://www.scribd.com/document/856377201/Deep-Learning-1st-Edition-by-Ian-Goodfellow-Yoshua-Bengio-Aaron-Courville-0262035618-9780262035613-pdf-download",
    "https://www.understandthemath.com/linear-algebra",
    "https://www.wolfram.com/wolfram-u/courses/mathematics/introduction-to-linear-algebra",
    "https://www.youtube.com/%403blue1brown",
    "https://www.youtube.com/@3blue1brown",
    "https://www.youtube.com/c/3blue1brown",
    "https://www.youtube.com/watch?v=KgolhE7p-KY&pp=0gcJCfwAo7VqN5tD",
    "https://www.youtube.com/watch?v=Ri-CkjnhRRo",
    "https://www.youtube.com/watch?v=cqTwHnNbc8g",
    "https://www.youtube.com/watch?v=fp5tqPlgJxs"
  ]
}