{
  "query": "Children's cognitive development and learning. In terms of developmental psychology, it includes stages of cognitive development (Piaget, Vygotsky), children's attention and memory; in terms of learning theory, it includes game-based learning, constructivism, meaningful learning; attention and concentration topics.",
  "chain_of_research": {
    "plan_1": {
      "title": "Research Approach\nPiaget's Theory Focus\nVygotsky's Theory Focus\nNext Steps",
      "description": "I'm starting my research by focusing on the foundational theories of Piaget and Vygotsky, as they are central to understanding children's cognitive development. I'll be conducting separate initial explorations for each theorist to build a strong knowledge base before comparing them.\nFor Piaget, I'll be looking into his four stages of cognitive development, specifically noting the age ranges and the cognitive abilities and limitations characteristic of each stage.\nMy research on Vygotsky will concentrate on key concepts such as the Zone of Proximal Development (ZPD), scaffolding, and the significant role of language and social interaction in cognitive development.\nAfter gathering information on each theory individually, I will then synthesize this information by searching for scholarly articles that directly compare and contrast Piaget and Vygotsky. This will help me to build a comprehensive understanding of their similarities and differences."
    },
    "search_1": [
      "https://en.wikipedia.org/wiki/Piaget%27s_theory_of_cognitive_development#:~:text=above%20their%20level.-,Four%20stages%20of%20development,stage%2C%20and%20formal%20operational%20stage.",
      "https://www.ncbi.nlm.nih.gov/books/NBK448206",
      "https://www.simplypsychology.org/piaget-vs-vygotsky.html",
      "https://www.gowriensw.com.au/thought-leadership/vygotsky-theory#:~:text=Vygotsky's%20sociocultural%20theory%20about%20child,building%20knowledge%20and%20understanding%20concepts.",
      "https://psychologywriting.com/vygotskys-and-piagets-theories-comparison",
      "https://open.library.okstate.edu/foundationsofeducationaltechnology/chapter/2-cognitive-development-the-theory-of-jean-piaget",
      "https://www.mcw.edu/-/media/MCW/Education/Academic-Affairs/OEI/Faculty-Quick-Guides/Sociocultural-Theory-of-Cognitive-Development.pdf",
      "https://psychologywriting.com/piagets-and-vygotskys-theories-of-cognitive-development",
      "https://www.ebsco.com/research-starters/education/sociocultural-theory",
      "https://en.wikipedia.org/wiki/Piaget%27s_theory_of_cognitive_development",
      "https://www.khanacademy.org/science/health-and-medicine/executive-systems-of-the-brain/cognition-lesson/v/piagets-stages-of-cognitive-development",
      "https://indianmentalhealth.com/pdf/2022/vol9-issue3/4-Review-Paper-2.pdf",
      "https://positivepsychology.com/piaget-stages-theory",
      "https://www.vaia.com/en-us/explanations/psychology/social-context-of-behaviour/piaget-vs-vygotsky",
      "https://www.gowriensw.com.au/thought-leadership/vygotsky-theory",
      "https://helpfulprofessor.com/piaget-vs-vygotsky",
      "https://openbooks.library.baylor.edu/lifespanhumandevelopment/chapter/chapter-9-3-vygotskys-sociocultural-theory",
      "https://www.structural-learning.com/post/vygotskys-theory"
    ],
    "observation_1": "I've begun by gathering initial information on Piaget's and Vygotsky's theories of cognitive development. For Piaget, I've identified his four stages: sensorimotor, preoperational, concrete operational, and formal operational, along with their approximate age ranges and some key characteristics like object permanence in the sensorimotor stage and symbolic thought in the preoperational stage. For Vygotsky, I've learned that his sociocultural theory emphasizes the crucial role of social interaction, culture, and language in cognitive development, introducing concepts like the Zone of Proximal Development (ZPD) and the idea of 'more knowledgeable others' (MKOs) who guide learning.",
    "plan_2": {
      "title": "Contrasting Perspectives\nDeepening Understanding",
      "description": "A key insight emerging from the initial search is the fundamental difference in how Piaget and Vygotsky view the source of cognitive development. Piaget emphasizes individual construction of knowledge through interaction with the environment and proposes universal stages, where thought precedes language. In contrast, Vygotsky highlights the social and cultural context, suggesting that learning is a collaborative process mediated by cultural tools, especially language, and that social interaction precedes individual development. While Piaget sees development as more biologically driven and individual, Vygotsky views it as culturally dependent and socially mediated.\nMy next step is to delve deeper into the specifics of these theories. I will be examining detailed descriptions of Piaget's stages, exploring the nuances of Vygotsky's concepts like ZPD and scaffolding, and further analyzing the comparisons between their perspectives on language, social interaction, and the nature of learning. This will allow me to build a more robust understanding of these foundational theories before moving on to other aspects of children's cognitive development and learning."
    },
    "search_2": [
      "https://psychologywriting.com/vygotskys-and-piagets-theories-comparison",
      "https://www.simplypsychology.org/piaget-vs-vygotsky.html",
      "https://www.ncbi.nlm.nih.gov/books/NBK448206"
    ],
    "observation_2": "I've successfully gathered comprehensive information on both Piaget's and Vygotsky's theories of cognitive development. For Piaget, I now have a detailed understanding of his four stages: sensorimotor, preoperational, concrete operational, and formal operational, including the typical age ranges and the specific cognitive abilities and limitations associated with each. This includes concepts like object permanence, symbolic play, conservation, and hypothetical-deductive thought. For Vygotsky, I've gained a solid grasp of his sociocultural theory, focusing on the Zone of Proximal Development (ZPD), the role of 'more knowledgeable others' (MKOs), scaffolding, and the critical importance of language and social interaction in shaping cognitive growth.",
    "plan_3": {
      "title": "Synthesizing Contrasting Views\nNext Research Focus: Attention and Memory",
      "description": "A significant part of my work involved synthesizing the comparisons between Piaget and Vygotsky. I've noted that while both acknowledge children as active learners, Piaget emphasizes individual discovery and universal, biologically-driven stages where thought precedes language. Vygotsky, conversely, highlights the social and cultural context, viewing learning as a collaborative process where social interaction and language are primary drivers of cognitive development. This distinction is particularly evident in their views on the role of language and the influence of culture on development, with Vygotsky emphasizing cultural mediation and the idea that learning appears first on a social level before being internalized.\nHaving established a strong foundation in Piaget's and Vygotsky's theories, I am now shifting my focus to children's attention and memory. My next steps will involve researching the development of attention, specifically looking into selective attention, sustained attention, and executive control. Concurrently, I will investigate the development of memory, focusing on working memory, long-term memory, and the use of mnemonic strategies. I will prioritize information from academic sources in developmental psychology."
    },
    "search_3": [
      "https://socialsci.libretexts.org/Courses/Pittsburg_State_University/The_Developing_Child/12%3A_Cognitive_Development_in_Infancy_and_Toddlerhood/12.04%3A_Cognitive_Processes/12.4.02%3A_Attention",
      "https://www.devon.gov.uk/support-schools-settings/send/educational-psychology/resources/devon-psychology-in-action/memory-and-processing",
      "https://southcountychildandfamily.com/resources/executive-functions/sustained-attention",
      "https://childdevelopment.com.au/areas-of-concern/working-memory",
      "https://deepblue.lib.umich.edu/bitstream/handle/2027.42/108352/ets200453.pdf?sequence%3D1",
      "https://strategiesforlearning.com/strategies-for-enhancing-working-memory",
      "https://www.researchgate.net/publication/6949000_The_Development_of_Sustained_Attention_in_Children_The_Effect_of_Age_and_Task_Load",
      "https://pmc.ncbi.nlm.nih.gov/articles/PMC4207727",
      "https://www.btbpsychology.com/blog/working-memory-strategies-for-children",
      "https://pmc.ncbi.nlm.nih.gov/articles/PMC6528818",
      "https://mybrightwheel.com/blog/childs-memory",
      "https://ris.utwente.nl/ws/portalfiles/portal/16046691/selective_attention.pdf"
    ],
    "observation_3": "I've initiated the next phase of my research, focusing on the development of attention and memory in children. My initial searches have provided a good starting point, and I'm now ready to delve into the specifics of how these cognitive functions evolve from infancy through adolescence. This includes exploring different types of attention, such as selective and sustained attention, and understanding the development of executive control. For memory, I'll be looking into working memory, long-term memory, and the various strategies children employ to remember information.",
    "plan_4": {
      "title": "Targeted Information Gathering\nTransition to Learning Theories",
      "description": "To gain a comprehensive understanding, I'm planning to browse specific academic and child development resources. For attention, I'll be examining how these abilities are measured and the factors that influence their development. For memory, I'll be seeking clear explanations of different memory types and practical examples of how to support memory development in children. This targeted approach will allow me to extract the detailed information needed to address these crucial aspects of cognitive development.\nOnce I have thoroughly explored attention and memory, I will transition to the next major component of my research: learning theories. This structured approach ensures that I build a robust understanding of each area before moving on, allowing for a comprehensive synthesis of the entire topic."
    },
    "search_4": [
      "https://socialsci.libretexts.org/Courses/Pittsburg_State_University/The_Developing_Child/12%3A_Cognitive_Development_in_Infancy_and_Toddlerhood/12.04%3A_Cognitive_Processes/12.4.02%3A_Attention",
      "https://childdevelopment.com.au/areas-of-concern/working-memory",
      "https://www.devon.gov.uk/support-schools-settings/send/educational-psychology/resources/devon-psychology-in-action/memory-and-processing",
      "https://deepblue.lib.umich.edu/bitstream/handle/2027.42/108352/ets200453.pdf?sequence%3D1"
    ],
    "observation_4": "I've made good progress in understanding children's attention and memory. For attention, I've gathered details on its progression from infancy to toddlerhood, including concepts like sustained and selective attention, and the factors that influence them. I also have some insights into how attention is measured, particularly in younger children. For memory, I've gained a clear understanding of working memory and long-term memory, along with practical strategies to support their development, such as mnemonic techniques.",
    "plan_5": {
      "title": "Information Gaps Identified\nShifting Focus to Learning Theories",
      "description": "While I have a solid foundation for attention and memory, I've identified a gap in the information regarding the development of attention through adolescence. My current data is more detailed for earlier developmental stages, and I'll need to keep this in mind for future research if more depth is required in that area.\nHaving established a good understanding of attention and memory, I am now moving on to the next major section of my research: learning theories. My immediate next steps will involve exploring constructivism, meaningful learning, and game-based learning. I will aim to define each theory, understand its core principles, and investigate its practical applications in educational settings. I will also specifically look for information on the psychological benefits of game-based learning."
    },
    "search_5": [
      "https://icenet.blog/2021/10/05/education-theory-made-practical-volume-5-part-9",
      "https://www.ebsco.com/research-starters/education/game-based-learning",
      "https://uwaterloo.ca/chem13-news-magazine/november-2014/recommended/why-educational-research-matters-you-rote-vs-meaningful",
      "https://acrl.ala.org/IS/wp-content/uploads/2014/05/spring2015.pdf",
      "https://en.wikipedia.org/wiki/Meaningful_learning",
      "https://files.eric.ed.gov/fulltext/EJ1090277.pdf",
      "https://quizlet.com/study-guides/ausubel-s-meaningful-verbal-learning-theory-31f50296-fd0f-4588-97ec-1c96ad17a543",
      "http://fountainmagazine.com/2004/issue-48-october-december-2004/constructivism-in-piaget-and-vygotsky",
      "https://pmc.ncbi.nlm.nih.gov/articles/PMC11018941",
      "https://dl.icdst.org/pdfs/files1/7e9bd5801e72bf80a66e4b3fd0b06c50.pdf",
      "https://www.researchgate.net/publication/378071316_Constructivism_in_Education_Exploring_the_Contributions_of_Piaget_Vygotsky_and_Bruner",
      "https://medcerts.com/blog/game-based-learning-key-benefits-examples",
      "https://www.frontiersin.org/journals/education/articles/10.3389/feduc.2021.660376/full",
      "https://edtechbooks.org/studentguide/constructivism",
      "https://www.learningbp.com/meaningful-learning-ausubel-theory",
      "https://en.wikipedia.org/wiki/Constructivism_(philosophy_of_education",
      "https://www.simplypsychology.org/constructivism.html",
      "https://lxdlearningexperiencedesign.com/learning-theory/constructivism-learning-theory"
    ],
    "observation_5": "I've initiated the research into learning theories, specifically focusing on constructivism, meaningful learning, and game-based learning. My initial searches have provided a good overview of each, and I'm now ready to delve deeper into their core principles and practical applications.",
    "plan_6": {
      "title": "Targeted Browsing for Deeper Understanding\nNext Steps: Synthesizing Learning Theories",
      "description": "To gain a comprehensive understanding, I'm planning to browse specific resources for each learning theory. For constructivism, I'll be looking into how Piaget's and Vygotsky's theories of cognitive development underpin this approach. For meaningful learning, I'll focus on its definition, particularly in contrast to rote learning, and Ausubel's contributions. For game-based learning, I'll be investigating its principles and psychological benefits, such as enhanced engagement and motivation.\nMy immediate next steps involve browsing the identified sources to extract detailed information on each learning theory. This will allow me to build a solid foundation for this section of the report. Following this, I will synthesize the relationship between these learning theories and the developmental stages I've already researched, connecting how children's cognitive development influences and is influenced by these learning approaches."
    },
    "search_6": [
      "https://icenet.blog/2021/10/05/education-theory-made-practical-volume-5-part-9",
      "https://www.simplypsychology.org/constructivism.html",
      "http://fountainmagazine.com/2004/issue-48-october-december-2004/constructivism-in-piaget-and-vygotsky",
      "https://files.eric.ed.gov/fulltext/EJ1090277.pdf"
    ],
    "observation_6": "I've successfully gathered substantial information on constructivism, meaningful learning, and game-based learning. I now have a good understanding of their core principles, the key theorists associated with them, and their practical applications in educational settings. This completes the initial exploration of these learning theories.",
    "plan_7": {
      "title": "Connecting Development and Learning\nFuture Research Directions",
      "description": "My next crucial step is to synthesize the information I've gathered on cognitive developmental stages (Piaget, Vygotsky) with these learning theories. I will be analyzing how a child's cognitive stage might influence the effectiveness of teaching methods like constructivism and game-based learning, and how Vygotsky's perspective on social interaction and cultural tools fits into this relationship. This will involve looking for explicit connections between developmental psychology and learning theory.\nTo achieve this synthesis, I will be searching for academic articles and educational resources that specifically discuss the intersection of Piaget's stages and various learning theories, as well as Vygotsky's influence on learning approaches. Following this, I will address the topic of attention and concentration challenges in learning and explore evidence-based strategies to improve focus. Finally, I will investigate modern perspectives and criticisms of classical cognitive development theories to provide a comprehensive analysis."
    },
    "search_7": [
      "https://www.tandfonline.com/doi/full/10.1080/2331186X.2024.2449280",
      "https://www.frontiersin.org/journals/psychology/articles/10.3389/fpsyg.2023.1105806/full",
      "https://www.researchgate.net/publication/227086462_Effectiveness_of_Game-Based_Learning_Influence_of_Cognitive_Style",
      "https://pmc.ncbi.nlm.nih.gov/articles/PMC11018941",
      "https://pmc.ncbi.nlm.nih.gov/articles/PMC10086333",
      "https://gprjournals.org/journals/index.php/jetm/article/download/199/231/667",
      "https://www.simplypsychology.org/constructivism.html",
      "https://www.simplypsychology.org/vygotsky.html",
      "https://www.gowriensw.com.au/thought-leadership/vygotsky-theory",
      "https://ojs.mahadewa.ac.id/index.php/ijed/article/view/4148",
      "https://cornerstone.lib.mnsu.edu/cgi/viewcontent.cgi?article=1138&context=all",
      "https://theeducationhub.org.nz/vygotskys-philosophy-of-education",
      "https://gsi.berkeley.edu/gsi-guide-contents/learning-theory-research/cognitive-constructivism",
      "https://www.etsu.edu/teaching/resources/more_resources/vygotsky.php",
      "https://en.wikipedia.org/wiki/Constructivism_(philosophy_of_education",
      "https://doran-ece.com/app/uploads/sites/2/2021/06/Jean-Piagets-Constructivist-Theory-of-Learning-and-Its-Application-in-Teaching-Doran-International-ECE.pdf",
      "https://dl.icdst.org/pdfs/files1/444fad619d2795beb2aad55aac4bd4eb.pdf",
      "https://cdforskning.no/cdf/catalog/view/130/647/4644"
    ],
    "observation_7": "I'm now moving into a critical phase of my research: synthesizing the relationship between children's cognitive developmental stages and various learning theories. I've already gathered foundational knowledge on Piaget's and Vygotsky's theories, as well as constructivism, meaningful learning, and game-based learning. My current focus is to explicitly connect these areas, understanding how a child's developmental stage impacts their engagement with and benefit from different learning approaches.",
    "plan_8": {
      "title": "Connecting Piaget and Constructivism\nCognitive Development and Game-Based Learning\nVygotsky's Practical Implications\nNext Steps: Attention Challenges and Modern Critiques",
      "description": "I will be specifically examining how Piaget's stages of cognitive development influence the application of constructivist learning. This involves understanding how the cognitive characteristics of each stage, such as egocentrism in the preoperational stage or concrete thinking in the concrete operational stage, affect a child's ability to actively construct knowledge. I'll be looking for insights into how constructivist methods need to be adapted to align with a child's developmental readiness.\nAnother key area of synthesis is the connection between cognitive development and game-based learning. I'll be investigating how aspects like attention and memory, which I've previously researched, influence a child's interaction with educational games. This will include exploring how game design can be tailored to different developmental levels to maximize learning outcomes.\nI'm also focusing on the practical implications of Vygotsky's sociocultural theory for instructional design. I will be looking into how concepts such as the Zone of Proximal Development (ZPD) and scaffolding can be effectively applied in educational settings to support learning across various developmental levels, emphasizing the role of social interaction and 'more knowledgeable others' in facilitating cognitive growth.\nAfter completing this synthesis, I will transition to the final components of my research. This includes exploring challenges related to children's attention and concentration in learning environments, and then investigating modern critiques and perspectives on the classical developmental theories of Piaget and Vygotsky. This structured approach ensures a comprehensive and nuanced understanding of the entire topic."
    },
    "search_8": [
      "https://www.simplypsychology.org/constructivism.html",
      "https://cornerstone.lib.mnsu.edu/cgi/viewcontent.cgi?article=1138&context=all",
      "https://www.frontiersin.org/journals/psychology/articles/10.3389/fpsyg.2023.1105806/full",
      "https://www.simplypsychology.org/vygotsky.html"
    ],
    "observation_8": "I've begun the crucial process of synthesizing the foundational theories of Piaget and Vygotsky with various learning approaches. My initial searches have provided a good starting point for understanding how these developmental stages might interact with learning theories like constructivism and game-based learning. I'm now looking to strengthen these connections with more specific examples and research.",
    "plan_9": {
      "title": "Addressing Information Gaps\nExpanding Research Scope\nNext Steps in Research",
      "description": "I've identified a need for more explicit links between Piaget's stages and the practical application of constructivism and game-based learning. My previous searches didn't provide enough detail on how these learning approaches are specifically tailored or effective at different cognitive developmental stages. I also need to explore how Vygotsky's Zone of Proximal Development (ZPD) can be applied across Piaget's stages.\nTo ensure a comprehensive understanding, I'm expanding my research to include challenges related to children's attention and concentration in learning environments. This will involve looking into common issues like distractibility and lack of focus, as well as evidence-based strategies to improve these aspects. Additionally, I will investigate modern critiques of Piaget's and Vygotsky's theories and explore more recent theories of cognitive development.\nMy immediate next steps involve conducting targeted searches to explicitly link Piaget's stages with constructivist and game-based learning applications, and to understand the application of Vygotsky's ZPD across these stages. Concurrently, I will begin researching common attention and concentration challenges in children and effective strategies to address them, and finally, explore modern perspectives and criticisms of the classical developmental theories."
    },
    "search_9": [
      "https://www.hilarispublisher.com/open-access/the-cognitive-development-of-children-from-piaget-to-modern-theories-103064.html#:~:text=Some%20of%20the%20modern%20theories,%2C%20environment%2C%20and%20individual%20experiences.",
      "https://www.bircu-journal.com/index.php/birci/article/view/1082",
      "https://eric.ed.gov/?id=EJ1274368",
      "https://teamgymshorts4.weebly.com/criticisms-of-piagetrsquos-theory.html",
      "https://www.researchgate.net/profile/Armando-Machado/publication/232556312_In_Defense_of_Piaget%27s_Theory_A_Reply_to_10_Common_Criticisms/links/09e41511a75a9d34c3000000/In-Defense-of-Piagets-Theory-A-Reply-to-10-Common-Criticisms.pdf",
      "https://www.psychologicalscience.org/observer/jean-piaget",
      "https://www.edutopia.org/discussion/7-ways-increase-students-attention-span",
      "https://education.nsw.gov.au/campaigns/inclusive-practice-hub/primary-school/common-needs/attention/evidence-based-strategies",
      "https://en.wikipedia.org/wiki/Zone_of_proximal_development",
      "https://www.pbs.org/parents/thrive/tips-for-helping-your-child-focus-and-concentrate",
      "https://www.reddit.com/r/ScienceBasedParenting/comments/12qqkqy/6_ways_to_improve_your_childs_focus_and",
      "https://www.gowriensw.com.au/thought-leadership/vygotsky-theory",
      "https://www.faithwest.org/5-strategies-to-improve-your-child-s-focus-and-attention-span",
      "https://thedecisionlab.com/reference-guide/neuroscience/zone-of-proximal-development",
      "https://www.simplypsychology.org/zone-of-proximal-development.html",
      "https://www.simplypsychology.org/vygotsky.html",
      "https://psychologywriting.com/piagets-vygotskys-and-scaffolding-theories",
      "https://www.expressable.com/learning-center/tips-and-resources/how-to-help-your-child-with-attention-problems",
      "https://www.nhsggc.org.uk/kids/resources/ot-activityinformation-sheets/attention-and-concentration",
      "https://childmind.org/article/not-all-attention-problems-are-adhd",
      "https://oxfordlearning.com/nine-reasons-kids-struggle-with-paying-attention-in-class",
      "https://www.nimh.nih.gov/health/topics/attention-deficit-hyperactivity-disorder-adhd",
      "https://www.communityplaythings.com/resources/articles/constructive-play",
      "http://fountainmagazine.com/2004/issue-48-october-december-2004/constructivism-in-piaget-and-vygotsky",
      "https://cornerstone.lib.mnsu.edu/cgi/viewcontent.cgi?article=1138&context=all",
      "https://www.nu.edu/blog/what-is-constructivism-in-education",
      "https://gsi.berkeley.edu/gsi-guide-contents/learning-theory-research/cognitive-constructivism",
      "https://www.people.wm.edu/~mxtsch/Teaching/JCPE/Volume1/JCPE_2008-01-09.pdf"
    ],
    "observation_9": "I've made significant progress in understanding Piaget's and Vygotsky's theories. For Piaget, I have detailed information on his four stages: sensorimotor, preoperational, concrete operational, and formal operational, including their age ranges and key cognitive characteristics like object permanence, symbolic thought, conservation, and hypothetical-deductive reasoning. For Vygotsky, I've solidified my understanding of his sociocultural theory, focusing on the Zone of Proximal Development (ZPD), the role of 'more knowledgeable others' (MKOs), scaffolding, and the critical importance of language and social interaction in cognitive development.",
    "plan_10": {
      "title": "Identifying Information Gaps for Synthesis\nRefining Attention Strategies and Modern Perspectives\nNext Steps for Comprehensive Coverage",
      "description": "While I have a strong grasp of the individual theories, I've identified a crucial information gap in explicitly linking Piaget's stages with the practical application of constructivism and game-based learning. I need to find concrete examples of how these learning theories are applied differently for children at various developmental stages. Similarly, I need to elaborate on how Vygotsky's ZPD is applied across these stages.\nFor attention and concentration, I have a list of common problems and general strategies, but I need to find more evidence-based strategies supported by research. Additionally, I have initial search results on modern perspectives and critiques of classical theories, but I need to browse these sources to extract specific criticisms of Piaget and Vygotsky and to identify and understand contemporary theories of cognitive development.\nMy next steps involve a targeted approach to fill these identified gaps. I will conduct focused browsing of existing URLs to find practical classroom applications of constructivism across Piaget's stages and to identify evidence-based attention strategies. I will also browse sources to detail criticisms of Piaget and Vygotsky and to gain an initial understanding of modern theories like the Dynamic Systems Theory, with a plan for follow-up searches if needed. This will ensure a comprehensive and nuanced understanding of the entire topic."
    },
    "search_10": [
      "https://eric.ed.gov/?id=EJ1274368",
      "https://www.hilarispublisher.com/open-access/the-cognitive-development-of-children-from-piaget-to-modern-theories-103064.html",
      "https://www.edutopia.org/discussion/7-ways-increase-students-attention-span",
      "https://www.bircu-journal.com/index.php/birci/article/view/1082",
      "https://www.communityplaythings.com/resources/articles/constructive-play"
    ],
    "observation_10": "I've further solidified my understanding of Piaget's four stages of cognitive development (sensorimotor, preoperational, concrete operational, and formal operational), including their associated age ranges and key cognitive characteristics like object permanence, symbolic thought, conservation, and hypothetical-deductive reasoning. Similarly, I've reinforced my knowledge of Vygotsky's sociocultural theory, focusing on the Zone of Proximal Development (ZPD), the role of 'more knowledgeable others' (MKOs), scaffolding, and the critical importance of language and social interaction in cognitive development.",
    "plan_11": {
      "title": "Addressing Remaining Information Gaps\nNext Steps for Comprehensive Synthesis",
      "description": "While I have a strong foundation, I've identified specific areas that require further detail to ensure a comprehensive report. I need to strengthen the explicit connection between Piaget's stages and the practical application of learning theories, particularly constructivism and game-based learning. This involves finding concrete examples of how these learning approaches are tailored for children at different developmental stages. Additionally, I need to gather more specific, evidence-based strategies for improving attention and concentration, and to further elaborate on modern theories of cognitive development beyond the classical perspectives.\nMy next steps involve a final round of targeted research to fill these remaining gaps. I will conduct specific searches for 'constructivist activities' and 'game-based learning' tailored to Piaget's preoperational and concrete operational stages. I will also browse existing sources to identify research-backed strategies for improving attention. Finally, I will conduct deeper dives into modern theories such as Dynamic Systems Theory, Social Cognitive Theory, and Neo-Piagetian theories to understand their core concepts and how they build upon or diverge from Piaget and Vygotsky. This focused effort will allow me to complete a comprehensive synthesis of the topic."
    },
    "search_11": [
      "https://en.wikipedia.org/wiki/Neo-Piagetian_theories_of_cognitive_development",
      "https://www.gowriensw.com.au/thought-leadership/piaget-theory",
      "https://foundations.ed.brocku.ca/winter_term/week14/9",
      "https://www.atlantis-press.com/article/126012468.pdf",
      "https://courses.lumenlearning.com/adolescent/chapter/psychological-constructivism-piagets-theories",
      "https://www.aph.org/blog/learning-through-games-at-home",
      "https://gsi.berkeley.edu/gsi-guide-contents/learning-theory-research/cognitive-constructivism",
      "https://en.wikipedia.org/wiki/Piaget%27s_theory_of_cognitive_development",
      "https://www.jackrabbitcare.com/blog/educational-activities-to-accelerate-early-learning",
      "https://www.simplypsychology.org/preoperational.html",
      "http://fountainmagazine.com/2004/issue-48-october-december-2004/constructivism-in-piaget-and-vygotsky",
      "https://library.fiveable.me/classroom-management/unit-2/cognitive-constructivist-theories/study-guide/ifrnX5My7NOAJX4u",
      "https://cornerstone.lib.mnsu.edu/cgi/viewcontent.cgi?article=1003&context=isalt_resources",
      "https://en.wikipedia.org/wiki/Social_cognitive_theory",
      "https://www.healthline.com/health/childrens-health/concrete-operational-stage",
      "https://pmc.ncbi.nlm.nih.gov/articles/PMC10442055",
      "https://www.med.upenn.edu/hbhe4/part3-ch8-key-constructs.shtml",
      "https://www.frontiersin.org/journals/education/articles/10.3389/feduc.2018.00038/full",
      "https://www.simplypsychology.org/piaget.html",
      "https://www.myteachingcupboard.com/blog/developmental-stages-of-play-piaget",
      "https://library.fiveable.me/key-terms/developmental-psychology/dynamic-systems-theory#:~:text=Dynamic%20Systems%20Theory%20implies%20a,explore%20their%20surroundings%20more%20effectively.",
      "https://library.fiveable.me/key-terms/developmental-psychology/dynamic-systems-theory",
      "https://research.rug.nl/files/250864506/A_dynamic_systems_model_of_basic_developmental_mechanisms.pdf",
      "https://ottheory.com/therapy-model/dynamic-systems-theory-model-visual-perception-development",
      "https://www.researchgate.net/publication/391138275_The_Impact_of_Game-Based_Learning_Science_for_Kids_on_the_Development_of_Logical_Thinking_in_Children_Aged_5-6_Years",
      "https://lchc.ucsd.edu/MCA/Mail/xmcamail.2011_04.dir/pdfmkn1hFH60m.pdf",
      "https://www.verywellmind.com/concrete-operational-stage-of-cognitive-development-2795458",
      "https://brill.com/display/book/9789087903817/BP000005.pdf",
      "https://media.lanecc.edu/users/kime/Ch9Piaget.pdf",
      "https://playlearnthrive.com/stages-of-play-jean-piagets-theory",
      "https://www.earlyyears.tv/piagets-cognitive-stages-game",
      "https://www.frontiersin.org/journals/education/articles/10.3389/feduc.2024.1337716/full",
      "https://www.pbs.org/parents/thrive/tips-for-helping-your-child-focus-and-concentrate",
      "https://www.faithwest.org/5-strategies-to-improve-your-child-s-focus-and-attention-span"
    ],
    "observation_11": "I have now gathered a comprehensive set of information covering all the key areas of the research request. This includes detailed notes on Piaget's and Vygotsky's theories, their comparison, the development of attention and memory, and various learning theories such as constructivism, meaningful learning, and game-based learning. I have also explored the relationship between developmental stages and these learning theories, investigated challenges to attention and concentration, and researched modern perspectives and critiques of the classical theories.",
    "plan_12": {
      "title": "Information Saturation and Synthesis Readiness\nNext Steps: Report Generation",
      "description": "I have reached a point of saturation where further searching is unlikely to yield significantly new information that would alter the core of the report. The information I have is detailed and drawn from a variety of sources, including academic articles, educational websites, and psychological resources. I am confident that I have sufficient information to synthesize a comprehensive and well-structured report.\nMy next action is to synthesize all the gathered information into a comprehensive report. This will involve structuring the content logically, integrating the various concepts and theories, and presenting a cohesive overview of children's cognitive development and learning."
    }
  },
  "final_report": "# **The Architecture of the Developing Mind: A Synthesis of Cognitive Development and Learning Science**\n\n## **Part I: Foundational Theories of Cognitive Development**\n\nThe study of how a child's mind grows and learns is dominated by two towering figures whose theories, though often contrasted, collectively provide the foundational bedrock for modern developmental psychology and educational practice. Jean Piaget and Lev Vygotsky offered powerful, yet divergent, paradigms for understanding the intricate process of cognitive development. Piaget envisioned the child as a \"lone scientist,\" actively constructing a model of the world through independent exploration and internal equilibration. Vygotsky, in contrast, saw the child as a \"social apprentice,\" whose cognitive abilities are forged through collaborative interaction and the internalization of cultural tools. This section will delve deeply into these two foundational theories, examining their core tenets, developmental frameworks, and critical evaluations, before culminating in a comparative analysis that illuminates their fundamental differences and surprising points of convergence.\n\n### **Chapter 1: Piaget's Theory of Cognitive Construction: The Child as a Lone Scientist**\n\nJean Piaget, a Swiss psychologist, revolutionized the field of developmental psychology by proposing that children are not merely miniature adults who think less efficiently; rather, they think in qualitatively different ways.1 His theory posits that children are active constructors of their own knowledge, building their understanding of the world through direct interaction with their environment.1 This perspective, known as cognitive constructivism, casts the child in the role of a \"lone scientist\" who formulates and tests theories about the world through exploration and discovery.4\n\n#### **Mechanisms of Development**\n\nAt the heart of Piaget's theory lie four core concepts that explain the mechanisms of cognitive change. These processes work in concert to drive the child from one developmental stage to the next, propelled by an innate desire to make sense of the world.\n\n* **Schemas:** Piaget proposed that individuals organize information and experiences into mental frameworks he called schemas.2 These are systems of knowledge that act as cognitive blueprints for understanding and interacting with the world.7 A young child, for instance, develops a schema for \"dog\" that might include features like four legs, fur, a tail, and a bark. These schemas are not static; they are constantly being modified and refined through experience.\n* **Assimilation:** This is the process of integrating new information or experiences into pre-existing schemas.3 When a child encounters a new object or event, they first try to understand it by fitting it into what they already know.1 For example, a child with a schema for \"bird\" might see a butterfly and, noting that it flies, initially label it a bird, thus assimilating the new creature into their existing category.8\n* **Accommodation:** When new information cannot be neatly assimilated into an existing schema, accommodation occurs. This involves modifying an existing schema or creating an entirely new one to fit the new information.1 In the previous example, when the child learns that butterflies have different wings and do not chirp, they must accommodate this new information by altering their \"bird\" schema and creating a new \"butterfly\" schema. This process of accommodation is what allows for genuine cognitive growth.8\n* **Equilibration:** Piaget saw equilibration as the primary force driving cognitive development.1 It is the process of seeking a stable balance, or equilibrium, between one's cognitive structures and the information from the environment. When a child encounters information that contradicts their existing schemas (a state of\n  *disequilibrium*), they are motivated to resolve this conflict through assimilation and accommodation, ultimately reaching a new, more sophisticated state of equilibrium.11 This cycle—equilibrium, disequilibrium, and the return to a more advanced equilibrium—is a self-regulating feedback loop that propels learning forward. The limitations of one stage of thought create the very disequilibrium that, when resolved, leads to the qualitatively different thinking of the next stage. Thus, the \"flaws\" in a child's thinking at any given stage are not merely errors but are essential catalysts for their own development.\n\n#### **The Four Stages of Cognitive Development**\n\nPiaget proposed a \"staircase\" model of development, comprising four universal, sequential stages. Each stage is characterized by a distinct and qualitatively different way of thinking, with each new stage building upon the achievements of the last.3\n\n##### **1. Sensorimotor Stage (Birth to ~2 years)**\n\nDuring this initial stage, infants \"think\" and learn about the world primarily through their senses and motor actions.9 Knowledge is constructed through physical interaction—touching, looking, listening, and manipulating objects—without the significant support of language.13\n\nDevelopment within this stage progresses through six distinct substages, moving from innate reflexes like sucking and grasping to more intentional, goal-directed behaviors.1 The crowning achievement of the sensorimotor stage is the development of\n\n**object permanence**. This is the understanding that objects and people continue to exist even when they are not in sight.13 A younger infant might lose interest in a toy once it is hidden under a blanket, as if it has ceased to exist. An older infant, however, will actively search for the hidden toy, demonstrating a stable mental representation of the object.9\n\n##### **2. Preoperational Stage (~2 to ~7 years)**\n\nThis stage is defined by the emergence of the **semiotic function**, which is the ability to use symbols to represent objects and events.9 Language, mental images, and symbolic play become central tools for thought.14 A key behavior of this stage is dramatic or pretend play, where a child might use a banana as a telephone or a block as a car.9 This type of play is an early form of metacognition, as it requires the child to operate on two levels of thought simultaneously—the realistic (this is a banana) and the imaginative (this is a telephone).13\n\nDespite these advances, thinking in the preoperational stage is intuitive rather than logical.2 It is characterized by two significant limitations:\n\n* **Egocentrism:** The child is unable to take the perspective of another person. They assume that others see, think, and feel exactly as they do.1\n* **Centration:** The child tends to focus on only one aspect of a situation at a time, ignoring other relevant features.14 This leads to the inability to understand\n  **conservation**—the principle that the quantity of a substance remains the same despite changes in its appearance. For example, a preoperational child will often insist that a tall, thin glass holds more water than a short, wide glass, even after seeing the water poured from one to the other, because they are centrating on the height of the water level.15\n\n##### **3. Concrete Operational Stage (~7 to ~11 years)**\n\nThe concrete operational stage marks the beginning of logical, organized thought.9 However, this logical reasoning is limited to concrete, physical objects and events that the child can directly perceive or manipulate.17 Egocentrism significantly declines as children become better at understanding others' perspectives.9\n\nThe key cognitive achievement of this stage is the mastery of **conservation**. This is made possible by the development of several new mental abilities:\n\n* **Decentration:** The ability to consider multiple aspects of a situation simultaneously (e.g., both the height and width of a glass).9\n* **Reversibility:** The understanding that actions can be mentally reversed (e.g., knowing that the water can be poured back into the original glass).9\n\nChildren in this stage also develop more sophisticated skills in **classification** (the ability to group objects into hierarchies of classes and subclasses) and **seriation** (the ability to order items along a quantitative dimension, such as length or weight).1\n\n##### **4. Formal Operational Stage (~11 years to Adulthood)**\n\nThis is the final stage in Piaget's theory, characterized by the ability to think abstractly, systematically, and hypothetically.9 Thought is no longer tied to concrete reality.\n\nAdolescents in this stage develop **hypothetical-deductive reasoning**, the ability to think like a scientist. They can generate hypotheses about a problem, deduce testable consequences, and systematically isolate variables to confirm or disconfirm their hypotheses.9 They can also engage in propositional thought and reason about abstract concepts such as justice, morality, freedom, and probability.2\n\n**Table 1: Piaget's Four Stages of Cognitive Development**\n\n| Stage Name | Approximate Age Range | Core Characteristics & Abilities | Key Limitations | Example Task |\n| --- | --- | --- | --- | --- |\n| **Sensorimotor** | Birth – 2 years | Learns through senses and motor actions. Develops object permanence. Moves from reflexive to goal-directed actions. 9 | Thinking is limited to the here and now; no symbolic thought. | Hiding a toy under a blanket. The child with object permanence will search for it. 13 |\n| **Preoperational** | 2 – 7 years | Uses symbolic thought, language, and pretend play. Thinking is intuitive. 9 | Egocentric (cannot take others' perspectives). Centration leads to a lack of conservation. 1 | The conservation of liquid task. The child believes a tall, thin glass holds more water than a short, wide one. 15 |\n| **Concrete Operational** | 7 – 11 years | Can think logically about concrete events. Masters conservation, reversibility, classification, and seriation. 1 | Cannot think abstractly or hypothetically. Logic is tied to physical reality. 16 | Understanding that squishing a ball of clay into a \"hot dog\" shape does not change the amount of clay. 15 |\n| **Formal Operational** | 11 years – Adulthood | Can think abstractly and hypothetically. Uses hypothetical-deductive reasoning to solve problems systematically. 9 | Lingering egocentrism in adolescence. Not all individuals consistently use formal operational thought across all domains. 19 | Solving a pendulum problem by systematically testing variables (length, weight, force) to determine what affects the swing speed. 9 |\n\n#### **Critical Evaluation of Piaget's Theory**\n\nWhile Piaget's theory remains profoundly influential, it has been subject to significant criticism over the decades, leading to a more nuanced understanding of its strengths and weaknesses.\n\n* **Underestimation and Overestimation of Abilities:** A frequent criticism is that Piaget's tasks often led to an underestimation of children's abilities, particularly in infancy and early childhood.21 By changing the methodology—for example, by measuring surprise or looking time instead of active search—researchers have found evidence of object permanence in infants as young as 3-4 months, much earlier than Piaget claimed.23 Conversely, his theory tends to overestimate the abilities of adolescents and adults, as many people do not consistently apply formal operational thought across all situations or domains of knowledge.20\n* **The Stage Concept:** The idea of discrete, universal, and monolithic stages has been challenged. Research suggests that cognitive development is often more continuous and domain-specific than Piaget's \"staircase\" model implies.20 A child might display concrete operational thinking in mathematics but preoperational thinking in social reasoning, a variability that the stage model struggles to explain.18\n* **Neglect of Sociocultural Factors:** Perhaps the most significant limitation is the theory's relative neglect of social and cultural influences on development.6 Piaget focused on the child's independent interactions with the physical world, largely downplaying the critical roles of instruction, social interaction, and cultural context in shaping how a child thinks.21 His model implies a universal developmental path, which contradicts evidence of cultural variations in cognitive development.\n* **Methodological Issues:** Piaget's research methods have also been scrutinized. He often based his conclusions on observations of a small, unrepresentative sample, including his own three children. His reporting lacked the statistical rigor and control groups expected in modern research, raising questions about observer bias and the generalizability of his findings.20\n\n### **Chapter 2: Vygotsky's Sociocultural Theory: The Child as a Social Apprentice**\n\nIn stark contrast to Piaget's vision of the child as a lone scientist, Russian psychologist Lev Vygotsky proposed a sociocultural theory of development. He argued that cognitive development is not an isolated journey but an innately collaborative and socially mediated process.24 For Vygotsky, the child is a social apprentice who learns through guided participation with more knowledgeable members of their culture.26\n\n#### **Core Tenets**\n\nVygotsky's theory is built on the foundational idea that the mind is socially constructed. Learning is not something that happens *inside* the child and then moves outward; rather, it begins in the social world and is gradually internalized.\n\n* **Social Origins of Cognition:** Vygotsky famously asserted, \"Every function in the child's cultural development appears twice: first, on the social level, and later, on the individual level; first, between people (interpsychological) and then inside the child (intrapsychological)\".4 This means that all higher mental functions, such as reasoning and problem-solving, originate as actual relationships between individuals. Social learning, therefore, precedes and enables individual development.28\n* **The Role of Culture:** Culture is not merely a backdrop for development; it is a primary force that shapes it. Vygotsky believed that culture provides the **tools of intellectual adaptation**, such as language, counting systems, mnemonic devices, art, and writing.25 These tools do not just help children learn; they fundamentally transform\n  *how* children think. Because these cultural tools vary from one society to another, Vygotsky's theory leads to the expectation of variable cognitive development across cultures, rather than the universal stages proposed by Piaget.4\n\n#### **Key Vygotskian Concepts**\n\nVygotsky's framework provides a set of powerful concepts for understanding how social interaction drives learning. These concepts form the basis for a theory of instructional design, explaining not just how development happens, but how it can be actively fostered.\n\n* **The More Knowledgeable Other (MKO):** The MKO is any individual who possesses a higher level of skill or greater understanding than the learner with respect to a particular task or concept.25 This is most often a teacher, parent, or older caregiver, but it can also be a peer, a younger person with specific expertise, or even a non-human resource like a computer program or a book.25 The MKO is the essential guide who helps the learner navigate new cognitive territory.\n* **The Zone of Proximal Development (ZPD):** The ZPD is the cornerstone of Vygotsky's educational theory. He defined it as \"the distance between the actual developmental level as determined by independent problem solving and the level of potential development as determined through problem-solving under adult guidance or in collaboration with more capable peers\".4 It represents the dynamic space of learning potential—the set of skills and concepts that a child cannot yet master on their own but can achieve with assistance.25 This is the \"sweet spot\" for instruction, where learning is most effective because it is challenging yet achievable.31 The ZPD is not a static property of the child but a dynamic space created\n  *in the interaction* between the learner, the MKO, and the task. Its effectiveness depends on the quality of that interaction and the MKO's ability to provide appropriate support.\n* **Scaffolding:** If the ZPD is the \"where\" of learning, scaffolding is the \"how.\" Introduced by later theorists but perfectly aligned with Vygotsky's ideas, scaffolding refers to the process of providing temporary, tailored support to a learner to help them successfully complete a task within their ZPD.4 The MKO provides just enough assistance—through modeling, giving hints, asking leading questions, or simplifying the task—to allow the learner to succeed.26 As the learner's competence grows, this support is gradually faded and withdrawn, transferring responsibility for the task to the learner.26\n* **Language and Thought:** For Vygotsky, language is the most important cultural tool, the \"tool of tools,\" that mediates nearly all higher cognitive functions.27 He proposed a different relationship between language and thought than Piaget.\n  + Vygotsky believed that language and thought begin as separate, independent systems. In the first couple of years, thought is non-verbal (sensorimotor) and language is pre-intellectual (used for simple communication).4\n  + Around the age of three, these two systems converge, and \"thought becomes verbal and speech becomes rational\".4 This merger creates a new, powerful form of verbal thought and revolutionizes the child's cognitive abilities.\n  + This development is observable through three forms of speech:\n    1. **Social Speech:** From around age two, speech is primarily external and used for communicating with others.4\n    2. **Private Speech:** From around age three, children begin to direct speech to themselves, talking themselves through problems or guiding their own actions. This \"thinking out loud\" is a critical tool for self-regulation and planning.4 It is the internalization of the social dialogue the child has with others; the guidance they once received from an MKO, they now provide to themselves.\n    3. **Inner Speech:** As the child matures (around age seven), private speech goes \"underground,\" becoming silent inner speech.4 This internalized dialogue forms the basis of our internal thought processes and conscious reasoning.4\n\nVygotsky's framework is fundamentally a theory of instruction. Unlike Piaget, who was cautious about accelerating development, Vygotsky argued that good learning *leads* development, pulling the child forward through the ZPD.4 The entire conceptual apparatus of MKO, ZPD, and scaffolding is not just a description of how learning happens, but a direct blueprint for how to design effective teaching and create optimal learning environments.25\n\n### **Chapter 3: A Comparative Analysis: Piaget vs. Vygotsky - Two Visions of Development**\n\nComparing the theories of Jean Piaget and Lev Vygotsky reveals a fundamental divergence in how the process of cognitive development is conceptualized. While both were pioneers and are considered constructivists for their shared belief that children actively build knowledge, their core assumptions about the engine of that construction—the individual versus the social collective—set them on starkly different theoretical paths.2\n\n#### **Core Philosophical Divide**\n\nThe central debate between Piaget and Vygotsky revolves around the primary locus of development.\n\n* **Piaget's Cognitive Constructivism:** Piaget's theory is oriented toward autonomy, emphasizing the individual child's independent construction of knowledge through direct interaction with the physical world.4 The environment provides the raw material, but the cognitive restructuring is an internal process driven by equilibration.4\n* **Vygotsky's Social Constructivism:** Vygotsky's theory is oriented toward heteronomy, focusing on the child's dependence on social and cultural factors for cognitive development.4 Knowledge is co-constructed in social interaction and then internalized. The individual's mind is a product of society and culture.6\n\nThis philosophical split manifests in their views on several key dimensions of development.\n\n#### **Direct Comparison on Key Dimensions**\n\n* **Role of Language:**\n  + **Piaget:** For Piaget, thought precedes language. Language is a tool used to represent and express thoughts that have already been formed through action and sensorimotor exploration.4 A child's linguistic ability is seen as a reflection of their current cognitive stage. He viewed\n    **egocentric speech** as a symptom of the preoperational child's inability to take another's perspective, a cognitive limitation that simply fades away as the child matures and becomes less egocentric.21\n  + **Vygotsky:** For Vygotsky, language is the central tool that shapes and drives cognitive development.25 After language and thought merge, language becomes the primary mechanism for reasoning, planning, and self-regulation. He saw\n    **private speech** not as a sign of immaturity, but as a vital cognitive tool—a transition from external, social dialogue to internal, silent thought.4\n* **Role of Social Interaction:**\n  + **Piaget:** While not ignoring social interaction, Piaget placed primary emphasis on the child's interaction with the physical environment. He saw interaction with *peers* as particularly valuable because it creates cognitive conflict. When peers disagree, it forces a child to confront other viewpoints, which creates the disequilibrium necessary to overcome egocentrism.4\n  + **Vygotsky:** Social interaction is the very *origin* of higher cognitive functions.24 He placed a much stronger emphasis on interactions with\n    *more capable others*—adults or advanced peers (MKOs)—who provide crucial guidance and scaffolding within the ZPD.4\n* **Mechanism and Course of Development:**\n  + **Piaget:** Development proceeds through a universal, biologically-driven sequence of four distinct, qualitative stages.6 This progression is propelled by the internal, individual process of equilibration. In this view, development must precede learning; a child cannot be taught a concept until they have reached the appropriate developmental stage of readiness.4\n  + **Vygotsky:** Development is a continuous process, not divided into rigid stages, and its path is heavily influenced by the specific cultural tools and social interactions the child experiences.4 He famously argued that learning\n    *leads* development. Well-designed instruction that targets the ZPD pulls the child forward and awakens new developmental processes.4\n\n#### **Similarities and Points of Convergence**\n\nDespite their profound differences, the two theories are not entirely without common ground.\n\n* Both Piaget and Vygotsky are fundamentally **constructivists**. They rejected the behaviorist notion of the child as a passive recipient of information and agreed that children are active agents who construct their own understanding of the world.2\n* Both recognized the importance of **play** in a child's development, viewing it as a critical context for learning and cognitive growth.13\n* Both acknowledged the existence and importance of a child's self-directed speech, although, as noted, they offered vastly different interpretations of its function and developmental fate.21\n\nThe tension between these two theories can be seen as reflecting a larger philosophical debate in education: the value of independent discovery learning (Piaget) versus guided learning (Vygotsky).4 A Piagetian classroom would prioritize creating a rich environment full of materials for children to explore on their own. A Vygotskian classroom would prioritize collaborative activities and strategic interventions from the teacher to guide students through challenging tasks. However, it is also possible to view the theories as complementary rather than mutually exclusive. One might argue that Piaget described the universal, maturational \"hardware\" of cognitive development, while Vygotsky described how cultural and social \"software\" (like language and instructional strategies) is installed and runs on that hardware.6 An effective educational approach likely requires both: creating opportunities for autonomous discovery while also providing the expert social guidance needed to make that discovery efficient and meaningful.\n\n**Table 2: Comparative Framework of Piagetian and Vygotskian Theory**\n\n| Key Dimension | Piaget's Cognitive Constructivism | Vygotsky's Social Constructivism |\n| --- | --- | --- |\n| **Locus of Development** | Individual. The child as a \"lone scientist.\" 4 | Social. The child as a \"social apprentice.\" 24 |\n| **Key Mechanism** | Equilibration (assimilation, accommodation) driven by cognitive conflict. 1 | Internalization of social interactions and cultural tools via the ZPD. 27 |\n| **View on Stages** | Strong emphasis on universal, sequential, and distinct stages of development. 6 | No formal stages; development is continuous and culturally variable. 4 |\n| **Relationship Between Learning & Development** | Development precedes learning. Learning is limited by the current developmental stage. 4 | Learning leads development. Instruction within the ZPD pulls development forward. 4 |\n| **Role of Language** | Thought precedes language. Language is a tool to express existing thought. Egocentric speech is a sign of immaturity. 4 | Language and thought merge to create verbal thought. Language is the central tool that shapes cognition. Private speech is a vital tool for self-regulation. 4 |\n| **Role of Social Interaction** | Peer interaction is important for creating cognitive conflict and reducing egocentrism. 4 | Social interaction, especially with a More Knowledgeable Other (MKO), is the origin of higher cognitive functions. 4 |\n| **Educational Implication** | Emphasizes discovery learning and providing a rich environment for individual exploration. 2 | Emphasizes guided learning, scaffolding, collaborative work, and apprenticeship. 25 |\n\n## **Part II: Core Cognitive Processes in Learning**\n\nMoving from the grand architectural theories of Piaget and Vygotsky, this section examines the fundamental mental machinery that makes learning possible. Attention acts as the gateway to the mind, determining which information is selected for processing. Memory serves as the system for storing and retrieving that information. Understanding the development, limitations, and enhancement of these core cognitive processes is essential for designing effective learning experiences.\n\n### **Chapter 4: The Development of Attention and Concentration**\n\nAttention is not a single entity but a multifaceted system of cognitive processes that allow us to select information from the environment, maintain focus over time, and manage our mental resources. It is the foundational skill upon which all higher-order thinking, learning, and problem-solving are built. Without the ability to attend, information cannot be effectively processed by working memory or encoded for later recall.38\n\n#### **The Architecture of Attention**\n\nThe attentional system is commonly understood to comprise several key components:\n\n* **Sustained Attention (Vigilance):** This is the ability to maintain a consistent focus on a particular task over an extended period, especially when the task is repetitive or uninteresting.40 It is the mental stamina required for completing homework, listening to a story, or working through a long problem.\n* **Selective Attention:** This is the crucial ability to focus on task-relevant information while actively filtering out and ignoring irrelevant distractions.38 In a busy classroom, selective attention allows a student to listen to the teacher's voice while tuning out the sounds of a classmate tapping a pencil or activity in the hallway.\n* **Executive Control of Attention:** Often considered a core component of executive function, this refers to the higher-level, voluntary control over attention. It includes the ability to flexibly shift focus from one task to another, inhibit prepotent but incorrect responses, and strategically allocate attentional resources according to one's goals.38\n\nThe development of attention can be understood as a progressive shift from being stimulus-driven (exogenous control) to being goal-driven (endogenous control). An infant's attention is largely captured by salient external events like a bright light or a loud noise.38 Through the maturation of the brain's prefrontal cortex, the child gradually develops the ability to direct their attention purposefully, inhibit distractions, and stay on task, becoming a more proactive, self-regulated learner.38\n\n#### **Developmental Trajectory of Attention**\n\nThe capacity for attention develops rapidly throughout childhood and adolescence.\n\n* **Infancy (0-2 years):** Development begins with reflexive **orienting**, where newborns automatically turn toward new stimuli.38 By three months,\n  **sustained attention** begins to emerge, allowing infants to gaze at objects for longer periods. A critical milestone in this period is **joint attention**, the shared focus of two individuals on an object, typically initiated by one person pointing or gazing. This ability is fundamental for social learning and language acquisition.38\n* **Early Childhood (2-7 years):** The ability to exert control over attention improves markedly. Children become better at **selective attention**, learning to ignore distracting information, though this skill is still developing and fragile.42\n* **Middle Childhood & Adolescence (7+ years):** Research indicates a rapid development in sustained attention between the ages of 8 and 10, after which performance tends to plateau with more gradual improvements.41 Selective attention also becomes significantly more efficient. Studies using incidental learning tasks—where children must focus on a central task while ignoring irrelevant details—show that as children approach adolescence, they become progressively better at allocating their attention to task-relevant information at the expense of processing extraneous cues.42\n\n#### **Common Challenges to Attention and Concentration**\n\nDifficulties with attention are common in children and can stem from a wide range of sources. It is critical to recognize that what appears as \"not paying attention\" can be a symptom of various underlying issues.\n\n* **Neurodevelopmental Conditions:** Attention-Deficit/Hyperactivity Disorder (ADHD) is a primary cause, characterized by a persistent pattern of inattention, hyperactivity, and/or impulsivity that interferes with functioning and development.45\n* **Psychological and Emotional Factors:** High levels of anxiety, Obsessive-Compulsive Disorder (OCD), or stress resulting from trauma can consume a child's cognitive resources, making it difficult to concentrate on external tasks. A child may appear distracted because they are preoccupied with internal worries or intrusive thoughts.47\n* **Undiagnosed Learning Disorders:** A child who struggles with an undiagnosed learning disorder, such as dyslexia or an auditory processing disorder, may appear inattentive because they are unable to keep up with the academic work. Their distraction or fidgeting can be a sign of frustration, embarrassment, or cognitive overload rather than a primary attention problem.47\n* **Environmental and Lifestyle Factors:** A child's ability to concentrate is significantly impacted by their environment and physical state. Factors such as insufficient sleep, poor nutrition, a disorganized or cluttered workspace, and excessive background noise or visual distractions can all impair focus.45\n* **Task-Appropriateness and Motivation:** A frequent cause of inattention is a mismatch between the task and the child's abilities or interests. A task that is too difficult and outside the child's ZPD can lead to frustration and avoidance, while a task that is too easy can lead to boredom and disengagement.48 A lack of motivation or personal interest in the subject matter can also result in a child struggling to pay attention.48 This highlights a crucial connection: an educator's first response to inattention should be a critical evaluation of the task itself.\n\n#### **Evidence-Based Strategies for Enhancing Attention**\n\nA multi-pronged approach involving environmental adjustments, task modification, and explicit skill-building can effectively support and improve a child's attention and concentration.\n\n* **Environmental Modification:** Creating an optimal learning environment is a crucial first step. This includes minimizing potential distractions by seating a child away from windows or busy areas, reducing visual clutter on walls and desks, and using headphones or earplugs to dampen noise.49\n* **Task Management and Structure:**\n  + **Chunking:** Break large, overwhelming assignments into smaller, more manageable steps.50\n  + **Time Adjustment:** Adjust work periods to match the child's developmental capacity for sustained focus, which is roughly two to five minutes per year of their age.51 Use timers to structure these work intervals.\n  + **Activity Sequencing:** Alternate between high-interest and low-interest activities, or between tasks requiring high concentration and those that are less demanding, to maintain engagement.52\n* **Incorporating Movement:** Regular physical activity is vital. Schedule short \"brain breaks\" for stretching, jumping jacks, or bouncing on an exercise ball to help children reset their focus and release excess energy.49\n* **Building Metacognitive Awareness:** Explicitly teach children what \"paying attention\" looks and feels like. Use visual cues (like a colored card on their desk) or periodic, timed \"attention checks\" to help them monitor their own focus and build self-awareness.45\n* **Mindfulness and Calming Techniques:** Practices like deep belly breathing can help children manage the anxiety that often accompanies challenging tasks, calming their physiological state and clearing their minds for better concentration.53\n* **Using Games:** Attention and focus can be practiced and strengthened through engaging games. Simple games like \"Simon Says,\" \"Red Light, Green Light,\" \"I Spy,\" and memory matching games all require and build skills in listening, observation, and concentration in a fun, low-stakes context.40\n\n### **Chapter 5: The Architecture of Memory in Children**\n\nMemory is the cognitive process responsible for encoding, storing, and retrieving information. It is inextricably linked to learning; without memory, no learning could be retained. The system is not a single entity but is typically modeled as having distinct components, with working memory acting as a crucial bottleneck between the external world and the vast repository of long-term knowledge.\n\n#### **The Components of Memory**\n\n* **Working Memory:** Often described as the brain's \"mental workspace\" or \"post-it note,\" working memory is a system with a limited capacity for temporarily holding and actively manipulating information.39 It is what we use to follow multi-step directions, solve mental math problems, or comprehend a sentence by holding the beginning in mind while processing the end.55 Because its capacity is finite, if a task presents too much information at once (cognitive overload), learning breaks down.39 This makes working memory the critical bottleneck between teaching and learning; information must be successfully processed here before it can be stored permanently.\n* **Long-Term Memory:** This is the vast and relatively permanent storage system for our knowledge and skills.39 The ultimate goal of most educational endeavors is to facilitate the encoding of information from the transient working memory into the durable structure of long-term memory.57\n\n#### **Development of Memory**\n\nThe dramatic improvement in children's memory performance with age has been a central topic of research, with two primary explanations proposed for this growth.\n\n* **The Neo-Piagetian (Capacity-Based) View:** This perspective, advanced by theorists like Juan Pascual-Leone, argues that cognitive development is driven by a fundamental increase in working memory capacity.57 According to this view, a young child's inability to solve certain problems is due to an insufficient mental \"space\" to hold all the necessary pieces of information in mind at once. For example, understanding a ratio like\n  4/6=6/9 requires concurrently processing four elements, a task that exceeds the capacity of a younger child.57 As maturational processes increase working memory capacity, the child becomes capable of grasping more complex concepts.58\n* **The Knowledge-Based View:** This perspective argues that memory improvement is less about a change in raw capacity and more about the growth of the child's knowledge base.57 As children learn more about the world, they can organize information more efficiently into larger \"chunks.\" A classic study showed that child chess experts could remember chessboard configurations better than novice adults. This was not because the children had larger working memories, but because their expertise allowed them to see meaningful patterns and chunks of pieces, effectively reducing the number of individual items they needed to remember.57\n\nThese two views are not mutually exclusive. They likely operate in a reciprocal feedback loop: an expanding knowledge base allows for more effective chunking, which increases the functional efficiency of working memory. In turn, a more efficient working memory allows the child to process more complex information, leading to faster acquisition of new knowledge.\n\n#### **Strategies for Supporting Memory**\n\nEffective memory support involves a two-pronged approach: first, managing the load on the limited working memory, and second, using strategies to promote robust encoding into long-term memory. These strategies are not about passive absorption; they are all forms of active knowledge construction, aligning directly with the principles of constructivism. They require the learner to actively manipulate, organize, and connect with the information.\n\n##### **Managing Working Memory Load**\n\n* **Chunking:** Break down complex information or multi-step instructions into smaller, more digestible parts. This prevents cognitive overload by presenting information in units that fit within the capacity of working memory.39\n* **Scaffolding and Visual Aids:** Use external aids like diagrams, pictures, checklists, and written instructions to offload information from working memory. This frees up cognitive resources for deeper processing.39\n* **Repetition and Simplification:** Use short, simple phrases for instructions and have the child repeat them back. This ensures the information has been successfully captured in working memory before they begin a task.60\n\n##### **Encoding into Long-Term Memory**\n\n* **Elaborative Learning:** Encourage deep processing by prompting children to think about the meaning of new information. This can be done by asking questions, encouraging discussion, and explicitly linking new concepts to the child's prior knowledge and experiences.39\n* **Multisensory Learning:** Engage multiple senses to create richer, more resilient memory traces. For example, a child can learn spelling words by not only seeing them but also tracing them in sand (touch), saying them aloud (hearing), and writing them in the air (kinesthetic).59\n* **Visualization:** Encourage children to create a mental picture of the information they are learning. This act of transformation from verbal to visual information strengthens the memory encoding.56\n* **Spaced Practice:** Distributing learning sessions over time is far more effective for long-term retention than cramming all at once. Reviewing material in short, regular intervals strengthens the neural pathways of the memory.39\n\n##### **Retrieving from Long-Term Memory**\n\n* **Practice Testing:** The act of actively retrieving information from memory (e.g., through low-stakes quizzes or self-testing) is one of the most powerful ways to strengthen long-term retention—more effective than simply re-reading the material.39\n* **Mnemonic Devices:** Teach children memory aids for recalling lists or sequences. These can include acronyms (e.g., *HOMES* for the Great Lakes), acrostics (e.g., \"Please Excuse My Dear Aunt Sally\" for mathematical order of operations), or rhymes.56 These devices work by organizing disparate information into a single, more easily remembered chunk.\n\n**Table 3: Evidence-Based Strategies for Supporting Attention and Memory**\n\n| Cognitive Domain | Strategy | Description | Practical Classroom/Home Example |\n| --- | --- | --- | --- |\n| **Sustained Attention** | **Task Chunking & Time Adjustment** | Break long tasks into smaller segments and set work periods appropriate for the child's age (2-5 min/year of age). 50 | For a 30-minute math worksheet, set a timer for 15 minutes. After the first half, take a 5-minute movement break before starting the second half. 53 |\n| **Selective Attention** | **Environmental Modification** | Reduce sensory distractions by creating an organized, quiet workspace with minimal visual clutter. 49 | Designate a \"homework zone\" away from the TV and high-traffic areas. Use a study carrel or face the desk toward a blank wall. 45 |\n| **Executive Control** | **Metacognitive Training** | Explicitly teach what focus looks like and use cues (e.g., a timer, a visual reminder) to prompt self-monitoring. 45 | Use an \"attention check\" system where a quiet chime sounds every 10 minutes, and the student gives a thumbs-up if they were on task. 51 |\n| **Working Memory** | **Chunking & Scaffolding** | Present information in small, manageable pieces and use external aids like checklists or diagrams to reduce cognitive load. 39 | Instead of giving a 5-step instruction verbally, provide a checklist with pictures for each step of the morning routine. 60 |\n| **Long-Term Encoding** | **Elaboration & Multisensory Input** | Encourage deep processing by linking new info to prior knowledge and engaging multiple senses (hearing, sight, touch). 39 | When learning about the rainforest, have students listen to sounds of the rainforest, look at pictures, and touch different plant leaves. 59 |\n| **Long-Term Retrieval** | **Practice Testing & Mnemonics** | Use low-stakes quizzes and memory aids (acronyms, rhymes) to strengthen the ability to recall information. 39 | Instead of just re-reading a history chapter, have the child use flashcards to quiz themselves. Use the acronym ROYGBIV to remember the colors of the rainbow. 56 |\n\n## **Part III: Modern Learning Theories and Applications**\n\nThe foundational theories of development and the science of core cognitive processes provide the \"why\" and \"how\" of learning. This section explores the \"what\"—influential pedagogical frameworks that translate these principles into educational practice. We will examine how constructivism is applied in the classroom, how meaningful learning transforms rote memorization into rich understanding, and how game-based learning harnesses the power of play to drive cognitive growth.\n\n### **Chapter 6: Constructivism in Practice: Building Knowledge in the Classroom**\n\nConstructivism is not a specific teaching method but rather a comprehensive learning theory that provides a philosophical foundation for educational practice.63 It fundamentally reframes the goal of education from the transmission of information to the facilitation of meaning-making.\n\n#### **Core Principles of Constructivism**\n\nAt its heart, constructivism holds that knowledge cannot be passively received from a teacher or a text; it must be actively built, or *constructed*, in the mind of the learner.64 This process is deeply personal and influenced by the learner's unique background.\n\n* **Knowledge is Actively Constructed:** Learners are not empty vessels waiting to be filled. They are active participants who create their own understanding by connecting new information with their existing knowledge, experiences, and beliefs.2\n* **Learning is an Active Process:** Meaningful understanding requires active engagement—questioning, exploring, and interacting with ideas—rather than passive listening and memorization.63\n* **Learning is Social and Contextual:** Knowledge is shaped by social interactions, collaboration, and the cultural context in which it is learned. Dialogue with others helps learners refine their thinking.2\n* **Learning is Learner-Centered:** The learner's prior knowledge, perspective, and interests are central to the learning process. Each student will construct a unique understanding of the same lesson based on their individual background.64\n\n#### **The Constructivist Classroom**\n\nApplying these principles transforms the traditional classroom environment, redefining the roles of both the teacher and the student.\n\n* **Role of the Teacher:** The teacher's role shifts from being an instructor to a **facilitator** or \"guide on the side\".2 Their primary function is to create a collaborative, problem-solving environment. They do this by posing questions, providing resources, and guiding students' inquiry, rather than simply delivering answers.2 A key technique is\n  **scaffolding**, where the teacher provides just enough support to help students tackle challenging problems, gradually withdrawing that support as students become more competent.63\n* **Role of the Student:** The student becomes an **active participant** and takes ownership of their learning.2 They are encouraged to be inquisitive, to ask questions, and to formulate and test their own ideas. Learning happens through exploration, reflection, and collaboration with peers.63\n* **Classroom Environment:** A constructivist classroom is characterized by interaction and collaboration. It often features flexible seating arrangements like small groups to encourage peer dialogue.63 Learning activities are frequently hands-on, inquiry-based, and connected to authentic, real-world problems that allow for a variety of student solutions and products.2\n\n#### **Applying Constructivism Across Piaget's Stages**\n\nAn effective constructivist approach must be developmentally appropriate, tailoring activities to the cognitive abilities and limitations of learners at different stages.\n\n* **Sensorimotor and Preoperational Classroom (Ages 0-7):** Learning must be anchored in the concrete and sensory. Since children in these stages learn through direct physical experience and are beginning to use symbols, activities should be hands-on and encourage play.\n  + **Examples:** Using physical manipulatives for counting, engaging in dramatic play and role-playing to explore social roles, building with blocks, drawing, painting, and storytelling.2 Simple sorting games, puzzles, and activities that involve touching, seeing, and hearing are essential for building foundational schemas.14\n* **Concrete Operational Classroom (Ages 7-11):** Children in this stage are developing logical thought but still need to ground it in concrete reality. Instruction can leverage this emerging logic through structured, hands-on activities.\n  + **Examples:** Conducting simple science experiments (like sink-or-float tests) to explore cause and effect, using diagrams and timelines to organize information, and engaging in classification tasks.14 Activities that make logical processes visible, such as sequencing jumbled story paragraphs or using measuring cups in baking to understand fractions, are highly effective.71 Collaborative group projects and peer feedback become powerful tools as egocentrism declines.72\n* **Formal Operational Classroom (Ages 11+):** Instruction can now engage students in abstract and hypothetical reasoning. The facilitator's role is to pose complex problems and encourage students to explore multiple perspectives.\n  + **Examples:** Staging debates on ethical or social issues, designing and conducting independent research projects, using computer simulations to explore complex systems (e.g., a United Nations model on global issues), and solving problems that require abstract thought and the systematic testing of hypotheses.2\n\nUltimately, an effective constructivist classroom synthesizes the best of both Piaget and Vygotsky. It provides the rich, exploratory environment necessary for individual discovery (Piaget) while also offering the strategic, collaborative guidance from teachers and peers that helps learners navigate their Zone of Proximal Development (Vygotsky).\n\n### **Chapter 7: From Rote to Richness: Ausubel's Meaningful Learning Theory**\n\nWhile constructivism provides the \"who\" (the learner) and \"where\" (the social context) of learning, David Ausubel's theory of meaningful learning provides a detailed account of the cognitive \"how.\" It explains the internal process by which new information is integrated into a learner's mind to create durable, applicable knowledge, standing in sharp contrast to the superficiality of rote memorization.\n\n#### **Defining Meaningful Learning vs. Rote Learning**\n\nAusubel drew a critical distinction between two ways of internalizing information, which lie on a continuum 62:\n\n* **Rote Learning:** This involves memorizing information verbatim, without connecting it to what the learner already knows.61 The information is stored in an arbitrary and isolated fashion. Because it lacks connections to the learner's existing cognitive framework, rote-learned knowledge is easily forgotten and difficult to apply to new problems or situations.73\n* **Meaningful Learning:** This occurs when a learner consciously and deliberately links new information to relevant concepts they already possess.61 This process creates a rich, interconnected, and hierarchical network of knowledge. Because the new information is anchored to a stable cognitive structure, it is retained for much longer and can be readily transferred to solve novel problems.74\n\n#### **The Mechanism of Subsumption**\n\nThe core cognitive mechanism of meaningful learning is **subsumption**. This is the process through which new, more specific information is linked to and incorporated under a broader, more general, pre-existing concept (known as a \"subsumer\") in the learner's cognitive structure.73 For example, to meaningfully learn about different types of apples (Granny Smith, Red Delicious), a student subsumes this new information under their existing, more general concept of \"apple.\" This act of relating new knowledge to an existing framework is what gives it meaning and allows it to be organized into a usable mental format.73\n\n#### **Conditions for Meaningful Learning**\n\nFor meaningful learning to take place, Ausubel and his followers, such as Joseph Novak, identified three essential conditions 62:\n\n1. **Meaningful Material:** The material to be learned must be conceptually clear, well-organized, and relatable to the learner's prior knowledge. It must have potential meaning.\n2. **Relevant Prior Knowledge:** The learner must possess the necessary pre-existing concepts in their cognitive structure to which the new information can be anchored. One cannot meaningfully learn calculus without a solid foundation in algebra.\n3. **Learner's Choice:** The learner must possess a \"meaningful learning set\"—they must actively *choose* to relate the new information to their existing knowledge rather than simply memorizing it by rote. This highlights the importance of student motivation and intention.\n\n#### **The Role of Advance Organizers**\n\nTo help meet these conditions, Ausubel proposed a powerful instructional strategy: the use of **advance organizers**. These are materials presented to the learner *before* the main lesson. They are pitched at a higher level of abstraction and generality than the learning material itself and are designed to act as a cognitive bridge.73\n\nAn advance organizer activates the relevant \"subsumers\" in the learner's mind, providing a conceptual framework to which the new, more detailed information can be attached.73 For example, before a lesson on the specific causes of the American Revolution, a teacher might use a comparative organizer to discuss the general concept of \"revolution\" and have students compare it to other revolutions they have studied. This activates their prior knowledge and prepares their cognitive structure to assimilate the new information meaningfully. Visual tools like\n\n**concept maps** are a particularly effective form of advance organizer, as they explicitly show the hierarchical relationships between concepts.73\n\nAusubel's theory provides a compelling explanation for the internal cognitive processes at play during effective instruction. It reveals that the guidance provided by an MKO in Vygotsky's ZPD often works by helping the learner identify the correct prior knowledge (the subsumer) needed to make sense of a new challenge. Furthermore, by creating interconnected knowledge structures, meaningful learning is the direct antidote to the problem of \"inert knowledge\"—information that can be recalled for a test but cannot be applied in the real world.61\n\n### **Chapter 8: Game-Based Learning: Play as a Cognitive Tool**\n\nGame-Based Learning (GBL) is an educational approach that leverages the principles of game design to create engaging and effective learning experiences.77 By harnessing the inherent motivational power of play, GBL can facilitate deep cognitive processing, promote skill development, and foster positive attitudes toward learning. It represents a powerful synthesis of constructivist principles and an understanding of the cognitive and affective drivers of human behavior.\n\n#### **Principles of Game-Based Learning**\n\nGBL involves using a full-fledged game as a tool for learning, a method distinct from \"gamification,\" which is the application of isolated game mechanics like points or badges to otherwise traditional tasks.31 A well-designed educational game integrates learning objectives seamlessly into the core elements of a game: players, clear objectives, rules, resources to manage, conflict to overcome, and an uncertain outcome that drives engagement.77\n\nThe psychological power of GBL stems from its alignment with foundational learning theories. It is deeply compatible with Vygotsky's sociocultural perspective, which highlights the importance of play, cultural tools, and community in cognitive development.31\n\n#### **Psychological Benefits of GBL**\n\nWhen designed effectively, games can offer a host of benefits that support the whole learner.\n\n* **Cognitive Benefits:** GBL has been shown to enhance a wide range of cognitive skills, including problem-solving, critical thinking, spatial reasoning, memory, attention, and information processing speed.77 Games provide a context for situated learning, where knowledge is applied at the moment it is needed, which aids in transfer.31 They can make abstract concepts concrete and allow learners to visualize and interact with complex systems.80\n* **Motivational and Affective Benefits:** Games excel at fostering motivation and engagement.79 They provide clear goals and immediate, constant feedback, which helps learners monitor their progress. A key feature is the creation of a safe space for failure; in a game, mistakes are not punitive but are opportunities to learn and try again, a concept known as \"graceful failure\".78 By carefully balancing challenge and skill, good games can induce a state of \"flow,\" a highly focused and enjoyable state of deep immersion.31 This positive emotional experience, sometimes linked to the release of dopamine, can enhance memory and cognitive processing.82\n* **Social and Emotional Benefits:** Multiplayer, collaborative, and role-playing games are powerful tools for developing social and emotional skills. They provide opportunities to practice communication, cooperation, negotiation, empathy, and emotional regulation in a structured context.79\n\nThe effectiveness of a learning game is not automatic; it is contingent on its alignment with the learner's cognitive development and individual learning style.84 A \"one-size-fits-all\" approach is unlikely to succeed. Therefore, designing games for different developmental stages is crucial.\n\n#### **Designing Games for Cognitive Development**\n\n* **Preoperational Stage (Ages 2-7):** Games for this age group should focus on sensory exploration, symbolic representation, and simple, repeatable rules. The goal is to build foundational schemas through play.\n  + **Examples:** Digital finger-painting apps, shape and color sorting games, simple puzzles, and cause-and-effect games (e.g., tap a character to make a sound) align with this stage's focus on sensory input.69 Dramatic pretend play, whether with physical props or in a digital environment, is vital for developing symbolic thought, language, and emotional understanding.83 Games like \"Simon Says\" reinforce listening and following simple action-based rules.87\n* **Concrete Operational Stage (Ages 7-11):** Children in this stage are developing logical thought, so games can introduce more complex rules, strategy, and classification.\n  + **Examples:** Linear board games like *Chutes and Ladders* have been shown to be highly effective for developing number sense and an understanding of magnitude.88 Logic and strategy games like checkers, chess, or Mancala foster sequential and logical thinking.89 STEM building kits and games that require classifying objects or solving problems with concrete rules are ideal.90 These games allow children to practice their emerging skills in conservation, reversibility, and logical reasoning in an engaging format.16\n* **Formal Operational Stage (Ages 11+):** Games can now challenge abstract, hypothetical, and strategic thinking.\n  + **Examples:** Complex strategy games (e.g., chess, resource management games), simulations that model intricate systems (e.g., economic or environmental sims), and logic puzzles like Sudoku or a Rubik's cube all demand formal operational thought.89 Role-playing games with complex narratives can encourage players to consider multiple perspectives and make decisions based on abstract principles.\n\nAn effectively designed educational game functions as a dynamic Zone of Proximal Development. It constantly assesses the player's ability and presents them with challenges that are just difficult enough to be engaging but not so hard as to be frustrating.31 The game itself provides the necessary scaffolds—tutorials, hints, simplified levels—to help the player succeed, acting as an automated More Knowledgeable Other. In this way, GBL brilliantly bridges constructivist theory (learning by doing and exploring) with meaningful learning theory (embedding knowledge in a purposeful and engaging context).77\n\n## **Part IV: Contemporary Perspectives on Cognitive Development**\n\nWhile the theories of Piaget and Vygotsky remain foundational, contemporary research has continued to refine, challenge, and expand upon their ideas. Modern theories of cognitive development move away from linear, universal stage models toward more dynamic, context-dependent, and integrated perspectives. This final section explores several of these influential modern frameworks, including Dynamic Systems Theory, Social Cognitive Theory, and Neo-Piagetian theories.\n\n### **Chapter 9: Beyond Stages: Modern Theories of Development**\n\nContemporary theories offer a more complex and nuanced view of development, reflecting a broader scientific shift from deterministic models to probabilistic ones that account for the intricate interplay of multiple influencing factors.\n\n#### **Dynamic Systems Theory (DST)**\n\nDynamic Systems Theory offers a radical departure from traditional stage-based models. It views development not as a pre-programmed unfolding of cognitive structures, but as a complex, non-linear, and self-organizing process.92\n\n* **Core Idea:** According to DST, cognitive and behavioral change emerges from the continuous, real-time interaction of many different components of a system. These components include not only neural processes but also genetics, the physical body, environmental factors, and the child's own actions and experiences.93 Development is not driven by a single master plan but is \"softly assembled\" from the interplay of these elements.\n* **Key Concepts:** DST rejects classic dualisms like nature vs. nurture and mind vs. body, seeing them as inextricably linked.97 A central tenet is that development is non-linear; small changes in one part of the system (e.g., a baby's leg strength) can lead to large, qualitative shifts in the entire system's behavior (e.g., the emergence of walking).94 This allows the theory to account for both gradual change and sudden developmental leaps. The developmental path of each child is seen as unique, emerging from a specific history of interactions within their particular system.93\n* **Relation to Classical Theories:** DST can be seen as a framework that formally integrates the insights of both Piaget and Vygotsky. It honors Piaget's view of the child as an active agent whose actions drive development, while also fully incorporating Vygotsky's emphasis on the crucial role of the social and physical environment.94\n\n#### **Bandura's Social Cognitive Theory (SCT)**\n\nDeveloped by Albert Bandura, Social Cognitive Theory extends his earlier social learning theory by placing a strong emphasis on the role of cognition as a mediator between the environment and behavior.98\n\n* **Core Idea:** SCT is built on the concept of **triadic reciprocal causation**, which posits that development is the result of a continuous, dynamic interaction between three factors: personal factors (including cognitive abilities, beliefs, and attitudes), behavior, and the environment.99 Each factor influences and is influenced by the others.\n* **Key Constructs:**\n  + **Observational Learning:** A cornerstone of the theory, this is the process of learning by observing the behavior of others (models) and the consequences of that behavior. It is governed by four sub-processes: attention (noticing the behavior), retention (remembering it), reproduction (being able to perform it), and motivation (wanting to perform it).99\n  + **Human Agency:** Bandura emphasized that people are agents of their own lives; they are not simply shaped by their environment but actively contribute to and alter it.99\n  + **Self-Efficacy:** This is arguably the most influential construct of SCT. Self-efficacy is an individual's belief in their own capability to successfully perform a specific task or achieve a goal.100 It is not a general sense of confidence but is task-specific. Self-efficacy is a powerful predictor of behavior, influencing the choices we make, the effort we exert, our persistence in the face of adversity, and our emotional reactions.96 A student with high self-efficacy for math is more likely to engage in challenging math problems and persevere when they get stuck.\n\nThe concept of self-efficacy provides a powerful psychological link to Vygotsky's theory. A child's willingness to attempt a task within their ZPD is heavily dependent on their self-efficacy. Effective scaffolding from a More Knowledgeable Other does more than provide cognitive support; it actively builds the learner's self-efficacy by providing encouragement (social persuasion) and enabling them to achieve success (mastery experiences). Without sufficient self-efficacy, a learner may be too hesitant or anxious to even enter their ZPD, rendering instruction ineffective.\n\n#### **Neo-Piagetian Theories**\n\nNeo-Piagetian theories represent an effort to blend the strengths of Piaget's stage theory with insights from information-processing theory.58\n\n* **Core Idea:** These theories retain Piaget's idea that development progresses through a sequence of stages but seek to provide a better explanation for the cognitive mechanisms that drive this change. They also acknowledge that development can be more variable and context-dependent than Piaget originally proposed.96\n* **Key Contributions:** The primary explanation that neo-Piagetians offer for stage progression is the growth in **information processing capacity**, particularly **working memory**.58 Theorists like Juan Pascual-Leone proposed that the amount of information a child can hold and manipulate in their mind at one time (their \"mental power\") increases systematically with age. Each increase in working memory capacity allows the child to process more complex relationships and construct the more sophisticated concepts characteristic of the next developmental stage.58 This provides a cognitive-processing explanation for why a concrete operational child can handle conservation tasks (which require holding two dimensions in mind) while a preoperational child cannot.\n\nTogether, these modern theories paint a picture of cognitive development that is far more complex, dynamic, and individualized than the classical models first suggested. They emphasize the intricate dance between internal cognitive processes and external social and environmental factors, providing a richer and more flexible framework for understanding and supporting the developing minds of children.\n\n## **Conclusion and Recommendations**\n\nThe journey from the foundational theories of Piaget and Vygotsky to the modern landscapes of cognitive science and learning theory reveals a progressively more nuanced and integrated understanding of children's cognitive development. No single theory holds all the answers. Instead, a comprehensive and effective approach to education requires a synthesis of perspectives, drawing from a rich toolkit of concepts to create learning environments that are responsive to the dynamic nature of the developing mind.\n\nThe analysis yields several overarching conclusions that translate into actionable recommendations for educators, curriculum designers, and parents:\n\n1. **Development Informs, It Does Not Dictate.** Piaget's stages provide an invaluable framework for understanding the general trajectory of cognitive change and for creating developmentally appropriate practices. However, the critiques of his theory remind us that these stages are not rigid, universal timetables. Development is continuous and variable.\n   * **Recommendation:** Use Piaget's stages as a guide for anticipating a child's likely cognitive abilities and limitations, but always assess the individual child's understanding. Be prepared for variability and domain-specific differences in performance.\n2. **Learning is a Socially Constructed and Guided Process.** Vygotsky's profound insight is that learning originates in social interaction. The concepts of the More Knowledgeable Other, the Zone of Proximal Development, and Scaffolding are not just descriptive but prescriptive—they form a blueprint for effective instruction.\n   * **Recommendation:** Embrace collaborative learning. Structure tasks that allow students to work in pairs or small groups with varying ability levels. Teachers should see their primary role as that of a facilitator who provides strategic, temporary support (scaffolding) to help students tackle challenges that are just beyond their current independent reach.\n3. **Attention and Working Memory are Critical Bottlenecks.** All learning must pass through the gateways of attention and working memory. Cognitive overload is a primary cause of learning failure.\n   * **Recommendation:** Prioritize the management of cognitive load in all instructional design. Break complex tasks and information into smaller, manageable chunks. Use visual aids, checklists, and repetition to reduce the burden on working memory. Proactively design learning environments to minimize distractions and create routines that support sustained focus.\n4. **Learning Must Be Meaningful to Be Durable and Applicable.** As Ausubel demonstrated, knowledge that is simply memorized is inert and quickly forgotten. True learning involves connecting new information to what the learner already knows.\n   * **Recommendation:** Shift the focus from rote memorization to meaningful connections. Use advance organizers, concept maps, and analogies to activate prior knowledge before introducing new material. Constantly prompt students to explain concepts in their own words and relate them to their own experiences.\n5. **Play is a Serious Vehicle for Cognitive Growth.** Game-based learning is not a frivolous add-on but a powerful pedagogical tool that aligns with the core principles of motivation, engagement, and cognitive development.\n   * **Recommendation:** Intentionally incorporate well-designed, developmentally appropriate games into learning. Use simple symbolic and sensory games for younger children, logic and rule-based games for elementary students, and complex strategy and simulation games for adolescents to foster a wide range of cognitive and social skills.\n\nUltimately, fostering a child's cognitive development is about creating an ecosystem of learning. This ecosystem should provide rich opportunities for independent exploration (Piaget), be structured with expert social guidance (Vygotsky), be mindful of the brain's processing limits (cognitive science), and be infused with the meaning and engagement that make knowledge come alive (Ausubel and GBL). By integrating these diverse yet complementary perspectives, we can better architect learning experiences that honor the complexity of the developing mind and empower every child to construct their own robust and lasting understanding of the world.\n\n#### 引用的著作\n\n1. Piaget's Stages: 4 Stages of Cognitive Development & Theory - Positive Psychology, 访问时间为 八月 4, 2025， <https://positivepsychology.com/piaget-stages-theory/>\n2. CONSTRUCTIVISM in Piaget and Vygotsky - The Fountain Magazine, 访问时间为 八月 4, 2025， <http://fountainmagazine.com/2004/issue-48-october-december-2004/constructivism-in-piaget-and-vygotsky>\n3. Piaget's theory of cognitive development - Wikipedia, 访问时间为 八月 4, 2025， <https://en.wikipedia.org/wiki/Piaget%27s_theory_of_cognitive_development>\n4. Vygotsky vs. Piaget: A Paradigm Shift - Simply Psychology, 访问时间为 八月 4, 2025， <https://www.simplypsychology.org/piaget-vs-vygotsky.html>\n5. Learning Theories: Constructivism - Cornerstone, 访问时间为 八月 4, 2025， <https://cornerstone.lib.mnsu.edu/cgi/viewcontent.cgi?article=1138&context=all>\n6. Piaget's and Vygotsky's Theories of Cognitive Development | Psychology Paper Example, 访问时间为 八月 4, 2025， <https://psychologywriting.com/piagets-and-vygotskys-theories-of-cognitive-development/>\n7. Constructivism (philosophy of education) - Wikipedia, 访问时间为 八月 4, 2025， [https://en.wikipedia.org/wiki/Constructivism\\_(philosophy\\_of\\_education)](https://en.wikipedia.org/wiki/Constructivism_%28philosophy_of_education%29)\n8. Jean Piaget's Individual Constructivist Theory of Cognitive Development, 访问时间为 八月 4, 2025， <https://foundations.ed.brocku.ca/winter_term/week14/9/>\n9. Piaget - StatPearls - NCBI Bookshelf, 访问时间为 八月 4, 2025， <https://www.ncbi.nlm.nih.gov/books/NBK448206/>\n10. Piaget's Theory and the Stages of Cognitive Development - Gowrie NSW, 访问时间为 八月 4, 2025， <https://www.gowriensw.com.au/thought-leadership/piaget-theory>\n11. Piagetian and Vygotskian Concepts of Cognitive Development: A Review - Indian Journal of Mental Health, 访问时间为 八月 4, 2025， <https://indianmentalhealth.com/pdf/2022/vol9-issue3/4-Review-Paper-2.pdf>\n12. en.wikipedia.org, 访问时间为 八月 4, 2025， <https://en.wikipedia.org/wiki/Piaget%27s_theory_of_cognitive_development#:~:text=above%20their%20level.-,Four%20stages%20of%20development,stage%2C%20and%20formal%20operational%20stage.>\n13. 2.1 Cognitive Development: The Theory of Jean Piaget – Foundations of Educational Technology - OPEN OKSTATE, 访问时间为 八月 4, 2025， <https://open.library.okstate.edu/foundationsofeducationaltechnology/chapter/2-cognitive-development-the-theory-of-jean-piaget/>\n14. Piaget's Theory and Stages of Cognitive Development - Simply Psychology, 访问时间为 八月 4, 2025， <https://www.simplypsychology.org/piaget.html>\n15. Psychological Constructivism | Adolescent Psychology - Lumen Learning, 访问时间为 八月 4, 2025， <https://courses.lumenlearning.com/adolescent/chapter/psychological-constructivism-piagets-theories/>\n16. The Concrete Operational Stage of Cognitive Development - Verywell Mind, 访问时间为 八月 4, 2025， <https://www.verywellmind.com/concrete-operational-stage-of-cognitive-development-2795458>\n17. Cognitive Constructivism - GSI Teaching & Resource Center, 访问时间为 八月 4, 2025， <https://gsi.berkeley.edu/gsi-guide-contents/learning-theory-research/cognitive-constructivism/>\n18. Piaget's stages of cognitive development (video) - Khan Academy, 访问时间为 八月 4, 2025， <https://www.khanacademy.org/science/health-and-medicine/executive-systems-of-the-brain/cognition-lesson/v/piagets-stages-of-cognitive-development>\n19. Developmental Psychology: Incorporating Piaget's and Vygotsky's Theories in Classrooms, 访问时间为 八月 4, 2025， <https://www.people.wm.edu/~mxtsch/Teaching/JCPE/Volume1/JCPE_2008-01-09.pdf>\n20. The Enduring Influence of Jean Piaget - Association for Psychological Science, 访问时间为 八月 4, 2025， <https://www.psychologicalscience.org/observer/jean-piaget>\n21. Vygotsky's and Piaget's Theories Comparison | Psychology Paper ..., 访问时间为 八月 4, 2025， <https://psychologywriting.com/vygotskys-and-piagets-theories-comparison/>\n22. Piaget's Cognitive Developmental Theory: Critical Review., 访问时间为 八月 4, 2025， <https://eric.ed.gov/?id=EJ1274368>\n23. In Defense of Piaget's Theory: A Reply to 10 Common Criticisms - ResearchGate, 访问时间为 八月 4, 2025， <https://www.researchgate.net/profile/Armando-Machado/publication/232556312_In_Defense_of_Piaget%27s_Theory_A_Reply_to_10_Common_Criticisms/links/09e41511a75a9d34c3000000/In-Defense-of-Piagets-Theory-A-Reply-to-10-Common-Criticisms.pdf>\n24. www.gowriensw.com.au, 访问时间为 八月 4, 2025， <https://www.gowriensw.com.au/thought-leadership/vygotsky-theory#:~:text=Vygotsky's%20sociocultural%20theory%20about%20child,building%20knowledge%20and%20understanding%20concepts.>\n25. Lev Vygotsky's Theory of Child Development - Gowrie NSW, 访问时间为 八月 4, 2025， <https://www.gowriensw.com.au/thought-leadership/vygotsky-theory>\n26. Vygotsky's Sociocultural Theory of Cognitive Development - Simply Psychology, 访问时间为 八月 4, 2025， <https://www.simplypsychology.org/vygotsky.html>\n27. 10.3 Vygotsky's Sociocultural Theory – Lifespan Human Development: A Topical Approach, 访问时间为 八月 4, 2025， <https://openbooks.library.baylor.edu/lifespanhumandevelopment/chapter/chapter-9-3-vygotskys-sociocultural-theory/>\n28. Sociocultural Theory of Cognitive Development, 访问时间为 八月 4, 2025， <https://www.mcw.edu/-/media/MCW/Education/Academic-Affairs/OEI/Faculty-Quick-Guides/Sociocultural-Theory-of-Cognitive-Development.pdf>\n29. Zone of Proximal Development - Simply Psychology, 访问时间为 八月 4, 2025， <https://www.simplypsychology.org/zone-of-proximal-development.html>\n30. Zone of proximal development - Wikipedia, 访问时间为 八月 4, 2025， <https://en.wikipedia.org/wiki/Zone_of_proximal_development>\n31. Foundations of Game-Based Learning - ERIC, 访问时间为 八月 4, 2025， <https://files.eric.ed.gov/fulltext/EJ1090277.pdf>\n32. Vygotsky's Theory - East Tennessee State University, 访问时间为 八月 4, 2025， <https://www.etsu.edu/teaching/resources/more_resources/vygotsky.php>\n33. Sociocultural Theory | EBSCO Research Starters, 访问时间为 八月 4, 2025， <https://www.ebsco.com/research-starters/education/sociocultural-theory>\n34. Vygotsky's philosophy of education - THE EDUCATION HUB, 访问时间为 八月 4, 2025， <https://theeducationhub.org.nz/vygotskys-philosophy-of-education/>\n35. Piaget vs Vygotsky: Similarities and Differences (2025) - Helpful Professor, 访问时间为 八月 4, 2025， <https://helpfulprofessor.com/piaget-vs-vygotsky/>\n36. Vygotsky's Theory - Structural Learning, 访问时间为 八月 4, 2025， <https://www.structural-learning.com/post/vygotskys-theory>\n37. Piaget vs Vygotsky: Similarities & Difference | Vaia, 访问时间为 八月 4, 2025， <https://www.vaia.com/en-us/explanations/psychology/social-context-of-behaviour/piaget-vs-vygotsky/>\n38. 12.4.2: Attention - Social Sci LibreTexts, 访问时间为 八月 4, 2025， <https://socialsci.libretexts.org/Courses/Pittsburg_State_University/The_Developing_Child/12%3A_Cognitive_Development_in_Infancy_and_Toddlerhood/12.04%3A_Cognitive_Processes/12.4.02%3A_Attention>\n39. Memory and processing - Support for schools and settings, 访问时间为 八月 4, 2025， <https://www.devon.gov.uk/support-schools-settings/send/educational-psychology/resources/devon-psychology-in-action/memory-and-processing/>\n40. Improve Sustained Attention - South County Child & Family Consultants, 访问时间为 八月 4, 2025， <https://southcountychildandfamily.com/resources/executive-functions/sustained-attention/>\n41. (PDF) The Development of Sustained Attention in Children: The Effect of Age and Task Load, 访问时间为 八月 4, 2025， <https://www.researchgate.net/publication/6949000_The_Development_of_Sustained_Attention_in_Children_The_Effect_of_Age_and_Task_Load>\n42. THE DEVELOPMENT OF ATTENTION IN CHILDREN1, 访问时间为 八月 4, 2025， <https://deepblue.lib.umich.edu/bitstream/handle/2027.42/108352/ets200453.pdf?sequence%3D1>\n43. Sustained Attention in Infancy: A Foundation for the Development of Multiple Aspects of Self-Regulation for Children in Poverty - PMC - PubMed Central, 访问时间为 八月 4, 2025， <https://pmc.ncbi.nlm.nih.gov/articles/PMC6528818/>\n44. Selective attention relates to the development of executive functions in 2,5, 访问时间为 八月 4, 2025， <https://ris.utwente.nl/ws/portalfiles/portal/16046691/selective_attention.pdf>\n45. How to Help Your Child with Attention Problems - Expressable, 访问时间为 八月 4, 2025， <https://www.expressable.com/learning-center/tips-and-resources/how-to-help-your-child-with-attention-problems>\n46. Attention-Deficit/Hyperactivity Disorder (ADHD) - National Institute of Mental Health (NIMH), 访问时间为 八月 4, 2025， <https://www.nimh.nih.gov/health/topics/attention-deficit-hyperactivity-disorder-adhd>\n47. Not All Attention Problems Are ADHD - Child Mind Institute, 访问时间为 八月 4, 2025， <https://childmind.org/article/not-all-attention-problems-are-adhd/>\n48. Nine Reasons Kids Struggle With Paying Attention in Class - Oxford Learning, 访问时间为 八月 4, 2025， <https://oxfordlearning.com/nine-reasons-kids-struggle-with-paying-attention-in-class/>\n49. Attention and Concentration | NHS GGC, 访问时间为 八月 4, 2025， <https://www.nhsggc.org.uk/kids/resources/ot-activityinformation-sheets/attention-and-concentration/>\n50. 6 Ways to Improve Your Child's Focus and Concentration (Based on another article) - Reddit, 访问时间为 八月 4, 2025， <https://www.reddit.com/r/ScienceBasedParenting/comments/12qqkqy/6_ways_to_improve_your_childs_focus_and/>\n51. 7 Ways to Increase a Student's Attention Span | Edutopia, 访问时间为 八月 4, 2025， <https://www.edutopia.org/discussion/7-ways-increase-students-attention-span>\n52. Evidence-based strategies for attention - NSW Department of Education, 访问时间为 八月 4, 2025， <https://education.nsw.gov.au/campaigns/inclusive-practice-hub/primary-school/common-needs/attention/evidence-based-strategies>\n53. How to Help Kids Focus | Parenting Tips &… | PBS KIDS for Parents, 访问时间为 八月 4, 2025， <https://www.pbs.org/parents/thrive/tips-for-helping-your-child-focus-and-concentrate>\n54. 5 Strategies to Improve your Child's Focus and Attention Span, 访问时间为 八月 4, 2025， <https://www.faithwest.org/5-strategies-to-improve-your-child-s-focus-and-attention-span>\n55. Working Memory Strategies for Children - BTB Psychology, 访问时间为 八月 4, 2025， <https://www.btbpsychology.com/blog/working-memory-strategies-for-children>\n56. Child's Memory: A Guide to Understanding Your Child's Cognitive Growth - Brightwheel, 访问时间为 八月 4, 2025， <https://mybrightwheel.com/blog/childs-memory>\n57. Working Memory Underpins Cognitive Development, Learning, and Education - PMC, 访问时间为 八月 4, 2025， <https://pmc.ncbi.nlm.nih.gov/articles/PMC4207727/>\n58. Neo-Piagetian theories of cognitive development - Wikipedia, 访问时间为 八月 4, 2025， <https://en.wikipedia.org/wiki/Neo-Piagetian_theories_of_cognitive_development>\n59. Strategies for Enhancing Working Memory, 访问时间为 八月 4, 2025， <https://strategiesforlearning.com/strategies-for-enhancing-working-memory/>\n60. Working Memory - Kid Sense Child Development, 访问时间为 八月 4, 2025， <https://childdevelopment.com.au/areas-of-concern/working-memory/>\n61. Meaningful learning - Wikipedia, 访问时间为 八月 4, 2025， <https://en.wikipedia.org/wiki/Meaningful_learning>\n62. Why educational research matters to you: Rote vs meaningful learning | Chem 13 News Magazine | University of Waterloo, 访问时间为 八月 4, 2025， <https://uwaterloo.ca/chem13-news-magazine/november-2014/recommended/why-educational-research-matters-you-rote-vs-meaningful>\n63. Constructivism as a Theory for Teaching and Learning, 访问时间为 八月 4, 2025， <https://www.simplypsychology.org/constructivism.html>\n64. (PDF) Constructivism in Education: Exploring the Contributions of Piaget, Vygotsky, and Bruner - ResearchGate, 访问时间为 八月 4, 2025， <https://www.researchgate.net/publication/378071316_Constructivism_in_Education_Exploring_the_Contributions_of_Piaget_Vygotsky_and_Bruner>\n65. Constructivism - EdTech Books, 访问时间为 八月 4, 2025， <https://edtechbooks.org/studentguide/constructivism>\n66. Constructivism Learning Theory - LXD, 访问时间为 八月 4, 2025， <https://lxdlearningexperiencedesign.com/learning-theory/constructivism-learning-theory/>\n67. Constructivism in Education: What Is Constructivism? | NU - National University, 访问时间为 八月 4, 2025， <https://www.nu.edu/blog/what-is-constructivism-in-education/>\n68. Constructive Play - Community Playthings, 访问时间为 八月 4, 2025， <https://www.communityplaythings.com/resources/articles/constructive-play>\n69. Educational Activities to Accelerate Early Learning - Jackrabbit Care, 访问时间为 八月 4, 2025， <https://www.jackrabbitcare.com/blog/educational-activities-to-accelerate-early-learning/>\n70. The Association of Strategy Use and Concrete-Operational Thinking in Primary School - Frontiers, 访问时间为 八月 4, 2025， <https://www.frontiersin.org/journals/education/articles/10.3389/feduc.2018.00038/full>\n71. Concrete Operational Stage: Definition, Examples, Activities, More - Healthline, 访问时间为 八月 4, 2025， <https://www.healthline.com/health/childrens-health/concrete-operational-stage>\n72. Cognitive and Constructivist Theories | Classroom Management Class Notes - Fiveable, 访问时间为 八月 4, 2025， <https://library.fiveable.me/classroom-management/unit-2/cognitive-constructivist-theories/study-guide/ifrnX5My7NOAJX4u>\n73. Education Theory Made Practical – Volume 5, Part 9: Ausubel's ..., 访问时间为 八月 4, 2025， <https://icenet.blog/2021/10/05/education-theory-made-practical-volume-5-part-9/>\n74. Ausubel's Learning Theory, 访问时间为 八月 4, 2025， <https://dl.icdst.org/pdfs/files1/7e9bd5801e72bf80a66e4b3fd0b06c50.pdf>\n75. Meaningful Learning and its Implications in the Classroom - Learningbp, 访问时间为 八月 4, 2025， <https://www.learningbp.com/meaningful-learning-ausubel-theory/>\n76. Ausubel's Meaningful Verbal Learning Theory Study Guide | Quizlet, 访问时间为 八月 4, 2025， <https://quizlet.com/study-guides/ausubel-s-meaningful-verbal-learning-theory-31f50296-fd0f-4588-97ec-1c96ad17a543>\n77. Game-Based Learning | EBSCO Research Starters, 访问时间为 八月 4, 2025， <https://www.ebsco.com/research-starters/education/game-based-learning>\n78. Game-Based Learning - Awesome site in the making!, 访问时间为 八月 4, 2025， <https://acrl.ala.org/IS/wp-content/uploads/2014/05/spring2015.pdf>\n79. Game-based learning in early childhood education: a systematic review and meta-analysis, 访问时间为 八月 4, 2025， <https://pmc.ncbi.nlm.nih.gov/articles/PMC11018941/>\n80. Influence of game-based learning in mathematics ... - Frontiers, 访问时间为 八月 4, 2025， <https://www.frontiersin.org/journals/psychology/articles/10.3389/fpsyg.2023.1105806/full>\n81. Influence of game-based learning in mathematics education on the students' cognitive and affective domain: A systematic review - PMC - PubMed Central, 访问时间为 八月 4, 2025， <https://pmc.ncbi.nlm.nih.gov/articles/PMC10086333/>\n82. Game-Based Learning: Key Benefits & Examples - MedCerts, 访问时间为 八月 4, 2025， <https://medcerts.com/blog/game-based-learning-key-benefits-examples>\n83. Adapting Game-Based Learning Across Educational Levels: A Developmental Perspective - Atlantis Press, 访问时间为 八月 4, 2025， <https://www.atlantis-press.com/article/126012468.pdf>\n84. Full article: Simulation game-based learning for cognitive apprenticeship development: a focus on processing speed - Taylor & Francis Online, 访问时间为 八月 4, 2025， <https://www.tandfonline.com/doi/full/10.1080/2331186X.2024.2449280>\n85. Effectiveness of Game-Based Learning: Influence of Cognitive Style - ResearchGate, 访问时间为 八月 4, 2025， <https://www.researchgate.net/publication/227086462_Effectiveness_of_Game-Based_Learning_Influence_of_Cognitive_Style>\n86. Developmental Stages of Play - Piaget - My Teaching Cupboard, 访问时间为 八月 4, 2025， <https://www.myteachingcupboard.com/blog/developmental-stages-of-play-piaget>\n87. Learning Through Games at Home | American Printing House, 访问时间为 八月 4, 2025， <https://www.aph.org/blog/learning-through-games-at-home/>\n88. Exploring the potential of a game-based preschool assessment of mathematical competencies - Frontiers, 访问时间为 八月 4, 2025， <https://www.frontiersin.org/journals/education/articles/10.3389/feduc.2024.1337716/full>\n89. Piaget Stages of Cognitive Development Monopoly Game Guidelines for Parents Sensorimotor, 访问时间为 八月 4, 2025， <https://media.lanecc.edu/users/kime/Ch9Piaget.pdf>\n90. What are the stages of play? Jean Piaget's Theory of Play! - Play. Learn. Thrive., 访问时间为 八月 4, 2025， <https://playlearnthrive.com/stages-of-play-jean-piagets-theory/>\n91. CHAPTER 4 - Brill, 访问时间为 八月 4, 2025， <https://brill.com/display/book/9789087903817/BP000005.pdf>\n92. www.hilarispublisher.com, 访问时间为 八月 4, 2025， <https://www.hilarispublisher.com/open-access/the-cognitive-development-of-children-from-piaget-to-modern-theories-103064.html#:~:text=Some%20of%20the%20modern%20theories,%2C%20environment%2C%20and%20individual%20experiences.>\n93. Dynamic Systems Theory - (Developmental Psychology) - Vocab, Definition, Explanations, 访问时间为 八月 4, 2025， <https://library.fiveable.me/key-terms/developmental-psychology/dynamic-systems-theory>\n94. University of Groningen A dynamic systems model of basic developmental mechanisms Van Geert, P. L. C., 访问时间为 八月 4, 2025， <https://research.rug.nl/files/250864506/A_dynamic_systems_model_of_basic_developmental_mechanisms.pdf>\n95. library.fiveable.me, 访问时间为 八月 4, 2025， <https://library.fiveable.me/key-terms/developmental-psychology/dynamic-systems-theory#:~:text=Dynamic%20Systems%20Theory%20implies%20a,explore%20their%20surroundings%20more%20effectively.>\n96. The Cognitive Development of Children: From Piaget to Modern ..., 访问时间为 八月 4, 2025， <https://www.hilarispublisher.com/open-access/the-cognitive-development-of-children-from-piaget-to-modern-theories-103064.html>\n97. A Dynamic Systems Approach to the Development of Cognition and Action, 访问时间为 八月 4, 2025， <https://lchc.ucsd.edu/MCA/Mail/xmcamail.2011_04.dir/pdfmkn1hFH60m.pdf>\n98. Editorial: Past, present and future contributions from the social cognitive theory (Albert Bandura) - PMC - PubMed Central, 访问时间为 八月 4, 2025， <https://pmc.ncbi.nlm.nih.gov/articles/PMC10442055/>\n99. Social cognitive theory - Wikipedia, 访问时间为 八月 4, 2025， <https://en.wikipedia.org/wiki/Social_cognitive_theory>\n100. Health Behavior and Health Education | Part Three, Chapter Eight: Key Constructs, 访问时间为 八月 4, 2025， <https://www.med.upenn.edu/hbhe4/part3-ch8-key-constructs.shtml>\n101. Social Cognitive Theory.docx - Cornerstone, 访问时间为 八月 4, 2025， <https://cornerstone.lib.mnsu.edu/cgi/viewcontent.cgi?article=1003&context=isalt_resources>\n",
  "all_source_links": [
    "http://fountainmagazine.com/2004/issue-48-october-december-2004/constructivism-in-piaget-and-vygotsky",
    "https://accounts.google.com/SignOutOptions?hl=zh-CN&continue=https://gemini.google.com/&ec=GBRAkgU",
    "https://acrl.ala.org/IS/wp-content/uploads/2014/05/spring2015.pdf",
    "https://brill.com/display/book/9789087903817/BP000005.pdf",
    "https://cdforskning.no/cdf/catalog/view/130/647/4644",
    "https://childdevelopment.com.au/areas-of-concern/working-memory",
    "https://childmind.org/article/not-all-attention-problems-are-adhd",
    "https://cornerstone.lib.mnsu.edu/cgi/viewcontent.cgi?article=1003&context=isalt_resources",
    "https://cornerstone.lib.mnsu.edu/cgi/viewcontent.cgi?article=1138&context=all",
    "https://courses.lumenlearning.com/adolescent/chapter/psychological-constructivism-piagets-theories",
    "https://deepblue.lib.umich.edu/bitstream/handle/2027.42/108352/ets200453.pdf?sequence%3D1",
    "https://dl.icdst.org/pdfs/files1/444fad619d2795beb2aad55aac4bd4eb.pdf",
    "https://dl.icdst.org/pdfs/files1/7e9bd5801e72bf80a66e4b3fd0b06c50.pdf",
    "https://doran-ece.com/app/uploads/sites/2/2021/06/Jean-Piagets-Constructivist-Theory-of-Learning-and-Its-Application-in-Teaching-Doran-International-ECE.pdf",
    "https://edtechbooks.org/studentguide/constructivism",
    "https://education.nsw.gov.au/campaigns/inclusive-practice-hub/primary-school/common-needs/attention/evidence-based-strategies",
    "https://en.wikipedia.org/wiki/Constructivism",
    "https://en.wikipedia.org/wiki/Constructivism\\_(philosophy\\_of\\_education",
    "https://en.wikipedia.org/wiki/Constructivism_%28philosophy_of_education%29",
    "https://en.wikipedia.org/wiki/Constructivism_(philosophy_of_education",
    "https://en.wikipedia.org/wiki/Meaningful_learning",
    "https://en.wikipedia.org/wiki/Neo-Piagetian_theories_of_cognitive_development",
    "https://en.wikipedia.org/wiki/Piaget%27s_theory_of_cognitive_development",
    "https://en.wikipedia.org/wiki/Piaget%27s_theory_of_cognitive_development#:~:text=above%20their%20level.-,Four%20stages%20of%20development,stage%2C%20and%20formal%20operational%20stage.",
    "https://en.wikipedia.org/wiki/Social_cognitive_theory",
    "https://en.wikipedia.org/wiki/Zone_of_proximal_development",
    "https://eric.ed.gov/?id=EJ1274368",
    "https://files.eric.ed.gov/fulltext/EJ1090277.pdf",
    "https://foundations.ed.brocku.ca/winter_term/week14/9",
    "https://gprjournals.org/journals/index.php/jetm/article/download/199/231/667",
    "https://gsi.berkeley.edu/gsi-guide-contents/learning-theory-research/cognitive-constructivism",
    "https://helpfulprofessor.com/piaget-vs-vygotsky",
    "https://icenet.blog/2021/10/05/education-theory-made-practical-volume-5-part-9",
    "https://indianmentalhealth.com/pdf/2022/vol9-issue3/4-Review-Paper-2.pdf",
    "https://lchc.ucsd.edu/MCA/Mail/xmcamail.2011_04.dir/pdfmkn1hFH60m.pdf",
    "https://library.fiveable.me/classroom-management/unit-2/cognitive-constructivist-theories/study-guide/ifrnX5My7NOAJX4u",
    "https://library.fiveable.me/key-terms/developmental-psychology/dynamic-systems-theory",
    "https://library.fiveable.me/key-terms/developmental-psychology/dynamic-systems-theory#:~:text=Dynamic%20Systems%20Theory%20implies%20a,explore%20their%20surroundings%20more%20effectively.",
    "https://lxdlearningexperiencedesign.com/learning-theory/constructivism-learning-theory",
    "https://medcerts.com/blog/game-based-learning-key-benefits-examples",
    "https://media.lanecc.edu/users/kime/Ch9Piaget.pdf",
    "https://mybrightwheel.com/blog/childs-memory",
    "https://ojs.mahadewa.ac.id/index.php/ijed/article/view/4148",
    "https://open.library.okstate.edu/foundationsofeducationaltechnology/chapter/2-cognitive-development-the-theory-of-jean-piaget",
    "https://openbooks.library.baylor.edu/lifespanhumandevelopment/chapter/chapter-9-3-vygotskys-sociocultural-theory",
    "https://ottheory.com/therapy-model/dynamic-systems-theory-model-visual-perception-development",
    "https://oxfordlearning.com/nine-reasons-kids-struggle-with-paying-attention-in-class",
    "https://playlearnthrive.com/stages-of-play-jean-piagets-theory",
    "https://pmc.ncbi.nlm.nih.gov/articles/PMC10086333",
    "https://pmc.ncbi.nlm.nih.gov/articles/PMC10442055",
    "https://pmc.ncbi.nlm.nih.gov/articles/PMC11018941",
    "https://pmc.ncbi.nlm.nih.gov/articles/PMC4207727",
    "https://pmc.ncbi.nlm.nih.gov/articles/PMC6528818",
    "https://positivepsychology.com/piaget-stages-theory",
    "https://psychologywriting.com/piagets-and-vygotskys-theories-of-cognitive-development",
    "https://psychologywriting.com/piagets-vygotskys-and-scaffolding-theories",
    "https://psychologywriting.com/vygotskys-and-piagets-theories-comparison",
    "https://quizlet.com/study-guides/ausubel-s-meaningful-verbal-learning-theory-31f50296-fd0f-4588-97ec-1c96ad17a543",
    "https://research.rug.nl/files/250864506/A_dynamic_systems_model_of_basic_developmental_mechanisms.pdf",
    "https://ris.utwente.nl/ws/portalfiles/portal/16046691/selective_attention.pdf",
    "https://socialsci.libretexts.org/Courses/Pittsburg_State_University/The_Developing_Child/12%3A_Cognitive_Development_in_Infancy_and_Toddlerhood/12.04%3A_Cognitive_Processes/12.4.02%3A_Attention",
    "https://southcountychildandfamily.com/resources/executive-functions/sustained-attention",
    "https://strategiesforlearning.com/strategies-for-enhancing-working-memory",
    "https://teamgymshorts4.weebly.com/criticisms-of-piagetrsquos-theory.html",
    "https://thedecisionlab.com/reference-guide/neuroscience/zone-of-proximal-development",
    "https://theeducationhub.org.nz/vygotskys-philosophy-of-education",
    "https://uwaterloo.ca/chem13-news-magazine/november-2014/recommended/why-educational-research-matters-you-rote-vs-meaningful",
    "https://www.aph.org/blog/learning-through-games-at-home",
    "https://www.atlantis-press.com/article/126012468.pdf",
    "https://www.bircu-journal.com/index.php/birci/article/view/1082",
    "https://www.btbpsychology.com/blog/working-memory-strategies-for-children",
    "https://www.communityplaythings.com/resources/articles/constructive-play",
    "https://www.devon.gov.uk/support-schools-settings/send/educational-psychology/resources/devon-psychology-in-action/memory-and-processing",
    "https://www.earlyyears.tv/piagets-cognitive-stages-game",
    "https://www.ebsco.com/research-starters/education/game-based-learning",
    "https://www.ebsco.com/research-starters/education/sociocultural-theory",
    "https://www.edutopia.org/discussion/7-ways-increase-students-attention-span",
    "https://www.etsu.edu/teaching/resources/more_resources/vygotsky.php",
    "https://www.expressable.com/learning-center/tips-and-resources/how-to-help-your-child-with-attention-problems",
    "https://www.faithwest.org/5-strategies-to-improve-your-child-s-focus-and-attention-span",
    "https://www.frontiersin.org/journals/education/articles/10.3389/feduc.2018.00038/full",
    "https://www.frontiersin.org/journals/education/articles/10.3389/feduc.2021.660376/full",
    "https://www.frontiersin.org/journals/education/articles/10.3389/feduc.2024.1337716/full",
    "https://www.frontiersin.org/journals/psychology/articles/10.3389/fpsyg.2023.1105806/full",
    "https://www.gowriensw.com.au/thought-leadership/piaget-theory",
    "https://www.gowriensw.com.au/thought-leadership/vygotsky-theory",
    "https://www.gowriensw.com.au/thought-leadership/vygotsky-theory#:~:text=Vygotsky's%20sociocultural%20theory%20about%20child,building%20knowledge%20and%20understanding%20concepts.",
    "https://www.healthline.com/health/childrens-health/concrete-operational-stage",
    "https://www.hilarispublisher.com/open-access/the-cognitive-development-of-children-from-piaget-to-modern-theories-103064.html",
    "https://www.hilarispublisher.com/open-access/the-cognitive-development-of-children-from-piaget-to-modern-theories-103064.html#:~:text=Some%20of%20the%20modern%20theories,%2C%20environment%2C%20and%20individual%20experiences.",
    "https://www.jackrabbitcare.com/blog/educational-activities-to-accelerate-early-learning",
    "https://www.khanacademy.org/science/health-and-medicine/executive-systems-of-the-brain/cognition-lesson/v/piagets-stages-of-cognitive-development",
    "https://www.learningbp.com/meaningful-learning-ausubel-theory",
    "https://www.mcw.edu/-/media/MCW/Education/Academic-Affairs/OEI/Faculty-Quick-Guides/Sociocultural-Theory-of-Cognitive-Development.pdf",
    "https://www.med.upenn.edu/hbhe4/part3-ch8-key-constructs.shtml",
    "https://www.myteachingcupboard.com/blog/developmental-stages-of-play-piaget",
    "https://www.ncbi.nlm.nih.gov/books/NBK448206",
    "https://www.nhsggc.org.uk/kids/resources/ot-activityinformation-sheets/attention-and-concentration",
    "https://www.nimh.nih.gov/health/topics/attention-deficit-hyperactivity-disorder-adhd",
    "https://www.nu.edu/blog/what-is-constructivism-in-education",
    "https://www.pbs.org/parents/thrive/tips-for-helping-your-child-focus-and-concentrate",
    "https://www.people.wm.edu/~mxtsch/Teaching/JCPE/Volume1/JCPE_2008-01-09.pdf",
    "https://www.psychologicalscience.org/observer/jean-piaget",
    "https://www.reddit.com/r/ScienceBasedParenting/comments/12qqkqy/6_ways_to_improve_your_childs_focus_and",
    "https://www.researchgate.net/profile/Armando-Machado/publication/232556312_In_Defense_of_Piaget%27s_Theory_A_Reply_to_10_Common_Criticisms/links/09e41511a75a9d34c3000000/In-Defense-of-Piagets-Theory-A-Reply-to-10-Common-Criticisms.pdf",
    "https://www.researchgate.net/publication/227086462_Effectiveness_of_Game-Based_Learning_Influence_of_Cognitive_Style",
    "https://www.researchgate.net/publication/378071316_Constructivism_in_Education_Exploring_the_Contributions_of_Piaget_Vygotsky_and_Bruner",
    "https://www.researchgate.net/publication/391138275_The_Impact_of_Game-Based_Learning_Science_for_Kids_on_the_Development_of_Logical_Thinking_in_Children_Aged_5-6_Years",
    "https://www.researchgate.net/publication/6949000_The_Development_of_Sustained_Attention_in_Children_The_Effect_of_Age_and_Task_Load",
    "https://www.simplypsychology.org/constructivism.html",
    "https://www.simplypsychology.org/piaget-vs-vygotsky.html",
    "https://www.simplypsychology.org/piaget.html",
    "https://www.simplypsychology.org/preoperational.html",
    "https://www.simplypsychology.org/vygotsky.html",
    "https://www.simplypsychology.org/zone-of-proximal-development.html",
    "https://www.structural-learning.com/post/vygotskys-theory",
    "https://www.tandfonline.com/doi/full/10.1080/2331186X.2024.2449280",
    "https://www.vaia.com/en-us/explanations/psychology/social-context-of-behaviour/piaget-vs-vygotsky",
    "https://www.verywellmind.com/concrete-operational-stage-of-cognitive-development-2795458"
  ],
  "summary_citations": [
    "http://fountainmagazine.com/2004/issue-48-october-december-2004/constructivism-in-piaget-and-vygotsky",
    "https://accounts.google.com/SignOutOptions?hl=zh-CN&continue=https://gemini.google.com/&ec=GBRAkgU",
    "https://acrl.ala.org/IS/wp-content/uploads/2014/05/spring2015.pdf",
    "https://brill.com/display/book/9789087903817/BP000005.pdf",
    "https://cdforskning.no/cdf/catalog/view/130/647/4644",
    "https://childdevelopment.com.au/areas-of-concern/working-memory",
    "https://childmind.org/article/not-all-attention-problems-are-adhd",
    "https://cornerstone.lib.mnsu.edu/cgi/viewcontent.cgi?article=1003&context=isalt_resources",
    "https://cornerstone.lib.mnsu.edu/cgi/viewcontent.cgi?article=1138&context=all",
    "https://courses.lumenlearning.com/adolescent/chapter/psychological-constructivism-piagets-theories",
    "https://deepblue.lib.umich.edu/bitstream/handle/2027.42/108352/ets200453.pdf?sequence%3D1",
    "https://dl.icdst.org/pdfs/files1/444fad619d2795beb2aad55aac4bd4eb.pdf",
    "https://dl.icdst.org/pdfs/files1/7e9bd5801e72bf80a66e4b3fd0b06c50.pdf",
    "https://doran-ece.com/app/uploads/sites/2/2021/06/Jean-Piagets-Constructivist-Theory-of-Learning-and-Its-Application-in-Teaching-Doran-International-ECE.pdf",
    "https://edtechbooks.org/studentguide/constructivism",
    "https://education.nsw.gov.au/campaigns/inclusive-practice-hub/primary-school/common-needs/attention/evidence-based-strategies",
    "https://en.wikipedia.org/wiki/Constructivism",
    "https://en.wikipedia.org/wiki/Constructivism\\_(philosophy\\_of\\_education",
    "https://en.wikipedia.org/wiki/Constructivism_%28philosophy_of_education%29",
    "https://en.wikipedia.org/wiki/Constructivism_(philosophy_of_education",
    "https://en.wikipedia.org/wiki/Meaningful_learning",
    "https://en.wikipedia.org/wiki/Neo-Piagetian_theories_of_cognitive_development",
    "https://en.wikipedia.org/wiki/Piaget%27s_theory_of_cognitive_development",
    "https://en.wikipedia.org/wiki/Piaget%27s_theory_of_cognitive_development#:~:text=above%20their%20level.-,Four%20stages%20of%20development,stage%2C%20and%20formal%20operational%20stage.",
    "https://en.wikipedia.org/wiki/Social_cognitive_theory",
    "https://en.wikipedia.org/wiki/Zone_of_proximal_development",
    "https://eric.ed.gov/?id=EJ1274368",
    "https://files.eric.ed.gov/fulltext/EJ1090277.pdf",
    "https://foundations.ed.brocku.ca/winter_term/week14/9",
    "https://gprjournals.org/journals/index.php/jetm/article/download/199/231/667",
    "https://gsi.berkeley.edu/gsi-guide-contents/learning-theory-research/cognitive-constructivism",
    "https://helpfulprofessor.com/piaget-vs-vygotsky",
    "https://icenet.blog/2021/10/05/education-theory-made-practical-volume-5-part-9",
    "https://indianmentalhealth.com/pdf/2022/vol9-issue3/4-Review-Paper-2.pdf",
    "https://lchc.ucsd.edu/MCA/Mail/xmcamail.2011_04.dir/pdfmkn1hFH60m.pdf",
    "https://library.fiveable.me/classroom-management/unit-2/cognitive-constructivist-theories/study-guide/ifrnX5My7NOAJX4u",
    "https://library.fiveable.me/key-terms/developmental-psychology/dynamic-systems-theory",
    "https://library.fiveable.me/key-terms/developmental-psychology/dynamic-systems-theory#:~:text=Dynamic%20Systems%20Theory%20implies%20a,explore%20their%20surroundings%20more%20effectively.",
    "https://lxdlearningexperiencedesign.com/learning-theory/constructivism-learning-theory",
    "https://medcerts.com/blog/game-based-learning-key-benefits-examples",
    "https://media.lanecc.edu/users/kime/Ch9Piaget.pdf",
    "https://mybrightwheel.com/blog/childs-memory",
    "https://ojs.mahadewa.ac.id/index.php/ijed/article/view/4148",
    "https://open.library.okstate.edu/foundationsofeducationaltechnology/chapter/2-cognitive-development-the-theory-of-jean-piaget",
    "https://openbooks.library.baylor.edu/lifespanhumandevelopment/chapter/chapter-9-3-vygotskys-sociocultural-theory",
    "https://ottheory.com/therapy-model/dynamic-systems-theory-model-visual-perception-development",
    "https://oxfordlearning.com/nine-reasons-kids-struggle-with-paying-attention-in-class",
    "https://playlearnthrive.com/stages-of-play-jean-piagets-theory",
    "https://pmc.ncbi.nlm.nih.gov/articles/PMC10086333",
    "https://pmc.ncbi.nlm.nih.gov/articles/PMC10442055",
    "https://pmc.ncbi.nlm.nih.gov/articles/PMC11018941",
    "https://pmc.ncbi.nlm.nih.gov/articles/PMC4207727",
    "https://pmc.ncbi.nlm.nih.gov/articles/PMC6528818",
    "https://positivepsychology.com/piaget-stages-theory",
    "https://psychologywriting.com/piagets-and-vygotskys-theories-of-cognitive-development",
    "https://psychologywriting.com/piagets-vygotskys-and-scaffolding-theories",
    "https://psychologywriting.com/vygotskys-and-piagets-theories-comparison",
    "https://quizlet.com/study-guides/ausubel-s-meaningful-verbal-learning-theory-31f50296-fd0f-4588-97ec-1c96ad17a543",
    "https://research.rug.nl/files/250864506/A_dynamic_systems_model_of_basic_developmental_mechanisms.pdf",
    "https://ris.utwente.nl/ws/portalfiles/portal/16046691/selective_attention.pdf",
    "https://socialsci.libretexts.org/Courses/Pittsburg_State_University/The_Developing_Child/12%3A_Cognitive_Development_in_Infancy_and_Toddlerhood/12.04%3A_Cognitive_Processes/12.4.02%3A_Attention",
    "https://southcountychildandfamily.com/resources/executive-functions/sustained-attention",
    "https://strategiesforlearning.com/strategies-for-enhancing-working-memory",
    "https://teamgymshorts4.weebly.com/criticisms-of-piagetrsquos-theory.html",
    "https://thedecisionlab.com/reference-guide/neuroscience/zone-of-proximal-development",
    "https://theeducationhub.org.nz/vygotskys-philosophy-of-education",
    "https://uwaterloo.ca/chem13-news-magazine/november-2014/recommended/why-educational-research-matters-you-rote-vs-meaningful",
    "https://www.aph.org/blog/learning-through-games-at-home",
    "https://www.atlantis-press.com/article/126012468.pdf",
    "https://www.bircu-journal.com/index.php/birci/article/view/1082",
    "https://www.btbpsychology.com/blog/working-memory-strategies-for-children",
    "https://www.communityplaythings.com/resources/articles/constructive-play",
    "https://www.devon.gov.uk/support-schools-settings/send/educational-psychology/resources/devon-psychology-in-action/memory-and-processing",
    "https://www.earlyyears.tv/piagets-cognitive-stages-game",
    "https://www.ebsco.com/research-starters/education/game-based-learning",
    "https://www.ebsco.com/research-starters/education/sociocultural-theory",
    "https://www.edutopia.org/discussion/7-ways-increase-students-attention-span",
    "https://www.etsu.edu/teaching/resources/more_resources/vygotsky.php",
    "https://www.expressable.com/learning-center/tips-and-resources/how-to-help-your-child-with-attention-problems",
    "https://www.faithwest.org/5-strategies-to-improve-your-child-s-focus-and-attention-span",
    "https://www.frontiersin.org/journals/education/articles/10.3389/feduc.2018.00038/full",
    "https://www.frontiersin.org/journals/education/articles/10.3389/feduc.2021.660376/full",
    "https://www.frontiersin.org/journals/education/articles/10.3389/feduc.2024.1337716/full",
    "https://www.frontiersin.org/journals/psychology/articles/10.3389/fpsyg.2023.1105806/full",
    "https://www.gowriensw.com.au/thought-leadership/piaget-theory",
    "https://www.gowriensw.com.au/thought-leadership/vygotsky-theory",
    "https://www.gowriensw.com.au/thought-leadership/vygotsky-theory#:~:text=Vygotsky's%20sociocultural%20theory%20about%20child,building%20knowledge%20and%20understanding%20concepts.",
    "https://www.healthline.com/health/childrens-health/concrete-operational-stage",
    "https://www.hilarispublisher.com/open-access/the-cognitive-development-of-children-from-piaget-to-modern-theories-103064.html",
    "https://www.hilarispublisher.com/open-access/the-cognitive-development-of-children-from-piaget-to-modern-theories-103064.html#:~:text=Some%20of%20the%20modern%20theories,%2C%20environment%2C%20and%20individual%20experiences.",
    "https://www.jackrabbitcare.com/blog/educational-activities-to-accelerate-early-learning",
    "https://www.khanacademy.org/science/health-and-medicine/executive-systems-of-the-brain/cognition-lesson/v/piagets-stages-of-cognitive-development",
    "https://www.learningbp.com/meaningful-learning-ausubel-theory",
    "https://www.mcw.edu/-/media/MCW/Education/Academic-Affairs/OEI/Faculty-Quick-Guides/Sociocultural-Theory-of-Cognitive-Development.pdf",
    "https://www.med.upenn.edu/hbhe4/part3-ch8-key-constructs.shtml",
    "https://www.myteachingcupboard.com/blog/developmental-stages-of-play-piaget",
    "https://www.ncbi.nlm.nih.gov/books/NBK448206",
    "https://www.nhsggc.org.uk/kids/resources/ot-activityinformation-sheets/attention-and-concentration",
    "https://www.nimh.nih.gov/health/topics/attention-deficit-hyperactivity-disorder-adhd",
    "https://www.nu.edu/blog/what-is-constructivism-in-education",
    "https://www.pbs.org/parents/thrive/tips-for-helping-your-child-focus-and-concentrate",
    "https://www.people.wm.edu/~mxtsch/Teaching/JCPE/Volume1/JCPE_2008-01-09.pdf",
    "https://www.psychologicalscience.org/observer/jean-piaget",
    "https://www.reddit.com/r/ScienceBasedParenting/comments/12qqkqy/6_ways_to_improve_your_childs_focus_and",
    "https://www.researchgate.net/profile/Armando-Machado/publication/232556312_In_Defense_of_Piaget%27s_Theory_A_Reply_to_10_Common_Criticisms/links/09e41511a75a9d34c3000000/In-Defense-of-Piagets-Theory-A-Reply-to-10-Common-Criticisms.pdf",
    "https://www.researchgate.net/publication/227086462_Effectiveness_of_Game-Based_Learning_Influence_of_Cognitive_Style",
    "https://www.researchgate.net/publication/378071316_Constructivism_in_Education_Exploring_the_Contributions_of_Piaget_Vygotsky_and_Bruner",
    "https://www.researchgate.net/publication/391138275_The_Impact_of_Game-Based_Learning_Science_for_Kids_on_the_Development_of_Logical_Thinking_in_Children_Aged_5-6_Years",
    "https://www.researchgate.net/publication/6949000_The_Development_of_Sustained_Attention_in_Children_The_Effect_of_Age_and_Task_Load",
    "https://www.simplypsychology.org/constructivism.html",
    "https://www.simplypsychology.org/piaget-vs-vygotsky.html",
    "https://www.simplypsychology.org/piaget.html",
    "https://www.simplypsychology.org/preoperational.html",
    "https://www.simplypsychology.org/vygotsky.html",
    "https://www.simplypsychology.org/zone-of-proximal-development.html",
    "https://www.structural-learning.com/post/vygotskys-theory",
    "https://www.tandfonline.com/doi/full/10.1080/2331186X.2024.2449280",
    "https://www.vaia.com/en-us/explanations/psychology/social-context-of-behaviour/piaget-vs-vygotsky",
    "https://www.verywellmind.com/concrete-operational-stage-of-cognitive-development-2795458"
  ]
}