{
  "query": "How to prevent and treat eczema through diet and exercise",
  "chain_of_research": {
    "plan_1": {
      "title": "Understanding Eczema\nResearch Approach\nNext Steps",
      "description": "I'm starting my research by building a foundational understanding of eczema, also known as atopic dermatitis. This involves defining the condition, identifying its symptoms, exploring its causes, and recognizing common triggers. My initial approach will be to gather broad information and then refine my searches for more specific details.\nMy strategy is to address the research points systematically, beginning with the fundamental aspects of eczema before delving into the specifics of diet and exercise. I'll be looking for connections between different areas of research, such as the gut-skin axis, as I gather information.\nI'll be using search queries to find reliable sources like the National Eczema Association, the American Academy of Dermatology, and PubMed articles. Once I identify these sources, I'll delve deeper into their content to extract detailed information."
    },
    "search_1": [
      "https://www.aafp.org/pubs/afp/issues/2020/0515/p590.html",
      "https://pmc.ncbi.nlm.nih.gov/articles/PMC6399565",
      "https://www.aaaai.org/tools-for-the-public/conditions-library/allergies/eczema-(atopic-dermatitis)-overview",
      "https://www.mayoclinic.org/diseases-conditions/atopic-dermatitis-eczema/symptoms-causes/syc-20353273",
      "https://pmc.ncbi.nlm.nih.gov/articles/PMC11625510",
      "https://www.aad.org/public/diseases/eczema/types/atopic-dermatitis",
      "https://www.ncbi.nlm.nih.gov/books/NBK538209",
      "https://nationaleczema.org/types-of-eczema/atopic-dermatitis/#:~:text=Eczema%20is%20a%20term%20for,predisposition%20to%20the%20skin%20condition.",
      "https://publications.aap.org/pediatrics/article/155/6/e2025071812/201952/Atopic-Dermatitis-Update-on-Skin-Directed",
      "https://pubmed.ncbi.nlm.nih.gov/25610977",
      "https://nationaleczema.org/types-of-eczema/atopic-dermatitis",
      "https://www.ncbi.nlm.nih.gov/books/NBK448071",
      "https://www.nhs.uk/conditions/atopic-eczema",
      "https://www.aafp.org/pubs/afp/issues/2012/0701/p35.html/1000",
      "https://nationaleczema.org/types-of-eczema",
      "https://nationaleczema.org/eczema",
      "https://pmc.ncbi.nlm.nih.gov/articles/PMC10931328",
      "https://pubmed.ncbi.nlm.nih.gov/16309494"
    ],
    "observation_1": "I've gathered initial information on eczema, primarily focusing on atopic dermatitis, which is the most common type. I've learned that eczema is a chronic inflammatory skin condition characterized by dry, itchy, and inflamed skin, often appearing as rashes or scaly patches. It's not contagious and typically begins in childhood, though it can persist into adulthood. The exact cause is unknown, but it's understood to be a complex interplay of genetic predisposition, environmental factors, and immune system dysregulation. A key insight is the role of a weakened skin barrier, often due to mutations in the filaggrin gene, which makes the skin more susceptible to moisture loss and the entry of irritants and allergens. This can lead to an overactive immune response and inflammation. Common triggers include rough fabrics, dry skin, infections, heat and sweat, stress, cleaning products, dust mites, pet dander, mold, pollen, tobacco smoke, cold and dry air, and fragrances. The 'itch-scratch cycle' is a significant factor, where scratching exacerbates the condition and can lead to further skin damage and infections.",
    "plan_2": {
      "title": "Eczema and Associated Conditions\nInitial Treatment and Management Insights\nNext Steps: Diet and the Gut-Skin Axis",
      "description": "I've also noted that eczema often co-occurs with other allergic conditions, forming what's known as the 'atopic march,' which includes asthma, hay fever (allergic rhinitis), and food allergies. This suggests a systemic allergic predisposition in affected individuals. Complications can include chronic itchy skin, skin infections, and sleep problems due to intense itching.\nWhile the focus of this research is on diet and exercise, I've already encountered some general management strategies. These include liberal application of fragrance-free emollients (moisturizers) to help retain moisture and strengthen the skin barrier, regular lukewarm baths with soap-free cleansers, and avoiding known triggers. Topical corticosteroids are also mentioned as a first-line treatment for flare-ups.\nMy next steps will delve into the relationship between diet and eczema. I'll be looking for information on common food triggers, the principles of anti-inflammatory and elimination diets, and the role of specific nutrients and probiotics. I'll also continue to explore the concept of the gut-skin axis, as initial findings suggest a connection between the microbiome and skin health."
    },
    "search_2": [
      "https://www.medicalnewstoday.com/articles/eczema-gut-health",
      "https://health.clevelandclinic.org/eczema-diet",
      "https://www.va.gov/WHOLEHEALTHLIBRARY/tools/supplements-for-skin-health.asp",
      "https://www.medicalnewstoday.com/articles/320855",
      "https://www.pierrefabreeczemafoundation.org/en/support/useful-advices/diet-and-eczema",
      "https://www.altitudedermatology.com/blog-post/diet-and-managing-eczema",
      "https://www.nuffieldhealth.com/article/eczema-5-ways-changing-your-diet-could-help",
      "https://www.healthline.com/nutrition/supplements-for-eczema",
      "https://www.healthline.com/health/skin-disorders/eczema-diet",
      "https://www.bioderma.co.uk/your-skin/dry-atopic-skin/itchy-and-atopic-skin-how-treat-it/eczema-cure-ideal-diet-children-atopic-skin",
      "https://www.webmd.com/skin-problems-and-treatments/eczema/ss/slideshow-supplements-for-eczema",
      "https://pmc.ncbi.nlm.nih.gov/articles/PMC5006549",
      "https://nationaleczema.org/eczema-management",
      "https://acaai.org/resource/my-child-has-severe-eczema-should-i-eliminate-certain-foods-from-their-diet",
      "https://www.everydayhealth.com/eczema/diet",
      "https://pmc.ncbi.nlm.nih.gov/articles/PMC3970830",
      "https://www.ncbi.nlm.nih.gov/books/NBK424896",
      "https://www.rch.org.au/uploadedFiles/Main/Content/allergy/Eczema%20Food%20Allergies%20Other%20Triggers(1).pdf",
      "https://www.everydayhealth.com/eczema/tips-using-elimination-diet-determine-root-cause-eczema",
      "https://pmc.ncbi.nlm.nih.gov/articles/PMC6517242",
      "https://pubmed.ncbi.nlm.nih.gov/30480774",
      "https://pubmed.ncbi.nlm.nih.gov/11069570",
      "https://www.ihealthunifiedcare.com/articles/the-eczema-elimination-diet",
      "https://pubmed.ncbi.nlm.nih.gov/35978397",
      "https://www.ruh.nhs.uk/patients/patient_information/PAE003_Diet_and_eczema.pdf",
      "https://www.niaid.nih.gov/news-events/niaid-discovery-leads-novel-probiotic-eczema",
      "https://www.medicalnewstoday.com/articles/food-elimination-diet-children-eczema",
      "https://pubmed.ncbi.nlm.nih.gov/30465329",
      "https://www.nhs.uk/conditions/atopic-eczema",
      "https://www.mayoclinic.org/diseases-conditions/atopic-dermatitis-eczema/symptoms-causes/syc-20353273",
      "https://pmc.ncbi.nlm.nih.gov/articles/PMC6399565",
      "https://nationaleczema.org/types-of-eczema/atopic-dermatitis"
    ],
    "observation_2": "I've made significant progress in understanding the role of diet in eczema management. I've identified common food triggers such as dairy, eggs, peanuts, soy, wheat, fish, and shellfish, with some sources also mentioning nightshades, citrus fruits, and foods high in nickel or salicylates. A key insight is that food triggers are highly individual, emphasizing the need for personalized approaches. Regarding dietary strategies, anti-inflammatory diets like the Mediterranean diet, rich in whole foods, fruits, vegetables, and omega-3 fatty acids, are generally recommended. While elimination diets can be helpful for confirmed food allergies, they are not a universal solution and should be undertaken with medical supervision to prevent nutritional deficiencies and the potential development of new allergies.",
    "plan_3": {
      "title": "Nutrients and the Gut-Skin Axis\nNext Steps: Exercise and Deeper Dive into Gut-Skin Connection",
      "description": "My research has also shed light on various nutrients and supplements that may benefit eczema, including omega-3 fatty acids, vitamin D, vitamin E, zinc, and probiotics. The evidence for their effectiveness varies, with some showing promise but requiring further research for definitive recommendations. The role of probiotics, in particular, appears mixed, with some studies suggesting benefits, especially in prevention, while others show little effect on existing eczema. This ties into the emerging understanding of the gut-skin axis, where an imbalanced gut microbiome can influence skin health and inflammation, reinforcing the importance of a holistic approach to diet.\nMy next steps will focus on exploring the role of exercise in eczema management, investigating both its benefits and potential drawbacks. I'll also continue to delve deeper into the intricacies of the gut-skin axis to fully understand its implications for eczema. Additionally, I will begin to compare the strength of evidence for dietary versus exercise interventions to provide a comprehensive overview."
    },
    "search_3": [
      "https://www.prosperabiotech.com/en/blog/eczema-and-exercise-treatment-and-causes",
      "https://www.allergy.org.au/patients/fast-facts/eczema-and-food-allergy",
      "https://allergyasthmanetwork.org/news/eczema-and-exercise/#:~:text=Swimming%20is%20one%20of%20the,for%20many%20people%20with%20eczema.",
      "https://www.medicalnewstoday.com/articles/320855",
      "https://pmc.ncbi.nlm.nih.gov/articles/PMC5216171",
      "https://www.webmd.com/skin-problems-and-treatments/eczema/atopic-dermatitis-best-exercises",
      "https://nationaleczema.org/eczema-management/diet-nutrition",
      "https://www.dermatologytimes.com/view/the-role-of-exercise-in-atopic-dermatitis-spontaneous-urticaria",
      "https://www.ncbi.nlm.nih.gov/books/NBK260249",
      "https://deannaminich.com/8-evidence-based-holistic-approaches-to-eczema",
      "https://www.researchgate.net/publication/378748256_Dietary_Interventions_in_Atopic_Dermatitis_A_Comprehensive_Scoping_Review_and_Analysis",
      "https://www.healthychildren.org/English/health-issues/conditions/skin/Pages/sports-and-eczema-how-to-help-your-child-prevent-flare-ups.aspx",
      "https://allergyasthmanetwork.org/news/eczema-and-exercise",
      "https://nationaleczema.org/blog/exercising-eczema",
      "https://www.medicalnewstoday.com/articles/exercising-with-eczema",
      "https://www.healthcentral.com/condition/eczema/how-do-you-manage-eczema-when-exercising",
      "https://nationaleczema.org/blog/eczema-exercise",
      "https://eczema.org/information-and-advice/living-with-eczema/exercise-and-eczema",
      "https://www.webmd.com/skin-problems-and-treatments/eczema/eczema-exercise-tips",
      "https://www.tandfonline.com/doi/full/10.1080/19490976.2025.2473524",
      "https://www.mdpi.com/2076-2607/9/2/353",
      "https://pmc.ncbi.nlm.nih.gov/articles/PMC6021588",
      "https://www.mdpi.com/1422-0067/22/8/4228",
      "https://www.healthline.com/health/eczema/how-does-the-gut-skin-axis-affect-eczema",
      "https://www.owlstonemedical.com/about/blog/2024/oct/01/how-the-gut-microbiome-influences-skin-health-exploring-the-gut-skin-axis",
      "https://nationaleczema.org/eczema-management",
      "https://www.medicalnewstoday.com/articles/eczema-gut-health",
      "https://www.everydayhealth.com/eczema/diet",
      "https://pmc.ncbi.nlm.nih.gov/articles/PMC5006549"
    ],
    "observation_3": "I've gathered substantial information on how exercise impacts eczema. A significant benefit is stress reduction, which is a known trigger for flare-ups. Exercise also contributes to overall health, indirectly supporting skin well-being. However, I've also identified potential drawbacks: sweat, heat, and friction from clothing can exacerbate eczema symptoms. The salt in sweat, in particular, can irritate and dehydrate sensitive skin. To mitigate these issues, I've found several best practices: opting for low-impact activities like yoga or swimming, wearing loose-fitting cotton clothing, staying well-hydrated, taking breaks to cool down, gently patting away sweat, and moisturizing both before and immediately after exercise. For swimming, pre-moisturizing acts as a barrier, and rinsing off chlorine post-swim is crucial.",
    "plan_4": {
      "title": "Advancing Understanding of the Gut-Skin Axis\nNext Steps: Critiquing Universal Diets and Evidence Comparison",
      "description": "My understanding of the gut-skin axis has progressed. I now have a foundational grasp of how gut health, specifically the gut microbiome, can influence the immune system and inflammation, thereby impacting eczema. This reinforces the interconnectedness of internal health and skin conditions.\nMy next steps will focus on two key areas. First, I will seek out more explicit critiques of a 'one-size-fits-all' eczema diet, building on the existing understanding that food triggers are highly individual. Second, I will conduct more targeted research to thoroughly compare the scientific evidence supporting dietary interventions versus exercise interventions for eczema management. This will allow me to provide a more nuanced perspective on the relative strengths of each approach. Finally, I will begin synthesizing all gathered information to formulate holistic lifestyle strategies that integrate diet, exercise, and skincare."
    },
    "search_4": [
      "https://vibrantskinbar.com/blog/holistic-eczema-treatment",
      "https://nationaleczema.org/treatments/complementary-alternative",
      "https://abbyroseskincare.com/blogs/news/a-holistic-approach-to-managing-eczema",
      "https://www.chloemcleod.com/holistic-approach-to-managing-eczema-from-diet-to-skincare-products-to-environmental-factors",
      "https://pmc.ncbi.nlm.nih.gov/articles/PMC4518179",
      "https://www.valleyskininstitute.com/eczema-triggers-the-worst-foods-you-need-to-avoid",
      "https://pmc.ncbi.nlm.nih.gov/articles/PMC10755759",
      "https://www.researchgate.net/publication/378748256_Dietary_Interventions_in_Atopic_Dermatitis_A_Comprehensive_Scoping_Review_and_Analysis",
      "https://www.healthline.com/health/skin-disorders/eczema-diet",
      "https://www.mamahealth.com/hand-eczema/handling-eczema-diet-complete-guide",
      "https://www.rch.org.au/uploadedFiles/Main/Content/allergy/Eczema%20Food%20Allergies%20Other%20Triggers(1).pdf",
      "https://www.researchgate.net/publication/303182290_Atopic_Dermatitis_Is_Associated_with_Less_Physical_Activity_in_US_Adults",
      "https://www.everydayhealth.com/eczema/diet",
      "https://pmc.ncbi.nlm.nih.gov/articles/PMC6885041",
      "https://hub.eaaci.org/resources_papers/a-systematic-review-and-meta-analysis-of-nutritional-and-dietary-interventions-in-randomized-controlled-trials-for-skin-symptoms-in-children-with-atopic-dermatitis-and-without-food-allergy-an-eaaci-t",
      "https://nationaleczema.org/blog/food-elimination-diet-for-atopic-dermatitis",
      "https://academic.oup.com/bjd/article/188/6/718/6880686",
      "https://www.pierrefabreeczemafoundation.org/en/support/useful-advices/diet-and-eczema",
      "https://nationaleczema.org/eczema-management/diet-nutrition",
      "https://www.mayoclinic.org/diseases-conditions/atopic-dermatitis-eczema/diagnosis-treatment/drc-20353279",
      "https://pmc.ncbi.nlm.nih.gov/articles/PMC3970830",
      "https://nationaleczema.org/blog/exercising-eczema",
      "https://www.everydayhealth.com/eczema/tips-using-elimination-diet-determine-root-cause-eczema",
      "https://www.medicalnewstoday.com/articles/320855",
      "https://www.mdpi.com/2076-2607/9/2/353"
    ],
    "observation_4": "I've made significant progress in understanding various aspects of eczema management. I have a comprehensive definition of eczema, including its symptoms, causes, and triggers. My research into diet has provided detailed information on common food triggers, the benefits and considerations of anti-inflammatory and elimination diets, and the role of specific nutrients and probiotics. Similarly, I've explored the dual impact of exercise, noting both its benefits in stress reduction and potential drawbacks related to sweat and heat, along with best practices to mitigate these issues. I also have a solid understanding of the gut-skin axis and its relevance to eczema, and the personalized nature of food triggers has consistently highlighted the critique of a 'one-size-fits-all' diet.",
    "plan_5": {
      "title": "Addressing Information Gaps and Next Steps",
      "description": "While I have a strong foundation, I'm now focusing on directly comparing the evidence for dietary and exercise interventions, as this is an area where I need to synthesize information more directly. I will be looking for studies that specifically compare these approaches. Additionally, I will begin to formulate holistic lifestyle strategies by integrating all the information I've gathered on diet, exercise, and skincare. My next actions will involve targeted searches for comparative studies and a thorough review of existing information to build these comprehensive recommendations."
    },
    "search_5": [
      "https://www.droracle.ai/articles/194160/holistic-approches-to-severe-eczema",
      "https://www.mayoclinic.org/diseases-conditions/atopic-dermatitis-eczema/diagnosis-treatment/drc-20353279",
      "https://publications.aap.org/pediatrics/article/155/6/e2025071812/201952/Atopic-Dermatitis-Update-on-Skin-Directed",
      "https://www.aap.org/en/patient-care/atopic-dermatitis/treatment-of-atopic-dermatitis",
      "https://www.medicalnewstoday.com/articles/320855",
      "https://www.aad.org/member/clinical-quality/guidelines/atopic-dermatitis",
      "https://nationaleczema.org/eczema-management/diet-nutrition",
      "https://pmc.ncbi.nlm.nih.gov/articles/PMC5582672",
      "https://cdn.fortuneonline.org/articles/lifestyle-factors-in-the-clinical-manifestation-and-management-of-atopic-dermatitis.pdf",
      "https://www.webmd.com/skin-problems-and-treatments/eczema/atopic-dermatitis-best-exercises",
      "https://pmc.ncbi.nlm.nih.gov/articles/PMC11870655",
      "https://pmc.ncbi.nlm.nih.gov/articles/PMC5736303",
      "https://pmc.ncbi.nlm.nih.gov/articles/PMC6327646",
      "https://karger.com/iaa/article/185/6/545/896421/Dietary-Interventions-in-Atopic-Dermatitis-A",
      "https://academic.oup.com/ced/article/47/8/1523/6692927",
      "https://pmc.ncbi.nlm.nih.gov/articles/PMC9541324",
      "https://www.researchgate.net/publication/338550759_Impact_of_atopic_dermatitis_on_quality_of_life_in_adults_a_systematic_review_and_meta-analysis",
      "https://www.cambridge.org/core/journals/behaviour-change/article/psychological-and-educational-interventions-for-atopic-dermatitis-in-adults-a-systematic-review-and-metaanalysis/DD089BACBE7ABEFAD2FCEC448F54F015",
      "https://www.researchgate.net/publication/378748256_Dietary_Interventions_in_Atopic_Dermatitis_A_Comprehensive_Scoping_Review_and_Analysis",
      "https://pmc.ncbi.nlm.nih.gov/articles/PMC10755759",
      "https://nationaleczema.org/treatments/complementary-alternative",
      "https://www.chloemcleod.com/holistic-approach-to-managing-eczema-from-diet-to-skincare-products-to-environmental-factors"
    ],
    "observation_5": "I've now gathered a comprehensive understanding of eczema, including its definition, symptoms, causes, and triggers. I've explored the nuanced roles of diet and exercise, recognizing that while both are beneficial, their application requires different considerations. Dietary interventions, particularly elimination diets, are highly individualized and necessitate medical supervision to prevent nutritional deficiencies and new allergies. In contrast, exercise is broadly encouraged for its stress-reducing and overall health benefits, with the primary challenge being managing sweat and heat as potential triggers.",
    "plan_6": {
      "title": "Comparing Dietary and Exercise Interventions\nConcluding Research and Report Generation",
      "description": "A key insight from my research is the difference in the evidence base for dietary versus exercise interventions. While both contribute to eczema management, the evidence for dietary changes is more complex and less universally applicable, often requiring a personalized approach. Exercise, on the other hand, offers more straightforward benefits, primarily through stress reduction and general well-being, with practical strategies available to mitigate potential flare-ups from sweat and heat.\nI believe I have reached a point of information saturation, where further general searches are unlikely to yield substantially new insights. I have a solid foundation to construct a comprehensive report that addresses all the user's questions, integrating information on diet, exercise, and the underlying pathophysiology of eczema. My next step is to synthesize all the gathered information and generate the final report."
    }
  },
  "final_report": "# **A Comprehensive Clinical Report on the Prevention and Management of Eczema Through Diet and Exercise**\n\n## **Executive Summary**\n\nAtopic dermatitis (AD), the most common form of eczema, is a chronic, inflammatory skin disease characterized by a defective skin barrier, immune system dysregulation, and an intense itch-scratch cycle. It is not merely a skin condition but a systemic disorder with significant impacts on quality of life, often co-existing with food allergies, asthma, and mental health challenges. While there is no cure, a holistic management paradigm that integrates foundational skincare with strategic lifestyle interventions can significantly improve disease control, reduce the frequency and severity of flares, and enhance overall well-being. This report provides an exhaustive, evidence-based analysis of how diet and exercise can be leveraged to prevent and treat eczema.\n\nThe core of nutritional management is not restrictive elimination but the proactive adoption of an anti-inflammatory dietary pattern, such as the Mediterranean diet. This approach focuses on consuming whole foods rich in omega-3 fatty acids, antioxidants, and fiber, which work to reduce systemic inflammation and support a healthy gut microbiome—a key regulator of immune function now understood to be intricately linked to skin health via the \"gut-skin axis.\" Conversely, the evidence cautions strongly against unsupervised food elimination diets for the general eczema population due to risks of nutritional deficiency and the potential for inducing new, more severe allergies. Such diets should only be considered for a small subset of patients with confirmed, food-triggered AD under strict medical and dietetic supervision.\n\nSimilarly, exercise presents a paradox; its benefits in reducing stress and systemic inflammation are well-established, yet the sweat and heat it generates are potent eczema triggers. The key to harnessing its benefits lies not in avoidance but in strategic management. A framework of \"prepare, manage, and recover\"—involving pre-workout moisturizing, careful selection of low-impact activities and appropriate clothing, active cooling during exercise, and a critical post-workout cleansing and moisturizing routine—allows individuals to remain physically active while minimizing flare-ups.\n\nUltimately, the most effective approach to managing eczema is personalized and integrative. Foundational skincare, including liberal emollient use and gentle cleansing, remains the non-negotiable cornerstone of all treatment. Diet and exercise act as powerful adjuncts that complement conventional medical therapies by addressing the underlying systemic inflammation from within. This report synthesizes the current scientific evidence to provide a comprehensive roadmap for patients and clinicians, emphasizing that through systematic self-monitoring, professional guidance, and consistent application of these principles, individuals with eczema can achieve greater control over their condition and lead healthier, more comfortable lives.\n\n## **Section 1: Understanding Atopic Dermatitis: The Foundation of Disease**\n\nTo effectively prevent and treat atopic dermatitis (AD) through lifestyle interventions, one must first possess a deep understanding of its complex nature. AD is not simply dry skin; it is a chronic, relapsing-remitting inflammatory skin disease rooted in a complex interplay of genetic predisposition, environmental factors, and profound immunological dysfunction.1 This foundational knowledge explains why interventions like diet and exercise, which modulate systemic processes, can have a significant impact.\n\n### **1.1 Defining Eczema: More Than Just Dry Skin**\n\nAtopic dermatitis is the most prevalent of seven distinct types of eczema, a group of conditions that cause inflamed, itchy, and dry skin.3 Its clinical presentation can vary significantly among individuals and across different skin tones. The hallmark symptoms include intense, persistent itching (pruritus) and excessively dry skin (xerosis).5 This leads to an inflamed rash that, on lighter skin, often appears pink or red, while on darker skin tones, it may manifest as purplish, brown, or grayish patches.3 In individuals with brown or Black skin, small, raised bumps (papules) are a common feature, and after a flare resolves, the affected area may show changes in pigmentation, appearing lighter (hypopigmentation) or darker (hyperpigmentation) than the surrounding skin.6\n\nThe condition typically begins in early childhood, with up to 60% of cases developing before the age of one and 90% by the age of five.1 While many children see improvement as they get older, AD can persist into or begin in adulthood.2 It is crucial to note that AD is not contagious; it cannot be transmitted from one person to another.5 Its prevalence is substantial, affecting up to 25% of children and 10% of adults in developed nations, making it a significant public health concern.2\n\n### **1.2 The Pathophysiological Triad: A Defective Barrier, A Dysregulated Immune System, and the Itch-Scratch Cycle**\n\nThe symptoms of AD arise from a confluence of three core pathological processes. Understanding this triad is essential, as effective management strategies must address each component.\n\n#### **The Defective Skin Barrier**\n\nA primary and fundamental defect in AD is a compromised skin barrier. A healthy skin barrier functions like a well-mortared brick wall, keeping moisture in and harmful substances out. In AD, this barrier is often compared to a \"wicker basket,\" porous and inefficient.6 This dysfunction stems from two main sources:\n\n* **Genetic Factors:** A major risk factor for developing AD involves mutations in the gene that codes for filaggrin (FLG), a critical protein responsible for organizing the structural components of the outermost skin layer (the stratum corneum).3 Without sufficient functional filaggrin, the skin's \"bricks\" are disorganized, leading to a weakened barrier.3 However, the presence of an\n  *FLG* mutation is not deterministic; not everyone with the mutation develops AD, and not all AD patients have the mutation, underscoring the disease's multifactorial etiology.13\n* **Lipid Abnormalities:** The \"mortar\" of the skin barrier is composed of lipids, primarily ceramides, cholesterol, and free fatty acids. Patients with AD have been shown to have reduced levels of ceramides, which impairs the skin's ability to retain water, leading to increased transepidermal water loss (TEWL) and the characteristic dryness of the condition.2\n\n#### **Immune System Dysregulation**\n\nThe compromised skin barrier allows environmental irritants, allergens, and microbes to penetrate the skin's deeper layers, where they encounter the immune system.10 In individuals with AD, the immune system is predisposed to overreact, launching an inflammatory cascade.3\n\n* **Type 2 Inflammation:** The immune response in AD is classically dominated by Type 2 inflammation. This pathway is characterized by the overproduction of specific signaling proteins called cytokines, particularly Interleukin-4 (IL-4) and Interleukin-13 (IL-13).2 These cytokines orchestrate the inflammatory response, recruiting immune cells to the skin, promoting the production of IgE antibodies (the type involved in allergic reactions), and paradoxically, further weakening the skin barrier by suppressing the production of filaggrin and antimicrobial peptides.13 This establishes AD as a disease of systemic inflammation with prominent skin manifestations, providing the biological rationale for why systemic interventions like diet and exercise can be effective.\n* **Microbial Imbalance (Dysbiosis):** The skin of AD patients is uniquely susceptible to colonization by the bacterium *Staphylococcus aureus*. Over 90% of individuals with AD have high levels of *S. aureus* on their skin, which displaces beneficial bacteria.2\n  *S. aureus* secretes toxins that directly stimulate inflammation and can exacerbate the disease, contributing to the chronicity and severity of flares.13\n\n#### **The Itch-Scratch Cycle**\n\nPruritus, or itch, is the most common and burdensome symptom of AD.1 The itch associated with eczema is not merely a nuisance; it is a key driver of the disease itself. When an individual scratches, they cause further physical damage to the already fragile skin barrier. This mechanical trauma activates nerve fibers and triggers the release of more inflammatory mediators, which in turn generates more itch.1 This creates a vicious and self-perpetuating \"itch-scratch cycle\".12 Over time, this constant scratching can lead to skin thickening, a process known as lichenification, which results in tough, leathery patches of skin.3 Interrupting this cycle is a primary goal of treatment. Any intervention—whether medical, dietary, or behavioral—that reduces itch is not just providing palliative relief but is actively treating a core mechanism of the disease.\n\n### **1.3 The \"Atopic March\": The Link Between Eczema, Allergies, and Asthma**\n\nThe systemic nature of AD is best illustrated by the concept of the \"atopic march\".2 This term describes the common clinical progression of allergic diseases that often begins in infancy with atopic dermatitis. The defective skin barrier in AD is thought to serve as the initial site of allergic sensitization.3 When environmental allergens (like food particles or pollen) penetrate the compromised skin, they can trigger an immune response that not only causes skin inflammation but also sensitizes the body to that allergen systemically.\n\nThis \"transcutaneous sensitization\" can then lead to the subsequent development of other allergic conditions at different sites, such as food allergies in the gastrointestinal tract, allergic rhinitis (hay fever) in the upper airways, and asthma in the lower airways.2 People with severe AD are at a particularly high risk of developing this constellation of conditions.3 This phenomenon highlights that AD is not an isolated skin ailment but is often the first step in a lifelong journey of atopic disease, emphasizing the importance of effective early management to potentially mitigate this progression. The complexity of triggers—ranging from fabrics and soaps to stress and food—stems from this combination of a genetically susceptible barrier and a dysregulated immune system, explaining why management must be highly personalized.5\n\n## **Section 2: The Gut-Skin Axis: A New Frontier in Eczema Management**\n\nRecent scientific advancements have illuminated a profound connection between the health of the gastrointestinal tract and the skin, a relationship termed the \"gut-skin axis\".16 This bidirectional communication network provides a compelling biological rationale for how dietary interventions can influence the course of atopic dermatitis. Understanding this axis reframes nutritional strategies, moving them from simple trigger avoidance to a more sophisticated approach aimed at modulating systemic inflammation at its source.\n\n### **2.1 The Gut Microbiome's Role in Systemic Immunity**\n\nThe human gut is not merely a digestive organ; it is a primary hub of immunological activity. It is home to the vast majority of the body's immune cells, concentrated in a specialized region known as the gut-associated lymphoid tissue (GALT).18 Residing within the gut is the microbiome—a complex ecosystem of trillions of bacteria, fungi, and other microorganisms.14 From birth, this gut microbiome engages in constant cross-talk with the host's immune system, playing a critical role in its development, maturation, and regulation.18\n\nThis communication is not confined to the gut. Metabolites produced by gut bacteria, such as short-chain fatty acids (SCFAs), can enter the bloodstream and travel to distant organs, including the skin, influencing their local immune environment.21 This systemic reach means that the state of the gut microbiome can have far-reaching effects on the body's overall inflammatory tone, forming the basis of the gut-skin axis.17\n\n### **2.2 Dysbiosis and Atopic Dermatitis: Unraveling the Connection**\n\nDysbiosis is a term used to describe an imbalance in the gut microbiome. This can mean a reduction in microbial diversity, a loss of beneficial bacteria, or an overgrowth of potentially harmful, pro-inflammatory species.14 A growing body of evidence indicates that gut dysbiosis is a common feature in individuals with atopic dermatitis.14\n\nStudies have identified a distinct \"microbial signature\" in the guts of AD patients, especially in infants. Compared to healthy individuals, those with AD often exhibit lower levels of beneficial, anti-inflammatory bacteria such as *Bifidobacterium*, *Akkermansia*, and various butyrate-producing species.14 Concurrently, they may have higher levels of pro-inflammatory bacteria like\n\n*Clostridium* and *Escherichia*.14\n\nThis imbalance has direct consequences for systemic inflammation. A healthy, diverse microbiome produces anti-inflammatory compounds like SCFAs, which help maintain the integrity of the intestinal barrier and promote immune tolerance.20 In a state of dysbiosis, the production of these beneficial metabolites decreases. This can contribute to increased intestinal permeability, often referred to as a \"leaky gut,\" allowing inflammatory bacterial components to pass from the gut into the bloodstream.14 Once in circulation, these components can trigger a low-grade, systemic inflammatory response that can manifest on the skin, exacerbating AD symptoms.16 Therefore, the gut can be seen as a primary site for modulating the very inflammation that drives eczema, making it a logical and powerful target for intervention.\n\n### **2.3 Modulating the Gut for Skin Health: The Potential of Probiotics, Prebiotics, and Fermented Foods**\n\nThe link between gut dysbiosis and AD suggests that strategies aimed at restoring a healthy gut microbiome could be therapeutically beneficial. The goal of such interventions is to shift the gut ecosystem towards a more diverse and anti-inflammatory state, thereby reducing the systemic inflammatory signals that reach the skin. This can be approached through several dietary avenues:\n\n* **Probiotics:** These are live, beneficial microorganisms that, when consumed in adequate amounts, may confer a health benefit.22 The most studied probiotic strains for AD belong to the\n  *Lactobacillus* and *Bifidobacterium* genera.23 They are thought to work by competing with harmful bacteria, strengthening the gut barrier, and directly modulating the immune response in the GALT.18\n* **Prebiotics:** These are specific types of non-digestible fiber that act as fuel for beneficial gut bacteria, selectively promoting their growth and activity.23 Dietary sources of prebiotics are abundant and include foods like garlic, onions, bananas, asparagus, oats, and other whole grains.24 Consuming a wide variety of these plant-based fibers is crucial because different beneficial microbes thrive on different types of fiber. This highlights that the health of the microbiome is defined by its diversity and function, not just the presence of one or two \"good\" bacteria.\n* **Fermented Foods:** Foods such as yogurt, kefir, sauerkraut, kimchi, and miso are natural sources of live probiotic cultures and can be a valuable part of a diet aimed at supporting gut health.25\n\nThe gut-skin axis provides a coherent biological framework that connects multiple, seemingly disparate eczema triggers. For instance, psychological stress is known to alter the gut microbiome, potentially inducing dysbiosis that fuels inflammation and leads to a skin flare.15 Similarly, a pro-inflammatory diet can drive dysbiosis with the same result. This unifying mechanism strengthens the rationale for a holistic management approach that considers diet, stress, and other lifestyle factors as interconnected components influencing skin health through the central hub of the gut microbiome.\n\n## **Section 3: Dietary Interventions for Eczema: A Critical, Evidence-Based Analysis**\n\nThe connection between diet and eczema is complex and highly individualized, making it a source of both hope and confusion for many patients. While food does not cause atopic dermatitis, certain dietary patterns can either promote or combat the systemic inflammation that drives the disease.26 A critical analysis of the scientific evidence reveals that the most effective nutritional strategy is not one of extreme restriction, but rather a proactive, additive approach focused on building a resilient anti-inflammatory internal environment.\n\n### **3.1 The Anti-Inflammatory Diet: The Cornerstone of Nutritional Management**\n\nGiven that atopic dermatitis is fundamentally an inflammatory condition, a diet designed to reduce systemic inflammation is the most logical and evidence-supported nutritional approach.29 This is not a proprietary \"eczema diet\" but rather a pattern of healthy eating that benefits overall health and may be particularly helpful for those with chronic inflammatory diseases.28 The Mediterranean diet is frequently cited as an excellent therapeutic model because it is inherently anti-inflammatory and rich in nutrients that support skin and gut health.25\n\nThe core principle is to maximize the intake of whole, unprocessed foods with anti-inflammatory properties while minimizing foods that can promote inflammation.\n\n**Key Anti-Inflammatory Components to Emphasize:**\n\n* **Omega-3 Fatty Acids:** These essential fats have potent anti-inflammatory properties. They are found in fatty fish like salmon, mackerel, and sardines, as well as plant sources such as flaxseeds, walnuts, and canola oil.23\n* **Flavonoids and Antioxidants:** These are powerful plant-based compounds that combat oxidative stress, a key contributor to inflammation. Rich sources include a wide variety of colorful fruits and vegetables, such as berries, dark cherries, apples, onions, broccoli, and dark leafy greens like kale and spinach.25 Quercetin is a particularly well-studied anti-inflammatory flavonoid found in many of these foods.26\n* **Fiber and Prebiotics:** Abundant in all plant foods—including fruits, vegetables, whole grains (brown rice, quinoa, oats), and legumes (beans, lentils)—fiber is essential for nourishing a diverse and healthy gut microbiome, which is central to regulating immunity.25\n\n**Pro-Inflammatory Foods to Limit or Avoid:**\n\n* **Sugar and Refined Carbohydrates:** Foods high in added sugars and made from refined white flour (e.g., sweets, sugary drinks, white bread, white pasta) can spike insulin levels and promote inflammatory pathways.25\n* **Unhealthy Fats:** Saturated fats, found in high amounts in red meat and full-fat dairy products, and artificial trans fats, common in fried and ultra-processed foods, can be pro-inflammatory.29\n* **Ultra-Processed Foods:** These products are often a combination of unhealthy fats, refined sugars, and artificial additives, and their consumption is associated with increased inflammation and a higher prevalence of AD.30\n\nAdopting such a dietary pattern represents a proactive strategy. Instead of focusing on what to subtract, the primary goal is to add a wide variety of nutrient-dense, anti-inflammatory foods that build a more resilient system from the inside out.\n\n| Feature | General Anti-Inflammatory Diet | Mediterranean Diet |\n| --- | --- | --- |\n| **Core Principle** | Reduce systemic inflammation by maximizing anti-inflammatory foods and minimizing pro-inflammatory foods. | Emphasize whole, plant-based foods, healthy fats, and lean protein, reflecting traditional eating patterns of the Mediterranean region. |\n| **Key Foods to Emphasize** | Colorful fruits & vegetables (berries, leafy greens), omega-3-rich fish, nuts, seeds, legumes, whole grains, spices (turmeric, ginger). | Fruits, vegetables, whole grains, legumes, nuts, seeds, fish and seafood, with a primary focus on olive oil as the main source of fat. |\n| **Key Foods to Limit** | Ultra-processed foods, refined sugars and grains (white bread, sweets), red and processed meats, fried foods, unhealthy fats (trans fats, excess saturated fat). | Red and processed meat (consumed rarely), full-fat dairy, sugar-sweetened beverages, refined grains, and highly processed foods. |\n| **Primary Mechanism for Eczema** | Lowers systemic inflammatory markers, combats oxidative stress, and nourishes a diverse, anti-inflammatory gut microbiome. | Provides a rich source of anti-inflammatory omega-3s and monounsaturated fats, antioxidants, and prebiotic fiber to support gut-skin axis health. |\n| Sources: 25 |  |  |  |\n\n### **3.2 Food Triggers: Navigating Allergies, Sensitivities, and Intolerances**\n\nThe relationship between AD and food reactions is complex. It is critical to distinguish between different types of reactions to guide management appropriately 28:\n\n* **True Food Allergy (IgE-mediated):** This is a rapid and consistent immune reaction that occurs within minutes to a couple of hours of ingestion. Symptoms can include hives, swelling, vomiting, and in severe cases, anaphylaxis. The most common food allergens are cow's milk, eggs, peanuts, tree nuts, soy, wheat, fish, and shellfish.26 Children with moderate to severe AD have a significantly higher risk of developing these true food allergies.28\n* **Delayed Eczematous Reactions:** These are non-IgE-mediated sensitivities where an eczema flare (increased redness and itch) occurs hours or even up to two days after consuming a particular food.34 These reactions are notoriously difficult to identify because of the time lag and may not be detected by standard allergy tests.31\n* **Systemic Contact Dermatitis:** In some individuals, a substance that causes an allergic rash upon skin contact can also trigger a flare when ingested. Common culprits include nickel, a metal found in foods like whole grains, some nuts, shellfish, and chocolate, and Balsam of Peru, a fragrance compound related to flavorings in citrus fruits, tomatoes, and certain spices.31\n\nCrucially, food triggers are highly personalized. There is no universal list of foods that all people with eczema must avoid.26 The process of identifying personal triggers requires careful, methodical observation, ideally guided by a healthcare professional.\n\n### **3.3 The Elimination Diet: A High-Risk, Low-Evidence Strategy**\n\nThe desire to identify and eliminate food triggers often leads patients to try elimination diets. However, the scientific community, including major dermatology and allergy organizations, advises strongly against this practice for the general AD population due to a combination of significant risks and a lack of supporting evidence.37\n\nSystematic reviews and meta-analyses have found that broad elimination diets (e.g., removing milk and eggs from an unselected population) provide little to no benefit in improving eczema symptoms.40 The small potential benefit observed in some studies is often outweighed by substantial risks:\n\n* **Nutritional Deficiencies:** Removing entire food groups, especially staple foods like dairy or wheat, without expert guidance can easily lead to malnutrition and poor growth, a critical concern for children.39\n* **Induction of New Allergies:** Paradoxically, strict avoidance of a food can lead to a loss of oral tolerance. When the food is reintroduced, the immune system may perceive it as a foreign threat, triggering a new and potentially severe allergic reaction, including anaphylaxis, that did not previously exist.39\n* **Psychosocial and Financial Burden:** These diets are difficult to follow, can be expensive, and create significant stress and social isolation, particularly for children and their families.39\n\nAn elimination diet should only be undertaken in a very specific context: for a patient with suspected severe, food-driven AD, and *only* under the combined supervision of an allergist and a registered dietitian.42 The proper method involves allergy testing, keeping a detailed food and symptom diary, and then performing a structured \"exclusion and challenge\" of one suspected food at a time.25 For the vast majority of individuals with eczema, this high-risk strategy is not appropriate.\n\n### **3.4 Nutritional Supplements: Separating Hype from Evidence**\n\nThe market for dietary supplements purported to help eczema is vast, but the clinical evidence is often weak, conflicting, or inconclusive. At present, no dietary supplement is recommended for the *routine* treatment of atopic dermatitis.44 A complex systemic disease like AD, with its multifaceted pathophysiology, is unlikely to be significantly impacted by a single-nutrient intervention. This reality underscores that a \"food as medicine\" approach, focusing on whole dietary patterns that provide a synergistic matrix of nutrients, is a more biologically plausible and evidence-supported strategy than searching for a single \"magic bullet\" supplement.\n\n| Supplement | Proposed Mechanism of Action | Summary of Clinical Evidence | Strength of Evidence / Recommendation |\n| --- | --- | --- | --- |\n| **Probiotics (Oral)** | Modulate gut microbiome, support gut barrier, and regulate systemic immune response. | Highly controversial. Some meta-analyses show a modest reduction in AD severity (SCORAD score), especially in infants and with mixed-strain formulas.45 However, large, high-quality Cochrane reviews conclude they probably make little to no difference in patient-rated symptoms or quality of life.22 | **Inconclusive.** Not recommended for routine treatment. May be considered on a case-by-case basis with a physician. |\n| **Vitamin D** | Regulates immune function and supports skin barrier integrity by increasing antimicrobial peptides. | Evidence is conflicting. Some studies link low vitamin D levels to more severe AD. Some trials show supplementation improves symptoms, particularly in patients with low baseline levels or frequent skin infections, but others show no benefit over placebo.44 | **Limited / Conflicting.** Not recommended for routine treatment. Testing and supplementation may be considered for specific subgroups (e.g., those with deficiency, recurrent infections).44 |\n| **Vitamin E** | Acts as an antioxidant, protecting skin cells from oxidative stress and damage. | Evidence is very limited. A few small studies suggest a potential benefit in reducing symptoms, but larger, robust trials are needed to confirm these findings.44 | **Very Limited.** Not recommended for treatment. |\n| **Fish Oil (Omega-3s)** | Competes with pro-inflammatory fatty acids, reducing the production of inflammatory mediators like leukotrienes. | While dietary intake is encouraged, evidence for high-dose supplementation is weak. Some small, low-quality studies have shown encouraging results, but larger, well-designed trials are required before a recommendation can be made.44 | **Limited.** Not recommended for routine treatment, though increasing dietary intake via fatty fish is advised. |\n| **Evening Primrose Oil / Borage Oil (GLA)** | Aims to correct a hypothesized deficiency in the anti-inflammatory fatty acid Gamma-Linolenic Acid (GLA). | Despite a plausible theory, multiple systematic reviews of numerous trials have consistently concluded that these supplements provide no significant benefit over placebo for eczema symptoms.44 | **Strong Evidence of No Benefit.** Not recommended for treatment. |\n| Sources: 22 |  |  |  |  |\n\n## **Section 4: Exercise and Physical Activity: A Strategic Approach to Movement**\n\nPhysical activity presents a significant paradox for individuals with atopic dermatitis. The well-documented benefits of exercise—including stress reduction, improved sleep, and long-term anti-inflammatory effects—are directly therapeutic for several core drivers of eczema.30 Yet, the act of exercising itself, primarily through the generation of heat and sweat, is one of the most commonly reported triggers for itch and flare-ups.54 The solution is not to avoid exercise, but to adopt a strategic approach that maximizes its benefits while carefully mitigating its risks.\n\n### **4.1 The Double-Edged Sword: Benefits vs. Triggers of Exercise**\n\nEngaging in regular physical activity offers substantial advantages that can positively impact the management of atopic dermatitis.\n\n* **Benefits:**\n  + **Stress Reduction:** Psychological stress is a potent trigger for AD flares by modulating the immune and nervous systems.5 Exercise is one of the most effective methods for managing stress, which can help break the stress-itch cycle.52\n  + **Anti-Inflammatory Effects:** While a single bout of intense exercise can be transiently pro-inflammatory, a consistent exercise routine leads to a long-term reduction in systemic inflammatory markers, helping to lower the body's overall inflammatory state that fuels AD.30\n  + **Improved Sleep and Mental Health:** The intense pruritus of AD often leads to significant sleep disruption and can contribute to anxiety and depression.6 Exercise is proven to improve sleep quality and mental well-being, addressing these major comorbidities.52\n* **Triggers:**\n  + **Sweat:** This is the primary exercise-related trigger. Sweat is mostly water but also contains salts (sodium) and other compounds. When sweat evaporates from the skin, it can have a dehydrating effect. The residual salt left on the skin can then sting and severely irritate the already compromised skin barrier, leading to intense itching.54\n  + **Heat:** A rise in body temperature during physical activity is a direct trigger for itch in many individuals with eczema.55\n\nThe goal of an eczema-friendly exercise plan is to manage these triggers so effectively that the therapeutic benefits can be realized. This involves a framework of preparing the skin beforehand, managing the environment during the workout, and recovering properly afterward.\n\n### **4.2 Managing the Primary Trigger: Strategies to Mitigate Sweat and Heat**\n\nA proactive, multi-step approach is required to neutralize the negative effects of sweat and heat on eczematous skin.\n\n* **Pre-Workout Preparation:**\n  + **Hydrate from Within:** Drink plenty of water before beginning any physical activity to ensure the body and skin are well-hydrated. This helps counteract the fluid loss from sweating.54\n  + **Create a Protective Barrier:** Apply a moisturizer to the skin approximately one hour before exercising. This allows the product to fully absorb and form a protective barrier against the irritating effects of sweat. A lighter cream or lotion may be more comfortable than a heavy, occlusive ointment, which could trap heat and sweat.60\n* **During the Workout:**\n  + **Control the Environment:** Whenever possible, exercise in a cool, well-ventilated space. Using a fan or positioning oneself near an air conditioner can make a significant difference.52 If exercising outdoors, choose the cooler parts of the day, such as early morning or evening, and stay in the shade.52\n  + **Take Frequent Breaks:** Instead of one long, continuous session of intense activity, break workouts into shorter intervals. Taking regular breaks allows the body to cool down, reducing the overall heat load and sweat accumulation.54\n  + **Manage Sweat Actively:** Keep a clean, soft towel on hand to gently blot or pat away sweat. Avoid rubbing the skin, which can cause friction and irritation. Cooling towels that are dampened with cold water can also be used to provide immediate relief to hot, itchy areas.52\n* **Post-Workout Recovery:** This is arguably the most critical phase.\n  + **Shower Immediately:** Do not let sweat dry on the skin. Rinse off as soon as possible after finishing the workout to remove irritating salt residue.55\n  + **Use Lukewarm Water:** A hot shower can strip the skin of its essential oils and worsen dryness. Use cool or lukewarm water and keep the shower brief (5-10 minutes).52\n  + **Cleanse Gently:** Use a mild, fragrance-free, non-soap cleanser to wash the skin, and rinse it off completely.55\n  + **Moisturize Immediately (\"Soak and Seal\"):** After gently patting the skin dry with a soft towel, apply a liberal amount of your preferred moisturizer to the entire body while the skin is still slightly damp (within three minutes). This is a crucial step to lock in hydration and repair the skin barrier.63\n\n### **4.3 Building an Eczema-Friendly Fitness Regimen**\n\nThe choice of exercise is less important than the modification of the routine and environment. By controlling key variables, individuals can often participate in a wide range of activities.\n\n* **Clothing and Equipment:**\n  + **Choose Breathable Fabrics:** Opt for clothing made from soft, smooth, breathable fabrics like 100% cotton. Wear loose-fitting garments to allow for air circulation and prevent heat from being trapped against the skin.52 Avoid rough materials like wool. While some synthetic \"moisture-wicking\" fabrics are designed to pull sweat away, they can sometimes feel rough and cause irritation, so personal tolerance may vary.54\n  + **Minimize Friction:** Remove tags from clothing or wear garments inside out to prevent seams from rubbing against sensitive skin.54\n  + **Keep Gear Clean:** Always wash workout clothes after a single use to prevent the buildup of bacteria and sweat residue. Wipe down shared gym equipment before use.54\n* **Recommended Activities:**\n  + **Low-Impact, Low-Sweat Exercises:** Activities that keep the heart rate steady without causing excessive sweating are often the best tolerated. Excellent options include:\n    - **Walking:** A simple yet effective form of aerobic exercise.56\n    - **Strength Training:** Using weights, resistance bands, or bodyweight exercises often includes built-in rest periods, allowing the body to cool down.56\n    - **Pilates:** Focuses on core strength and flexibility with controlled movements.52\n  + **Mind-Body Practices:** These are particularly beneficial as they directly address the stress component of eczema.\n    - **Yoga:** Gentle styles like Hatha yoga are ideal. Hot yoga (Bikram), which is performed in a heated room, should generally be avoided.56\n    - **Tai Chi:** This practice involves slow, flowing movements and deep breathing, making it an excellent low-impact, stress-reducing exercise.52\n  + **Aquatic Exercise:**\n    - **Swimming and Water Aerobics:** These are often highly recommended because the water keeps the skin cool throughout the workout.56 However, individual reactions to pool chemicals vary. For some, the chlorine can be an irritant. For others, it may have a beneficial effect similar to a dilute bleach bath by reducing bacteria on the skin.57 It is essential to apply a barrier moisturizer before swimming and to shower and re-moisturize immediately after exiting the pool.55\n* Adapting During Flares:\n  It is vital to listen to your body. During a moderate to severe flare, continuing a high-intensity routine can significantly worsen the condition.\n  + **Modify, Don't Stop (If Possible):** Instead of stopping all activity, switch to a lower-intensity version. For example, walk instead of run, or focus on gentle stretching.52\n  + **Prioritize Rest:** During a particularly severe flare, when the skin is very sore or infected, taking a rest day is the safest and most sensible option.52\n\nBy implementing these strategies, the challenge of exercising with eczema shifts from a question of \"if\" to \"how.\" A methodical and adaptive approach empowers individuals to gain the significant mental and physical health benefits of exercise while keeping their skin calm and comfortable.\n\n| Phase | Key Objective | Actionable Strategies |\n| --- | --- | --- |\n| **Phase 1: Pre-Workout** | Protect and Prepare the Skin | - Hydrate well by drinking water. - Apply a light, fragrance-free moisturizer at least 30-60 minutes prior to allow for absorption. - Choose loose-fitting, soft, breathable clothing (e.g., 100% cotton). - Remove tags and ensure seams do not cause friction. |\n| **Phase 2: During Workout** | Mitigate Heat and Sweat | - Exercise in a cool, well-ventilated environment (use fans or A/C). - Avoid exercising outdoors during peak heat (10 a.m. - 4 p.m.). - Take frequent breaks to cool down and rehydrate. - Gently blot sweat with a clean, soft towel; do not rub. - Use cooling towels or spray the skin with cool water for relief. |\n| **Phase 3: Post-Workout** | Cleanse and Repair the Skin | - Shower as soon as possible after finishing. - Use lukewarm or cool water, not hot. - Keep the shower brief (5-10 minutes). - Wash with a gentle, non-soap, fragrance-free cleanser. - Gently pat skin dry with a soft towel. - Apply a liberal amount of moisturizer to the entire body within 3 minutes of showering (\"Soak and Seal\"). |\n| Sources: 52 |  |  |  |\n\n## **Section 5: An Integrated and Holistic Treatment Paradigm**\n\nThe prevention and treatment of atopic dermatitis through diet and exercise are most effective when they are not viewed as standalone solutions but are instead integrated into a comprehensive, holistic management plan. This paradigm recognizes AD as a complex condition influenced by skin barrier health, systemic inflammation, and psycho-neuro-immunological factors. Lifestyle interventions act as powerful force multipliers for conventional medical treatments, working synergistically to manage symptoms, reduce flare frequency, and improve long-term quality of life.\n\n### **5.1 The Non-Negotiable Foundation: Advanced Skincare and Moisturizing Protocols**\n\nBefore considering any dietary or exercise modifications, it is essential to establish a consistent and correct skincare routine. This is the bedrock of all AD management, as its primary goal is to directly address the fundamental defect in the skin barrier.66 All other interventions are adjuncts to, not replacements for, this foundational care.1\n\n* **Liberal Moisturizing (Emollience):** The cornerstone of AD therapy is the liberal and frequent application of moisturizers.68 This should be done at least twice daily, and more often if needed. Thick creams and ointments, which have a lower water content, are generally more effective than lotions at hydrating the skin and creating a protective barrier.9 Products containing ceramides can help replenish the skin's natural lipid layer, while simple, occlusive ointments like petroleum jelly are highly effective at preventing water loss.59 All products should be free of potential irritants like fragrances, dyes, and alcohols.69\n* **Therapeutic Bathing and Cleansing:** Daily bathing or showering in lukewarm water for a short duration (5 to 10 minutes) is recommended to hydrate the skin and remove irritants and allergens.1 Harsh soaps should be avoided in favor of gentle, non-soap, pH-balanced cleansers.67 The \"soak and seal\" method is critical: after bathing, the skin should be gently patted dry, and moisturizer must be applied to the still-damp skin within three minutes to trap the moisture.64 For patients with moderate-to-severe AD and frequent bacterial infections, a dermatologist may recommend dilute bleach baths 2-3 times per week to reduce the\n  *S. aureus* load on the skin.9\n* **Conventional Topical Therapy:** This foundational skincare is used in conjunction with prescription topical medications during flares. Topical corticosteroids of appropriate potency remain the first-line treatment for reducing inflammation.1 Topical calcineurin inhibitors (e.g., tacrolimus, pimecrolimus) and newer non-steroidal options like PDE-4 or JAK inhibitors are also key components of the treatment armamentarium, especially for sensitive areas or long-term maintenance.66\n\n### **5.2 Synergizing Lifestyle and Medicine: How Diet and Exercise Complement Conventional Therapies**\n\nAn integrated approach creates a multi-pronged attack on the pathophysiology of AD. While conventional topical therapies work from the outside-in to quell local inflammation in the skin, diet and exercise work from the inside-out to reduce the systemic inflammation that fuels the disease.\n\nAn anti-inflammatory diet, by nourishing a healthy gut microbiome and providing anti-inflammatory nutrients, lowers the body's overall inflammatory baseline.30 Regular, strategically managed exercise contributes further by reducing stress-related neuro-inflammation and exerting its own long-term systemic anti-inflammatory effects.30 By lowering this underlying inflammatory \"pressure,\" the skin becomes less reactive to triggers. This synergy can make topical treatments more effective and may, over time, reduce the frequency and amount of medication needed to maintain control, a significant and desirable outcome for patients.1\n\n### **5.3 Beyond Diet and Exercise: The Role of Stress Management and Sleep Hygiene**\n\nA truly holistic approach must address the psycho-neuro-immunological aspects of eczema, which form a vicious cycle.\n\n* **Stress Management:** Stress is a well-documented and powerful trigger for AD flares.5 The release of stress hormones can directly impact immune cells in the skin, promoting inflammation and itch. Therefore, incorporating dedicated stress-reduction techniques is a vital part of management. Practices such as meditation, deep breathing exercises, yoga, and tai chi have shown promise in helping patients manage stress, which can lead to calmer skin.57\n* **Sleep Hygiene:** The relentless itch of AD is a major cause of sleep disturbance.6 This lack of restorative sleep, in turn, can worsen AD. Sleep deprivation is known to increase systemic inflammation, disrupt the skin barrier, and lower the brain's threshold for perceiving itch, making flares more likely and more severe.58 Prioritizing sleep hygiene—by maintaining a regular sleep schedule, creating a cool and dark sleep environment, and managing itch effectively at night—is a critical therapeutic intervention.\n\n### **5.4 Developing a Personalized Action Plan: A Step-by-Step Guide**\n\nBecause AD is so variable, the most powerful tool a patient possesses is the systematic collection of personal data. A generic plan is a starting point, but true control comes from personalization.\n\n* **Step 1: Master Foundational Care.** Before anything else, establish a consistent, twice-daily moisturizing routine and gentle bathing practices. This is the non-negotiable base of the pyramid.\n* **Step 2: Adopt an Anti-Inflammatory Diet.** Shift focus from food restriction to food addition. Proactively incorporate a wide variety of vegetables, fruits, lean proteins, and healthy fats. Systematically reduce intake of sugar, ultra-processed items, and fried foods.\n* **Step 3: Introduce Strategic Exercise.** Begin with low-impact activities like walking or yoga. Meticulously follow the \"prepare, manage, recover\" framework for every session to minimize the risk of flares.\n* **Step 4: Keep a Detailed Symptom and Trigger Diary.** This is the key to personalization. Methodically log daily food intake, exercise activities, stress levels, sleep quality, and the state of your skin.25 Over weeks and months, patterns will emerge that are unique to you, allowing you to identify your specific triggers—be they dietary, environmental, or stress-related. This transforms management from guesswork into an evidence-based personal science.\n* **Step 5: Consult with Healthcare Professionals.** Always work in partnership with a healthcare team. A dermatologist can guide medical treatment. An allergist can perform appropriate testing if a true food allergy is suspected. A registered dietitian can ensure any dietary changes are nutritionally sound and sustainable.25 This collaborative approach ensures safety and optimizes outcomes.\n\n## **Section 6: Conclusion and Future Directions**\n\nAtopic dermatitis is a complex, chronic inflammatory disease that demands more than a single-modality treatment. The evidence synthesized in this report clearly indicates that while foundational skincare and conventional medical therapies are the cornerstones of management, strategic interventions in diet and exercise offer powerful, complementary pathways to reduce disease burden and improve quality of life. The most effective strategies move away from reactive trigger avoidance and toward a proactive, holistic paradigm aimed at reducing systemic inflammation and building a more resilient biological system.\n\n### **6.1 Summary of Key Recommendations**\n\nA successful, evidence-based lifestyle approach to managing atopic dermatitis can be distilled into five core principles:\n\n1. **Prioritize Foundational Skincare:** Consistent, liberal moisturizing with thick, fragrance-free emollients and gentle, lukewarm bathing are non-negotiable. This directly repairs and supports the primary defect in the skin barrier.\n2. **Adopt an Additive, Anti-Inflammatory Diet:** Focus on building a diet rich in whole, plant-based foods, omega-3 fatty acids, and a diversity of fiber to nourish the gut microbiome. The Mediterranean diet serves as an excellent template. This approach is safer and more evidence-based than restrictive elimination diets.\n3. **Engage in Strategic, Modified Exercise:** Do not avoid physical activity. Instead, manage its triggers by following a \"prepare, manage, recover\" protocol. Choose low-impact activities and appropriate clothing, and always prioritize post-workout cleansing and moisturizing.\n4. **Embrace a Holistic Perspective:** Recognize that AD is influenced by more than just the skin. Actively manage stress and prioritize sleep hygiene, as these factors are deeply intertwined with the inflammatory and neurological pathways of the disease.\n5. **Personalize Through Data and Professional Guidance:** Use a detailed symptom diary to become an expert on your own condition. Work collaboratively with a team of healthcare professionals—including a dermatologist, allergist, and dietitian—to tailor this holistic framework to your unique needs, ensuring both safety and efficacy.\n\n### **6.2 The Future of Eczema Management: The Path Toward Personalized Medicine**\n\nWhile our understanding of AD has advanced significantly, critical gaps in the research remain. There is a notable scarcity of long-term, large-scale, and head-to-head clinical trials evaluating whole-diet interventions and exercise protocols, particularly in the adult population.75 Future research must focus on these areas to provide more definitive clinical guidelines.\n\nSimultaneously, the field of medical treatment for AD is rapidly evolving. The development of highly targeted biologic drugs and oral small molecules (like JAK inhibitors) has revolutionized care for patients with moderate-to-severe disease.70 These therapies offer unprecedented levels of control. However, even in this new era of advanced pharmacology, the principles of holistic lifestyle management remain critically important for achieving optimal, sustained outcomes and overall health.\n\nThe ultimate goal is to move beyond the current trial-and-error approach and toward true personalized medicine. The future of eczema care likely lies in the use of biomarkers—such as genetic screening for *FLG* mutations, gut microbiome analysis, or immune cell profiling—to predict which specific dietary, lifestyle, or medical intervention will be most effective for an individual patient.76 This will allow clinicians to prescribe a truly tailored regimen from the outset, maximizing efficacy, minimizing side effects, and transforming the management of this challenging chronic disease.\n\n#### 引用的著作\n\n1. Atopic Dermatitis: Diagnosis and Treatment - AAFP, 访问时间为 八月 6, 2025， <https://www.aafp.org/pubs/afp/issues/2020/0515/p590.html>\n2. Atopic Dermatitis - StatPearls - NCBI Bookshelf, 访问时间为 八月 6, 2025， <https://www.ncbi.nlm.nih.gov/books/NBK448071/>\n3. Atopic Dermatitis: Causes, Symptoms, Diagnosis | National Eczema ..., 访问时间为 八月 6, 2025， <https://nationaleczema.org/types-of-eczema/atopic-dermatitis/>\n4. Types of Eczema: Symptoms, Differences, Diagnosis, 访问时间为 八月 6, 2025， <https://nationaleczema.org/types-of-eczema/>\n5. Eczema (contact dermatitis): Symptoms, causes, & treatment, 访问时间为 八月 6, 2025， <https://nationaleczema.org/eczema/>\n6. Atopic dermatitis (eczema) - Symptoms and causes - Mayo Clinic, 访问时间为 八月 6, 2025， <https://www.mayoclinic.org/diseases-conditions/atopic-dermatitis-eczema/symptoms-causes/syc-20353273>\n7. Atopic eczema - NHS, 访问时间为 八月 6, 2025， <https://www.nhs.uk/conditions/atopic-eczema/>\n8. Eczema types: Atopic dermatitis overview - American Academy of Dermatology, 访问时间为 八月 6, 2025， <https://www.aad.org/public/diseases/eczema/types/atopic-dermatitis>\n9. Atopic Dermatitis: Update on Skin-Directed Management: Clinical Report - AAP Publications, 访问时间为 八月 6, 2025， <https://publications.aap.org/pediatrics/article/155/6/e2025071812/201952/Atopic-Dermatitis-Update-on-Skin-Directed>\n10. Atopic dermatitis: pathogenesis and therapeutic intervention - PMC - PubMed Central, 访问时间为 八月 6, 2025， <https://pmc.ncbi.nlm.nih.gov/articles/PMC11625510/>\n11. Eczema - StatPearls - NCBI Bookshelf, 访问时间为 八月 6, 2025， <https://www.ncbi.nlm.nih.gov/books/NBK538209/>\n12. Atopic Dermatitis: An Overview - AAFP, 访问时间为 八月 6, 2025， <https://www.aafp.org/pubs/afp/issues/2012/0701/p35.html/1000>\n13. Pathophysiology of atopic dermatitis: Clinical implications - PMC, 访问时间为 八月 6, 2025， <https://pmc.ncbi.nlm.nih.gov/articles/PMC6399565/>\n14. Gut–Skin Axis: Current Knowledge of the Interrelationship between ..., 访问时间为 八月 6, 2025， <https://www.mdpi.com/2076-2607/9/2/353>\n15. The impact of lifestyle factors on evolution of atopic dermatitis: An alternative approach, 访问时间为 八月 6, 2025， <https://pmc.ncbi.nlm.nih.gov/articles/PMC6327646/>\n16. Eczema and gut health: Is there a link? - Medical News Today, 访问时间为 八月 6, 2025， <https://www.medicalnewstoday.com/articles/eczema-gut-health>\n17. The gut-skin axis: a bi-directional, microbiota-driven relationship with therapeutic potential, 访问时间为 八月 6, 2025， <https://www.tandfonline.com/doi/full/10.1080/19490976.2025.2473524>\n18. Microbiome in the Gut-Skin Axis in Atopic Dermatitis - PMC, 访问时间为 八月 6, 2025， <https://pmc.ncbi.nlm.nih.gov/articles/PMC6021588/>\n19. Eczema and the Gut-Skin Axis: What's the Link? - Healthline, 访问时间为 八月 6, 2025， <https://www.healthline.com/health/eczema/how-does-the-gut-skin-axis-affect-eczema>\n20. Comparative Analysis of the Microbiome across the Gut–Skin Axis in Atopic Dermatitis, 访问时间为 八月 6, 2025， <https://www.mdpi.com/1422-0067/22/8/4228>\n21. How the Gut Microbiome Influences Skin Health: Exploring the Gut-Skin Axis, 访问时间为 八月 6, 2025， <https://www.owlstonemedical.com/about/blog/2024/oct/01/how-the-gut-microbiome-influences-skin-health-exploring-the-gut-skin-axis/>\n22. Probiotics for treating eczema - PMC - PubMed Central, 访问时间为 八月 6, 2025， <https://pmc.ncbi.nlm.nih.gov/articles/PMC6517242/>\n23. Supplements for Skin Health - Whole Health Library - VA.gov, 访问时间为 八月 6, 2025， <https://www.va.gov/WHOLEHEALTHLIBRARY/tools/supplements-for-skin-health.asp>\n24. Holistic Eczema Treatment - 13 Ways to Treat Eczema Naturally - Vibrant Skin Bar, 访问时间为 八月 6, 2025， <https://vibrantskinbar.com/blog/holistic-eczema-treatment/>\n25. Eczema & Diet: Foods That Help and Hurt Your Skin - Altitude Dermatology, 访问时间为 八月 6, 2025， <https://www.altitudedermatology.com/blog-post/diet-and-managing-eczema>\n26. Eczema Diet: Foods to Eat and Foods to Avoid - Healthline, 访问时间为 八月 6, 2025， <https://www.healthline.com/health/skin-disorders/eczema-diet>\n27. Eczema Diet: Foods to eat, avoid, and tips - Medical News Today, 访问时间为 八月 6, 2025， <https://www.medicalnewstoday.com/articles/320855>\n28. Diet and Nutrition for Eczema | Food Allergies, 访问时间为 八月 6, 2025， <https://nationaleczema.org/eczema-management/diet-nutrition/>\n29. Control Eczema with Your Diet - Cleveland Clinic Health Essentials, 访问时间为 八月 6, 2025， <https://health.clevelandclinic.org/eczema-diet>\n30. Diet, sleep, and exercise in inflammatory skin diseases - PMC, 访问时间为 八月 6, 2025， <https://pmc.ncbi.nlm.nih.gov/articles/PMC10755759/>\n31. Eczema and Diet: The Foods to Eat and Avoid to Prevent and Manage Flare-Ups, 访问时间为 八月 6, 2025， <https://www.everydayhealth.com/eczema/diet/>\n32. The Role of Diet in Handling Eczema: A Complete Guide - Mama Health, 访问时间为 八月 6, 2025， <https://www.mamahealth.com/hand-eczema/handling-eczema-diet-complete-guide>\n33. Diet and eczema, 访问时间为 八月 6, 2025， <https://www.pierrefabreeczemafoundation.org/en/support/useful-advices/diet-and-eczema>\n34. Diet and Dermatitis: Food Triggers - PMC - National Institutes of Health (NIH) |, 访问时间为 八月 6, 2025， <https://pmc.ncbi.nlm.nih.gov/articles/PMC3970830/>\n35. Eczema; food allergies and other triggers, 访问时间为 八月 6, 2025， [https://www.rch.org.au/uploadedFiles/Main/Content/allergy/Eczema%20Food%20Allergies%20Other%20Triggers(1).pdf](https://www.rch.org.au/uploadedFiles/Main/Content/allergy/Eczema%20Food%20Allergies%20Other%20Triggers%281%29.pdf)\n36. Eczema Triggers: The Worst Foods You Need to Avoid - Valley Skin Institute, 访问时间为 八月 6, 2025， <https://www.valleyskininstitute.com/eczema-triggers-the-worst-foods-you-need-to-avoid/>\n37. My child has severe eczema, should I eliminate certain foods from their diet? - ACAAI Patient, 访问时间为 八月 6, 2025， <https://acaai.org/resource/my-child-has-severe-eczema-should-i-eliminate-certain-foods-from-their-diet>\n38. A Look at the Food Elimination Diet Trend for Atopic Dermatitis, 访问时间为 八月 6, 2025， <https://nationaleczema.org/blog/food-elimination-diet-for-atopic-dermatitis/>\n39. Eczema Elimination Diet: Should You Try It? - Everyday Health, 访问时间为 八月 6, 2025， <https://www.everydayhealth.com/eczema/tips-using-elimination-diet-determine-root-cause-eczema/>\n40. Eczema: Research summaries – Eczema: Can eliminating particular foods help? - NCBI, 访问时间为 八月 6, 2025， <https://www.ncbi.nlm.nih.gov/books/NBK424896/>\n41. Dietary exclusions for established atopic eczema - PMC - PubMed Central, 访问时间为 八月 6, 2025， <https://pmc.ncbi.nlm.nih.gov/articles/PMC6885041/>\n42. Diet and Eczema in Children - Royal United Hospitals Bath, 访问时间为 八月 6, 2025， <https://www.ruh.nhs.uk/patients/patient_information/PAE003_Diet_and_eczema.pdf>\n43. Eczema and Food Allergy - Fast Facts, 访问时间为 八月 6, 2025， <https://www.allergy.org.au/patients/fast-facts/eczema-and-food-allergy>\n44. Diet and eczema: a review of dietary supplements for the treatment ..., 访问时间为 八月 6, 2025， <https://pmc.ncbi.nlm.nih.gov/articles/PMC5006549/>\n45. The role of probiotics in the treatment of adult atopic dermatitis: a meta-analysis of randomized controlled trials - PubMed, 访问时间为 八月 6, 2025， <https://pubmed.ncbi.nlm.nih.gov/35978397/>\n46. Probiotic Supplementation for Prevention of Atopic Dermatitis in Infants and Children: A Systematic Review and Meta-analysis - PubMed, 访问时间为 八月 6, 2025， <https://pubmed.ncbi.nlm.nih.gov/30465329/>\n47. Probiotics for treating eczema - PubMed, 访问时间为 八月 6, 2025， <https://pubmed.ncbi.nlm.nih.gov/30480774/>\n48. 6 Helpful Supplements to Treat Eczema - Healthline, 访问时间为 八月 6, 2025， <https://www.healthline.com/nutrition/supplements-for-eczema>\n49. Supplements for Eczema: What You Should Know - WebMD, 访问时间为 八月 6, 2025， <https://www.webmd.com/skin-problems-and-treatments/eczema/ss/slideshow-supplements-for-eczema>\n50. Dietary interventions - Systematic review of treatments for atopic eczema - NCBI Bookshelf, 访问时间为 八月 6, 2025， <https://www.ncbi.nlm.nih.gov/books/NBK260249/>\n51. 8 Evidence-Based, Holistic Approaches to Eczema - Dr. Deanna Minich, 访问时间为 八月 6, 2025， <https://deannaminich.com/8-evidence-based-holistic-approaches-to-eczema/>\n52. How to exercise safely with eczema | National Eczema Association, 访问时间为 八月 6, 2025， <https://nationaleczema.org/blog/exercising-eczema/>\n53. The Role of Exercise in Atopic Dermatitis, Spontaneous Urticaria - Dermatology Times, 访问时间为 八月 6, 2025， <https://www.dermatologytimes.com/view/the-role-of-exercise-in-atopic-dermatitis-spontaneous-urticaria>\n54. Eczema & Sports: How to Help Your Child Prevent Flare-Ups - HealthyChildren.org, 访问时间为 八月 6, 2025， <https://www.healthychildren.org/English/health-issues/conditions/skin/Pages/sports-and-eczema-how-to-help-your-child-prevent-flare-ups.aspx>\n55. Tips for Exercising When You Have Eczema, 访问时间为 八月 6, 2025， <https://www.webmd.com/skin-problems-and-treatments/eczema/eczema-exercise-tips>\n56. Best Exercises When You Have Atopic Dermatitis - WebMD, 访问时间为 八月 6, 2025， <https://www.webmd.com/skin-problems-and-treatments/eczema/atopic-dermatitis-best-exercises>\n57. Exercise and eczema, 访问时间为 八月 6, 2025， <https://eczema.org/information-and-advice/living-with-eczema/exercise-and-eczema/>\n58. Association between moderate to severe atopic dermatitis and lifestyle factors in the Dutch general population | Clinical and Experimental Dermatology | Oxford Academic, 访问时间为 八月 6, 2025， <https://academic.oup.com/ced/article/47/8/1523/6692927>\n59. Eczema and Exercise - Allergy & Asthma Network, 访问时间为 八月 6, 2025， <https://allergyasthmanetwork.org/news/eczema-and-exercise/>\n60. Tips for Exercising with Eczema, 访问时间为 八月 6, 2025， <https://nationaleczema.org/blog/eczema-exercise/>\n61. Eczema and exercise: Does physical activity benefit atopic eczema? - Prospera Biotech, 访问时间为 八月 6, 2025， <https://www.prosperabiotech.com/en/blog/eczema-and-exercise-treatment-and-causes/>\n62. How Do You Manage Eczema When Exercising? - Health Central, 访问时间为 八月 6, 2025， <https://www.healthcentral.com/condition/eczema/how-do-you-manage-eczema-when-exercising>\n63. Tips for exercising with eczema - Medical News Today, 访问时间为 八月 6, 2025， <https://www.medicalnewstoday.com/articles/exercising-with-eczema>\n64. Eczema (Atopic Dermatitis) | Symptoms, Treatment & Management, 访问时间为 八月 6, 2025， [https://www.aaaai.org/tools-for-the-public/conditions-library/allergies/eczema-(atopic-dermatitis)-overview](https://www.aaaai.org/tools-for-the-public/conditions-library/allergies/eczema-%28atopic-dermatitis%29-overview)\n65. allergyasthmanetwork.org, 访问时间为 八月 6, 2025， <https://allergyasthmanetwork.org/news/eczema-and-exercise/#:~:text=Swimming%20is%20one%20of%20the,for%20many%20people%20with%20eczema.>\n66. What are the holistic approaches to managing severe eczema? - Dr.Oracle AI, 访问时间为 八月 6, 2025， <https://www.droracle.ai/articles/194160/holistic-approches-to-severe-eczema>\n67. Guidelines for the management of atopic dermatitis (eczema) for pharmacists - PMC, 访问时间为 八月 6, 2025， <https://pmc.ncbi.nlm.nih.gov/articles/PMC5582672/>\n68. Treatment of Atopic Dermatitis - AAP, 访问时间为 八月 6, 2025， <https://www.aap.org/en/patient-care/atopic-dermatitis/treatment-of-atopic-dermatitis/>\n69. Atopic dermatitis (eczema) - Diagnosis and treatment - Mayo Clinic, 访问时间为 八月 6, 2025， <https://www.mayoclinic.org/diseases-conditions/atopic-dermatitis-eczema/diagnosis-treatment/drc-20353279>\n70. Atopic dermatitis clinical guideline - American Academy of Dermatology, 访问时间为 八月 6, 2025， <https://www.aad.org/member/clinical-quality/guidelines/atopic-dermatitis>\n71. Alternative and Complementary Treatments for Eczema - National ..., 访问时间为 八月 6, 2025， <https://nationaleczema.org/treatments/complementary-alternative/>\n72. Psychological and Educational Interventions for Atopic Dermatitis in Adults: A Systematic Review and Meta-Analysis | Behaviour Change - Cambridge University Press, 访问时间为 八月 6, 2025， <https://www.cambridge.org/core/journals/behaviour-change/article/psychological-and-educational-interventions-for-atopic-dermatitis-in-adults-a-systematic-review-and-metaanalysis/DD089BACBE7ABEFAD2FCEC448F54F015>\n73. Lifestyle Factors in the Clinical Manifestation and Management of Atopic Dermatitis, 访问时间为 八月 6, 2025， <https://cdn.fortuneonline.org/articles/lifestyle-factors-in-the-clinical-manifestation-and-management-of-atopic-dermatitis.pdf>\n74. The Eczema Elimination Diet - iHealth Unified Care, 访问时间为 八月 6, 2025， <https://www.ihealthunifiedcare.com/articles/the-eczema-elimination-diet>\n75. (PDF) Dietary Interventions in Atopic Dermatitis: A Comprehensive ..., 访问时间为 八月 6, 2025， <https://www.researchgate.net/publication/378748256_Dietary_Interventions_in_Atopic_Dermatitis_A_Comprehensive_Scoping_Review_and_Analysis>\n76. Unraveling Atopic Dermatitis: Insights into Pathophysiology, Therapeutic Advances, and Future Perspectives, 访问时间为 八月 6, 2025， <https://pmc.ncbi.nlm.nih.gov/articles/PMC10931328/>\n77. How we treat atopic dermatitis now and how that will change over the next 5 years | British Journal of Dermatology | Oxford Academic, 访问时间为 八月 6, 2025， <https://academic.oup.com/bjd/article/188/6/718/6880686>\n",
  "all_source_links": [
    "https://abbyroseskincare.com/blogs/news/a-holistic-approach-to-managing-eczema",
    "https://acaai.org/resource/my-child-has-severe-eczema-should-i-eliminate-certain-foods-from-their-diet",
    "https://academic.oup.com/bjd/article/188/6/718/6880686",
    "https://academic.oup.com/ced/article/47/8/1523/6692927",
    "https://accounts.google.com/SignOutOptions?hl=zh-CN&continue=https://gemini.google.com/app/b018ec52094f7b88&ec=GBRAkgU",
    "https://allergyasthmanetwork.org/news/eczema-and-exercise",
    "https://allergyasthmanetwork.org/news/eczema-and-exercise/#:~:text=Swimming%20is%20one%20of%20the,for%20many%20people%20with%20eczema.",
    "https://cdn.fortuneonline.org/articles/lifestyle-factors-in-the-clinical-manifestation-and-management-of-atopic-dermatitis.pdf",
    "https://dashscope.aliyuncs.com/compatible-mode/v1",
    "https://deannaminich.com/8-evidence-based-holistic-approaches-to-eczema",
    "https://eczema.org/information-and-advice/living-with-eczema/exercise-and-eczema",
    "https://health.clevelandclinic.org/eczema-diet",
    "https://hub.eaaci.org/resources_papers/a-systematic-review-and-meta-analysis-of-nutritional-and-dietary-interventions-in-randomized-controlled-trials-for-skin-symptoms-in-children-with-atopic-dermatitis-and-without-food-allergy-an-eaaci-t",
    "https://karger.com/iaa/article/185/6/545/896421/Dietary-Interventions-in-Atopic-Dermatitis-A",
    "https://nationaleczema.org/blog/eczema-exercise",
    "https://nationaleczema.org/blog/exercising-eczema",
    "https://nationaleczema.org/blog/food-elimination-diet-for-atopic-dermatitis",
    "https://nationaleczema.org/eczema",
    "https://nationaleczema.org/eczema-management",
    "https://nationaleczema.org/eczema-management/diet-nutrition",
    "https://nationaleczema.org/treatments/complementary-alternative",
    "https://nationaleczema.org/types-of-eczema",
    "https://nationaleczema.org/types-of-eczema/atopic-dermatitis",
    "https://nationaleczema.org/types-of-eczema/atopic-dermatitis/#:~:text=Eczema%20is%20a%20term%20for,predisposition%20to%20the%20skin%20condition.",
    "https://pmc.ncbi.nlm.nih.gov/articles/PMC10755759",
    "https://pmc.ncbi.nlm.nih.gov/articles/PMC10931328",
    "https://pmc.ncbi.nlm.nih.gov/articles/PMC11625510",
    "https://pmc.ncbi.nlm.nih.gov/articles/PMC11870655",
    "https://pmc.ncbi.nlm.nih.gov/articles/PMC3970830",
    "https://pmc.ncbi.nlm.nih.gov/articles/PMC4518179",
    "https://pmc.ncbi.nlm.nih.gov/articles/PMC5006549",
    "https://pmc.ncbi.nlm.nih.gov/articles/PMC5216171",
    "https://pmc.ncbi.nlm.nih.gov/articles/PMC5582672",
    "https://pmc.ncbi.nlm.nih.gov/articles/PMC5736303",
    "https://pmc.ncbi.nlm.nih.gov/articles/PMC6021588",
    "https://pmc.ncbi.nlm.nih.gov/articles/PMC6327646",
    "https://pmc.ncbi.nlm.nih.gov/articles/PMC6399565",
    "https://pmc.ncbi.nlm.nih.gov/articles/PMC6517242",
    "https://pmc.ncbi.nlm.nih.gov/articles/PMC6885041",
    "https://pmc.ncbi.nlm.nih.gov/articles/PMC9541324",
    "https://publications.aap.org/pediatrics/article/155/6/e2025071812/201952/Atopic-Dermatitis-Update-on-Skin-Directed",
    "https://pubmed.ncbi.nlm.nih.gov/11069570",
    "https://pubmed.ncbi.nlm.nih.gov/16309494",
    "https://pubmed.ncbi.nlm.nih.gov/25610977",
    "https://pubmed.ncbi.nlm.nih.gov/30465329",
    "https://pubmed.ncbi.nlm.nih.gov/30480774",
    "https://pubmed.ncbi.nlm.nih.gov/35978397",
    "https://vibrantskinbar.com/blog/holistic-eczema-treatment",
    "https://www.aaaai.org/tools-for-the-public/conditions-library/allergies/eczema-%28atopic-dermatitis%29-overview",
    "https://www.aaaai.org/tools-for-the-public/conditions-library/allergies/eczema-(atopic-dermatitis)-overview",
    "https://www.aad.org/member/clinical-quality/guidelines/atopic-dermatitis",
    "https://www.aad.org/public/diseases/eczema/types/atopic-dermatitis",
    "https://www.aafp.org/pubs/afp/issues/2012/0701/p35.html/1000",
    "https://www.aafp.org/pubs/afp/issues/2020/0515/p590.html",
    "https://www.aap.org/en/patient-care/atopic-dermatitis/treatment-of-atopic-dermatitis",
    "https://www.allergy.org.au/patients/fast-facts/eczema-and-food-allergy",
    "https://www.altitudedermatology.com/blog-post/diet-and-managing-eczema",
    "https://www.bioderma.co.uk/your-skin/dry-atopic-skin/itchy-and-atopic-skin-how-treat-it/eczema-cure-ideal-diet-children-atopic-skin",
    "https://www.cambridge.org/core/journals/behaviour-change/article/psychological-and-educational-interventions-for-atopic-dermatitis-in-adults-a-systematic-review-and-metaanalysis/DD089BACBE7ABEFAD2FCEC448F54F015",
    "https://www.chloemcleod.com/holistic-approach-to-managing-eczema-from-diet-to-skincare-products-to-environmental-factors",
    "https://www.dermatologytimes.com/view/the-role-of-exercise-in-atopic-dermatitis-spontaneous-urticaria",
    "https://www.droracle.ai/articles/194160/holistic-approches-to-severe-eczema",
    "https://www.everydayhealth.com/eczema/diet",
    "https://www.everydayhealth.com/eczema/tips-using-elimination-diet-determine-root-cause-eczema",
    "https://www.healthcentral.com/condition/eczema/how-do-you-manage-eczema-when-exercising",
    "https://www.healthline.com/health/eczema/how-does-the-gut-skin-axis-affect-eczema",
    "https://www.healthline.com/health/skin-disorders/eczema-diet",
    "https://www.healthline.com/nutrition/supplements-for-eczema",
    "https://www.healthychildren.org/English/health-issues/conditions/skin/Pages/sports-and-eczema-how-to-help-your-child-prevent-flare-ups.aspx",
    "https://www.ihealthunifiedcare.com/articles/the-eczema-elimination-diet",
    "https://www.mamahealth.com/hand-eczema/handling-eczema-diet-complete-guide",
    "https://www.mayoclinic.org/diseases-conditions/atopic-dermatitis-eczema/diagnosis-treatment/drc-20353279",
    "https://www.mayoclinic.org/diseases-conditions/atopic-dermatitis-eczema/symptoms-causes/syc-20353273",
    "https://www.mdpi.com/1422-0067/22/8/4228",
    "https://www.mdpi.com/2076-2607/9/2/353",
    "https://www.medicalnewstoday.com/articles/320855",
    "https://www.medicalnewstoday.com/articles/eczema-gut-health",
    "https://www.medicalnewstoday.com/articles/exercising-with-eczema",
    "https://www.medicalnewstoday.com/articles/food-elimination-diet-children-eczema",
    "https://www.ncbi.nlm.nih.gov/books/NBK260249",
    "https://www.ncbi.nlm.nih.gov/books/NBK424896",
    "https://www.ncbi.nlm.nih.gov/books/NBK448071",
    "https://www.ncbi.nlm.nih.gov/books/NBK538209",
    "https://www.nhs.uk/conditions/atopic-eczema",
    "https://www.niaid.nih.gov/news-events/niaid-discovery-leads-novel-probiotic-eczema",
    "https://www.nuffieldhealth.com/article/eczema-5-ways-changing-your-diet-could-help",
    "https://www.owlstonemedical.com/about/blog/2024/oct/01/how-the-gut-microbiome-influences-skin-health-exploring-the-gut-skin-axis",
    "https://www.pierrefabreeczemafoundation.org/en/support/useful-advices/diet-and-eczema",
    "https://www.prosperabiotech.com/en/blog/eczema-and-exercise-treatment-and-causes",
    "https://www.rch.org.au/uploadedFiles/Main/Content/allergy/Eczema%20Food%20Allergies%20Other%20Triggers%281%29.pdf",
    "https://www.rch.org.au/uploadedFiles/Main/Content/allergy/Eczema%20Food%20Allergies%20Other%20Triggers(1).pdf",
    "https://www.researchgate.net/publication/303182290_Atopic_Dermatitis_Is_Associated_with_Less_Physical_Activity_in_US_Adults",
    "https://www.researchgate.net/publication/338550759_Impact_of_atopic_dermatitis_on_quality_of_life_in_adults_a_systematic_review_and_meta-analysis",
    "https://www.researchgate.net/publication/378748256_Dietary_Interventions_in_Atopic_Dermatitis_A_Comprehensive_Scoping_Review_and_Analysis",
    "https://www.ruh.nhs.uk/patients/patient_information/PAE003_Diet_and_eczema.pdf",
    "https://www.tandfonline.com/doi/full/10.1080/19490976.2025.2473524",
    "https://www.va.gov/WHOLEHEALTHLIBRARY/tools/supplements-for-skin-health.asp",
    "https://www.valleyskininstitute.com/eczema-triggers-the-worst-foods-you-need-to-avoid",
    "https://www.webmd.com/skin-problems-and-treatments/eczema/atopic-dermatitis-best-exercises",
    "https://www.webmd.com/skin-problems-and-treatments/eczema/eczema-exercise-tips",
    "https://www.webmd.com/skin-problems-and-treatments/eczema/ss/slideshow-supplements-for-eczema"
  ],
  "summary_citations": [
    "https://abbyroseskincare.com/blogs/news/a-holistic-approach-to-managing-eczema",
    "https://acaai.org/resource/my-child-has-severe-eczema-should-i-eliminate-certain-foods-from-their-diet",
    "https://academic.oup.com/bjd/article/188/6/718/6880686",
    "https://academic.oup.com/ced/article/47/8/1523/6692927",
    "https://accounts.google.com/SignOutOptions?hl=zh-CN&continue=https://gemini.google.com/app/b018ec52094f7b88&ec=GBRAkgU",
    "https://allergyasthmanetwork.org/news/eczema-and-exercise",
    "https://allergyasthmanetwork.org/news/eczema-and-exercise/#:~:text=Swimming%20is%20one%20of%20the,for%20many%20people%20with%20eczema.",
    "https://cdn.fortuneonline.org/articles/lifestyle-factors-in-the-clinical-manifestation-and-management-of-atopic-dermatitis.pdf",
    "https://dashscope.aliyuncs.com/compatible-mode/v1",
    "https://deannaminich.com/8-evidence-based-holistic-approaches-to-eczema",
    "https://eczema.org/information-and-advice/living-with-eczema/exercise-and-eczema",
    "https://health.clevelandclinic.org/eczema-diet",
    "https://hub.eaaci.org/resources_papers/a-systematic-review-and-meta-analysis-of-nutritional-and-dietary-interventions-in-randomized-controlled-trials-for-skin-symptoms-in-children-with-atopic-dermatitis-and-without-food-allergy-an-eaaci-t",
    "https://karger.com/iaa/article/185/6/545/896421/Dietary-Interventions-in-Atopic-Dermatitis-A",
    "https://nationaleczema.org/blog/eczema-exercise",
    "https://nationaleczema.org/blog/exercising-eczema",
    "https://nationaleczema.org/blog/food-elimination-diet-for-atopic-dermatitis",
    "https://nationaleczema.org/eczema",
    "https://nationaleczema.org/eczema-management",
    "https://nationaleczema.org/eczema-management/diet-nutrition",
    "https://nationaleczema.org/treatments/complementary-alternative",
    "https://nationaleczema.org/types-of-eczema",
    "https://nationaleczema.org/types-of-eczema/atopic-dermatitis",
    "https://nationaleczema.org/types-of-eczema/atopic-dermatitis/#:~:text=Eczema%20is%20a%20term%20for,predisposition%20to%20the%20skin%20condition.",
    "https://pmc.ncbi.nlm.nih.gov/articles/PMC10755759",
    "https://pmc.ncbi.nlm.nih.gov/articles/PMC10931328",
    "https://pmc.ncbi.nlm.nih.gov/articles/PMC11625510",
    "https://pmc.ncbi.nlm.nih.gov/articles/PMC11870655",
    "https://pmc.ncbi.nlm.nih.gov/articles/PMC3970830",
    "https://pmc.ncbi.nlm.nih.gov/articles/PMC4518179",
    "https://pmc.ncbi.nlm.nih.gov/articles/PMC5006549",
    "https://pmc.ncbi.nlm.nih.gov/articles/PMC5216171",
    "https://pmc.ncbi.nlm.nih.gov/articles/PMC5582672",
    "https://pmc.ncbi.nlm.nih.gov/articles/PMC5736303",
    "https://pmc.ncbi.nlm.nih.gov/articles/PMC6021588",
    "https://pmc.ncbi.nlm.nih.gov/articles/PMC6327646",
    "https://pmc.ncbi.nlm.nih.gov/articles/PMC6399565",
    "https://pmc.ncbi.nlm.nih.gov/articles/PMC6517242",
    "https://pmc.ncbi.nlm.nih.gov/articles/PMC6885041",
    "https://pmc.ncbi.nlm.nih.gov/articles/PMC9541324",
    "https://publications.aap.org/pediatrics/article/155/6/e2025071812/201952/Atopic-Dermatitis-Update-on-Skin-Directed",
    "https://pubmed.ncbi.nlm.nih.gov/11069570",
    "https://pubmed.ncbi.nlm.nih.gov/16309494",
    "https://pubmed.ncbi.nlm.nih.gov/25610977",
    "https://pubmed.ncbi.nlm.nih.gov/30465329",
    "https://pubmed.ncbi.nlm.nih.gov/30480774",
    "https://pubmed.ncbi.nlm.nih.gov/35978397",
    "https://vibrantskinbar.com/blog/holistic-eczema-treatment",
    "https://www.aaaai.org/tools-for-the-public/conditions-library/allergies/eczema-%28atopic-dermatitis%29-overview",
    "https://www.aaaai.org/tools-for-the-public/conditions-library/allergies/eczema-(atopic-dermatitis)-overview",
    "https://www.aad.org/member/clinical-quality/guidelines/atopic-dermatitis",
    "https://www.aad.org/public/diseases/eczema/types/atopic-dermatitis",
    "https://www.aafp.org/pubs/afp/issues/2012/0701/p35.html/1000",
    "https://www.aafp.org/pubs/afp/issues/2020/0515/p590.html",
    "https://www.aap.org/en/patient-care/atopic-dermatitis/treatment-of-atopic-dermatitis",
    "https://www.allergy.org.au/patients/fast-facts/eczema-and-food-allergy",
    "https://www.altitudedermatology.com/blog-post/diet-and-managing-eczema",
    "https://www.bioderma.co.uk/your-skin/dry-atopic-skin/itchy-and-atopic-skin-how-treat-it/eczema-cure-ideal-diet-children-atopic-skin",
    "https://www.cambridge.org/core/journals/behaviour-change/article/psychological-and-educational-interventions-for-atopic-dermatitis-in-adults-a-systematic-review-and-metaanalysis/DD089BACBE7ABEFAD2FCEC448F54F015",
    "https://www.chloemcleod.com/holistic-approach-to-managing-eczema-from-diet-to-skincare-products-to-environmental-factors",
    "https://www.dermatologytimes.com/view/the-role-of-exercise-in-atopic-dermatitis-spontaneous-urticaria",
    "https://www.droracle.ai/articles/194160/holistic-approches-to-severe-eczema",
    "https://www.everydayhealth.com/eczema/diet",
    "https://www.everydayhealth.com/eczema/tips-using-elimination-diet-determine-root-cause-eczema",
    "https://www.healthcentral.com/condition/eczema/how-do-you-manage-eczema-when-exercising",
    "https://www.healthline.com/health/eczema/how-does-the-gut-skin-axis-affect-eczema",
    "https://www.healthline.com/health/skin-disorders/eczema-diet",
    "https://www.healthline.com/nutrition/supplements-for-eczema",
    "https://www.healthychildren.org/English/health-issues/conditions/skin/Pages/sports-and-eczema-how-to-help-your-child-prevent-flare-ups.aspx",
    "https://www.ihealthunifiedcare.com/articles/the-eczema-elimination-diet",
    "https://www.mamahealth.com/hand-eczema/handling-eczema-diet-complete-guide",
    "https://www.mayoclinic.org/diseases-conditions/atopic-dermatitis-eczema/diagnosis-treatment/drc-20353279",
    "https://www.mayoclinic.org/diseases-conditions/atopic-dermatitis-eczema/symptoms-causes/syc-20353273",
    "https://www.mdpi.com/1422-0067/22/8/4228",
    "https://www.mdpi.com/2076-2607/9/2/353",
    "https://www.medicalnewstoday.com/articles/320855",
    "https://www.medicalnewstoday.com/articles/eczema-gut-health",
    "https://www.medicalnewstoday.com/articles/exercising-with-eczema",
    "https://www.medicalnewstoday.com/articles/food-elimination-diet-children-eczema",
    "https://www.ncbi.nlm.nih.gov/books/NBK260249",
    "https://www.ncbi.nlm.nih.gov/books/NBK424896",
    "https://www.ncbi.nlm.nih.gov/books/NBK448071",
    "https://www.ncbi.nlm.nih.gov/books/NBK538209",
    "https://www.nhs.uk/conditions/atopic-eczema",
    "https://www.niaid.nih.gov/news-events/niaid-discovery-leads-novel-probiotic-eczema",
    "https://www.nuffieldhealth.com/article/eczema-5-ways-changing-your-diet-could-help",
    "https://www.owlstonemedical.com/about/blog/2024/oct/01/how-the-gut-microbiome-influences-skin-health-exploring-the-gut-skin-axis",
    "https://www.pierrefabreeczemafoundation.org/en/support/useful-advices/diet-and-eczema",
    "https://www.prosperabiotech.com/en/blog/eczema-and-exercise-treatment-and-causes",
    "https://www.rch.org.au/uploadedFiles/Main/Content/allergy/Eczema%20Food%20Allergies%20Other%20Triggers%281%29.pdf",
    "https://www.rch.org.au/uploadedFiles/Main/Content/allergy/Eczema%20Food%20Allergies%20Other%20Triggers(1).pdf",
    "https://www.researchgate.net/publication/303182290_Atopic_Dermatitis_Is_Associated_with_Less_Physical_Activity_in_US_Adults",
    "https://www.researchgate.net/publication/338550759_Impact_of_atopic_dermatitis_on_quality_of_life_in_adults_a_systematic_review_and_meta-analysis",
    "https://www.researchgate.net/publication/378748256_Dietary_Interventions_in_Atopic_Dermatitis_A_Comprehensive_Scoping_Review_and_Analysis",
    "https://www.ruh.nhs.uk/patients/patient_information/PAE003_Diet_and_eczema.pdf",
    "https://www.tandfonline.com/doi/full/10.1080/19490976.2025.2473524",
    "https://www.va.gov/WHOLEHEALTHLIBRARY/tools/supplements-for-skin-health.asp",
    "https://www.valleyskininstitute.com/eczema-triggers-the-worst-foods-you-need-to-avoid",
    "https://www.webmd.com/skin-problems-and-treatments/eczema/atopic-dermatitis-best-exercises",
    "https://www.webmd.com/skin-problems-and-treatments/eczema/eczema-exercise-tips",
    "https://www.webmd.com/skin-problems-and-treatments/eczema/ss/slideshow-supplements-for-eczema"
  ]
}