{
  "query": "What are the main schools of thought in the study of intellectual history? It is known that there are the Cambridge School and the Strauss School, but what other schools are there? What are the characteristics of their methods in studying intellectual history?",
  "chain_of_research": {
    "plan_1": {
      "title": "Research Approach\nFocusing on Key Schools\nNext Steps",
      "description": "I'm beginning my research into the main schools of thought in intellectual history. My initial approach involves broadly searching for prominent schools beyond the Cambridge and Strauss Schools, which were already mentioned. I'll then delve into the specifics of each identified school, focusing on their characteristics, methodologies, key figures, and any associated criticisms or debates.\nI'm starting by gathering detailed information on the Cambridge School, exploring its emphasis on linguistic context and historical intentions through figures like Quentin Skinner and J.G.A. Pocock. Concurrently, I'll investigate the Strauss School, focusing on its unique approach to esoteric writing and philosophical interpretation, particularly through the work of Leo Strauss.\nMy next steps will involve identifying additional major schools of thought in intellectual history and then conducting similar in-depth investigations into their specific methodologies and contributions. I will also be looking for information on how these schools emerged, evolved, and their impact on the field."
    },
    "search_1": [
      "https://www.youtube.com/watch?v=h0CYD0c-hbY",
      "https://www.intellectualhistory.net/teaching/j-g-a-pocock",
      "https://www.atlantis-press.com/article/126009551.pdf",
      "https://en.wikipedia.org/wiki/J._G._A._Pocock",
      "https://isi.org/leo-strauss",
      "https://www.history.ox.ac.uk/intellectual-history",
      "https://en.wikipedia.org/wiki/Intellectual_history",
      "https://intellectualhistory.web.ox.ac.uk/article/cambridge-school-and-turn-present",
      "https://en.wikipedia.org/wiki/Cambridge_School_(intellectual_history",
      "https://cjh.uchicago.edu/issues/fall16/7.12.pdf",
      "https://en.wikipedia.org/wiki/Quentin_Skinner"
    ],
    "observation_1": "I've started by identifying several key schools of thought in intellectual history. Beyond the Cambridge and Strauss Schools, I've found mentions of the Lovejoy approach (History of Ideas), Foucault's approach, the Long Period approach, Global Intellectual History, and the History of Mentalities (associated with the Annales School). The Warsaw School of History of Ideas also appeared as a distinct entity.",
    "plan_2": {
      "title": "Deepening Understanding of Core Schools\nCharting Future Research",
      "description": "I'm now synthesizing information to build a more detailed understanding of the Cambridge School, focusing on its contextualist and linguistic methodologies, as championed by figures like Quentin Skinner and J.G.A. Pocock. Simultaneously, I'm exploring the Strauss School's emphasis on classical texts, its critique of modernity, and its distinctive concept of esoteric writing.\nMy next steps involve systematically gathering more in-depth information on the methodologies and characteristics of the Lovejoy approach, Foucault's approach, the Annales School (History of Mentalities), Conceptual History (with its link to 'Sattelzeit' and Koselleck), Global Intellectual History, and the Warsaw School. I will prioritize using existing search results for the Cambridge and Strauss Schools before initiating new searches for the other identified schools."
    },
    "search_2": [
      "https://en.wikipedia.org/wiki/Cambridge_School_(intellectual_history",
      "https://isi.org/leo-strauss",
      "https://www.atlantis-press.com/article/126009551.pdf",
      "https://intellectualhistory.web.ox.ac.uk/article/cambridge-school-and-turn-present",
      "https://library.fiveable.me/key-terms/world-history-since-1400/annales-school",
      "https://en.wikipedia.org/wiki/Arthur_Oncken_Lovejoy#:~:text=Lovejoy%20insisted%20that%20the%20history,active%20in%20the%20public%20arena.",
      "https://en.wikipedia.org/wiki/History_of_mentalities",
      "https://www.scribd.com/document/251714321/History-of-Ideas",
      "https://en.wikipedia.org/wiki/Reinhart_Koselleck",
      "https://www.cambridge.org/core/books/intellectual-history-and-the-problem-of-conceptual-change/kosellecks-begriffsgeschichte/6C92FD36E076B474EEA38FE5D5524F35",
      "https://www.corteidh.or.cr/tablas/r32759.pdf",
      "https://en.wikipedia.org/wiki/The_Archaeology_of_Knowledge",
      "https://ces.fas.harvard.edu/uploads/files/Reports-Articles/What-is-Intellectual-History-Essay-by-Peter-Gordon.pdf",
      "https://en.wikipedia.org/wiki/Warsaw_School_(history_of_ideas",
      "https://en.wikipedia.org/wiki/Warsaw_School_(history_of_ideas)#:~:text=Their%20methodology%20borrowed%20from%20Marxism,about%20their%20truth%20or%20falsity.",
      "https://www.unimi.it/en/education/degree-programme-courses/2025/global-intellectual-history"
    ],
    "observation_2": "I've successfully gathered initial information on several prominent schools of thought in intellectual history, including the Cambridge School, the Strauss School, Lovejoy's 'History of Ideas,' Foucault's approach, the Annales School (specifically 'History of Mentalities'), Conceptual History (Begriffsgeschichte), and the Warsaw School. This broadens my understanding beyond the initial two schools I was aware of.",
    "plan_3": {
      "title": "Deepening Understanding of Key Methodologies\nIdentifying and Addressing Information Gaps\nNext Research Steps",
      "description": "I've gained a clearer understanding of the Cambridge School's methodology, which emphasizes historical contextualism and views texts as interventions in ongoing political debates, focusing on what authors were 'doing' with their writing. This approach, influenced by Wittgenstein and Austin's ordinary language philosophy, aims to recover the author's intentions and the specific problems their texts were designed to solve. For the Strauss School, I've learned about its focus on classical texts, its critique of modern political thought, and its distinctive method of reading for 'hidden' or esoteric meanings, believing that ancient philosophers often concealed their true messages from casual readers.\nWhile I have a good foundation, I've identified specific areas for further investigation. I need to explicitly explore the historical development and lasting influence of both the Cambridge and Strauss Schools. My understanding of 'Global Intellectual History' as a distinct field, beyond a course description, is still limited, so I'll conduct a more targeted search for its core principles and key figures. Additionally, I need to systematically look for criticisms and debates surrounding all the identified schools to ensure a comprehensive overview.\nMy immediate next steps involve refining my understanding of the Cambridge School's 'speech acts' methodology with more specific examples, and explicitly searching for the historical development and lasting influence of both the Cambridge and Strauss Schools. I will also perform a more targeted search for the key figures, core principles, and methodological approaches of Global Intellectual History. Finally, I will search for criticisms of the Lovejoy approach, Foucault's approach, the Annales School, Conceptual History, and the Warsaw School to ensure a balanced perspective."
    },
    "search_3": [
      "https://en.wikipedia.org/wiki/Critique_and_Crisis",
      "https://brill.com/downloadpdf/journals/mtsr/12/1-4/article-p477_31.pdf",
      "https://germanhistory-intersections.org/en/knowledge-and-education/ghis:document-129",
      "https://projects.iq.harvard.edu/files/history/files/what_is_intell_history_pgordon_mar2012.pdf",
      "https://www.ebsco.com/research-starters/history/leo-strauss",
      "https://en.wikipedia.org/wiki/Leo_Strauss",
      "https://intellectualhistory.web.ox.ac.uk/article/cambridge-school-and-turn-present",
      "https://www.qmul.ac.uk/history/media/ph/news/The-Cambridge-School.pdf",
      "https://en.wikipedia.org/wiki/History_of_mentalities#:~:text=In%20particular%2C%20Marxist%20historians%20were,disparagement%20of%20reason.%22%20Carlo%20Ginzburg",
      "https://marywcraig.com/2015/04/26/the-annales-school",
      "https://educationmuseum.wordpress.com/2012/06/01/history-archaeology-and-genealogy",
      "https://pages.jh.edu/jhumag/0400web/28.html#:~:text=Some%20of%20his%20critics%20have,greatest%20contribution%20was%20his%20method.",
      "https://muse.jhu.edu/article/650166/summary",
      "http://www.yorku.ca/christo/papers/digarch3.htm",
      "https://www.unimi.it/en/education/degree-programme-courses/2025/global-intellectual-history",
      "https://ces.fas.harvard.edu/uploads/files/Reports-Articles/What-is-Intellectual-History-Essay-by-Peter-Gordon.pdf"
    ],
    "observation_3": "I've made significant progress in detailing the characteristics and methodologies of various schools of thought in intellectual history. I now have a solid understanding of the Cambridge School's contextualist approach, emphasizing authorial intention and 'speech acts' within historical contexts, and the Strauss School's focus on classical texts and the concept of 'esoteric writing' to address the crisis of modernity. I've also gathered information on Lovejoy's 'History of Ideas' and its 'unit-idea' methodology, Foucault's 'Archaeology' and 'Genealogy' for analyzing power and discourse, the Annales School's 'History of Mentalities' aiming for 'total history,' Conceptual History (Begriffsgeschichte) with its focus on the historical semantics of terms, and the Warsaw School's emphasis on researcher objectivity and pluralism.",
    "plan_4": {
      "title": "Identifying Key Figures and Criticisms\nAddressing Information Gaps for Global Intellectual History\nNext Steps in Research",
      "description": "For each school, I've identified key figures associated with their development and core principles. I've also begun to note criticisms and debates surrounding these approaches, such as the Cambridge School's early 'antiquarianism' critique, the Strauss School's potential for speculative interpretations, and the Annales School's fragmentation. This helps in understanding the ongoing scholarly discourse within the field.\nWhile I have a good overview of many schools, I've identified a specific information gap regarding 'Global Intellectual History.' My previous searches provided only a course description, so I still need to pinpoint its key figures, core principles, and detailed methodological approaches as a distinct field of study. This is crucial for a comprehensive understanding of the intellectual history landscape.\nMy next step is to conduct a more targeted search for information on Global Intellectual History to fully understand its methodologies and key proponents. Once I have this, I will synthesize all the gathered information to provide a comprehensive overview of the main schools of thought in intellectual history, their characteristics, and their methods."
    },
    "search_4": [
      "https://history.fas.harvard.edu/theme/intellectual-history",
      "https://www.tandfonline.com/journals/rgih20/about-this-journal",
      "https://www.unimi.it/en/education/degree-programme-courses/2025/global-intellectual-history",
      "https://encyclopedia.pub/entry/36565"
    ]
  },
  "final_report": "# **Major Schools of Thought in Intellectual History: Methodologies, Characteristics, and Evolution**\n\n## **1. Introduction: Defining Intellectual History and its Diverse Approaches**\n\n### **1 @https://ces.fas.harvard.edu/uploads/files/Reports-Articles/What-is-Intellectual-History-Essay-by-Peter-Gordon.pdf> . The Field of Intellectual History**\n\nIntellectual history is a dynamic and multifaceted field of study, broadly concerned with the examination of intellectuals, ideas, and intellectual patterns across the expanse of time @https://ces.fas.harvard.edu/uploads/files/Reports-Articles/What-is-Intellectual-History-Essay-by-Peter-Gordon.pdf>  Its inherent eclecticism and resistance to a singular, universally accepted definition are defining features of the discipline @https://ces.fas.harvard.edu/uploads/files/Reports-Articles/What-is-Intellectual-History-Essay-by-Peter-Gordon.pdf>  The roots of intellectual history can be traced back to European disciplines such as\n\n*Kulturgeschichte* (Cultural History) and *Geistesgeschichte* (Intellectual History), drawing inspiration from foundational figures like Voltaire and Jacob Burckhardt @https://en.wikipedia.org/wiki/Intellectual_history> \n\nThe contemporary understanding of intellectual history, initially conceptualized as \"the history of ideas,\" gained systematic academic traction in the immediate post-World War II period of the 1940s. This development was significantly shaped by the leadership of Arthur Lovejoy, who notably founded the *Journal of the History of Ideas* @https://en.wikipedia.org/wiki/Intellectual_history>  A hallmark of intellectual history practitioners is their acute awareness of their own methodological commitments, indicating that a deep engagement with historical method is not merely an auxiliary concern but a core characteristic of the discipline itself @https://ces.fas.harvard.edu/uploads/files/Reports-Articles/What-is-Intellectual-History-Essay-by-Peter-Gordon.pdf> \n\n### **1 @https://en.wikipedia.org/wiki/Intellectual_history> . Foundational Questions and Methodological Divergences**\n\nThe field of intellectual history encompasses a wide array of approaches, often distinguishing itself from pure philosophy. While intellectual history frequently involves the meticulous reconstruction of philosophical arguments as they appear in formal texts, its primary objective is to \"understand\" a given intellectual problem or perspective rather than to \"defend\" or \"refute\" it on philosophical grounds @https://ces.fas.harvard.edu/uploads/files/Reports-Articles/What-is-Intellectual-History-Essay-by-Peter-Gordon.pdf>  This distinction underscores a fundamental difference in disciplinary aims. Intellectual historians generally approach ideas as historically conditioned phenomena, best understood within their broader contexts—whether social struggles, institutional frameworks, or specific linguistic environments—thereby resisting the \"Platonist expectation\" that an idea can be defined in isolation from the world @https://ces.fas.harvard.edu/uploads/files/Reports-Articles/What-is-Intellectual-History-Essay-by-Peter-Gordon.pdf>  This stance fosters skepticism towards decontextualized evaluation, emphasizing the embeddedness of thought in its historical milieu.\n\nThe evolution of the field from its earlier incarnation as \"the history of ideas\" to the more nuanced \"intellectual history\" represents a significant maturation of the discipline, marked by heightened methodological self-awareness. Arthur Lovejoy's initial \"history of ideas\" approach, for instance, focused on identifying \"unit-ideas\" that could be traced across different periods, implying a certain trans-historical stability of concepts @https://en.wikipedia.org/wiki/Arthur_Oncken_Lovejoy#:~:text=Lovejoy%20insisted%20that%20the%20history,active%20in%20the%20public%20arena.>  However, subsequent schools, notably the Cambridge School 5 and Michel Foucault's analytical frameworks 6, explicitly challenged this perspective. They emphasized the radical historicity and contextual embeddedness of ideas, arguing that concepts are not timeless entities but are profoundly shaped by specific historical conditions. This critical dialogue and refinement of approaches have directly contributed to the field's explicit concern with its own methodologies, moving beyond a simple chronicle of ideas to a more rigorous and critical engagement with how ideas function in history.\n\nA crucial characteristic of intellectual history is its inherent interdisciplinarity. The discipline is often described as eclectic, bearing close resemblances to philosophy, political theory, cultural history, and sociology @https://ces.fas.harvard.edu/uploads/files/Reports-Articles/What-is-Intellectual-History-Essay-by-Peter-Gordon.pdf>  This pervasive cross-disciplinary engagement is not accidental but fundamental to its practice. Various schools within intellectual history draw heavily from diverse intellectual traditions: the European cultural and intellectual history tradition 2, the sociological, anthropological, and geographical insights of the Annales School 7, the linguistic theories informing the Cambridge School and Conceptual History 5, and the complex blend of Marxism, hermeneutics, existentialism, and structuralism adopted by the Warsaw School @https://en.wikipedia.org/wiki/Warsaw_School_%28history_of_ideas%29  This broad methodological borrowing allows for a richer and more comprehensive analysis of intellectual formations, recognizing that ideas are not isolated phenomena but are deeply intertwined with social, political, cultural, and linguistic structures. While this eclecticism enables profound insights, it can also invite critiques regarding a potential lack of philosophical rigor or a perceived diffusion of focus @https://ces.fas.harvard.edu/uploads/files/Reports-Articles/What-is-Intellectual-History-Essay-by-Peter-Gordon.pdf> \n\n## **2. The Cambridge School: Contextualism and Linguistic Action**\n\n### **2 @https://ces.fas.harvard.edu/uploads/files/Reports-Articles/What-is-Intellectual-History-Essay-by-Peter-Gordon.pdf> . Origins and Key Figures**\n\nThe Cambridge School is a prominent, albeit loosely defined, historiographical movement traditionally associated with the University of Cambridge. It began to gain significant academic recognition in the late 1960s @https://en.wikipedia.org/wiki/Intellectual_history>  The foundational figures most closely linked with this approach include Quentin Skinner, J.G.A. Pocock, and John Dunn @https://en.wikipedia.org/wiki/Intellectual_history>  Their work built upon and was influenced by earlier innovative historical scholarship, such as Peter Laslett's studies on Filmer and Locke conducted between the late 1940s and 1960s @https://www.qmul.ac.uk/history/media/ph/news/The-Cambridge-School.pdf>  J.G.A. Pocock played a pivotal role in initially identifying and articulating the characteristics of what came to be known as the \"Cambridge School\" in the early 1970s @https://www.qmul.ac.uk/history/media/ph/news/The-Cambridge-School.pdf> \n\n### **2 @https://en.wikipedia.org/wiki/Intellectual_history> . Core Principles: Historical Contextualism and Anti-Anachronism**\n\nThe Cambridge School is fundamentally characterized by a \"historicist or contextualist mode of interpretation\" @https://en.wikipedia.org/wiki/Cambridge_School_%28intellectual_history%29  This approach mandates that intellectual historians understand the works of past authors not as timeless philosophical statements, but as \"historically specific responses to local questions\" that arose within a particular social and political environment @https://intellectualhistory.web.ox.ac.uk/article/cambridge-school-and-turn-present>  A central tenet is the explicit opposition to \"perceived anachronism\" and \"teleology,\" which are seen as distortions that impose modern meanings or predetermined historical trajectories onto past ideas @https://en.wikipedia.org/wiki/Cambridge_School_%28intellectual_history%29  Quentin Skinner's influential 1969 article, 'Meaning and Understanding in the History of Ideas,' served as a foundational text, critiquing both \"perennialism\"—the belief that philosophers consistently debate the same fundamental questions across history—and the notion that historical texts can be adequately understood without their specific historical context @https://en.wikipedia.org/wiki/Cambridge_School_%28intellectual_history%29  The school's acceptance of ideas as constitutive elements of human history positions it as \"idealist,\" distinguishing it from social-scientific positivism in historiography @https://en.wikipedia.org/wiki/Cambridge_School_%28intellectual_history%29 \n\n### **2 @https://en.wikipedia.org/wiki/Arthur_Oncken_Lovejoy#:~:text=Lovejoy%20insisted%20that%20the%20history,active%20in%20the%20public%20arena.> . Specific Methodological Approaches: Linguistic Context and Speech Acts**\n\nA defining feature of the Cambridge School's methodology is its profound emphasis on linguistic context. Scholars associated with this school meticulously study \"a history of language, of vocabularies, grammars, rhetorics, and their usages,\" primarily as expressed in written and printed forms @https://en.wikipedia.org/wiki/Cambridge_School_%28intellectual_history%29  J.G.A. Pocock, for instance, argued that their work should not be conflated with broader \"history of ideas\" or \"conceptual history\" approaches, stressing instead the concrete historical forms through which ideas manifest in language @https://en.wikipedia.org/wiki/Cambridge_School_%28intellectual_history%29 \n\nQuentin Skinner's significant contribution lies in his theory of interpretation, which treats canonical texts in the history of political theory as active \"interventions in on-going political debates\" @https://en.wikipedia.org/wiki/Quentin_Skinner>  The primary analytical focus is on discerning \"what individual writers may be said to have been doing in what they wrote\" @https://en.wikipedia.org/wiki/Quentin_Skinner>  This understanding of political writing as a \"form of action\" is deeply rooted in ordinary language philosophy, particularly drawing from the insights of Ludwig Wittgenstein, who emphasized the functions of words in different language games, and J.L. Austin, who developed the concept of a speech act, meaning that \"whenever we use language for purposes of communication, we are always doing something as well as saying something\" @https://en.wikipedia.org/wiki/Quentin_Skinner> \n\nConsequently, for the Cambridge School, historians must recover not merely the explicit content of what a thinker stated, but, more critically, \"what a thinker hoped to achieve in saying it\" @https://en.wikipedia.org/wiki/Quentin_Skinner>  Skinner applies Austin's framework of \"locutionary, illocutionary, and perlocutionary acts\" to analyze the intended communication (locutionary), the performative enactment (illocutionary), and the desired response (perlocutionary) of a historical utterance @https://brill.com/downloadpdf/journals/mtsr/12/1-4/article-p477_31.pdf>  He maintains that for a speech act to be meaningful as a historical intervention, it must represent the \"deliberate, voluntary action of individuals,\" thereby affirming the importance of authorial intentionality in their interpretive framework @https://brill.com/downloadpdf/journals/mtsr/12/1-4/article-p477_31.pdf> \n\n### **2 @https://www.scribd.com/document/251714321/History-of-Ideas> . Historical Development and Influence**\n\nInitially, the Cambridge School's rigorous contextualism drew criticism, with some observers arguing that it effectively severed intellectual history from contemporary relevance, reducing it to a \"mere antiquarian affair\" @https://intellectualhistory.web.ox.ac.uk/article/cambridge-school-and-turn-present>  However, a notable shift, described as a \"volte-face,\" occurred in the 1990s. Quentin Skinner began to advocate for the contextual study of intellectual history as a means of \"recovering alternative ways of thought\" that could indeed prove valuable for understanding and addressing current circumstances @https://intellectualhistory.web.ox.ac.uk/article/cambridge-school-and-turn-present> \n\nThis evolved approach includes the \"investigation of paths not taken,\" which entails the historical recovery of long-abandoned modes of social organization or forgotten ways of thinking about fundamental concepts like liberty, equality, and capitalism. This endeavor aims to illuminate the \"contingency of the present,\" demonstrating that historical outcomes \"could have been otherwise\" @https://intellectualhistory.web.ox.ac.uk/article/cambridge-school-and-turn-present>  The contextualism of the Cambridge School, particularly through its engagement with genealogical approaches, now implies a \"political intervention.\" This intervention takes the form of a hermeneutic that enables a fresh understanding of both past and contemporary thought by explicitly linking it to its political context @https://intellectualhistory.web.ox.ac.uk/article/cambridge-school-and-turn-present> \n\nThe Cambridge School's evolution from a strict anti-anachronistic stance to embracing the recovery of \"paths not taken\" for present relevance represents a sophisticated engagement with the problem of presentism. While the initial Cambridge approach vehemently rejected projecting modern concerns onto historical texts, viewing such anachronism as a distortion of past meaning and a counter to approaches seeking \"perennial\" philosophical questions 5, Skinner's later shift suggests a recognition that historical inquiry, even when rigorously contextual, cannot entirely detach itself from its contemporary context. By exploring \"alternative ways of thought\" or \"paths not taken,\" the school uses historical analysis not to find direct answers for the present in the past, but to illuminate the fundamental contingency of current realities. This means understanding that things as they are \"could have been otherwise\" 11, a perspective that can empower critical reflection and potential action in the present. This nuanced approach aligns with similar developments in Michel Foucault's \"history of the present\" 6, indicating a broader trend within the field towards a critically engaged, rather than purely antiquarian, historical practice.\n\n### **2 @https://en.wikipedia.org/wiki/Cambridge_School_%28intellectual_history%29 . Internal Debates and Criticisms**\n\nA key point of contention surrounding Skinner's approach concerns the knowability of authorial intentions. Critics argue that intentions are often \"absent from historical evidence\" and that the actual effect of speech acts depends more on \"public construal and response\" than on the subjective intent of the author @https://brill.com/downloadpdf/journals/mtsr/12/1-4/article-p477_31.pdf>  This raises fundamental questions about the limits of historical interpretation.\n\nDespite being frequently grouped together, the leading figures of the Cambridge School—Pocock, Skinner, and Dunn—developed \"distinct concerns\" within intellectual history and political theory. Pocock primarily focused on the history of historical understanding, Skinner on the history of philosophy, and Dunn increasingly prioritized political theory over historical research @https://www.qmul.ac.uk/history/media/ph/news/The-Cambridge-School.pdf>  This divergence highlights the internal heterogeneity of the school. Furthermore, Skinner's later emphasis on the ideology of republicanism, which he characterized as a \"neo-Roman\" style of thought, also marked a \"divergence in political agenda\" within the broader movement @https://www.qmul.ac.uk/history/media/ph/news/The-Cambridge-School.pdf> \n\nThe Cambridge School's deep engagement with speech act theory transforms the understanding of historical texts from mere repositories of ideas into active interventions within specific historical debates @https://en.wikipedia.org/wiki/Quentin_Skinner>  By focusing on \"what writers were doing\" in their texts, the Cambridge School moves beyond a purely semantic or propositional analysis of ideas. This implies that language is not merely a transparent medium for conveying thought but a performative tool used to achieve specific effects within a social and political context. The historian's task, therefore, becomes akin to an interpreter of strategic communication, aiming to uncover the\n\n*illocutionary force* (what was intended to be done by saying something) and the *perlocutionary effect* (the impact on the audience) of historical utterances. This elevates the historian's role from a simple chronicler to a reconstructive analyst of past political and intellectual maneuvers. The ongoing discussion regarding the knowability of \"authorial intention\" 13 underscores a fundamental epistemological challenge within this approach, pointing to an inherent tension between the ideal of recovering original intent and the practical limitations imposed by the nature of historical evidence.\n\n## **3. The Strauss School: Classical Texts and Esoteric Interpretation**\n\n### **3 @https://ces.fas.harvard.edu/uploads/files/Reports-Articles/What-is-Intellectual-History-Essay-by-Peter-Gordon.pdf> . Key Figure and Origins**\n\nThe Strauss School is centered around the influential political philosopher Leo Strauss (1899-1973), a German-American scholar @https://www.atlantis-press.com/article/126009551.pdf>  Strauss's intellectual trajectory was profoundly shaped by the political and social upheavals of late 19th and early 20th century Germany, as well as his formative studies with prominent philosophers such as Edmund Husserl and Martin Heidegger @https://isi.org/leo-strauss/>  After immigrating to the United States, he developed his distinctive approach to political philosophy, particularly as a professor at the University of Chicago, where his teachings significantly influenced a group of students and followers, leading to what became known as the \"Chicago School of Political Philosophy\" @https://isi.org/leo-strauss/> \n\n### **3 @https://en.wikipedia.org/wiki/Intellectual_history> . Core Principles: Critique of Modernity and Recovery of Classical Political Philosophy**\n\nA central tenet of Strauss's thought is his comprehensive critique of modernity. He contended that modernity, which he traced to Niccolò Machiavelli in the 15th century, represented a \"radical break\" from the enduring tradition of Western civilization. This break, in his view, led to a profound \"crisis of nihilism, relativism, historicism, and scientism\" @https://en.wikipedia.org/wiki/Leo_Strauss>  He argued that modern political and social sciences, with their empirical focus and rational analysis, had become detached from and consequently failed to address the fundamental questions of human nature, morality, and justice @https://en.wikipedia.org/wiki/Leo_Strauss> \n\nAs a remedy to this perceived crisis, Strauss proposed a \"return to the source and capturing the classics\" 14, advocating for a recovery of the ancient understanding of politics and philosophy @https://isi.org/leo-strauss/>  For Strauss, political philosophy is inherently concerned with \"questioning the best political system, the right way of life, fair governance, prestige, knowledge, and the necessary influence of power\" @https://www.atlantis-press.com/article/126009551.pdf>  He firmly believed that philosophy is \"essentially political,\" underscoring the inseparable link between philosophical inquiry and the organization of human society @https://www.atlantis-press.com/article/126009551.pdf>  A significant theme explored in his work, particularly in \"Natural Rights and History,\" is the historical transformation from the classical political philosophy that prioritized \"good before right\" to the modern Western concept of \"right before good\" @https://www.atlantis-press.com/article/126009551.pdf> \n\nStrauss viewed \"historicism\" as another \"philosophical cave\" that ultimately leads to nihilism by eroding all objective value standards @https://www.atlantis-press.com/article/126009551.pdf>  He maintained that historical \"experience\" derived from scattered historical knowledge is, in its essence, \"nothing but a history of thought\" @https://www.atlantis-press.com/article/126009551.pdf>  Consequently, he emphasized \"regression over progress,\" believing that revisiting the original starting points of philosophical inquiry allows for a clearer understanding of fundamental problems, unburdened by subsequent interpretations and historical accretions @https://www.atlantis-press.com/article/126009551.pdf> \n\nStrauss's work is not merely a historical analysis but a profound philosophical diagnosis of a \"crisis of modernity\" 14 that fundamentally underpins his entire methodological and interpretive approach. His personal experiences of political instability in Germany 15 and his critique of modern political thought 17 are explicitly linked to a perceived decline in moral and political standards, culminating in what he termed \"nihilism, relativism, historicism, and scientism\" @https://en.wikipedia.org/wiki/Leo_Strauss>  His call for a \"return to the classics\" and his concept of esoteric writing are presented as a \"secret medicine\" 14 to address this crisis. This reveals a deeply normative dimension to his intellectual history: it is not simply about understanding the past for its own sake, but about utilizing the wisdom of the past to correct the perceived pathologies of the present. This contrasts sharply with the Cambridge School's initial anti-presentism 11, highlighting a fundamental divergence in the ultimate purpose of intellectual historical inquiry between these two schools.\n\n### **3 @https://en.wikipedia.org/wiki/Arthur_Oncken_Lovejoy#:~:text=Lovejoy%20insisted%20that%20the%20history,active%20in%20the%20public%20arena.> . Specific Methodological Approaches: Esoteric Writing and Deep Reading**\n\nStrauss advocated for a \"careful and respectful reading of the classical texts\" 17, a practice that forms the bedrock of his methodology. His most distinctive methodological concept is \"esoteric writing,\" which he also termed \"the art of writing\" @https://en.wikipedia.org/wiki/Leo_Strauss>  He posited that many great philosophers, particularly from antiquity, employed a \"hidden and visible\" or \"subtle\" writing style. This was done to conceal their true, often radical or potentially dangerous, meanings from casual readers or political authorities, thereby protecting themselves from persecution @https://www.atlantis-press.com/article/126009551.pdf> \n\nThis \"dual communication\" allowed philosophers to engage with both the broader political context through an \"exoteric\" message, and to convey deeper, more profound philosophical questions through an \"esoteric\" message reserved for a discerning few @https://isi.org/leo-strauss/>  A key purpose of esoteric writing, in Strauss's view, was also to \"educate and guide future young people\" who possessed the intellectual capacity to discern \"political legitimacy\" @https://www.atlantis-press.com/article/126009551.pdf>  His pedagogical method at the University of Chicago reflected this, involving a Socratic approach that encouraged students to critically engage directly with texts and actively seek out these \"hidden\" meanings @https://isi.org/leo-strauss/>  He employed a \"hermeneutic technique\" for deep reading, aiming to distinguish between the surface and deeper, implicit meanings of classical texts @https://www.atlantis-press.com/article/126009551.pdf>  Strauss's historical focus was predominantly \"political history\" 14, and he frequently utilized comparative analysis to establish intellectual coordinates and highlight the evolution of concepts @https://www.atlantis-press.com/article/126009551.pdf> \n\n### **3 @https://www.scribd.com/document/251714321/History-of-Ideas> . Historical Development and Influence**\n\nStrauss's intellectual legacy, particularly through his students and followers, continues to exert significant influence on conservative thought, emphasizing the enduring importance of classical ideas in contemporary political discourse @https://www.ebsco.com/research-starters/history/leo-strauss>  He argued that philosophers, by virtue of their unique understanding of fundamental truths, could serve as \"essential advisers to political leaders\" @https://www.ebsco.com/research-starters/history/leo-strauss>  He contended that the state often relies on \"noble fictions\" about its founding and that it frequently employs coercive means to maintain its existence. Philosophers who openly expose these underlying truths, Strauss believed, risk punishment from the state @https://www.ebsco.com/research-starters/history/leo-strauss> \n\n### **3 @https://en.wikipedia.org/wiki/Cambridge_School_%28intellectual_history%29 . Internal Debates and Criticisms**\n\nCritics of Strauss's interpretation argue that he \"overstates the extent to which philosophers employed esotericism\" and question whether his method of uncovering hidden meanings is \"overly speculative,\" suggesting that his interpretations might reflect his own philosophical agenda more than the original authors' actual intent @https://isi.org/leo-strauss/>  Some contend that his approach leads to an \"overly intellectualized reading\" of philosophical texts, potentially overlooking their crucial social and historical contexts @https://isi.org/leo-strauss/>  Notably, the Cambridge School, particularly through the work of Quentin Skinner, explicitly developed its contextualist methodology partly as a direct critique of Strauss and his followers @https://en.wikipedia.org/wiki/Quentin_Skinner> \n\nStrauss's concept of esoteric writing 17 transforms the act of philosophical interpretation into an inherently political and potentially subversive endeavor. If, as Strauss argues, ancient philosophers wrote esoterically to protect themselves from persecution and to communicate only to a select, discerning few 17, then the act of interpreting these texts becomes more than a mere scholarly exercise. The interpreter, in the Straussian view, assumes the role of uncovering these hidden truths, thereby participating in what Strauss called \"the great conversation\" 17 and potentially challenging prevailing \"noble fictions\" of the state @https://www.ebsco.com/research-starters/history/leo-strauss>  This suggests that for the Strauss School, intellectual history is not merely descriptive but prescriptive, aiming to recover a \"right way of life\" and the \"best political system\" @https://www.atlantis-press.com/article/126009551.pdf>  The criticisms that his method is \"overly speculative\" or reflects his \"own philosophical agenda\" 15 underscore the subjective and potentially ideological nature of this interpretive act, raising questions about the precise line between historical reconstruction and philosophical advocacy.\n\n## **4. The History of Ideas (Lovejoy Approach): Tracing Unit-Ideas**\n\n### **4 @https://ces.fas.harvard.edu/uploads/files/Reports-Articles/What-is-Intellectual-History-Essay-by-Peter-Gordon.pdf> . Key Figure and Origins**\n\nArthur Oncken Lovejoy (1873-1962) is widely acknowledged as the central figure who initiated the systematic study of the history of ideas in the early 20th century @https://en.wikipedia.org/wiki/Intellectual_history>  His pivotal role in establishing the\n\n*Journal of the History of Ideas* further cemented his legacy and provided a crucial institutional platform for the burgeoning field @https://en.wikipedia.org/wiki/Intellectual_history> \n\n### **4 @https://en.wikipedia.org/wiki/Intellectual_history> . Core Principle: The \"Unit-Idea\"**\n\nLovejoy's core principle for the history of ideas revolved around the analysis of \"unit ideas,\" which he defined as \"single concepts\" or \"individual concepts\" @https://en.wikipedia.org/wiki/Arthur_Oncken_Lovejoy#:~:text=Lovejoy%20insisted%20that%20the%20history,active%20in%20the%20public%20arena.>  These unit-ideas were posited as being relatively stable over time, yet possessing the capacity to \"recombine over history\" in novel patterns and to manifest in diverse forms across different historical eras @https://www.scribd.com/document/251714321/History-of-Ideas>  The focus was on tracing these fundamental conceptual building blocks through various intellectual landscapes.\n\n### **4 @https://en.wikipedia.org/wiki/Arthur_Oncken_Lovejoy#:~:text=Lovejoy%20insisted%20that%20the%20history,active%20in%20the%20public%20arena.> . Specific Methodological Approaches**\n\nThe \"unit-idea\" methodology involves the systematic extraction of a basic idea from a specific philosophical work or a broader philosophical movement @https://en.wikipedia.org/wiki/Intellectual_history>  Lovejoy proposed a set of specific investigative principles to guide this methodology: (1) the identification of underlying\n\n**assumptions** that inform the unit-idea; (2) the analysis of **dialectical motives**, referring to the forces or reasons driving the development and interaction of ideas; (3) an understanding of **metaphysical pathos**, which relates to the emotional or affective dimension associated with certain philosophical concepts; and (4) a rigorous examination of **philosophical semantics**, involving the meaning and interpretation of philosophical terms within their historical context @https://en.wikipedia.org/wiki/Intellectual_history>  These principles were intended to define the overarching philosophical movement or intellectual milieu in which a unit-idea could be found and subsequently traced throughout its historical trajectory @https://www.scribd.com/document/251714321/History-of-Ideas>  Lovejoy's seminal work,\n\n*The Great Chain of Being*, stands as a comprehensive example of his intended program and the broad scope he envisioned for the study of the history of ideas @https://www.scribd.com/document/251714321/History-of-Ideas> \n\n### **4 @https://www.scribd.com/document/251714321/History-of-Ideas> . Internal Debates and Criticisms**\n\nA significant criticism leveled against Lovejoy's approach was that the \"unit-idea was something that existed in the minds of certain investigators rather than in reality\" @https://pages.jh.edu/jhumag/0400web/28.html#:~:text=Some%20of%20his%20critics%20have,greatest%20contribution%20was%20his%20method.>  This critique suggests a potential for imposing pre-conceived conceptual frameworks onto historical data rather than allowing them to emerge organically from the sources themselves. His contribution is sometimes noted more for his \"formal and materialist sense of ideas\" than for a deep sensitivity to the specificity of literary objects or the nuanced complexities of historical context @https://muse.jhu.edu/article/650166/summary> \n\nLovejoy's emphasis on \"unit-ideas\" that \"recombine\" 4 highlights an early, and ultimately contested, attempt to reconcile the perceived continuity of certain concepts with their dynamic historical manifestations. By positing \"unit-ideas\" as fundamentally stable entities that merely rearrange themselves, Lovejoy's approach implies a degree of trans-historical continuity in intellectual development. This stands in contrast to later schools, such as Michel Foucault's 6, which emphasize radical discontinuity and the historical contingency of concepts. The criticism that \"unit-ideas\" might exist more in the \"minds of investigators than in reality\" 19 points to the inherent challenge of imposing fixed analytical categories onto fluid historical phenomena. This tension between identifying enduring conceptual structures and acknowledging radical historical change remains a central methodological discussion in intellectual history, with Lovejoy's work serving as a foundational reference point for this ongoing debate.\n\nWhile Lovejoy's methodology aimed for systematic analysis, its primary focus on extracting and tracing \"unit-ideas\" implicitly carried the risk of decontextualizing ideas from their rich historical, linguistic, and social environments. If a \"unit-idea\" is isolated from a philosophical work and then followed across different periods 2, there is an inherent danger of overlooking or underplaying the specific nuances of its meaning and function within its original context. This aligns with the Cambridge School's critique of \"perennialism\" and the \"irrelevance of context\" @https://en.wikipedia.org/wiki/Cambridge_School_%28intellectual_history%29  Although Lovejoy's investigative principles (assumptions, dialectical motives, etc. 2) attempt to provide some contextual grounding, the primary analytical focus on the \"unit\" itself can lead to an \"internalist\" method, where conceptual evolution is prioritized over broader social, political, or institutional influences @https://ces.fas.harvard.edu/uploads/files/Reports-Articles/What-is-Intellectual-History-Essay-by-Peter-Gordon.pdf>  This methodological choice has significant implications for how deeply one can understand the\n\n*force* or *impact* of an idea as an active element in its historical moment.\n\n## **5. The Annales School: History of Mentalities and Longue Durée**\n\n### **5 @https://ces.fas.harvard.edu/uploads/files/Reports-Articles/What-is-Intellectual-History-Essay-by-Peter-Gordon.pdf> . Key Figures and Origins**\n\nThe Annales School is a highly influential French historical movement that emerged in the early 20th century @https://library.fiveable.me/key-terms/world-history-since-1400/annales-school>  It was founded by prominent historians Marc Bloch and Lucien Febvre in 1929 @https://library.fiveable.me/key-terms/world-history-since-1400/annales-school>  Within this broader movement, the specific concept of \"history of mentalities\" originated with Marc Bloch's writings and was subsequently developed by later theorists, most notably Georges Duby and Roger Chartier @https://en.wikipedia.org/wiki/History_of_mentalities> \n\n### **5 @https://en.wikipedia.org/wiki/Intellectual_history> . Core Principles: Total History and Long-Term Structures**\n\nThe Annales School fundamentally challenged traditional historiography by consciously prioritizing \"social and economic structures over political events\" @https://library.fiveable.me/key-terms/world-history-since-1400/annales-school>  Their overarching goal was to create \"total history,\" which involved a comprehensive reconstruction of the world of a specific time period. This ambition meant moving beyond conventional political or event-oriented history to integrate the \"skeleton of the basic economic analysis with the flesh of demographic, cultural, mental, and even psychoanalytical data\" @https://en.wikipedia.org/wiki/History_of_mentalities> \n\nA critical concept introduced by the Annales School is \"la longue durée\" (the long duration), which emphasizes the profound importance of \"long-term historical trends\" and underlying societal factors as primary drivers of historical change, rather than focusing solely on immediate or short-term events @https://library.fiveable.me/key-terms/world-history-since-1400/annales-school>  The \"history of mentalities\" specifically aimed to understand the \"collective ways of thinking and perceiving the world\" that were prevalent within a given historical period, delving into the shared attitudes, beliefs, and values of a society @https://en.wikipedia.org/wiki/History_of_mentalities> \n\n### **5 @https://en.wikipedia.org/wiki/Arthur_Oncken_Lovejoy#:~:text=Lovejoy%20insisted%20that%20the%20history,active%20in%20the%20public%20arena.> . Specific Methodological Approaches**\n\nThe Annales School is characterized by its strong commitment to \"interdisciplinary approaches,\" drawing extensively from fields such as sociology, anthropology, and geography to enrich and deepen historical analysis @https://library.fiveable.me/key-terms/world-history-since-1400/annales-school>  Their methodology often involved limiting analysis to a \"particular place and a particular time,\" which naturally lent itself to \"intensive study\" and the development of \"microhistory\" as a valuable tool for historical analysis @https://en.wikipedia.org/wiki/History_of_mentalities>  Notable examples include Carlo Ginzburg's microhistorical reconstruction of peasant mentalities in 16th-century Italy through the examination of the trial records of a single miller, Domenico Scandella 21, and Robert Darnton's use of microhistory to explore the mentalities of different social strata in French society @https://en.wikipedia.org/wiki/History_of_mentalities> \n\n### **5 @https://www.scribd.com/document/251714321/History-of-Ideas> . Internal Debates and Criticisms**\n\nThe Annales School has faced criticism for a perceived \"lack of coherent meta-narrative and lack of focus\" 22, with some arguing that due to its fragmentation and evolution over time, the title \"school\" itself may have become inappropriate @https://marywcraig.com/2015/04/26/the-annales-school/>  Marxist historians, in particular, criticized the Annales approach for attempts to include the study of mentalities in a general synthesis, which they argued could lead to a \"basic reliance upon faith accompanied by a consequent disparagement of reason\" @https://en.wikipedia.org/wiki/History_of_mentalities>  Critics like Gismondi called for the history of mentalities to \"purge itself of its ethnocentricity, drift towards enlightenment, and analytically shallow ethnography\" @https://marywcraig.com/2015/04/26/the-annales-school/>  Despite these criticisms, the influence of the Annales School remains strong and is widely acknowledged to have enriched historical inquiry, with many traditional historians incorporating its approaches into their own fields @https://marywcraig.com/2015/04/26/the-annales-school/>  The concept of \"mentalités\" is now considered an \"integral part of the study of history\" @https://marywcraig.com/2015/04/26/the-annales-school/> \n\nThe Annales School's foundational emphasis on *la longue durée* and \"total history\" 7 represents a profound reorientation of historical inquiry. This shift moved the focus from discrete political events and individual actors to deep, underlying social, economic, and cultural structures. Traditional historiography often centered on political narratives, wars, and the actions of prominent figures. The Annales School deliberately challenged this by seeking to uncover the enduring patterns and forces that shape human societies over centuries, rather than merely chronicling short-term occurrences. By integrating diverse forms of data—demographic, cultural, mental, and psychoanalytical—with economic analysis, they aimed to create a more comprehensive and nuanced understanding of historical change. This methodological innovation has significantly broadened the scope of historical investigation, compelling historians to consider a wider array of factors when analyzing causation and societal evolution.\n\n## **6. Michel Foucault's Approaches: Archaeology and Genealogy**\n\n### **6 @https://ces.fas.harvard.edu/uploads/files/Reports-Articles/What-is-Intellectual-History-Essay-by-Peter-Gordon.pdf> . Key Figure and Origins**\n\nMichel Foucault stands as a highly influential, yet often controversial, figure in intellectual history @https://www.corteidh.or.cr/tablas/r32759.pdf>  His work is characterized by a pragmatic approach to theory, viewing concepts as a \"toolbox of more or less useful instruments\" designed to address specific problems rather than as building blocks for a grand theoretical edifice @https://www.corteidh.or.cr/tablas/r32759.pdf>  This pragmatic stance led to an evolution in his methodological frameworks throughout his career.\n\n### **6 @https://en.wikipedia.org/wiki/Intellectual_history> . Core Principles and Methodological Evolution**\n\nFoucault's intellectual history evolved through distinct phases, primarily \"archaeology\" and \"genealogy,\" each with its own core principles and methodological approaches. Questions of power were a recurring concern throughout his work, but his conceptualizations of power also evolved, shifting from concepts of exclusion to more productive understandings of \"power-knowledge\" and \"action upon action\" @https://www.corteidh.or.cr/tablas/r32759.pdf> \n\n**Archaeology:** Foucault's earlier works, such as *Madness and Civilization* (1961), *The Birth of the Clinic* (1963), and *The Order of Things* (1966), exemplify his archaeological method @https://www.corteidh.or.cr/tablas/r32759.pdf>  Archaeology was Foucault's term for a method of historical research that \"digs down into the past,\" uncovering the discursive traces of distinct historical periods and re-assembling them as layers, each exhibiting its own structured pattern of statements and order of discourse @https://www.corteidh.or.cr/tablas/r32759.pdf>  The objective was to uncover the \"epistemological conditions of possibility\"—the\n\n*epistemes*—upon which these discourses were based, aiming to reveal the implicit systems that determine behavior without conscious awareness @https://www.corteidh.or.cr/tablas/r32759.pdf>  This approach stressed structural order, structural differences, and the discontinuities that mark off the present from its past, focusing on distinguishing historical epochs rather than tracing processes of change @https://www.corteidh.or.cr/tablas/r32759.pdf>  A key concept in this methodology is the\n\n*énoncé* (statement), which is a way of speaking or a discourse, and the archaeological method studies only \"the things said\" as emergences and transformations @https://en.wikipedia.org/wiki/The_Archaeology_of_Knowledge> \n\n**Genealogy:** A significant shift occurred in Foucault's work with *Discipline and Punish* (1975), which marked a move from archaeology to a new, more Nietzschean conception: genealogy @https://www.corteidh.or.cr/tablas/r32759.pdf>  Genealogy is fundamentally concerned with using history as a means of critical engagement with the present. It explicitly begins with a diagnosis of the current situation, starting from a problem expressed in contemporary terms and then working out its historical lineage @https://www.corteidh.or.cr/tablas/r32759.pdf>  This method aims to write critical history by using historical materials to bring about a \"revaluing of values\" in the present. It traces how contemporary practices and institutions emerged from specific struggles, conflicts, alliances, and exercises of power, many of which are now forgotten @https://www.corteidh.or.cr/tablas/r32759.pdf>  The purpose of genealogy is not to search for \"origins\" but rather for processes of \"descent\" and \"emergence,\" tracing the often erratic and discontinuous path whereby the past became the present, thereby highlighting the contingency of the present and the openness of the future @https://www.corteidh.or.cr/tablas/r32759.pdf>  This is \"effective history\" because its intent is to problematize the present by revealing the power relations upon which it depends and the contingent processes that have brought it into being, aiming to disturb what was thought immobile and show the heterogeneity of what was imagined consistent @https://www.corteidh.or.cr/tablas/r32759.pdf>  Genealogy also involves preliminary work, including the specification of a\n\n*dispositif* (an apparatus or power-knowledge regime) and *problematization* (identifying how a phenomenon became a problem for specific authorities at a specific time) @https://www.corteidh.or.cr/tablas/r32759.pdf> \n\nFoucault's shift from archaeology to genealogy, particularly his development of a \"history of the present,\" transforms historical inquiry into a critical tool for understanding and challenging contemporary power structures @https://www.corteidh.or.cr/tablas/r32759.pdf>  While archaeology focused on uncovering the underlying rules and structures of knowledge in specific historical periods, genealogy explicitly uses historical analysis to diagnose and critique present-day issues. By tracing the contingent processes and power struggles that shaped current realities, Foucault's approach emphasizes that the present is not an inevitable outcome but a product of specific historical choices and conflicts. This perspective underscores the contingency of the present and, by extension, the possibility of alternative futures, thereby serving as a powerful impetus for critical reflection and potential societal transformation.\n\nFoucault's work reveals that reality, knowledge, and even subjectivity are discursively constructed through intricate power relations @https://www.corteidh.or.cr/tablas/r32759.pdf>  His analysis of \"discursive formations\" demonstrates that what can be said or known in a given period is governed by rules that operate beneath individual consciousness, defining the boundaries of language and thought @https://en.wikipedia.org/wiki/The_Archaeology_of_Knowledge>  This challenges traditional notions of objective truth, suggesting instead that \"truth is not the purpose of history, but the discourse contained in history\" @https://en.wikipedia.org/wiki/The_Archaeology_of_Knowledge>  The concept of \"power-knowledge\" further highlights that power is not merely repressive but productive, actively shaping what counts as knowledge and thereby influencing how individuals perceive themselves and their world. This perspective illuminates the pervasive influence of discourse in constituting social reality, moving beyond a simple understanding of ideas as independent entities to seeing them as deeply embedded within and constitutive of power dynamics.\n\n### **6 @https://en.wikipedia.org/wiki/Arthur_Oncken_Lovejoy#:~:text=Lovejoy%20insisted%20that%20the%20history,active%20in%20the%20public%20arena.> . Internal Debates and Criticisms**\n\nFoucault's work has often been met with skepticism from traditional philosophers and historians, with some arguing that his methodologies challenge the established rules of research to such an extent that his contributions do not fit properly into either discipline @https://educationmuseum.wordpress.com/2012/06/01/history-archaeology-and-genealogy/>  His historical work is noted for challenging both \"continuist and discontinuist historical accounts\" and for its explicit aim to be a \"critical history of the present\" rather than striving for traditional objectivity @https://educationmuseum.wordpress.com/2012/06/01/history-archaeology-and-genealogy/> \n\nCritics have argued that Foucault's study of history was not focused on finding \"the truth about the past,\" leading many historians to assert that his work is \"not really history\" in the conventional sense @https://educationmuseum.wordpress.com/2012/06/01/history-archaeology-and-genealogy/>  Foucault, however, countered traditional notions of objectivity by arguing that all historical accounts are inherently selective, influenced by what historians deem interesting or by habit and convention. Since it is impossible to include everything that ever happened, all histories necessarily exclude a great deal, and therefore, taking responsibility for selection bias is more \"intellectually ethical\" than pretending objectivity @https://educationmuseum.wordpress.com/2012/06/01/history-archaeology-and-genealogy/> \n\nFurthermore, Foucault's work has been subject to common misconceptions, with traditional Anglo-American scholars sometimes mischaracterizing his approach as primarily Marxist, structuralist, or irrationalist @http://www.yorku.ca/christo/papers/digarch3.htm>  While his work engages with elements from these traditions, Foucault himself distanced his later work from orthodox Marxism, and his critiques were often more regional and conceptually diverse than a purely Marxist analysis @http://www.yorku.ca/christo/papers/digarch3.htm>  He also viewed power not only in negative, repressive terms but also for its positive possibilities in constituting new objects of knowledge, and unlike Marxists, he prescribed no specific program of action or promised any utopia @http://www.yorku.ca/christo/papers/digarch3.htm> \n\n## **7. Conceptual History (Begriffsgeschichte): Semantics and Temporality of Concepts**\n\n### **7 @https://ces.fas.harvard.edu/uploads/files/Reports-Articles/What-is-Intellectual-History-Essay-by-Peter-Gordon.pdf> . Key Figure and Origins**\n\nConceptual History, or *Begriffsgeschichte*, is a significant approach within intellectual history, pioneered by the German historian Reinhart Koselleck @https://en.wikipedia.org/wiki/Reinhart_Koselleck>  This field distinguishes itself by focusing on the historical semantics of terms and the profound changes in their meanings over time @https://en.wikipedia.org/wiki/Reinhart_Koselleck> \n\n### **7 @https://en.wikipedia.org/wiki/Intellectual_history> . Core Principles**\n\nA central principle of Koselleck's *Begriffsgeschichte* is the radical indefinability of concepts. For Koselleck, concepts are \"plurivocal by nature,\" meaning that no single definition can be applied to all the different historical manifestations of terms like \"democracy,\" \"freedom,\" or \"justice\" @https://www.cambridge.org/core/books/intellectual-history-and-the-problem-of-conceptual-change/kosellecks-begriffsgeschichte/6C92FD36E076B474EEA38FE5D5524F35>  This challenges the ahistorical assumptions of earlier\n\n*Ideengeschichte* (history of ideas) approaches. Concepts, in this view, are not merely historical indices but also \"historical factors\" 27, implying that language and ideas are not passive reflections but active forces shaping social and political reality.\n\nA cornerstone of Koselleck's contribution is the concept of *Sattelzeit*, or \"saddle time,\" which refers to a threshold period between 1750 and 1850. During this era, particularly in Germany, language underwent a profound transformation into the language of modernity @https://en.wikipedia.org/wiki/Reinhart_Koselleck>  This period saw a fundamental shift in the semantics and pragmatics of key political and social terms, marking a decisive break from pre-modern understandings. For Koselleck, conceptual history is inherently inseparable from social history; without shared concepts, society, and especially the political sphere, cannot function @https://www.cambridge.org/core/books/intellectual-history-and-the-problem-of-conceptual-change/kosellecks-begriffsgeschichte/6C92FD36E076B474EEA38FE5D5524F35> \n\nConcepts, viewed as active historical agents, are not passive reflections but dynamic forces that shape social and political reality. Koselleck's assertion that concepts are not only \"historical indices\" but also \"historical factors\" 27 implies that language and ideas possess a transformative power. This perspective moves beyond a purely descriptive history of ideas to one that attributes agency to conceptual change. It suggests that the evolution of terms like \"state\" or \"citizen\" can directly influence political structures and social relations, rather than merely documenting them. This understanding highlights the profound impact of conceptual shifts on the course of history, demonstrating how changes in the way people articulate and understand their world can drive significant sociopolitical transformations.\n\n### **7 @https://en.wikipedia.org/wiki/Arthur_Oncken_Lovejoy#:~:text=Lovejoy%20insisted%20that%20the%20history,active%20in%20the%20public%20arena.> . Specific Methodological Approaches**\n\nConceptual History primarily focuses on the systematic study of the \"changing semantics and pragmatics of concepts in their social and political contexts\" @https://en.wikipedia.org/wiki/Reinhart_Koselleck>  This involves meticulous reflections on \"time and temporality in history and the history of language\" @https://en.wikipedia.org/wiki/Reinhart_Koselleck>  The methodology draws from various disciplines, including the philosophical history of terminology, historical philology, semasiology (the study of meaning), and onomatology (the study of names) @https://germanhistory-intersections.org/en/knowledge-and-education/ghis%3Adocument-129  The results of this work are continually evaluated through the rigorous exegesis of texts, which also forms the basis of the analysis itself @https://germanhistory-intersections.org/en/knowledge-and-education/ghis%3Adocument-129 \n\nThe concept of *Sattelzeit* in Koselleck's work illustrates how linguistic shifts are intrinsically linked to profound sociopolitical changes @https://en.wikipedia.org/wiki/Reinhart_Koselleck>  This period, characterized by the transformation of German language into the language of modernity, exemplifies how conceptual history reveals the co-evolution of language, thought, and society. During the\n\n*Sattelzeit*, traditional terms acquired new meanings, and new concepts emerged, reflecting and shaping the profound societal upheavals of the Enlightenment and revolutionary eras. This approach challenges the notion of timeless concepts, demonstrating instead that the very vocabulary through which societies understand themselves is historically contingent and deeply intertwined with their political, social, and cultural transformations. By focusing on these semantic shifts, conceptual history provides a powerful lens for understanding the dynamics of historical change at a fundamental level.\n\n### **7 @https://www.scribd.com/document/251714321/History-of-Ideas> . Internal Debates and Criticisms**\n\nKoselleck's work, particularly *Critique and Crisis* (1959), subjected the Enlightenment and its philosophy of history to a critical appraisal, influenced by the authoritarian state ideas of his early mentor Carl Schmitt @https://en.wikipedia.org/wiki/Reinhart_Koselleck>  He aimed to expose the seemingly humanistic and universal theorems of the Enlightenment as \"hypocritical\" fighting concepts @https://en.wikipedia.org/wiki/Critique_and_Crisis>  He argued that the Enlightenment, by misjudging the peace-keeping function of the absolutist state, had undermined its foundations, leading to a \"destructive disease\" in the bourgeois world @https://en.wikipedia.org/wiki/Reinhart_Koselleck> \n\nIn later publications, Koselleck continued to use the concept of crisis to diagnose the conditions of the modern era, but he refined his approach. He redefined the concept of crisis as a historical category of knowledge, explaining the emergence of the bourgeois world not solely on a political level but also in terms of social, technical, and economic changes. He abandoned the medical metaphor of illness, viewing modernity's acceleration and increasing time pressure as a historical change in social time structures rather than a pathogenesis @https://en.wikipedia.org/wiki/Critique_and_Crisis>  Despite his emphasis on the inseparability of conceptual and social history, critics have argued that his distinction between the two, particularly in his later work, contains a \"fallacy\" and breaks the fundamental tenets of his own historical-conceptual theory @https://www.cambridge.org/core/books/intellectual-history-and-the-problem-of-conceptual-change/kosellecks-begriffsgeschichte/6C92FD36E076B474EEA38FE5D5524F35> \n\n## **8. Global Intellectual History: Interconnectedness and Cross-Cultural Flows**\n\n### **8 @https://ces.fas.harvard.edu/uploads/files/Reports-Articles/What-is-Intellectual-History-Essay-by-Peter-Gordon.pdf> . Definition and Characteristics**\n\nGlobal Intellectual History is a relatively new and expansive area of study, still without a precise, universally agreed-upon definition @https://www.unimi.it/en/education/degree-programme-courses/2025/global-intellectual-history>  Broadly, it explores the diverse ways in which the circulation of ideas has become global, encompassing the history of thought across the world from the invention of writing to the present @https://www.unimi.it/en/education/degree-programme-courses/2025/global-intellectual-history>  Proponents stress the necessity of studying intellectual development from a \"cosmopolitan or global point of view\" to uncover connections and parallels across different cultures @https://encyclopedia.pub/entry/36565>  However, the field also acknowledges significant risks, such as comparing \"incommensurable cultural contexts\" or identifying connections that might be merely the outcome of imaginative abstraction rather than genuine historical linkages @https://www.unimi.it/en/education/degree-programme-courses/2025/global-intellectual-history>  This field is often considered a sister discipline to, or a particular approach within, intellectual history, sometimes also referred to as global history of ideas @https://encyclopedia.pub/entry/36565> \n\nGlobal intellectual history confronts the inherent tension between recognizing commonalities in thought across diverse contexts and respecting the unique characteristics of each cultural framework @https://ces.fas.harvard.edu/uploads/files/Reports-Articles/What-is-Intellectual-History-Essay-by-Peter-Gordon.pdf>  This extends the long-standing debate over contextualism to a global scale. While there is value in identifying seemingly \"eternal\" thoughts or shared human preoccupations that manifest across different civilizations 1, the challenge lies in avoiding the imposition of a universal, often Western, conceptual lens onto non-Western intellectual traditions. The field actively seeks to navigate the complexities of cross-cultural comparison, ensuring that the pursuit of global connections does not inadvertently flatten or distort the distinctiveness of local intellectual developments. This requires a nuanced methodological approach that balances the search for interconnectedness with a deep appreciation for cultural specificity.\n\n### **8 @https://en.wikipedia.org/wiki/Intellectual_history> . Methodological Approaches**\n\nGlobal Intellectual History employs a combination of \"connective and comparative\" methodologies @https://www.history.ox.ac.uk/intellectual-history>  The connective approach examines the consequences of cultural entanglement, such as the architectural styles that emerged when Portuguese ecclesiastical forms were transplanted to tropical regions @https://www.history.ox.ac.uk/intellectual-history>  This method focuses on tracing the actual movement, adaptation, and hybridization of ideas as different societies interact. The comparative approach, conversely, involves examining parallels in intellectual development across distinct cultural contexts. An example includes considering how Chinese intellectuals turned to classical texts to formulate \"Neo-Confucianism,\" which can offer a new perspective on the familiar European themes of the Renaissance and Reformation @https://www.history.ox.ac.uk/intellectual-history> \n\nThe field aims to guide scholars toward understanding both the continuity and the unique peculiarities of modern historical production compared to that of the past @https://www.unimi.it/en/education/degree-programme-courses/2025/global-intellectual-history>  This involves a rigorous analysis of concrete examples to grasp the problems and methods of contemporary historiographic reflection, fostering the development of individual historiographical styles @https://www.unimi.it/en/education/degree-programme-courses/2025/global-intellectual-history>  Critical reading of primary sources and scientific texts is paramount to developing autonomous reflections within this domain @https://www.unimi.it/en/education/degree-programme-courses/2025/global-intellectual-history> \n\nThis field actively seeks to move beyond traditional Eurocentric narratives by exploring intellectual developments and connections outside of Europe, fostering a more inclusive and polycentric understanding of global thought @https://en.wikipedia.org/wiki/Intellectual_history>  Historically, intellectual history has often focused on Western intellectual traditions. However, global intellectual history consciously broadens its geographical and cultural scope, investigating the history of ideas in regions previously marginalized or viewed as peripheral. This necessitates the development of new methodologies that are sensitive to diverse conceptual frameworks and historical contexts, avoiding the imposition of Western categories or assumptions onto non-Western thought. By doing so, the field contributes to a more comprehensive and equitable understanding of the global tapestry of human intellectual endeavor, recognizing multiple centers of innovation and interconnectedness.\n\n## **9. Other Notable Approaches in Intellectual History**\n\nBeyond the prominent schools discussed, intellectual history encompasses several other significant approaches, each with its own focus and methodology.\n\n### **9 @https://ces.fas.harvard.edu/uploads/files/Reports-Articles/What-is-Intellectual-History-Essay-by-Peter-Gordon.pdf> . Warsaw School (History of Ideas)**\n\nThe Warsaw School was a group of Polish historians of ideas active primarily in the late 1950s and 1960s @https://en.wikipedia.org/wiki/Warsaw_School_%28history_of_ideas%29  Key figures included Bronisław Baczko and Leszek Kołakowski, alongside scholars such as Andrzej Walicki, Jerzy Szacki, and Krzysztof Pomian @https://en.wikipedia.org/wiki/Warsaw_School_%28history_of_ideas%29  While their methods were varied, shared characteristics included an emphasis on objectivity, pluralism, and the political independence of scientific inquiry, with researchers striving to place themselves outside the investigated subject @https://en.wikipedia.org/wiki/Warsaw_School_%28history_of_ideas%29  Their methodology drew eclectically from Marxism, hermeneutics, German sociology of knowledge, existentialism, and elements of Claude Lévi-Strauss's structuralism @https://en.wikipedia.org/wiki/Warsaw_School_%28history_of_ideas%29  The school aimed to describe historical phenomena without making judgments about their truth or falsity. They held that ideologies, including Marxism, were products of their specific historical conditions, a view that contrasted with the historical materialist idea that mental structure is solely derived from social class. They also showed interest in individual, religious, and group ideologies, stressing that history is fundamentally a product of individual human actions @https://en.wikipedia.org/wiki/Warsaw_School_%28history_of_ideas%29 \n\n### **9 @https://en.wikipedia.org/wiki/Intellectual_history> . History of Historical Thought**\n\nThis subfield focuses on the evolution of historical thinking itself. It is notably associated with scholars like Anthony Grafton (Princeton University) and J.G.A. Pocock (Johns Hopkins University) @https://en.wikipedia.org/wiki/Intellectual_history>  Pocock, a key figure in the Cambridge School, also made significant contributions to understanding the history of English common law and the work of Enlightenment historians such as Edward Gibbon @https://www.intellectualhistory.net/teaching/j-g-a-pocock>  His research explored how thinkers constructed historical analyses into epistemologies of law and politics, and how figures like Gibbon understood historical decline as an inevitable conflict between ancient virtue and modern commerce @https://en.wikipedia.org/wiki/J._G._A._Pocock> \n\n### **9 @https://en.wikipedia.org/wiki/Arthur_Oncken_Lovejoy#:~:text=Lovejoy%20insisted%20that%20the%20history,active%20in%20the%20public%20arena.> . History of Political Thought**\n\nA particular focus in Britain since the late 1960s, the history of political thought is strongly associated with Cambridge historians like John Dunn and Quentin Skinner @https://en.wikipedia.org/wiki/Intellectual_history>  This area examines the emergence and development of political concepts within their historical contexts, often overlapping significantly with the methodologies of the Cambridge School, especially its contextualist approach to political texts @https://en.wikipedia.org/wiki/Intellectual_history> \n\n### **9 @https://www.scribd.com/document/251714321/History-of-Ideas> . Twelfth-Century Renaissance**\n\nThis interdisciplinary area within intellectual history provides a broad overview of the content and applications of learning during the twelfth century @https://www.history.ox.ac.uk/intellectual-history>  It explores a wide range of curricular subjects, examining their sources, including the classical textual tradition, the impact of newly translated texts, and the consequences of personal contact with Muslim and Jewish scholars in regions like Sicily and the Iberian Peninsula. The course structure often revolves around the seven liberal arts (trivium and quadrivium) and the three higher faculties of medieval schools, illustrating the intellectual ferment of this period @https://www.history.ox.ac.uk/intellectual-history> \n\n### **9 @https://en.wikipedia.org/wiki/Cambridge_School_%28intellectual_history%29 . Selfhood in History (1500 to Present)**\n\nThis course of study investigates how individuals in the past understood the self, conceptualized emotions, and the relationship between the individual and the collective across different times and cultures @https://www.history.ox.ac.uk/intellectual-history>  It challenges sociological, collective categories of analysis often employed by historians, seeking to incorporate subjectivity and emotions into historical narratives. This approach draws on diverse source materials such as diaries, letters, visual sources, material objects, travel writing, memoirs, court records, micro-historical material, and oral history, bridging the early modern and modern periods to enable productive comparisons in historiography @https://www.history.ox.ac.uk/intellectual-history> \n\n## **10. Conclusion: Synthesis and Future Directions**\n\nThe study of intellectual history is characterized by a rich tapestry of schools of thought, each offering distinct methodologies and interpretive frameworks for understanding the evolution of ideas across time. The Cambridge School, with its rigorous contextualism and focus on language as a form of political action, has fundamentally reshaped the interpretation of historical texts by emphasizing authorial intent within specific historical debates. Its evolution, particularly the embrace of \"paths not taken,\" demonstrates a sophisticated engagement with the present, using historical contingency to inform contemporary reflection.\n\nIn contrast, the Strauss School, driven by a profound diagnosis of the \"crisis of modernity,\" advocates for a return to classical texts and employs the concept of \"esoteric writing\" to uncover hidden philosophical truths. This approach views interpretation as an inherently political act, aiming to recover a \"right way of life\" from the wisdom of the ancients. While both schools engage deeply with historical texts, their differing purposes—understanding historical interventions versus correcting modern pathologies—highlight a fundamental divergence in the ultimate aims of intellectual historical inquiry.\n\nArthur Lovejoy's pioneering \"History of Ideas\" laid foundational groundwork by tracing \"unit-ideas\" across historical periods, though it faced critiques regarding the potential for decontextualization and the imposition of investigator-driven categories. This tension between identifying enduring conceptual structures and acknowledging radical historical change remains a central methodological discussion. The Annales School, through its \"History of Mentalities\" and emphasis on *la longue durée*, revolutionized historical inquiry by shifting focus from discrete events to deep, underlying social and cultural structures, advocating for a \"total history\" that integrates diverse forms of data.\n\nMichel Foucault's methodological evolution, from \"archaeology\" to \"genealogy,\" transformed historical inquiry into a critical tool for understanding and challenging contemporary power structures. His work profoundly demonstrates how reality, knowledge, and subjectivity are discursively constructed through intricate power relations, thereby challenging traditional notions of objective truth. Conceptual History, pioneered by Reinhart Koselleck, further deepens this understanding by focusing on the changing semantics and pragmatics of concepts, particularly through the lens of *Sattelzeit*, revealing how linguistic shifts are intrinsically linked to profound sociopolitical transformations and attributing agency to conceptual change itself.\n\nFinally, Global Intellectual History represents a crucial contemporary development, actively seeking to move beyond traditional Eurocentric narratives. It endeavors to understand the interconnectedness and cross-cultural flows of ideas on a worldwide scale, navigating the complexities of comparing diverse intellectual traditions while fostering a more inclusive and polycentric view of global thought.\n\nIn sum, the field of intellectual history is a vibrant arena of ongoing methodological debates and innovations. These schools, despite their differences, collectively underscore the discipline's commitment to understanding how ideas are formed, transmitted, contested, and transformed, and how they, in turn, shape human societies and individual experiences. The persistent discussions surrounding contextualism versus universalism, objectivity versus presentism, and authorial intent versus public reception continue to drive the field's dynamism, ensuring its continued relevance in critically engaging with both past intellectual landscapes and contemporary challenges.\n\n#### 引用的著作\n\n1. What is Intellectual History? | Harvard University, 访问时间为 八月 4, 2025， <https://ces.fas.harvard.edu/uploads/files/Reports-Articles/What-is-Intellectual-History-Essay-by-Peter-Gordon.pdf>\n2. Intellectual history - Wikipedia, 访问时间为 八月 4, 2025， <https://en.wikipedia.org/wiki/Intellectual_history>\n3. Arthur Oncken Lovejoy - Wikipedia, 访问时间为 八月 4, 2025， <https://en.wikipedia.org/wiki/Arthur_Oncken_Lovejoy#:~:text=Lovejoy%20insisted%20that%20the%20history,active%20in%20the%20public%20arena.>\n4. History of Ideas: The Lovejoy Approach | PDF | Philosophical ..., 访问时间为 八月 4, 2025， <https://www.scribd.com/document/251714321/History-of-Ideas>\n5. Cambridge School (intellectual history) - Wikipedia, 访问时间为 八月 4, 2025， [https://en.wikipedia.org/wiki/Cambridge\\_School\\_(intellectual\\_history)](https://en.wikipedia.org/wiki/Cambridge_School_%28intellectual_history%29)\n6. What is a ''history of the present''? On Foucault's genealogies and ..., 访问时间为 八月 4, 2025， <https://www.corteidh.or.cr/tablas/r32759.pdf>\n7. Annales School - (World History – 1400 to Present) - Vocab ..., 访问时间为 八月 4, 2025， <https://library.fiveable.me/key-terms/world-history-since-1400/annales-school>\n8. Reinhart Koselleck - Wikipedia, 访问时间为 八月 4, 2025， <https://en.wikipedia.org/wiki/Reinhart_Koselleck>\n9. Warsaw School (history of ideas) - Wikipedia, 访问时间为 八月 4, 2025， [https://en.wikipedia.org/wiki/Warsaw\\_School\\_(history\\_of\\_ideas)](https://en.wikipedia.org/wiki/Warsaw_School_%28history_of_ideas%29)\n10. The Cambridge School - Queen Mary University of London, 访问时间为 八月 4, 2025， <https://www.qmul.ac.uk/history/media/ph/news/The-Cambridge-School.pdf>\n11. The Cambridge School and the Turn to the Present - Oxford Centre for Intellectual History, 访问时间为 八月 4, 2025， <https://intellectualhistory.web.ox.ac.uk/article/cambridge-school-and-turn-present>\n12. Quentin Skinner - Wikipedia, 访问时间为 八月 4, 2025， <https://en.wikipedia.org/wiki/Quentin_Skinner>\n13. THE HISTORICAL ASSESSMENT OF SPEECH ACTS: CLARIFICATIONS OF AUSTIN AND SKINNER FOR THE STUDY OF RELIGIONS JASON DAVID BEDUHN Thi - Brill, 访问时间为 八月 4, 2025， <https://brill.com/downloadpdf/journals/mtsr/12/1-4/article-p477_31.pdf>\n14. Insights and Coordinates from the Perspective of ... - Atlantis Press, 访问时间为 八月 4, 2025， <https://www.atlantis-press.com/article/126009551.pdf>\n15. Leo Strauss: The Scholar Who Challenged Modernity's Crisis ..., 访问时间为 八月 4, 2025， <https://isi.org/leo-strauss/>\n16. Leo Strauss | EBSCO Research Starters, 访问时间为 八月 4, 2025， <https://www.ebsco.com/research-starters/history/leo-strauss>\n17. Leo Strauss - Wikipedia, 访问时间为 八月 4, 2025， <https://en.wikipedia.org/wiki/Leo_Strauss>\n18. What is a Straussian reading? What is esoteric Writing? - YouTube, 访问时间为 八月 4, 2025， <https://www.youtube.com/watch?v=h0CYD0c-hbY>\n19. pages.jh.edu, 访问时间为 八月 4, 2025， <https://pages.jh.edu/jhumag/0400web/28.html#:~:text=Some%20of%20his%20critics%20have,greatest%20contribution%20was%20his%20method.>\n20. What Lovejoy's History of Ideas Might Have To Do With Literature - Project MUSE, 访问时间为 八月 4, 2025， <https://muse.jhu.edu/article/650166/summary>\n21. History of mentalities - Wikipedia, 访问时间为 八月 4, 2025， <https://en.wikipedia.org/wiki/History_of_mentalities>\n22. The Annales School | marywcraig, 访问时间为 八月 4, 2025， <https://marywcraig.com/2015/04/26/the-annales-school/>\n23. en.wikipedia.org, 访问时间为 八月 4, 2025， <https://en.wikipedia.org/wiki/History_of_mentalities#:~:text=In%20particular%2C%20Marxist%20historians%20were,disparagement%20of%20reason.%22%20Carlo%20Ginzburg>\n24. Foucault's history, archaeology, and genealogy - Museum of Education, 访问时间为 八月 4, 2025， <https://educationmuseum.wordpress.com/2012/06/01/history-archaeology-and-genealogy/>\n25. The Archaeology of Knowledge - Wikipedia, 访问时间为 八月 4, 2025， <https://en.wikipedia.org/wiki/The_Archaeology_of_Knowledge>\n26. \"Digging Archaeology: Sources of Foucault's Historiography\" by Christopher D. Green, 访问时间为 八月 4, 2025， <http://www.yorku.ca/christo/papers/digarch3.htm>\n27. Koselleck's Begriffsgeschichte (Chapter 5) - Intellectual History and ..., 访问时间为 八月 4, 2025， <https://www.cambridge.org/core/books/intellectual-history-and-the-problem-of-conceptual-change/kosellecks-begriffsgeschichte/6C92FD36E076B474EEA38FE5D5524F35>\n28. Reinhart Koselleck, “Begriffsgeschichte and Social History” (1979), 访问时间为 八月 4, 2025， [https://germanhistory-intersections.org/en/knowledge-and-education/ghis:document-129](https://germanhistory-intersections.org/en/knowledge-and-education/ghis%3Adocument-129)\n29. Critique and Crisis - Wikipedia, 访问时间为 八月 4, 2025， <https://en.wikipedia.org/wiki/Critique_and_Crisis>\n30. Global Intellectual History | Università degli Studi di Milano Statale - Unimi, 访问时间为 八月 4, 2025， <https://www.unimi.it/en/education/degree-programme-courses/2025/global-intellectual-history>\n31. Global Intellectual History | Encyclopedia MDPI, 访问时间为 八月 4, 2025， <https://encyclopedia.pub/entry/36565>\n32. Intellectual History - Faculty of History, 访问时间为 八月 4, 2025， <https://www.history.ox.ac.uk/intellectual-history>\n33. Warsaw School (history of ideas) - Wikipedia, 访问时间为 八月 4, 2025， [https://en.wikipedia.org/wiki/Warsaw\\_School\\_(history\\_of\\_ideas)#:~:text=Their%20methodology%20borrowed%20from%20Marxism,about%20their%20truth%20or%20falsity.](https://en.wikipedia.org/wiki/Warsaw_School_%28history_of_ideas%29#:~:text=Their%20methodology%20borrowed%20from%20Marxism,about%20their%20truth%20or%20falsity.)\n34. J. G. A. Pocock - Institute of Intellectual History, 访问时间为 八月 4, 2025， <https://www.intellectualhistory.net/teaching/j-g-a-pocock>\n35. J. G. A. Pocock - Wikipedia, 访问时间为 八月 4, 2025， <https://en.wikipedia.org/wiki/J._G._A._Pocock>\n",
  "all_source_links": [
    "http://www.yorku.ca/christo/papers/digarch3.htm",
    "https://accounts.google.com/SignOutOptions?hl=zh-CN&continue=https://gemini.google.com/app%3Fis_sa%3D1%26is_sa%3D1%26android-min-version%3D301356232%26ios-min-version%3D322.0%26campaign_id%3Dbkws%26utm_source%3Dsem%26utm_source%3Dgoogle%26utm_medium%3Dpaid-media%26utm_medium%3Dcpc%26utm_campaign%3Dbkws%26utm_campaign%3D2024enAU_gemfeb%26pt%3D9008%26mt%3D8%26ct%3Dp-growth-sem-bkws%26gclsrc%3Daw.ds%26gad_source%3D1%26gad_campaignid%3D22437964261%26gbraid%3D0AAAAApk5BhmTIKeu82GeBI85qNScnwP3m%26gclid%3DCjwKCAjwkvbEBhApEiwAKUz6-ybVgRKghbvMe_m6J9HfhKccGbx5pv_fQCiPXewPYkQWthYXErb2txoClPAQAvD_BwE&ec=GBRAkgU",
    "https://brill.com/downloadpdf/journals/mtsr/12/1-4/article-p477_31.pdf",
    "https://ces.fas.harvard.edu/uploads/files/Reports-Articles/What-is-Intellectual-History-Essay-by-Peter-Gordon.pdf",
    "https://cjh.uchicago.edu/issues/fall16/7.12.pdf",
    "https://educationmuseum.wordpress.com/2012/06/01/history-archaeology-and-genealogy",
    "https://en.wikipedia.org/wiki/Arthur_Oncken_Lovejoy#:~:text=Lovejoy%20insisted%20that%20the%20history,active%20in%20the%20public%20arena.",
    "https://en.wikipedia.org/wiki/Cambridge",
    "https://en.wikipedia.org/wiki/Cambridge\\_School\\_(intellectual\\_history",
    "https://en.wikipedia.org/wiki/Cambridge_School_%28intellectual_history%29",
    "https://en.wikipedia.org/wiki/Cambridge_School_(intellectual_history",
    "https://en.wikipedia.org/wiki/Critique_and_Crisis",
    "https://en.wikipedia.org/wiki/History_of_mentalities",
    "https://en.wikipedia.org/wiki/History_of_mentalities#:~:text=In%20particular%2C%20Marxist%20historians%20were,disparagement%20of%20reason.%22%20Carlo%20Ginzburg",
    "https://en.wikipedia.org/wiki/Intellectual_history",
    "https://en.wikipedia.org/wiki/J._G._A._Pocock",
    "https://en.wikipedia.org/wiki/Leo_Strauss",
    "https://en.wikipedia.org/wiki/Quentin_Skinner",
    "https://en.wikipedia.org/wiki/Reinhart_Koselleck",
    "https://en.wikipedia.org/wiki/The_Archaeology_of_Knowledge",
    "https://en.wikipedia.org/wiki/Warsaw",
    "https://en.wikipedia.org/wiki/Warsaw\\_School\\_(history\\_of\\_ideas",
    "https://en.wikipedia.org/wiki/Warsaw\\_School\\_(history\\_of\\_ideas)#:~:text=Their%20methodology%20borrowed%20from%20Marxism,about%20their%20truth%20or%20falsity.",
    "https://en.wikipedia.org/wiki/Warsaw_School_%28history_of_ideas%29",
    "https://en.wikipedia.org/wiki/Warsaw_School_%28history_of_ideas%29#:~:text=Their%20methodology%20borrowed%20from%20Marxism,about%20their%20truth%20or%20falsity.",
    "https://en.wikipedia.org/wiki/Warsaw_School_(history_of_ideas",
    "https://en.wikipedia.org/wiki/Warsaw_School_(history_of_ideas)#:~:text=Their%20methodology%20borrowed%20from%20Marxism,about%20their%20truth%20or%20falsity.",
    "https://encyclopedia.pub/entry/36565",
    "https://germanhistory-intersections.org/en/knowledge-and-education/ghis%3Adocument-129",
    "https://germanhistory-intersections.org/en/knowledge-and-education/ghis:document-129",
    "https://history.fas.harvard.edu/theme/intellectual-history",
    "https://intellectualhistory.web.ox.ac.uk/article/cambridge-school-and-turn-present",
    "https://isi.org/leo-strauss",
    "https://library.fiveable.me/key-terms/world-history-since-1400/annales-school",
    "https://marywcraig.com/2015/04/26/the-annales-school",
    "https://muse.jhu.edu/article/650166/summary",
    "https://myactivity.google.com/product/gemini?utm_source=gemini",
    "https://pages.jh.edu/jhumag/0400web/28.html#:~:text=Some%20of%20his%20critics%20have,greatest%20contribution%20was%20his%20method.",
    "https://policies.google.com/terms",
    "https://projects.iq.harvard.edu/files/history/files/what_is_intell_history_pgordon_mar2012.pdf",
    "https://support.google.com/bard/answer/13594961",
    "https://support.google.com/gemini/answer/13594961#location&zippy=%2Cwhat-location-information-do-gemini-apps-collect-why-and-how-is-it-used",
    "https://www.atlantis-press.com/article/126009551.pdf",
    "https://www.cambridge.org/core/books/intellectual-history-and-the-problem-of-conceptual-change/kosellecks-begriffsgeschichte/6C92FD36E076B474EEA38FE5D5524F35",
    "https://www.corteidh.or.cr/tablas/r32759.pdf",
    "https://www.ebsco.com/research-starters/history/leo-strauss",
    "https://www.history.ox.ac.uk/intellectual-history",
    "https://www.intellectualhistory.net/teaching/j-g-a-pocock",
    "https://www.qmul.ac.uk/history/media/ph/news/The-Cambridge-School.pdf",
    "https://www.scribd.com/document/251714321/History-of-Ideas",
    "https://www.tandfonline.com/journals/rgih20/about-this-journal",
    "https://www.unimi.it/en/education/degree-programme-courses/2025/global-intellectual-history",
    "https://www.youtube.com/watch?v=h0CYD0c-hbY"
  ],
  "summary_citations": [
    "http://www.yorku.ca/christo/papers/digarch3.htm",
    "https://accounts.google.com/SignOutOptions?hl=zh-CN&continue=https://gemini.google.com/app%3Fis_sa%3D1%26is_sa%3D1%26android-min-version%3D301356232%26ios-min-version%3D322.0%26campaign_id%3Dbkws%26utm_source%3Dsem%26utm_source%3Dgoogle%26utm_medium%3Dpaid-media%26utm_medium%3Dcpc%26utm_campaign%3Dbkws%26utm_campaign%3D2024enAU_gemfeb%26pt%3D9008%26mt%3D8%26ct%3Dp-growth-sem-bkws%26gclsrc%3Daw.ds%26gad_source%3D1%26gad_campaignid%3D22437964261%26gbraid%3D0AAAAApk5BhmTIKeu82GeBI85qNScnwP3m%26gclid%3DCjwKCAjwkvbEBhApEiwAKUz6-ybVgRKghbvMe_m6J9HfhKccGbx5pv_fQCiPXewPYkQWthYXErb2txoClPAQAvD_BwE&ec=GBRAkgU",
    "https://brill.com/downloadpdf/journals/mtsr/12/1-4/article-p477_31.pdf",
    "https://ces.fas.harvard.edu/uploads/files/Reports-Articles/What-is-Intellectual-History-Essay-by-Peter-Gordon.pdf",
    "https://cjh.uchicago.edu/issues/fall16/7.12.pdf",
    "https://educationmuseum.wordpress.com/2012/06/01/history-archaeology-and-genealogy",
    "https://en.wikipedia.org/wiki/Arthur_Oncken_Lovejoy#:~:text=Lovejoy%20insisted%20that%20the%20history,active%20in%20the%20public%20arena.",
    "https://en.wikipedia.org/wiki/Cambridge",
    "https://en.wikipedia.org/wiki/Cambridge\\_School\\_(intellectual\\_history",
    "https://en.wikipedia.org/wiki/Cambridge_School_%28intellectual_history%29",
    "https://en.wikipedia.org/wiki/Cambridge_School_(intellectual_history",
    "https://en.wikipedia.org/wiki/Critique_and_Crisis",
    "https://en.wikipedia.org/wiki/History_of_mentalities",
    "https://en.wikipedia.org/wiki/History_of_mentalities#:~:text=In%20particular%2C%20Marxist%20historians%20were,disparagement%20of%20reason.%22%20Carlo%20Ginzburg",
    "https://en.wikipedia.org/wiki/Intellectual_history",
    "https://en.wikipedia.org/wiki/J._G._A._Pocock",
    "https://en.wikipedia.org/wiki/Leo_Strauss",
    "https://en.wikipedia.org/wiki/Quentin_Skinner",
    "https://en.wikipedia.org/wiki/Reinhart_Koselleck",
    "https://en.wikipedia.org/wiki/The_Archaeology_of_Knowledge",
    "https://en.wikipedia.org/wiki/Warsaw",
    "https://en.wikipedia.org/wiki/Warsaw\\_School\\_(history\\_of\\_ideas",
    "https://en.wikipedia.org/wiki/Warsaw\\_School\\_(history\\_of\\_ideas)#:~:text=Their%20methodology%20borrowed%20from%20Marxism,about%20their%20truth%20or%20falsity.",
    "https://en.wikipedia.org/wiki/Warsaw_School_%28history_of_ideas%29",
    "https://en.wikipedia.org/wiki/Warsaw_School_%28history_of_ideas%29#:~:text=Their%20methodology%20borrowed%20from%20Marxism,about%20their%20truth%20or%20falsity.",
    "https://en.wikipedia.org/wiki/Warsaw_School_(history_of_ideas",
    "https://en.wikipedia.org/wiki/Warsaw_School_(history_of_ideas)#:~:text=Their%20methodology%20borrowed%20from%20Marxism,about%20their%20truth%20or%20falsity.",
    "https://encyclopedia.pub/entry/36565",
    "https://germanhistory-intersections.org/en/knowledge-and-education/ghis%3Adocument-129",
    "https://germanhistory-intersections.org/en/knowledge-and-education/ghis:document-129",
    "https://history.fas.harvard.edu/theme/intellectual-history",
    "https://intellectualhistory.web.ox.ac.uk/article/cambridge-school-and-turn-present",
    "https://isi.org/leo-strauss",
    "https://library.fiveable.me/key-terms/world-history-since-1400/annales-school",
    "https://marywcraig.com/2015/04/26/the-annales-school",
    "https://muse.jhu.edu/article/650166/summary",
    "https://myactivity.google.com/product/gemini?utm_source=gemini",
    "https://pages.jh.edu/jhumag/0400web/28.html#:~:text=Some%20of%20his%20critics%20have,greatest%20contribution%20was%20his%20method.",
    "https://policies.google.com/terms",
    "https://projects.iq.harvard.edu/files/history/files/what_is_intell_history_pgordon_mar2012.pdf",
    "https://support.google.com/bard/answer/13594961",
    "https://support.google.com/gemini/answer/13594961#location&zippy=%2Cwhat-location-information-do-gemini-apps-collect-why-and-how-is-it-used",
    "https://www.atlantis-press.com/article/126009551.pdf",
    "https://www.cambridge.org/core/books/intellectual-history-and-the-problem-of-conceptual-change/kosellecks-begriffsgeschichte/6C92FD36E076B474EEA38FE5D5524F35",
    "https://www.corteidh.or.cr/tablas/r32759.pdf",
    "https://www.ebsco.com/research-starters/history/leo-strauss",
    "https://www.history.ox.ac.uk/intellectual-history",
    "https://www.intellectualhistory.net/teaching/j-g-a-pocock",
    "https://www.qmul.ac.uk/history/media/ph/news/The-Cambridge-School.pdf",
    "https://www.scribd.com/document/251714321/History-of-Ideas",
    "https://www.tandfonline.com/journals/rgih20/about-this-journal",
    "https://www.unimi.it/en/education/degree-programme-courses/2025/global-intellectual-history",
    "https://www.youtube.com/watch?v=h0CYD0c-hbY"
  ]
}