{
  "query": "Prepare an academic report on the historical development of neoliberalism, including its background, the main contents of neoliberalist thought, and its political impact in the real world. Conduct an in-depth analysis of the nature and causes of neoliberalism, and elaborate on its evolution in contemporary society.",
  "chain_of_research": {
    "plan_1": {
      "title": "Researching Neoliberalism's Foundations\nNext Steps in Research",
      "description": "I'm beginning my research into the historical development of neoliberalism. My initial focus will be on understanding its intellectual origins and the historical context that led to its emergence. This includes exploring its philosophical roots, the economic conditions following World War II, and the critiques of Keynesian economic policies that paved the way for neoliberal thought.\nMy next steps involve systematically gathering information on the core tenets of neoliberalism, its key figures, its real-world political and socio-economic impact, and its evolution in contemporary society. I'll be looking for information from academic sources, reputable think tanks, and historical analyses to ensure a comprehensive and well-supported report."
    },
    "search_1": [
      "https://www.mjemcgill.com/journals/deconstructing-neoliberalism-the-role-of-the-chicago-school-in-the-development-of-neoliberalism-and-its-propagation-in-the-economies-of-chile-and-argentinanbspnbsp",
      "https://en.wikipedia.org/wiki/Chicago_school_of_economics",
      "https://en.wikipedia.org/wiki/Neoliberalism",
      "https://www.journals.uchicago.edu/doi/full/10.1086/710311",
      "https://en.wikipedia.org/wiki/Neoliberalism#:~:text=Neoliberalism%20originated%20among%20European%20liberal,liberal%20desire%20to%20control%20markets.",
      "https://www.cambridge.org/core/journals/historical-journal/article/at-the-origins-of-neoliberalism-the-free-economy-and-the-strong-state-19301947/B476470A93CC147E8EC8AC2EFE550062",
      "https://www.cambridge.org/core/journals/economics-and-philosophy/article/brief-history-of-neoliberalism-david-harvey-oxford-university-press-2005-vii-247-pages/FE172126138782F93B68C59406221862",
      "https://www.investopedia.com/terms/n/neoliberalism.asp",
      "https://www.adamsmith.org/blog/scaling-the-heights-a-history-of-the-mont-pelerin-society",
      "https://files.persagen.com/01/Mont_Pelerin_Society-History_of_MPS-2014.pdf",
      "https://fpif.org/from_keynesianism_to_neoliberalism_shifting_paradigms_in_economics",
      "https://marxismocritico.com/wp-content/uploads/2011/10/alfredo-saad-filho-marxian-and-keynesian-critiques-of-neoliberalism.pdf"
    ],
    "observation_1": "I've started by exploring the intellectual origins of neoliberalism, discovering that it emerged among European liberal scholars in the 1930s. This was a direct response to the perceived decline of classical liberalism and the growing influence of social liberalism, particularly in the wake of the Great Depression. It's interesting to note that early proponents, such as the Ordo-liberals, initially accommodated some state regulation, distinguishing them from pure laissez-faire advocates.",
    "plan_2": {
      "title": "Key Thinkers and Influential Groups\nShifting Economic Paradigms\nNext Steps: Deepening the Analysis",
      "description": "My research has identified key figures like Friedrich Hayek, Ludwig von Mises, and Milton Friedman as central to neoliberal thought. The Mont Pelerin Society, founded by Hayek in 1947, and the Chicago School of Economics played pivotal roles in developing and disseminating these ideas. These groups were instrumental in shaping the intellectual landscape that would later see neoliberalism gain prominence.\nA significant insight is how neoliberalism positioned itself against Keynesianism. Neoliberals argued that free markets would naturally lead to full employment through price adjustments, directly challenging Keynesian ideas about wage rigidity and the need for government intervention. The economic dislocations of the 1970s, including stagflation, provided a critical opening for neoliberal ideas to gain traction, as they offered an alternative explanation and solution to the perceived failures of Keynesian policies.\nMy next steps will involve a deeper dive into the core theoretical tenets and principles of neoliberal thought. I'll also continue to investigate the key figures, influential schools, and prominent institutions that shaped and promoted neoliberalism, building on the initial findings. Additionally, I will seek more specific details on the philosophical underpinnings and how they diverge from classical liberalism."
    },
    "search_2": [
      "https://www.mytutor.co.uk/answers/56225/A-Level/Government-and-Politics/What-are-the-main-differences-between-Classical-Liberalism-and-Neo-Liberalism",
      "https://www.reddit.com/r/CriticalTheory/comments/1b5hl3m/difference_between_liberalism_and_neoliberalism",
      "https://pmc.ncbi.nlm.nih.gov/articles/PMC6586979",
      "https://harvardpress.typepad.com/hup_publicity/2018/03/making-sense-of-neoliberalism-quinn-slobodian.html",
      "https://explaininghistory.org/2025/05/27/the-intellectual-origins-of-neoliberalism-from-hayek-to-friedman-and-beyond",
      "https://www.law.nyu.edu/sites/default/files/Beyond%20Neoliberalism%20by%20Larry%20Kramer.pdf",
      "https://en.wikipedia.org/wiki/Neoliberalism#:~:text=Neoliberalism%20is%20often%20associated%20with,and%20reductions%20in%20government%20spending.",
      "https://www.britannica.com/money/neoliberalism",
      "https://oxfordre.com/education/display/10.1093/acrefore/9780190264093.001.0001/acrefore-9780190264093-e-721?p=emailAM6.eWybpaevQ&d=/10.1093/acrefore/9780190264093.001.0001/acrefore-9780190264093-e-721",
      "https://rooseveltinstitute.org/think-tank",
      "https://www.humanrestorationproject.org/writing/the-silent-crisis-humanities-pedagogy-and-neoliberalism"
    ],
    "observation_2": "I'm now focusing on elaborating the main theoretical tenets and core principles of neoliberal thought. While I've identified key concepts like privatization, deregulation, free trade, and reduced government spending, I need to delve deeper into their economic, political, and social dimensions. A crucial nuance I'm exploring is that early neoliberalism wasn't a pure embrace of laissez-faire; it acknowledged a role for the state in constructing and maintaining market conditions, a departure from classical liberalism.",
    "plan_3": {
      "title": "Distinguishing Neoliberalism from Classical Liberalism\nExpanding on Influential Actors and Institutions\nNext Steps: Deeper Theoretical Exploration",
      "description": "A significant area of focus is to clearly distinguish neoliberalism from classical liberalism. My initial findings suggest that early neoliberals were wary of 19th-century laissez-faire, and the movement is not simply a continuation of classical liberal thought. I'm working to understand the specific ways in which neoliberalism represents a new departure, particularly in its view of the market as an information processor superior to human reason and its emphasis on the constructed nature of market conditions.\nI'm continuing to investigate the key figures, influential schools of thought, and prominent institutions that shaped and promoted neoliberalism. While I have a good grasp of figures like Hayek and Friedman, and institutions like the Mont Pelerin Society and the Chicago School, I'm looking to identify other significant contributors and understand the specific contributions and internal differences among various schools, such as the Austrian, Chicago, and Ordo-liberal perspectives.\nMy next steps involve a more in-depth exploration of the theoretical underpinnings of neoliberalism, drawing from the information I've gathered. I will be synthesizing the details on its core principles, the nuanced role of the state, and the distinctions from classical liberalism, as well as further detailing the contributions of key figures and institutions."
    },
    "search_3": [
      "https://www.investopedia.com/terms/n/neoliberalism.asp",
      "https://en.wikipedia.org/wiki/Ordoliberalism",
      "https://www.numberanalytics.com/blog/ultimate-guide-neoliberalism-social-theory",
      "https://pmc.ncbi.nlm.nih.gov/articles/PMC9605858",
      "https://academic.oup.com/book/36150/chapter/314419453/chapter-pdf/57811866/oso-9780198854289-chapter-5.pdf",
      "https://www.cambridge.org/core/books/making-thatchers-britain/thinktank-archipelago-thatcherism-and-neoliberalism/DC977778240D47DAB1B1711476EFE4E8",
      "https://rooseveltinstitute.org/think-tank",
      "https://explaininghistory.org/2025/05/27/what-is-neoliberalism-a-guide-to-the-ideology-behind-modern-capitalism",
      "https://www.mytutor.co.uk/answers/56225/A-Level/Government-and-Politics/What-are-the-main-differences-between-Classical-Liberalism-and-Neo-Liberalism",
      "https://harvardpress.typepad.com/hup_publicity/2018/03/making-sense-of-neoliberalism-quinn-slobodian.html",
      "https://www.britannica.com/money/neoliberalism",
      "https://files.persagen.com/01/Mont_Pelerin_Society-History_of_MPS-2014.pdf",
      "https://pmc.ncbi.nlm.nih.gov/articles/PMC6586979",
      "https://en.wikipedia.org/wiki/Chicago_school_of_economics"
    ],
    "observation_3": "I've made substantial progress in understanding the intellectual origins and historical background of neoliberalism. It emerged in the 1930s among European liberal scholars, like the Ordo-liberals, as a response to the perceived decline of classical liberalism and the rise of collectivist ideas, particularly influenced by the Great Depression and the post-World War II context. A key text from this period was Hayek's 'The Road to Serfdom' (1944). A significant insight is how neoliberalism critiqued Keynesianism, arguing that free markets would naturally ensure full employment and highlighting internal divisions within Keynesian thought.",
    "plan_4": {
      "title": "Defining Core Principles\nKey Players and Influential Networks\nAddressing Remaining Gaps",
      "description": "I've gathered a comprehensive overview of neoliberalism's core tenets. Economically, it champions free markets, minimal state intervention, deregulation, privatization, reduced government spending, and lower taxes. Politically, it emphasizes strong private property rights and a state that actively creates and maintains market conditions, rather than a purely laissez-faire approach. Socially, it links human progress to economic growth, promotes individual responsibility, and views the market as an arbiter of truth, which can lead to the commodification of public goods and increased economic inequality.\nMy research has identified key figures such as Friedrich Hayek, Ludwig von Mises, Milton Friedman, and the Ordo-liberals (Wilhelm Röpke, Alexander Rüstow, Walter Eucken). The Mont Pelerin Society, founded by Hayek in 1947, served as a crucial intellectual forum, while the Chicago School of Economics, with figures like Friedman and Stigler, played a significant role in propagating these ideas, particularly through monetarism and rational expectations. Political figures like Margaret Thatcher and Ronald Reagan were instrumental in implementing neoliberal policies.\nWhile I have a strong foundation, I need to further synthesize how the economic, political, and social dimensions of neoliberalism interrelate, especially reconciling the 'strong state' aspect with the 'minimal state' rhetoric. My next steps will focus on the political impact and real-world implementation of neoliberal policies in various countries, exploring their immediate consequences. I will also delve deeper into the broader socio-economic consequences, the analytical reasons for neoliberalism's rise and persistence, and its evolution and contemporary manifestations in global society."
    },
    "search_4": [
      "https://library.fiveable.me/anthropology-of-globalization/unit-4/neoliberalism-structural-adjustment/study-guide/Oea32UZYWlrXcYCg#:~:text=Neoliberalism%20and%20structural%20adjustment%20programs,impacts%20were%20huge%20but%20controversial.",
      "https://www.downsizinggovernment.org/privatization",
      "https://www.wider.unu.edu/publication/chile-under-neoliberalism",
      "https://www.economicshelp.org/blog/20688/concepts/neoliberalism",
      "https://www.numberanalytics.com/blog/neoliberalism-labor-race-class",
      "https://oxfordre.com/latinamericanhistory/display/10.1093/acrefore/9780199366439.001.0001/acrefore-9780199366439-e-99?d=%2F10.1093%2Facrefore%2F9780199366439.001.0001%2Facrefore-9780199366439-e-99&p=emailAMBg1md3l8Y0k",
      "https://www.britannica.com/money/neoliberalism",
      "https://www.numberanalytics.com/blog/neoliberalism-labor-politics-guide",
      "https://rooseveltinstitute.org/wp-content/uploads/2020/07/RI_The-Empirical-Failures-of-Neoliberalism_brief-202001.pdf",
      "https://www.frontiersin.org/journals/psychology/articles/10.3389/fpsyg.2021.694270/full",
      "https://www.mdpi.com/2075-4698/7/4/33",
      "https://www.routledge.com/Populism-and-Neoliberalism/Cayla/p/book/9780367427702",
      "https://en.wikipedia.org/wiki/Neoliberalism",
      "https://www.wzb.eu/en/node/51673",
      "https://alternateroutes.ca/index.php/ar/article/download/15857/15760",
      "https://illuminem.com/illuminemvoices/the-neoliberal-paradox",
      "https://www.dissentmagazine.org/article/uses-and-abuses-neoliberalism-debate",
      "http://www.people.umass.edu/dmkotz/Glob_and_NL_02.pdf",
      "https://www.researchgate.net/profile/Ronaldo-Munck/publication/314464865_Neoliberalism_and_Politics_and_the_Politics_of_Neoliberalism_Ronaldo_Munck/links/58c4226ba6fdcce648e4f12c/Neoliberalism-and-Politics-and-the-Politics-of-Neoliberalism-Ronaldo-Munck.pdf",
      "https://blogs.lse.ac.uk/businessreview/2019/02/02/the-2008-crisis-failed-to-displace-neoliberalisms-core-principles",
      "https://journals.openedition.org/regulation/7729",
      "https://thecic.org/neoliberalism-past-present-future",
      "https://www.transformingsociety.co.uk/2019/10/28/explaining-the-neoliberal-turn",
      "https://rooseveltinstitute.org/publications/the-cultural-contradictions-of-neoliberalism",
      "https://www.investopedia.com/terms/n/neoliberalism.asp"
    ],
    "observation_4": "I'm synthesizing a crucial nuance in neoliberal thought: the idea of a 'strong state' that actively constructs and maintains market conditions, rather than a purely 'minimal state' associated with classical laissez-faire. This distinction is vital for understanding how neoliberalism operates in practice, as it implies a deliberate role for government in shaping the economic environment to favor market mechanisms.",
    "plan_5": {
      "title": "Analyzing Neoliberalism's Rise and Persistence\nExploring Contemporary Evolution\nNext Steps: Deeper Causal and Evolutionary Analysis",
      "description": "I'm now focusing on a deeper analysis of the nature and causes of neoliberalism's rise and its continued influence. I'm weaving together factors such as the economic dislocations of the 1970s (like stagflation), the intellectual critiques of Keynesianism, and the strategic role of intellectual networks like the Mont Pelerin Society and the Chicago School. I'm also considering how shifts in corporate interests contributed to its dominance and why it has persisted despite criticisms.\nI'm elaborating on the evolution and contemporary manifestations of neoliberalism. I've noted that the 2008 financial crisis, while significant, did not displace its core principles, leading to phenomena like 'neo-austerity.' My ongoing research will explore how neoliberalism has adapted in the face of global challenges, its ongoing influence in current global society, and its connections to contemporary political and economic trends, such as populism.\nMy next steps will involve conducting more targeted research to further deepen the analytical explanation of why neoliberalism became dominant and has persisted. I will also seek more recent analyses to comprehensively detail its post-2008 trajectory and its current forms in global society."
    },
    "search_5": [
      "https://www.cambridge.org/core/books/austerity-welfare-and-work/introduction-the-crisis-and-austerity-neoliberalism/092DCCC59DC2C7E546D45BC7FBD4B7CF",
      "https://pmc.ncbi.nlm.nih.gov/articles/PMC5732618",
      "https://rooseveltinstitute.org/wp-content/uploads/2020/07/RI_The-Empirical-Failures-of-Neoliberalism_brief-202001.pdf",
      "https://blogs.lse.ac.uk/internationaldevelopment/2024/03/28/neoliberal-conditions-global-institutions-impact-on-developing-nations",
      "https://cas.au.dk/cpg/research-themes/global-governance-beyond-neoliberalism",
      "http://assets.press.princeton.edu/chapters/s7204.pdf",
      "https://academic.oup.com/ser/article/6/4/703/1739555",
      "https://en.wikipedia.org/wiki/Neoliberalism",
      "https://www.britannica.com/money/neoliberalism",
      "https://www.lse.ac.uk/ideas/Assets/Documents/updates/LSE-IDEAS-Understanding-Global-Rise-of-Populism.pdf",
      "https://www.econstor.eu/bitstream/10419/196158/1/oek36.pdf"
    ]
  },
  "final_report": "# **The Historical Development and Enduring Impact of Neoliberalism: An Academic Report**\n\n## **I. Introduction: Defining Neoliberalism and its Historical Context**\n\nThis report provides an in-depth academic analysis of neoliberalism, tracing its historical development, examining its core intellectual tenets, and evaluating its profound political and socio-economic impact across the globe. Neoliberalism, a term often employed pejoratively, is broadly understood as a political and economic ideology that champions free markets, private enterprise, and competition as the most effective mechanisms for fostering human well-being and prosperity @https://www.investopedia.com/terms/n/neoliberalism.asp>  Its policy prescriptions typically include privatization, deregulation, free trade, monetarism, austerity measures, and significant reductions in government spending @https://www.investopedia.com/terms/n/neoliberalism.asp> \n\nA common misconception portrays neoliberalism as a simple return to a minimal, \"laissez-faire\" state, characterized by a complete withdrawal of government from economic and social affairs @https://www.investopedia.com/terms/n/neoliberalism.asp>  However, a closer examination reveals a more complex reality. Neoliberalism, in its practical application, does not advocate for pure laissez-faire economics @https://en.wikipedia.org/wiki/Neoliberalism>  Instead, it necessitates a robust and active state to establish and maintain the institutional framework within which free markets can operate and thrive. This involves \"perpetual interventions\" 8 and the creation of \"complex structures of institutional supports, business-friendly regulations\" @https://www.dissentmagazine.org/article/uses-and-abuses-neoliberalism-debate/>  Historian Quinn Slobodian, for instance, argues that neoliberalism is less a theory of the market or economics and more a theory of law and state, primarily concerned with shielding the economic sphere from the political one @https://harvardpress.typepad.com/hup_publicity/2018/03/making-sense-of-neoliberalism-quinn-slobodian.html>  This perspective highlights that what is often termed \"deregulation\" is, in effect, a form of \"re-regulation\" 12, where existing rules are reshaped or new ones are introduced to favor capital accumulation and market expansion, rather than simply removing governmental oversight. Leaders associated with neoliberal reforms, such as Margaret Thatcher and Augusto Pinochet, despite their pro-market rhetoric, demonstrably utilized the full powers of the state to implement their agendas @https://www.transformingsociety.co.uk/2019/10/28/explaining-the-neoliberal-turn/>  This fundamental characteristic underscores that the state, far from being minimal, is re-tasked to actively engineer and protect market conditions, often insulating economic policy from democratic pressures.\n\nThis report will proceed by first exploring the intellectual and historical context that gave birth to neoliberal thought, identifying its key figures and foundational ideas. Subsequently, it will detail the core tenets of neoliberalism across economic, political, and social dimensions. The analysis will then shift to the real-world implementation and consequences of neoliberal policies, examining their impact on national economies and global governance. Finally, the report will address neoliberalism's evolution in contemporary society, including its remarkable resilience in the face of crises and its complex relationship with emerging political phenomena like populism.\n\n## **II. The Genesis of Neoliberal Thought: Historical Background and Intellectual Origins**\n\nThe intellectual roots of neoliberalism can be traced to European liberal scholars in the 1930s @https://en.wikipedia.org/wiki/Neoliberalism>  This period witnessed a perceived decline in the popularity of classical liberalism, which was seen as ceding ground to a \"social liberal desire to control markets\" @https://en.wikipedia.org/wiki/Neoliberalism>  The economic turmoil of the Great Depression significantly influenced this intellectual shift, prompting discussions on policies designed to counter the inherent volatility of free markets @https://en.wikipedia.org/wiki/Neoliberalism> \n\n### **A. Precursors and the Crisis of Classical Liberalism**\n\nEarly exponents of neoliberal thought were notably critical of 19th-century liberalism and its advocacy for pure laissez-faire economics. They recognized that the ideal market society would not emerge \"naturally\" but would require deliberate construction and continuous maintenance @https://www.cambridge.org/core/journals/economics-and-philosophy/article/brief-history-of-neoliberalism-david-harvey-oxford-university-press-2005-vii-247-pages/FE172126138782F93B68C59406221862>  This intellectual current was born from a profound concern about the fragility of market society and individual liberty, particularly in the face of perceived threats from socialist central planning and increasing democratic demands for state intervention and redistribution @https://harvardpress.typepad.com/hup_publicity/2018/03/making-sense-of-neoliberalism-quinn-slobodian.html>  Far from seeking to dismantle the state entirely, these early theorists even considered accommodating certain elements of the welfare state agenda, believing that the legitimation of the market and the individual liberty it secured necessitated an expansion of state capacity @https://www.cambridge.org/core/journals/historical-journal/article/at-the-origins-of-neoliberalism-the-free-economy-and-the-strong-state-19301947/B476470A93CC147E8EC8AC2EFE550062>  This proactive, \"constructivist\" approach to market building, rather than a passive non-intervention, represents a crucial underlying theme in neoliberalism's genesis. The \"crisis of classical liberalism\" was thus not merely a waning of its popularity but a recognition by a new generation of liberal thinkers that the market system required robust, state-backed protection and engineering to survive and flourish in an environment increasingly inclined towards collectivism. This understanding is foundational to comprehending its later political actions and policy choices.\n\n### **B. Foundational Meetings and Societies**\n\nThe formalization of neoliberal thought began with key intellectual gatherings. The **Colloque Walter Lippmann** in Paris in 1938 was a seminal event where the term \"neoliberalism\" was proposed and adopted to describe a specific set of economic beliefs @https://oxfordre.com/education/display/10.1093/acrefore/9780190264093.001.0001/acrefore-9780190264093-e-721?p=emailAM6.eWybpaevQ&d=/10.1093/acrefore/9780190264093.001.0001/acrefore-9780190264093-e-721>  Attendees, including prominent figures like Louis Rougier and Friedrich Hayek, envisioned a system that prioritized the price mechanism, free enterprise, and competition, but crucially, also advocated for a \"strong and impartial state\" to enforce these principles. This vision anticipated an elite structure of successful individuals gaining power in society, potentially replacing existing representative democracies @https://en.wikipedia.org/wiki/Neoliberalism> \n\nFollowing World War II, the **Mont Pelerin Society (MPS)** was founded in 1947 by F.A. Hayek, serving as a critical forum for intellectual discourse @https://files.persagen.com/01/Mont_Pelerin_Society-History_of_MPS-2014.pdf>  Its primary objective was to offer an intellectual counter-narrative to the prevailing centralism and socialism of the post-war era @https://files.persagen.com/01/Mont_Pelerin_Society-History_of_MPS-2014.pdf>  Conceived as an \"international academy,\" the MPS focused on discussing and diffusing liberal ideas, prioritizing intellectual debate over direct political engagement @https://files.persagen.com/01/Mont_Pelerin_Society-History_of_MPS-2014.pdf>  Its founding members shared a profound \"sense of crisis,\" believing that freedom was under threat from \"erroneous theories\" about history, society, and economics @https://files.persagen.com/01/Mont_Pelerin_Society-History_of_MPS-2014.pdf> \n\n### **C. Key Intellectual Figures and Schools of Thought**\n\nThe intellectual landscape of neoliberalism is rich with diverse contributions from several schools of thought:\n\n* **Austrian School:** Figures such as **Friedrich Hayek** and **Ludwig von Mises** were central to this tradition @https://oxfordre.com/education/display/10.1093/acrefore/9780190264093.001.0001/acrefore-9780190264093-e-721?p=emailAM6.eWybpaevQ&d=/10.1093/acrefore/9780190264093.001.0001/acrefore-9780190264093-e-721>  Hayek's influential work,\n  *The Road to Serfdom* (1944), argued that interventionist measures aimed at wealth redistribution inevitably lead to totalitarianism @https://www.britannica.com/money/neoliberalism>  The Misean wing, in particular, sought to ground the market in a rationalist version of \"natural necessity\" @https://www.cambridge.org/core/journals/economics-and-philosophy/article/brief-history-of-neoliberalism-david-harvey-oxford-university-press-2005-vii-247-pages/FE172126138782F93B68C59406221862> \n* **German Ordoliberals:** This group included scholars like **Wilhelm Röpke**, **Alexander Rüstow**, **Walter Eucken**, and **Alfred Müller-Armack** @https://en.wikipedia.org/wiki/Neoliberalism>  They promoted the concept of the \"social market economy,\" which, while emphasizing market principles, also favored a strong role for the state in ensuring fair competition and providing certain social security elements @https://en.wikipedia.org/wiki/Neoliberalism>  Their approach often distinguished itself from later, more radical interpretations of neoliberalism.\n* **Chicago School of Economics:** Led by prominent figures such as **Milton Friedman** and **George Stigler**, this school rejected Keynesianism in favor of monetarism, later transitioning to new classical macroeconomics heavily influenced by rational expectations @https://www.mjemcgill.com/journals/deconstructing-neoliberalism-the-role-of-the-chicago-school-in-the-development-of-neoliberalism-and-its-propagation-in-the-economies-of-chile-and-argentinanbspnbsp>  The Chicago School advocated for laissez-faire government policy, emphasizing price theory, public choice theory, and the economic analysis of law @https://en.wikipedia.org/wiki/Chicago_school_of_economics>  Their ideas were instrumental in propagating neoliberal policies, notably in countries like Chile and Argentina @https://www.mjemcgill.com/journals/deconstructing-neoliberalism-the-role-of-the-chicago-school-in-the-development-of-neoliberalism-and-its-propagation-in-the-economies-of-chile-and-argentinanbspnbsp> \n* **Other Influential Thinkers:** **James M. Buchanan** 2 contributed to public choice theory, while\n  **Ayn Rand**'s philosophy of Objectivism, emphasizing rational individualism, also resonated with some neoliberal tenets @https://oxfordre.com/education/display/10.1093/acrefore/9780190264093.001.0001/acrefore-9780190264093-e-721?p=emailAM6.eWybpaevQ&d=/10.1093/acrefore/9780190264093.001.0001/acrefore-9780190264093-e-721> \n  **Charles Peters** is associated with a distinct, centrist American \"neoliberal\" movement in the 1970s, which, while pro-market, was separate from the broader economic philosophy @https://en.wikipedia.org/wiki/Neoliberalism> \n\n**Table 1: Key Neoliberal Thinkers and Their Contributions**\n\n| Thinker's Name | Associated School/Movement | Core Contribution/Idea |\n| --- | --- | --- |\n| Friedrich Hayek | Austrian School, Mont Pelerin Society | Critique of central planning (*The Road to Serfdom*); market as information processor; strong state for rule-making, not planning 7 |\n| Milton Friedman | Chicago School of Economics, Mont Pelerin Society | Monetarism; rejection of Keynesianism; advocacy for minimal government intervention in economy; price theory 4 |\n| Wilhelm Röpke | German Ordoliberalism, Mont Pelerin Society | Social Market Economy; active state as rule-maker and enforcer of competition and social security 4 |\n| Ludwig von Mises | Austrian School, Mont Pelerin Society | Laissez-faire; grounding market in \"natural necessity\"; critique of state intervention 4 |\n| James M. Buchanan | Public Choice Theory, Mont Pelerin Society | Application of economic methods to political science; critique of government inefficiency 2 |\n| Walter Eucken | German Ordoliberalism, Freiburg School | Foundations of Ordoliberalism; \"economic constitution\" with constitutive and regulative principles for competitive markets 4 |\n| Ayn Rand | Objectivism | Philosophy of rational individualism; no greater moral goal than achieving happiness; anti-collectivism 2 |\n\n### **D. Philosophical Underpinnings: Market as Information Processor and the \"Negative Theology\"**\n\nA profound philosophical underpinning of neoliberalism lies in its view of the market. As articulated by Philip Mirowski, neoliberalism posits the market as the \"greatest information processor,\" inherently superior to any human being or state in its capacity to aggregate and process information @https://en.wikipedia.org/wiki/Neoliberalism>  This perspective positions the market as the ultimate \"arbiter of truth\" and forms the core of the neoliberal argument for the inevitable failure of socialism, as no central planning mechanism could ever match the market's cognitive power @https://www.cambridge.org/core/journals/economics-and-philosophy/article/brief-history-of-neoliberalism-david-harvey-oxford-university-press-2005-vii-247-pages/FE172126138782F93B68C59406221862> \n\nFurther extending this epistemological stance, Quinn Slobodian describes neoliberal globalism as a \"negative theology\" @https://harvardpress.typepad.com/hup_publicity/2018/03/making-sense-of-neoliberalism-quinn-slobodian.html>  In this view, the world economy is perceived as \"sublime and ineffable,\" a complex system that fundamentally escapes full human comprehension or numerical capture @https://harvardpress.typepad.com/hup_publicity/2018/03/making-sense-of-neoliberalism-quinn-slobodian.html>  Given these perceived limits to human knowledge, the philosophy advocates for \"ironclad rules\" to govern economic activity, rather than pursuing potentially \"radical\" goals such as social justice, redistribution, or collective transformation @https://harvardpress.typepad.com/hup_publicity/2018/03/making-sense-of-neoliberalism-quinn-slobodian.html>  The implication is that individuals are free to choose, but only within a circumscribed range of options dictated by these global market forces @https://harvardpress.typepad.com/hup_publicity/2018/03/making-sense-of-neoliberalism-quinn-slobodian.html>  This epistemological justification for market primacy is crucial, as it directly leads to the political philosophy of insulating economic policy from mass democratic demands @https://explaininghistory.org/2025/05/27/what-is-neoliberalism-a-guide-to-the-ideology-behind-modern-capitalism/>  The concern is that popular pressures for redistribution or social interventions could undermine the market's inherent, albeit inscrutable, efficiency @https://illuminem.com/illuminemvoices/the-neoliberal-paradox>  This is not merely an economic preference; it is a fundamental statement about the boundaries of human understanding and the perceived superiority of market mechanisms over collective, especially democratic, decision-making. This rationale provides a powerful, almost quasi-religious, basis for minimizing state intervention in social welfare and maximizing the market's reach, framing any deviation as irrational or even dangerous. It explains why neoliberal thinkers have historically been wary of mass democratic demands @https://explaininghistory.org/2025/05/27/what-is-neoliberalism-a-guide-to-the-ideology-behind-modern-capitalism/> \n\n## **III. Core Tenets of Neoliberalism: Economic, Political, and Social Dimensions**\n\nNeoliberalism is a comprehensive ideology that manifests across economic, political, and social spheres, with interconnected principles designed to maximize market influence and individual responsibility.\n\n### **A. Economic Principles**\n\nAt its core, neoliberalism champions several key economic principles:\n\n* **Free Markets and Competition:** These are considered fundamental, believed to be the most efficient allocators of resources and the primary drivers of human progress @https://explaininghistory.org/2025/05/27/what-is-neoliberalism-a-guide-to-the-ideology-behind-modern-capitalism/>  Competition is viewed as the defining characteristic of human relations @https://oxfordre.com/education/display/10.1093/acrefore/9780190264093.001.0001/acrefore-9780190264093-e-721?p=emailAM6.eWybpaevQ&d=/10.1093/acrefore/9780190264093.001.0001/acrefore-9780190264093-e-721> \n* **Deregulation:** A central tenet involves minimizing government control over industry and economic activity to enhance efficiency @https://www.investopedia.com/terms/n/neoliberalism.asp>  This includes the elimination of price controls and the deregulation of capital markets @https://en.wikipedia.org/wiki/Neoliberalism> \n* **Privatization:** This refers to the transfer of control of economic factors and public services—such as infrastructure, utilities, healthcare, and education—from governmental to private sector ownership @https://www.investopedia.com/terms/n/neoliberalism.asp> \n* **Free Trade and Globalization:** Neoliberalism actively promotes unhindered international trade and the unrestricted movement of international capital, viewing these as essential for global economic integration and efficiency @https://www.investopedia.com/terms/n/neoliberalism.asp> \n* **Monetarism and Austerity:** There is a strong emphasis on controlling the money supply to combat inflation, coupled with policies of austerity that involve reducing government budget deficits through cuts in public spending, particularly on social programs @https://www.investopedia.com/terms/n/neoliberalism.asp> \n* **Reduced Government Spending and Taxation:** This involves lowering taxes on businesses and the wealthy, with corresponding reductions in public expenditures, based on the belief that this stimulates investment and economic growth @https://www.investopedia.com/terms/n/neoliberalism.asp> \n\n### **B. Political Philosophy**\n\nThe political philosophy of neoliberalism, as discussed previously, presents a paradox. While advocating for a \"minimal state\" in terms of welfare provision and direct economic regulation, it simultaneously requires a strategically \"strong state\" to function effectively. This state's role is to enforce contracts, safeguard private property rights, control the money supply, and actively *create* and *protect* market conditions @https://explaininghistory.org/2025/05/27/what-is-neoliberalism-a-guide-to-the-ideology-behind-modern-capitalism/>  This includes establishing the legal frameworks necessary for flexible wages and working times, thereby shaping labor markets to align with market imperatives @https://www.britannica.com/money/neoliberalism> \n\nA significant aspect of this political philosophy is the deliberate insulation of economic policy from democratic pressures. Neoliberal thinkers have historically expressed wariness of mass democratic demands, fearing that popular calls for wealth redistribution or social interventions could undermine the fundamental logic of the market @https://explaininghistory.org/2025/05/27/what-is-neoliberalism-a-guide-to-the-ideology-behind-modern-capitalism/>  This concern has, in part, driven the construction of transnational institutions, such as the World Trade Organization (WTO), designed to safeguard the global economy from such social or nationalist interventions @https://harvardpress.typepad.com/hup_publicity/2018/03/making-sense-of-neoliberalism-quinn-slobodian.html>  The nation-state itself undergoes a transformation, evolving into a \"competitive state\" @https://www.britannica.com/money/neoliberalism>  In this new role, states actively compete for economic investment by facilitating privatization, further deregulation, and, often, the deterioration of labor legislation and welfare policies to attract capital @https://www.britannica.com/money/neoliberalism> \n\nThis perspective highlights that the state under neoliberalism is not merely a passive regulator but rather a proactive \"market engineer.\" Its power is repurposed away from broad social welfare or public good objectives towards actively facilitating and protecting capital accumulation. This involves shaping laws, institutions, and even social norms to align with market principles. For instance, state interventions in the form of corporate subsidies and research and development (R&D) programs are justified as means to stimulate market-driven growth @https://www.britannica.com/money/neoliberalism>  Furthermore, this approach seeks to \"desacralize\" institutions traditionally protected from market forces, such as education and healthcare, by subjecting them to competitive market dynamics @https://academic.oup.com/ser/article/6/4/703/1739555>  The neoliberal state is thus not weak; it is strategically powerful, deploying its authority to create, maintain, and expand market logic into new domains, often at the expense of social protections and democratic accountability.\n\n### **C. Social Implications**\n\nThe social dimension of neoliberalism extends deeply into individual and collective life:\n\n* **Individual Responsibility and Self-Reliance:** Neoliberal ideology strongly emphasizes self-help and individual responsibility for one's problems, positing that the market is inherently capable of self-regulation and that individual failure is largely a personal shortcoming @https://www.britannica.com/money/neoliberalism> \n* **Commodification of Public Services:** Public services, including health, education, and even water, are increasingly treated as commodities. This leads to their privatization and, consequently, reduced accessibility for vulnerable populations, exacerbating social inequalities @https://www.investopedia.com/terms/n/neoliberalism.asp>  Universities, for example, are increasingly treated as enterprises @https://www.britannica.com/money/neoliberalism> \n* **Competition as a Defining Characteristic:** Neoliberalism posits competition as the fundamental characteristic of human relations, effectively redefining citizens primarily as consumers within a market framework @https://oxfordre.com/education/display/10.1093/acrefore/9780190264093.001.0001/acrefore-9780190264093-e-721?p=emailAM6.eWybpaevQ&d=/10.1093/acrefore/9780190264093.001.0001/acrefore-9780190264093-e-721> \n* **Undermining Social and Economic Rights:** A critical aspect of the neoliberal outlook is its tendency to not acknowledge social and economic rights as legitimate human rights or genuine entitlements. Within its market-based framework, the belief is that individuals do not have a claim on societal resources for basic needs like food, education, housing, and healthcare @https://pmc.ncbi.nlm.nih.gov/articles/PMC6586979/>  This perspective directly informs policies that cut public expenditures for social services and reduce welfare programs @https://pmc.ncbi.nlm.nih.gov/articles/PMC6586979/> \n\nThe social dimension of neoliberalism goes beyond mere policy outcomes; it encompasses a powerful cultural project that actively shapes individual subjectivity and societal norms. This ideological penetration fosters a \"grind culture,\" where individuals are shamed for perceived failures and encouraged to adopt ubiquitous individualistic life strategies, such as relentless self-improvement, to \"make it\" or mitigate risks @https://rooseveltinstitute.org/publications/the-cultural-contradictions-of-neoliberalism/>  This process creates a \"neoliberal subject\" who is expected to be constantly adaptable and resilient to market shocks @https://pmc.ncbi.nlm.nih.gov/articles/PMC5732618/>  However, this relentless pressure also contributes to significant psychological and social costs, including \"mounting despair, mental health problems, overwork, addiction, loneliness and social isolation\" @https://rooseveltinstitute.org/publications/the-cultural-contradictions-of-neoliberalism/>  The widespread adoption of wellness and self-help culture can be viewed as an attempt by individuals to find solace, often by internalizing and applying neoliberal cultural tools to their personal struggles @https://rooseveltinstitute.org/publications/the-cultural-contradictions-of-neoliberalism/> \n\n**Table 2: Core Neoliberal Policies and Their Objectives/Outcomes**\n\n| Policy Area | Core Neoliberal Principle/Objective | Intended Outcome (as per proponents) | Observed Outcome (as per critics/studies) |\n| --- | --- | --- | --- |\n| **Privatization** | Transfer public assets/services to private sector 1 | Increased efficiency, innovation, reduced government burden 33 | Reduced accessibility for vulnerable populations, commodification of public goods, increased inequality 1 |\n| **Deregulation** | Minimize government control over industry and economic activity 1 | Enhanced efficiency, greater competition, economic growth 33 | Increased financial instability, growth of monopolies, harm to workers' rights 1 |\n| **Fiscal Policy (Austerity, Tax Cuts)** | Reduce government spending, lower taxes on businesses/wealthy 1 | Stimulate investment, reduce deficits, \"trickle-down\" benefits 36 | Slower GDP growth, increased income/wealth inequality, stagnant wages 36 |\n| **Trade** | Promote free trade and free movement of capital 1 | Economic efficiency, access to more products/services, globalization benefits 1 | Job outsourcing, deindustrialization in developed nations, exploitation in informal economies in developing nations 1 |\n| **Labor Markets** | Flexibilization, reduced union power 1 | Greater efficiency, responsiveness to market demands, job creation 1 | Wage stagnation, rise of precarious work, decline in job security, disproportionate impact on marginalized communities 1 |\n\n## **IV. The Rise to Dominance: Nature and Causes of Neoliberalism's Ascendancy**\n\nThe ascendancy of neoliberalism to a dominant global paradigm was not a sudden phenomenon but the culmination of intellectual development, opportune socio-economic conditions, and strategic promotion by influential actors.\n\n### **A. Critiques and Perceived Failures of Keynesianism**\n\nA primary factor in the \"Neoliberal turn\" was the perceived failure of the prevailing Keynesian consensus @https://en.wikipedia.org/wiki/Neoliberalism>  Keynesianism, despite its initial successes in post-war economic management, suffered from internal intellectual divisions, particularly concerning the theory of income distribution and the role of wage rigidity in unemployment @https://fpif.org/from_keynesianism_to_neoliberalism_shifting_paradigms_in_economics/>  While American Keynesians often accepted the marginal product theory of labor, implying that existing income distribution was fundamentally fair, British post-Keynesians emphasized the role of institutional variables and power relations in shaping income distribution @https://marxismocritico.com/wp-content/uploads/2011/10/alfredo-saad-filho-marxian-and-keynesian-critiques-of-neoliberalism.pdf>  This theoretical rift contributed to a growing paralysis within Keynesian thought, hindering the emergence of a clear, unified ideology capable of competing with the rising neoliberal rhetoric @https://marxismocritico.com/wp-content/uploads/2011/10/alfredo-saad-filho-marxian-and-keynesian-critiques-of-neoliberalism.pdf> \n\nThe most conventional explanation for the shift, however, points to the economic crisis of the 1970s. The oil price shocks of this era led to \"stagflation\"—a combination of high inflation and low economic growth—which Keynesian policies struggled to effectively address @https://en.wikipedia.org/wiki/Neoliberalism>  This provided a crucial \"entry point\" for neoliberal ideas to gain traction, presenting themselves as a viable alternative to a seemingly failing economic model @https://fpif.org/from_keynesianism_to_neoliberalism_shifting_paradigms_in_economics/>  Furthermore, neoliberal proponents characterized the labor market innovations of the New Deal era, such as trade unions and minimum wage laws, as \"market distortions\" that lacked economic efficiency rationale and were justified merely for reasons of equity @https://fpif.org/from_keynesianism_to_neoliberalism_shifting_paradigms_in_economics/>  This framing allowed for an intellectual attack on Keynesian full-employment monetary and fiscal policies.\n\n### **B. Socio-Economic and Political Dislocations of the 1970s**\n\nBeyond intellectual critiques, the socio-economic and political dislocations of the 1970s provided fertile ground for neoliberalism's rise. The reversal of the Keynesian impulse was significantly amplified by the widespread social and economic disruptions associated with the Vietnam War era and the OPEC oil price shocks @https://fpif.org/from_keynesianism_to_neoliberalism_shifting_paradigms_in_economics/>  The ideological conflict of the Cold War also played a role, fostering an antipathy towards notions of collective economic action and encouraging a denial of the inherent limitations of market capitalism @https://fpif.org/from_keynesianism_to_neoliberalism_shifting_paradigms_in_economics/> \n\nDuring this period, a \"profits squeeze\" emerged, as slower growth in the late 1960s and early 1970s coincided with demands from wage-dependent populations for continued job security and welfare protection @https://www.transformingsociety.co.uk/2019/10/28/explaining-the-neoliberal-turn/>  In response, profit-dependent owners and managers of capital became concerned about declining profitability. Their \"weapon\" in this context included the withdrawal of investment, which contributed to lower growth and higher unemployment, and a concerted push for market deregulation and tax cuts @https://www.transformingsociety.co.uk/2019/10/28/explaining-the-neoliberal-turn/>  The increased mobility of persons and capital through early globalization facilitated this withdrawal of capital and the pursuit of more favorable regulatory environments elsewhere @https://www.transformingsociety.co.uk/2019/10/28/explaining-the-neoliberal-turn/> \n\n### **C. Strategic Promotion by Intellectual Networks and Corporate Interests**\n\nThe \"long march\" of neoliberal ideas through post-war civil society institutions 15 culminated in a \"dramatic neo-liberal moment of the 1980s\" @https://www.cambridge.org/core/journals/historical-journal/article/at-the-origins-of-neoliberalism-the-free-economy-and-the-strong-state-19301947/B476470A93CC147E8EC8AC2EFE550062>  This ascendancy was not merely an organic intellectual shift or a natural market correction; it was a deliberate political project 41 driven by a confluence of intellectual development and strategic interests.\n\nIntellectual networks, such as the Mont Pelerin Society, played a crucial role in laying the theoretical groundwork. Founded in 1947, the MPS actively worked to keep the intellectual flame of liberalism alive and critique prevailing interventionist notions @https://files.persagen.com/01/Mont_Pelerin_Society-History_of_MPS-2014.pdf>  It served as a forum for intellectual exchange, diffusing liberal ideas globally through the strength and intellectual rigor of its arguments @https://files.persagen.com/01/Mont_Pelerin_Society-History_of_MPS-2014.pdf>  Similarly, the Chicago School of Economics significantly influenced the evolution and propagation of neoliberal policies, first within the United States and subsequently in developing countries @https://www.mjemcgill.com/journals/deconstructing-neoliberalism-the-role-of-the-chicago-school-in-the-development-of-neoliberalism-and-its-propagation-in-the-economies-of-chile-and-argentinanbspnbsp> \n\nCrucially, as corporate interests found that the Keynesian regulationist approach no longer served their advantage, they actively sought an alternative @http://www.people.umass.edu/dmkotz/Glob_and_NL_02.pdf>  They found in the \"old liberal ideas\" a ready-made ideological basis for cutting state programs perceived as obstacles to profit-making @http://www.people.umass.edu/dmkotz/Glob_and_NL_02.pdf>  This highlights a symbiotic relationship: economic pressures on capital (e.g., profit squeeze, stagflation) catalyzed a search for new ideological justifications. The intellectual networks, having developed these ideas for decades, provided the necessary theoretical framework. This framework was then actively promoted and implemented by powerful political actors, such as Margaret Thatcher, Ronald Reagan, and Augusto Pinochet, who were receptive to these ideas and possessed the political will to enact them, often leveraging state power to do so @https://www.transformingsociety.co.uk/2019/10/28/explaining-the-neoliberal-turn/>  The rise of neoliberalism was thus a complex process involving the strategic alignment of intellectual production, specific economic crises, and the active pursuit of capital interests seeking to restore profitability and power. This underscores the significant agency of powerful actors in shaping dominant economic paradigms.\n\n## **V. Real-World Impact: Political Implementation and Consequences**\n\nThe intellectual tenets of neoliberalism translated into concrete policy models, profoundly reshaping economies and societies across the globe.\n\n### **A. Key Case Studies of Implementation**\n\nThe late 20th century saw the widespread implementation of neoliberal policies in various national and international contexts:\n\n* **Thatcherism (UK) and Reaganomics (US):** The administrations of Margaret Thatcher in the United Kingdom (1979-1990) and Ronald Reagan in the United States (1981-1989) are strongly associated with the practical application of neoliberal policies @https://www.investopedia.com/terms/n/neoliberalism.asp>  Their agendas included extensive privatization of state-owned industries, significant tax cuts, and broad deregulation across various sectors @https://www.investopedia.com/terms/n/neoliberalism.asp>  An earlier example of a neoliberal policy in the U.S. was President Jimmy Carter's deregulation of the airline industry in 1978 @https://www.investopedia.com/terms/n/neoliberalism.asp> \n* **Pinochet's Chile:** Chile became a pioneering case study for neoliberal implementation, with radical economic reforms introduced from 1975 under the authoritarian Pinochet dictatorship @https://en.wikipedia.org/wiki/Neoliberalism>  This involved widespread privatization of public enterprises, deregulation, and financial liberalization, leading to a sharp increase in income and wealth inequality @https://www.wider.unu.edu/publication/chile-under-neoliberalism>  The \"Chicago Boys,\" a group of Chilean economists trained at the University of Chicago, played a significant role in advising and implementing these policies @https://www.mjemcgill.com/journals/deconstructing-neoliberalism-the-role-of-the-chicago-school-in-the-development-of-neoliberalism-and-its-propagation-in-the-economies-of-chile-and-argentinanbspnbsp> \n* **The Washington Consensus and Structural Adjustment Programs:** Beyond individual nations, a set of neoliberal policies known as the \"Washington Consensus\" was widely promoted and implemented in many former communist and developing countries @https://www.mjemcgill.com/journals/deconstructing-neoliberalism-the-role-of-the-chicago-school-in-the-development-of-neoliberalism-and-its-propagation-in-the-economies-of-chile-and-argentinanbspnbsp>  These policies were often imposed as conditionalities for loans from influential international financial institutions, such as the International Monetary Fund (IMF) and the World Bank @https://thecic.org/neoliberalism-past-present-future/>  The programs typically mandated trade liberalization, privatization, deregulation, and fiscal discipline @https://thecic.org/neoliberalism-past-present-future/> \n* **\"Third Way\" Politics:** The pervasive influence of neoliberal ideology extended even to center-left political parties. From the 1990s onward, parties like the British Labour Party (which officially abandoned its commitment to \"common ownership\" in 1995) and the U.S. Democratic Party under leaders like Bill Clinton and Barack Obama adopted cautiously pragmatic, pro-market policies, often referred to as \"Third Way\" approaches @https://www.britannica.com/money/neoliberalism> \n\n### **B. Socio-Economic Consequences**\n\nThe real-world implementation of neoliberal policies has generated a wide array of socio-economic consequences, often diverging significantly from the promises of its proponents.\n\n* **Economic Growth and Inequality:** While advocates of neoliberalism promised greater economic growth and efficiency, empirical studies suggest a deceleration in GDP growth rates post-1980 compared to the preceding period (1950-1980) @https://rooseveltinstitute.org/wp-content/uploads/2020/07/RI_The-Empirical-Failures-of-Neoliberalism_brief-202001.pdf>  More strikingly, neoliberal policies have consistently been linked to a significant increase in income and wealth inequality, with the benefits accruing disproportionately to the already wealthy @https://www.investopedia.com/terms/n/neoliberalism.asp>  For instance, research indicates that the top 1 percent's share of total income in the U.S. rose from 8 percent in 1979 to 18 percent in 2017 @https://rooseveltinstitute.org/wp-content/uploads/2020/07/RI_The-Empirical-Failures-of-Neoliberalism_brief-202001.pdf> \n* **Labor Market Changes:** Deregulation of labor markets and a reduction in the power of trade unions have contributed to wage stagnation for many workers, a rise in precarious work (such as the gig economy), and a general decline in job security @https://www.investopedia.com/terms/n/neoliberalism.asp>  This shift has had a particularly severe and disproportionate impact on marginalized communities, including communities of color and low-income populations @https://www.numberanalytics.com/blog/neoliberalism-labor-race-class> \n* **Commodification and Access to Public Services:** The privatization of public goods and essential services, including water, health, and education, has led to their commodification. This has often made these services less accessible or unaffordable for poor and vulnerable populations, thereby exacerbating existing social inequalities @https://www.investopedia.com/terms/n/neoliberalism.asp> \n* **Globalization and its Effects:** Neoliberalism's emphasis on economic efficiency has strongly encouraged globalization. While promoting worldwide interconnectivity and e-commerce, it has also led to factory closures and job outsourcing in developed countries, contributing to deindustrialization in some regions @https://www.investopedia.com/terms/n/neoliberalism.asp>  In developing nations, the imposition of neoliberal policies has often fostered the emergence and growth of informal economies, characterized by a lack of formal contracts, rights, or bargaining power, leading to increased exploitation @https://blogs.lse.ac.uk/internationaldevelopment/2024/03/28/neoliberal-conditions-global-institutions-impact-on-developing-nations/> \n* **Financial Instability:** Contrary to the claims of proponents, capital deregulation, a hallmark of neoliberal policy, has been linked to an increase in financial instability and has contributed to significant economic crises, including the 2008 global financial crisis @https://www.investopedia.com/terms/n/neoliberalism.asp> \n* **Decreased Social Mobility:** Empirical studies reveal a notable decline in both relative and absolute income mobility in countries that have adopted neoliberal policies. This challenges the \"trickle-down\" premise, which posits that benefits to the wealthy would eventually spread throughout society, and undermines the traditional narrative of the \"American Dream\" @https://www.economicshelp.org/blog/20688/concepts/neoliberalism/>  For example, the percentage of children earning more than their parents fell from 90% for those born in 1940 to 50% for those born in the 1980s @https://rooseveltinstitute.org/wp-content/uploads/2020/07/RI_The-Empirical-Failures-of-Neoliberalism_brief-202001.pdf> \n\nThe consistent pattern of these outcomes highlights a significant discrepancy between neoliberalism's stated goals of broad prosperity and its real-world effects. The policies, such as tax cuts, deregulation, privatization, and the weakening of labor unions, designed to unleash \"entrepreneurial freedoms\" 2 and allocate resources efficiently 1, appear to have systematically benefited capital owners at the expense of labor and the broader population. This has led to increased inequality and reduced social safety nets, suggesting a systemic outcome rather than an accidental one.\n\n**Table 3: Socio-Economic Impacts of Neoliberal Policies: A Comparative View**\n\n| Impact Area | Neoliberal Promise/Hypothesis | Observed Real-World Outcome | Specific Examples/Evidence |\n| --- | --- | --- | --- |\n| **Economic Growth** | Greater efficiency and sustained growth through free markets 1 | Slower GDP growth post-1980 compared to pre-1980 36 | Average annual US GDP growth slowed from 3 @https://www.reddit.com/r/CriticalTheory/comments/1b5hl3m/difference_between_liberalism_and_neoliberalism/> % (1950-1980) to 2 @https://pmc.ncbi.nlm.nih.gov/articles/PMC6586979/> % (since 1980) 36 |\n| **Income/Wealth Inequality** | Benefits \"trickle down\" to all, reducing poverty 34 | Significant increase in income and wealth inequality 1 | Top 1% income share in US rose from 8% (1979) to 18% (2017) 36; sharp increase in inequality in Pinochet's Chile 43 |\n| **Labor Markets** | Increased flexibility, job creation, higher wages for skilled workers 1 | Wage stagnation, rise of precarious/gig work, decline in unionization 1 | Hourly wages for most US workers increased only 0 @https://pmc.ncbi.nlm.nih.gov/articles/PMC6586979/> % per year after inflation since 1980 36; proliferation of temporary, contract, gig work 24 |\n| **Public Services** | Privatization leads to better, more accessible services 33 | Commodification, reduced accessibility for vulnerable populations 1 | Increased water prices post-privatization in developing countries 24; healthcare less accessible to those who cannot afford it 24 |\n| **Financial Stability** | Capital deregulation promotes economic development 1 | Increased financial instability, recurrent economic crises 1 | 2008 Global Financial Crisis, attributed to financial deregulation and speculation 35 |\n| **Social Mobility** | Increased upward mobility through dynamic markets 36 | Significant decline in both relative and absolute income mobility 36 | 90% of children born in 1940 earned more than parents; only 50% for those born in 1980s 36 |\n\n### **C. Impact on Human Rights and Social Welfare**\n\nNeoliberal doctrine directly impacts human rights and social welfare by seeking to reduce the state's role in their protection and implementation @https://pmc.ncbi.nlm.nih.gov/articles/PMC6586979/>  This approach aims to diminish or even eliminate the state's social and welfare responsibilities, often leading to cuts in public expenditures for social services such as health and education, and reductions in welfare programs and the safety net for the poor @https://pmc.ncbi.nlm.nih.gov/articles/PMC6586979/>  A key aspect of the neoliberal outlook is its reluctance to acknowledge social and economic rights as legitimate human rights or genuine entitlements. Within its market-based framework, it is believed that individuals do not have a claim on societal resources necessary for adequate food, education, housing, and healthcare @https://pmc.ncbi.nlm.nih.gov/articles/PMC6586979/>  Consequently, the commodification of public services directly undermines access to these fundamental human rights.\n\n## **VI. Neoliberalism in Contemporary Society: Evolution, Resilience, and Challenges**\n\nDespite significant challenges and widespread criticism, neoliberalism has demonstrated remarkable resilience and continues to exert profound influence in contemporary global society.\n\n### **A. Resilience Post-2008 Financial Crisis**\n\nThe 2007/2008 global financial crisis, widely attributed to the excesses of financialization and deregulation—key features of neoliberalism—engendered expectations of a shift towards a \"post-neoliberal regime\" @https://pmc.ncbi.nlm.nih.gov/articles/PMC5732618/>  However, this shift largely failed to materialize @https://pmc.ncbi.nlm.nih.gov/articles/PMC5732618/>  Instead, neoliberalism not only survived but, in many respects, \"thrived\" @https://blogs.lse.ac.uk/businessreview/2019/02/02/the-2008-crisis-failed-to-displace-neoliberalisms-core-principles/>  The crisis did not lead to a fundamental repudiation of its core principles.\n\nThis persistence can be understood as a manifestation of neoliberalism's inherent adaptive capacity and its ability to leverage crises as opportunities for further reform. Following the crisis, \"austerity\" ascended as a dominant political and economic project, leading to what some term \"neo-austerity\" @https://blogs.lse.ac.uk/businessreview/2019/02/02/the-2008-crisis-failed-to-displace-neoliberalisms-core-principles/>  This involved massive bailouts of financial institutions, followed by public spending cuts and regressive tax hikes to reduce public debt @https://blogs.lse.ac.uk/businessreview/2019/02/02/the-2008-crisis-failed-to-displace-neoliberalisms-core-principles/>  This response exemplifies the \"strong state\" paradox: the state intervened decisively to protect the financial system (a core neoliberal concern for capital), then imposed the costs onto the public through austerity measures, thereby reinforcing the model of a \"shrunken welfare state\" @https://blogs.lse.ac.uk/businessreview/2019/02/02/the-2008-crisis-failed-to-displace-neoliberalisms-core-principles/>  This demonstrates that neoliberalism is not a static ideology but a dynamic framework capable of absorbing shocks and reinterpreting them to further its agenda, often by prioritizing capital interests even at the expense of public welfare.\n\n### **B. Adaptations and Ongoing Influence in Global Governance**\n\nNeoliberal principles continue to be deeply embedded within the architecture of global governance, particularly through the operations of international financial institutions such as the IMF, World Bank, and WTO @https://thecic.org/neoliberalism-past-present-future/>  These institutions, initially established to regulate global finance and trade, have increasingly become instrumental in propagating neoliberalism worldwide @https://blogs.lse.ac.uk/internationaldevelopment/2024/03/28/neoliberal-conditions-global-institutions-impact-on-developing-nations/>  They achieve this by imposing \"conditionalities\"—neoliberal principles like trade liberalization, privatization, and deregulation—on nations seeking loans @https://blogs.lse.ac.uk/internationaldevelopment/2024/03/28/neoliberal-conditions-global-institutions-impact-on-developing-nations/> \n\nThis institutionalization of neoliberalism in global governance has significant consequences, particularly for developing nations. The application of these principles, often driven by the theory of comparative advantage, has frequently \"condemned some states to producers of primary products\" 37, limiting their industrial diversification and perpetuating a specific, often unequal, global division of labor. Furthermore, the widespread adoption of these policies has contributed to a global increase in informal economies, characterized by a lack of formal contracts, rights, or regulation, and often leading to exploitation, particularly of women and children @https://blogs.lse.ac.uk/internationaldevelopment/2024/03/28/neoliberal-conditions-global-institutions-impact-on-developing-nations/>  This demonstrates how neoliberal policies, while promoting a certain kind of \"efficiency,\" can simultaneously create new forms of precarity and inequality on a global scale. The concept of \"neoliberal globalization\" itself emphasizes free trade policies and the free movement of international capital, further solidifying these global economic arrangements @https://www.britannica.com/money/neoliberalism> \n\n### **C. The Connection Between Neoliberalism and the Rise of Populism**\n\nContemporary populism is frequently viewed as a rebellion against the forces of globalization and neoliberalism @https://www.routledge.com/Populism-and-Neoliberalism/Cayla/p/book/9780367427702>  The roots of populist movements are often traced to the inherent contradiction between the democratic ideal, which posits that \"the people should decide,\" and neoliberal governance, which seeks to establish markets and competition as the \"arbiters of major social developments\" @https://www.routledge.com/Populism-and-Neoliberalism/Cayla/p/book/9780367427702>  The rising income inequality, stagnation of the working class, and degradation of the environment—outcomes often associated with neoliberal policies 26—contribute to widespread social discontent and a \"logic of resentment\" @https://www.wzb.eu/en/node/51673> \n\nHowever, the relationship between neoliberalism and populism is complex and, at times, paradoxical. While populism arises from grievances exacerbated by neoliberal policies, it can also, in some instances, adopt and amplify certain neoliberal logics. For example, some analyses suggest that conservative populism tends to target those with a \"monopoly on representation\" (such as journalists, academics, and established political parties) rather than those with a \"monopoly on production\" (i.e., capitalist structures), potentially indicating a \"further radicalisation of neoliberal logic\" @https://www.wzb.eu/en/node/51673>  This suggests a misdirection of public anger away from systemic economic structures. There is even a discussion about the potential for a \"new authoritarian form of neoliberalism,\" where a strong state (often led by a populist figure) enforces market order while simultaneously suppressing democratic dissent or social welfare demands @https://www.econstor.eu/bitstream/10419/196158/1/oek36.pdf>  This complex interplay suggests that populism is not a simple rejection of neoliberalism. While it emerges from the very societal fissures created by neoliberal policies, it can paradoxically internalize and perpetuate certain neoliberal values, or even represent a mutated, more authoritarian form of neoliberal logic rather than a true alternative.\n\n### **D. Cultural and Psychological Consequences**\n\nBeyond economic and political shifts, neoliberal policies and ideology have left a significant mark on culture and individual psychology. This has been described as \"cultural wreckage,\" manifesting in mounting despair, widespread mental health problems, pervasive overwork, rising addiction rates, increased loneliness and social isolation, and an internalized sense of shame for those perceived as failing to succeed in the market @https://rooseveltinstitute.org/publications/the-cultural-contradictions-of-neoliberalism/> \n\nThis cultural influence is evident in the prevalence of \"grind culture,\" which valorizes relentless productivity and self-optimization, and the shaming of individuals who do not achieve market-defined success @https://rooseveltinstitute.org/publications/the-cultural-contradictions-of-neoliberalism/>  Ubiquitous individualistic life strategies, such as self-improvement and self-help culture, become coping mechanisms, where individuals turn the very cultural tools of neoliberalism back on themselves in an attempt to find solace or mitigate the risks of failure @https://rooseveltinstitute.org/publications/the-cultural-contradictions-of-neoliberalism/>  This profound penetration into personal lives illustrates how neoliberalism functions not just as an economic or political system but as a pervasive cultural force shaping how individuals perceive themselves, their responsibilities, and their relationship to society, often with significant psychological and social costs.\n\n### **E. Ongoing Debates and Future Trajectories**\n\nThe enduring impacts of neoliberalism have spurred ongoing debates and a growing pushback against its principles, often manifesting in increased nationalism and protectionism @https://thecic.org/neoliberalism-past-present-future/>  There is a burgeoning intellectual and political movement exploring alternatives, with calls for moving \"Beyond Neoliberalism\" and developing new economic and social models @https://www.law.nyu.edu/sites/default/files/Beyond%20Neoliberalism%20by%20Larry%20Kramer.pdf>  These discussions center on addressing the negative consequences of neoliberalism, including strengthening labor unions, improving labor regulations, implementing more progressive taxation, and increasing public investment in essential services and infrastructure @https://www.numberanalytics.com/blog/neoliberalism-labor-politics-guide>  The future trajectory of global political economy will depend on the capacity of societies to critically assess the legacy of neoliberalism and forge new pathways that prioritize broader well-being and social justice.\n\n## **VII. Conclusion: A Critical Synthesis and Future Outlook**\n\nThe historical development of neoliberalism reveals a complex and often contradictory ideology that has profoundly shaped the modern world. Far from being a simple reassertion of classical laissez-faire principles, neoliberalism emerged as a sophisticated, constructivist project. Its intellectual origins in the 1930s were rooted in a strategic response to the perceived fragility of market systems and the rising tide of collectivism, necessitating an active, \"strong state\" to engineer and protect market conditions. This fundamental characteristic—the state as a market engineer rather than merely a minimal regulator—is central to understanding its true nature.\n\nThe report has highlighted that the real-world implementation of neoliberal policies, exemplified by Thatcherism, Reaganomics, Pinochet's Chile, and the Washington Consensus, consistently produced outcomes that diverged from its stated goals of broad prosperity. Instead, these policies have been empirically linked to slower economic growth, a marked increase in income and wealth inequality, the precaritization of labor, the commodification of public services, and heightened financial instability. These consequences underscore a systemic pattern where benefits disproportionately accrue to capital owners, often at the expense of labor and the broader population, challenging the efficacy of the \"trickle-down\" premise.\n\nNeoliberalism has demonstrated remarkable resilience, even thriving in the aftermath of crises for which it is widely blamed, such as the 2008 financial crisis. This adaptability is evident in its capacity to leverage crises as justifications for further market-oriented reforms, often through the imposition of austerity measures that reinforce a capital-centric, shrunken welfare state. Its influence is deeply institutionalized within global governance structures, which continue to propagate neoliberal principles through conditionalities that can perpetuate unequal development and foster informal economies in developing nations. The rise of populism presents a complex challenge, emerging from the societal fissures created by neoliberalism's impacts, yet sometimes paradoxically adopting or amplifying certain neoliberal logics, potentially leading to new forms of authoritarian governance. Furthermore, the pervasive cultural and psychological consequences, including increased despair, individualism, and the internalization of market logic, reveal the profound depth of neoliberalism's societal penetration.\n\nLooking ahead, the ongoing debates and growing pushback against neoliberalism signal a critical juncture. The consistent empirical failures to deliver on promises of broad-based prosperity, coupled with increasing social discontent, necessitate a re-evaluation of its foundational assumptions and policy prescriptions. Future academic inquiry will be crucial in further dissecting the long-term cultural and psychological effects of this paradigm, exploring the potential for novel forms of authoritarian neoliberalism, and rigorously assessing the viability and implications of alternative economic and social models that seek to rebalance power and prioritize collective well-being.\n\n#### 引用的著作\n\n1. Neoliberalism: What It Is, With Examples and Pros and Cons - Investopedia, 访问时间为 八月 4, 2025， <https://www.investopedia.com/terms/n/neoliberalism.asp>\n2. Impact of the Neoliberal Revolution on Society and Public Education, 访问时间为 八月 4, 2025， <https://oxfordre.com/education/display/10.1093/acrefore/9780190264093.001.0001/acrefore-9780190264093-e-721?p=emailAM6.eWybpaevQ&d=/10.1093/acrefore/9780190264093.001.0001/acrefore-9780190264093-e-721>\n3. What Is Neoliberalism? A Guide to the Ideology Behind Modern Capitalism - Explaining History Podcast, 访问时间为 八月 4, 2025， <https://explaininghistory.org/2025/05/27/what-is-neoliberalism-a-guide-to-the-ideology-behind-modern-capitalism/>\n4. Neoliberalism - Wikipedia, 访问时间为 八月 4, 2025， <https://en.wikipedia.org/wiki/Neoliberalism>\n5. en.wikipedia.org, 访问时间为 八月 4, 2025， <https://en.wikipedia.org/wiki/Neoliberalism#:~:text=Neoliberalism%20is%20often%20associated%20with,and%20reductions%20in%20government%20spending.>\n6. Being Bold about Rights in a Neoliberal World - PMC, 访问时间为 八月 4, 2025， <https://pmc.ncbi.nlm.nih.gov/articles/PMC6586979/>\n7. Neoliberalism | Definition, Ideology, & Examples | Britannica Money, 访问时间为 八月 4, 2025， <https://www.britannica.com/money/neoliberalism>\n8. A Brief History of Neoliberalism, David Harvey. Oxford University Press, 2005, vii + 247 pages. | Economics & Philosophy, 访问时间为 八月 4, 2025， <https://www.cambridge.org/core/journals/economics-and-philosophy/article/brief-history-of-neoliberalism-david-harvey-oxford-university-press-2005-vii-247-pages/FE172126138782F93B68C59406221862>\n9. Difference between Liberalism and Neo-Liberalism : r/CriticalTheory - Reddit, 访问时间为 八月 4, 2025， <https://www.reddit.com/r/CriticalTheory/comments/1b5hl3m/difference_between_liberalism_and_neoliberalism/>\n10. The Uses and Abuses of “Neoliberalism” - Dissent Magazine, 访问时间为 八月 4, 2025， <https://www.dissentmagazine.org/article/uses-and-abuses-neoliberalism-debate/>\n11. Making Sense of Neoliberalism - Harvard University Press Blog, 访问时间为 八月 4, 2025， <https://harvardpress.typepad.com/hup_publicity/2018/03/making-sense-of-neoliberalism-quinn-slobodian.html>\n12. neoliberalism and the State - Alternate Routes: A Journal of Critical Social Research, 访问时间为 八月 4, 2025， <https://alternateroutes.ca/index.php/ar/article/download/15857/15760>\n13. Explaining the Neoliberal turn - Transforming Society, 访问时间为 八月 4, 2025， <https://www.transformingsociety.co.uk/2019/10/28/explaining-the-neoliberal-turn/>\n14. en.wikipedia.org, 访问时间为 八月 4, 2025， <https://en.wikipedia.org/wiki/Neoliberalism#:~:text=Neoliberalism%20originated%20among%20European%20liberal,liberal%20desire%20to%20control%20markets.>\n15. At the Origins of Neo-Liberalism: The Free Economy and the Strong State, 1930–1947\\* | The Historical Journal | Cambridge Core, 访问时间为 八月 4, 2025， <https://www.cambridge.org/core/journals/historical-journal/article/at-the-origins-of-neoliberalism-the-free-economy-and-the-strong-state-19301947/B476470A93CC147E8EC8AC2EFE550062>\n16. The neoliberal paradox - illuminem, 访问时间为 八月 4, 2025， <https://illuminem.com/illuminemvoices/the-neoliberal-paradox>\n17. A SHORT HISTORY OF THE MONT PELERIN SOCIETY By Eamonn ..., 访问时间为 八月 4, 2025， <https://files.persagen.com/01/Mont_Pelerin_Society-History_of_MPS-2014.pdf>\n18. Scaling the Heights - A History of the Mont Pelerin Society - Adam Smith Institute, 访问时间为 八月 4, 2025， <https://www.adamsmith.org/blog/scaling-the-heights-a-history-of-the-mont-pelerin-society>\n19. The Intellectual Origins of Neoliberalism: From Hayek to Friedman and Beyond - Explaining History Podcast, 访问时间为 八月 4, 2025， <https://explaininghistory.org/2025/05/27/the-intellectual-origins-of-neoliberalism-from-hayek-to-friedman-and-beyond/>\n20. Ordoliberalism - Wikipedia, 访问时间为 八月 4, 2025， <https://en.wikipedia.org/wiki/Ordoliberalism>\n21. Ordo-Liberalism as Tradition, Ideology, and Model of Citizenship: Memorializing, Reinventing, Forgetting - Oxford Academic, 访问时间为 八月 4, 2025， <https://academic.oup.com/book/36150/chapter/314419453/chapter-pdf/57811866/oso-9780198854289-chapter-5.pdf>\n22. Deconstructing Neoliberalism: The Role of the Chicago School in the Development of Neoliberalism and its Propagation in the Economies of Chile and Argentina - McGill Journal of Economics, 访问时间为 八月 4, 2025， <https://www.mjemcgill.com/journals/deconstructing-neoliberalism-the-role-of-the-chicago-school-in-the-development-of-neoliberalism-and-its-propagation-in-the-economies-of-chile-and-argentinanbspnbsp>\n23. Chicago school of economics - Wikipedia, 访问时间为 八月 4, 2025， <https://en.wikipedia.org/wiki/Chicago_school_of_economics>\n24. Understanding Neoliberalism's Social Impact - Number Analytics, 访问时间为 八月 4, 2025， <https://www.numberanalytics.com/blog/ultimate-guide-neoliberalism-social-theory>\n25. Neoliberalism in Labor Politics - Number Analytics, 访问时间为 八月 4, 2025， <https://www.numberanalytics.com/blog/neoliberalism-labor-politics-guide>\n26. Neoliberalism: past, present…future? - Canadian International Council, 访问时间为 八月 4, 2025， <https://thecic.org/neoliberalism-past-present-future/>\n27. The 2008 crisis failed to displace neoliberalism's core principles - LSE Business Review, 访问时间为 八月 4, 2025， <https://blogs.lse.ac.uk/businessreview/2019/02/02/the-2008-crisis-failed-to-displace-neoliberalisms-core-principles/>\n28. Introduction: the Crisis and Austerity Neoliberalism (Chapter 1) - Cambridge University Press, 访问时间为 八月 4, 2025， <https://www.cambridge.org/core/books/austerity-welfare-and-work/introduction-the-crisis-and-austerity-neoliberalism/092DCCC59DC2C7E546D45BC7FBD4B7CF>\n29. What is neo-liberalism? | Socio-Economic Review - Oxford Academic, 访问时间为 八月 4, 2025， <https://academic.oup.com/ser/article/6/4/703/1739555>\n30. The Silent Crisis: Humanities, Pedagogy, and Neoliberalism | Human Restoration Project, 访问时间为 八月 4, 2025， <https://www.humanrestorationproject.org/writing/the-silent-crisis-humanities-pedagogy-and-neoliberalism>\n31. The Cultural Contradictions of Neoliberalism: The Longing for an Alternative Order and the Future of Multiracial Democracy in an Age of Authoritarianism - The Roosevelt Institute, 访问时间为 八月 4, 2025， <https://rooseveltinstitute.org/publications/the-cultural-contradictions-of-neoliberalism/>\n32. Governing the resilience of neoliberalism through biopolitics - PMC - PubMed Central, 访问时间为 八月 4, 2025， <https://pmc.ncbi.nlm.nih.gov/articles/PMC5732618/>\n33. Privatization | Downsizing the Federal Government, 访问时间为 八月 4, 2025， <https://www.downsizinggovernment.org/privatization>\n34. Neoliberalism - examples and criticisms - Economics Help, 访问时间为 八月 4, 2025， <https://www.economicshelp.org/blog/20688/concepts/neoliberalism/>\n35. The global financial crisis, neoclassical economics, and the neoliberal years of capitalism, 访问时间为 八月 4, 2025， <https://journals.openedition.org/regulation/7729>\n36. THE EMPIRICAL FAILURES OF NEOLIBERALISM - The Roosevelt Institute, 访问时间为 八月 4, 2025， <https://rooseveltinstitute.org/wp-content/uploads/2020/07/RI_The-Empirical-Failures-of-Neoliberalism_brief-202001.pdf>\n37. Neoliberal Conditions: Global Institutions' Impact on Developing Nations - LSE Blogs, 访问时间为 八月 4, 2025， <https://blogs.lse.ac.uk/internationaldevelopment/2024/03/28/neoliberal-conditions-global-institutions-impact-on-developing-nations/>\n38. Neoliberalism's Impact on Labor - Number Analytics, 访问时间为 八月 4, 2025， <https://www.numberanalytics.com/blog/neoliberalism-labor-race-class>\n39. From Keynesianism to Neoliberalism: Shifting Paradigms in Economics - FPIF, 访问时间为 八月 4, 2025， <https://fpif.org/from_keynesianism_to_neoliberalism_shifting_paradigms_in_economics/>\n40. MARXIAN AND KEYNESIAN CRITIQUES OF NEOLIBERALISM NEOLIBERALISM HAS LOST much of its political legitimacy and nearly all its popu, 访问时间为 八月 4, 2025， <https://marxismocritico.com/wp-content/uploads/2011/10/alfredo-saad-filho-marxian-and-keynesian-critiques-of-neoliberalism.pdf>\n41. THE RISE OF NEOLIBERALISM AND INSTITUTIONAL ANALYSIS - Princeton University, 访问时间为 八月 4, 2025， <http://assets.press.princeton.edu/chapters/s7204.pdf>\n42. Globalization and Neoliberalism, 访问时间为 八月 4, 2025， <http://www.people.umass.edu/dmkotz/Glob_and_NL_02.pdf>\n43. Blog : Chile under neoliberalism - UNU-WIDER, 访问时间为 八月 4, 2025， <https://www.wider.unu.edu/publication/chile-under-neoliberalism>\n44. Neoliberalism in Chile | Oxford Research Encyclopedia of Latin American History, 访问时间为 八月 4, 2025， [https://oxfordre.com/latinamericanhistory/display/10.1093/acrefore/9780199366439.001.0001/acrefore-9780199366439-e-99?d=%2F10.1093%2Facrefore%2F9780199366439.001.0001%2Facrefore-9780199366439-e-99&p=emailAMBg1md3l8Y0k](https://oxfordre.com/latinamericanhistory/display/10.1093/acrefore/9780199366439.001.0001/acrefore-9780199366439-e-99?d=/10.1093/acrefore/9780199366439.001.0001/acrefore-9780199366439-e-99&p=emailAMBg1md3l8Y0k)\n45. library.fiveable.me, 访问时间为 八月 4, 2025， <https://library.fiveable.me/anthropology-of-globalization/unit-4/neoliberalism-structural-adjustment/study-guide/Oea32UZYWlrXcYCg#:~:text=Neoliberalism%20and%20structural%20adjustment%20programs,impacts%20were%20huge%20but%20controversial.>\n46. Beyond Neoliberalism - NYU Law, 访问时间为 八月 4, 2025， <https://www.law.nyu.edu/sites/default/files/Beyond%20Neoliberalism%20by%20Larry%20Kramer.pdf>\n47. Global Governance Beyond Neoliberalism - Institut for Kultur og Samfund, 访问时间为 八月 4, 2025， <https://cas.au.dk/cpg/research-themes/global-governance-beyond-neoliberalism>\n48. Populism and Neoliberalism - 1st Edition - David Cayla - Routledge Boo, 访问时间为 八月 4, 2025， <https://www.routledge.com/Populism-and-Neoliberalism/Cayla/p/book/9780367427702>\n49. The Neoliberal Spirit of Populism | WZB, 访问时间为 八月 4, 2025， <https://www.wzb.eu/en/node/51673>\n50. UNDERSTANDING THE GLOBAL RISE OF POPULISM - LSE, 访问时间为 八月 4, 2025， <https://www.lse.ac.uk/ideas/Assets/Documents/updates/LSE-IDEAS-Understanding-Global-Rise-of-Populism.pdf>\n51. Neoliberalism and right-wing populism: Conceptual analogies - EconStor, 访问时间为 八月 4, 2025， <https://www.econstor.eu/bitstream/10419/196158/1/oek36.pdf>\n52. Our Think Tank - The Roosevelt Institute, 访问时间为 八月 4, 2025， <https://rooseveltinstitute.org/think-tank/>\n",
  "all_source_links": [
    "http://assets.press.princeton.edu/chapters/s7204.pdf",
    "http://www.people.umass.edu/dmkotz/Glob_and_NL_02.pdf",
    "https://academic.oup.com/book/36150/chapter/314419453/chapter-pdf/57811866/oso-9780198854289-chapter-5.pdf",
    "https://academic.oup.com/ser/article/6/4/703/1739555",
    "https://accounts.google.com/SignOutOptions?hl=zh-CN&continue=https://gemini.google.com/%3Fis_sa%3D1%26is_sa%3D1%26android-min-version%3D301356232%26ios-min-version%3D322.0%26campaign_id%3Dbkws%26utm_source%3Dsem%26utm_source%3Dgoogle%26utm_medium%3Dpaid-media%26utm_medium%3Dcpc%26utm_campaign%3Dbkws%26utm_campaign%3D2024enAU_gemfeb%26pt%3D9008%26mt%3D8%26ct%3Dp-growth-sem-bkws%26gclsrc%3Daw.ds%26gad_source%3D1%26gad_campaignid%3D22437964261%26gbraid%3D0AAAAApk5BhmTIKeu82GeBI85qNScnwP3m%26gclid%3DCjwKCAjwkvbEBhApEiwAKUz6-ybVgRKghbvMe_m6J9HfhKccGbx5pv_fQCiPXewPYkQWthYXErb2txoClPAQAvD_BwE&ec=GBRAkgU",
    "https://alternateroutes.ca/index.php/ar/article/download/15857/15760",
    "https://blogs.lse.ac.uk/businessreview/2019/02/02/the-2008-crisis-failed-to-displace-neoliberalisms-core-principles",
    "https://blogs.lse.ac.uk/internationaldevelopment/2024/03/28/neoliberal-conditions-global-institutions-impact-on-developing-nations",
    "https://cas.au.dk/cpg/research-themes/global-governance-beyond-neoliberalism",
    "https://en.wikipedia.org/wiki/Chicago_school_of_economics",
    "https://en.wikipedia.org/wiki/Neoliberalism",
    "https://en.wikipedia.org/wiki/Neoliberalism#:~:text=Neoliberalism%20is%20often%20associated%20with,and%20reductions%20in%20government%20spending.",
    "https://en.wikipedia.org/wiki/Neoliberalism#:~:text=Neoliberalism%20originated%20among%20European%20liberal,liberal%20desire%20to%20control%20markets.",
    "https://en.wikipedia.org/wiki/Ordoliberalism",
    "https://explaininghistory.org/2025/05/27/the-intellectual-origins-of-neoliberalism-from-hayek-to-friedman-and-beyond",
    "https://explaininghistory.org/2025/05/27/what-is-neoliberalism-a-guide-to-the-ideology-behind-modern-capitalism",
    "https://files.persagen.com/01/Mont_Pelerin_Society-History_of_MPS-2014.pdf",
    "https://fpif.org/from_keynesianism_to_neoliberalism_shifting_paradigms_in_economics",
    "https://harvardpress.typepad.com/hup_publicity/2018/03/making-sense-of-neoliberalism-quinn-slobodian.html",
    "https://illuminem.com/illuminemvoices/the-neoliberal-paradox",
    "https://journals.openedition.org/regulation/7729",
    "https://library.fiveable.me/anthropology-of-globalization/unit-4/neoliberalism-structural-adjustment/study-guide/Oea32UZYWlrXcYCg#:~:text=Neoliberalism%20and%20structural%20adjustment%20programs,impacts%20were%20huge%20but%20controversial.",
    "https://marxismocritico.com/wp-content/uploads/2011/10/alfredo-saad-filho-marxian-and-keynesian-critiques-of-neoliberalism.pdf",
    "https://myactivity.google.com/product/gemini?utm_source=gemini",
    "https://oxfordre.com/education/display/10.1093/acrefore/9780190264093.001.0001/acrefore-9780190264093-e-721?p=emailAM6.eWybpaevQ&d=/10.1093/acrefore/9780190264093.001.0001/acrefore-9780190264093-e-721",
    "https://oxfordre.com/latinamericanhistory/display/10.1093/acrefore/9780199366439.001.0001/acrefore-9780199366439-e-99?d=%2F10.1093%2Facrefore%2F9780199366439.001.0001%2Facrefore-9780199366439-e-99&p=emailAMBg1md3l8Y0k",
    "https://oxfordre.com/latinamericanhistory/display/10.1093/acrefore/9780199366439.001.0001/acrefore-9780199366439-e-99?d=/10.1093/acrefore/9780199366439.001.0001/acrefore-9780199366439-e-99&p=emailAMBg1md3l8Y0k",
    "https://pmc.ncbi.nlm.nih.gov/articles/PMC5732618",
    "https://pmc.ncbi.nlm.nih.gov/articles/PMC6586979",
    "https://pmc.ncbi.nlm.nih.gov/articles/PMC9605858",
    "https://policies.google.com/terms",
    "https://rooseveltinstitute.org/publications/the-cultural-contradictions-of-neoliberalism",
    "https://rooseveltinstitute.org/think-tank",
    "https://rooseveltinstitute.org/wp-content/uploads/2020/07/RI_The-Empirical-Failures-of-Neoliberalism_brief-202001.pdf",
    "https://support.google.com/bard/answer/13594961",
    "https://support.google.com/gemini/answer/13594961#location&zippy=%2Cwhat-location-information-do-gemini-apps-collect-why-and-how-is-it-used",
    "https://thecic.org/neoliberalism-past-present-future",
    "https://www.adamsmith.org/blog/scaling-the-heights-a-history-of-the-mont-pelerin-society",
    "https://www.britannica.com/money/neoliberalism",
    "https://www.cambridge.org/core/books/austerity-welfare-and-work/introduction-the-crisis-and-austerity-neoliberalism/092DCCC59DC2C7E546D45BC7FBD4B7CF",
    "https://www.cambridge.org/core/books/making-thatchers-britain/thinktank-archipelago-thatcherism-and-neoliberalism/DC977778240D47DAB1B1711476EFE4E8",
    "https://www.cambridge.org/core/journals/economics-and-philosophy/article/brief-history-of-neoliberalism-david-harvey-oxford-university-press-2005-vii-247-pages/FE172126138782F93B68C59406221862",
    "https://www.cambridge.org/core/journals/historical-journal/article/at-the-origins-of-neoliberalism-the-free-economy-and-the-strong-state-19301947/B476470A93CC147E8EC8AC2EFE550062",
    "https://www.dissentmagazine.org/article/uses-and-abuses-neoliberalism-debate",
    "https://www.downsizinggovernment.org/privatization",
    "https://www.economicshelp.org/blog/20688/concepts/neoliberalism",
    "https://www.econstor.eu/bitstream/10419/196158/1/oek36.pdf",
    "https://www.frontiersin.org/journals/psychology/articles/10.3389/fpsyg.2021.694270/full",
    "https://www.humanrestorationproject.org/writing/the-silent-crisis-humanities-pedagogy-and-neoliberalism",
    "https://www.investopedia.com/terms/n/neoliberalism.asp",
    "https://www.journals.uchicago.edu/doi/full/10.1086/710311",
    "https://www.law.nyu.edu/sites/default/files/Beyond%20Neoliberalism%20by%20Larry%20Kramer.pdf",
    "https://www.lse.ac.uk/ideas/Assets/Documents/updates/LSE-IDEAS-Understanding-Global-Rise-of-Populism.pdf",
    "https://www.mdpi.com/2075-4698/7/4/33",
    "https://www.mjemcgill.com/journals/deconstructing-neoliberalism-the-role-of-the-chicago-school-in-the-development-of-neoliberalism-and-its-propagation-in-the-economies-of-chile-and-argentinanbspnbsp",
    "https://www.mytutor.co.uk/answers/56225/A-Level/Government-and-Politics/What-are-the-main-differences-between-Classical-Liberalism-and-Neo-Liberalism",
    "https://www.numberanalytics.com/blog/neoliberalism-labor-politics-guide",
    "https://www.numberanalytics.com/blog/neoliberalism-labor-race-class",
    "https://www.numberanalytics.com/blog/ultimate-guide-neoliberalism-social-theory",
    "https://www.reddit.com/r/CriticalTheory/comments/1b5hl3m/difference_between_liberalism_and_neoliberalism",
    "https://www.researchgate.net/profile/Ronaldo-Munck/publication/314464865_Neoliberalism_and_Politics_and_the_Politics_of_Neoliberalism_Ronaldo_Munck/links/58c4226ba6fdcce648e4f12c/Neoliberalism-and-Politics-and-the-Politics-of-Neoliberalism-Ronaldo-Munck.pdf",
    "https://www.routledge.com/Populism-and-Neoliberalism/Cayla/p/book/9780367427702",
    "https://www.transformingsociety.co.uk/2019/10/28/explaining-the-neoliberal-turn",
    "https://www.wider.unu.edu/publication/chile-under-neoliberalism",
    "https://www.wzb.eu/en/node/51673"
  ],
  "summary_citations": [
    "http://assets.press.princeton.edu/chapters/s7204.pdf",
    "http://www.people.umass.edu/dmkotz/Glob_and_NL_02.pdf",
    "https://academic.oup.com/book/36150/chapter/314419453/chapter-pdf/57811866/oso-9780198854289-chapter-5.pdf",
    "https://academic.oup.com/ser/article/6/4/703/1739555",
    "https://accounts.google.com/SignOutOptions?hl=zh-CN&continue=https://gemini.google.com/%3Fis_sa%3D1%26is_sa%3D1%26android-min-version%3D301356232%26ios-min-version%3D322.0%26campaign_id%3Dbkws%26utm_source%3Dsem%26utm_source%3Dgoogle%26utm_medium%3Dpaid-media%26utm_medium%3Dcpc%26utm_campaign%3Dbkws%26utm_campaign%3D2024enAU_gemfeb%26pt%3D9008%26mt%3D8%26ct%3Dp-growth-sem-bkws%26gclsrc%3Daw.ds%26gad_source%3D1%26gad_campaignid%3D22437964261%26gbraid%3D0AAAAApk5BhmTIKeu82GeBI85qNScnwP3m%26gclid%3DCjwKCAjwkvbEBhApEiwAKUz6-ybVgRKghbvMe_m6J9HfhKccGbx5pv_fQCiPXewPYkQWthYXErb2txoClPAQAvD_BwE&ec=GBRAkgU",
    "https://alternateroutes.ca/index.php/ar/article/download/15857/15760",
    "https://blogs.lse.ac.uk/businessreview/2019/02/02/the-2008-crisis-failed-to-displace-neoliberalisms-core-principles",
    "https://blogs.lse.ac.uk/internationaldevelopment/2024/03/28/neoliberal-conditions-global-institutions-impact-on-developing-nations",
    "https://cas.au.dk/cpg/research-themes/global-governance-beyond-neoliberalism",
    "https://en.wikipedia.org/wiki/Chicago_school_of_economics",
    "https://en.wikipedia.org/wiki/Neoliberalism",
    "https://en.wikipedia.org/wiki/Neoliberalism#:~:text=Neoliberalism%20is%20often%20associated%20with,and%20reductions%20in%20government%20spending.",
    "https://en.wikipedia.org/wiki/Neoliberalism#:~:text=Neoliberalism%20originated%20among%20European%20liberal,liberal%20desire%20to%20control%20markets.",
    "https://en.wikipedia.org/wiki/Ordoliberalism",
    "https://explaininghistory.org/2025/05/27/the-intellectual-origins-of-neoliberalism-from-hayek-to-friedman-and-beyond",
    "https://explaininghistory.org/2025/05/27/what-is-neoliberalism-a-guide-to-the-ideology-behind-modern-capitalism",
    "https://files.persagen.com/01/Mont_Pelerin_Society-History_of_MPS-2014.pdf",
    "https://fpif.org/from_keynesianism_to_neoliberalism_shifting_paradigms_in_economics",
    "https://harvardpress.typepad.com/hup_publicity/2018/03/making-sense-of-neoliberalism-quinn-slobodian.html",
    "https://illuminem.com/illuminemvoices/the-neoliberal-paradox",
    "https://journals.openedition.org/regulation/7729",
    "https://library.fiveable.me/anthropology-of-globalization/unit-4/neoliberalism-structural-adjustment/study-guide/Oea32UZYWlrXcYCg#:~:text=Neoliberalism%20and%20structural%20adjustment%20programs,impacts%20were%20huge%20but%20controversial.",
    "https://marxismocritico.com/wp-content/uploads/2011/10/alfredo-saad-filho-marxian-and-keynesian-critiques-of-neoliberalism.pdf",
    "https://myactivity.google.com/product/gemini?utm_source=gemini",
    "https://oxfordre.com/education/display/10.1093/acrefore/9780190264093.001.0001/acrefore-9780190264093-e-721?p=emailAM6.eWybpaevQ&d=/10.1093/acrefore/9780190264093.001.0001/acrefore-9780190264093-e-721",
    "https://oxfordre.com/latinamericanhistory/display/10.1093/acrefore/9780199366439.001.0001/acrefore-9780199366439-e-99?d=%2F10.1093%2Facrefore%2F9780199366439.001.0001%2Facrefore-9780199366439-e-99&p=emailAMBg1md3l8Y0k",
    "https://oxfordre.com/latinamericanhistory/display/10.1093/acrefore/9780199366439.001.0001/acrefore-9780199366439-e-99?d=/10.1093/acrefore/9780199366439.001.0001/acrefore-9780199366439-e-99&p=emailAMBg1md3l8Y0k",
    "https://pmc.ncbi.nlm.nih.gov/articles/PMC5732618",
    "https://pmc.ncbi.nlm.nih.gov/articles/PMC6586979",
    "https://pmc.ncbi.nlm.nih.gov/articles/PMC9605858",
    "https://policies.google.com/terms",
    "https://rooseveltinstitute.org/publications/the-cultural-contradictions-of-neoliberalism",
    "https://rooseveltinstitute.org/think-tank",
    "https://rooseveltinstitute.org/wp-content/uploads/2020/07/RI_The-Empirical-Failures-of-Neoliberalism_brief-202001.pdf",
    "https://support.google.com/bard/answer/13594961",
    "https://support.google.com/gemini/answer/13594961#location&zippy=%2Cwhat-location-information-do-gemini-apps-collect-why-and-how-is-it-used",
    "https://thecic.org/neoliberalism-past-present-future",
    "https://www.adamsmith.org/blog/scaling-the-heights-a-history-of-the-mont-pelerin-society",
    "https://www.britannica.com/money/neoliberalism",
    "https://www.cambridge.org/core/books/austerity-welfare-and-work/introduction-the-crisis-and-austerity-neoliberalism/092DCCC59DC2C7E546D45BC7FBD4B7CF",
    "https://www.cambridge.org/core/books/making-thatchers-britain/thinktank-archipelago-thatcherism-and-neoliberalism/DC977778240D47DAB1B1711476EFE4E8",
    "https://www.cambridge.org/core/journals/economics-and-philosophy/article/brief-history-of-neoliberalism-david-harvey-oxford-university-press-2005-vii-247-pages/FE172126138782F93B68C59406221862",
    "https://www.cambridge.org/core/journals/historical-journal/article/at-the-origins-of-neoliberalism-the-free-economy-and-the-strong-state-19301947/B476470A93CC147E8EC8AC2EFE550062",
    "https://www.dissentmagazine.org/article/uses-and-abuses-neoliberalism-debate",
    "https://www.downsizinggovernment.org/privatization",
    "https://www.economicshelp.org/blog/20688/concepts/neoliberalism",
    "https://www.econstor.eu/bitstream/10419/196158/1/oek36.pdf",
    "https://www.frontiersin.org/journals/psychology/articles/10.3389/fpsyg.2021.694270/full",
    "https://www.humanrestorationproject.org/writing/the-silent-crisis-humanities-pedagogy-and-neoliberalism",
    "https://www.investopedia.com/terms/n/neoliberalism.asp",
    "https://www.journals.uchicago.edu/doi/full/10.1086/710311",
    "https://www.law.nyu.edu/sites/default/files/Beyond%20Neoliberalism%20by%20Larry%20Kramer.pdf",
    "https://www.lse.ac.uk/ideas/Assets/Documents/updates/LSE-IDEAS-Understanding-Global-Rise-of-Populism.pdf",
    "https://www.mdpi.com/2075-4698/7/4/33",
    "https://www.mjemcgill.com/journals/deconstructing-neoliberalism-the-role-of-the-chicago-school-in-the-development-of-neoliberalism-and-its-propagation-in-the-economies-of-chile-and-argentinanbspnbsp",
    "https://www.mytutor.co.uk/answers/56225/A-Level/Government-and-Politics/What-are-the-main-differences-between-Classical-Liberalism-and-Neo-Liberalism",
    "https://www.numberanalytics.com/blog/neoliberalism-labor-politics-guide",
    "https://www.numberanalytics.com/blog/neoliberalism-labor-race-class",
    "https://www.numberanalytics.com/blog/ultimate-guide-neoliberalism-social-theory",
    "https://www.reddit.com/r/CriticalTheory/comments/1b5hl3m/difference_between_liberalism_and_neoliberalism",
    "https://www.researchgate.net/profile/Ronaldo-Munck/publication/314464865_Neoliberalism_and_Politics_and_the_Politics_of_Neoliberalism_Ronaldo_Munck/links/58c4226ba6fdcce648e4f12c/Neoliberalism-and-Politics-and-the-Politics-of-Neoliberalism-Ronaldo-Munck.pdf",
    "https://www.routledge.com/Populism-and-Neoliberalism/Cayla/p/book/9780367427702",
    "https://www.transformingsociety.co.uk/2019/10/28/explaining-the-neoliberal-turn",
    "https://www.wider.unu.edu/publication/chile-under-neoliberalism",
    "https://www.wzb.eu/en/node/51673"
  ]
}