{
  "query": "Analyze the monster, elite, and boss system of 'Diablo' to uncover why it can continuously attract players to grind and maintain high engagement. Dive into the mysteries behind it, specifically researching aspects such as the types, quantity, categories, stats, loot, and skills of the monsters, and provide comprehensive data to guide independent game developers in designing game systems.",
  "chain_of_research": {
    "plan_1": {
      "title": "Research Approach\nInitial Focus: Design Philosophy and Normal Monsters\nNext Steps",
      "description": "I'm starting a comprehensive analysis of the monster, elite, and boss systems in the Diablo series. My goal is to understand how these systems contribute to player engagement and retention, providing insights for game developers. I'll be looking into monster types, quantities, categories, stats, loot, skills, difficulty scaling, and replayability. I'll prioritize official wikis, game design articles, and reputable gaming news sites.\nMy initial research will focus on two key areas. First, I'll investigate Blizzard's overarching design philosophy for Diablo's monster system, particularly how it supports the core gameplay loop of killing monsters, acquiring loot, and character progression. Second, I'll delve into the characteristics of normal monsters, examining their types, distribution, quantity, and behaviors across different Diablo titles. I'll also explore how their sheer numbers contribute to the game's 'grind' and overall feel.\nWhile focusing on these initial points, I'll also gather broader information about Diablo's monster system that will be relevant for later stages of the research, such as details on elite monsters, bosses, loot mechanics, and how difficulty scales to maintain replayability. This will involve consulting official game guides, developer insights, and detailed fan wikis."
    },
    "search_1": [
      "https://www.ign.com/wikis/diablo-4/Loot_Tiers_and_Rarity_Guide",
      "https://diablo2.diablowiki.net/D1_Diablo_(monster",
      "https://gamedesignskills.com/game-design/core-loops-in-gameplay",
      "https://maxroll.gg/d4/wiki/uniques",
      "https://us.forums.blizzard.com/en/d4/t/a-detailed-response-for-blizzards-current-state-of-the-game/225404",
      "https://www.eurogamer.net/diablo-2-leveling-guide-power-level-exp-scaling-8017",
      "https://www.reddit.com/r/diablo4/comments/1k23x9s/diablo_4_designer_says_its_absolutely_critical",
      "https://us.forums.blizzard.com/en/d4/t/the-gameplay-loop/141268",
      "https://gamedesignskills.com/game-design/game-boss-design",
      "https://blizzardwatch.com/2015/07/11/combat-elite-monster-affixes-diablo-3",
      "https://www.youtube.com/watch?v=mYmKpZVlFQg",
      "https://www.ign.com/wikis/diablo-3/Monster_Affixes",
      "https://www.youtube.com/watch?v=pD4NaGmPfJM",
      "https://www.ign.com/articles/2012/03/26/diablo-iii-designing-a-demon",
      "https://maxroll.gg/d4/resources/experience",
      "https://maxroll.gg/d4/resources/monster-families",
      "https://www.diablowiki.net/Monster",
      "https://www.reddit.com/r/Diablo/comments/tuhcc/whats_the_difference_between_champion_rare_and",
      "https://diablo2.diablowiki.net/Monsters",
      "https://diablo2.diablowiki.net/Archives:_Monsters"
    ],
    "observation_1": "I've started to uncover the core reasons behind Diablo's player retention, which largely revolves around an 'endless grind' and the pursuit of rare items. This design creates a strong sense of accomplishment when players succeed in obtaining difficult-to-get upgrades or perfect items. The long-term goals associated with this grind keep players engaged, especially those who enjoy optimizing their characters. However, I've also noted a tension in the design, as some players find the randomness and potential for failure to be punishing and disrespectful of their time, leading to frustration and burnout. The core gameplay loop across Diablo titles consistently involves farming bosses, acquiring loot, and using that loot to tackle tougher challenges, a cycle that has been present since Diablo 2.",
    "plan_2": {
      "title": "Monster Variety and Progression\nElite and Boss Mechanics\nNext Steps in Research",
      "description": "I'm gaining a clearer picture of how different monster types contribute to the gameplay experience. In Diablo 1 and 2, monsters are broadly categorized as Animals, Demons, or Undead, with specific stats and behaviors for unique monsters like Diablo. Diablo 3 introduced functional classifications like 'Swarmer,' 'Ranged,' 'Lieutenant,' and 'Elite,' designed to encourage cooperative combat strategies. Diablo 4 further refines this with 'Monster Families' such as Bandits, Cannibals, Cultists, and Demons, each with distinct members, locations, and basic attack patterns. Experience scaling is also a key element, with monsters near a character's level providing optimal experience, and penalties applied for significant level differences. Multiplayer also scales monster health and experience.\nI've found extensive details on elite monster affixes in Diablo 3, which are special mechanics that significantly alter combat. These affixes, such as 'Molten,' 'Plagued,' 'Avenger,' and 'Shielding,' scale in quantity with player level, forcing players to adapt their strategies. For major boss encounters, the design principles emphasize creating challenging, climactic battles that test player skills and offer meaningful rewards. These rewards often include highly sought-after Unique and Mythic Unique items, which can be target-farmed from specific endgame bosses in Diablo 4, and even crafted, providing clear progression goals.\nMy next steps involve diving deeper into the specifics of each point. I'll be browsing the identified sources to extract more concrete examples of monster behaviors, elite affixes, and boss mechanics. I also need to conduct new searches to gather more specific data on how monster stats (health, damage, resistances) scale with difficulty across the series, and to understand how randomized monster compositions and procedural generation contribute to replayability and prevent monotony in Diablo games."
    },
    "search_2": [
      "https://gamedesignskills.com/game-design/core-loops-in-gameplay",
      "https://gamedesignskills.com/game-design/game-boss-design",
      "https://us.forums.blizzard.com/en/d4/t/a-detailed-response-for-blizzards-current-state-of-the-game/225404",
      "https://www.ign.com/wikis/diablo-3/Monster_Affixes",
      "https://blizzardwatch.com/2015/07/11/combat-elite-monster-affixes-diablo-3",
      "https://diablo2.diablowiki.net/Monsters",
      "https://www.diablowiki.net/Monster",
      "https://maxroll.gg/d4/resources/monster-families",
      "https://en.wikipedia.org/wiki/Diablo_IV",
      "https://www.reddit.com/r/Diablo/comments/13yhjvu/d4_is_the_first_game_in_the_franchise_that",
      "https://www.diablowiki.net/Difficulty",
      "https://www.reddit.com/r/diablo4/comments/1m1b6v3/what_are_the_exact_enemy_health_and_damage",
      "https://gaming.stackexchange.com/questions/66348/how-do-the-different-difficulty-levels-affect-the-gameplay",
      "https://diablo2.diablowiki.net/Difficulty",
      "https://classic.battle.net/diablo2exp/basics/resistances.shtml",
      "http://classic.battle.net/diablo2exp/monsters/basics.shtml",
      "https://www.cis.upenn.edu/~cis110/11fa/hw/hw06/index.html",
      "http://thegamedesignforum.com/features/RD_D2_5.html",
      "https://www.reddit.com/r/Diablo/comments/xcp7vz/how_random_is_diablo_3",
      "https://us.forums.blizzard.com/en/d3/t/procedural-generation-one-overlooked-drawback-of-shared-zones/6373",
      "https://www.diablowiki.net/Randomization",
      "https://www.mdpi.com/2073-431X/13/11/304",
      "https://www.ign.com/wikis/diablo-4/Diablo_4_2.3.0_Patch_Notes",
      "https://www.purediablo.com/diablo4/Difficulties",
      "https://www.youtube.com/watch?v=mYmKpZVlFQg",
      "https://www.ign.com/wikis/diablo-4/Loot_Tiers_and_Rarity_Guide",
      "https://maxroll.gg/d4/wiki/uniques"
    ],
    "observation_2": "I'm synthesizing the information on Diablo's design philosophy, particularly the 'endless grind' and 'power fantasy.' While I have a good grasp of community discussions around these concepts, I need to find more explicit statements from Blizzard or developers to fully articulate their stated design goals for player retention through the monster system. This will help me provide a more authoritative perspective on how the monster system is intended to keep players engaged over time.",
    "plan_3": {
      "title": "Deepening Monster Analysis\nEnhancing Boss and Loot Details\nNext Research Steps",
      "description": "I'm now focusing on how the sheer quantity and varied behaviors of normal monsters contribute to the foundational 'grind' experience. I have detailed classifications for monsters across Diablo 2, 3, and 4, including their types, distribution, and how they cooperate. For elite monsters, I have extensive information on Diablo 3's affixes and their scaling. My next step is to confirm the consistency of these elite affixes across all Diablo titles and to explicitly detail how these elements create dynamic combat encounters and serve as mini-challenges that reward players.\nFor major boss encounters, I've gathered general design principles, but I need to delve into more specific details about distinct phases, attack patterns, and the lore significance of iconic bosses like Diablo, Baal, Mephisto, Malthael, and Lilith across the series. This will allow me to evaluate how these climactic battles drive player progression and engagement. Regarding loot, I have a good understanding of Diablo 4's rarity and tier system, including Unique and Mythic Unique drops. I'll now focus on obtaining more specific information on drop rates, the role of set bonuses (especially prominent in Diablo 2 and 3), and how the synergy between monster killing and loot acquisition motivates players.\nTo fill the remaining gaps, I will conduct targeted searches for official Blizzard statements on design philosophy, browse wikis for specific normal monster behaviors in Diablo 2 and 3, and research elite affixes in Diablo 2 and 4 for consistency. I'll also look for detailed mechanics of major bosses and information on set items and general drop rates across the series. Finally, I will synthesize the existing data on difficulty scaling and procedural generation to clearly explain how they contribute to continuous challenge, power fantasy, and replayability."
    },
    "search_3": [
      "https://www.youtube.com/watch?v=86uCKw0KLfc",
      "https://www.eurogamer.net/diablo-2-leveling-guide-power-level-exp-scaling-8017",
      "https://maxroll.gg/d3/resources/experience-explained",
      "https://www.gameaccessibilitynexus.com/blog/2025/06/25/diablo-iv-anniversary-interview-with-drew-mccrory",
      "https://www.youtube.com/watch?v=SDgwu9QVj4A",
      "https://www.poecurrency.com",
      "https://gaming.stackexchange.com/questions/68670/how-many-xp-do-i-get-by-killing-monsters",
      "https://www.pcgamesn.com/diablo-4/lilith",
      "https://eu.forums.blizzard.com/en/d4/t/uber-lilith-mechanics/8262",
      "https://www.ign.com/wikis/diablo-3/Malthael",
      "https://www.eurogamer.net/diablo-3-ultimate-evil-guide?page=13",
      "https://diablo2.diablowiki.net/Mephisto",
      "https://www.diablowiki.net/Mephisto",
      "https://diablo2.diablowiki.net/Baal",
      "https://www.diablowiki.net/Baal",
      "https://www.reddit.com/r/Diablo/comments/53ipm2/whats_the_story_behind_diablo_1",
      "https://mobalytics.gg/diablo-4/guides/gear-affixes-full-list",
      "https://en.wikipedia.org/wiki/Diablo_(series",
      "https://maxroll.gg/d4/resources/elites-affixes",
      "https://www.youtube.com/watch?v=xRPAUKsEpu0",
      "https://www.youtube.com/watch?v=odG5gb8amWk",
      "https://www.diablowiki.net/Boss_Modifiers"
    ],
    "observation_3": "I'm synthesizing the overarching design philosophy of Diablo, particularly how the 'endless grind' and the pursuit of power contribute to player retention. I've found that the tension between rewarding rarity and respecting player time is a recurring theme, with some players valuing the sense of accomplishment from hard-won items, while others find the randomness frustrating. Blizzard's approach seems to balance high-end grinds with upgrade risks, aiming for long-term engagement through distant goals and min-maxing opportunities. The core gameplay loop consistently involves farming, acquiring loot, and using it to tackle tougher challenges, a cycle that has been central since Diablo 2.",
    "plan_4": {
      "title": "Monster System Contributions\nBoss Encounters and Loot\nNext Steps: Set Items and Deeper Mechanics",
      "description": "I'm now able to articulate how the sheer quantity and varied behaviors of normal monsters contribute to the foundational 'grind' experience. Across Diablo titles, monsters are designed with diverse attack patterns and roles (e.g., swarmers, ranged, resurrecting, leaping, exploding), ensuring dynamic encounters. Elite monsters, identified by their unique names and colors, possess 'affixes' that significantly alter combat, scaling in number with player level. These affixes, such as 'Molten,' 'Frozen,' 'Teleporter,' 'Avenger,' and 'Waller,' create mini-challenges within regular gameplay, forcing players to adapt their strategies. This system of varied monster types and challenging elites is crucial for preventing monotony and maintaining engagement during the grind.\nFor major boss encounters, I'm gathering details on their distinct phases, attack patterns, and lore significance, which are designed to be climactic tests of player skill. The rewards from these bosses, particularly Unique and Mythic Unique items in Diablo 4, are highly sought after and can be target-farmed, providing clear progression goals. I've noted that Mythic Uniques in Diablo 4 have a low drop chance from tormented bosses but can drop multiple at once, and can also be crafted, offering alternative paths to acquisition. This synergy between challenging monster encounters and desirable loot is a key driver of player motivation.\nTo further enrich my understanding, I will now focus on researching the specifics of set items and their bonuses across Diablo 2, 3, and 4, as these are crucial for endgame progression and build diversity. I will also continue to consolidate information on how monster stats, resistances, and experience scale with difficulty and player count across the series. This will allow me to fully explain how the monster system ensures continuous challenge while maintaining a satisfying power fantasy and contributing to the game's high replayability through randomized elements."
    },
    "search_4": [
      "https://us.forums.blizzard.com/en/d4/t/no-set-items-is-killing-the-diablo-4/67109",
      "https://us.forums.blizzard.com/en/d4/t/message-to-devs-very-simple-advise-to-never-miss-the-mark-again/227072",
      "https://us.forums.blizzard.com/en/d4/t/a-detailed-response-for-blizzards-current-state-of-the-game/225404",
      "https://us.forums.blizzard.com/en/d4/t/game-operation-and-mechanics/216914",
      "https://maxroll.gg/d2/items/sets",
      "https://www.ign.com/wikis/diablo-3/Craftable_Set_Items",
      "https://us.forums.blizzard.com/en/d4/t/%F0%9F%93%88-player-retention-theory/225029",
      "https://d2runewizard.com/sets",
      "https://www.icy-veins.com/forums/topic/36274-multiple-set-bonuses",
      "https://en.wikipedia.org/wiki/Diablo_(series",
      "https://www.ign.com/wikis/diablo-3/Malthael",
      "https://www.pcgamesn.com/diablo-4/lilith",
      "https://diablo2.diablowiki.net/Mephisto",
      "https://diablo2.diablowiki.net/Baal",
      "https://m.youtube.com/watch?v=_Ow0e9zGN9s",
      "https://www.furiouspaul.com/pc/diablo1"
    ],
    "observation_4": "I've gained a clearer understanding of the original Diablo's boss design, specifically for the final boss, Diablo. Unlike later iterations, Diablo 1's boss encounters were simpler, focusing more on raw stats, elemental resistances, and general combat rather than complex multi-phase mechanics. For instance, the Hellfire expansion's boss, Na-Krul, was designed as a solo, spell-less equivalent to Diablo, further highlighting the less intricate boss design of the first game. This contrasts with the more elaborate, multi-phase boss battles seen in subsequent Diablo titles.",
    "plan_5": {
      "title": "Comprehensive System Understanding\nNext Steps: Synthesizing for Developers",
      "description": "I've now gathered comprehensive information across all requested aspects of Diablo's monster, elite, and boss systems. This includes the overarching design philosophy centered on the 'endless grind' and 'power fantasy,' the diverse types and behaviors of normal monsters, the dynamic combat introduced by elite monster affixes, and the progression-driving mechanics of major boss encounters. I also have detailed data on loot generation, including rarity, tiers, unique and mythic unique items, and the role of target farming and crafting. Furthermore, I've covered how difficulty scaling, monster stats, and resistances contribute to maintaining challenge and player engagement, alongside the importance of randomized elements for replayability.\nWith all the necessary information at hand, I am now ready to synthesize a comprehensive report. This report will detail the intricacies of Diablo's monster system and provide actionable insights for independent game developers, guiding them in designing engaging and retention-focused game systems based on the successful elements observed in the Diablo series."
    }
  },
  "final_report": "# **The Perpetual Grind: Deconstructing Diablo's Monster, Elite, and Boss Systems for Player Engagement**\n\n## **Executive Summary: The Pillars of Perpetual Play**\n\nThis report deconstructs the enduring appeal of the 'Diablo' series' monster, elite, and boss systems, identifying the core design principles that foster continuous player engagement and a satisfying grind. By analyzing monster variety, density, difficulty scaling, elite affixes, and boss mechanics alongside their integrated loot systems, this analysis uncovers how Blizzard cultivates a powerful \"kill-loot-grow\" loop. Key takeaways for independent developers include the strategic use of procedural generation, the importance of balancing deterministic and random rewards, and the necessity of iterative design to maintain a challenging yet fair player experience.\n\n## **1. Introduction: The Enduring Allure of Sanctuary's Grind**\n\nThe 'Diablo' franchise stands as a titan in the Action RPG genre, renowned for its addictive gameplay loop and remarkable player retention. At its heart lies a meticulously crafted ecosystem of enemies – from the swarming hordes to the formidable bosses – each designed to fuel a cycle of combat, reward, and character progression. This report aims to dissect these systems, providing independent game developers with actionable guidance into the psychological underpinnings that drive players to repeatedly engage with Sanctuary's dark, monster-filled world. The term \"grind\" in this context refers not to mindless repetition, but to a purposeful, often satisfying, pursuit of power and reward within a game's core loop.\n\n## **2. The Core Gameplay Loop: Fueling the Cycle of Conquest and Reward**\n\nDiablo's success is rooted in its fundamental \"kill-loot-grow-repeat\" loop, a cyclical progression that keeps players engaged for thousands of hours. This loop is not monolithic but composed of nested sub-loops operating on different timescales, from moment-to-moment combat decisions to long-term seasonal goals.\n\n### **Deconstructing Diablo's Fundamental Loop**\n\nThe core gameplay loop is a repeatable sequence of player actions that forms the primary flow of their experience, designed to keep them playing.1 In Diablo, this translates to actions such as \"Explore Areas -> Complete Dungeons -> Gain Levels & Wealth -> Visit Shops\".1 These loops nest into each other, spiraling outward in increasing layers of nuance and complexity. Examples include moment-to-moment actions like \"Spot Resource -> Face Enemy -> Evade Attack -> Defeat Enemy -> Collect Resource,\" which then feed into minute-to-minute loops like \"Complete quests -> Craft best gear -> Adjust spells / talents -> Sell extra resources,\" and eventually day-to-day and big-picture goals like \"Travel new zones -> Set new goals -> Make new friends -> Plan for raids -> Complete PvP\".1\n\nDiablo 4's current loop involves activities such as \"doing vampire stuff to get Varshan stuff,\" \"farming helltides for steel,\" \"killing bosses (Duriel, Drivel),\" and \"leveling up glyphs in NM dungeons\".2 This structure is noted to be similar to Diablo 2 and Diablo 3, where players \"farm bosses, get loot, use said loot on tougher bosses, rinse repeat\".2 The ultimate endgame goal for many players, especially in seasonal play, is to maximize efficiency, often described as \"one click deleting screens\" to achieve \"more in game currency per hour\".3 This pursuit of efficiency itself becomes a skill and a driver of engagement. The fundamental \"kill-loot-grow\" cycle in Diablo has subtly evolved beyond mere progression to incorporate a significant meta-game of efficiency maximization. Players, particularly in seasonal contexts, are driven not just by the power fantasy of defeating enemies, but by the strategic challenge of optimizing their time-to-kill (TTK) and resource acquisition per hour. This \"one-click deleting screens\" mentality transforms the grind from a simple repetitive task into an engaging, skill-based pursuit of optimal performance within the game's systems. This adds a layer of intellectual engagement to the physical act of playing.\n\n### **The Role of Procedural Generation in Maintaining Replayability and Freshness**\n\nRandomization is a cornerstone feature of Diablo games, applied to most maps to create a distinct experience with every new game.4 This procedural content generation (PCG) is vital for enhancing replayability by ensuring each gameplay experience is unique.5\n\nIn Diablo I and II, the appeal stemmed from both levels and loot being procedurally generated, contributing to immense replay value.6 Diablo 2's loot generation algorithm, for instance, involves randomly picking a monster, determining its treasure class, generating a base item, and then adding random affixes.6 Monster spawns also vary in groups, amounts, and composition, though limited by map type.4\n\nDiablo III continued this tradition, with random elements in crafted items, map tiles, and event occurrences.4 While some outdoor areas were static, dungeons were randomly generated using tile sets.7 The game's replayability was heavily attributed to its scaling difficulty, loot system, seasonal themes, and diverse character classes.8\n\nDiablo IV incorporates procedurally generated dungeons (both interior and exterior environments) and a loot-focused character-building system, alongside its open world.9 However, Diablo IV has faced criticism for eschewing random\n\n*overworld* maps, with some players finding its dungeons \"almost totally linear\" and feeling that this reduces replayability compared to Diablo I and II's more varied map generation.10 The \"feeling\" of randomness can be subjective.4\n\nWhile procedural generation is a foundational element for replayability in Diablo 4, its implementation and\n\n*perceived effectiveness* have varied significantly across titles. The shift from largely procedural overworlds in Diablo I and II to static overworlds with procedural dungeons in Diablo III and IV 7 reveals a design trade-off between \"endless freshness\" and a \"more believable\" or consistent world.7 This highlights that the\n\n*type* and *scope* of procedural generation directly influence player perception of replayability and can lead to friction if player expectations, shaped by earlier titles, are not met. Independent developers must carefully consider whether their PCG aims for truly unique playthroughs or merely varied combat arenas.\n\n**Table 1: Diablo Series Core Gameplay Loop Elements & Randomization**\n\n| Game Title | Core Loop Emphasis | Overworld Map Randomization | Dungeon Layout Randomization | Monster Spawns Randomization | Loot Generation Randomization |\n| --- | --- | --- | --- | --- | --- |\n| Diablo I | Simple Dungeon Crawl | Yes (full map) | Yes (full map) | Yes (groups, amounts) | Yes (drop rate, modifiers, quality) |\n| Diablo II | Act-based Progression & Item Runs | Yes (full map per new character) | Yes (full map) | Yes (groups, amounts, composition) | Yes (treasure class, base item, affixes) |\n| Diablo III | Seasonal Grind & Rifts | No (static zones) | Yes (tile-based, hundreds of layouts) | Yes (groups, amounts, composition, affixes) | Yes (drop rate, modifiers, quality, smart loot) |\n| Diablo IV | Open World & Endgame Boss Ladder | No (static open world) | Yes (random layouts, interior/exterior) | Yes (families, archetypes, synergies) | Yes (rarity, fixed/random stats, imprints) |\n\n## **3. The Monster System: The Engine of Endless Grinding**\n\nThe foundational element of Diablo's grind is its diverse and dynamically scaling monster system. Monsters are not merely obstacles but carefully designed components that drive combat flow, progression, and reward.\n\n### **3.1. Monster Types and Categories: Diversity in Destruction**\n\nEarly Diablo titles, like Diablo I, featured \"special monsters\" such as The Butcher, The Skeleton King, and Diablo, whose stats and behaviors were unique and not borrowed or modified from other monsters.11 Diablo I also had basic classifications for monsters, though less explicitly detailed in the provided snippets.\n\nDiablo II categorized all monsters into three broad classifications: Animals, Demons, or Undead.12 These classifications could influence gameplay, for instance, Undead monsters taking 150% damage from blunt weapons.12 Within these, monsters were further distinguished by color: White for Standard, Blue for Champion, and Gold for Unique or Boss.12 The game featured a wide array of monster names distributed across Acts, such as \"Bleeder,\" \"Doom Ape,\" and \"Gorebelly\".13\n\nDiablo III shifted its classification system from thematic types to functional roles based on combat behavior and AI.14 These categories include:\n\n* **Swarmer:** Weak, typically melee, designed as \"health walls\" for players to kill and gather health orbs.14\n* **Ranged:** Dangerous, can attack all at once, and may employ evasive movement AI.14\n* **Lieutenant:** Higher-level monsters that can cast spells, buff, or spawn others, serving as high-priority targets.14\n* **Elite:** Tough, with stronger attacks, designed to make the player pause and think.14 These are sub-categorized into \"Champions\" (blue-named, travel in packs) and \"Rare\" (yellow-named, may or may not have minions).15\n* **AOE (Area of Effect):** \"Area of Denial\" characters that change the \"game space\" by creating hazardous zones.14\n* **Weakener:** Debuff, slow, or drain players, making other monsters more threatening.14\n* **One-offs:** Monsters with unique, cool abilities.14\n\nDiablo IV further refines this with \"Monster Families,\" each defined by a theme, combat style, and location, containing different archetypes with synergistic abilities.9 Examples include:\n\n* **Bandits:** Scrapper, Throat-splitter, Marksman, Arsonist; known for ambushes.16\n* **Cannibals:** Melee types, Gorger (knockdown), Swarmers (fast hordes); no ranged.16\n* **Cultists:** Mother Disciples (fireballs), Mother Chosen (dagger), Mother Heralds (summon minions, ignore players during rituals).16\n* **Demons:** The largest family with various archetypes like Annihilator, Balrog, Succubus, Hellion.16\n* **Fallen:** Overseers, regular Fallen, Lunatics (explode), Shamans (resurrect Fallen).16\n\nA core design principle across the series is that monster visual design should match the challenge they represent.17 Features like exaggerated claws and fangs reflect their characteristics (e.g., poison, bleeding).17 For regular monsters, players primarily remember attack patterns, sound effects, and death animations rather than intricate visual details due to the fast-paced combat.18\n\nThe evolution from Diablo II's broad, lore-based monster classifications (Animals, Demons, Undead 12) to Diablo III and IV's functional archetypes (Swarmer, Ranged, Lieutenant, Elite, AOE, Weakener 14) represents a significant design maturation. This shift indicates a deliberate move towards engineering combat encounters by defining how each monster type contributes mechanically to the overall fight, rather than just its thematic origin. This allows for more dynamic, predictable (in terms of role), and strategically engaging combat scenarios, crucial for maintaining flow and challenge in high-speed ARPG gameplay. Furthermore, beyond purely aesthetic appeal, monster visual design (size, color, exaggerated features like fangs/claws 17) serves as a critical, almost subconscious,\n\n*gameplay cue*. In the fast-paced, high-density combat of Diablo, players have only a \"second or so\" to process monster information.18 Therefore, distinct silhouettes, color coding 12, and exaggerated characteristics 17 immediately communicate threat level, attack type (e.g., poison, bleeding), and functional role, enabling rapid threat assessment and tactical decision-making without breaking combat flow. This efficiency in visual communication is paramount for engagement.\n\n### **3.2. Quantity and Density: The Thrill of the Horde**\n\nMonster quantity and density are crucial for the satisfying flow of combat and efficient grinding in Diablo. In Diablo II, multiplayer games significantly increased monster hit points and experience value.12 Specifically, monster hit points were multiplied by\n\n(Number of Players + 1) / 2, and experience increased proportionally (e.g., 150% for 2 players, up to 450% for 8 players).12 This encourages group play for faster progression.\n\nIn Diablo IV, monster density, along with time-to-kill (TTK), is a primary factor for efficient experience and \"Favor\" (Season Pass currency) farming.21 Players are advised to prioritize high-density activities like Helltides and Infernal Hordes.21 Elites in Diablo IV give a fixed amount of XP that scales with difficulty, and their minions and Champion monsters provide 60% of an Elite's XP, making large packs highly valuable targets.22 Party bonuses in Diablo IV further boost XP: 5% if another player is nearby, or 10% if they're in your party. Crucially, base XP gained from monster kills is obtained by every party member individually at full value, regardless of contribution, and all XP bonuses stack multiplicatively.22\n\nMonster quantity and density are not merely environmental fillers but a primary driver of player satisfaction and progression efficiency.21 High density enables the exhilarating \"screen-clearing\" power fantasy 3 inherent to ARPGs, where players feel immensely powerful as they mow down hordes of enemies. This directly optimizes XP and currency gain, reinforcing the core grind loop. The design challenge lies in balancing this density to provide satisfying combat without overwhelming system performance or trivializing individual monster encounters. The implementation of multiplayer scaling, particularly in Diablo IV 22, where each party member receives full base XP from kills\n\n*plus* stacking party bonuses, creates an exponential efficiency gain for group play. While this encourages social interaction and cooperative synergy, it can inadvertently create a \"meta\" where solo play at higher tiers feels significantly less efficient for grinding.22 This can alienate players who prefer a solo experience, highlighting a tension between incentivizing group play and respecting diverse playstyles.\n\n### **3.3. Monster Stats and Difficulty Scaling: The Ever-Present Challenge**\n\nDifficulty scaling is a primary mechanism for maintaining challenge and driving player progression across the Diablo series.\n\nIn **Diablo I**, monster stats like Hit Points, Armor Class (AC), To/Hit, and Damage increased significantly across Normal, Nightmare, and Hell difficulties.11 Notably, Diablo I monsters had no physical resistance or immunity.11\n\n**Diablo II** features Normal, Nightmare, and Hell difficulties, with monsters gaining increased hit points, damage, resistances, and improved skills (+3 levels in Nightmare, +7 in Hell).20 Players also suffer resistance penalties in higher difficulties (-40% in Nightmare, -100% in Hell).23 Immunities (100% resistance to a damage type) become more common in Nightmare and Hell, forcing players to diversify damage types or \"break\" immunities with specific skills.12 Monsters regenerate health, with faster rates on higher difficulties, making \"Prevent Monster Heal\" important.20 Experience gain is maximized when character and monster levels are within five levels of each other, with significant penalties outside this range.12\n\n**Diablo III** monsters scale their level to match the highest character in the game.25 Difficulty levels (Normal to Torment VI, and beyond) dramatically increase monster health and damage (e.g., Torment VI monsters have 8590% health and 2540% damage compared to Normal).25 Each difficulty level typically increases monster HP by 60% and damage by 45% over the previous one.25 Higher difficulties also boost XP and gold rewards, and increase legendary item drop rates.25 Multiplayer increases monster HP, but monster damage no longer scales with additional players as of patch 1.0.3.26\n\n**Diablo IV** employs Standard Difficulties (Normal, Hard, Expert, Penitent) and Torment Difficulties (Torment 1-4, extending up to Torment XV for the Pit).27 Torment difficulties introduce player handicaps, such as reduced Armor and All Resistances (e.g., Torment 4 applies -1000 Armor and -100% to all resistances).27 Monster health increases exponentially in high Pit levels, while monster damage tends to plateau.28 XP bonuses also scale significantly with difficulty (e.g., Torment 4 offers +600% XP bonus, Torment XV offers +13400% XP bonus).22 Exact monster health and damage numbers are not explicitly displayed in Diablo IV, leading to player speculation and \"vibe\" based gameplay.28\n\nDifficulty scaling across Diablo titles 11 functions as a deliberate \"grind wall\" that necessitates player investment beyond simple leveling. The exponential increase in monster health, damage, and resistances, coupled with player penalties (e.g., Diablo 2's resistance penalties, Diablo IV's armor/resistance handicaps 23) and the introduction of immunities 12, forces players to engage deeply with the game's core loop: farming for better gear, optimizing character builds, and mastering combat mechanics. This ensures that progression feels earned, directly contributing to a stronger sense of accomplishment 29 rather than trivial advancement. The lack of transparent monster stats in Diablo IV 28 and the continuous, often uncommunicated, tweaking of numbers 28 highlight a perpetual balancing act by developers. While constant iteration is deemed a \"secret to success\" 31 for long-term engagement, this opacity and frequent changes can lead to significant player frustration. When players cannot clearly understand\n\n*why* their build is underperforming or *how* monster difficulty is calculated, progress can feel \"arbitrary and punitive\" rather than skill-based.29 This tension between developer control over the meta and player agency/understanding is a critical factor in long-term retention and community sentiment.\n\n**Table 2: Diablo Series Difficulty Scaling Comparison**\n\n| Game Title | Difficulty Tiers | Monster Health Scaling (vs. Normal) | Monster Damage Scaling (vs. Normal) | Player Resistance Penalties | XP/Gold Bonuses (vs. Normal) | Key Mechanics Introduced/Scaled |\n| --- | --- | --- | --- | --- | --- | --- |\n| Diablo I | Normal, Nightmare, Hell | D1 Diablo: 833 / 2549 / 3432 HP | D1 Diablo: 30-60 / 64-124 / 126-246 | None | Not specified | None (no physical resistance) |\n| Diablo II | Normal, Nightmare, Hell | Life = HP \\* (Players+1)/2 20 | Increased 23 | -40% Nightmare, -100% Hell 23 | 100% within +/- 5 levels 19 | Immunities, Elite Modifiers (+1/2) 20 |\n| Diablo III | Normal to Torment VI | Up to 8590% (Torment VI) 25 | Up to 2540% (Torment VI) 25 | CC resistance capped 25 | Up to 1600% (Torment VI) 25 | Elite Affixes (up to 4), Set Items, Uber Keys 25 |\n| Diablo IV | Normal to Torment XV (Pit) | Up to 6334823% (Torment XV Pit) 27 | Up to 57664% (Torment XV Pit) 27 | -25% to -100% All Resistances (Torment) 27 | Up to 13400% XP, 6050% Gold (Torment XV Pit) 27 | Sacred/Ancestral Items, Mythic Uniques, Pit Handicaps 27 |\n\n## **4. Elite Monsters: Affixes, Adaptation, and Tactical Depth**\n\nElite monsters serve as mini-bosses, injecting tactical complexity and unpredictability into standard combat encounters. Their unique modifiers, known as affixes, force players to constantly adapt and make real-time strategic decisions.\n\n### **4.1. Elite Monster Categories and Appearance**\n\nIn **Diablo II**, elite monsters are primarily categorized as \"Champions\" (blue-named) and \"Unique\" monsters (gold-named).12 SuperUniques are specific named monsters that appear in fixed locations.12\n\n**Diablo III** consolidates these under the broader term \"Elite monsters,\" which include Champions (blue-named, travel in packs without minions) and Rare monsters (yellow-named, may or may not have minions).15 These elites are explicitly \"designed to make the player pause and think\" due to their toughness and stronger attacks.14\n\n**Diablo IV** continues the Champion monster concept, with them granting 60% of an Elite's XP, making them valuable targets.22 Across the series, elite monsters are visually distinct (e.g., color-coded names, unique models for Uniques/Bosses).12 However, in the fast-paced combat, players are more likely to remember their attack patterns, sound effects, and death animations than intricate visual details.18\n\n### **4.2. Elite Affixes: Mechanics of Mayhem**\n\nElite affixes are specific mechanics that appear as one or two words on the elite's nameplate and have distinct visual appearances in the game world.35 The number of affixes scales with difficulty/level: In\n\n**Diablo III**, elites start with 1 affix (Levels 1-25) and scale up to 4 affixes by Level 60-70.32 Similar scaling logic applies to\n\n**Diablo IV**.36\n\nAffixes can be broadly categorized by their impact on gameplay 35:\n\n* **Area of Effect / \"Don't Stand in the Fire\" Affixes:** These create hazardous zones that players must move out of. Examples include:\n  + **Desecrator (Fire):** Forms molten pits under the player's feet.32\n  + **Molten (Fire):** Elite leaves fiery trails and explodes on death.32\n  + **Plagued (Poison):** Spawns green poison pools.32\n  + **Mortar (Fire):** Launches explosive projectiles at ranged players.32\n  + **Frozen (Cold):** Summons exploding ice mines/orbs.32\n  + **Fire Enchanted (Fire):** Elite ejects fire waves and explodes on death.36\n* **Movement Hindrance / \"Frogger\" Affixes:** These require players to actively dodge or reposition to avoid damage or control. Examples include:\n  + **Arcane Enchanted (Arcane):** Spawns orbs emitting lethal rotating beams.32\n  + **Frozen Pulse (Cold):** Chasing icicles that pulse cold damage.32\n  + **Electrified (Lightning):** Elite fires shock bolts around itself.32\n  + **Orbiter (Lightning):** Spawns a central ball with orbiting lightning rings.35\n  + **Poison Enchanted (Poison):** Spawns criss-crossing poison lines.32\n* **Crowd Control / \"Movement Problem\" Affixes:** These directly impede player movement or control. Examples include:\n  + **Jailer:** Immobilizes players with purple wards.32\n  + **Knockback:** Attacks that push players away.32\n  + **Vortex:** Draws players to the elite's position.32\n  + **Waller:** Creates rock walls to block movement/attacks.32\n  + **Teleporter:** Elite teleports at will, often to the player.32\n  + **Nightmarish:** Inflicts fear, causing players to run away.32\n* **Monster Property / \"Monster Problem\" Affixes:** These modify the elite's defensive or offensive capabilities, or alter their numbers. Examples include:\n  + **Avenger:** Elites grow stronger and larger when others in their pack are slain.32\n  + **Fast:** Increased movement and attack speed.32\n  + **Health Link:** Elites share health, requiring them to be killed together.32\n  + **Horde:** Elite spawns with more minions.32\n  + **Illusionist:** Conjures multiple copies of the elite.32\n  + **Reflects Damage:** Elite reflects a percentage of damage dealt back to the player.32\n  + **Shielding:** Elite casts an immunity shield around itself or allies.32\n  + **Summoner:** Summons minions based on surrounding mob type.36\n  + **Suppressor:** Creates a bubble immune to ranged attacks from outside.36\n\nCertain affix combinations are prevented (e.g., Vortex and Knockback won't appear together) to avoid overly frustrating encounters.35 Lingering effects from affixes disappear once the entire elite pack is defeated.35 Blizzard has also removed affixes deemed too punitive, such as \"Invulnerable Minions\".32\n\nElite affixes 32 are the primary mechanism through which Diablo introduces dynamic, real-time combat puzzles. The increasing quantity and complexity of these affixes with difficulty 32 force players to continuously adapt their strategies, prioritize targets (e.g., Lieutenants or Shamans who buff/resurrect 14), manage space (\"don't stand in the fire\" 35), and react to movement impairments. This constant need for improvisation and tactical decision-making prevents combat from becoming monotonous, significantly enhancing engagement and providing a sense of mastery beyond mere stat-checking. While the game encourages grinding, elite affixes function as an inherent \"anti-grind\" mechanism by preventing mindless repetition and promoting active engagement. They introduce necessary unpredictability and tactical demands, mitigating the \"artificial engagement\" critique 29 by ensuring that even repetitive farming requires skill and attention. The historical removal of affixes like \"Invulnerable Minions\" 32 demonstrates a design philosophy evolving towards challenges that are tactical and surmountable through player skill, rather than simply frustrating or time-wasting, thereby improving long-term player satisfaction and reducing burnout.\n\n**Table 3: Elite Monster Affixes and Their Tactical Implications (Diablo 3 & 4)**\n\n| Affix Name | Game(s) Present | Category | Effect Description | Tactical Player Response | Notes |\n| --- | --- | --- | --- | --- | --- |\n| Arcane Enchanted | D3, D4 | Movement Hindrance | Spawns orbs emitting lethal rotating beams. | Dodge beams, use immunity skills. | Lingering effect, scales with level.32 |\n| Avenger | D3 | Monster Property | Elites grow stronger/larger when others in pack are slain. | Kill all simultaneously, or kite the last one. | Champion-only, increases challenge as pack thins.32 |\n| Desecrator | D3, D4 | Area of Effect | Creates a small circle of fire under player. | Move out of the circle immediately. | Can be obscured, dangerous with Jailer.32 |\n| Electrified | D3, D4 | Movement Hindrance | Fires shock bolts all around itself. | Dodge bolts, or tank damage at range. | Quick small tick damage.32 |\n| Fast | D3 | Monster Property | Increased movement and attack speed (40%). | Kite, use crowd control, burst damage. | Makes elites more aggressive and dangerous.32 |\n| Fire Chains | D3 | Monster Property | Conjures a chain of fire between elite and allies. | Break chains, avoid chain triangle. | Significant damage if caught.32 |\n| Frozen | D3, D4 | Area of Effect | Deploys ice mines/orbs that freeze players on detonation. | Move out of explosion radius before detonation. | Can lock players in place.32 |\n| Frozen Pulse | D3, D4 | Movement Hindrance | Chasing icicle that pulses cold damage, slowing movement. | Set initial location, then move out of pulse area. | Requires active repositioning.32 |\n| Health Link | D3 | Monster Property | Life/damage shared between elite and allies. | Focus fire on one monster, but be aware all take damage. | Requires killing the pack together.32 |\n| Horde | D3 | Monster Property | Spawns a greater number of minions. | Manage crowd control, use AOE attacks. | Multiplies effects of other affixes.32 |\n| Illusionist | D3 | Monster Property | Conjures multiple copies of itself with less health. | Identify original, use AOE, manage multiple affix mechanics. | Copies also spawn affix mechanics.32 |\n| Jailer | D3 | Crowd Control | Immobilizes players with purple wards. | Use immunity skills, avoid hazardous locations. | Particularly dangerous with Desecrator.32 |\n| Knockback | D3 | Crowd Control | Attack that knocks players back. | Maintain positioning, avoid environmental hazards. | Can push players into dangerous zones.32 |\n| Molten | D3 | Area of Effect | Leaves fiery liquid trail, explodes on death. | Avoid trails, move away from elite on death. | Dangerous for melee, requires careful looting.32 |\n| Mortar | D3, D4 | Area of Effect | Fires explosive mortars at ranged players. | Stay in melee range, or constantly move. | Ground indicators can overlap for massive damage.32 |\n| Plagued | D3 | Area of Effect | Conjures pools of poison. | Move out of pools, stack them at edges. | Persists until elite pack is dead.32 |\n| Reflects Damage | D3 | Monster Property | Elite reflects percentage of damage dealt back to player. | Stop attacking when shield is active. | Visual cue (spiky red glow) indicates active shield.32 |\n| Shielding | D3 | Monster Property | Casts immunity shield around itself/allies. | Switch targets, wait for shield to expire. | Forces target prioritization.32 |\n| Summoner | D4 | Monster Property | Summons minions based on surrounding mob type. | Prioritize the summoner, manage adds. | Can have up to 6 minions.36 |\n| Suppressor | D4 | Monster Property | Creates bubble immune to ranged attacks from outside. | Enter the bubble, use melee attacks. | Forces engagement in close quarters.36 |\n| Teleporter | D3, D4 | Crowd Control | Teleports at will, often to player. | Be prepared for sudden repositioning, avoid charges. | Can be annoying with charging monster types.32 |\n| Vortex | D3 | Crowd Control | Draws players next to them. | Hide behind obstructions, use movement skills. | Can pull players into dangerous areas.32 |\n| Waller | D3 | Crowd Control | Creates rock walls to impede movement/attacks. | Navigate walls, use movement skills to escape. | Can block projectiles.32 |\n\n## **5. Boss System: Climactic Encounters and Coveted Rewards**\n\nBosses in the Diablo series represent the pinnacle of challenge and the most coveted rewards, serving as climactic encounters that validate player progression and skill.\n\n### **5.1. Boss Design Principles: The Ultimate Skill Test**\n\nBoss design is the process of creating a \"climactic encounter\" that is a \"skill test\" for the player, usually relating to their moveset.38 They are typically found at the end of a distinct section of the game.38 Key principles of boss design include:\n\n* **Purpose:** Determine the objective of the boss fight (e.g., skill test, narrative progression).38\n* **Theme:** Develop the boss's thematic identity.38\n* **Moveset:** Design attacks and patterns around the player's available moveset, adding variations, spawning enemies, overlapping attacks, and interphases to keep fights fresh.38\n* **Escalation:** Boss fights should escalate in challenge and intensity.38\n\n**Diablo I's** final boss, Diablo, is found on level 16 of the dungeon, surrounded by Blood Knights and Advocates, but can be lured out.11 His stats scale with difficulty, and he possesses a variety of spells like Apocalypse, Blood Star, Fireball, and Telekinesis.11 The lore for Diablo I's Diablo centers on his corruption of King Leoric and his son Albrecht, with the hero venturing into the labyrinth to confront the evil.39\n\n**Diablo II's** Act Bosses (Andariel, Duriel, Mephisto, Diablo, Baal) are crucial for progression to higher difficulties.41\n\n* **Mephisto (Act III Boss):** A skeletal, floating apparition who battles at melee range but uses powerful lightning, poison, and cold spells.42 He is the \"Lord of Hatred,\" known for cunning and specializing in creating undead.43 He was the first Prime Evil captured but corrupted the Zakarum priesthood to free himself.42 Mephisto is a popular \"monster run\" target due to his accessible location and good item drops.42 He does not regenerate hit points.42\n* **Baal (Act V Boss):** The \"Lord of Destruction\" and final boss of Diablo II.41 He has a fierce melee attack and casts curses (Defense Curse, Blood Mana), elemental novas (Incineration Nova, Hoarfrost), Mana Rift, and summons Festering Appendages.41 Crucially, Baal can duplicate himself, creating a \"Vile Effigy\" with half his HP.41 He does not regenerate hit points.41 His lore involves being imprisoned in Tal Rasha and later tricking Marius to regain his soulstone.44\n\n**Diablo III's** bosses, like Azmodan and Diablo, underwent extensive concepting (50-60 concepts) to achieve an \"iconic silhouette\" and convey their themes.18 Players remember their attack patterns, sound effects, and death animations.18\n\n* **Malthael (Reaper of Souls Final Boss):** A three-phase encounter testing player adaptation.45 His abilities include Drain Soul, Charge, Death Fog (heavy DoT), Soul Nova (white orbs), Skull Vortex (skulls vortexing to center then flying out), and Summon Exorcists (drop health globes).45 In Phase 3, he spawns two Death Fogs and gains Soul Sweep (damaging lines).45\n* Other Diablo III bosses also feature unique mechanics: The Butcher (charge, hook), Maghda (minions), Belial (green circles, swirling breath), Cydea (web, scuttle, minions), Azmodan (homing fireballs, minions).46 Diablo (Diablo III) has multiple phases, including fighting a clone of yourself.46\n\n**Diablo IV's** final boss, Lilith, is a two-phase fight in the Throne of Hatred arena.47 Her abilities include Spinning Slice, Demon Cross (lines of flames), Hell Dive (crash down), and Champion Summons (drop potion orbs).47 In Phase 2, she introduces Arena Destruction (crumbling sections), Shadow Flight (hazardous mist), and Corrupted Growths (exploding bulbs), forcing players to navigate a shrinking, dangerous environment.47 Lilith's lore ties her to Mephisto and the creation of Sanctuary, and her motivations in Diablo IV involve raising an army against the Prime Evils.47 However, the Diablo IV Lilith fight has been criticized for being \"easy to make a hard boss, not easy to make a good one\".48 Player feedback points to one-shot mechanics (arena edge, fireballs, blood wave, boils), unpredictable patterns, adds spawning in different locations, overlapping waves, and bugs (e.g., infinite wave spawning if phases are skipped).48 This can lead to frustration and a feeling that success relies on luck or brute-forcing with gear rather than skill.48\n\nBosses in Diablo are meticulously crafted as both narrative focal points 39 and mechanical climaxes.38 They serve to validate player progression and skill, creating a strong sense of accomplishment upon defeat.38 The design of multi-phase encounters and varied movesets, as seen in Malthael and Lilith 45, ensures that these battles are not merely stat checks but require active player adaptation and mastery of mechanics. This approach deepens player engagement by making boss encounters memorable and challenging pinnacles of the gameplay experience. However, the criticism of Diablo IV's Lilith fight 48 highlights a crucial distinction between a \"hard\" boss and a \"good\" one. While one-shot mechanics and high damage contribute to difficulty, if patterns are unpredictable or bugs lead to unfair outcomes, the challenge can feel arbitrary and punitive rather than a true test of skill.29 This can undermine the sense of accomplishment and lead to player burnout, emphasizing the importance of precise tuning, clear visual cues, and reliable mechanics to ensure that difficulty is perceived as fair and surmountable through player agency.\n\n### **5.2. Loot System Integration: The Reward Loop's Payoff**\n\nThe loot system is intrinsically linked to the monster and boss systems, providing the tangible rewards that drive the grind and maintain player engagement. The rarity and power of drops directly correlate with the challenge overcome.\n\nIn **Diablo I**, Diablo, like any normal monster, was not guaranteed to drop anything specific, often just gold.11 This early iteration emphasized the thrill of\n\n*any* good drop.\n\n**Diablo II** featured a more sophisticated loot generation algorithm that considered monster \"treasure class\" and then generated base items with random affixes.6 This led to a vast array of item possibilities. Diablo II also introduced \"Set Items,\" which are powerful equipment that increase in power when multiple pieces are combined.49 These sets have \"Green Stats\" (bound to specific items, unlocked by equipping multiple pieces) and \"Golden Stats\" (bound to the number of pieces worn, offering full range bonuses when all pieces are equipped).49 Examples include Arctic Gear for leveling, Death's Hand + Death's Guard for attack-based characters, and various useful single set pieces like Naj's Puzzler for Teleport charges.50\n\n**Diablo III** continued the concept of set items, often providing significant bonuses for equipping 2, 3, 4, or 6 pieces.51 Some sets, like Tal Rasha's, are multi-piece sets with cascading bonuses.52 Diablo III also introduced a \"smart loot\" system, where drops have an 85% chance to be from the player's class loot table, reducing irrelevant drops and making loot hunting more efficient.8 Legendary loot drops are very favorable at higher difficulties.8\n\n**Diablo IV** features five loot rarities: Common (White), Magic (Purple), Rare (Yellow), Legendary (Orange), and Unique (Tan/Bronze).33 Legendary gear starts dropping around level 20, while Unique items are exclusive to World Tier 3 and 4.33 Loot tiers (Sacred in World Tier 3, Ancestral in World Tier 4) further increase item stats.33\n\n* **Common:** No Bonus Stats.33\n* **Magic:** 1-2 Random Bonus Stats.33\n* **Rare:** 3-4 Random Bonus Stats.33\n* **Legendary:** 4 Random Bonus Stats, Legendary Imprint (extractable power).33\n* **Unique:** 4 Fixed Bonus Stats, Unique Imprint (build-altering effects).33\n* **Mythic Uniques:** Extremely rare, even more powerful versions of Uniques, always dropping at item power 800 with maximum roll ranges and at least one greater affix.34 These are target-farmable from all Tormented endgame bosses, with a 1.5% chance per of 5 RNG instances (roughly 7.5% overall) per kill.34 They can also be crafted using Resplendent Sparks.34\n\nThe loot system, particularly the pursuit of rare and build-defining items, creates long-term goals and a strong sense of accomplishment.29 The rarity of top-tier items makes them meaningful trophies, driving players to continue playing even after completing core content.29 This pursuit of \"perfect gear or ultra-rare affixes\" fuels the \"endless grind\".29 However, a significant tension exists between randomness and determinism in loot acquisition.29 While randomness appeals to \"gambling-style dopamine loops\" and creates value through scarcity 29, excessive reliance on pure chance can lead to player frustration and burnout, especially when progress feels lost due to \"item-breaking upgrades\" or \"bricked items\".29 Modern design increasingly values \"respecting the player's time,\" favoring deterministic progression.29 Blizzard's approach in Diablo IV, offering both high-end random grinds (Uber uniques) and crafting options for Mythic Uniques 29, attempts to bridge this gap, though it has alienated some players.29 The balance between unpredictable, exciting drops and reliable, time-investment-based progression is crucial for sustained player satisfaction and retention.\n\n## **6. Conclusions and Recommendations for Independent Game Developers**\n\nThe enduring appeal of the Diablo series' monster, elite, and boss systems is not a singular phenomenon but a complex interplay of carefully designed mechanics that foster continuous player engagement. For independent game developers seeking to emulate this success, several key principles emerge:\n\n1. **Embrace Nested Gameplay Loops:** Design a core \"kill-loot-grow\" loop that is inherently satisfying, but then build nested sub-loops that operate on different timescales. This provides both immediate gratification and long-term objectives, catering to various player motivations, from moment-to-moment combat flow to seasonal progression and social goals. The ultimate goal should be to make the grind itself a rewarding, optimizable experience rather than a chore.\n2. **Strategic Procedural Generation:** Leverage procedural content generation (PCG) to enhance replayability, but carefully consider its scope. While fully randomized overworlds (as in Diablo I and II) can offer immense freshness, a static overworld with procedurally generated dungeons (as in Diablo III and IV) can provide a sense of a consistent, believable world while still offering varied combat encounters. The key is to ensure that the randomization genuinely alters gameplay experiences and meets player expectations for novelty.\n3. **Functional Monster Design:** Move beyond purely thematic monster classifications towards functional archetypes. Design each monster type, from common foes to elites, with a clear combat role (e.g., swarmer, ranged, debuffer, spawner). This allows for more dynamic and predictable (in terms of role) combat encounters, enabling players to develop effective strategies.\n4. **Visual Clarity in Combat:** Prioritize clear and immediate visual communication for monsters and their abilities. In fast-paced ARPG combat, players have limited time to process information. Distinct silhouettes, color coding for monster rarity, and exaggerated visual cues for attack types or affixes allow for rapid threat assessment and tactical decision-making without interrupting gameplay flow.\n5. **Density as a Power Fantasy Enabler:** Design monster density not just as a numerical value, but as a core component of the power fantasy. High monster density allows players to feel powerful as they clear large groups, directly contributing to efficient progression and a sense of exhilaration. Balance this density to avoid performance issues or trivializing individual encounters.\n6. **Thoughtful Multiplayer Scaling:** When implementing multiplayer, consider the implications of experience and loot scaling. While incentivizing group play can foster social engagement, ensure that solo play remains a viable and rewarding option for players who prefer it, avoiding a meta that makes solo progression feel significantly inefficient.\n7. **Progressive Difficulty with Intent:** Implement difficulty scaling as a deliberate \"grind wall\" that necessitates player investment in gear and build optimization, rather than just level progression. Exponential increases in monster stats, coupled with player handicaps and immunities, can create a challenging yet rewarding progression curve.\n8. **Transparency in Progression:** While constant iteration and balancing are vital for long-term engagement, maintain transparency regarding monster stats and system changes where possible. Opaque mechanics or frequent, uncommunicated nerfs can lead to player frustration and a feeling that progress is arbitrary, undermining the sense of accomplishment.\n9. **Bosses as Skill Tests and Rewards:** Design bosses as climactic encounters that test player mastery of mechanics and serve as significant narrative and mechanical milestones. Ensure that boss abilities are well-telegraphed, and that the challenge is perceived as fair and surmountable through skill, rather than relying on unpredictable \"one-shot\" mechanics or bugs.\n10. **Balanced Loot Systems:** Integrate a loot system that balances the excitement of random drops with deterministic progression. While rare, random drops can create powerful dopamine loops and a sense of accomplishment, incorporating deterministic paths (e.g., crafting, pity mechanics, target farming) can respect player time and mitigate burnout from excessive RNG. The loot system should consistently offer meaningful upgrades that directly empower character builds and enable new gameplay strategies.\n\n#### 引用的著作\n\n1. Designing The Core Gameplay Loop: A Beginner's Guide, 访问时间为 七月 28, 2025， <https://gamedesignskills.com/game-design/core-loops-in-gameplay/>\n2. The gameplay loop - PC General Discussion - Diablo IV Forums, 访问时间为 七月 28, 2025， <https://us.forums.blizzard.com/en/d4/t/the-gameplay-loop/141268>\n3. Diablo 4 designer says its “absolutely critical that players feel powerful” to maintain popularity - Reddit, 访问时间为 七月 28, 2025， <https://www.reddit.com/r/diablo4/comments/1k23x9s/diablo_4_designer_says_its_absolutely_critical/>\n4. Randomization - Diablo Wiki, 访问时间为 七月 28, 2025， <https://www.diablowiki.net/Randomization>\n5. Creating a Newer and Improved Procedural Content Generation (PCG) Algorithm with Minimal Human Intervention for Computer Gaming Development - MDPI, 访问时间为 七月 28, 2025， <https://www.mdpi.com/2073-431X/13/11/304>\n6. Homework 6 - Loot generator - CIS UPenn, 访问时间为 七月 28, 2025， <https://www.cis.upenn.edu/~cis110/11fa/hw/hw06/index.html>\n7. Procedural generation - One overlooked drawback of shared zones - General Discussion - Diablo 3 Forums, 访问时间为 七月 28, 2025， <https://us.forums.blizzard.com/en/d3/t/procedural-generation-one-overlooked-drawback-of-shared-zones/6373>\n8. How random is Diablo 3? - Reddit, 访问时间为 七月 28, 2025， <https://www.reddit.com/r/Diablo/comments/xcp7vz/how_random_is_diablo_3/>\n9. Diablo IV - Wikipedia, 访问时间为 七月 28, 2025， <https://en.wikipedia.org/wiki/Diablo_IV>\n10. D4 is the first game in the franchise that eschews random maps : r/Diablo - Reddit, 访问时间为 七月 28, 2025， <https://www.reddit.com/r/Diablo/comments/13yhjvu/d4_is_the_first_game_in_the_franchise_that/>\n11. D1 Diablo (monster) - Diablo 2 Wiki, 访问时间为 七月 28, 2025， [https://diablo2.diablowiki.net/D1\\_Diablo\\_(monster)](https://diablo2.diablowiki.net/D1_Diablo_%28monster%29)\n12. Monsters - Diablo Wiki, 访问时间为 七月 28, 2025， <https://diablo2.diablowiki.net/Monsters>\n13. Archives: Monsters - Diablo 2 Wiki, 访问时间为 七月 28, 2025， [https://diablo2.diablowiki.net/Archives:\\_Monsters](https://diablo2.diablowiki.net/Archives%3A_Monsters)\n14. Monster - Diablo Wiki, 访问时间为 七月 28, 2025， <https://www.diablowiki.net/Monster>\n15. What's the difference between champion, rare, and elite monsters? : r/Diablo - Reddit, 访问时间为 七月 28, 2025， <https://www.reddit.com/r/Diablo/comments/tuhcc/whats_the_difference_between_champion_rare_and/>\n16. Monster Families In Diablo 4 - D4 Maxroll.gg, 访问时间为 七月 28, 2025， <https://maxroll.gg/d4/resources/monster-families>\n17. Introduction to monster design 3 - 3 Principles of Monster Design - YouTube, 访问时间为 七月 28, 2025， <https://www.youtube.com/watch?v=pD4NaGmPfJM>\n18. Diablo III: Designing a Demon - IGN, 访问时间为 七月 28, 2025， <https://www.ign.com/articles/2012/03/26/diablo-iii-designing-a-demon>\n19. Diablo 2 leveling guide: EXP scaling and where to power level in Diablo 2 explained, 访问时间为 七月 28, 2025， <https://www.eurogamer.net/diablo-2-leveling-guide-power-level-exp-scaling-8017>\n20. The Arreat Summit - Monsters: Basic Monster Information - Battle.net, 访问时间为 七月 28, 2025， <http://classic.battle.net/diablo2exp/monsters/basics.shtml>\n21. Fastest Season Pass Favor Farm in Diablo 4 Vessel of Hatred - YouTube, 访问时间为 七月 28, 2025， <https://www.youtube.com/watch?v=odG5gb8amWk>\n22. Experience in Diablo 4 - Maxroll, 访问时间为 七月 28, 2025， <https://maxroll.gg/d4/resources/experience>\n23. Difficulty - Diablo 2 Wiki, 访问时间为 七月 28, 2025， <https://diablo2.diablowiki.net/Difficulty>\n24. Basics: Resistances - The Arreat Summit - Battle.net, 访问时间为 七月 28, 2025， <https://classic.battle.net/diablo2exp/basics/resistances.shtml>\n25. Difficulty - Diablo Wiki, 访问时间为 七月 28, 2025， <https://www.diablowiki.net/Difficulty>\n26. How do the different difficulty levels affect the gameplay? - Arqade - Stack Exchange, 访问时间为 七月 28, 2025， <https://gaming.stackexchange.com/questions/66348/how-do-the-different-difficulty-levels-affect-the-gameplay>\n27. Difficulties - Diablo 4 - PureDiablo, 访问时间为 七月 28, 2025， <https://www.purediablo.com/diablo4/Difficulties>\n28. What are the exact enemy health, and damage difference for each difficulty? - Reddit, 访问时间为 七月 28, 2025， <https://www.reddit.com/r/diablo4/comments/1m1b6v3/what_are_the_exact_enemy_health_and_damage/>\n29. A detailed response for Blizzards current state of the game - PC General Discussion - Diablo IV Forums, 访问时间为 七月 28, 2025， <https://us.forums.blizzard.com/en/d4/t/a-detailed-response-for-blizzards-current-state-of-the-game/225404>\n30. Diablo 4 2.3.0 Patch Notes - IGN, 访问时间为 七月 28, 2025， <https://www.ign.com/wikis/diablo-4/Diablo_4_2.3.0_Patch_Notes>\n31. Interview w/ BLIZZARD right before DIABLO 2 shipped - Nov 1999 - YouTube, 访问时间为 七月 28, 2025， <https://www.youtube.com/watch?v=SDgwu9QVj4A>\n32. Monster Affixes - Diablo III Guide - IGN, 访问时间为 七月 28, 2025， <https://www.ign.com/wikis/diablo-3/Monster_Affixes>\n33. Loot Tiers and Rarity Guide - Diablo 4 Guide - IGN, 访问时间为 七月 28, 2025， <https://www.ign.com/wikis/diablo-4/Loot_Tiers_and_Rarity_Guide>\n34. Unique and Mythic Unique Items - Maxroll.gg D4, 访问时间为 七月 28, 2025， <https://maxroll.gg/d4/wiki/uniques>\n35. How to combat elite monster affixes in Diablo 3 - Blizzard Watch, 访问时间为 七月 28, 2025， <https://blizzardwatch.com/2015/07/11/combat-elite-monster-affixes-diablo-3/>\n36. Elite and Affixes Overview - Maxroll, 访问时间为 七月 28, 2025， <https://maxroll.gg/d4/resources/elites-affixes>\n37. Boss Modifiers - Diablo Wiki, 访问时间为 七月 28, 2025， <https://www.diablowiki.net/Boss_Modifiers>\n38. Boss Design: How to Make an Unforgettable Boss Battle, 访问时间为 七月 28, 2025， <https://gamedesignskills.com/game-design/game-boss-design/>\n39. What's the story behind Diablo 1? - Reddit, 访问时间为 七月 28, 2025， <https://www.reddit.com/r/Diablo/comments/53ipm2/whats_the_story_behind_diablo_1/>\n40. Diablo (series) - Wikipedia, 访问时间为 七月 28, 2025， [https://en.wikipedia.org/wiki/Diablo\\_(series)](https://en.wikipedia.org/wiki/Diablo_%28series%29)\n41. Baal - Diablo Wiki - Diablo 2 Wiki, 访问时间为 七月 28, 2025， <https://diablo2.diablowiki.net/Baal>\n42. Mephisto - Diablo Wiki, 访问时间为 七月 28, 2025， <https://diablo2.diablowiki.net/Mephisto>\n43. Mephisto - Diablo Wiki, 访问时间为 七月 28, 2025， <https://www.diablowiki.net/Mephisto>\n44. Baal - Diablo Wiki, 访问时间为 七月 28, 2025， <https://www.diablowiki.net/Baal>\n45. Malthael - Diablo III Guide - IGN, 访问时间为 七月 28, 2025， <https://www.ign.com/wikis/diablo-3/Malthael>\n46. Diablo 3 all boss strategies explained, including how to beat Diablo and Malthael, 访问时间为 七月 28, 2025， <https://www.eurogamer.net/diablo-3-ultimate-evil-guide?page=13>\n47. Diablo 4 Lilith boss guide and lore - PCGamesN, 访问时间为 七月 28, 2025， <https://www.pcgamesn.com/diablo-4/lilith>\n48. Uber Lilith mechanics? - General Discussion PC - Diablo IV Forums, 访问时间为 七月 28, 2025， <https://eu.forums.blizzard.com/en/d4/t/uber-lilith-mechanics/8262>\n49. Diablo 2 Sets - D2Runewizard, 访问时间为 七月 28, 2025， <https://d2runewizard.com/sets>\n50. Set Items in Diablo 2 Resurrected - Maxroll.gg, 访问时间为 七月 28, 2025， <https://maxroll.gg/d2/items/sets>\n51. Craftable Set Items - Diablo III Guide - IGN, 访问时间为 七月 28, 2025， <https://www.ign.com/wikis/diablo-3/Craftable_Set_Items>\n52. Multiple set bonuses? - General Discussion - Icy Veins, 访问时间为 七月 28, 2025， <https://www.icy-veins.com/forums/topic/36274-multiple-set-bonuses/>\n53. Mythic Drop Rates in Diablo 4 Explained - YouTube, 访问时间为 七月 28, 2025， <https://www.youtube.com/watch?v=86uCKw0KLfc>\n",
  "all_source_links": [
    "http://classic.battle.net/diablo2exp/monsters/basics.shtml",
    "http://thegamedesignforum.com/features/RD_D2_5.html",
    "https://accounts.google.com/SignOutOptions?hl=zh-CN&continue=https://gemini.google.com/%3Fis_sa%3D1%26is_sa%3D1%26android-min-version%3D301356232%26ios-min-version%3D322.0%26campaign_id%3Dbkws%26utm_source%3Dsem%26utm_source%3Dgoogle%26utm_medium%3Dpaid-media%26utm_medium%3Dcpc%26utm_campaign%3Dbkws%26utm_campaign%3D2024enAU_gemfeb%26pt%3D9008%26mt%3D8%26ct%3Dp-growth-sem-bkws%26gclsrc%3Daw.ds%26gad_source%3D1%26gad_campaignid%3D22437964261%26gbraid%3D0AAAAApk5BhmTIKeu82GeBI85qNScnwP3m%26gclid%3DCjwKCAjwkvbEBhApEiwAKUz6-ybVgRKghbvMe_m6J9HfhKccGbx5pv_fQCiPXewPYkQWthYXErb2txoClPAQAvD_BwE&ec=GBRAkgU",
    "https://blizzardwatch.com/2015/07/11/combat-elite-monster-affixes-diablo-3",
    "https://classic.battle.net/diablo2exp/basics/resistances.shtml",
    "https://d2runewizard.com/sets",
    "https://diablo2.diablowiki.net/Archives%3A_Monsters",
    "https://diablo2.diablowiki.net/Archives:",
    "https://diablo2.diablowiki.net/Archives:\\_Monsters",
    "https://diablo2.diablowiki.net/Archives:_Monsters",
    "https://diablo2.diablowiki.net/Baal",
    "https://diablo2.diablowiki.net/D1",
    "https://diablo2.diablowiki.net/D1\\_Diablo\\_(monster",
    "https://diablo2.diablowiki.net/D1_Diablo_%28monster%29",
    "https://diablo2.diablowiki.net/D1_Diablo_(monster",
    "https://diablo2.diablowiki.net/Difficulty",
    "https://diablo2.diablowiki.net/Mephisto",
    "https://diablo2.diablowiki.net/Monsters",
    "https://en.wikipedia.org/wiki/Diablo",
    "https://en.wikipedia.org/wiki/Diablo\\_(series",
    "https://en.wikipedia.org/wiki/Diablo_%28series%29",
    "https://en.wikipedia.org/wiki/Diablo_(series",
    "https://en.wikipedia.org/wiki/Diablo_IV",
    "https://eu.forums.blizzard.com/en/d4/t/uber-lilith-mechanics/8262",
    "https://gamedesignskills.com/game-design/core-loops-in-gameplay",
    "https://gamedesignskills.com/game-design/game-boss-design",
    "https://gaming.stackexchange.com/questions/66348/how-do-the-different-difficulty-levels-affect-the-gameplay",
    "https://gaming.stackexchange.com/questions/68670/how-many-xp-do-i-get-by-killing-monsters",
    "https://m.youtube.com/watch?v=_Ow0e9zGN9s",
    "https://maxroll.gg/d2/items/sets",
    "https://maxroll.gg/d3/resources/experience-explained",
    "https://maxroll.gg/d4/resources/elites-affixes",
    "https://maxroll.gg/d4/resources/experience",
    "https://maxroll.gg/d4/resources/monster-families",
    "https://maxroll.gg/d4/wiki/uniques",
    "https://mobalytics.gg/diablo-4/guides/gear-affixes-full-list",
    "https://myactivity.google.com/product/gemini?utm_source=gemini",
    "https://policies.google.com/terms",
    "https://support.google.com/bard/answer/13594961",
    "https://support.google.com/gemini/answer/13594961#location&zippy=%2Cwhat-location-information-do-gemini-apps-collect-why-and-how-is-it-used",
    "https://us.forums.blizzard.com/en/d3/t/procedural-generation-one-overlooked-drawback-of-shared-zones/6373",
    "https://us.forums.blizzard.com/en/d4/t/%F0%9F%93%88-player-retention-theory/225029",
    "https://us.forums.blizzard.com/en/d4/t/a-detailed-response-for-blizzards-current-state-of-the-game/225404",
    "https://us.forums.blizzard.com/en/d4/t/game-operation-and-mechanics/216914",
    "https://us.forums.blizzard.com/en/d4/t/message-to-devs-very-simple-advise-to-never-miss-the-mark-again/227072",
    "https://us.forums.blizzard.com/en/d4/t/no-set-items-is-killing-the-diablo-4/67109",
    "https://us.forums.blizzard.com/en/d4/t/the-gameplay-loop/141268",
    "https://www.cis.upenn.edu/~cis110/11fa/hw/hw06/index.html",
    "https://www.diablowiki.net/Baal",
    "https://www.diablowiki.net/Boss_Modifiers",
    "https://www.diablowiki.net/Difficulty",
    "https://www.diablowiki.net/Mephisto",
    "https://www.diablowiki.net/Monster",
    "https://www.diablowiki.net/Randomization",
    "https://www.eurogamer.net/diablo-2-leveling-guide-power-level-exp-scaling-8017",
    "https://www.eurogamer.net/diablo-3-ultimate-evil-guide?page=13",
    "https://www.furiouspaul.com/pc/diablo1",
    "https://www.gameaccessibilitynexus.com/blog/2025/06/25/diablo-iv-anniversary-interview-with-drew-mccrory",
    "https://www.icy-veins.com/forums/topic/36274-multiple-set-bonuses",
    "https://www.ign.com/articles/2012/03/26/diablo-iii-designing-a-demon",
    "https://www.ign.com/wikis/diablo-3/Craftable_Set_Items",
    "https://www.ign.com/wikis/diablo-3/Malthael",
    "https://www.ign.com/wikis/diablo-3/Monster_Affixes",
    "https://www.ign.com/wikis/diablo-4/Diablo_4_2.3.0_Patch_Notes",
    "https://www.ign.com/wikis/diablo-4/Loot_Tiers_and_Rarity_Guide",
    "https://www.mdpi.com/2073-431X/13/11/304",
    "https://www.pcgamesn.com/diablo-4/lilith",
    "https://www.poecurrency.com",
    "https://www.purediablo.com/diablo4/Difficulties",
    "https://www.reddit.com/r/Diablo/comments/13yhjvu/d4_is_the_first_game_in_the_franchise_that",
    "https://www.reddit.com/r/Diablo/comments/53ipm2/whats_the_story_behind_diablo_1",
    "https://www.reddit.com/r/Diablo/comments/tuhcc/whats_the_difference_between_champion_rare_and",
    "https://www.reddit.com/r/Diablo/comments/xcp7vz/how_random_is_diablo_3",
    "https://www.reddit.com/r/diablo4/comments/1k23x9s/diablo_4_designer_says_its_absolutely_critical",
    "https://www.reddit.com/r/diablo4/comments/1m1b6v3/what_are_the_exact_enemy_health_and_damage",
    "https://www.youtube.com/watch?v=86uCKw0KLfc",
    "https://www.youtube.com/watch?v=SDgwu9QVj4A",
    "https://www.youtube.com/watch?v=mYmKpZVlFQg",
    "https://www.youtube.com/watch?v=odG5gb8amWk",
    "https://www.youtube.com/watch?v=pD4NaGmPfJM",
    "https://www.youtube.com/watch?v=xRPAUKsEpu0"
  ],
  "summary_citations": [
    "http://classic.battle.net/diablo2exp/monsters/basics.shtml",
    "http://thegamedesignforum.com/features/RD_D2_5.html",
    "https://accounts.google.com/SignOutOptions?hl=zh-CN&continue=https://gemini.google.com/%3Fis_sa%3D1%26is_sa%3D1%26android-min-version%3D301356232%26ios-min-version%3D322.0%26campaign_id%3Dbkws%26utm_source%3Dsem%26utm_source%3Dgoogle%26utm_medium%3Dpaid-media%26utm_medium%3Dcpc%26utm_campaign%3Dbkws%26utm_campaign%3D2024enAU_gemfeb%26pt%3D9008%26mt%3D8%26ct%3Dp-growth-sem-bkws%26gclsrc%3Daw.ds%26gad_source%3D1%26gad_campaignid%3D22437964261%26gbraid%3D0AAAAApk5BhmTIKeu82GeBI85qNScnwP3m%26gclid%3DCjwKCAjwkvbEBhApEiwAKUz6-ybVgRKghbvMe_m6J9HfhKccGbx5pv_fQCiPXewPYkQWthYXErb2txoClPAQAvD_BwE&ec=GBRAkgU",
    "https://blizzardwatch.com/2015/07/11/combat-elite-monster-affixes-diablo-3",
    "https://classic.battle.net/diablo2exp/basics/resistances.shtml",
    "https://d2runewizard.com/sets",
    "https://diablo2.diablowiki.net/Archives%3A_Monsters",
    "https://diablo2.diablowiki.net/Archives:",
    "https://diablo2.diablowiki.net/Archives:\\_Monsters",
    "https://diablo2.diablowiki.net/Archives:_Monsters",
    "https://diablo2.diablowiki.net/Baal",
    "https://diablo2.diablowiki.net/D1",
    "https://diablo2.diablowiki.net/D1\\_Diablo\\_(monster",
    "https://diablo2.diablowiki.net/D1_Diablo_%28monster%29",
    "https://diablo2.diablowiki.net/D1_Diablo_(monster",
    "https://diablo2.diablowiki.net/Difficulty",
    "https://diablo2.diablowiki.net/Mephisto",
    "https://diablo2.diablowiki.net/Monsters",
    "https://en.wikipedia.org/wiki/Diablo",
    "https://en.wikipedia.org/wiki/Diablo\\_(series",
    "https://en.wikipedia.org/wiki/Diablo_%28series%29",
    "https://en.wikipedia.org/wiki/Diablo_(series",
    "https://en.wikipedia.org/wiki/Diablo_IV",
    "https://eu.forums.blizzard.com/en/d4/t/uber-lilith-mechanics/8262",
    "https://gamedesignskills.com/game-design/core-loops-in-gameplay",
    "https://gamedesignskills.com/game-design/game-boss-design",
    "https://gaming.stackexchange.com/questions/66348/how-do-the-different-difficulty-levels-affect-the-gameplay",
    "https://gaming.stackexchange.com/questions/68670/how-many-xp-do-i-get-by-killing-monsters",
    "https://m.youtube.com/watch?v=_Ow0e9zGN9s",
    "https://maxroll.gg/d2/items/sets",
    "https://maxroll.gg/d3/resources/experience-explained",
    "https://maxroll.gg/d4/resources/elites-affixes",
    "https://maxroll.gg/d4/resources/experience",
    "https://maxroll.gg/d4/resources/monster-families",
    "https://maxroll.gg/d4/wiki/uniques",
    "https://mobalytics.gg/diablo-4/guides/gear-affixes-full-list",
    "https://myactivity.google.com/product/gemini?utm_source=gemini",
    "https://policies.google.com/terms",
    "https://support.google.com/bard/answer/13594961",
    "https://support.google.com/gemini/answer/13594961#location&zippy=%2Cwhat-location-information-do-gemini-apps-collect-why-and-how-is-it-used",
    "https://us.forums.blizzard.com/en/d3/t/procedural-generation-one-overlooked-drawback-of-shared-zones/6373",
    "https://us.forums.blizzard.com/en/d4/t/%F0%9F%93%88-player-retention-theory/225029",
    "https://us.forums.blizzard.com/en/d4/t/a-detailed-response-for-blizzards-current-state-of-the-game/225404",
    "https://us.forums.blizzard.com/en/d4/t/game-operation-and-mechanics/216914",
    "https://us.forums.blizzard.com/en/d4/t/message-to-devs-very-simple-advise-to-never-miss-the-mark-again/227072",
    "https://us.forums.blizzard.com/en/d4/t/no-set-items-is-killing-the-diablo-4/67109",
    "https://us.forums.blizzard.com/en/d4/t/the-gameplay-loop/141268",
    "https://www.cis.upenn.edu/~cis110/11fa/hw/hw06/index.html",
    "https://www.diablowiki.net/Baal",
    "https://www.diablowiki.net/Boss_Modifiers",
    "https://www.diablowiki.net/Difficulty",
    "https://www.diablowiki.net/Mephisto",
    "https://www.diablowiki.net/Monster",
    "https://www.diablowiki.net/Randomization",
    "https://www.eurogamer.net/diablo-2-leveling-guide-power-level-exp-scaling-8017",
    "https://www.eurogamer.net/diablo-3-ultimate-evil-guide?page=13",
    "https://www.furiouspaul.com/pc/diablo1",
    "https://www.gameaccessibilitynexus.com/blog/2025/06/25/diablo-iv-anniversary-interview-with-drew-mccrory",
    "https://www.icy-veins.com/forums/topic/36274-multiple-set-bonuses",
    "https://www.ign.com/articles/2012/03/26/diablo-iii-designing-a-demon",
    "https://www.ign.com/wikis/diablo-3/Craftable_Set_Items",
    "https://www.ign.com/wikis/diablo-3/Malthael",
    "https://www.ign.com/wikis/diablo-3/Monster_Affixes",
    "https://www.ign.com/wikis/diablo-4/Diablo_4_2.3.0_Patch_Notes",
    "https://www.ign.com/wikis/diablo-4/Loot_Tiers_and_Rarity_Guide",
    "https://www.mdpi.com/2073-431X/13/11/304",
    "https://www.pcgamesn.com/diablo-4/lilith",
    "https://www.poecurrency.com",
    "https://www.purediablo.com/diablo4/Difficulties",
    "https://www.reddit.com/r/Diablo/comments/13yhjvu/d4_is_the_first_game_in_the_franchise_that",
    "https://www.reddit.com/r/Diablo/comments/53ipm2/whats_the_story_behind_diablo_1",
    "https://www.reddit.com/r/Diablo/comments/tuhcc/whats_the_difference_between_champion_rare_and",
    "https://www.reddit.com/r/Diablo/comments/xcp7vz/how_random_is_diablo_3",
    "https://www.reddit.com/r/diablo4/comments/1k23x9s/diablo_4_designer_says_its_absolutely_critical",
    "https://www.reddit.com/r/diablo4/comments/1m1b6v3/what_are_the_exact_enemy_health_and_damage",
    "https://www.youtube.com/watch?v=86uCKw0KLfc",
    "https://www.youtube.com/watch?v=SDgwu9QVj4A",
    "https://www.youtube.com/watch?v=mYmKpZVlFQg",
    "https://www.youtube.com/watch?v=odG5gb8amWk",
    "https://www.youtube.com/watch?v=pD4NaGmPfJM",
    "https://www.youtube.com/watch?v=xRPAUKsEpu0"
  ]
}