{
  "query": "What are the similarities and differences between the political and legal systems of the Roman Empire and the Eastern Roman Empire?",
  "chain_of_research": {
    "plan_1": {
      "title": "Initial Research Focus\nUpcoming Comparative Analysis\nSynthesizing the Legacy",
      "description": "I'm starting my research by focusing on the political and legal systems of the Roman Empire. I'll be looking into how the Emperor's role evolved, the function of the Senate, how provinces were administered, and the fundamental principles of Roman law. This will provide a solid foundation for understanding the later developments in the Eastern Roman Empire.\nOnce I have a good grasp of the Roman Empire's systems, I'll shift my attention to the Eastern Roman (Byzantine) Empire. I'll investigate the Emperor's absolute power, the centralized bureaucracy, the significant role of the Orthodox Church, and the evolution of Byzantine law, including the pivotal Justinian's Code. Following this, I'll conduct a comparative analysis to highlight the similarities and differences between the two empires' political and legal structures. I'll be particularly interested in the shift from the 'republican fiction' of the Roman Emperor to the Byzantine concept of 'divine right,' the impact of Christianity on governance and law, and the linguistic transition from Latin to Greek.\nMy ultimate goal is to synthesize these findings to understand how the Byzantine Empire both preserved and transformed the Roman legacy, ultimately creating its own distinct and lasting political and legal system. I'm beginning by gathering information on the Roman Empire's political and legal structure."
    },
    "search_1": [
      "https://www.britannica.com/topic/constitutiones-principum#:~:text=The%20chief%20forms%20of%20imperial,particular%20on%20a%20point%20of",
      "https://www.britannica.com/topic/constitutiones-principum",
      "https://en.wikipedia.org/wiki/Principate",
      "https://www.ebsco.com/research-starters/history/dominate-rome",
      "https://www.labrujulaverde.com/en/2023/11/from-principate-to-dominate-when-roman-emperors-became-boastful-autocrats",
      "https://www.ebsco.com/research-starters/history/dominate-rome#:~:text=%22Dominate%20in%20Rome%22%20refers%20to,rule%20under%20emperors%20like%20Diocletian.",
      "https://www.pbs.org/empires/romans/empire/senators.html#:~:text=During%20the%20empire%2C%20the%20senate,Senate%20discussions%2C%20and%20propose%20legislation.",
      "https://pressbooks.nscc.ca/worldhistory/chapter/chapter-9-the-roman-empire",
      "https://www.pbs.org/articles/learn-about-the-roman-senate",
      "https://en.wikipedia.org/wiki/Dominate",
      "https://www.pbs.org/empires/romans/empire/senators.html",
      "https://scholarship.kentlaw.iit.edu/cgi/viewcontent.cgi?article=2999&context=cklawreview",
      "https://library.fiveable.me/key-terms/early-world-civilizations/provincial-administration",
      "https://en.wikipedia.org/wiki/Roman_Senate",
      "https://www.cambridge.org/core/books/law-and-power-in-the-making-of-the-roman-commonwealth/evolution-of-roman-law-and-jurisprudence/AF3E906F977B3AA169B94D3635DD3144",
      "https://www.numberanalytics.com/blog/provincial-administration-ancient-rome",
      "https://en.wikipedia.org/wiki/Senate_of_the_Roman_Empire",
      "https://digitalcommons.law.uga.edu/cgi/viewcontent.cgi?article=1051&context=gjicl",
      "https://en.wikipedia.org/wiki/Roman_province",
      "https://theimpactlawyers.com/articles/the-influence-of-the-legal-aspects-of-the-roman-empire",
      "https://dj.univ-danubius.ro/index.php/AUDJ/article/view/524/1082",
      "https://www.unrv.com/government/provincialgovernment.php",
      "https://www.britannica.com/topic/province-ancient-Roman-government",
      "https://www.cambridge.org/core/books/cambridge-ancient-history/provincial-administration-and-taxation/7CBC4A0170CC34248635BA2EB386BAB9",
      "https://en.wikipedia.org/wiki/Roman_law",
      "http://www.rechtshistorie.nl/en/roman-law",
      "https://www.britannica.com/topic/Roman-law",
      "https://www.ius.uzh.ch/dam/jcr:b201fd7a-c57e-43e6-abc5-5259609becb1/H%C3%A4usler_Roman%20Law_Introduction%20to%20Swiss%20law_draft.pdf",
      "https://lsd.law/define/praetor",
      "https://www.cambridge.org/core/books/cambridge-companion-to-roman-law/sources-of-law-from-the-republic-to-the-dominate/561AB3827959381F24D798A498298795",
      "https://www.thoughtco.com/what-is-praetor-117900",
      "https://www.britannica.com/topic/praetor",
      "https://brewminate.com/praetors-and-executive-power-in-the-ancient-roman-government",
      "https://www.unrv.com/government/praetors.php",
      "https://en.wikipedia.org/wiki/Praetor"
    ],
    "observation_1": "I've begun by examining the political structure of the Roman Empire, specifically the transition from the Principate to the Dominate. I've learned that the Principate, initiated by Augustus, maintained a facade of republican institutions, with the emperor acting as 'first citizen.' In contrast, the Dominate, solidified by Diocletian, was an overtly autocratic system where the emperor was an absolute ruler, referred to as 'dominus' or 'master.' This shift involved increased centralization of power, a more rigorous taxation system, and a separation of military and civil authority in the provinces. The Senate's role diminished significantly, becoming more of an advisory body, though it retained some ceremonial importance.",
    "plan_2": {
      "title": "Insights into Roman Legal Foundations\nNext Steps: Eastern Roman Empire",
      "description": "My research into the Roman legal system has provided insights into its key sources and the roles of legal figures. I've identified the Twelve Tables as the earliest written law, followed by the development of 'ius honorarium' through praetorian edicts, which allowed for the adaptation of law to new circumstances. Resolutions of the Senate ('senatus consulta') and imperial decrees ('constitutiones principum') also served as sources of law. I've also noted the crucial role of jurists in interpreting and developing legal principles, often advising magistrates and contributing to the intellectual substance of private law.\nWith a foundational understanding of the Roman Empire's political and legal systems, I'm now ready to delve into the Eastern Roman (Byzantine) Empire. My next steps will focus on researching the absolute power of the Byzantine Emperor, the characteristics of its centralized bureaucracy, the influence of the Orthodox Church on governance, and the significant developments in Byzantine law, particularly the Corpus Juris Civilis. This will enable me to draw direct comparisons and identify the similarities and differences between the two empires."
    },
    "search_2": [
      "https://www.google.com/search?q=political+system+of+the+Byzantine+Empire",
      "https://en.wikipedia.org/wiki/Byzantine_bureaucracy_and_aristocracy",
      "https://www.britannica.com/topic/Basilica-Byzantine-law#:~:text=Basilica%2C%20(from%20Greek%20basilikos%2C,son%20Leo%20VI%20the%20Wise.",
      "https://www.britannica.com/topic/Basilica-Byzantine-law",
      "https://www.britannica.com/biography/Basil-I-Byzantine-emperor",
      "https://www.tandfonline.com/doi/abs/10.1080/03044181.2014.902398#:~:text=Numerous%20studies%20have%20depicted%20the,legitimate%20Christian%20basileus%20on%20earth.",
      "https://en.wikipedia.org/wiki/Basileus",
      "https://www.tsarvisit.com/en/blog/st-basil-cathedral",
      "https://www.britannica.com/topic/Ecloga",
      "http://www.mlahanas.de/Greeks/Medieval/LX/ByzantineAaristocracyAndBureaucracy.html",
      "https://en.wikipedia.org/wiki/Saint_Basil%27s_Cathedral",
      "https://fromthegardenintothecity.wordpress.com/2012/06/19/the-basileus-in-byzantium",
      "https://origin.web.fordham.edu/halsall/source/ecloga1.asp#:~:text=The%20Ecloga%20of%20Leo%20III,be%20influenced%20by%20Christian%20principles.",
      "https://hagiasophiaturkey.com/discussion-pages/discussion/ecloga",
      "https://en.wikipedia.org/wiki/Subdivisions_of_the_Byzantine_Empire",
      "https://en.wikipedia.org/wiki/Basil_I",
      "https://www.reddit.com/r/explainlikeimfive/comments/1bdty9x/eli5_why_is_byzantine_used_to_describe_excessive",
      "https://istanbultarihi.ist/405-politics-and-society-in-the-early-byzantine-capital-330-565",
      "https://grbs.library.duke.edu/index.php/grbs/article/download/17047/7593/23048",
      "https://www.worldhistory.org/Byzantine_Government",
      "https://www.cambridge.org/core/books/empires-and-bureaucracy-in-world-history/bureaucracies-elites-and-clans-the-case-of-byzantium-c6001100/8AF53D1475991B5E5A0208F89BFCCDA1",
      "https://digitalcommons.winthrop.edu/medievalmanuscript/6/#:~:text=Corpus%20Juris%20Civilis%20is%20the,Justinian%20Code%2C%20and%20the%20Novels.",
      "https://scholarship.law.wm.edu/libpubs/118",
      "https://en.wikipedia.org/wiki/Corpus_Juris_Civilis",
      "https://courses.lumenlearning.com/atd-herkimer-westerncivilization/chapter/the-justinian-code",
      "https://en.wikipedia.org/wiki/Byzantine_law",
      "https://www.reddit.com/r/byzantium/comments/1h8d4jp/who_was_the_most_significant_byzantine_emperor_in",
      "https://www.cambridge.org/core/books/cambridge-companion-to-roman-law/law-of-new-rome-byzantine-law/D91318B011CE39A05C841836FF622ADA#:~:text=Byzantine%20law%20was%20founded%20not,not%20connected%20with%20Roman%20law.",
      "https://library.fiveable.me/early-world-civilizations/unit-14/justinians-reign-legal-reforms/study-guide/zXbrttCDOuUB6em0",
      "https://www.cambridge.org/core/books/cambridge-companion-to-roman-law/law-of-new-rome-byzantine-law/D91318B011CE39A05C841836FF622ADA",
      "https://max-eup2012.mpipriv.de/index.php/Corpus_Juris_Civilis",
      "https://www.britannica.com/biography/Justinian-I/Internal-policy",
      "https://www.byzantinetradition.org/historical-development/from-the-roman-empire-to-byzantium",
      "https://www.metmuseum.org/essays/the-byzantine-state-under-justinian-i-justinian-the-great",
      "https://www.britannica.com/topic/caesaropapism#:~:text=caesaropapism%2C%20political%20system%20in%20which,Roman%2C%20or%20Byzantine%2C%20Empire.",
      "https://www.britannica.com/topic/caesaropapism",
      "https://library.fiveable.me/key-terms/hs-honors-world-history/caesaropapism",
      "https://www.youtube.com/watch?v=sMC8O-emses"
    ],
    "observation_2": "I've identified a minor technical issue in my previous attempt to gather information. I'm now refining my browsing queries to be more precise and targeted, ensuring I extract the specific comparative information needed for a thorough analysis of the Roman and Eastern Roman Empires' political and legal systems. This will help me gather the most relevant details efficiently.",
    "plan_3": {
      "title": "Next Steps: Targeted Information Gathering",
      "description": "My immediate next step is to execute these refined browsing queries. This will allow me to gather detailed information on the political and legal aspects of both empires, which is crucial for building a comprehensive comparison. Once the information is collected, I will synthesize and analyze it to highlight the similarities and differences."
    },
    "search_3": [
      "https://www.britannica.com/topic/Basilica-Byzantine-law",
      "https://en.wikipedia.org/wiki/Byzantine_bureaucracy_and_aristocracy",
      "https://en.wikipedia.org/wiki/Byzantine_law",
      "https://www.worldhistory.org/Byzantine_Government"
    ],
    "observation_3": "I've made significant progress in understanding the political and legal systems of both the Roman and Eastern Roman Empires. I now have a clearer picture of how imperial authority evolved from the 'republican fiction' of the Roman Principate to the 'divine right' concept in the Byzantine Empire. I've also noted the increasing influence of Christian morality on Byzantine law and the shift from Latin to Greek as the official language of the state.",
    "plan_4": {
      "title": "Addressing Information Gaps\nRefining Research for Deeper Analysis",
      "description": "While I have a good overview, I've identified some specific areas where I need more detailed information to fully address the user's request. I want to find concrete examples of how Christian morality impacted specific Byzantine laws, gain a deeper understanding of the administrative continuity and changes in the Byzantine bureaucracy compared to its Roman predecessor, and explore the ideological concept of 'symphony' between church and state in Byzantium.\nMy next steps will involve targeted research to fill these gaps. I will conduct additional searches and browse academic sources to gather specific examples and details on the practical impact of Christian morality on Byzantine law, the evolution of administrative structures, and the concept of 'symphony.' This will allow me to synthesize a comprehensive and well-supported analysis of how the Eastern Roman Empire preserved and transformed its Roman legacy."
    },
    "search_4": [
      "https://www.britannica.com/topic/Basilica-Byzantine-law",
      "https://en.wikipedia.org/wiki/Basilika",
      "https://academic.oup.com/jcs/article/59/2/280/2805468#:~:text=Symphony%20meant%20other%20things%2C%20such,Byzantine%20political%20philosophy%20and%20practice.",
      "https://en.wikipedia.org/wiki/Symphonia_(theology",
      "http://orthodoxinfo.com/general/history3.aspx",
      "https://rlo.acton.org/archives/56363-fr-michael-butler-orthodoxy-church-and-state.html",
      "https://politicaltheology.com/russias-unfinished-symphony-of-church-and-state",
      "https://scholarsarchive.byu.edu/cgi/viewcontent.cgi?article=2301&context=ccr",
      "https://www.cambridge.org/core/journals/journal-of-law-and-religion/article/churchstate-symphonia-its-historical-development-and-its-applications-by-the-russian-orthodox-church/93B4C1ADB2B7EB10FBB29ADD321FE9F6",
      "https://www.geeksforgeeks.org/social-science/byzantine-empire-vs-roman-empire",
      "https://en.wikipedia.org/wiki/Byzantine_bureaucracy_and_aristocracy",
      "https://www.marketsandmorality.com/index.php/mandm/article/viewFile/981/882",
      "https://istanbultarihi.ist/405-politics-and-society-in-the-early-byzantine-capital-330-565",
      "https://www.reddit.com/r/byzantium/comments/18y9udr/why_was_byzantium_so_centralized_compare_to_other",
      "https://en.wikipedia.org/wiki/Role_of_Christianity_in_civilization",
      "https://www.cambridge.org/core/books/cambridge-ancient-history/emperors-government-and-bureaucracy/7B5DD34A6C95AA86CFCAE4B56E06DD34",
      "https://books.openedition.org/efr/10093",
      "https://www.thegospelcoalition.org/blogs/kevin-deyoung/first-sexual-revolution-triumph-christian-morality-roman-empire",
      "https://en.wikipedia.org/wiki/Persecution_of_Christians_in_the_Roman_Empire",
      "https://www.saet.ac.uk/Christianity/UtilitarianismandChristianTheology",
      "https://www.britannica.com/biography/Justinian-I/Ecclesiastical-policy",
      "https://www.britannica.com/biography/Leo-III/Legal-and-other-accomplishments",
      "https://en.wikipedia.org/wiki/Justinian_I",
      "https://fscj.pressbooks.pub/earlyhumanities2ndedition/chapter/justinian-law",
      "https://digitalcommons.liberty.edu/hsgconference/2023/legal_regulatory/4",
      "https://www.britannica.com/topic/Ecloga",
      "https://www.britannica.com/topic/Code-of-Justinian",
      "https://en.wikipedia.org/wiki/Byzantine_law",
      "https://droitromain.univ-grenoble-alpes.fr/Anglica/CJ1_Scott.htm",
      "https://origin.web.fordham.edu/Halsall/basis/Edwin%20Hanson%20Freshfield%20-%20A%20Manual%20of%20Roman%20Law_%20The%20Ecloga1926.pdf",
      "https://origin.web.fordham.edu/halsall/source/ecloga1.asp",
      "https://courses.lumenlearning.com/atd-herkimer-westerncivilization/chapter/byzantiums-legacy"
    ],
    "observation_4": "I have now gathered a substantial amount of information on the political and legal systems of both the Roman and Eastern Roman (Byzantine) Empires. My research has covered the evolution of imperial rule, the role of the Senate and bureaucracy, the sources and development of law, and the significant influence of Christianity and the Greek language in the Byzantine era. I have successfully described the political structures of both empires, outlined the core principles of their legal systems, and gathered information on key legal codifications like the Corpus Juris Civilis, the Ecloga, and the Basilica.",
    "plan_5": {
      "title": "New Insights on Christian Influence\nReady for Synthesis and Report Generation",
      "description": "This latest round of research provided more specific examples of Christian influence on Byzantine law, particularly in areas like marriage, sexual morality, and the mitigation of punishments. I also gained a clearer understanding of the 'symphony' between church and state as a theoretical ideal in Byzantium. This adds depth to my previous understanding of the shift from 'republican fiction' to 'divine right' and the impact of Christian morality.\nI believe I have reached a sufficient level of information saturation to address all aspects of the user's query comprehensively. Further research is unlikely to yield substantially new insights that would alter the fundamental analysis. I have enough material to synthesize the findings and analyze how the Eastern Roman Empire preserved and transformed the Roman legacy. I will now proceed to the final step of completing the research and generating the report."
    }
  },
  "final_report": "# **An Inheritance Transformed: A Comparative Analysis of the Political and Legal Systems of the Roman and Eastern Roman Empires**\n\n## **Introduction**\n\nThis report provides a comprehensive comparative analysis of the political and legal systems of the Roman Empire and its direct successor, the Eastern Roman (Byzantine) Empire. It argues that while the Byzantine Empire was the unbroken legal and political heir to Rome, it did not merely preserve the Roman model. Instead, it fundamentally re-imagined and transformed its inheritance through the powerful lenses of Orthodox Christian theology, Hellenistic political philosophy, and the relentless geopolitical pressures of its millennium-long existence. This analysis traces the evolution from the \"republican fiction\" of the Principate to the divine autocracy of the *Basileus*, and from the classical jurisprudence of Roman jurists to the Christian-infused legal codes of Byzantium. The analysis will demonstrate how the Eastern Empire was both a continuation of Rome and a unique civilization in its own right, Roman in its institutional bones but Christian and Hellenic in its soul.\n\n## **Section 1: The Ideology of Imperial Power: From First Citizen to God's Vice-Regent**\n\nThe foundational principles of imperial authority underwent a profound transformation from the establishment of the Roman Empire to the zenith of its Eastern successor. This evolution traces a clear trajectory from a leader who was notionally \"first among equals\" to an absolute monarch whose legitimacy was derived directly from God, a shift that redefined the nature of the state and the relationship between the ruler and the ruled.\n\n### **1.1 The Roman Emperor: The Transition from *Princeps* to *Dominus***\n\n#### **The Principate (27 BC - 284 AD): An Absolute Monarchy in Republican Garb**\n\nThe political system established by Augustus following the final civil war of the Republic was a work of political genius, what Edward Gibbon famously called \"an absolute monarchy disguised by the forms of a commonwealth\".1 Augustus carefully avoided the title of\n\n*Rex* (king), which was deeply odious to the Roman aristocracy, and instead adopted the unassuming title *Princeps Civitatis*, meaning \"first citizen\".1 This title was intended to convey that he was merely the first among the senators and citizens, preserving the illusion that the Republic continued.1\n\nThe emperor's actual power, however, was immense and rested on a combination of legal authority and personal prestige. He was granted *imperium majus*, an extraordinary power superior to that of other magistrates, and the lifelong powers of a tribune, which gave him the ability to propose legislation and veto the actions of other officials.2 Beyond these formal powers, the true foundation of his rule was\n\n*auctoritas*, a uniquely Roman concept of prestige, influence, and the ability to command obedience through respect.1 Augustus earned this through his military victories, his restoration of peace and stability, and his immense personal wealth, which made him the ultimate source of patronage for the senatorial and equestrian classes.1 To maintain this \"republican fiction,\" the emperor was expected to be a generous benefactor to the people, providing the proverbial \"bread and circuses\" (\n\n*panem et circenses*), and to work in theoretical partnership with the Senate.1\n\n#### **The Dominate (284 AD onwards): The Unveiling of Autocracy**\n\nThe delicate balance of the Principate was shattered by the Crisis of the Third Century, a period of intense civil war, military anarchy, and economic collapse. The system was reconstituted on an explicitly authoritarian basis by Emperor Diocletian, inaugurating the phase known as the Dominate.4 The name itself signifies the change in tone: it derives from the word\n\n*dominus*, meaning \"lord\" or \"master,\" a title previously associated with slave-owners and one that earlier emperors had resisted.4 This marked a definitive ideological shift from the emperor as a constitutional magistrate (\n\n*princeps*) to the emperor as an absolute and divinely-touched ruler (*dominus*).4\n\nThis new ideology was reinforced by elaborate court ceremonies borrowed from Eastern monarchies, most notably *proskynesis*, the act of prostration before the emperor, which emphasized his remote and sacred status.4 Diocletian's reforms created a more centralized and, in many ways, totalitarian state. To manage the vast and troubled empire, he established the Tetrarchy, a system of four rulers with four imperial courts, and dramatically expanded the army and the bureaucracy to enforce the imperial will.4 The republican facade was completely abandoned in favor of open, undisguised autocracy.\n\n### **1.2 The Byzantine *Basileus*: A Synthesis of Roman Autocracy and Christian Divinity**\n\n#### **The Emperor as *Nomos Empsychos* (\"Living Law\")**\n\nThe Byzantine emperor, or *Basileus*, was the ultimate evolution of the Roman *Dominus*, representing a fusion of late Roman autocracy with Orthodox Christian theology and Hellenistic political philosophy.7 His power was understood to be absolute and divinely ordained; he was not merely the head of state but God's chosen vice-regent on Earth, the protector of the Orthodox faith, and the incarnation of the law itself—\n\n*nomos empsychos*.7 This concept elevated the emperor far beyond the status of a mere political leader, imbuing his office with a sacred character. All officials in the vast Byzantine bureaucracy acted not as elected magistrates but as deputies and viceroys of this single, divinely-appointed monarch.7\n\n#### **The Adoption of *Basileus***\n\nWhile the inhabitants of the Eastern Empire always considered themselves Romans (*Romaioi*), the formal adoption of the Greek title *Basileus* (king or emperor) by Emperor Heraclius around 628 AD was a landmark event signifying a cultural and ideological shift.10 The term had ancient roots in the Greek world, but its adoption in a Christian imperial context was profoundly significant.11 It was directly linked to a potent propaganda campaign during the desperate wars against the Sassanian Persians. Heraclius was portrayed as a new David, a Biblical king leading God's chosen people to victory against a formidable foe.10 This narrative fully integrated the imperial office into a Christian theological framework. The emperor's rule over the earthly kingdom (\n\n*basileia*) was now explicitly seen as a reflection of Christ's heavenly kingdom, and the *Basileus* was his earthly representative until the Second Coming.10\n\n#### **Succession: Theory vs. Reality**\n\nThe continuity with the Roman past was maintained through a persistent legal fiction. In theory, the Roman Republic was never formally abolished, and each Byzantine emperor was supposed to be formally elected by the Senate (*Synkletos*) and acclaimed by the army.7 In practice, this was a hollow ceremony. The Senate had become a rubber stamp, and the army held a virtual monopoly on the selection process.7 Dynastic succession became the established convention, with emperors promoting their sons as co-emperors to ensure a smooth transition.12\n\nHowever, this convention was frequently and violently interrupted. The absence of a codified law of succession created a volatile political environment where power was often seized through usurpation, court intrigue, and assassination.13 The successful rise of a usurper, such as the peasant-born Basil I who murdered his predecessor to found the Macedonian dynasty, was often interpreted in hindsight as proof of God's favor, a sign that the new ruler was the true, divinely chosen one.12 This created a system that was simultaneously more theologically rigid in its claims to legitimacy (divine right) and more practically unstable than the Roman Principate, where mechanisms like adoption had been used to formalize succession.14\n\n### **1.3 Comparative Analysis: The Source and Legitimacy of Absolute Rule**\n\nThe transition from the Roman *Princeps* to the Byzantine *Basileus* reveals a fundamental shift in the conceptual basis of absolute power. The authority of the *Princeps* was a complex tapestry woven from legal precedent (*imperium majus*), military command, and the carefully maintained political fiction of republican continuity.1 He was a magistrate who became a god only upon his death through senatorial decree. The authority of the Byzantine\n\n*Basileus*, by contrast, absorbed these elements into an all-encompassing theological framework. His power was not granted by the Senate or the people but was bestowed directly by God.7 He was God's living representative from the moment of his coronation, and his every act was imbued with divine sanction.\n\nThis evolution was not a sudden break but a gradual process. The Dominate of Diocletian served as a crucial ideological catalyst. By stripping away the \"republican fiction\" of the Principate, Diocletian's reforms resolved the inherent contradiction of an autocrat pretending to be a first citizen.4 This move to open autocracy, however, left a legitimacy vacuum. If power no longer derived from the \"Senate and People of Rome,\" its traditional source, then from where did it come? Christianity, with its concept of one God in heaven, provided the perfect ideological solution: one emperor on Earth, ruling by divine grace.8 Therefore, the Dominate was more than just a pragmatic response to the Third-Century Crisis; it was the essential political step that de-coupled imperial authority from its republican roots, creating the ideological space for Christianity to become the new, and far more absolute, foundation of imperial legitimacy.\n\n| **Table 1: The Evolution of Imperial Authority** |  |  |  |  |\n| --- | --- | --- | --- | --- |\n| **Era** | **Primary Title** | **Ideological Basis** | **Relationship to Senate** | **Source of Law** |\n| **Roman Principate** | *Princeps* (First Citizen) | *Auctoritas*; \"Republican Fiction\"; Merit; Military Might 1 | Theoretical Partner; Conferral of Title; Source of Prestige 3 | Emperor, Senate, Magistrates, Jurists |\n| **Roman Dominate** | *Dominus* (Lord/Master) | Open Autocracy; Divine Association; Military Power 4 | Reduced to Municipal Body of Rome; Politically Irrelevant 15 | Emperor |\n| **Byzantine Empire** | *Basileus* (Emperor) | Divine Right; God's Vice-Regent; *Nomos Empsychos* (Living Law) 7 | Ceremonial Body; Source of Aristocratic Administrators 16 | Emperor (as God's instrument) |\n\n## **Section 2: The Senate: From Political Partner to Ceremonial Body**\n\nThe history of the Roman and Byzantine Senates is a clear illustration of the concentration of power in the hands of the emperor. The institution, once the heart of the Roman Republic, followed a long, steady trajectory of decline, its political authority eroding until it was left as a prestigious but largely powerless shell, a symbol of a past it no longer embodied.\n\n### **2.1 The Senate in Rome: A Trajectory of Diminishing Authority**\n\n#### **Republican Heritage**\n\nDuring the Roman Republic, the Senate was the preeminent political body. Though technically an advisory council, its collective prestige and the experience of its members gave it immense authority (*auctoritas*). It controlled state finances, directed foreign policy and military strategy, and administered the growing number of provinces.15 Its decrees, the\n\n*senatus consulta*, while formally \"advice\" to a magistrate, were almost always obeyed in practice.15\n\n#### **The Principate**\n\nWith the rise of Augustus, the Senate's role changed dramatically. Understanding the need to maintain the \"republican fiction,\" Augustus deliberately preserved the Senate as a visible institution of government.2 It retained a portfolio of real, albeit circumscribed, functions. The Senate continued to pass decrees that had the force of law, served as a high court for important criminal trials, managed certain provinces, and, most critically, held the formal power to confer the title of emperor on a new ruler.3 This last power ensured that the Senate remained relevant, as an emperor's legitimacy was not fully secure without its official sanction.3\n\nHowever, the constitutional balance of power had irrevocably shifted. The emperor held the true power of the state: he commanded the legions, controlled the treasury, and could effectively dictate the Senate's actions by proposing legislation and appointing new senators who were loyal to him.3 As such, membership in the Senate increasingly became a goal for those seeking social standing and prestige rather than a platform for exercising actual political authority.19\n\n#### **The Dominate**\n\nThe final blow to the Roman Senate's political relevance came with the reforms of Diocletian. By establishing new imperial capitals closer to the frontiers (such as Nicomedia, Milan, and Trier) and formalizing the emperor's autocratic status, Diocletian severed the state's dependence on the city of Rome.4 The Senate was left behind, becoming politically irrelevant and reduced to the status of a purely municipal council for the old capital, its once empire-spanning authority gone forever.15\n\n### **2.2 The Senate of Constantinople: An Imperial Aristocracy**\n\n#### **A New Creation**\n\nWhen Constantine the Great founded his new capital, Constantinople, he established a new Senate modeled on its Roman predecessor.16 This was not an ancient institution with a legacy of independent power, but a body created from the outset by the emperor. Its members were not the descendants of republican patricians but high-ranking state officials, military commanders, and wealthy landowners drawn from the imperial aristocracy, all appointed by the emperor.16\n\n#### **Ceremonial and Advisory Role**\n\nThe Byzantine Senate, or *Synkletos*, never possessed the political power of its republican ancestor. Its role was primarily ceremonial and advisory.7 The emperor was, in theory, supposed to consult this body—particularly its inner circle of senior members, the\n\n*sacrum consistorium*—on matters of state importance, but he was under no obligation to follow its advice and held the ultimate power of decision.16 The Senate's practical functions were limited. It served as the highest court of the empire for cases of high treason and, importantly, acted as the primary pool of talent from which the emperor recruited his top ministers, generals, and provincial governors.16 Its role in \"electing\" a new emperor, like that of the late Roman Senate, was a constitutional formality that merely ratified a decision already made by the army or through court intrigue.7\n\n### **2.3 Comparative Analysis: The Devolution of a Republican Pillar**\n\nBoth the Roman Senate in the West and the *Synkletos* in the East followed a similar path of devolution from a center of political power to a body of ceremonial prestige. The key difference between them lies in their origins and, consequently, their ideological significance. The Roman Senate was a powerful vestige of a republican past that the emperors of the Principate had to carefully manage, co-opt, and neutralize. Its existence was a constant, if faint, reminder of a time before autocracy. The Byzantine Senate, in contrast, was a creation of the imperial system from its inception. It was designed to be an ornament of the autocracy, not a check upon it. Its purpose was to provide a class of administrators and to lend an air of Roman tradition to the new capital, not to share in governance.\n\nThe survival of the Senate in both empires, long after its political obsolescence, speaks to its enduring ideological function. For the emperors of the Principate, the Senate was the most important prop for the \"republican fiction\" that legitimized their rule.1 Without the Senate's formal approval, an emperor was little more than a successful warlord. For the Byzantine emperors, the creation of a \"New Senate\" in Constantinople was a powerful statement of legitimacy and continuity. It was a tangible symbol that their new city was the true \"New Rome,\" inheriting all the ancient institutions and glory of the original.16 In both cases, the Senate was less a partner in power and more a crucial piece of political theater, used first to mask the birth of an autocracy in Rome, and later to anchor a new capital in the deep-rooted traditions of the Roman past.\n\n## **Section 3: The Administrative State: Governing the Empire**\n\nThe governance of a vast, multi-ethnic empire presented immense logistical challenges that both the Roman and Byzantine states sought to solve through sophisticated administrative systems. While the Byzantine bureaucracy was a direct descendant of the Roman model, it evolved in fundamentally different ways, adapting its structure to reflect a new set of military, fiscal, and political realities.\n\n### **3.1 Roman Provincial Administration: A System of Delegated Authority**\n\n#### **Republic to Principate**\n\nThe Roman system of provincial administration (*provinciae*) was developed ad hoc during the Republic as Rome conquered new territories outside of Italy.14 It was under Augustus that this system was rationalized and formalized. He divided the provinces into two categories: Senatorial and Imperial.21 The Senatorial provinces were peaceful, stable territories governed by proconsuls appointed by the Senate for an annual term.14 The Imperial provinces, however, were the strategically vital frontier territories that housed the bulk of the Roman legions. These were governed by legates (\n\n*legati Augusti pro praetore*) who were personally appointed by the emperor and served at his pleasure.21 This clever division ensured that the emperor maintained direct control over the empire's military power, while allowing the Senate to retain a semblance of its traditional administrative role.1 The primary duties of a provincial governor were to maintain order, administer justice, and oversee the collection of taxes, often relying on local elites to act as intermediaries.21\n\n#### **The Diocletianic Reforms**\n\nThe administrative structure of the Principate was radically overhauled by Diocletian at the end of the third century. To increase central control, combat corruption, and reduce the power of provincial governors, he implemented a series of sweeping reforms. He more than doubled the number of provinces by subdividing existing ones, making them smaller and more manageable.4 These provinces were then grouped into twelve larger units called dioceses, each overseen by a\n\n*vicarius*, and the dioceses were in turn grouped into four massive praetorian prefectures.4\n\nThe most crucial innovation of this system was the strict separation of civil and military authority.4 Each province now had a civil governor (\n\n*praeses* or *comes*) responsible for justice and finance, while military forces within the province were commanded by a separate official, the *dux*.4 This division of power was a deliberate strategy to prevent any single official from amassing enough military and financial resources to launch a rebellion, a constant threat during the preceding fifty years of crisis.\n\n### **3.2 Byzantine Administration: The Centralized and Militarized *Thema* System**\n\n#### **From Diocletian to Justinian**\n\nThe early Byzantine Empire directly inherited the late Roman administrative model established by Diocletian and Constantine, with its hierarchy of prefectures, dioceses, and provinces.7 This system began to fray under Justinian I in the 6th century. Faced with unrest and the need for more efficient governance in newly reconquered or threatened territories, Justinian began to experiment with reuniting civil and military authority in the hands of a single governor in certain provinces, a clear departure from the Diocletianic principle.24\n\n#### **The Rise of the *Themata***\n\nThe 7th century brought an existential crisis. The rapid Muslim conquests stripped the empire of its wealthiest provinces in the East and South, while Slavic and Avar invasions overran the Balkans.24 In response to this immense pressure, the old administrative system collapsed and was replaced by a radical new structure: the\n\n*thema* system.16 A\n\n*thema* (theme) was a large administrative district where a field army was permanently settled. The commander of that army, the *strategos* (general), was also the supreme civil governor of the territory, reporting directly to the emperor.7\n\nThis system was a complete reversal of Diocletian's core principle. It concentrated military, fiscal, and judicial power in the hands of a single official, creating highly militarized, self-sufficient administrative zones capable of mounting a rapid defense against invaders without waiting for complex orders from the central government.7 The\n\n*strategos* acted as the emperor's viceroy in his theme, enjoying immense power.7\n\n#### **The Central Bureaucracy**\n\nComplementing the provincial administration was a large, complex, and highly centralized bureaucracy based in Constantinople.7 This professional civil service, a direct legacy of the late Roman state, was one of the empire's greatest strengths.26 Powerful ministers, such as the\n\n*logothetes*, oversaw vast departments responsible for finance (*logothetes tou genikou*), the military payroll (*logothetes tou stratiotikou*), and foreign affairs and internal security (*logothetes tou dromou*).13 This efficient, salaried bureaucracy allowed for consistent tax collection and governance, providing a level of stability that enabled the empire to endure centuries of crises, invasions, and internal turmoil.28\n\n### **3.3 Comparative Analysis: Evolving Structures of Imperial Control**\n\nThe administrative evolution from the Roman to the Byzantine model reveals a telling shift in imperial priorities. The late Roman system, forged by Diocletian in the aftermath of the Third-Century Crisis, was primarily designed to ensure internal security. Its main goal was to prevent rebellion by dividing power and creating multiple, overlapping chains of command. The Byzantine *thema* system, born out of the desperate struggle for survival in the 7th century, prioritized external defense above all else. Its main goal was to ensure a swift and effective military response to invasion by concentrating power in the hands of regional generals. The Roman system was a complex web of delegated and divided authority; the Byzantine system became a more direct, militarized chain of command flowing from the emperor to his *strategoi*.\n\nThis administrative evolution was not arbitrary but a rational, adaptive response to a fundamental change in the empire's primary existential threat. Where Diocletian's greatest fear was the ambitious Roman general, Heraclius's successors' greatest fear was the Arab or Bulgar army at the gates.\n\nFurthermore, the Byzantine state's preservation and refinement of the late Roman professional bureaucracy was a critical point of continuity and a major divergence from the path taken in Western Europe. While political power in the West became increasingly decentralized and personalized in a feudal system, Byzantine power remained institutionalized and centralized.29 In the West, a lord's authority was tied to his land and personal oaths of fealty. In Byzantium, owning vast estates did not automatically grant one legal or military authority; these were separate rights granted by the state through official appointment.29 Tax revenues flowed to the imperial treasury in Constantinople, not to local magnates, funding a professional army and civil service.29 This created what one Byzantine historian called a \"continuing bureaucratic structure going beyond affinities with individual emperors,\" an impersonal and \"immortal\" state apparatus that could function regardless of who sat on the throne.28 This institutional resilience, a direct inheritance from Rome, is arguably the single most important factor explaining Byzantium's remarkable thousand-year survival.\n\n## **Section 4: The Legal System: Codification, Language, and Interpretation**\n\nThe legal system of the Eastern Roman Empire was, at its core, a direct continuation of Roman law. The Byzantines saw themselves as the inheritors and custodians of this profound legal tradition. However, this inheritance was not passively received; it was actively reinterpreted, codified, and transformed by the dominant cultural and religious forces of the East—the Greek language and Orthodox Christianity.\n\n### **4.1 The Foundations of Roman Jurisprudence**\n\nRoman law was not a monolithic entity but a complex legal order that developed organically over centuries from a variety of sources (*fontes iuris*).30 The earliest written law was the Law of the Twelve Tables (c. 450 BC), a code enacted to make the law public and prevent arbitrary application by patrician magistrates.31 Over time, other sources emerged, including\n\n*leges* (statutes passed by the popular assemblies), *plebiscita* (resolutions of the plebeian assembly, which gained the force of law), and *senatus consulta* (decrees of the Senate).32\n\n#### **The Role of Magistrates (Praetors)**\n\nOne of the most dynamic sources of legal development was the edicts of the magistrates, particularly the *praetor*.31 The praetor was a judicial officer responsible for the administration of justice in Rome.34 Upon taking office each year, he would issue an edict outlining the legal principles and remedies he would apply during his term.32 While the praetor did not technically create new law, he could grant new legal actions and defenses not found in the old, rigid civil law (\n\n*ius civile*). This body of magistrate-created law, known as the *ius honorarium*, served to supplement, correct, and modernize the *ius civile* for the public good, making it more flexible and equitable.31 The praetor's role was to frame the legal issues of a case in a\n\n*formula*, which was then passed to a lay judge (*iudex*) for a decision on the facts.36\n\n#### **The Role of Jurists (*Prudentes*)**\n\nThe period from roughly 150 BC to 200 AD is considered the classical or mature period of Roman law, an age defined by the brilliant work of legal experts known as jurists (*iuris prudentes*).33 Legal interpretation, once the secretive domain of the priestly college of pontiffs, became a secular science practiced by a class of highly respected legal advisors.37 These jurists were not practicing lawyers in the modern sense; they were legal scholars who gave legal opinions (\n\n*responsa*) to citizens and magistrates, taught students, and wrote extensive treatises on the law.39 Through their systematic analysis and interpretation, they transformed Roman law from a collection of rules into a sophisticated and rational legal science.39 Their written opinions became a highly authoritative source of law, so much so that by the 2nd century AD, the emperor was effectively the sole legislator, but his legislation was deeply informed by the work of these jurists.32\n\n### **4.2 The Justinianic Revolution: The *Corpus Juris Civilis***\n\nBy the 6th century AD, a millennium of Roman legal development had produced a bewildering mass of statutes, edicts, and juristic writings, many of which were contradictory, obsolete, or difficult to access.41 Shortly after ascending the throne, Emperor Justinian I embarked on a monumental project to bring order to this chaos by compiling, rationalizing, and codifying the entirety of Roman law.25 This ambitious undertaking, supervised by his brilliant quaestor Tribonian, resulted in the\n\n*Corpus Juris Civilis* (\"Body of Civil Law\"), the single most important legal text in Western history.44\n\nThe *Corpus Juris Civilis* consists of four distinct but integrated parts 44:\n\n1. **The *Codex Constitutionum***: First published in 529 and revised in 534, the *Codex* was a comprehensive collection of all valid imperial laws (*constitutiones*), systematically arranged by topic. It eliminated contradictions and repealed all obsolete legislation.46\n2. **The *Digesta* (or *Pandects*)**: Completed in 533, the *Digesta* is the intellectual heart of the *Corpus*. It is a vast anthology of excerpts—over 9,000 of them—from the writings of the great classical jurists like Ulpian, Papinian, and Paul. Justinian gave these juristic opinions, which had previously been private scholarly work, the full force of law.46\n3. **The *Institutiones***: Also published in 533, the *Institutiones* was an official introductory textbook for first-year law students, providing a systematic overview of the principles of Roman law. It was largely based on the earlier Institutes of the jurist Gaius.41\n4. **The *Novellae***: Meaning \"new laws,\" the *Novellae* is a collection of the legislation promulgated by Justinian himself after the publication of the revised *Codex* in 534. Unlike the other three parts, which were written in Latin, the *Novellae* were mostly issued in Greek, the common language of the Eastern Empire.41\n\nThe *Corpus Juris Civilis* was a landmark achievement. It preserved the rich legacy of Roman jurisprudence for posterity and became the bedrock of all subsequent Byzantine law.9 Following its rediscovery in Italy during the Middle Ages, it became the foundation for the legal systems of continental Europe and, by extension, much of the modern world.49\n\n### **4.3 The Hellenization of Law: The *Ecloga* and the *Basilica***\n\nJustinian's codification was both an end and a beginning. It was the ultimate achievement of classical Roman legal science, a monumental act of preservation. Yet, by \"freezing\" the law in a definitive text and giving the opinions of past jurists the force of statute, it effectively ended the dynamic, interpretive legal process that had created it. The creative age of the praetor and the jurist was over; the age of the code had begun.\n\n#### **The Language Barrier and Legal Simplification**\n\nThe *Corpus Juris Civilis* was also the last great legal work of the Roman world written in Latin.9 In the centuries after Justinian, knowledge of Latin faded rapidly in the Greek-speaking East, rendering the complex Latin of the\n\n*Corpus* largely inaccessible to judges and lawyers.9 Legal practice grew more pragmatic, relying on simplified summaries, commentaries, and new handbooks written in Greek.9\n\n#### **The *Ecloga* (726 AD)**\n\nIn 726, Emperor Leo III (the Isaurian) issued the *Ecloga* (\"Selection\"), the first major Byzantine law code promulgated in Greek.9 It was not a comprehensive restatement of the law but a concise, practical manual intended for use by judges.52 The\n\n*Ecloga* represented a conscious revision of Justinianic law, with its preface declaring an intention to amend the law \"towards a more philanthropic version,\" reflecting the growing influence of Christian principles.9\n\n#### **The *Basilica* (c. 892 AD)**\n\nThe culmination of this process of Hellenization was the *Basilica* (\"Imperial Laws\"). Initiated by Emperor Basil I, who was called the \"second Justinian\" for his legislative work, and completed by his son Leo VI the Wise, the *Basilica* was a massive, comprehensive codification of Byzantine law in sixty books, written entirely in Greek.12 It was far more systematically arranged than the\n\n*Corpus Juris Civilis*, integrating the material from the *Codex*, *Digesta*, and *Novellae* into a single, cohesive work and updating it with later legislation.55 The\n\n*Basilica* superseded all previous law books and became the foundation of Byzantine jurisprudence for the remaining centuries of the empire's existence.12\n\nWhile Roman law was intensely practical, Byzantine legal codes served a dual purpose. They were indeed practical manuals for a functioning legal system, but they were also ideological and ceremonial instruments. The preambles and content of codes like the *Ecloga* and *Basilica* are replete with theological justifications, framing the emperor's legislative activity as a sacred duty performed as God's representative.9 This reflects the concept of the\n\n*Basileus* as *nomos empsychos*. Issuing law was a performance of his divine role, intended to project an image of a perfectly ordered Christian society. This created a system where the formal, written law could be an idealized statement of principles, while day-to-day justice, particularly in the provinces, might rely on more simplified vernacular laws like the *Farmer's Law* or *Sea Law*.9 This two-tiered nature of law—a high-level ideological codification and a low-level practical application—distinguishes the Byzantine legal mindset from the more unified, pragmatic focus of classical Roman law.\n\n| **Table 2: A Comparative Timeline of Major Legal Codifications** |  |  |  |  |  |\n| --- | --- | --- | --- | --- | --- |\n| **Code** | **Date** | **Originating Authority** | **Language** | **Primary Goal** | **Key Innovations** |\n| **Law of the Twelve Tables** | c. 450 BC | Decemviri (Republic) | Latin | Publicize law; prevent arbitrary judgments 31 | First written codification of Roman law. |\n| **Praetorian Edict** | c. 367 BC onwards | Praetors (Republic/Empire) | Latin | Supplement and correct civil law for equity 31 | Created the flexible *ius honorarium*. |\n| **Codex Theodosianus** | 438 AD | Theodosius II | Latin | Collect all imperial laws since Constantine I 9 | First major official imperial codification. |\n| ***Corpus Juris Civilis*** | 529-534 AD | Justinian I | Latin | Codify and preserve the entire Roman legal heritage 25 | Definitive codification; gave jurists' opinions force of law. |\n| ***Ecloga*** | 726 AD | Leo III | Greek | Create a practical, concise manual for judges 52 | First major Greek code; infused with Christian \"philanthropy.\" |\n| ***Basilica*** | c. 892 AD | Basil I & Leo VI | Greek | Systematically restate all Byzantine law in Greek 54 | Integrated Justinian's works into a single, organized code. |\n\n## **Section 5: The Christian Revolution: Reshaping Law and State**\n\nThe most profound and defining difference between the classical Roman Empire and its Eastern successor was the pervasive influence of Christianity. The adoption of Christianity as the state religion did not merely add a new element to the imperial system; it fundamentally remade the ideological foundations of the state, redefined the purpose of law, and created a unique relationship between secular and spiritual authority that had no precedent in the ancient world.\n\n### **5.1 The Relationship Between Church and State: *Symphonia* and Caesaropapism**\n\n#### **Roman State Religion**\n\nThe pre-Christian Roman state was deeply religious, but its religion was a public, civic affair. The worship of the traditional Greco-Roman gods, and later the deified emperors (the imperial cult), was a matter of civic duty and a demonstration of political loyalty to the state.57 This system was generally tolerant of other faiths, provided their adherents also participated in the state cults. The monotheism of Christians (and Jews), however, made this impossible. Their refusal to sacrifice to the Roman gods and emperor was seen not as a matter of private conscience but as an act of treason (\n\n*maiestas*), leading to sporadic but sometimes severe persecution.57\n\n#### **Byzantine Caesaropapism and the Ideal of *Symphonia***\n\nThe conversion of Constantine and the eventual establishment of Christianity as the state religion under Theodosius I in 380 AD inverted this relationship.57 In the Byzantine Empire, the emperor was not only the supreme secular ruler but also the effective head of the church, a system later termed Caesaropapism.58 The emperor was seen as the protector of the universal church and the manager of its administrative affairs.59 He had the authority to convene ecumenical councils, his will was often decisive in the appointment of the Patriarch of Constantinople, and he viewed it as his imperial duty to uphold Orthodox doctrine and suppress heresy through legislation.25\n\nThe theoretical model developed to describe this uniquely integrated relationship was *symphonia*, or \"harmony\".62 As articulated in Justinian's laws,\n\n*symphonia* posited that the priesthood (*sacerdotium*) and the imperial power (*imperium*) were the two greatest gifts of God to humanity. They were two distinct elements within a single, unified Christian society, destined to work in close cooperation for the spiritual and material well-being of mankind.62 In theory, this was a partnership of interdependent equals; in practice, the emperor's authority was almost always dominant, making him the senior partner in the \"symphony\".59 This model provided a powerful theological solution to the conflict that had defined Christian-Roman relations for three centuries. By fusing church and state into a single organism with the emperor at its head, loyalty to the state and loyalty to the church became one and the same.\n\n### **5.2 The Imprint of Christian Morality on Byzantine Law**\n\nThe Christianization of the empire led to a profound shift in legal philosophy. Byzantine law was Roman law reinterpreted through the lens of Christian ethics.9 The guiding principle was no longer just abstract justice (\n\n*iustitia*) but also *philanthrōpía*—a Christian concept of love for mankind, compassion, and mercy.9 The\n\n*Ecloga* of Leo III explicitly states its purpose as a revision of Roman law based on Christian principles and \"in the direction of humanity\".52 This moral infusion is evident across multiple areas of law.\n\n#### **Family Law and Women's Rights**\n\nChristian teachings on the sanctity of marriage and the spiritual equality of persons before God had a noticeable impact on family law. Justinian's laws, reportedly influenced by his wife, Empress Theodora, introduced significant protections for women. New laws were passed to prohibit forced prostitution, grant women more extensive property rights, allow women to initiate divorce proceedings, ensure that a widow's dowry was returned to her, and prevent a husband from taking on major debt without his wife's consent.41 The\n\n*Ecloga* went further, enhancing the legal rights of both women and children at the expense of the near-absolute power of the father (*patria potestas*) that had been a hallmark of traditional Roman law.52\n\n#### **Sexual Morality**\n\nThe contrast is stark in the realm of sexual morality. Classical Roman morality was highly permissive for freeborn men, based on social status rather than a universal ethic. Sex with slaves, prostitutes, and in some cases, boys, was widely tolerated as a harmless outlet for male desire, so long as it did not involve the wife of another citizen.66 Christianity introduced a revolutionary and austere sexual ethic based on gender and the sanctity of marriage. It promoted an expansive concept of\n\n*porneia* (sexual immorality) that condemned all sexual activity outside of a monogamous, lifelong marriage between a man and a woman.66 This new morality was codified into law. Justinian's legislation criminalized sex between males and implemented strong measures against coerced prostitution, reflecting a complete transformation of the state's view on sexual conduct.66\n\n#### **Criminal Justice**\n\nChristian influence also reshaped criminal law. The *Ecloga* significantly restricted the use of the death penalty for many offenses that were previously capital crimes.52 In its place, it frequently substituted punishments of mutilation, such as blinding, amputation of the hand, or slitting of the nose.52 While horrific to modern sensibilities, these punishments were viewed through a theological lens as a \"philanthropic\" alternative to execution. Mutilation, unlike death, spared the sinner's life, leaving them time to repent for their crimes and potentially achieve salvation, while also serving as a powerful public deterrent.67\n\nThis Christianization of law was, however, a double-edged sword. The same moral impetus that led to what might be considered progressive reforms also introduced a new and systematic form of intolerance into the legal system. While classical Roman law was primarily concerned with a person's actions, Byzantine law became deeply concerned with a person's beliefs. The very first laws in Justinian's *Codex* command all subjects of the empire to adhere to the Catholic (i.e., Orthodox) Christian faith and brand all others as \"demented and insane\" heretics to be punished by the state.68 Justinian's legislation barred pagans and heretics from teaching or holding public office.25 Heresy was no longer just a religious error; it was a crime against the state itself, because in the unified Christian polity of Byzantium, an attack on religious orthodoxy was an attack on the very foundation of the empire.\n\n## **Conclusion: A Roman Legacy, A Byzantine Identity**\n\nThe Eastern Roman Empire stands as one of history's most remarkable examples of continuity and transformation. It was, without question, the direct and unbroken legal, political, and cultural successor to the Roman Empire. Its emperors called themselves *Romaioi*, its capital was the \"New Rome,\" and its legal system was built upon the monumental foundation of Roman jurisprudence. The administrative DNA of the centralized, bureaucratic state, a key factor in its longevity, was a direct inheritance from the reforms of Diocletian and Constantine.\n\nYet, this inheritance was not a static relic. Over the course of a millennium, it was profoundly and irrevocably transformed. The political system evolved from the disguised monarchy of the *Princeps*, who ruled through the fiction of republican consent, to the divinely-sanctioned autocracy of the *Basileus*, who ruled as God's vice-regent on Earth. The administrative state adapted its very structure to meet new existential threats, shifting from a system designed to prevent internal rebellion to one built for perpetual external defense.\n\nMost decisively, the entire edifice of the state and its laws was rebuilt on a new foundation: Orthodox Christianity. The legal system, while founded on Justinian's great codification of Roman law, was reshaped by the adoption of the Greek language and, more importantly, by the infusion of a Christian worldview. This new moral framework, centered on concepts like *philanthrōpía*, redefined the purpose of law, the nature of justice, and the relationship between the ruler and the ruled. It led to both humanitarian reforms and a new, systematic intolerance. The Byzantine Empire was, therefore, far more than simply the \"later Roman Empire.\" It was a unique and brilliant synthesis, a civilization that was Roman in its institutional structure but fundamentally Christian and Hellenic in its soul, its identity, and its ultimate destiny.\n\n#### 引用的著作\n\n1. Principate - Wikipedia, 访问时间为 八月 5, 2025， <https://en.wikipedia.org/wiki/Principate>\n2. Chapter 9: The Roman Empire – Western Civilization: A Concise History, 访问时间为 八月 5, 2025， <https://pressbooks.nscc.ca/worldhistory/chapter/chapter-9-the-roman-empire/>\n3. in the First Century. The Roman Empire. Social Order. Senators - PBS, 访问时间为 八月 5, 2025， <https://www.pbs.org/empires/romans/empire/senators.html>\n4. Dominate in Rome | EBSCO Research Starters, 访问时间为 八月 5, 2025， <https://www.ebsco.com/research-starters/history/dominate-rome>\n5. www.ebsco.com, 访问时间为 八月 5, 2025， <https://www.ebsco.com/research-starters/history/dominate-rome#:~:text=%22Dominate%20in%20Rome%22%20refers%20to,rule%20under%20emperors%20like%20Diocletian.>\n6. Dominate - Wikipedia, 访问时间为 八月 5, 2025， <https://en.wikipedia.org/wiki/Dominate>\n7. Byzantine bureaucracy and aristocracy - Wikipedia, 访问时间为 八月 5, 2025， <https://en.wikipedia.org/wiki/Byzantine_bureaucracy_and_aristocracy>\n8. www.tandfonline.com, 访问时间为 八月 5, 2025， <https://www.tandfonline.com/doi/abs/10.1080/03044181.2014.902398#:~:text=Numerous%20studies%20have%20depicted%20the,legitimate%20Christian%20basileus%20on%20earth.>\n9. Byzantine law - Wikipedia, 访问时间为 八月 5, 2025， <https://en.wikipedia.org/wiki/Byzantine_law>\n10. The Basileus in Byzantium - From the Garden into the City - WordPress.com, 访问时间为 八月 5, 2025， <https://fromthegardenintothecity.wordpress.com/2012/06/19/the-basileus-in-byzantium/>\n11. Basileus - Wikipedia, 访问时间为 八月 5, 2025， <https://en.wikipedia.org/wiki/Basileus>\n12. Basil I - Wikipedia, 访问时间为 八月 5, 2025， <https://en.wikipedia.org/wiki/Basil_I>\n13. Byzantine aristocracy and bureaucracy, 访问时间为 八月 5, 2025， <http://www.mlahanas.de/Greeks/Medieval/LX/ByzantineAaristocracyAndBureaucracy.html>\n14. Province | Origins, Administration & Expansion - Britannica, 访问时间为 八月 5, 2025， <https://www.britannica.com/topic/province-ancient-Roman-government>\n15. Roman Senate - Wikipedia, 访问时间为 八月 5, 2025， <https://en.wikipedia.org/wiki/Roman_Senate>\n16. Byzantine Government - World History Encyclopedia, 访问时间为 八月 5, 2025， <https://www.worldhistory.org/Byzantine_Government/>\n17. Discover the History of the Roman Senate - PBS, 访问时间为 八月 5, 2025， <https://www.pbs.org/articles/learn-about-the-roman-senate>\n18. www.pbs.org, 访问时间为 八月 5, 2025， <https://www.pbs.org/empires/romans/empire/senators.html#:~:text=During%20the%20empire%2C%20the%20senate,Senate%20discussions%2C%20and%20propose%20legislation.>\n19. Senate of the Roman Empire - Wikipedia, 访问时间为 八月 5, 2025， <https://en.wikipedia.org/wiki/Senate_of_the_Roman_Empire>\n20. Roman province - Wikipedia, 访问时间为 八月 5, 2025， <https://en.wikipedia.org/wiki/Roman_province>\n21. Provincial Administration in Ancient Rome - Number Analytics, 访问时间为 八月 5, 2025， <https://www.numberanalytics.com/blog/provincial-administration-ancient-rome>\n22. Provincial Government of the Roman Empire - UNRV.com, 访问时间为 八月 5, 2025， <https://www.unrv.com/government/provincialgovernment.php>\n23. Provincial administration - (Early World Civilizations) - Vocab, Definition, Explanations | Fiveable, 访问时间为 八月 5, 2025， <https://library.fiveable.me/key-terms/early-world-civilizations/provincial-administration>\n24. Subdivisions of the Byzantine Empire - Wikipedia, 访问时间为 八月 5, 2025， <https://en.wikipedia.org/wiki/Subdivisions_of_the_Byzantine_Empire>\n25. Justinian I - Byzantine Emperor, Law Reforms - Britannica, 访问时间为 八月 5, 2025， <https://www.britannica.com/biography/Justinian-I/Internal-policy>\n26. ELI5: Why is 'Byzantine' used to describe excessive bureaucracy? Was Byzantium really an administrative mess? : r/explainlikeimfive - Reddit, 访问时间为 八月 5, 2025， <https://www.reddit.com/r/explainlikeimfive/comments/1bdty9x/eli5_why_is_byzantine_used_to_describe_excessive/>\n27. Bureaucracies, Elites and Clans: The Case of Byzantium, c.600–1100 (Chapter 7), 访问时间为 八月 5, 2025， <https://www.cambridge.org/core/books/empires-and-bureaucracy-in-world-history/bureaucracies-elites-and-clans-the-case-of-byzantium-c6001100/8AF53D1475991B5E5A0208F89BFCCDA1>\n28. Impersonal Governance in Byzantium: Bureaucracy, Friendship, and Psellos' Letters - Greek, Roman, and Byzantine Studies, 访问时间为 八月 5, 2025， <https://grbs.library.duke.edu/index.php/grbs/article/download/17047/7593/23048>\n29. Why was Byzantium so centralized compare to other eroupean kingdoms and empires - Reddit, 访问时间为 八月 5, 2025， <https://www.reddit.com/r/byzantium/comments/18y9udr/why_was_byzantium_so_centralized_compare_to_other/>\n30. Roman Law, 访问时间为 八月 5, 2025， [https://www.ius.uzh.ch/dam/jcr:b201fd7a-c57e-43e6-abc5-5259609becb1/H%C3%A4usler\\_Roman%20Law\\_Introduction%20to%20Swiss%20law\\_draft.pdf](https://www.ius.uzh.ch/dam/jcr%3Ab201fd7a-c57e-43e6-abc5-5259609becb1/H%C3%A4usler_Roman%20Law_Introduction%20to%20Swiss%20law_draft.pdf)\n31. Roman law - Wikipedia, 访问时间为 八月 5, 2025， <https://en.wikipedia.org/wiki/Roman_law>\n32. Roman law | Influence, Importance, Principles, & Facts - Britannica, 访问时间为 八月 5, 2025， <https://www.britannica.com/topic/Roman-law>\n33. Sources of Law from the Republic to the Dominate (Chapter 3) - Cambridge University Press, 访问时间为 八月 5, 2025， <https://www.cambridge.org/core/books/cambridge-companion-to-roman-law/sources-of-law-from-the-republic-to-the-dominate/561AB3827959381F24D798A498298795>\n34. Praetor | Magistrate, Law & Jurisdiction | Britannica, 访问时间为 八月 5, 2025， <https://www.britannica.com/topic/praetor>\n35. Roman Praetors | UNRV Roman History, 访问时间为 八月 5, 2025， <https://www.unrv.com/government/praetors.php>\n36. What is praetor? Simple Definition & Meaning - LSD.Law, 访问时间为 八月 5, 2025， <https://lsd.law/define/praetor>\n37. Interpretation and Legal Reasoning in Roman Law, 访问时间为 八月 5, 2025， <https://scholarship.kentlaw.iit.edu/cgi/viewcontent.cgi?article=2999&context=cklawreview>\n38. Lawyers and Jurists - Digital Commons @ Georgia Law, 访问时间为 八月 5, 2025， <https://digitalcommons.law.uga.edu/cgi/viewcontent.cgi?article=1051&context=gjicl>\n39. The evolution of Roman law and jurisprudence (Chapter 8) - Cambridge University Press, 访问时间为 八月 5, 2025， <https://www.cambridge.org/core/books/law-and-power-in-the-making-of-the-roman-commonwealth/evolution-of-roman-law-and-jurisprudence/AF3E906F977B3AA169B94D3635DD3144>\n40. View of Jurists and Political Authority in Ancient Rome | Acta Universitatis Danubius. Juridica, 访问时间为 八月 5, 2025， <https://dj.univ-danubius.ro/index.php/AUDJ/article/view/524/1082>\n41. The Justinian Code | Western Civilization - Lumen Learning, 访问时间为 八月 5, 2025， <https://courses.lumenlearning.com/atd-herkimer-westerncivilization/chapter/the-justinian-code/>\n42. Who was the most significant Byzantine Emperor in terms of legislative reform? - Reddit, 访问时间为 八月 5, 2025， <https://www.reddit.com/r/byzantium/comments/1h8d4jp/who_was_the_most_significant_byzantine_emperor_in/>\n43. From the Roman Empire to Byzantium - Byzantine Tradition, 访问时间为 八月 5, 2025， <https://www.byzantinetradition.org/historical-development/from-the-roman-empire-to-byzantium>\n44. Corpus Juris Civilis - Max-EuP 2012, 访问时间为 八月 5, 2025， <https://max-eup2012.mpipriv.de/index.php/Corpus_Juris_Civilis>\n45. digitalcommons.winthrop.edu, 访问时间为 八月 5, 2025， <https://digitalcommons.winthrop.edu/medievalmanuscript/6/#:~:text=Corpus%20Juris%20Civilis%20is%20the,Justinian%20Code%2C%20and%20the%20Novels.>\n46. Corpus Juris Civilis - Wikipedia, 访问时间为 八月 5, 2025， <https://en.wikipedia.org/wiki/Corpus_Juris_Civilis>\n47. Code of Justinian | Definition & Creation - Britannica, 访问时间为 八月 5, 2025， <https://www.britannica.com/topic/Code-of-Justinian>\n48. Roman law - Rechtshistorie, 访问时间为 八月 5, 2025， <http://www.rechtshistorie.nl/en/roman-law>\n49. \"The Corpus Juris Civilis\" by Frederick W. Dingledy - Scholarship Repository, 访问时间为 八月 5, 2025， <https://scholarship.law.wm.edu/libpubs/118/>\n50. Justinian's reign and legal reforms | Early World Civilizations Class Notes - Fiveable, 访问时间为 八月 5, 2025， <https://library.fiveable.me/early-world-civilizations/unit-14/justinians-reign-legal-reforms/study-guide/zXbrttCDOuUB6em0>\n51. Justinian I - Wikipedia, 访问时间为 八月 5, 2025， <https://en.wikipedia.org/wiki/Justinian_I>\n52. Ecloga | Byzantine Empire, Justinian Code, Roman Law - Britannica, 访问时间为 八月 5, 2025， <https://www.britannica.com/topic/Ecloga>\n53. A MANUAL OF ROMAN LAW THE ECLOGA - Fordham University, 访问时间为 八月 5, 2025， <https://origin.web.fordham.edu/Halsall/basis/Edwin%20Hanson%20Freshfield%20-%20A%20Manual%20of%20Roman%20Law_%20The%20Ecloga1926.pdf>\n54. www.britannica.com, 访问时间为 八月 5, 2025， <https://www.britannica.com/topic/Basilica-Byzantine-law#:~:text=Basilica%2C%20(from%20Greek%20basilikos%2C,son%20Leo%20VI%20the%20Wise.>\n55. Basilica | Byzantine Empire, Roman Empire, Legal System | Britannica, 访问时间为 八月 5, 2025， <https://www.britannica.com/topic/Basilica-Byzantine-law>\n56. Basilika - Wikipedia, 访问时间为 八月 5, 2025， <https://en.wikipedia.org/wiki/Basilika>\n57. Persecution of Christians in the Roman Empire - Wikipedia, 访问时间为 八月 5, 2025， <https://en.wikipedia.org/wiki/Persecution_of_Christians_in_the_Roman_Empire>\n58. www.britannica.com, 访问时间为 八月 5, 2025， <https://www.britannica.com/topic/caesaropapism#:~:text=caesaropapism%2C%20political%20system%20in%20which,Roman%2C%20or%20Byzantine%2C%20Empire.>\n59. Caesaropapism | Byzantine Empire, Autocracy & Ecclesiastical Power, 访问时间为 八月 5, 2025， <https://www.britannica.com/topic/caesaropapism>\n60. Caesaropapism - (Honors World History) - Vocab, Definition, Explanations | Fiveable, 访问时间为 八月 5, 2025， <https://library.fiveable.me/key-terms/hs-honors-world-history/caesaropapism>\n61. Justinian I - Ecclesiastical Reform, Byzantine Empire, Law | Britannica, 访问时间为 八月 5, 2025， <https://www.britannica.com/biography/Justinian-I/Ecclesiastical-policy>\n62. Symphonia (theology) - Wikipedia, 访问时间为 八月 5, 2025， [https://en.wikipedia.org/wiki/Symphonia\\_(theology)](https://en.wikipedia.org/wiki/Symphonia_%28theology%29)\n63. A History of the Orthodox Church: The Church of Imperial Byzantium, 访问时间为 八月 5, 2025， <http://orthodoxinfo.com/general/history3.aspx>\n64. Fr. Michael Butler: Orthodoxy, Church, and State - Religion & Liberty Online - Acton Institute, 访问时间为 八月 5, 2025， <https://rlo.acton.org/archives/56363-fr-michael-butler-orthodoxy-church-and-state.html>\n65. 2021-2024: Christian Influence on Roman Natural Law in the Corpus Juris Civilis - Scholars Crossing, 访问时间为 八月 5, 2025， <https://digitalcommons.liberty.edu/hsgconference/2023/legal_regulatory/4/>\n66. The First Sexual Revolution: The Triumph of Christian Morality in the Roman Empire, 访问时间为 八月 5, 2025， <https://www.thegospelcoalition.org/blogs/kevin-deyoung/first-sexual-revolution-triumph-christian-morality-roman-empire/>\n67. Medieval Sourcebook: The Ecloga on Sexual Crimes (8th Cent.) - Fordham University, 访问时间为 八月 5, 2025， <https://origin.web.fordham.edu/halsall/source/ecloga1.asp>\n68. The Code of Justinian : Book 1 ( Scott ), 访问时间为 八月 5, 2025， <https://droitromain.univ-grenoble-alpes.fr/Anglica/CJ1_Scott.htm>\n",
  "all_source_links": [
    "http://orthodoxinfo.com/general/history3.aspx",
    "http://www.mlahanas.de/Greeks/Medieval/LX/ByzantineAaristocracyAndBureaucracy.html",
    "http://www.rechtshistorie.nl/en/roman-law",
    "https://academic.oup.com/jcs/article/59/2/280/2805468#:~:text=Symphony%20meant%20other%20things%2C%20such,Byzantine%20political%20philosophy%20and%20practice.",
    "https://accounts.google.com/SignOutOptions?hl=zh-CN&continue=https://gemini.google.com/&ec=GBRAkgU",
    "https://books.openedition.org/efr/10093",
    "https://brewminate.com/praetors-and-executive-power-in-the-ancient-roman-government",
    "https://courses.lumenlearning.com/atd-herkimer-westerncivilization/chapter/byzantiums-legacy",
    "https://courses.lumenlearning.com/atd-herkimer-westerncivilization/chapter/the-justinian-code",
    "https://digitalcommons.law.uga.edu/cgi/viewcontent.cgi?article=1051&context=gjicl",
    "https://digitalcommons.liberty.edu/hsgconference/2023/legal_regulatory/4",
    "https://digitalcommons.winthrop.edu/medievalmanuscript/6/#:~:text=Corpus%20Juris%20Civilis%20is%20the,Justinian%20Code%2C%20and%20the%20Novels.",
    "https://dj.univ-danubius.ro/index.php/AUDJ/article/view/524/1082",
    "https://droitromain.univ-grenoble-alpes.fr/Anglica/CJ1_Scott.htm",
    "https://en.wikipedia.org/wiki/Basil_I",
    "https://en.wikipedia.org/wiki/Basileus",
    "https://en.wikipedia.org/wiki/Basilika",
    "https://en.wikipedia.org/wiki/Byzantine_bureaucracy_and_aristocracy",
    "https://en.wikipedia.org/wiki/Byzantine_law",
    "https://en.wikipedia.org/wiki/Corpus_Juris_Civilis",
    "https://en.wikipedia.org/wiki/Dominate",
    "https://en.wikipedia.org/wiki/Justinian_I",
    "https://en.wikipedia.org/wiki/Persecution_of_Christians_in_the_Roman_Empire",
    "https://en.wikipedia.org/wiki/Praetor",
    "https://en.wikipedia.org/wiki/Principate",
    "https://en.wikipedia.org/wiki/Role_of_Christianity_in_civilization",
    "https://en.wikipedia.org/wiki/Roman_Senate",
    "https://en.wikipedia.org/wiki/Roman_law",
    "https://en.wikipedia.org/wiki/Roman_province",
    "https://en.wikipedia.org/wiki/Saint_Basil%27s_Cathedral",
    "https://en.wikipedia.org/wiki/Senate_of_the_Roman_Empire",
    "https://en.wikipedia.org/wiki/Subdivisions_of_the_Byzantine_Empire",
    "https://en.wikipedia.org/wiki/Symphonia",
    "https://en.wikipedia.org/wiki/Symphonia\\_(theology",
    "https://en.wikipedia.org/wiki/Symphonia_%28theology%29",
    "https://en.wikipedia.org/wiki/Symphonia_(theology",
    "https://fromthegardenintothecity.wordpress.com/2012/06/19/the-basileus-in-byzantium",
    "https://fscj.pressbooks.pub/earlyhumanities2ndedition/chapter/justinian-law",
    "https://grbs.library.duke.edu/index.php/grbs/article/download/17047/7593/23048",
    "https://hagiasophiaturkey.com/discussion-pages/discussion/ecloga",
    "https://istanbultarihi.ist/405-politics-and-society-in-the-early-byzantine-capital-330-565",
    "https://library.fiveable.me/early-world-civilizations/unit-14/justinians-reign-legal-reforms/study-guide/zXbrttCDOuUB6em0",
    "https://library.fiveable.me/key-terms/early-world-civilizations/provincial-administration",
    "https://library.fiveable.me/key-terms/hs-honors-world-history/caesaropapism",
    "https://lsd.law/define/praetor",
    "https://max-eup2012.mpipriv.de/index.php/Corpus_Juris_Civilis",
    "https://origin.web.fordham.edu/Halsall/basis/Edwin%20Hanson%20Freshfield%20-%20A%20Manual%20of%20Roman%20Law_%20The%20Ecloga1926.pdf",
    "https://origin.web.fordham.edu/halsall/source/ecloga1.asp",
    "https://origin.web.fordham.edu/halsall/source/ecloga1.asp#:~:text=The%20Ecloga%20of%20Leo%20III,be%20influenced%20by%20Christian%20principles.",
    "https://politicaltheology.com/russias-unfinished-symphony-of-church-and-state",
    "https://pressbooks.nscc.ca/worldhistory/chapter/chapter-9-the-roman-empire",
    "https://rlo.acton.org/archives/56363-fr-michael-butler-orthodoxy-church-and-state.html",
    "https://scholarsarchive.byu.edu/cgi/viewcontent.cgi?article=2301&context=ccr",
    "https://scholarship.kentlaw.iit.edu/cgi/viewcontent.cgi?article=2999&context=cklawreview",
    "https://scholarship.law.wm.edu/libpubs/118",
    "https://theimpactlawyers.com/articles/the-influence-of-the-legal-aspects-of-the-roman-empire",
    "https://www.britannica.com/biography/Basil-I-Byzantine-emperor",
    "https://www.britannica.com/biography/Justinian-I/Ecclesiastical-policy",
    "https://www.britannica.com/biography/Justinian-I/Internal-policy",
    "https://www.britannica.com/biography/Leo-III/Legal-and-other-accomplishments",
    "https://www.britannica.com/topic/Basilica-Byzantine-law",
    "https://www.britannica.com/topic/Basilica-Byzantine-law#:~:text=Basilica%2C%20(from%20Greek%20basilikos%2C,son%20Leo%20VI%20the%20Wise.",
    "https://www.britannica.com/topic/Code-of-Justinian",
    "https://www.britannica.com/topic/Ecloga",
    "https://www.britannica.com/topic/Roman-law",
    "https://www.britannica.com/topic/caesaropapism",
    "https://www.britannica.com/topic/caesaropapism#:~:text=caesaropapism%2C%20political%20system%20in%20which,Roman%2C%20or%20Byzantine%2C%20Empire.",
    "https://www.britannica.com/topic/constitutiones-principum",
    "https://www.britannica.com/topic/constitutiones-principum#:~:text=The%20chief%20forms%20of%20imperial,particular%20on%20a%20point%20of",
    "https://www.britannica.com/topic/praetor",
    "https://www.britannica.com/topic/province-ancient-Roman-government",
    "https://www.byzantinetradition.org/historical-development/from-the-roman-empire-to-byzantium",
    "https://www.cambridge.org/core/books/cambridge-ancient-history/emperors-government-and-bureaucracy/7B5DD34A6C95AA86CFCAE4B56E06DD34",
    "https://www.cambridge.org/core/books/cambridge-ancient-history/provincial-administration-and-taxation/7CBC4A0170CC34248635BA2EB386BAB9",
    "https://www.cambridge.org/core/books/cambridge-companion-to-roman-law/law-of-new-rome-byzantine-law/D91318B011CE39A05C841836FF622ADA",
    "https://www.cambridge.org/core/books/cambridge-companion-to-roman-law/law-of-new-rome-byzantine-law/D91318B011CE39A05C841836FF622ADA#:~:text=Byzantine%20law%20was%20founded%20not,not%20connected%20with%20Roman%20law.",
    "https://www.cambridge.org/core/books/cambridge-companion-to-roman-law/sources-of-law-from-the-republic-to-the-dominate/561AB3827959381F24D798A498298795",
    "https://www.cambridge.org/core/books/empires-and-bureaucracy-in-world-history/bureaucracies-elites-and-clans-the-case-of-byzantium-c6001100/8AF53D1475991B5E5A0208F89BFCCDA1",
    "https://www.cambridge.org/core/books/law-and-power-in-the-making-of-the-roman-commonwealth/evolution-of-roman-law-and-jurisprudence/AF3E906F977B3AA169B94D3635DD3144",
    "https://www.cambridge.org/core/journals/journal-of-law-and-religion/article/churchstate-symphonia-its-historical-development-and-its-applications-by-the-russian-orthodox-church/93B4C1ADB2B7EB10FBB29ADD321FE9F6",
    "https://www.ebsco.com/research-starters/history/dominate-rome",
    "https://www.ebsco.com/research-starters/history/dominate-rome#:~:text=%22Dominate%20in%20Rome%22%20refers%20to,rule%20under%20emperors%20like%20Diocletian.",
    "https://www.geeksforgeeks.org/social-science/byzantine-empire-vs-roman-empire",
    "https://www.google.com/search?q=political+system+of+the+Byzantine+Empire",
    "https://www.ius.uzh.ch/dam/jcr%3Ab201fd7a-c57e-43e6-abc5-5259609becb1/H%C3%A4usler_Roman%20Law_Introduction%20to%20Swiss%20law_draft.pdf",
    "https://www.ius.uzh.ch/dam/jcr:b201fd7a-c57e-43e6-abc5-5259609becb1/H%C3%A4usler",
    "https://www.ius.uzh.ch/dam/jcr:b201fd7a-c57e-43e6-abc5-5259609becb1/H%C3%A4usler\\_Roman%20Law\\_Introduction%20to%20Swiss%20law\\_draft.pdf",
    "https://www.ius.uzh.ch/dam/jcr:b201fd7a-c57e-43e6-abc5-5259609becb1/H%C3%A4usler_Roman%20Law_Introduction%20to%20Swiss%20law_draft.pdf",
    "https://www.labrujulaverde.com/en/2023/11/from-principate-to-dominate-when-roman-emperors-became-boastful-autocrats",
    "https://www.marketsandmorality.com/index.php/mandm/article/viewFile/981/882",
    "https://www.metmuseum.org/essays/the-byzantine-state-under-justinian-i-justinian-the-great",
    "https://www.numberanalytics.com/blog/provincial-administration-ancient-rome",
    "https://www.pbs.org/articles/learn-about-the-roman-senate",
    "https://www.pbs.org/empires/romans/empire/senators.html",
    "https://www.pbs.org/empires/romans/empire/senators.html#:~:text=During%20the%20empire%2C%20the%20senate,Senate%20discussions%2C%20and%20propose%20legislation.",
    "https://www.reddit.com/r/byzantium/comments/18y9udr/why_was_byzantium_so_centralized_compare_to_other",
    "https://www.reddit.com/r/byzantium/comments/1h8d4jp/who_was_the_most_significant_byzantine_emperor_in",
    "https://www.reddit.com/r/explainlikeimfive/comments/1bdty9x/eli5_why_is_byzantine_used_to_describe_excessive",
    "https://www.saet.ac.uk/Christianity/UtilitarianismandChristianTheology",
    "https://www.tandfonline.com/doi/abs/10.1080/03044181.2014.902398#:~:text=Numerous%20studies%20have%20depicted%20the,legitimate%20Christian%20basileus%20on%20earth.",
    "https://www.thegospelcoalition.org/blogs/kevin-deyoung/first-sexual-revolution-triumph-christian-morality-roman-empire",
    "https://www.thoughtco.com/what-is-praetor-117900",
    "https://www.tsarvisit.com/en/blog/st-basil-cathedral",
    "https://www.unrv.com/government/praetors.php",
    "https://www.unrv.com/government/provincialgovernment.php",
    "https://www.worldhistory.org/Byzantine_Government",
    "https://www.youtube.com/watch?v=sMC8O-emses"
  ],
  "summary_citations": [
    "http://orthodoxinfo.com/general/history3.aspx",
    "http://www.mlahanas.de/Greeks/Medieval/LX/ByzantineAaristocracyAndBureaucracy.html",
    "http://www.rechtshistorie.nl/en/roman-law",
    "https://academic.oup.com/jcs/article/59/2/280/2805468#:~:text=Symphony%20meant%20other%20things%2C%20such,Byzantine%20political%20philosophy%20and%20practice.",
    "https://accounts.google.com/SignOutOptions?hl=zh-CN&continue=https://gemini.google.com/&ec=GBRAkgU",
    "https://books.openedition.org/efr/10093",
    "https://brewminate.com/praetors-and-executive-power-in-the-ancient-roman-government",
    "https://courses.lumenlearning.com/atd-herkimer-westerncivilization/chapter/byzantiums-legacy",
    "https://courses.lumenlearning.com/atd-herkimer-westerncivilization/chapter/the-justinian-code",
    "https://digitalcommons.law.uga.edu/cgi/viewcontent.cgi?article=1051&context=gjicl",
    "https://digitalcommons.liberty.edu/hsgconference/2023/legal_regulatory/4",
    "https://digitalcommons.winthrop.edu/medievalmanuscript/6/#:~:text=Corpus%20Juris%20Civilis%20is%20the,Justinian%20Code%2C%20and%20the%20Novels.",
    "https://dj.univ-danubius.ro/index.php/AUDJ/article/view/524/1082",
    "https://droitromain.univ-grenoble-alpes.fr/Anglica/CJ1_Scott.htm",
    "https://en.wikipedia.org/wiki/Basil_I",
    "https://en.wikipedia.org/wiki/Basileus",
    "https://en.wikipedia.org/wiki/Basilika",
    "https://en.wikipedia.org/wiki/Byzantine_bureaucracy_and_aristocracy",
    "https://en.wikipedia.org/wiki/Byzantine_law",
    "https://en.wikipedia.org/wiki/Corpus_Juris_Civilis",
    "https://en.wikipedia.org/wiki/Dominate",
    "https://en.wikipedia.org/wiki/Justinian_I",
    "https://en.wikipedia.org/wiki/Persecution_of_Christians_in_the_Roman_Empire",
    "https://en.wikipedia.org/wiki/Praetor",
    "https://en.wikipedia.org/wiki/Principate",
    "https://en.wikipedia.org/wiki/Role_of_Christianity_in_civilization",
    "https://en.wikipedia.org/wiki/Roman_Senate",
    "https://en.wikipedia.org/wiki/Roman_law",
    "https://en.wikipedia.org/wiki/Roman_province",
    "https://en.wikipedia.org/wiki/Saint_Basil%27s_Cathedral",
    "https://en.wikipedia.org/wiki/Senate_of_the_Roman_Empire",
    "https://en.wikipedia.org/wiki/Subdivisions_of_the_Byzantine_Empire",
    "https://en.wikipedia.org/wiki/Symphonia",
    "https://en.wikipedia.org/wiki/Symphonia\\_(theology",
    "https://en.wikipedia.org/wiki/Symphonia_%28theology%29",
    "https://en.wikipedia.org/wiki/Symphonia_(theology",
    "https://fromthegardenintothecity.wordpress.com/2012/06/19/the-basileus-in-byzantium",
    "https://fscj.pressbooks.pub/earlyhumanities2ndedition/chapter/justinian-law",
    "https://grbs.library.duke.edu/index.php/grbs/article/download/17047/7593/23048",
    "https://hagiasophiaturkey.com/discussion-pages/discussion/ecloga",
    "https://istanbultarihi.ist/405-politics-and-society-in-the-early-byzantine-capital-330-565",
    "https://library.fiveable.me/early-world-civilizations/unit-14/justinians-reign-legal-reforms/study-guide/zXbrttCDOuUB6em0",
    "https://library.fiveable.me/key-terms/early-world-civilizations/provincial-administration",
    "https://library.fiveable.me/key-terms/hs-honors-world-history/caesaropapism",
    "https://lsd.law/define/praetor",
    "https://max-eup2012.mpipriv.de/index.php/Corpus_Juris_Civilis",
    "https://origin.web.fordham.edu/Halsall/basis/Edwin%20Hanson%20Freshfield%20-%20A%20Manual%20of%20Roman%20Law_%20The%20Ecloga1926.pdf",
    "https://origin.web.fordham.edu/halsall/source/ecloga1.asp",
    "https://origin.web.fordham.edu/halsall/source/ecloga1.asp#:~:text=The%20Ecloga%20of%20Leo%20III,be%20influenced%20by%20Christian%20principles.",
    "https://politicaltheology.com/russias-unfinished-symphony-of-church-and-state",
    "https://pressbooks.nscc.ca/worldhistory/chapter/chapter-9-the-roman-empire",
    "https://rlo.acton.org/archives/56363-fr-michael-butler-orthodoxy-church-and-state.html",
    "https://scholarsarchive.byu.edu/cgi/viewcontent.cgi?article=2301&context=ccr",
    "https://scholarship.kentlaw.iit.edu/cgi/viewcontent.cgi?article=2999&context=cklawreview",
    "https://scholarship.law.wm.edu/libpubs/118",
    "https://theimpactlawyers.com/articles/the-influence-of-the-legal-aspects-of-the-roman-empire",
    "https://www.britannica.com/biography/Basil-I-Byzantine-emperor",
    "https://www.britannica.com/biography/Justinian-I/Ecclesiastical-policy",
    "https://www.britannica.com/biography/Justinian-I/Internal-policy",
    "https://www.britannica.com/biography/Leo-III/Legal-and-other-accomplishments",
    "https://www.britannica.com/topic/Basilica-Byzantine-law",
    "https://www.britannica.com/topic/Basilica-Byzantine-law#:~:text=Basilica%2C%20(from%20Greek%20basilikos%2C,son%20Leo%20VI%20the%20Wise.",
    "https://www.britannica.com/topic/Code-of-Justinian",
    "https://www.britannica.com/topic/Ecloga",
    "https://www.britannica.com/topic/Roman-law",
    "https://www.britannica.com/topic/caesaropapism",
    "https://www.britannica.com/topic/caesaropapism#:~:text=caesaropapism%2C%20political%20system%20in%20which,Roman%2C%20or%20Byzantine%2C%20Empire.",
    "https://www.britannica.com/topic/constitutiones-principum",
    "https://www.britannica.com/topic/constitutiones-principum#:~:text=The%20chief%20forms%20of%20imperial,particular%20on%20a%20point%20of",
    "https://www.britannica.com/topic/praetor",
    "https://www.britannica.com/topic/province-ancient-Roman-government",
    "https://www.byzantinetradition.org/historical-development/from-the-roman-empire-to-byzantium",
    "https://www.cambridge.org/core/books/cambridge-ancient-history/emperors-government-and-bureaucracy/7B5DD34A6C95AA86CFCAE4B56E06DD34",
    "https://www.cambridge.org/core/books/cambridge-ancient-history/provincial-administration-and-taxation/7CBC4A0170CC34248635BA2EB386BAB9",
    "https://www.cambridge.org/core/books/cambridge-companion-to-roman-law/law-of-new-rome-byzantine-law/D91318B011CE39A05C841836FF622ADA",
    "https://www.cambridge.org/core/books/cambridge-companion-to-roman-law/law-of-new-rome-byzantine-law/D91318B011CE39A05C841836FF622ADA#:~:text=Byzantine%20law%20was%20founded%20not,not%20connected%20with%20Roman%20law.",
    "https://www.cambridge.org/core/books/cambridge-companion-to-roman-law/sources-of-law-from-the-republic-to-the-dominate/561AB3827959381F24D798A498298795",
    "https://www.cambridge.org/core/books/empires-and-bureaucracy-in-world-history/bureaucracies-elites-and-clans-the-case-of-byzantium-c6001100/8AF53D1475991B5E5A0208F89BFCCDA1",
    "https://www.cambridge.org/core/books/law-and-power-in-the-making-of-the-roman-commonwealth/evolution-of-roman-law-and-jurisprudence/AF3E906F977B3AA169B94D3635DD3144",
    "https://www.cambridge.org/core/journals/journal-of-law-and-religion/article/churchstate-symphonia-its-historical-development-and-its-applications-by-the-russian-orthodox-church/93B4C1ADB2B7EB10FBB29ADD321FE9F6",
    "https://www.ebsco.com/research-starters/history/dominate-rome",
    "https://www.ebsco.com/research-starters/history/dominate-rome#:~:text=%22Dominate%20in%20Rome%22%20refers%20to,rule%20under%20emperors%20like%20Diocletian.",
    "https://www.geeksforgeeks.org/social-science/byzantine-empire-vs-roman-empire",
    "https://www.google.com/search?q=political+system+of+the+Byzantine+Empire",
    "https://www.ius.uzh.ch/dam/jcr%3Ab201fd7a-c57e-43e6-abc5-5259609becb1/H%C3%A4usler_Roman%20Law_Introduction%20to%20Swiss%20law_draft.pdf",
    "https://www.ius.uzh.ch/dam/jcr:b201fd7a-c57e-43e6-abc5-5259609becb1/H%C3%A4usler",
    "https://www.ius.uzh.ch/dam/jcr:b201fd7a-c57e-43e6-abc5-5259609becb1/H%C3%A4usler\\_Roman%20Law\\_Introduction%20to%20Swiss%20law\\_draft.pdf",
    "https://www.ius.uzh.ch/dam/jcr:b201fd7a-c57e-43e6-abc5-5259609becb1/H%C3%A4usler_Roman%20Law_Introduction%20to%20Swiss%20law_draft.pdf",
    "https://www.labrujulaverde.com/en/2023/11/from-principate-to-dominate-when-roman-emperors-became-boastful-autocrats",
    "https://www.marketsandmorality.com/index.php/mandm/article/viewFile/981/882",
    "https://www.metmuseum.org/essays/the-byzantine-state-under-justinian-i-justinian-the-great",
    "https://www.numberanalytics.com/blog/provincial-administration-ancient-rome",
    "https://www.pbs.org/articles/learn-about-the-roman-senate",
    "https://www.pbs.org/empires/romans/empire/senators.html",
    "https://www.pbs.org/empires/romans/empire/senators.html#:~:text=During%20the%20empire%2C%20the%20senate,Senate%20discussions%2C%20and%20propose%20legislation.",
    "https://www.reddit.com/r/byzantium/comments/18y9udr/why_was_byzantium_so_centralized_compare_to_other",
    "https://www.reddit.com/r/byzantium/comments/1h8d4jp/who_was_the_most_significant_byzantine_emperor_in",
    "https://www.reddit.com/r/explainlikeimfive/comments/1bdty9x/eli5_why_is_byzantine_used_to_describe_excessive",
    "https://www.saet.ac.uk/Christianity/UtilitarianismandChristianTheology",
    "https://www.tandfonline.com/doi/abs/10.1080/03044181.2014.902398#:~:text=Numerous%20studies%20have%20depicted%20the,legitimate%20Christian%20basileus%20on%20earth.",
    "https://www.thegospelcoalition.org/blogs/kevin-deyoung/first-sexual-revolution-triumph-christian-morality-roman-empire",
    "https://www.thoughtco.com/what-is-praetor-117900",
    "https://www.tsarvisit.com/en/blog/st-basil-cathedral",
    "https://www.unrv.com/government/praetors.php",
    "https://www.unrv.com/government/provincialgovernment.php",
    "https://www.worldhistory.org/Byzantine_Government",
    "https://www.youtube.com/watch?v=sMC8O-emses"
  ]
}