{
  "query": "Write a comprehensive and informative article covering all aspects of medieval cats and dogs, including culture, mythology, legends, fictional stories, superstitions, as well as interesting facts and tales, and examine historical sources related to these topics.",
  "chain_of_research": {
    "plan_1": {
      "title": "Researching Medieval Animals\nInitial Research Focus\nNext Steps in Research",
      "description": "I'm starting a comprehensive research project on medieval cats and dogs, aiming to cover their cultural significance, mythological roles, superstitions, and appearances in literature and historical records. My goal is to synthesize information from various reliable sources to build a complete picture.\nMy initial approach will focus on understanding the daily lives and cultural roles of cats and dogs during the medieval period. This includes exploring their practical uses, such as pest control, hunting, and companionship, as well as their social standing within medieval society. I'll then broaden my scope to delve into their representation in mythology, folklore, and fictional narratives.\nMoving forward, I will investigate medieval superstitions and beliefs associated with these animals, looking into their connections with magic, luck, and religious views. I also plan to uncover interesting anecdotes and historical tales involving cats and dogs. A crucial part of my research will involve examining historical sources like illuminated manuscripts, bestiaries, and other medieval art to understand how these animals were depicted and perceived."
    },
    "search_1": [
      "https://bestiary.ca/beasts/beast181.htm",
      "https://www.reddit.com/r/MedievalHistory/comments/13lz5ur/cats_in_the_middle_ages_what_medieval_manuscripts",
      "https://www.sothebysinstitute.com/info-series/medieval-cat-paintings",
      "https://www.hindustantimes.com/lifestyle/pet/dogs-in-the-middle-ages-unveiling-our-ancestors-beloved-pets-through-medieval-writing-101706420489220.html",
      "https://bestiary.ca/beasts/beast213.htm",
      "https://www.reddit.com/r/todayilearned/comments/5lhurx/til_that_in_medieval_times_catburning_was_an",
      "https://www.leidenartsinsocietyblog.nl/articles/the-cat-in-medieval-western-europe",
      "https://www.historyhit.com/medieval-canines-how-did-the-people-of-the-middle-ages-treat-their-dogs",
      "https://www.scienceabc.com/nature/animals/what-are-some-superstitions-involving-animals.html",
      "https://en.wikipedia.org/wiki/Black_dog_(folklore",
      "https://pethelpful.com/pet-news/10-facts-about-dogs-in-medieval-times",
      "https://nautil.us/why-medieval-cats-approved-of-the-plague-236859",
      "https://www.raabcollection.com/medieval-manuscripts/french-hunter",
      "https://philandpearl.com/blogs/phil-and-pearls-blog/the-magic-of-black-cats",
      "https://pethistories.wordpress.com/2017/10/16/the-supreme-mouser-in-historical-perspective-cats-in-the-medieval-period",
      "https://www.reddit.com/r/AskHistorians/comments/1bsoj3h/did_fear_of_witches_exacerbate_the_black_plague",
      "https://50wattsbooks.com/products/cats-in-medieval-manuscripts-british-library#:~:text=Cats%20were%20illustrated%20in%20medieval,Devil%2C%20and%20as%20magical%20creatures.",
      "https://cathedral.southwark.anglican.org/visiting/southwark-cathedral-history-festival-2025/speakers-friday-18-july-the-cathedral-library/cats-in-medieval-manuscripts-dr-kathleen-walker-meikle",
      "https://www.culturefrontier.com/dogs-in-mythology",
      "https://www.medievalists.net/2018/02/famous-dogs-medieval-literature",
      "https://www.dogartists.co.uk/famous-dogs/famous-dogs-in-mythology-legendary-canines-from-myth-and-folklore",
      "https://www.medievalists.net/2025/01/surprising-talents-medieval-dogs",
      "https://basepaws.com/blog/meowgical-mythology-of-cats",
      "https://www.medievalists.net/2022/06/mans-best-friend-dogs",
      "https://blogs.getty.edu/iris/dogs-at-the-medieval-banquet",
      "https://www.hobesoundvet.com/feline-folklore",
      "https://flaglerlive.com/cats-middle-ages",
      "https://pmc.ncbi.nlm.nih.gov/articles/PMC7923258",
      "https://www.medievalists.net/2023/05/cats-hated-medieval-europe",
      "https://www.youtube.com/watch?v=cLPynXmdfG4"
    ],
    "observation_1": "I've begun to uncover the multifaceted roles of cats and dogs in medieval society. Cats were primarily valued for their mousing skills, with their worth even codified in Welsh law, and were sometimes seen as companions, even for scholars. However, their independent nature often led to anxiety and negative associations, particularly with paganism and witchcraft. Dogs, on the other hand, were more consistently viewed positively, serving diverse functions from hunting and guarding to herding and even performing as turnspits. Their loyalty was highly prized, and they were often symbols of nobility and wealth, with specific breeds like greyhounds holding high status.",
    "plan_2": {
      "title": "Exploring Myth and Superstition\nInsights from Historical Sources\nNext Steps in Deepening Understanding",
      "description": "My research into the mythological and superstitious aspects of medieval cats and dogs has revealed a stark contrast. Cats were frequently demonized, associated with the Devil, witches, and bad luck, leading to practices like cat-burning and decrees from popes. The myth of cats stealing babies' breath also emerged during this period. In contrast, dogs were often depicted as loyal and heroic figures in folklore, with tales of them rescuing masters or identifying murderers. However, some superstitions did exist, such as black dogs being omens of death or a dog crossing one's path signaling a quarrel.\nI'm finding rich details in historical sources. Illuminated manuscripts frequently depict both cats and dogs, sometimes playfully, offering insights into their daily presence. Bestiaries provide moralizing descriptions, portraying cats as hostile to mice with keen eyesight, and dogs as loyal companions who cannot live without humans. Legal documents, like the Welsh laws, highlight the economic value and legal protections afforded to these animals. I've also found interesting anecdotes, such as cheese being bought for a cat or the veneration of Guinefort the greyhound saint, which offer glimpses into the emotional bonds people shared with their animals.\nTo further enrich this research, I'll now delve deeper into specific online sources. I plan to browse articles that discuss the demonization of cats, the diverse roles and emotional bonds with dogs, and detailed bestiary entries for both animals. I will also explore specific literary examples and historical anecdotes to gather more concrete evidence and fill in the identified information gaps. Additionally, I will conduct a targeted search to find explicit comparative analyses of cats and dogs in the medieval period."
    },
    "search_2": [
      "https://bestiary.ca/beasts/beast213.htm",
      "https://www.medievalists.net/2023/05/cats-hated-medieval-europe",
      "https://www.leidenartsinsocietyblog.nl/articles/the-cat-in-medieval-western-europe",
      "https://bestiary.ca/beasts/beast181.htm",
      "https://www.historyhit.com/medieval-canines-how-did-the-people-of-the-middle-ages-treat-their-dogs",
      "https://nautil.us/why-medieval-cats-approved-of-the-plague-236859",
      "https://www.medievalists.net/2018/02/famous-dogs-medieval-literature",
      "https://www.medievalists.net/2025/01/surprising-talents-medieval-dogs",
      "https://www.metmuseum.org/essays/animals-in-medieval-art",
      "https://fineart-restoration.co.uk/news/cryptic-creatures-the-symbolism-of-animals-in-art",
      "https://core.ac.uk/download/pdf/61139956.pdf",
      "https://iro.uiowa.edu/esploro/outputs/undergraduate/Cats-and-Dogs--The-Development/9984111225102771",
      "https://pethelpful.com/pet-news/10-facts-about-dogs-in-medieval-times",
      "https://www.medievalists.net/2022/06/mans-best-friend-dogs"
    ],
    "observation_2": "I've been synthesizing the information gathered, and a clear distinction between medieval cats and dogs is emerging. Dogs were generally perceived positively, embodying loyalty, utility, and companionship, often serving as status symbols for the elite in hunting and as lapdogs. Cats, while valued for pest control, faced a more ambivalent to negative perception due to their independent nature and strong associations with the Devil, witchcraft, and paganism. This led to significant persecution, including practices like cat-burning, which dogs largely avoided.",
    "plan_3": {
      "title": "Uncovering Rich Narratives\nAddressing Remaining Gaps",
      "description": "My research has uncovered a wealth of narratives and anecdotes. For dogs, I've found compelling stories of loyalty, such as the 'saintly' greyhound Guinefort and the detailed accounts from Ibn al-Marzuban highlighting deep emotional bonds. Dogs also had a wider range of practical uses, from turnspits to war dogs. For cats, while their primary role as mousers is well-documented, I've also found instances of them being kept as pets by nobility and scholars, with some evidence of care, like cheese being bought for them. However, their portrayal in folklore often leaned towards the sinister, with beliefs about them stealing babies' breath or being witches in disguise.\nWhile I have a strong foundation, I've identified a few areas for further detail. I need to find more specific examples of cats in medieval literature and fables beyond general mentions of 'canny characters.' I also want to explore how cat ownership varied across social classes in more depth and gather more specific examples of dogs in warfare. Finally, I'll look for additional medieval European dog folklore that is distinct from the ancient Greek, Norse, and Celtic myths already covered. I'll conduct targeted searches to fill these gaps and ensure a comprehensive article."
    },
    "search_3": [
      "https://www.historic-uk.com/HistoryUK/HistoryofWales/The-legend-of-brave-Gelert",
      "https://www.historyhit.com/how-3-very-different-medieval-cultures-treated-cats",
      "https://www.reddit.com/r/WarCollege/comments/18uxiwe/did_ancient_or_medieval_armies_ever_use_trained",
      "https://www.oberlin.edu/library/friends/research.awards/SIM.pdf",
      "https://e-space.mmu.ac.uk/627409/1/BJMH%20War%20Dogs%20in%20Medieval%20and%20Early%20Modern%20West.pdf",
      "https://www.leidenartsinsocietyblog.nl/articles/the-cat-in-medieval-western-europe",
      "https://en.wikipedia.org/wiki/Dogs_in_warfare",
      "https://en.wikipedia.org/wiki/Black_dog_(folklore",
      "https://www.medievalists.net/2016/09/a-most-convenient-relationship-the-rise-of-the-cat-as-a-valued-companion-animal",
      "https://en.wikipedia.org/wiki/Belling_the_Cat",
      "https://en.wikipedia.org/wiki/Hellhound",
      "https://en.wikipedia.org/wiki/Dick_Whittington_and_His_Cat"
    ],
    "observation_3": "I've completed my research on medieval cats and dogs, gathering a comprehensive understanding of their cultural roles, mythological significance, literary appearances, and the superstitions surrounding them. I've successfully addressed all the initial research questions and the subsequent information gaps identified, ensuring a well-rounded perspective on both animals.",
    "plan_4": {
      "title": "New Insights on Cats and Dogs\nReady to Synthesize the Article",
      "description": "For cats, I've found specific literary examples like the fable 'Belling the Cat' and its medieval analogues, and the tale of 'Dick Whittington and His Cat,' which highlights the motif of cats bringing wealth. I've also gained a more nuanced understanding of their daily life integration, noting their presence across social classes, including among the peasantry and in monasteries, despite the prevailing negative superstitions. For dogs, I've clarified their role in warfare, distinguishing between 'dogs of war' (trained for military environments) and 'dogs in war' (present with armies but not necessarily combatants), with evidence suggesting their direct combat roles were sporadic. I've also expanded on specific European dog folklore, including the 'Legend of Gelert the Dog' and various 'Black Dog' manifestations like the Barghest and Black Shuck, and other hellhound figures from different European regions.\nWith all the necessary information now gathered and synthesized, I am confident that I have reached a point of saturation for this research. I have a robust collection of details on the practical uses, social standing, mythological associations, literary depictions, and superstitions related to medieval cats and dogs. I am now ready to proceed with generating the comprehensive article as requested."
    }
  },
  "final_report": "# **Feline and Canine Lives: A Comprehensive Exploration of Cats and Dogs in the Medieval World**\n\n## **Introduction: Animals as Mirrors of Medieval Society**\n\nMedieval society was intricately connected with the animal kingdom, a relationship extending far beyond mere utility. Animals served as profound reflections of human fears, emotions, and societal norms @https://www.leidenartsinsocietyblog.nl/articles/the-cat-in-medieval-western-europe>  During this period, perceptions of animal sentience underwent significant shifts. While Greco-Roman thought often attributed a sensitive soul to animals, the early Middle Ages saw a theological view emerge that denied animals any soul at all. However, from the twelfth century onwards, a more nuanced understanding of the human-animal divide began to develop, influenced by a renewed engagement with classical texts @https://www.leidenartsinsocietyblog.nl/articles/the-cat-in-medieval-western-europe> \n\nWithin this complex framework, cats and dogs occupied unique and evolving positions. As two of the earliest domesticated species permitted within medieval homes, their presence initially served utilitarian needs before gradually paving the way for the modern concept of the household pet, which began to emerge between the 14th and 16th centuries @https://core.ac.uk/download/pdf/61139956.pdf>  Their roles and symbolic interpretations fluctuated considerably between the medieval era and the Renaissance @https://core.ac.uk/download/pdf/61139956.pdf>  This duality is a recurring theme: both species were simultaneously valued for their practical contributions, such as pest control or hunting, and imbued with rich symbolic meanings, often representing moralistic extremes. This multifaceted relationship is vividly captured in the art and literature of the time @https://www.leidenartsinsocietyblog.nl/articles/the-cat-in-medieval-western-europe> \n\n## **I. The Medieval Cat: From Practicality to Persecution**\n\n### **A. Utilitarian Roles and Economic Value**\n\nCats were indispensable members of medieval society, primarily for their exceptional mousing skills. They played a critical role in safeguarding precious food supplies and maintaining public health by controlling rampant rodent populations @https://www.leidenartsinsocietyblog.nl/articles/the-cat-in-medieval-western-europe>  This function was particularly vital as rodents were notorious carriers of diseases, including the devastating bubonic plague, and frequently infested food stores @https://www.leidenartsinsocietyblog.nl/articles/the-cat-in-medieval-western-europe>  Their ability to keep rats and mice at bay was essential for sanitary conditions and disease prevention in both rural and urban environments @https://www.leidenartsinsocietyblog.nl/articles/the-cat-in-medieval-western-europe> \n\nThe economic importance of cats was formally recognized and quantified in medieval law. The 10th-century Laws of the Welsh King Hywel Dda, for instance, precisely valued an adult cat at fourpence, a sum comparable to that of a full-grown sheep or an untrained house-dog @https://www.leidenartsinsocietyblog.nl/articles/the-cat-in-medieval-western-europe>  This legal framework also stipulated specific \"properties\" a cat must possess to attain this value, such as keen sight and hearing, effective mouse-killing abilities, the capacity to rear kittens, and unbroken claws @https://www.leidenartsinsocietyblog.nl/articles/the-cat-in-medieval-western-europe>  Furthermore, cats tasked with protecting the king's barns were deemed \"four-legged civil servants\" and afforded legal protection @https://www.leidenartsinsocietyblog.nl/articles/the-cat-in-medieval-western-europe>  Early Irish law went even further, valuing a mouser at three cows, while in Saxony, Germany, the killing of an adult cat necessitated a reimbursement of sixty bushels of grain, directly symbolizing its crucial role in preserving grain stores @https://core.ac.uk/download/pdf/61139956.pdf>  The explicit legal valuations and the direct mention of cats preventing plague underscore that these animals were not merely companions but vital economic and public health assets. Their quantifiable value and legal protection demonstrate a deep societal reliance on their pest control abilities, moving beyond simple utility to signify a systemic integration into the medieval economy and public welfare. This robust economic value and legal safeguarding stand in stark contrast to their later demonization, suggesting that practical necessity often coexisted with, or even temporarily outweighed, superstitious fears in the daily lives of medieval people.\n\nBeyond their legal standing, cats were common fixtures in various domestic and institutional settings. They were mainstays in medieval households, from the humblest dwellings to royal manors, and even monasteries, primarily due to their pest control capabilities @https://pethistories.wordpress.com/2017/10/16/the-supreme-mouser-in-historical-perspective-cats-in-the-medieval-period/>  Their presence is frequently documented in medieval art, appearing in domestic scenes and peering mischievously from the margins of illuminated manuscripts @https://www.sothebysinstitute.com/info-series/medieval-cat-paintings> \n\n### **B. Cultural Perceptions and Social Standing**\n\nDespite their fundamental utilitarian roles, cats also gained recognition as cherished companions, particularly within the upper echelons of society and among scholars @https://flaglerlive.com/cats-middle-ages/>  The act of keeping an animal that required no functional purpose beyond companionship became a clear indicator of high social status and wealth @https://flaglerlive.com/cats-middle-ages/>  Noblewomen, for example, were sometimes depicted alongside their feline companions in portraits, further cementing this association with elite standing @https://flaglerlive.com/cats-middle-ages/>  Scholars, too, formed strong emotional attachments to their cats, writing eulogies that highlighted their role in providing comfort and welcome distractions from demanding intellectual pursuits @https://flaglerlive.com/cats-middle-ages/> \n\nMedieval art provides a rich visual record of these multifaceted perceptions. Artists captured cats in various poses and situations, from lazily lounging in domestic scenes to playfully peeking from the decorative borders of illuminated manuscripts @https://www.sothebysinstitute.com/info-series/medieval-cat-paintings>  These depictions often featured exaggerated features, emphasizing the cats' curious and mischievous nature rather than strict anatomical accuracy @https://www.sothebysinstitute.com/info-series/medieval-cat-paintings>  Cats frequently appeared in iconography related to feasts and other domestic spaces, reflecting their accepted presence within the medieval household @https://flaglerlive.com/cats-middle-ages/>  It was also common to find nuns depicted with cats in manuscripts and Books of Hours, underscoring their quiet integration into monastic life @https://flaglerlive.com/cats-middle-ages/> \n\nHowever, the cat's inherent nature also presented a conceptual challenge to medieval society. Felines embodied a \"liminal\" existence, symbolizing a range of opposing forces: domestic and wild, natural and supernatural, good and evil, dependent and independent, innocent and promiscuous, nocturnal and diurnal, and even lazy and vigilant @https://www.leidenartsinsocietyblog.nl/articles/the-cat-in-medieval-western-europe>  This inherent duality created significant conceptual tension. The independent nature of cats and their apparent disregard for human rules often caused anxiety, as they seemed to overstep their prescribed position within the human-animal hierarchy @https://www.leidenartsinsocietyblog.nl/articles/the-cat-in-medieval-western-europe>  The feline's inherent independence and nocturnal habits made them difficult to fully control, unlike dogs. This \"incompletely domesticated\" nature presented a fundamental challenge to medieval societal beliefs, which generally held that animals were created by God to serve and be ruled by humans @https://core.ac.uk/download/pdf/61139956.pdf>  This inherent tension explains the love-hate relationship often observed and the tendency to impose the role of an \"animated mousetrap\" upon the cat, as a way to rationalize its presence within a hierarchical worldview @https://www.leidenartsinsocietyblog.nl/articles/the-cat-in-medieval-western-europe>  In times of religious upheaval and social uncertainty, characterized by war, plague, famine, and rebellions, such ambivalence was rarely tolerated, leading to cats becoming convenient scapegoats for societal fears and emotions @https://www.leidenartsinsocietyblog.nl/articles/the-cat-in-medieval-western-europe> \n\n### **C. Mythology, Folklore, and Superstitions**\n\nThe shifting attitudes towards cats in medieval Europe were deeply rooted in a clash of cultural beliefs. In pre-Christian religions, cats held significant, often revered, roles. In ancient Egypt, they were divine protectors associated with the goddess Bastet @https://basepaws.com/blog/meowgical-mythology-of-cats>  Norse myths feature the goddess Freya's chariot drawn by cats, symbolizing fertility and fortune @https://core.ac.uk/download/pdf/61139956.pdf>  Celtic legends linked cats to the Otherworld, bridging mortal and spiritual realms @https://www.hobesoundvet.com/feline-folklore/>  However, with the gradual demonization of pagan deities and the ascendance of Christianity, attitudes towards cats in Europe underwent a profound transformation @https://www.leidenartsinsocietyblog.nl/articles/the-cat-in-medieval-western-europe> \n\nFrom the 12th century onwards, cats were increasingly viewed negatively, becoming associated with the Devil and satanic rituals @https://www.medievalists.net/2023/05/cats-hated-medieval-europe/>  Black cats, in particular, were singled out and feared as direct minions of the Devil @https://basepaws.com/blog/meowgical-mythology-of-cats>  Heretical groups, such as the Cathars and Waldensians, were accused by Catholic churchmen of associating with or even worshipping cats, with some even believing the name \"Cathars\" originated from cats @https://www.medievalists.net/2023/05/cats-hated-medieval-europe/>  The Knights Templar faced similar accusations during their trials in the early 14th century @https://www.medievalists.net/2023/05/cats-hated-medieval-europe/>  The belief that witches could shape-shift into cats also gained considerable traction, culminating in Pope Innocent VIII's declaration in 1484 that the cat was the devil's favorite animal and an idol for all witches @https://www.medievalists.net/2023/05/cats-hated-medieval-europe/> \n\nNumerous superstitions further illustrate the complex and often fearful perception of cats. The popular myth of cats having \"nine lives\" originated from the Egyptians, attributed to their remarkable ability to always land on their feet @https://basepaws.com/blog/meowgical-mythology-of-cats>  In England, a deeply ingrained belief held that cats were capable of climbing into an infant's crib and sucking its breath, often attributed to jealousy over the newborn receiving attention @https://basepaws.com/blog/meowgical-mythology-of-cats>  Black cats, while considered good luck in some cultures (e.g., Japan, South of France, among British and Irish sailors), were widely regarded as unlucky omens in Western mythology @https://philandpearl.com/blogs/phil-and-pearls-blog/the-magic-of-black-cats>  Another superstition suggested that if a pregnant woman picked up a cat, the cat could mark the baby with a wart, a hairy mole, a cat-shaped birthmark, or even transfer its face to the infant @https://basepaws.com/blog/meowgical-mythology-of-cats>  The Polish legend of the Pussy Willows offers a more benevolent tale, recounting how willow trees sprouted fur-like buds after saving kittens from a river @https://basepaws.com/blog/meowgical-mythology-of-cats> \n\nThe profound shift from pagan reverence to Christian demonization was not a spontaneous cultural evolution but a deliberate campaign by the Church, notably under figures like Pope Gregory IX and Pope Innocent VIII, aimed at consolidating power and suppressing perceived threats such as heresy and paganism @https://www.leidenartsinsocietyblog.nl/articles/the-cat-in-medieval-western-europe>  By strategically associating cats with the Devil and witchcraft, the Church effectively created a potent tool for social control, transforming a common animal into a symbol of moral danger. This demonstrates how religious and ideological conflicts profoundly impacted the perception and treatment of animals, leading to widespread persecution based on symbolic associations rather than practical realities. This \"moral panic\" served as a powerful mechanism to enforce conformity within medieval society @https://nautil.us/why-medieval-cats-approved-of-the-plague-236859/> \n\n### **D. Cats in Medieval Literature and Fables**\n\nMedieval literature, including bestiaries and fables, offers further insights into the perception of cats. Bestiaries, moralizing compendiums of animal knowledge, described the cat (known by various Latin names such as *Musio*, *Cattus*, and *Feles*) primarily as an enemy of mice, possessing exceptionally keen eyesight capable of piercing the darkness, often referred to as \"carbuncle eyes\" @https://bestiary.ca/beasts/beast213.htm>  Beyond their mousing prowess, they were also depicted as dirty and hateful animals, known for fighting venomous creatures, enjoying play, exhibiting vanity (even falling into wells while gazing at their reflections), and fiercely defending their territory @https://bestiary.ca/beasts/beast213.htm> \n\nFables, widely popular for their moral lessons, frequently featured cats. One of the most enduring is \"Belling the Cat,\" which appeared around 1200 in Odo of Cheriton's *Parabolae* @https://en.wikipedia.org/wiki/Belling_the_Cat>  This fable recounts a group of mice debating how to attach a bell to a marauding cat to warn of its approach, but ultimately failing to find a volunteer for the dangerous task @https://en.wikipedia.org/wiki/Belling_the_Cat>  The story serves as a cautionary tale about the practical feasibility of plans and the inherent difficulty of curbing powerful superiors or addressing collective action problems @https://en.wikipedia.org/wiki/Belling_the_Cat>  Another notable piece of English folklore, \"Dick Whittington and His Cat,\" though formally recorded later (early 17th century), has medieval analogues where a hero achieves wealth by selling a cat in a rodent-infested land, underscoring the cat's economic value as a mouser @https://en.wikipedia.org/wiki/Dick_Whittington_and_His_Cat>  Cats were also sometimes depicted interchangeably with foxes and weasels in popular animal stories, reflecting their shared reputation as sly tricksters @https://www.oberlin.edu/library/friends/research.awards/SIM.pdf>  The tale of a cat playing dead to catch rats was another common narrative circulated in bestiaries @https://www.oberlin.edu/library/friends/research.awards/SIM.pdf> \n\nThese fables, while seemingly simple narratives, often served as profound social commentary and moral instruction. Fables like \"Belling the Cat\" utilized the cat's predatory nature to critique human political and social hierarchies, particularly the challenges of controlling powerful lords or addressing class conflicts @https://en.wikipedia.org/wiki/Belling_the_Cat>  Even bestiary descriptions, despite their seemingly factual accounts, frequently carried underlying moralistic messages @https://bestiary.ca/beasts/beast213.htm>  This demonstrates that animal stories were not merely forms of entertainment but acted as didactic tools, enabling medieval society to navigate complex societal issues and understand human nature through relatable animal figures. Medieval literature, even in its simplest forms, thus provided a subtle yet effective medium for critiquing power structures and imparting moral lessons, using the familiar figures of animals to make abstract concepts accessible.\n\n### **E. The Darker Side: Persecution and its Consequences**\n\nFrom the 12th century, the negative perception of cats escalated into widespread persecution. Thousands of black cats, in particular, were rounded up and burned alive on bonfires, especially on June 24th, the feast day of St. John @https://nautil.us/why-medieval-cats-approved-of-the-plague-236859/>  The screams of the dying cats were often interpreted as the cries of the Devil himself @https://nautil.us/why-medieval-cats-approved-of-the-plague-236859/>  In some regions, such as Ypres, Belgium, the ritualistic cruelty took the form of throwing live cats from the belfry tower of the Cloth Hall, an annual custom that persisted until 1817 @https://nautil.us/why-medieval-cats-approved-of-the-plague-236859/>  French kings were even known to ceremonially ignite these fires, lending royal endorsement to the practice @https://www.reddit.com/r/todayilearned/comments/5lhurx/til_that_in_medieval_times_catburning_was_an/> \n\nThe beliefs underpinning this persecution were deeply rooted in the association of cats with evil, demonic forces, and witchcraft @https://www.medievalists.net/2023/05/cats-hated-medieval-europe/>  It was widely believed that witches could shape-shift into cats, particularly on St. John's Day, to carry out malevolent deeds @https://www.medievalists.net/2023/05/cats-hated-medieval-europe/>  Pope Innocent VIII's decree that witches' pet cats should be burned alongside them further solidified this connection @https://nautil.us/why-medieval-cats-approved-of-the-plague-236859/>  Onlookers, including devout Christians, often found pleasure in these cruel spectacles, believing they were witnessing the defeat of the Devil @https://nautil.us/why-medieval-cats-approved-of-the-plague-236859/> \n\nA popular historical narrative suggests that the widespread extermination of cats, driven by their association with witches, exacerbated the Black Death by allowing rat populations to proliferate unchecked @https://basepaws.com/blog/meowgical-mythology-of-cats>  However, historical scholarship indicates that this is an oversimplification @https://www.reddit.com/r/AskHistorians/comments/1bsoj3h/did_fear_of_witches_exacerbate_the_black_plague/>  While cats were certainly persecuted, attributing the Black Death solely to this action oversimplifies a complex historical and epidemiological event. The persecution of cats was primarily driven by profound religious and social anxieties, not a calculated act that directly caused the plague @https://www.leidenartsinsocietyblog.nl/articles/the-cat-in-medieval-western-europe>  The belief that cats were demonic led to their killing, but the actual impact on rat populations and the subsequent spread of the plague is a nuanced historical debate, not a direct causal link as often portrayed. The idea of \"cats' revenge,\" where their ghosts supposedly enjoyed human suffering after the plague, is a post-persecution belief, not a medieval understanding of epidemiology @https://nautil.us/why-medieval-cats-approved-of-the-plague-236859/>  This highlights the importance of critically examining popular historical narratives and understanding that the primary cause for persecution was ideological, rather than a misunderstanding of public health.\n\n## **II. The Medieval Dog: Loyalty, Labor, and Legend**\n\n### **A. Diverse Roles and Social Hierarchy**\n\nThe majority of dogs in the Middle Ages were working animals, performing a wide array of tasks essential to medieval life @https://www.hindustantimes.com/lifestyle/pet/dogs-in-the-middle-ages-unveiling-our-ancestors-beloved-pets-through-medieval-writing-101706420489220.html>  Hunting dogs were particularly prominent, especially within aristocratic culture, and are frequently mentioned in historical sources @https://www.hindustantimes.com/lifestyle/pet/dogs-in-the-middle-ages-unveiling-our-ancestors-beloved-pets-through-medieval-writing-101706420489220.html>  Specialized breeds such as greyhounds, bloodhounds, spaniels, poodles, and mastiffs were crucial for the hunt @https://www.hindustantimes.com/lifestyle/pet/dogs-in-the-middle-ages-unveiling-our-ancestors-beloved-pets-through-medieval-writing-101706420489220.html>  Greyhounds, admired for their \"incredible swiftness\" and intelligence, were highly esteemed and considered fitting gifts for princes @https://www.historyhit.com/medieval-canines-how-did-the-people-of-the-middle-ages-treat-their-dogs/>  As hunting evolved from a necessity to an aristocratic pastime, the social standing of these dogs was further elevated @https://core.ac.uk/download/pdf/61139956.pdf> \n\nGuard dogs constituted the most common canine vocation, protecting homes, goods, and livestock across all social strata @https://www.historyhit.com/medieval-canines-how-did-the-people-of-the-middle-ages-treat-their-dogs/>  Large mastiffs, for instance, were valued for their ability to instill fear and terror, even being used to secure London Bridge @https://www.youtube.com/watch?v=cLPynXmdfG4>  Beyond these primary roles, dogs also served as turnspits in kitchens, running on wheels to rotate roasting meat, and acted as messengers, game-sniffers, and water-drawers, turning well-wheels to pull up buckets of water @https://www.hindustantimes.com/lifestyle/pet/dogs-in-the-middle-ages-unveiling-our-ancestors-beloved-pets-through-medieval-writing-101706420489220.html> \n\nThe ownership of specific dog breeds, particularly hunting dogs or small lapdogs, served as a clear signifier of high social rank and wealth, as these animals were expensive to acquire and maintain @https://www.sothebysinstitute.com/info-series/medieval-cat-paintings>  Laws often reinforced this social stratification, prohibiting commoners from owning hunting dogs to prevent poaching in royal forests @https://pethelpful.com/pet-news/10-facts-about-dogs-in-medieval-times>  Unlike the often-unbred mongrel guard dogs, the practice of dog breeding, possibly originating from Roman times, continued primarily within aristocratic circles @https://www.historyhit.com/medieval-canines-how-did-the-people-of-the-middle-ages-treat-their-dogs/> \n\nLegal protections and restrictions further underscored the value placed on dogs. In 10th-century Welsh law, the killing of a greyhound was a crime punishable by death @https://pethelpful.com/pet-news/10-facts-about-dogs-in-medieval-times>  Similarly, medieval Scottish law stipulated that if a person killed a guard dog \"thruch villainy or agains the lawe,\" they were obliged to stand watch over the owner's property for the next year in the dog's stead @https://www.historyhit.com/medieval-canines-how-did-the-people-of-the-middle-ages-treat-their-dogs/>  Urban authorities also regulated the keeping of guard dogs due to concerns about potential violence @https://www.hindustantimes.com/lifestyle/pet/dogs-in-the-middle-ages-unveiling-our-ancestors-beloved-pets-through-medieval-writing-101706420489220.html>  The classification of dogs by function and the legal restrictions on their ownership clearly reflect the rigid social hierarchy of the Middle Ages. Dogs were not merely animals; they were living indicators of their owner's status, wealth, and occupation. The aristocratic culture of\n\n*vivre noblement* (the art of living nobly) extended to how dogs were adorned and cared for, further demonstrating their role in publicly displaying one's status @https://www.hindustantimes.com/lifestyle/pet/dogs-in-the-middle-ages-unveiling-our-ancestors-beloved-pets-through-medieval-writing-101706420489220.html>  The treatment and perception of dogs were thus deeply embedded in the feudal system, reinforcing class distinctions and illustrating how human societal structures were mirrored in their relationships with animals.\n\n### **B. Companionship and Emotional Bonds**\n\nDespite the absence of the word \"pet\" before the 16th century, medieval dog owners frequently demonstrated deep affection and indulgence towards their canine companions, much like modern owners @https://www.historyhit.com/medieval-canines-how-did-the-people-of-the-middle-ages-treat-their-dogs/>  Loyalty was consistently cited as the most prized quality in a medieval dog @https://www.historyhit.com/medieval-canines-how-did-the-people-of-the-middle-ages-treat-their-dogs/>  Gaston, Comte de Foix, a 14th-century hunter, famously expressed his profound connection to his hounds, stating, \"I speak to my hounds as I would to a man… and they understand me and do as I wish better than any man of my household\" @https://www.historyhit.com/medieval-canines-how-did-the-people-of-the-middle-ages-treat-their-dogs/>  Similarly, Ibn al-Marzuban's 10th-century work,\n\n*The Book on The Superiority of Dogs over many of Those who wear Clothes*, provides extensive anecdotal evidence of dogs' faithfulness, innate friendliness, staunch defense of their masters, playfulness, and their ability to recognize and form attachments to their human companions and homes @https://www.medievalists.net/2022/06/mans-best-friend-dogs/> \n\nLapdogs, small companion dogs, became particularly prominent among noblewomen by the 13th century, often cradled and pampered @https://www.hindustantimes.com/lifestyle/pet/dogs-in-the-middle-ages-unveiling-our-ancestors-beloved-pets-through-medieval-writing-101706420489220.html>  These dogs served as companions for more sedentary aristocratic lifestyles @https://www.historyhit.com/medieval-canines-how-did-the-people-of-the-middle-ages-treat-their-dogs/>  While some contemporary critics viewed them as a distraction from more \"commendable exercises\" or associated them with female idleness and vice 5, others, like John Caius, noted that some women loved their lapdogs more than their own children, finding \"most perfect recompense\" in their canine companions if they could not have children @https://www.medievalists.net/2025/01/surprising-talents-medieval-dogs/>  Clerics, too, often owned lapdogs, despite formal disapproval from the Church @https://www.hindustantimes.com/lifestyle/pet/dogs-in-the-middle-ages-unveiling-our-ancestors-beloved-pets-through-medieval-writing-101706420489220.html> \n\nThe care and maintenance of dogs, especially those belonging to the elite, further highlight the emotional bonds. Lords employed \"dog-boys,\" dedicated servants responsible for the constant care of hunting dogs, including daily kennel cleaning, providing fresh straw and water, daily rub-downs, and feeding a diet of bran bread and fresh game meat, with richer foods like buttered eggs and goat milk for sick dogs @https://www.historyhit.com/medieval-canines-how-did-the-people-of-the-middle-ages-treat-their-dogs/>  These dog-boys even slept in the kennels to prevent fights @https://pethelpful.com/pet-news/10-facts-about-dogs-in-medieval-times>  Lapdogs received even more luxurious treatment, including special coats, cushions made from fine materials, and even milk as a dietary luxury @https://www.hindustantimes.com/lifestyle/pet/dogs-in-the-middle-ages-unveiling-our-ancestors-beloved-pets-through-medieval-writing-101706420489220.html>  Dogs were also a fixture in medieval religious life, with monks and nuns habitually flouting rules prohibiting pets, and lay people commonly bringing their dogs to church @https://www.historyhit.com/medieval-canines-how-did-the-people-of-the-middle-ages-treat-their-dogs/> \n\nWhile the modern concept of \"pet\" was not formalized until later, the extensive evidence of emotional bonds, as seen in the writings of Gaston de Foix and Ibn al-Marzuban, and the lavish care bestowed upon lapdogs, clearly indicates that affection and companionship were significant aspects of human-dog relationships @https://core.ac.uk/download/pdf/61139956.pdf>  This challenges a simplistic view of medieval animal relations as purely utilitarian. It suggests that the capacity for emotional connection with animals is a deeply ingrained human trait, manifesting even within very different societal structures and linguistic frameworks.\n\n### **C. Mythology, Folklore, and Superstitions**\n\nDogs frequently appear in medieval mythology and folklore as guardians, often of the underworld. Notable examples include Cerberus, the three-headed hound guarding Hades in Greek mythology 33; Garmr, the blood-stained watchdog of Helheim in Norse mythology 33; and Anubis, the jackal-headed Egyptian god who guided souls to the afterlife @https://www.culturefrontier.com/dogs-in-mythology/>  This association with death and the underworld is often linked to their historical scavenging habits @https://en.wikipedia.org/wiki/Black_dog_%28folklore%29 \n\nSpectral black dogs are a prominent motif throughout European folklore, appearing as unnaturally large hounds with glowing red or yellow eyes, often connected with the Devil and serving as omens of death @https://www.culturefrontier.com/dogs-in-mythology/>  Famous examples include Black Shuck of East Anglia and the Barghest of Yorkshire @https://www.dogartists.co.uk/famous-dogs/famous-dogs-in-mythology-legendary-canines-from-myth-and-folklore/>  However, this motif also encompasses benevolent figures, such as the Gurt Dog in Somerset, which was said to guide travelers at night or protect them from danger @https://en.wikipedia.org/wiki/Black_dog_%28folklore%29  The appearance of such black dogs could also presage storms, as seen in the legend of the Tchian d'Bouôlé in Jersey @https://en.wikipedia.org/wiki/Black_dog_%28folklore%29 \n\nOther superstitions surrounding dogs include the belief that they could see ghosts and detect the presence of figures like Hecate, the Greek goddess of terror and darkness, warning humans with their barks @https://www.scienceabc.com/nature/animals/what-are-some-superstitions-involving-animals.html>  A dog crossing between two people was considered an ill omen, predicting quarrels or cancelled engagements @https://www.scienceabc.com/nature/animals/what-are-some-superstitions-involving-animals.html>  Curiously, the hair of a dog that had bitten a person was sometimes believed to be a cure for the bite itself @https://www.scienceabc.com/nature/animals/what-are-some-superstitions-involving-animals.html>  The Welsh legend of Gelert, the faithful hound who bravely killed a wolf to save a baby but was mistakenly slain by his master, remains a poignant and widely known tale, highlighting themes of loyalty and tragic misunderstanding @https://www.historic-uk.com/HistoryUK/HistoryofWales/The-legend-of-brave-Gelert/> \n\nThe portrayal of dogs in folklore as both protectors and harbingers of doom, unlike the more consistently demonized cats, stems from their practical roles as guardians and hunters combined with their ancient mythological associations with death and the underworld @https://www.culturefrontier.com/dogs-in-mythology/>  The \"black dog\" motif, for instance, perfectly captures this ambiguity: simultaneously a terrifying spectral entity and, in some instances, a benevolent guide @https://en.wikipedia.org/wiki/Black_dog_%28folklore%29  This duality reflects a societal understanding of dogs as powerful, perceptive creatures capable of both great good (loyalty, protection) and profound mystery (connection to the unseen, death). Their folklore often served as cautionary tales or attempts to explain inexplicable phenomena.\n\n### **D. Dogs in Medieval Literature and Fables**\n\nMedieval literature, including bestiaries, frequently featured dogs, depicting them as creatures intrinsically linked to human existence. Bestiaries described dogs (*Canis*) as unable to live without men, categorizing them into types for guarding, hunting, and shepherding @https://bestiary.ca/beasts/beast181.htm>  They were believed to possess the ability to heal their own wounds by licking them @https://bestiary.ca/beasts/beast181.htm>  Allegorically, the act of a dog licking its wounds was interpreted as a metaphor for confession curing the wounds of sin, while a dog returning to its vomit symbolized those who confess but then revert to sinful ways @https://bestiary.ca/beasts/beast181.htm> \n\nSeveral famous dogs populate medieval literary works:\n\n* **Cabal (or Cavall)**: King Arthur's hound, mentioned in the 9th-century *Historia Brittonum*, is said to have left a footprint on a stone during the hunt for the formidable boar Twrch Trwynt @https://www.medievalists.net/2018/02/famous-dogs-medieval-literature/>  This detail became a symbol of unwavering loyalty, as the stone would always return to its place on a cairn, much like a faithful hound finding its way home @https://www.medievalists.net/2018/02/famous-dogs-medieval-literature/> \n* **Petitcreiu**: Isolde's beloved lapdog, a magical creature from Avalon, possessed a bell whose chime could make one forget sorrow @https://www.medievalists.net/2018/02/famous-dogs-medieval-literature/>  Though Isolde later removed the bell to embrace her sadness in Tristan's absence, Petitcreiu remained a treasured companion, offering comfort through his mere presence @https://www.medievalists.net/2018/02/famous-dogs-medieval-literature/> \n* **The Chatelaine de Vergy's Little Dog**: In the tragic 13th-century tale, this nameless dog played a pivotal role in facilitating secret rendezvous between the Chatelaine and her knight @https://www.medievalists.net/2018/02/famous-dogs-medieval-literature/>  The dog would lead the knight to his mistress, symbolizing the loyalty and discretion essential to their clandestine affair, ultimately highlighting the devastating consequences when secrets are betrayed @https://www.medievalists.net/2018/02/famous-dogs-medieval-literature/> \n* **Saint Guinefort the Greyhound**: This 12th-13th century French legend tells the poignant story of a greyhound mistakenly killed by his master, a nobleman, who believed the dog had harmed his infant son @https://www.hindustantimes.com/lifestyle/pet/dogs-in-the-middle-ages-unveiling-our-ancestors-beloved-pets-through-medieval-writing-101706420489220.html>  It was later discovered that Guinefort had, in fact, saved the child from a venomous viper. Locals venerated the dog as a saint, although the Catholic Church later denounced his cult as heretical @https://www.hindustantimes.com/lifestyle/pet/dogs-in-the-middle-ages-unveiling-our-ancestors-beloved-pets-through-medieval-writing-101706420489220.html> \n* **Ibn al-Marzuban's Accounts**: The 10th-century *Book on The Superiority of Dogs over many of Those who wear Clothes* by Ibn al-Marzuban compiles numerous stories and poems praising dogs' faithfulness, intelligence, resourcefulness, and life-saving devotion @https://www.medievalists.net/2022/06/mans-best-friend-dogs/>  One anecdote recounts a dog repeatedly bringing bread to its master, who had been attacked, robbed, and left for dead in a ravine, eventually leading the man's son to his rescue @https://www.medievalists.net/2022/06/mans-best-friend-dogs/> \n\nThese literary accounts are replete with anecdotes of canine loyalty and heroism, depicting dogs rescuing their masters, identifying murderers, and remaining steadfastly loyal even after their owners' deaths, as seen in the tales of King Garamantes, Jason's dog, and a Roman dog @https://www.hindustantimes.com/lifestyle/pet/dogs-in-the-middle-ages-unveiling-our-ancestors-beloved-pets-through-medieval-writing-101706420489220.html>  Medieval literature consistently portrays dogs as epitomes of loyalty, intelligence, and devotion @https://www.hindustantimes.com/lifestyle/pet/dogs-in-the-middle-ages-unveiling-our-ancestors-beloved-pets-through-medieval-writing-101706420489220.html>  Stories like Saint Guinefort or Ibn al-Marzuban's anecdotes elevate dogs to heroic status, reflecting human ideals of faithfulness and self-sacrifice. This deep admiration for dogs stands in notable contrast to the often-negative portrayal of cats. Dogs thus served as moral exemplars in medieval society, their perceived virtues reinforcing desired human traits, and their literary presence often celebrated the ideal human-animal bond, reflecting a cultural comfort with their perceived obedience and trainability.\n\n### **E. Dogs in Warfare**\n\nDogs were utilized in warfare from ancient times, often as formidable combatants. Large mastiff-type breeds were sometimes equipped with armor or spiked collars and deployed to attack enemy formations @https://en.wikipedia.org/wiki/Dogs_in_warfare>  The Romans, for example, used dogs as sentries and to hunt escaped slaves @https://www.reddit.com/r/WarCollege/comments/18uxiwe/did_ancient_or_medieval_armies_ever_use_trained/> \n\nWhile their role in medieval European warfare was not as widespread or systematic as in ancient periods, dogs did have limited but recurrent uses. They were often present with armies in the field as \"dogs in war\"—accompanying forces without specific military training—rather than as specifically trained \"war dogs\" @https://e-space.mmu.ac.uk/627409/1/BJMH%20War%20Dogs%20in%20Medieval%20and%20Early%20Modern%20West.pdf>  However, there is some evidence for localized traditions of employing dogs in military garrisons or for guarding supplies @https://e-space.mmu.ac.uk/627409/1/BJMH%20War%20Dogs%20in%20Medieval%20and%20Early%20Modern%20West.pdf>  By the 16th century, there is clearer evidence of aggressive dogs being trained for quasi-military functions, particularly in the context of colonial warfare against indigenous peoples, where their use became a more continuous and disturbing tradition @https://e-space.mmu.ac.uk/627409/1/BJMH%20War%20Dogs%20in%20Medieval%20and%20Early%20Modern%20West.pdf>  The use of dogs in warfare, while sporadic in the medieval period, highlights their utility beyond domestic or hunting roles @https://en.wikipedia.org/wiki/Dogs_in_warfare>  The distinction between a \"dog of war\" (trained for military functions) and a \"dog in war\" (present but not specifically trained) is crucial for understanding their varied roles @https://e-space.mmu.ac.uk/627409/1/BJMH%20War%20Dogs%20in%20Medieval%20and%20Early%20Modern%20West.pdf>  The later, more systematic deployment of trained, aggressive dogs in colonial contexts introduces a significant ethical dimension, revealing how human conflict could exploit animal traits like loyalty and aggression for brutal purposes. This aspect of the human-animal relationship reflects a darker, more instrumental side, demonstrating the moral complexities inherent in human conflict.\n\n## **III. Contrasts and Commonalities: A Comparative Perspective**\n\nThe medieval period presented a fascinating dichotomy in the perception and treatment of cats and dogs, shaped by their inherent natures, practical utilities, and the prevailing cultural and religious beliefs.\n\n### **Comparing their Practical Utility and Perceived Domestication**\n\nCats were primarily valued as mousers, an essential role for food storage and public health, especially in preventing the spread of diseases like the plague @https://www.leidenartsinsocietyblog.nl/articles/the-cat-in-medieval-western-europe>  Despite this vital function, they were often viewed as \"incompletely domesticated\" due to their independent nature and nocturnal habits @https://www.leidenartsinsocietyblog.nl/articles/the-cat-in-medieval-western-europe>  This perceived lack of full submission to human control created significant conceptual tension within a society that expected animals to serve humanity @https://www.leidenartsinsocietyblog.nl/articles/the-cat-in-medieval-western-europe> \n\nDogs, conversely, held a highly diverse range of roles, including hunting, guarding, herding, and even specialized labor like turning spits @https://www.hindustantimes.com/lifestyle/pet/dogs-in-the-middle-ages-unveiling-our-ancestors-beloved-pets-through-medieval-writing-101706420489220.html>  They were generally perceived as loyal, obedient, and more fully domesticated, making them extensions of human control and status @https://core.ac.uk/download/pdf/61139956.pdf>  This fundamental difference in perceived amenability to human authority profoundly influenced their symbolic destinies.\n\n### **Differences in Symbolic Representation**\n\nThe symbolic representations of cats and dogs diverged sharply. Cats were frequently associated with sensuality, seduction, unpredictability, lust, betrayal, and mortality @https://fineart-restoration.co.uk/news/cryptic-creatures-the-symbolism-of-animals-in-art/>  Critically, they were heavily linked to paganism, witchcraft, and the Devil, with black cats being particularly demonized @https://www.medievalists.net/2023/05/cats-hated-medieval-europe/>  Their stealth and cunning, while admired for hunting, were viewed negatively when considering their suitability for companionship @https://flaglerlive.com/cats-middle-ages/> \n\nDogs, on the other hand, predominantly symbolized fidelity, loyalty, protection, and intelligence @https://www.hindustantimes.com/lifestyle/pet/dogs-in-the-middle-ages-unveiling-our-ancestors-beloved-pets-through-medieval-writing-101706420489220.html>  They were strongly associated with nobility, masculine discipline, and vitality @https://fineart-restoration.co.uk/news/cryptic-creatures-the-symbolism-of-animals-in-art/>  While spectral black dogs could be omens of death, many dogs were celebrated as benevolent guardians or heroic figures in folklore @https://en.wikipedia.org/wiki/Black_dog_%28folklore%29 \n\nThe core difference in medieval perception stems from cats' inherent independence versus dogs' perceived obedience @https://core.ac.uk/download/pdf/61139956.pdf>  This biological reality shaped their symbolic destinies: dogs, being more amenable to human control, became symbols of loyalty and order, reflecting human ideals. Cats, resisting full domestication, became symbols of the wild, the uncontrollable, and thus, the demonic, especially in a society seeking order amidst chaos @https://www.leidenartsinsocietyblog.nl/articles/the-cat-in-medieval-western-europe>  The medieval understanding of \"domestication\" was not just about utility but about control and hierarchy. Animals that fit neatly into this hierarchy (dogs) were celebrated, while those that challenged it (cats) became objects of suspicion and fear.\n\n### **Shared Presence in Daily Life, Art, and Literature**\n\nDespite their contrasting symbolic roles, both cats and dogs were ubiquitous in medieval households, art, and literature, reflecting their deep integration into daily life @https://www.sothebysinstitute.com/info-series/medieval-cat-paintings>  Both species were also subject to legal frameworks that governed their value and conduct, underscoring their importance within the societal structure @https://www.leidenartsinsocietyblog.nl/articles/the-cat-in-medieval-western-europe> \n\n### **Evolving Human-Animal Bonds**\n\nWhile the modern concept of a \"pet\" did not fully emerge until the 14th to 16th centuries, clear emotional bonds existed for both cats and dogs, particularly among the elite @https://core.ac.uk/download/pdf/61139956.pdf>  This demonstrates that the capacity for emotional connection with animals is a deeply ingrained human trait, manifesting even within very different societal structures and linguistic frameworks.\n\nThe following tables provide a comparative overview of their legal standing and prominent mythological associations:\n\n**Table 1: Legal Valuations and Protections of Cats and Dogs in Medieval Law**\n\n| Animal | Legal Source/Location | Valuation/Protection | Significance |\n| --- | --- | --- | --- |\n| Cat | Welsh Laws of Hywel Dda (10th century) | 4 pence (adult); 1-2 pence (kitten, age-dependent); value based on mousing ability; compensation for killing/stealing (wheat quantity) 1 | Quantified economic value, highlighting their vital role in pest control and food preservation. |\n| Cat | Early Irish Law | Mouser worth three cows 2 | Extremely high value, indicating critical importance for agricultural stability. |\n| Cat | Saxon Law (Germany) | Killing an adult cat required reimbursement of sixty bushels of grain 2 | Direct link between the cat's utility in eradicating grain-eating mice and its economic worth. |\n| Cat | Royal Barns (General) | Considered \"four-legged civil servants\" deserving protection 1 | Institutional recognition of their public service role. |\n| Dog (Greyhound) | Welsh Laws of Hywel Dda (10th century) | Killing was a crime punishable by death 26 | Reflects their elite status and value in aristocratic hunting. |\n| Dog (Greyhound) | English Forest Laws (11th century) | Ownership restricted to the elite; \"meane person\" (commoner) forbidden 26 | Reinforces social hierarchy and the exclusive nature of aristocratic pursuits. |\n| Dog (Guard Dog) | Scottish Law | If killed \"thruch villainy or agains the lawe,\" perpetrator had to stand watch over owner's property for a year 24 | Legal protection for their vital role in property and livestock security. |\n\nThe explicit monetary and compensatory values detailed in medieval laws provide concrete evidence of how these animals were viewed as assets, not just abstract companions. This moves beyond anecdotal evidence to demonstrate institutional recognition of their importance. The differential legal treatment, such as the death penalty for killing a greyhound versus a year's watch for a guard dog, and restrictions on commoners owning certain breeds, directly illustrates the social stratification embedded in animal ownership. It shows how laws reinforced the status of the elite. The emphasis on mousing skills for cats and hunting/guarding for dogs in legal texts underscores the practical necessities of medieval life—food preservation and security—that drove their legal protection. This table visually consolidates these diverse legal details, making the comparative analysis of their legal standing much clearer.\n\n**Table 2: Key Mythological and Folkloric Figures Associated with Medieval Cats and Dogs**\n\n| Animal | Figure/Concept | Origin/Culture | Associated Traits/Role |\n| --- | --- | --- | --- |\n| Cat | Bastet | Egyptian | Goddess of fertility, divine protector 14 |\n| Cat | Freya's Chariot | Norse | Symbol of fertility and fortune 14 |\n| Cat | Lilith | Biblical/Jewish Folklore | Demonic figure, baby-eater, could shapeshift into a giant black cat 14 |\n| Cat | Witches/Devil | Christian European | Devil's minions, familiars, shapeshifters, idol of witches 13 |\n| Cat | Nine Lives | Egyptian/European Folklore | Myth of immortality due to ability to land on feet 14 |\n| Cat | Breath-Stealer | English Folklore | Believed to suck breath from infants 14 |\n| Cat | Pussy Willows | Polish Legend | Willow trees sprouted fur-like buds after saving kittens 14 |\n| Dog | Cerberus | Greek Mythology | Three-headed guardian of the Underworld 33 |\n| Dog | Garmr | Norse Mythology | Blood-stained watchdog of Helheim (Underworld) 33 |\n| Dog | Anubis | Egyptian Mythology | Jackal-headed god guiding souls to afterlife 33 |\n| Dog | Black Shuck | English Folklore | Ominous spectral black dog, harbinger of death 34 |\n| Dog | Gurt Dog | English Folklore | Benevolent guardian black dog, guides travelers 35 |\n| Dog | Saint Guinefort | French Legend | Greyhound mistakenly killed, revealed to have saved a baby from a viper; venerated locally 5 |\n| Dog | Cú Chulainn | Celtic Mythology | Legendary warrior named \"Hound of Chulainn,\" embodying canine ferocity and loyalty 33 |\n\nThis table systematically categorizes the vast array of mythological and folkloric associations for both animals, allowing for a rapid grasp of their symbolic significance across different cultures and belief systems, including pagan, Christian, and regional folklore. By placing cat and dog myths side-by-side, it visually emphasizes the stark contrasts, such as the cat often being portrayed as demonic versus the dog as a loyal guardian, while also revealing certain continuities, like both being associated with the supernatural, albeit in distinct ways. The table serves as a quick reference for understanding how these animals transcended their physical forms to become powerful archetypes, influencing cultural narratives, fears, and veneration, thereby supporting the argument that their symbolic roles were as significant as their practical ones.\n\n## **Conclusion: Enduring Legacies of Medieval Felines and Canines**\n\nMedieval cats and dogs occupied a complex and often contradictory spectrum of roles within human society. They were, on one hand, indispensable working animals, vital for survival and economic stability—cats as essential mousers protecting food supplies, and dogs as versatile laborers in hunting, guarding, and various other tasks. On the other hand, they were also cherished companions, particularly among the elite, receiving lavish care and forming deep emotional bonds with their owners, even if the modern term \"pet\" had not yet emerged.\n\nBeyond their practical and companionate roles, both species served as potent symbols, reflecting the profound anxieties and ideals of the medieval world. The dog's perceived obedience and loyalty solidified its image as \"man's best friend,\" a moral exemplar that embodied desired human virtues. This perception was reinforced through countless literary tales of heroism and devotion. Conversely, the cat's inherent independence and nocturnal habits made it a creature of mystery, often challenging the medieval belief in human dominion over animals. This led to its unfortunate association with the wild, the uncontrollable, and, critically, with paganism, witchcraft, and the Devil, resulting in periods of severe persecution.\n\nThe medieval period thus laid foundational attitudes towards both species that profoundly shaped later cultural narratives. The dog's enduring image as a faithful companion and protector was firmly established, while the cat's association with mystique and occasional malevolence persisted, influencing folklore and cultural perceptions for centuries to come. The rich tapestry of medieval stories, superstitions, and artistic representations continues to shape our modern understanding and appreciation of these animals, demonstrating their enduring presence in the human imagination and serving as a testament to their complex and multifaceted lives in the medieval world.\n\n#### 引用的著作\n\n1. The Cat in Medieval Western Europe - Leiden Arts in Society Blog, 访问时间为 八月 4, 2025， <https://www.leidenartsinsocietyblog.nl/articles/the-cat-in-medieval-western-europe>\n2. Cats and Dogs: The Development of the Household Pet through Symbolic Interpretations and Social Practices in the Middle Ages and - CORE, 访问时间为 八月 4, 2025， <https://core.ac.uk/download/pdf/61139956.pdf>\n3. Cats and Dogs: The Development of the Household Pet through Symbolic Interpretations and Social Practices in the Middle Ages and Renaissance - University of Iowa, 访问时间为 八月 4, 2025， <https://iro.uiowa.edu/esploro/outputs/undergraduate/Cats-and-Dogs--The-Development/9984111225102771>\n4. Medieval Cat Paintings for Beginners: Exploring the Whimsical Depictions of Cats in Art, 访问时间为 八月 4, 2025， <https://www.sothebysinstitute.com/info-series/medieval-cat-paintings>\n5. Dogs in the middle ages: Unveiling our ancestors' beloved pets through medieval writing, 访问时间为 八月 4, 2025， <https://www.hindustantimes.com/lifestyle/pet/dogs-in-the-middle-ages-unveiling-our-ancestors-beloved-pets-through-medieval-writing-101706420489220.html>\n6. 50wattsbooks.com, 访问时间为 八月 4, 2025， <https://50wattsbooks.com/products/cats-in-medieval-manuscripts-british-library#:~:text=Cats%20were%20illustrated%20in%20medieval,Devil%2C%20and%20as%20magical%20creatures.>\n7. Cats in Medieval Manuscripts | Dr Kathleen Walker-Meikle - Southwark Cathedral, 访问时间为 八月 4, 2025， <https://cathedral.southwark.anglican.org/visiting/southwark-cathedral-history-festival-2025/speakers-friday-18-july-the-cathedral-library/cats-in-medieval-manuscripts-dr-kathleen-walker-meikle/>\n8. Cats in the Medieval Period - Pet Histories - WordPress.com, 访问时间为 八月 4, 2025， <https://pethistories.wordpress.com/2017/10/16/the-supreme-mouser-in-historical-perspective-cats-in-the-medieval-period/>\n9. Cats in the Middle Ages - FlaglerLive, 访问时间为 八月 4, 2025， <https://flaglerlive.com/cats-middle-ages/>\n10. How 3 Very Different Medieval Cultures Treated Cats | History Hit, 访问时间为 八月 4, 2025， <https://www.historyhit.com/how-3-very-different-medieval-cultures-treated-cats/>\n11. Cats in the middle ages: what medieval manuscripts teach us about our ancestors' pets : r/MedievalHistory - Reddit, 访问时间为 八月 4, 2025， <https://www.reddit.com/r/MedievalHistory/comments/13lz5ur/cats_in_the_middle_ages_what_medieval_manuscripts/>\n12. A Most Convenient Relationship: The Rise of the Cat as a Valued Companion Animal, 访问时间为 八月 4, 2025， <https://www.medievalists.net/2016/09/a-most-convenient-relationship-the-rise-of-the-cat-as-a-valued-companion-animal/>\n13. Why Cats were Hated in Medieval Europe - Medievalists.net, 访问时间为 八月 4, 2025， <https://www.medievalists.net/2023/05/cats-hated-medieval-europe/>\n14. Meowgical Mythology Of Cats | Mythical Cats | Myths and Legends - Basepaws, 访问时间为 八月 4, 2025， <https://basepaws.com/blog/meowgical-mythology-of-cats>\n15. The Role of Cats in Mythology: Legends, Luck & Ancient Beliefs - Hobe Sound Veterinary Clinic, 访问时间为 八月 4, 2025， <https://www.hobesoundvet.com/feline-folklore/>\n16. THE MAGIC OF BLACK CATS - Phil and Pearl, 访问时间为 八月 4, 2025， <https://philandpearl.com/blogs/phil-and-pearls-blog/the-magic-of-black-cats>\n17. Why Medieval Cats Approved of the Plague - Nautilus, 访问时间为 八月 4, 2025， <https://nautil.us/why-medieval-cats-approved-of-the-plague-236859/>\n18. TIL that in medieval times \"Cat-burning\" was an accepted practice thought to bring good luck. It was custom to burn a barrel full of live cats over a bonfire as people shrieked with laughter while they were singed and roasted. French Kings often witnessed it and even ceremoniously started the fire. : r/todayilearned - Reddit, 访问时间为 八月 4, 2025， <https://www.reddit.com/r/todayilearned/comments/5lhurx/til_that_in_medieval_times_catburning_was_an/>\n19. Beasts : Cat - Medieval Bestiary, 访问时间为 八月 4, 2025， <https://bestiary.ca/beasts/beast213.htm>\n20. Belling the Cat - Wikipedia, 访问时间为 八月 4, 2025， <https://en.wikipedia.org/wiki/Belling_the_Cat>\n21. Dick Whittington and His Cat - Wikipedia, 访问时间为 八月 4, 2025， <https://en.wikipedia.org/wiki/Dick_Whittington_and_His_Cat>\n22. Intersections of Female and Feline in Medieval Europe - Oberlin College and Conservatory, 访问时间为 八月 4, 2025， <https://www.oberlin.edu/library/friends/research.awards/SIM.pdf>\n23. Did fear of witches exacerbate the black plague in the medieval times? : r/AskHistorians - Reddit, 访问时间为 八月 4, 2025， <https://www.reddit.com/r/AskHistorians/comments/1bsoj3h/did_fear_of_witches_exacerbate_the_black_plague/>\n24. Medieval Canines: How Did the People of the Middle Ages Treat ..., 访问时间为 八月 4, 2025， <https://www.historyhit.com/medieval-canines-how-did-the-people-of-the-middle-ages-treat-their-dogs/>\n25. Dogs in the Wroclaw Stronghold, 2nd Half of the 10th–1st Half of the 13th Century (Lower Silesia, Poland)—An Zooarchaeological Overview - PMC - PubMed Central, 访问时间为 八月 4, 2025， <https://pmc.ncbi.nlm.nih.gov/articles/PMC7923258/>\n26. 10 Fascinating Facts About Dogs in Medieval Times - PetHelpful, 访问时间为 八月 4, 2025， <https://pethelpful.com/pet-news/10-facts-about-dogs-in-medieval-times>\n27. Medieval French Hunter, His Dog, and Their Catch - The Raab Collection, 访问时间为 八月 4, 2025， <https://www.raabcollection.com/medieval-manuscripts/french-hunter>\n28. Animal symbolism in art history - Fine Art Restoration Company, 访问时间为 八月 4, 2025， <https://fineart-restoration.co.uk/news/cryptic-creatures-the-symbolism-of-animals-in-art/>\n29. Surviving Life as a Dog in the Middle Ages... - YouTube, 访问时间为 八月 4, 2025， <https://www.youtube.com/watch?v=cLPynXmdfG4>\n30. Dogs at the Medieval Banquet | Getty Iris, 访问时间为 八月 4, 2025， <https://blogs.getty.edu/iris/dogs-at-the-medieval-banquet/>\n31. Man's Best Friend: Love for Dogs in the 10th century - Medievalists.net, 访问时间为 八月 4, 2025， <https://www.medievalists.net/2022/06/mans-best-friend-dogs/>\n32. The Surprising Talents of Medieval Dogs - Medievalists.net, 访问时间为 八月 4, 2025， <https://www.medievalists.net/2025/01/surprising-talents-medieval-dogs/>\n33. Dogs in Mythology and Folklore from Around the World - Culture Frontier, 访问时间为 八月 4, 2025， <https://www.culturefrontier.com/dogs-in-mythology/>\n34. Famous Dogs in Mythology: Legendary Canines from Myth and Folklore - Dog Artists, 访问时间为 八月 4, 2025， <https://www.dogartists.co.uk/famous-dogs/famous-dogs-in-mythology-legendary-canines-from-myth-and-folklore/>\n35. Black dog (folklore) - Wikipedia, 访问时间为 八月 4, 2025， [https://en.wikipedia.org/wiki/Black\\_dog\\_(folklore)](https://en.wikipedia.org/wiki/Black_dog_%28folklore%29)\n36. Hellhound - Wikipedia, 访问时间为 八月 4, 2025， <https://en.wikipedia.org/wiki/Hellhound>\n37. What Are Some Superstitions Involving Animals? - ScienceABC, 访问时间为 八月 4, 2025， <https://www.scienceabc.com/nature/animals/what-are-some-superstitions-involving-animals.html>\n38. The Legend of Gelert the Dog - Historic UK, 访问时间为 八月 4, 2025， <https://www.historic-uk.com/HistoryUK/HistoryofWales/The-legend-of-brave-Gelert/>\n39. Beasts : Dog - Medieval Bestiary, 访问时间为 八月 4, 2025， <https://bestiary.ca/beasts/beast181.htm>\n40. Famous Dogs in Medieval Literature - Medievalists.net, 访问时间为 八月 4, 2025， <https://www.medievalists.net/2018/02/famous-dogs-medieval-literature/>\n41. Dogs in warfare - Wikipedia, 访问时间为 八月 4, 2025， <https://en.wikipedia.org/wiki/Dogs_in_warfare>\n42. Did ancient or medieval armies ever use trained dogs en masse to attack a formation? : r/WarCollege - Reddit, 访问时间为 八月 4, 2025， <https://www.reddit.com/r/WarCollege/comments/18uxiwe/did_ancient_or_medieval_armies_ever_use_trained/>\n43. The Employment of War Dogs in the Medieval and Early Modern West - MMU e-space, 访问时间为 八月 4, 2025， <https://e-space.mmu.ac.uk/627409/1/BJMH%20War%20Dogs%20in%20Medieval%20and%20Early%20Modern%20West.pdf>\n44. Animals in Medieval Art - The Metropolitan Museum of Art, 访问时间为 八月 4, 2025， <https://www.metmuseum.org/essays/animals-in-medieval-art>\n",
  "all_source_links": [
    "https://50wattsbooks.com/products/cats-in-medieval-manuscripts-british-library#:~:text=Cats%20were%20illustrated%20in%20medieval,Devil%2C%20and%20as%20magical%20creatures.",
    "https://accounts.google.com/SignOutOptions?hl=zh-CN&continue=https://gemini.google.com/%3Fis_sa%3D1%26is_sa%3D1%26android-min-version%3D301356232%26ios-min-version%3D322.0%26campaign_id%3Dbkws%26utm_source%3Dsem%26utm_source%3Dgoogle%26utm_medium%3Dpaid-media%26utm_medium%3Dcpc%26utm_campaign%3Dbkws%26utm_campaign%3D2024enAU_gemfeb%26pt%3D9008%26mt%3D8%26ct%3Dp-growth-sem-bkws%26gclsrc%3Daw.ds%26gad_source%3D1%26gad_campaignid%3D22437964261%26gbraid%3D0AAAAApk5BhmTIKeu82GeBI85qNScnwP3m%26gclid%3DCjwKCAjwkvbEBhApEiwAKUz6-ybVgRKghbvMe_m6J9HfhKccGbx5pv_fQCiPXewPYkQWthYXErb2txoClPAQAvD_BwE&ec=GBRAkgU",
    "https://basepaws.com/blog/meowgical-mythology-of-cats",
    "https://bestiary.ca/beasts/beast181.htm",
    "https://bestiary.ca/beasts/beast213.htm",
    "https://blogs.getty.edu/iris/dogs-at-the-medieval-banquet",
    "https://cathedral.southwark.anglican.org/visiting/southwark-cathedral-history-festival-2025/speakers-friday-18-july-the-cathedral-library/cats-in-medieval-manuscripts-dr-kathleen-walker-meikle",
    "https://core.ac.uk/download/pdf/61139956.pdf",
    "https://e-space.mmu.ac.uk/627409/1/BJMH%20War%20Dogs%20in%20Medieval%20and%20Early%20Modern%20West.pdf",
    "https://en.wikipedia.org/wiki/Belling_the_Cat",
    "https://en.wikipedia.org/wiki/Black",
    "https://en.wikipedia.org/wiki/Black\\_dog\\_(folklore",
    "https://en.wikipedia.org/wiki/Black_dog_%28folklore%29",
    "https://en.wikipedia.org/wiki/Black_dog_(folklore",
    "https://en.wikipedia.org/wiki/Dick_Whittington_and_His_Cat",
    "https://en.wikipedia.org/wiki/Dogs_in_warfare",
    "https://en.wikipedia.org/wiki/Hellhound",
    "https://fineart-restoration.co.uk/news/cryptic-creatures-the-symbolism-of-animals-in-art",
    "https://flaglerlive.com/cats-middle-ages",
    "https://iro.uiowa.edu/esploro/outputs/undergraduate/Cats-and-Dogs--The-Development/9984111225102771",
    "https://myactivity.google.com/product/gemini?utm_source=gemini",
    "https://nautil.us/why-medieval-cats-approved-of-the-plague-236859",
    "https://pethelpful.com/pet-news/10-facts-about-dogs-in-medieval-times",
    "https://pethistories.wordpress.com/2017/10/16/the-supreme-mouser-in-historical-perspective-cats-in-the-medieval-period",
    "https://philandpearl.com/blogs/phil-and-pearls-blog/the-magic-of-black-cats",
    "https://pmc.ncbi.nlm.nih.gov/articles/PMC7923258",
    "https://policies.google.com/terms",
    "https://support.google.com/bard/answer/13594961",
    "https://support.google.com/gemini/answer/13594961#location&zippy=%2Cwhat-location-information-do-gemini-apps-collect-why-and-how-is-it-used",
    "https://www.culturefrontier.com/dogs-in-mythology",
    "https://www.dogartists.co.uk/famous-dogs/famous-dogs-in-mythology-legendary-canines-from-myth-and-folklore",
    "https://www.hindustantimes.com/lifestyle/pet/dogs-in-the-middle-ages-unveiling-our-ancestors-beloved-pets-through-medieval-writing-101706420489220.html",
    "https://www.historic-uk.com/HistoryUK/HistoryofWales/The-legend-of-brave-Gelert",
    "https://www.historyhit.com/how-3-very-different-medieval-cultures-treated-cats",
    "https://www.historyhit.com/medieval-canines-how-did-the-people-of-the-middle-ages-treat-their-dogs",
    "https://www.hobesoundvet.com/feline-folklore",
    "https://www.leidenartsinsocietyblog.nl/articles/the-cat-in-medieval-western-europe",
    "https://www.medievalists.net/2016/09/a-most-convenient-relationship-the-rise-of-the-cat-as-a-valued-companion-animal",
    "https://www.medievalists.net/2018/02/famous-dogs-medieval-literature",
    "https://www.medievalists.net/2022/06/mans-best-friend-dogs",
    "https://www.medievalists.net/2023/05/cats-hated-medieval-europe",
    "https://www.medievalists.net/2025/01/surprising-talents-medieval-dogs",
    "https://www.metmuseum.org/essays/animals-in-medieval-art",
    "https://www.oberlin.edu/library/friends/research.awards/SIM.pdf",
    "https://www.raabcollection.com/medieval-manuscripts/french-hunter",
    "https://www.reddit.com/r/AskHistorians/comments/1bsoj3h/did_fear_of_witches_exacerbate_the_black_plague",
    "https://www.reddit.com/r/MedievalHistory/comments/13lz5ur/cats_in_the_middle_ages_what_medieval_manuscripts",
    "https://www.reddit.com/r/WarCollege/comments/18uxiwe/did_ancient_or_medieval_armies_ever_use_trained",
    "https://www.reddit.com/r/todayilearned/comments/5lhurx/til_that_in_medieval_times_catburning_was_an",
    "https://www.scienceabc.com/nature/animals/what-are-some-superstitions-involving-animals.html",
    "https://www.sothebysinstitute.com/info-series/medieval-cat-paintings",
    "https://www.youtube.com/watch?v=cLPynXmdfG4"
  ],
  "summary_citations": [
    "https://50wattsbooks.com/products/cats-in-medieval-manuscripts-british-library#:~:text=Cats%20were%20illustrated%20in%20medieval,Devil%2C%20and%20as%20magical%20creatures.",
    "https://accounts.google.com/SignOutOptions?hl=zh-CN&continue=https://gemini.google.com/%3Fis_sa%3D1%26is_sa%3D1%26android-min-version%3D301356232%26ios-min-version%3D322.0%26campaign_id%3Dbkws%26utm_source%3Dsem%26utm_source%3Dgoogle%26utm_medium%3Dpaid-media%26utm_medium%3Dcpc%26utm_campaign%3Dbkws%26utm_campaign%3D2024enAU_gemfeb%26pt%3D9008%26mt%3D8%26ct%3Dp-growth-sem-bkws%26gclsrc%3Daw.ds%26gad_source%3D1%26gad_campaignid%3D22437964261%26gbraid%3D0AAAAApk5BhmTIKeu82GeBI85qNScnwP3m%26gclid%3DCjwKCAjwkvbEBhApEiwAKUz6-ybVgRKghbvMe_m6J9HfhKccGbx5pv_fQCiPXewPYkQWthYXErb2txoClPAQAvD_BwE&ec=GBRAkgU",
    "https://basepaws.com/blog/meowgical-mythology-of-cats",
    "https://bestiary.ca/beasts/beast181.htm",
    "https://bestiary.ca/beasts/beast213.htm",
    "https://blogs.getty.edu/iris/dogs-at-the-medieval-banquet",
    "https://cathedral.southwark.anglican.org/visiting/southwark-cathedral-history-festival-2025/speakers-friday-18-july-the-cathedral-library/cats-in-medieval-manuscripts-dr-kathleen-walker-meikle",
    "https://core.ac.uk/download/pdf/61139956.pdf",
    "https://e-space.mmu.ac.uk/627409/1/BJMH%20War%20Dogs%20in%20Medieval%20and%20Early%20Modern%20West.pdf",
    "https://en.wikipedia.org/wiki/Belling_the_Cat",
    "https://en.wikipedia.org/wiki/Black",
    "https://en.wikipedia.org/wiki/Black\\_dog\\_(folklore",
    "https://en.wikipedia.org/wiki/Black_dog_%28folklore%29",
    "https://en.wikipedia.org/wiki/Black_dog_(folklore",
    "https://en.wikipedia.org/wiki/Dick_Whittington_and_His_Cat",
    "https://en.wikipedia.org/wiki/Dogs_in_warfare",
    "https://en.wikipedia.org/wiki/Hellhound",
    "https://fineart-restoration.co.uk/news/cryptic-creatures-the-symbolism-of-animals-in-art",
    "https://flaglerlive.com/cats-middle-ages",
    "https://iro.uiowa.edu/esploro/outputs/undergraduate/Cats-and-Dogs--The-Development/9984111225102771",
    "https://myactivity.google.com/product/gemini?utm_source=gemini",
    "https://nautil.us/why-medieval-cats-approved-of-the-plague-236859",
    "https://pethelpful.com/pet-news/10-facts-about-dogs-in-medieval-times",
    "https://pethistories.wordpress.com/2017/10/16/the-supreme-mouser-in-historical-perspective-cats-in-the-medieval-period",
    "https://philandpearl.com/blogs/phil-and-pearls-blog/the-magic-of-black-cats",
    "https://pmc.ncbi.nlm.nih.gov/articles/PMC7923258",
    "https://policies.google.com/terms",
    "https://support.google.com/bard/answer/13594961",
    "https://support.google.com/gemini/answer/13594961#location&zippy=%2Cwhat-location-information-do-gemini-apps-collect-why-and-how-is-it-used",
    "https://www.culturefrontier.com/dogs-in-mythology",
    "https://www.dogartists.co.uk/famous-dogs/famous-dogs-in-mythology-legendary-canines-from-myth-and-folklore",
    "https://www.hindustantimes.com/lifestyle/pet/dogs-in-the-middle-ages-unveiling-our-ancestors-beloved-pets-through-medieval-writing-101706420489220.html",
    "https://www.historic-uk.com/HistoryUK/HistoryofWales/The-legend-of-brave-Gelert",
    "https://www.historyhit.com/how-3-very-different-medieval-cultures-treated-cats",
    "https://www.historyhit.com/medieval-canines-how-did-the-people-of-the-middle-ages-treat-their-dogs",
    "https://www.hobesoundvet.com/feline-folklore",
    "https://www.leidenartsinsocietyblog.nl/articles/the-cat-in-medieval-western-europe",
    "https://www.medievalists.net/2016/09/a-most-convenient-relationship-the-rise-of-the-cat-as-a-valued-companion-animal",
    "https://www.medievalists.net/2018/02/famous-dogs-medieval-literature",
    "https://www.medievalists.net/2022/06/mans-best-friend-dogs",
    "https://www.medievalists.net/2023/05/cats-hated-medieval-europe",
    "https://www.medievalists.net/2025/01/surprising-talents-medieval-dogs",
    "https://www.metmuseum.org/essays/animals-in-medieval-art",
    "https://www.oberlin.edu/library/friends/research.awards/SIM.pdf",
    "https://www.raabcollection.com/medieval-manuscripts/french-hunter",
    "https://www.reddit.com/r/AskHistorians/comments/1bsoj3h/did_fear_of_witches_exacerbate_the_black_plague",
    "https://www.reddit.com/r/MedievalHistory/comments/13lz5ur/cats_in_the_middle_ages_what_medieval_manuscripts",
    "https://www.reddit.com/r/WarCollege/comments/18uxiwe/did_ancient_or_medieval_armies_ever_use_trained",
    "https://www.reddit.com/r/todayilearned/comments/5lhurx/til_that_in_medieval_times_catburning_was_an",
    "https://www.scienceabc.com/nature/animals/what-are-some-superstitions-involving-animals.html",
    "https://www.sothebysinstitute.com/info-series/medieval-cat-paintings",
    "https://www.youtube.com/watch?v=cLPynXmdfG4"
  ]
}