{
  "query": "Design a 7-day itinerary for Banff and the surrounding areas in Canada. On the first day, depart from Toronto to Calgary and stay one night in Calgary; the rest of the itinerary can be arranged freely.",
  "chain_of_research": {
    "plan_1": {
      "title": "Initial Itinerary Planning\nFocusing on Day 1 Logistics\nNext Steps",
      "description": "I'm starting to plan a 7-day itinerary for Banff and the surrounding areas, as requested. The first day involves traveling from Toronto to Calgary, staying overnight in Calgary, and then spending the remaining six days exploring Banff and nearby national parks like Yoho and Jasper.\nMy immediate focus is on the logistics for Day 1. I'll be looking into flight options from Toronto to Calgary, researching car rental companies available at Calgary International Airport (YYC), and identifying suitable accommodation options in Calgary for the first night.\nI'm currently gathering information on flights, car rentals, and hotels to lay the groundwork for the first day of the trip."
    },
    "search_1": [
      "https://www.yyc.com/en-us/transportation/car-rentals",
      "https://www.hertz.com/us/en/location/canada/alberta/calgary/yyct11",
      "https://www.hotels.com/nh11423579/hotels-in-banff-trail-calgary-alberta",
      "https://www.google.com/travel/flights/flights-from-toronto-to-calgary.html",
      "https://www.booking.com/landmark/ca/banff-trail-c-train.html",
      "https://www.expedia.com/Car-Rentals-In-Calgary-Intl.d4413785.Car-Rental-Guide",
      "https://www.expedia.com/lp/flights/ytz/yyc/toronto-to-calgary",
      "https://www.uber.com/global/en/r/airports/yyc/car-rentals",
      "https://www.hotels.com/de1755389/hotels-near-banff-trail-station-calgary-canada",
      "https://www.alamo.com/en/car-rental-locations/ca/ab/calgary-international-airport-c5a1.html",
      "https://www.skyscanner.com/routes/ytoa/yyc/toronto-to-calgary.html",
      "https://www.expedia.com/Banff-Trail-Calgary-Hotels.0-n553248635921598916-0.Travel-Guide-Filter-Hotels",
      "https://www.expedia.com/lp/flights/yyz/yyc/toronto-to-calgary",
      "https://www.expedia.com/Banff-Trail-Station-Hotels.d6237018.Travel-Guide-Hotels",
      "https://www.aircanada.com/en-ca/flights-from-toronto-to-calgary",
      "https://www.kayak.com/flight-routes/Toronto-Pearson-Intl-YYZ/Calgary-YYC",
      "https://www.enterprise.com/en/car-rental-locations/ca/ab/calgary-international-airport-c5ei.html"
    ],
    "observation_1": "I've successfully gathered information for the first day of the trip. I found that direct flights from Toronto (YYZ) to Calgary (YYC) are readily available from multiple airlines, including Air Canada, WestJet, Porter Airlines, and Flair Airlines, with a flight duration of approximately 4.5 hours. For car rentals, numerous on-site and off-site companies operate at Calgary International Airport (YYC), offering a variety of vehicle types. Regarding accommodation in Calgary, I've identified several hotels, particularly in the 'Banff Trail' and northwest areas, which are well-situated for the onward journey to Banff.",
    "plan_2": {
      "title": "Planning the Banff Base\nNext Steps: Route and Attractions",
      "description": "Now that the initial travel logistics are clear, I'm shifting my focus to planning the core of the Banff itinerary. A key decision is determining the best base for the remaining days. I'm considering Banff town, Canmore, and Lake Louise as potential options, and I'll be researching their unique characteristics, such as atmosphere, dining, proximity to attractions, and cost, to make an informed recommendation.\nMy next steps involve comparing these potential bases and then identifying the most suitable driving route from Calgary to the chosen base, including estimated travel time. I'll also begin to explore key attractions within Banff National Park to help shape the overall itinerary."
    },
    "search_2": [
      "https://parks.canada.ca/pn-np/ab/banff/visit/les10-top10",
      "https://www.banfflakelouise.com/sightseeing",
      "https://abearandbisoninn.com/driving-from-calgary-to-canmore-via-bow-valley-trail",
      "https://illuminatedexperiences.com/calgary-to-canmore",
      "https://www.reddit.com/r/Banff/comments/1eqnlud/banff_vs_canmore_vs_calgary_vs_golden_vs_lake",
      "https://thebanffblog.com/banff-vs-lake-louise",
      "https://abearandbisoninn.com/driving-from-calgary-to-canmore",
      "https://everydaylillie.com/2023/01/04/calgary-to-cochrane-to-canmore-drive",
      "https://thebanffblog.com/banff-vs-canmore",
      "https://www.viamichelin.com/routes/results/calgary-t2g-_-alberta-canada-to-canmore-t1w-_-alberta-canada",
      "https://thebanffblog.com/calgary-to-canmore",
      "https://wereintherockies.com/should-you-stay-in-banff-or-canmore",
      "https://www.fodors.com/community/canada/lake-louise-or-banff-582859",
      "https://www.reddit.com/r/Banff/comments/1j8hrxg/staying_in_lake_louise_or_canmore_late_may_travels",
      "https://wanderlog.com/drive/between/58048/76078/calgary-to-lake-louise-drive",
      "https://www.banfflakelouise.com/blog/how-to-get-to-Banff-Lake-Louise-from-Calgary",
      "https://www.skilouise.com/how-to-get-to-lake-louise",
      "https://thebanffblog.com/calgary-to-lake-louise",
      "https://destinationlesstravel.com/calgary-to-lake-louise",
      "https://www.tourguidecanada.com/lake-louise-alberta.html",
      "https://thebanffblog.com/calgary-to-banff",
      "https://calgaryhomes.ca/blog/calgary-to-banff.html",
      "https://banffeveryday.com/is-the-drive-from-calgary-to-banff-easy-a-complete-guide",
      "https://www.banffjaspercollection.com/brewster-express/stories/road-from-calgary-to-banff",
      "https://www.tourguidecanada.com/calgary-to-banff.html",
      "https://turo.com/blog/canada/wayfaring/calgary-to-banff-drive-the-ultimate-road-trip-guide"
    ],
    "observation_2": "I've analyzed the pros and cons of staying in Banff town, Canmore, and Lake Louise as potential bases for the trip. Banff town emerges as the most logical and convenient choice for a first-time visitor, offering a lively atmosphere, diverse accommodation and dining options, and a central location for many attractions. While Canmore is more relaxed and potentially more affordable, and Lake Louise offers immersion in nature, Banff provides the best balance of accessibility and amenities.",
    "plan_3": {
      "title": "Calgary to Banff Travel\nNext Steps: Detailed Itinerary and Park Exploration",
      "description": "The drive from Calgary to Banff is straightforward, primarily along the Trans-Canada Highway (Highway 1), taking approximately 1.5 hours. There's also a more scenic, albeit slightly longer, option via the Bow Valley Parkway (Highway 1A).\nWith Banff town selected as the primary base, I'm now moving on to structuring the remaining six days of the itinerary. My plan is to group attractions by location to optimize travel time and to research detailed information on key attractions within Banff National Park, including opening hours and ticket prices. I'll also investigate the feasibility of including Yoho and Jasper National Parks in the itinerary, considering driving times and major sights. A crucial next step will be to gather information on reservation systems, particularly for the Parks Canada shuttle to Lake Louise and Moraine Lake, and any other required permits."
    },
    "search_3": [
      "https://www.bluebirdbanff.com",
      "https://parks.canada.ca/pn-np/ab/banff/visit/parkbus/louise",
      "https://yohochalets.com/exploring-the-wonders-of-yoho-national-park",
      "https://thebanffblog.com/moraine-lake-shuttle",
      "https://capturetheatlas.com/top-things-to-do-in-yoho-canada",
      "https://roamtransit.com/fares/reservations",
      "https://www.skilouise.com/lodging-hotels",
      "https://parks.canada.ca/voyage-travel/reserve",
      "https://www.planetware.com/british-columbia/yoho-national-park-cdn-bc-bcyo.htm",
      "https://www.fairmont.com/en/hotels/lake-louise/fairmont-chateau-lake-louise.html",
      "https://www.trivago.com/en-US/odr/hotels-canmore-canada?search=200-34584",
      "https://www.fairmont.com/en/hotels/banff/fairmont-banff-springs.html",
      "https://canmorealberta.com/places-to-stay/hotels",
      "https://banffnationalpark.com/wildlife-banff-national-park",
      "https://www.banfflakelouise.com/wildlife",
      "https://banffcanoeclub.com",
      "https://banff.ca/99/Canoeing",
      "https://www.banffadventures.com/rentals/canoes-kayaks-sups",
      "https://parks.canada.ca/pn-np/ab/banff/activ/randonnee-hiking/lakelouise",
      "https://parks.canada.ca/pn-np/ab/banff/activ/randonnee-hiking",
      "https://www.amatravel.ca/articles/easy-intermediate-hard-hikes-banff",
      "https://www.banfflakelouise.com/blog/9-bucket-list-hikes-banff-national-park",
      "https://snaphappytravel.com/best-stops-on-the-drive-from-banff-to-jasper",
      "https://www.mywanderingvoyage.com/blog/top-10-spots-on-my-jasper-to-banff-roadtrip",
      "https://thebanffblog.com/jasper-itinerary",
      "https://www.banfflakelouise.com/sightseeing",
      "https://thebanffblog.com/calgary-to-banff",
      "https://parks.canada.ca/pn-np/ab/banff/visit/les10-top10",
      "https://thebanffblog.com/banff-vs-lake-louise",
      "https://thebanffblog.com/banff-vs-canmore"
    ],
    "observation_3": "I've made significant progress in gathering information for the Banff itinerary. I've confirmed flight and car rental details for the arrival day in Calgary and identified suitable hotels near the route to Banff. I've also solidified Banff town as the ideal base for the trip due to its central location and amenities. My research has yielded a good list of attractions within Banff, including key lakes and scenic drives, and I've also explored major sights in Yoho and Jasper National Parks, assessing their feasibility as day trips.",
    "plan_4": {
      "title": "Addressing Key Logistics for Popular Sites\nNext Steps: Itinerary Synthesis and Refinement",
      "description": "A crucial insight gained is the importance of the Parks Canada shuttle for accessing popular and often crowded locations like Lake Louise and Moraine Lake. I've gathered information on the booking procedures and dates for this shuttle, which will be vital for planning the daily activities effectively.\nMy next step is to synthesize all the collected information into a detailed 7-day itinerary. I'll be structuring each day with a logical flow of activities, estimating driving times, and providing specific dining and accommodation suggestions. I will also be browsing the remaining URLs to gather more specific details on hiking trails and to provide concrete examples for accommodation and restaurants, ensuring a comprehensive and practical plan."
    },
    "search_4": [
      "https://icefieldsparkway.com",
      "https://www.banffjaspercollection.com/attractions/banff-gondola",
      "https://www.banffadventures.com/rentals/canoes-kayaks-sups",
      "https://www.tripadvisor.com/Restaurants-g154911-Banff_Banff_National_Park_Alberta.html",
      "https://banffnationalpark.com/wildlife-banff-national-park",
      "https://parks.canada.ca/pn-np/ab/banff/activ/randonnee-hiking/lakelouise"
    ],
    "observation_4": "I've gathered a substantial amount of information to construct a comprehensive 7-day itinerary for Banff and the surrounding areas. I have details on flights, car rentals, and hotels for the arrival day in Calgary, and I've confirmed Banff town as the ideal base for the remainder of the trip. I've also identified numerous attractions and activities within Banff, Yoho, and along the Icefields Parkway, including crucial information about the Parks Canada shuttle for Lake Louise and Moraine Lake.",
    "plan_5": {
      "title": "Addressing Information Gaps\nNext Steps: Finalizing the Itinerary",
      "description": "While I've successfully browsed most of the necessary resources, I'm still working to obtain specific details for Johnston Canyon, Emerald Lake, and Takakkaw Falls from the Parks Canada website, as these were previously inaccessible. I will attempt to find alternative sources for this information to ensure the itinerary is as complete as possible.\nMy next step is to synthesize all the gathered information into a detailed day-by-day itinerary. This will include a logical flow of activities, estimated driving times, and suggestions for dining and accommodation. I will also conduct a few final searches to fill the remaining information gaps for Johnston Canyon, Emerald Lake, and Takakkaw Falls before finalizing the research and compiling the complete report."
    },
    "search_5": [
      "https://www.johnstoncanyon.com/guide-johnston-canyon-trail",
      "https://crmr.com/activities/hikes/johnston-canyon-falls",
      "https://thebanffblog.com/emerald-lake",
      "https://thecreativeadventurer.com/the-easy-essential-guide-to-hiking-johnston-canyon-in-banff-national-park",
      "https://parks.canada.ca/pn-np/bc/yoho/activ/randonnee-hike/jour-day",
      "https://irockersup.ca/blogs/stories/emerald-lake-activities",
      "https://thebanffblog.com/takakkaw-falls-in-yoho",
      "https://www.banfflakelouise.com/experiences/johnston-canyon",
      "https://www.travelbanffcanada.com/johnston-canyon-hike-banff-national-park",
      "https://travelwiththesmile.com/blog/emerald-lake-yoho",
      "https://thebanffblog.com/johnston-canyon-hike",
      "https://adventures.com/canada/attractions/waterfalls/takakkaw-falls",
      "https://travelwiththesmile.com/blog/takakkaw-falls-yoho-national-park",
      "https://www.laidbacktrip.com/posts/takakkaw-falls-yoho-national-park",
      "https://travelwithwes.com/post/takakkaw-falls-yoho-national-park-guide-with-photos",
      "https://parks.canada.ca/pn-np/bc/yoho/activ",
      "https://parks.canada.ca/pn-np/bc/yoho/activ/places",
      "https://explorewithalec.com/yoho-national-park-itinerary"
    ],
    "observation_5": "I've successfully gathered all the necessary information to create a comprehensive 7-day itinerary for Banff and the surrounding areas. This includes details on flights from Toronto to Calgary, car rental options at Calgary International Airport, and suitable hotels in Calgary for the first night. I've also confirmed Banff town as the ideal base for the trip and have a robust list of attractions and activities within Banff, Yoho, and along the Icefields Parkway. Crucially, I've now obtained the specific details for Johnston Canyon, Emerald Lake, and Takakkaw Falls, which were the last pieces of information needed.",
    "plan_6": {
      "title": "Comprehensive Planning Achieved\nReady to Generate the Report",
      "description": "My research has reached a point of saturation, meaning I have a complete picture of the logistics, attractions, and activities required to build a detailed itinerary. I've considered factors like driving times, shuttle services for popular sites like Lake Louise and Moraine Lake, and general park information to ensure a well-rounded plan.\nWith all the necessary information now in hand, I am ready to synthesize it into a detailed, day-by-day itinerary. My next action will be to finalize the research phase and generate the complete report as requested."
    }
  },
  "final_report": "# **The Seven-Day Rocky Mountain Tapestry: An Expert Itinerary for Banff & Beyond**\n\n## **Introduction: From Urban Sprawl to Alpine Grandeur**\n\nThe journey from the sprawling urban landscape of Toronto to the heart of the Canadian Rockies is more than a simple change in geography; it is a profound shift in scale, pace, and perspective. One leaves behind the familiar rhythm of the city for the timeless, colossal grandeur of mountains that have stood for millennia. This itinerary is designed as an expertly curated framework for that very transformation. It is a seven-day narrative, meticulously planned to guide the traveler from the gateway city of Calgary deep into the turquoise-hued, peak-crowned splendor of Banff, Lake Louise, and Yoho National Park.\n\nThis is not a rigid, prescriptive schedule. Rather, it is a strategic blueprint built on deep local knowledge and logistical foresight. It is designed to navigate the complexities of travel in one of the world's most popular natural destinations—from securing the most sought-after shuttle reservations to choosing the most efficient and scenic driving routes. The following pages will serve as both a practical guide and an inspiring travel dossier, empowering the discerning planner to move beyond the surface and unlock the most profound experiences the Rockies have to offer. This journey is a tapestry woven from iconic vistas, thrilling adventures, quiet moments of reflection, and the unparalleled majesty of the wild.\n\n## **Section 1: The Expedition Blueprint: Pre-Trip Logistics & Strategy**\n\nA successful expedition into the Canadian Rockies begins long before one sets foot in Alberta. It is founded on a series of strategic decisions and timely bookings that transform a potentially stressful undertaking into a seamless adventure. This section provides the foundational blueprint for the journey, addressing the critical logistical pillars that must be in place before departure. Each recommendation is based on a thorough analysis of available options, designed to optimize time, comfort, and the overall quality of the experience.\n\n### **1.1 Your Passage to the West: Navigating Air Travel from Toronto to Calgary**\n\nThe initial leg of the journey is a flight from Toronto to Calgary International Airport (YYC), a major hub serving as the primary gateway to the Rockies. The flight itself is a routine domestic trip, but the choices made here have a direct impact on the tone and timing of the entire first day.\n\nSeveral airlines service this popular route, offering a spectrum of cost and service levels. Major carriers like Air Canada and WestJet provide extensive schedules with dozens of non-stop flights weekly from both Toronto Pearson International Airport (YYZ) and Billy Bishop Toronto City Airport (YTZ).1 Porter Airlines also offers a significant number of direct flights.1 On the other end of the spectrum, budget carrier Flair Airlines presents compellingly low base fares, with one-way tickets sometimes available for as little as $44 to $52.1\n\nWhile the low headline price of a budget airline is tempting, a trip of this nature, likely involving outdoor gear and a need for schedule reliability, warrants a closer look. The base fares on carriers like Flair often exclude checked baggage, carry-on luggage, and seat selection, the costs of which can accumulate and erode initial savings. For a seven-day journey, the potential for added fees and the consequences of a delay or cancellation on an airline with a less frequent schedule could disrupt the carefully planned itinerary that follows. Therefore, a full-service carrier may represent a better overall value proposition.\n\nFlight prices fluctuate seasonally, with January and February being the cheapest months to fly (typically $100-$281), and July being the most expensive.1 The flight duration for a non-stop journey is approximately 4 hours and 30 minutes, accounting for the two-hour time difference between Toronto (Eastern Time) and Calgary (Mountain Time).1\n\nThe most critical strategic decision regarding the flight is the arrival time. The high frequency of daily flights offers the choice between an early morning arrival or a later one. An early flight, such as one landing around 9:00 AM MT 4, transforms Day 1 from a mere travel day into a valuable opportunity to explore Calgary, making the city a destination in its own right. A late evening arrival relegates Calgary to a simple overnight stop. This itinerary is structured around an early-to-midday arrival to maximize the first day's potential.\n\n### **1.2 Securing Your Mountain Chariot: A Deep Dive into Calgary Car Rentals**\n\nUpon arrival at YYC, a rental vehicle is essential for the freedom and flexibility required to explore the vast landscapes of the national parks. The airport is well-equipped with numerous rental agencies, but making the right choice of both company and vehicle type is paramount.\n\nThe Rental Car Centre at YYC is conveniently located on the Departures Level, directly across the roadway from the Domestic Terminal, and is also accessible via the elevator lobby opposite the Arrivals entrance.6 This on-site facility hosts all the major international brands, including Avis, Budget, Enterprise, Hertz, National, and Alamo.6 Several off-site companies, such as Routes and Zoom Rent A Car, also operate, offering shuttle pick-up from Bus Bay #22 on the Arrivals level.6\n\nWhile off-site rentals can sometimes offer marginally lower daily rates, this is a classic time-versus-money calculation. The process of waiting for and traveling via shuttle after a flight consumes valuable time that could be better spent exploring or getting ahead of traffic. For a trip where every hour of daylight is precious, the convenience of an on-site rental is highly recommended.\n\nThe choice of vehicle is arguably more important than the choice of company. Given the unpredictable nature of mountain weather—where snow can fall even in summer months—and the remote nature of some roads like the Icefields Parkway, an SUV or a vehicle with all-wheel drive is not a luxury but a crucial tool for safety and accessibility.8 Such a vehicle provides higher clearance for varied road conditions and superior traction, ensuring that a sudden change in weather does not derail a key part of the itinerary. Rental companies offer a wide range of vehicles, including Standard Elite SUVs that can accommodate five people and luggage.11 Daily rental rates can fluctuate significantly, with prices ranging from as low as $32 for an economy car to over $150 for an SUV, depending on the season and demand.8 Booking well in advance is advisable.\n\n### **1.3 The Gateway Drive: Choosing Your Route from Calgary to the Mountains**\n\nThe drive from Calgary to the national park entrance is the traveler's first immersion into the landscape of the West. It is not merely a transit leg but a scenic overture to the week's adventure. There are two primary routes, each offering a distinct experience.12\n\nThe most direct path is the **Trans-Canada Highway (Highway 1)**. This multi-lane, well-maintained highway covers the approximately 130 km to Banff in about 1.5 hours under normal conditions.9 The drive begins on the prairies, but about 45 minutes in, the dramatic Front Ranges of the Rocky Mountains begin to dominate the horizon.12 Key landmarks visible from this route include Canada Olympic Park on the left as one leaves Calgary, and the impressive peak of Mount Yamnuska before reaching Canmore.14\n\nThe alternative is the more leisurely **Bow Valley Trail (Highway 1A)**. This route runs roughly parallel to the Trans-Canada but is a two-lane road that winds through rolling foothills and charming small towns, adding approximately 20-30 minutes to the journey.13 This scenic drive is an experience in itself, offering opportunities for curated stops that transform the drive into a memorable part of the day. Popular detours include the town of Cochrane, famous for Mackay's Ice Cream, and the Yamnuska Wolfdog Sanctuary, which offers a unique opportunity to learn about and see wolfdogs up close.17\n\nFor the purposes of this itinerary, a strategic approach is recommended: take the scenic **Highway 1A on Day 2** when driving *to* the mountains, when energy and excitement are high. This allows the journey itself to be an attraction. For the return trip on **Day 7**, when the focus is on catching a flight, the faster and more direct **Highway 1** is the more practical choice.12\n\n### **1.4 Establishing Your Basecamp: A Strategic Guide to Rocky Mountain Accommodation**\n\nThe choice of where to stay is one of the most consequential decisions in planning a Rockies trip. The three main hubs—Banff, Canmore, and Lake Louise—each present a unique set of advantages and disadvantages that can significantly shape the daily experience.20\n\n* **Banff:** As the historic heart of the park, Banff is a bustling, walkable resort town with a vast array of restaurants, shops, and nightlife.21 It is centrally located to many key attractions like the Banff Gondola and Lake Minnewanka. However, this popularity comes at a cost: accommodation is expensive, often older, and the town can be extremely crowded, especially in summer.21\n* **Canmore:** Located just outside the park gates, about a 20-minute drive east of Banff, Canmore offers a more relaxed, \"local\" feel.21 Accommodation here generally provides better value, with more modern options and a greater availability of suites with kitchens, which is ideal for families or longer stays.21 The trade-off is the additional daily driving time required to reach attractions within Banff National Park.21\n* **Lake Louise:** This small hamlet offers unparalleled proximity to its namesake lake, Moraine Lake, and the Icefields Parkway.20 Staying here allows for early morning access to these iconic spots before the crowds arrive. However, it is very isolated, with extremely limited and expensive dining and shopping options, and virtually no nightlife.20\n\nFor a seven-day trip designed to experience the full breadth of the region, a single base of operations is suboptimal. Staying solely in Banff or Canmore results in long, repetitive driving days to reach Lake Louise and the Icefields Parkway. Conversely, staying only in Lake Louise makes exploring the Banff townsite feel like a major excursion and the lack of amenities can become tiresome over several nights.\n\nTherefore, the most efficient and enriching approach is a **\"split stay\" strategy**. This itinerary is built around this concept, allocating nights geographically to minimize driving and maximize experience. The proposed structure is:\n\n* **Day 1:** Calgary\n* **Days 2-4:** Banff or Canmore\n* **Days 5-6:** Lake Louise\n\nThis structure groups activities logically, aligns the strengths of each location with the daily plan, and creates a more relaxed and immersive journey.\n\n### **1.5 The Keys to the Kingdom: Essential Park Passes & Shuttle Reservations**\n\nNavigating access to the jewels of Banff National Park requires advance planning, particularly for the most popular areas. Two items are non-negotiable: a Parks Canada Pass and shuttle reservations for Lake Louise and Moraine Lake.\n\n**Parks Canada Discovery Pass:** A pass is required for entry into all national parks in Canada, including Banff and Yoho. A daily pass can be purchased at the park gates upon entry (located on Highway 1 just after Canmore), but for a multi-day trip, a yearly **Discovery Pass** is more economical.9 The Discovery Pass provides unlimited admission for a full year to over 80 Parks Canada locations for a group of up to seven people arriving in a single vehicle. It can be purchased online in advance from the Parks Canada website, which is highly recommended to save time at the gate.\n\n**Lake Louise & Moraine Lake Shuttle Reservations:** This is the single most critical booking of the entire trip. Due to overwhelming demand, **Moraine Lake Road is closed to all personal vehicles year-round**.26 Access is exclusively via Parks Canada shuttles or licensed commercial tour operators. The parking lot at Lake Louise also fills before sunrise in the summer, making the shuttle the only practical and guaranteed way to visit both lakes in a single day.\n\nFailure to secure a shuttle reservation will likely mean missing Moraine Lake, one of the park's most iconic vistas. The system is highly competitive. Reservations for the entire season typically open on a specific day in the spring (e.g., April 16, 2025 at 8 am MDT), with 40% of the season's tickets released at that time.26 The remaining 60% of tickets are released on a rolling basis at 8 am MDT, exactly two days prior to the departure day.27\n\nIt is imperative to create an account on the **Parks Canada Reservation Service** website well in advance of the launch day and to be logged in and ready to book at the precise moment reservations open.27\n\nThe table below demystifies the complex access system, outlining the primary options for visiting these two lakes.\n\n| **Access Option** | **Booking Method** | **Booking Window** | **Key Benefit** | **Key Limitation / Cost** |\n| --- | --- | --- | --- | --- |\n| **Parks Canada Shuttle** | Parks Canada Reservation Service (Online/Phone) 26 | Initial release in spring (e.g., April 16); rolling 60% release 2 days prior at 8 am MDT 27 | Most affordable and official method; includes free Lake Connector shuttle between lakes. | Extremely high demand; tickets sell out in minutes. Departs from Park & Ride at Lake Louise Ski Resort. |\n| **Roam Public Transit** | Roam Transit Website (\"Reserve Now\") 29 | Reservations open in stages for the summer season 29 | **Reservable Super Pass** ($30 Adult) includes Route 8X from Banff and the Parks Canada Lake Connector. | Access to Moraine Lake is only via the Super Pass; regular tickets do not include the Connector. Requires travel from Banff. |\n| **Private Tour Operators** | Direct booking with companies (e.g., Moraine Lake Bus Company) 27 | Varies by company; often available further in advance. | Guaranteed access, often with value-added commentary or unique timing (e.g., sunrise tours). | Significantly more expensive than public options. |\n| **Biking** | No booking required. | N/A | Freedom to go at any time. | A demanding 15 km uphill ride on Moraine Lake Road with significant elevation gain. Requires a high level of fitness. |\n\n## **Section 2: The Itinerary: A Seven-Day Journey**\n\nThis day-by-day guide is the narrative heart of the expedition. It translates the strategic planning of the previous section into a tangible, flowing adventure. The itinerary is paced to balance iconic sightseeing with opportunities for spontaneous discovery, structured around the efficient \"split stay\" model to minimize transit time and maximize immersion in each of the Rockies' distinct regions.\n\n### **Itinerary at a Glance**\n\n| **Day** | **Theme** | **Overnight Location** | **Key Activities** |\n| --- | --- | --- | --- |\n| **Day 1** | Prairie Skies to City Lights | Calgary | Arrival at YYC, car rental, check-in, explore Calgary. |\n| **Day 2** | The Banff Overture | Banff / Canmore | Scenic drive on Hwy 1A, Banff Gondola, Banff Upper Hot Springs, explore Banff town. |\n| **Day 3** | The Turquoise Jewels | Banff / Canmore | Shuttle to Moraine Lake & Lake Louise, hiking, sunset at Vermilion Lakes. |\n| **Day 4** | Canyons, Parkways & Relocation | Lake Louise | Johnston Canyon hike, drive Bow Valley Parkway, check into Lake Louise accommodation. |\n| **Day 5** | A Journey Through Time | Lake Louise | Full-day drive on the Icefields Parkway to the Columbia Icefield. |\n| **Day 6** | Wonders of Yoho | Lake Louise | Day trip to Yoho National Park: Takakkaw Falls, Emerald Lake, Natural Bridge. |\n| **Day 7** | A Final Mountain Glimpse | Departure from Calgary | Leisurely breakfast, direct drive to YYC on Hwy 1, departure. |\n\n### **Day 1: Prairie Skies to City Lights — Arrival and Acclimatization in Calgary**\n\n**Theme:** The journey begins. This day is about transitioning from travel mode to adventure mode, settling in, and getting a first taste of Alberta.\n\n**Morning/Afternoon:** The adventure commences with an early-to-midday arrival at Calgary International Airport (YYC). After disembarking, proceed to the on-site **Rental Car Centre** located on the Departures Level to collect the pre-booked SUV.6 The convenience of an on-site pickup avoids delays and allows for a swift departure from the airport.\n\nThe first drive is a short one to the chosen accommodation. For optimal positioning for the following day's journey into the mountains, it is strategic to book a hotel in the northwest quadrant of Calgary, particularly in the **Banff Trail or University district**.30 This location provides easy access to the Trans-Canada Highway, allowing one to bypass the bulk of city traffic when heading west. A variety of reliable options are available here, including the Hampton Inn & Suites, Best Western Plus Village Park Inn, and Aloft Calgary University.30\n\n**Evening:** After checking in and dropping off luggage, the remainder of the day is free to explore Calgary. A great option is to head downtown to the **Stephen Avenue Walk**, a pedestrian mall lined with historic buildings, shops, and a diverse array of restaurants. Alternatively, for a more relaxed evening, consider a visit to Prince's Island Park for a riverside stroll.\n\n**Dining:** Calgary's culinary scene is vibrant. For this first night, consider a classic Alberta steakhouse or a more contemporary Canadian restaurant in the downtown core.\n\n### **Day 2: The Banff Overture — The Town, The Gondola, and The Springs**\n\n**Theme:** The first full immersion into the Rockies, combining breathtaking panoramic views with the historic charm of Banff town and a classic alpine wellness experience.\n\n**Morning:** Following breakfast in Calgary, the true mountain adventure begins. Take the scenic **Highway 1A (Bow Valley Trail)** west out of the city.13 This leisurely route offers a more intimate introduction to the foothills than the main highway. A worthwhile optional stop is the\n\n**Yamnuska Wolfdog Sanctuary**, located a short drive from Cochrane, which provides a fascinating and educational look at these magnificent animals.18 Continuing west, the mountains grow ever larger, creating a dramatic sense of arrival. Upon reaching the town of Banff, check into the pre-booked accommodation. Options range from the iconic luxury of the\n\n**Fairmont Banff Springs** to more moderate hotels that line Banff Avenue.33\n\n**Afternoon:** The afternoon is dedicated to gaining perspective. Drive up to the base of Sulphur Mountain and take the **Banff Gondola** to the summit.35 The eight-minute ride offers spectacular, unfolding views of six mountain ranges. At the top, a world-class interpretive centre and a 360-degree observation deck await. Stroll the ridgetop boardwalk to Sanson's Peak, the site of a historic meteorological observatory, for an even more expansive vista.35 It is advisable to book gondola tickets in advance online to secure a time slot and potentially save on cost.\n\n**Evening:** After descending from the peak, a short drive leads to the **Banff Upper Hot Springs**, a perfect way to soothe travel-weary muscles.36 Soaking in the mineral-rich, geothermally heated water while surrounded by snow-capped peaks is a quintessential Banff experience. Towel and swimsuit rentals are available on-site.36 Following the soak, return to the town of Banff for dinner and an evening stroll along the lively streets.\n\n**Dining:** Banff offers a plethora of dining choices. For a memorable meal, consider the **Bluebird Woodfired Steakhouse** for prime cuts in a stylish, mid-century setting 37, or\n\n**The Balkan Restaurant** for vibrant Greek and Mediterranean dishes.38 For a more casual but highly-rated option,\n\n**Park Distillery Restaurant + Bar** offers campfire-inspired cooking and its own craft spirits.38\n\n### **Day 3: The Turquoise Jewels — A Logistical Masterclass at Lake Louise & Moraine Lake**\n\n**Theme:** A day dedicated to two of the most famous lakes on Earth. Success today hinges entirely on the pre-booked shuttle reservation, a logistical necessity for accessing these immensely popular and breathtaking locations.\n\n**Morning:** An early start is essential. Drive from the Banff/Canmore base to the **Lake Louise Park and Ride**, located at the Lake Louise Ski Resort on Whitehorn Road.26 Be sure to arrive well in advance of the reserved shuttle departure time. The recommended strategy is to take the first available shuttle directly to\n\n**Moraine Lake**. The \"Valley of the Ten Peaks\" is often at its most serene in the morning light, with the water's surface like glass. Upon arrival, the first priority is the short but essential hike up the **Rockpile Trail**. This easy, 15-minute climb leads to the iconic viewpoint from which the most famous photographs of the lake are taken.39 Afterwards, descend and walk a portion of the flat\n\n**Moraine Lake Lakeshore trail** to appreciate the scale of the surrounding peaks and the impossibly turquoise water.40\n\n**Afternoon:** After soaking in the beauty of Moraine Lake, locate the stop for the **Lake Connector shuttle**. This free, first-come, first-served bus runs every 30 minutes between the two lakes for those with a valid Parks Canada shuttle reservation.26 The short ride brings you to the\n\n**Lake Louise lakeshore**, dominated by the imposing Victoria Glacier and the grand Fairmont Chateau Lake Louise. Walk the easy, paved **Lake Louise Lakeshore trail** that stretches along the northern edge of the lake, offering ever-changing perspectives of the glacier.40 For those with more energy and time, the\n\n**Lake Agnes Teahouse trail** is a classic moderate hike. The trail climbs 3.9 km through the forest to a charming, historic teahouse nestled beside a stunning alpine lake. The round trip takes approximately 2.5 to 3 hours.39\n\n**Evening:** At the end of the afternoon, take the shuttle from the Lake Louise lakeshore back to the Park and Ride. On the drive back to the Banff/Canmore base, make a sunset detour to **Vermilion Lakes Drive**, just outside the Banff townsite. This quiet road offers spectacular reflections of Mount Rundle in the placid waters and is one of the best locations in the park for spotting wildlife like elk and deer, especially at dusk.36\n\n**Dining:** After a long day of exploring, a relaxed dinner in Banff is in order. Consider **Three Bears Brewery & Restaurant** for its craft beer and creative menu in a lively, open-concept space.38\n\n### **Day 4: Canyons, Parkways, and Local Rhythms**\n\n**Theme:** A day of contrasts, from the intimate, water-carved depths of a canyon to the open vistas of a scenic parkway. This is also a strategic relocation day, moving the base of operations closer to the adventures of the coming days.\n\n**Morning:** Depart from the Banff/Canmore accommodation and head west on the **Bow Valley Parkway (Highway 1A)**. This scenic alternative to the Trans-Canada Highway is a destination in itself, with a lower speed limit that encourages wildlife spotting.9 The primary destination for the morning is\n\n**Johnston Canyon**. This is one of Banff's most popular hikes for good reason; a well-maintained trail and a series of catwalks bolted to the limestone cliffs lead you deep into the canyon.42 The easy walk to the\n\n**Lower Falls** is 1.2 km one-way and takes about an hour round-trip. Continuing on the trail for another 1.3 km leads to the much larger and more dramatic **Upper Falls**.44 Hiking in the morning on a weekday is the best strategy to avoid the significant crowds that flock here.42\n\n**Afternoon:** After the hike, it's time for the pivotal strategic move of the trip. Continue driving west on the Bow Valley Parkway, rejoining the Trans-Canada Highway to reach the hamlet of **Lake Louise**. Check into the pre-booked accommodation for the next two nights. Options here are more limited but offer incredible proximity to the next days' activities. Choices include the luxurious **Fairmont Chateau Lake Louise**, the comfortable **Lake Louise Inn**, or the cozy **Mountaineer Lodge**.46 This relocation saves hours of driving over the next two days.\n\n**Evening:** With the main activities for the day complete, the evening is for settling in and exploring the small **Lake Louise village**, centered around the Samson Mall.48 The village contains a visitor centre, a small grocery store, and a few shops and casual eateries. Enjoy a relaxed dinner and an early night in preparation for the epic journey ahead.\n\n**Dining:** Dining in Lake Louise is more limited and generally more expensive than in Banff.20 For a casual meal, the options in the Samson Mall suffice. For a more memorable experience, consider making a reservation at one of the acclaimed restaurants in the area's hotels, such as the\n\n**Post Hotel & Spa** or the various dining rooms within the **Fairmont Chateau Lake Louise**.\n\n### **Day 5: A Journey Through Time — The Icefields Parkway**\n\n**Theme:** An epic road trip on what is widely considered one of the most beautiful drives in the world. Today is about the journey itself, a slow-paced exploration of glaciers, impossibly colored lakes, and vast mountain wilderness.\n\n**Full Day:** Starting from a base in Lake Louise provides a significant head start for this full-day excursion. Before departing, ensure the vehicle has a **full tank of fuel**, as there are no gas stations along the 230 km parkway until Jasper.15 It is also wise to pack a lunch, snacks, and water. The drive north on the\n\n**Icefields Parkway (Highway 93)** is a continuous chain of stunning vistas. The plan is to drive to the Columbia Icefield, the day's main objective and turnaround point, and visit other key sights along the way.\n\n**Key Stops (in order, heading north):**\n\n1. **Hector Lake Viewpoint:** An early stop offering a beautiful view of one of the largest lakes in Banff.\n2. **Bow Lake:** Located right beside the highway, this is an easy and essential photo stop. The massive Crowfoot Glacier and Wapta Icefield loom over the brilliant blue water.49\n3. **Peyto Lake:** A short, slightly uphill walk from the parking lot leads to one of the most breathtaking viewpoints in the Rockies. The view from the platform reveals the lake's stunning turquoise color and unique wolf-head shape.49\n4. **Columbia Icefield:** This is the highlight and midpoint of the journey. It is highly recommended to book the **Glacier Adventure** tour in advance. This experience includes a ride on the massive Ice Explorer vehicle directly onto the surface of the **Athabasca Glacier**, where one can walk on ice that is centuries old. The ticket also includes admission to the **Glacier Skywalk**, a glass-floored observation platform that extends over the Sunwapta Valley.49 Allow at least 3-4 hours for this entire experience.\n\n**Key Stops (in order, heading south on the return):**\n\n1. **Sunwapta Falls:** On the drive back towards Lake Louise, stop at this powerful waterfall where the Sunwapta River makes a sharp turn and plunges into a narrow gorge.49 A short walk from the parking lot provides excellent views.\n2. **Athabasca Falls:** Further south, this is one of the most powerful waterfalls in the Rockies. While not particularly high, the sheer volume of water carving its way through the narrow gorge is a spectacular display of nature's force.49\n\n**Evening:** Arrive back in Lake Louise after a long but rewarding day of sightseeing.\n\n**Dining:** Dinner at your Lake Louise hotel or one of the local restaurants.\n\n### **Day 6: Wonders of Yoho — Waterfalls, Emerald Waters, and Serene Paddles**\n\n**Theme:** A day trip to the adjacent but distinctly different Yoho National Park. Yoho, a Cree word for \"awe and wonder,\" lives up to its name with towering waterfalls, a gem-colored lake, and marvels of railway engineering.\n\n**Morning:** From the Lake Louise base, the drive into **Yoho National Park** in British Columbia is short and scenic. The first major destination is **Takakkaw Falls**, one of the highest waterfalls in Canada, plunging 373 meters from the Daly Glacier.25 The Yoho Valley Road leading to the falls features a set of tight switchbacks that are not navigable for large RVs or trailers.53 From the parking lot, a flat, paved, and accessible 0.9 km path leads to the base of the falls, where the mist is powerful and refreshing.25\n\n**Afternoon:** After experiencing the falls, drive back towards the Trans-Canada Highway and take the turnoff for **Emerald Lake**. This stunning lake is famous for its vivid green color, caused by fine particles of glacial sediment, or \"rock flour\".54 The main activities here are to walk the easy\n\n**5.2 km Lakeshore Loop trail**, which offers constantly changing views of the surrounding mountains and the prestigious Emerald Lake Lodge.55 For a truly iconic Canadian Rockies experience, rent a canoe from the boathouse and paddle on the serene, emerald water. Rentals are typically $100 per hour.55 Note that personal watercraft are not permitted to prevent the spread of aquatic invasive species.55\n\nOn the drive out from Emerald Lake, make two final stops. First is the **Natural Bridge**, where the powerful Kicking Horse River has carved a passage through a solid rock formation.56 Second is the\n\n**Spiral Tunnels Viewpoint**, where, with good timing, one can watch a long freight train snake its way through two spiral tunnels engineered into the mountainside—a testament to the challenges of building a railway through this rugged terrain.57\n\n**Evening:** Return to Lake Louise for the final night in the mountains.\n\n**Dining:** This is an opportunity for a final special dinner. A reservation at the **Fairmont Chateau Lake Louise** offers world-class dining with an unbeatable view, while the **Post Hotel's** dining room is renowned for its exceptional cuisine and extensive wine list.\n\n### **Day 7: A Final Mountain Glimpse & The Journey Home**\n\n**Theme:** A leisurely departure, savoring the last moments of mountain air before the return to city life.\n\n**Morning:** Enjoy a final, unhurried breakfast in Lake Louise. There is no need to rush, as the drive to the airport is direct and predictable. Check out of the hotel and begin the journey east on the **Trans-Canada Highway (Highway 1)**.13 This direct route ensures an efficient trip back to Calgary.\n\n**Afternoon:** Depending on the flight schedule, there may be time for a brief stop in **Canmore**. This is an excellent opportunity for some last-minute souvenir shopping at unique local boutiques like Stonewaters, which offers a curated selection of Canadian-made goods, a distinct alternative to the more generic shops in Banff.21 A final short walk along Canmore's picturesque Policeman's Creek Boardwalk could also be a perfect farewell to the mountains.\n\nContinue the drive to Calgary International Airport (YYC). Allow ample time for the car rental return, airline check-in, and security procedures—a minimum of three hours before the scheduled flight departure is recommended. Depart from Calgary for Toronto, carrying memories of a week spent among the giants of the Canadian Rockies.\n\n## **Section 3: Thematic Deep Dives: Curating Your Perfect Experience**\n\nThis section provides consolidated, in-depth guides to key aspects of a Rockies adventure. Use these resources to tailor the daily itinerary to specific interests, whether that means tackling a challenging hike, finding the perfect paddle, enjoying a memorable meal, or responsibly seeking out the region's incredible wildlife.\n\n### **3.1 The Hiker's Companion: Curated Trails for Every Level**\n\nBanff National Park is a hiker's paradise, with trails ranging from gentle lakeside strolls to strenuous alpine scrambles. Prime hiking season generally runs from July through mid-September. Before late June, many higher elevation trails and passes can still be snow-bound and subject to avalanche risk.59 The following table summarizes some of the best trails mentioned in this itinerary and other notable options, organized by difficulty.\n\n| **Trail Name** | **Location** | **Difficulty** | **Return Distance** | **Elevation Gain** | **Estimated Time** | **Best For** |\n| --- | --- | --- | --- | --- | --- | --- |\n| **Johnston Canyon** | Bow Valley Parkway | Easy | 5.0 km (to Upper Falls) | 120 m | 1-2 hours | Waterfalls, unique canyon catwalks 43 |\n| **Lake Louise Lakeshore** | Lake Louise | Easy | 4.6 km | Minimal | 1 hour | Glacier views, accessibility 40 |\n| **Moraine Lake Rockpile & Lakeshore** | Moraine Lake | Easy | 3.0 km | Minimal | 1-2 hours | Iconic photo ops, Ten Peaks view 39 |\n| **Emerald Lake Loop** | Yoho National Park | Easy | 5.2 km | Minimal | 2 hours | Rainforest microclimate, tranquil paddling views 56 |\n| **Tunnel Mountain Summit** | Banff Town | Easy/Moderate | 4.8 km | 260 m | 2 hours | Views of Banff town and the Bow Valley 60 |\n| **Lake Agnes Teahouse** | Lake Louise | Moderate | 7.8 km | 495 m | 2.5-3 hours | Historic teahouse, stunning alpine lake 39 |\n| **Plain of Six Glaciers** | Lake Louise | Moderate | 11.6 km | 595 m | 4 hours | Expansive glacier and mountain views 40 |\n| **Larch Valley** | Moraine Lake | Moderate | 9.0 km | 570 m | 3.5-4 hours | Golden larches in autumn, valley views 39 |\n| **Sulphur Mountain** | Banff Town | Moderate | 11.0 km | 655 m | 4 hours | Panoramic views, option to take gondola down 60 |\n| **Sentinel Pass** | Moraine Lake | Difficult | 11.2 km | 750 m | 4.5-5.5 hours | High alpine pass, views of Ten Peaks 40 |\n| **Cory Pass Loop** | Bow Valley | Difficult | 13.0 km | 1000 m | 5-6 hours | Dramatic mountain scenery, challenging terrain 39 |\n\n### **3.2 On the Water: A Guide to Paddling in Paradise**\n\nOne of the most serene ways to experience the Rockies is from the water. Canoeing, kayaking, and stand-up paddleboarding (SUP) offer a unique perspective on the immense scale of the mountains and provide excellent opportunities for quiet wildlife viewing.\n\nThe primary hub for rentals in the town of Banff is the **Banff Canoe Club**, located at the corner of Wolf Street and Bow Avenue, just a short walk from downtown.61 From their docks, paddlers can explore a gentle section of the Bow River or venture up Forty Mile Creek into the tranquil Vermilion Lakes.63\n\n* **Rentals:** They offer canoes, single and double kayaks, and SUPs. A one-hour canoe or kayak rental costs approximately $65, with additional hours at a reduced rate. SUPs are around $30 per hour. All rentals include paddles and life jackets.61\n* **Guided Tours:** For those new to paddling or seeking a more structured experience, the Banff Canoe Club offers **Big Canoe Tours**. These 1.5-hour excursions in large, stable voyageur-style canoes are led by guides who share stories about local history, geology, and wildlife. Both a \"River Explorer\" tour and an evening \"Wildlife on the Bow\" tour are available for around $72 per adult.62\n\nCanoe rentals are also available at the iconic lakes. At **Lake Louise** and **Emerald Lake**, boathouses on the shore rent classic red canoes by the hour. While more expensive than rentals on the Bow River (e.g., ~$100/hr at Emerald Lake), the experience of paddling on these world-famous, gem-colored waters is unforgettable.55 It is important to note that due to the risk of spreading invasive species like whirling disease,\n\n**personal watercraft are prohibited at Emerald Lake** and other lakes in Yoho National Park.55\n\n### **3.3 The Banff Gastronomic Scene: A Culinary Guide**\n\nBanff and its surroundings offer a surprisingly diverse and high-quality culinary scene that extends far beyond typical mountain town fare. From world-class fine dining to cozy cafes and bustling brewpubs, there is an option for every palate and budget.\n\n* **Fine Dining & Special Occasions:** For a truly memorable meal, **Eden** at The Rimrock Resort Hotel holds a prestigious reputation for its exquisite tasting menus and extensive wine list.38 In Lake Louise, the dining rooms at the\n  **Fairmont Chateau Lake Louise** and the **Post Hotel & Spa** offer elegant alpine dining with impeccable service.\n* **Elevated Casual:** This category defines much of Banff's best dining. **The Bison Restaurant & Terrace** focuses on regional, seasonal ingredients with a stunning view from its second-floor terrace.38\n  **Bluebird Woodfired Steakhouse** delivers a classic steakhouse experience with a modern, stylish vibe.37\n  **Brazen**, located in the Mount Royal Hotel, offers bold, internationally inspired share plates in a historic setting.38\n* **Global Flavors:** Banff's international culinary offerings are strong. **Hello Sunshine** serves creative Japanese fare and sushi in a funky, vibrant space, while **Ramen Arashi** is a local favorite for authentic, soul-warming noodle soup.38 For Italian,\n  **Pizzeria Sophia** offers highly-rated pizzas, and for Greek, **The Balkan** has been a Banff institution for decades.38\n* **Brewpubs & Casual Bites:** For a more relaxed atmosphere, **Three Bears Brewery & Restaurant** and **Park Distillery Restaurant + Bar** are excellent choices, both offering house-made craft beer and spirits alongside inventive pub fare.38\n* **Cafes & Bakeries:** For a quick breakfast, coffee, or light lunch, **Wild Flour- Banff's Artisan Bakery Cafe** and **Whitebark Cafe** are top contenders, known for their quality coffee and fresh-baked goods.38 And no trip is complete without trying a\n  **BeaverTail**, a classic Canadian pastry.\n\n### **3.4 Wildlife Encounters: A Guide to Safe and Responsible Viewing**\n\nBanff National Park is a living ecosystem, home to a remarkable diversity of wildlife. Seeing these animals in their natural habitat is a thrilling and memorable part of any visit. The key to successful and ethical wildlife viewing is knowing where to look, when to go, and how to behave.\n\n**Best Times and Locations:** The hours around **dawn and dusk** are when animals are most active. The best driving routes for spotting wildlife are the **Bow Valley Parkway**, **Vermilion Lakes Drive**, the **Lake Minnewanka Loop**, and the **Icefields Parkway**.41 The shoulder seasons of spring and fall tend to offer the best viewing opportunities as animals are often at lower elevations.41\n\n**What You Might See:**\n\n* **Elk:** The most commonly seen large mammal in the park. They are frequently found grazing along the Banff Springs golf course, on the grounds of the Banff Centre, and throughout the Bow Valley Parkway.41 Be extremely cautious during the fall rut (September-October) when bulls are aggressive, and in late spring (May-June) when cows are protecting their newborn calves.\n* **Bighorn Sheep:** Often seen at the \"Backswamp\" on the Bow Valley Parkway, along the Lake Minnewanka road, and sometimes at the top of the Sulphur Mountain gondola.41\n* **Deer:** Both mule deer and whitetail deer are common along the park's roadsides and in meadows.\n* **Bears:** Both grizzly and black bears inhabit the park. While sightings are never guaranteed, they are most often spotted in the spring and early summer along the Bow Valley Parkway and the Icefields Parkway.41\n* **Moose:** These solitary animals are more elusive. Look for them in the wetland areas along the northern Icefields Parkway, particularly near Waterfowl Lakes.41\n* **Mountain Goats:** These high-alpine specialists are rarely seen from the road. Look for white specks high up on the cliffs along the Icefields Parkway, especially as you approach Jasper National Park.41\n\n**Responsible Viewing Etiquette:** The golden rule is to observe from a distance and never disturb the animals.\n\n* **Stay in Your Vehicle:** If you spot wildlife from the road, slow down, pull over safely, and watch from inside your car.\n* **Use Telephoto Lenses:** A long lens allows for great photos without needing to get close.\n* **Never Feed Wildlife:** It is illegal and extremely harmful to the animals, as it habituates them to humans and can lead to aggressive behavior and their ultimate destruction.\n* **Carry Bear Spray:** When hiking, carry bear spray and know how to use it. Make noise on the trail to avoid surprising a bear.41\n\n## **Conclusion: The Enduring Call of the Mountains**\n\nThis seven-day journey through the Canadian Rockies is more than a vacation; it is an immersion in a landscape of sublime power and beauty. From the first glimpse of the Front Ranges rising from the prairies to the final, quiet paddle on an emerald lake, the experience is designed to create a deep and lasting connection to this extraordinary part of the world. The strategic framework of this itinerary—the split stay, the pre-booked access, the carefully chosen routes—is intended to remove logistical friction, freeing the traveler to fully engage with the majesty that surrounds them.\n\nWhile the iconic sights of Banff, Lake Louise, and Yoho are the pillars of this adventure, the true magic often lies in the moments between: the spontaneous sighting of an elk grazing by the roadside, the taste of glacial water on a long hike, the shared silence while watching a sunset paint the peaks in alpenglow. This itinerary provides the map, but the territory itself offers endless opportunities for personal discovery. The enduring call of the mountains is a powerful one, and this journey is a comprehensive answer to that call, leaving the traveler with not just photographs, but a profound sense of awe and a renewed appreciation for the wild.\n\n#### 引用的著作\n\n1. Find Cheap Flights from Toronto to Calgary - Google, 访问时间为 八月 4, 2025， <https://www.google.com/travel/flights/flights-from-toronto-to-calgary.html>\n2. $100 Cheap flights from Toronto to Calgary (YTZ to YYC) - Expedia, 访问时间为 八月 4, 2025， <https://www.expedia.com/lp/flights/ytz/yyc/toronto-to-calgary>\n3. Cheap Flights from Toronto (YTOA) to Calgary (YYC) - Skyscanner, 访问时间为 八月 4, 2025， <https://www.skyscanner.com/routes/ytoa/yyc/toronto-to-calgary.html>\n4. $52 Cheap Flights from Toronto (YYZ) to Calgary (YYC) - Expedia, 访问时间为 八月 4, 2025， <https://www.expedia.com/lp/flights/yyz/yyc/toronto-to-calgary>\n5. $50 CHEAP FLIGHTS from Toronto Pearson to Calgary (YYZ - YYC) - Kayak, 访问时间为 八月 4, 2025， <https://www.kayak.com/flight-routes/Toronto-Pearson-Intl-YYZ/Calgary-YYC>\n6. Car rentals at YYC Calgary International Airport, 访问时间为 八月 4, 2025， <https://www.yyc.com/en-us/transportation/car-rentals>\n7. Car Rentals at Calgary Airport (YYC) | Uber Rent, 访问时间为 八月 4, 2025， <https://www.uber.com/global/en/r/airports/yyc/car-rentals/>\n8. Car Rental - Calgary International Airport - Hertz, 访问时间为 八月 4, 2025， <https://www.hertz.com/us/en/location/canada/alberta/calgary/yyct11>\n9. Is the Drive from Calgary to Banff Easy? A Complete Guide, 访问时间为 八月 4, 2025， <https://banffeveryday.com/is-the-drive-from-calgary-to-banff-easy-a-complete-guide/>\n10. How to Get From Calgary to Lake Louise in 2025 - The Banff Blog, 访问时间为 八月 4, 2025， <https://thebanffblog.com/calgary-to-lake-louise/>\n11. Car Rental at Calgary Intl. Airport (YYC) from $32 - Expedia, 访问时间为 八月 4, 2025， <https://www.expedia.com/Car-Rentals-In-Calgary-Intl.d4413785.Car-Rental-Guide>\n12. How to Get From CALGARY to BANFF in 2025 - The Banff Blog, 访问时间为 八月 4, 2025， <https://thebanffblog.com/calgary-to-banff/>\n13. How to Get to Banff From Calgary: Driving, Shuttles, & Buses, 访问时间为 八月 4, 2025， <https://calgaryhomes.ca/blog/calgary-to-banff.html>\n14. Must-see Sights on the Road from Calgary to Banff National Park, 访问时间为 八月 4, 2025， <https://www.banffjaspercollection.com/brewster-express/stories/road-from-calgary-to-banff/>\n15. From Calgary to Banff: Highlights en Route - Tour Guide to Travel Canada, 访问时间为 八月 4, 2025， <https://www.tourguidecanada.com/calgary-to-banff.html>\n16. How to Get From CALGARY to CANMORE (August 2025) - The Banff Blog, 访问时间为 八月 4, 2025， <https://thebanffblog.com/calgary-to-canmore/>\n17. Driving from Calgary to Canmore via Bow Valley Parkway - A Bear and Bison Inn, 访问时间为 八月 4, 2025， <https://abearandbisoninn.com/driving-from-calgary-to-canmore-via-bow-valley-trail/>\n18. Calgary to Cochrane to Canmore Drive - Everyday Lillie, 访问时间为 八月 4, 2025， <https://everydaylillie.com/2023/01/04/calgary-to-cochrane-to-canmore-drive/>\n19. How to Get from Calgary to Lake Louise +15 BEST Road Trip Stops - Destinationless Travel, 访问时间为 八月 4, 2025， <https://destinationlesstravel.com/calgary-to-lake-louise/>\n20. Banff vs Lake Louise • Which One is Right for YOU? - The Banff Blog, 访问时间为 八月 4, 2025， <https://thebanffblog.com/banff-vs-lake-louise/>\n21. Banff vs Canmore • Which is Better For YOUR Vacation?, 访问时间为 八月 4, 2025， <https://thebanffblog.com/banff-vs-canmore/>\n22. Banff vs Canmore vs Calgary vs Golden vs Lake Louise - Reddit, 访问时间为 八月 4, 2025， <https://www.reddit.com/r/Banff/comments/1eqnlud/banff_vs_canmore_vs_calgary_vs_golden_vs_lake/>\n23. Should You Stay in Banff or Canmore? A Local's Advice - We're in the Rockies, 访问时间为 八月 4, 2025， <https://wereintherockies.com/should-you-stay-in-banff-or-canmore/>\n24. Lake Louise or Banff - Fodor's Travel Talk Forums, 访问时间为 八月 4, 2025， <https://www.fodors.com/community/canada/lake-louise-or-banff-582859/>\n25. Takakkaw Falls in Yoho • A Guide to Visiting - The Banff Blog, 访问时间为 八月 4, 2025， <https://thebanffblog.com/takakkaw-falls-in-yoho/>\n26. Visiting Lake Louise and Moraine Lake - Banff National Park - Parks Canada, 访问时间为 八月 4, 2025， <https://parks.canada.ca/pn-np/ab/banff/visit/parkbus/louise>\n27. Moraine Lake Shuttle (2025): FAQ About the Parks Canada Shuttle - The Banff Blog, 访问时间为 八月 4, 2025， <https://thebanffblog.com/moraine-lake-shuttle/>\n28. Parks Canada reservations - Plan your visit, 访问时间为 八月 4, 2025， <https://parks.canada.ca/voyage-travel/reserve>\n29. Reservations - Roam Transit, 访问时间为 八月 4, 2025， <https://roamtransit.com/fares/reservations/>\n30. Top 10 Hotels in Banff Trail, Calgary, 访问时间为 八月 4, 2025， <https://www.hotels.com/nh11423579/hotels-in-banff-trail-calgary-alberta/>\n31. Top 10 Hotels in Banff Trail Station - Calgary, 访问时间为 八月 4, 2025， <https://www.hotels.com/de1755389/hotels-near-banff-trail-station-calgary-canada/>\n32. Find hotels in Banff Trail, Calgary from $63 - Expedia, 访问时间为 八月 4, 2025， <https://www.expedia.com/Banff-Trail-Calgary-Hotels.0-n553248635921598916-0.Travel-Guide-Filter-Hotels>\n33. Luxury Hotel in Banff | Fairmont Banff Springs, 访问时间为 八月 4, 2025， <https://www.fairmont.com/en/hotels/banff/fairmont-banff-springs.html>\n34. 访问时间为 一月 1, 1970， <https://www.booking.com/searchresults.en-gb.html?ss=Banff>\n35. Banff Gondola Official Site | Amazing Views & Dining on Sulphur ..., 访问时间为 八月 4, 2025， <https://www.banffjaspercollection.com/attractions/banff-gondola/>\n36. What to see while visiting Banff National Park - Parks Canada, 访问时间为 八月 4, 2025， <https://parks.canada.ca/pn-np/ab/banff/visit/les10-top10>\n37. Bluebird Wood-fired Steakhouse, 访问时间为 八月 4, 2025， <https://www.bluebirdbanff.com/>\n38. THE 10 BEST Restaurants in Banff (Updated August 2025), 访问时间为 八月 4, 2025， <https://www.tripadvisor.com/Restaurants-g154911-Banff_Banff_National_Park_Alberta.html>\n39. 9 Bucket List Hikes in Banff National Park, 访问时间为 八月 4, 2025， <https://www.banfflakelouise.com/blog/9-bucket-list-hikes-banff-national-park>\n40. Day hikes in the Lake Louise area - Banff National Park, 访问时间为 八月 4, 2025， <https://parks.canada.ca/pn-np/ab/banff/activ/randonnee-hiking/lakelouise>\n41. The Complete Guide to Wildlife Viewing in Banff National Park, 访问时间为 八月 4, 2025， <https://banffnationalpark.com/wildlife-banff-national-park/>\n42. guide | johnston canyon trail, 访问时间为 八月 4, 2025， <https://www.johnstoncanyon.com/guide-johnston-canyon-trail/>\n43. Johnston Canyon Hike: Ultimate Guide with Expert Local Tips - Travel Banff Canada, 访问时间为 八月 4, 2025， <https://www.travelbanffcanada.com/johnston-canyon-hike-banff-national-park/>\n44. Hike Johnston Canyon | Banff & Lake Louise Tourism, 访问时间为 八月 4, 2025， <https://www.banfflakelouise.com/experiences/johnston-canyon>\n45. Johnston Canyon Hike: All About Banff's Most POPULAR Trail, 访问时间为 八月 4, 2025， <https://thebanffblog.com/johnston-canyon-hike/>\n46. Lodging & Hotels - Lake Louise Ski Resort, 访问时间为 八月 4, 2025， <https://www.skilouise.com/lodging-hotels/>\n47. Luxury Hotel in Lake Louise | Fairmont Chateau Lake Louise, 访问时间为 八月 4, 2025， <https://www.fairmont.com/en/hotels/lake-louise/fairmont-chateau-lake-louise.html>\n48. Lake Louise Alberta: Itinerary Sample and Road Trip Map - Tour Guide to Travel Canada, 访问时间为 八月 4, 2025， <https://www.tourguidecanada.com/lake-louise-alberta.html>\n49. Best Stops on the Drive from Banff to Jasper - Snap Happy Travel, 访问时间为 八月 4, 2025， <https://snaphappytravel.com/best-stops-on-the-drive-from-banff-to-jasper/>\n50. Icefields Parkway | The Icefields Parkway: Highlights, Travel Tips,…, 访问时间为 八月 4, 2025， <https://icefieldsparkway.com/>\n51. Must-see places between Jasper and Banff National Parks, Alberta | My Wandering Voyage, 访问时间为 八月 4, 2025， <https://www.mywanderingvoyage.com/blog/top-10-spots-on-my-jasper-to-banff-roadtrip>\n52. Takakkaw Falls in Yoho: Your Ultimate Guide (2025), 访问时间为 八月 4, 2025， <https://travelwiththesmile.com/blog/takakkaw-falls-yoho-national-park/>\n53. Hikes and walks - Yoho National Park, 访问时间为 八月 4, 2025， <https://parks.canada.ca/pn-np/bc/yoho/activ/randonnee-hike/jour-day>\n54. Best Things to Do in Yoho National Park - Ultimate Guide to Canada, 访问时间为 八月 4, 2025， <https://capturetheatlas.com/top-things-to-do-in-yoho-canada/>\n55. Emerald Lake in Canada: 20 Things to KNOW (Yoho, British Columbia) - The Banff Blog, 访问时间为 八月 4, 2025， <https://thebanffblog.com/emerald-lake/>\n56. Points of interest - Yoho National Park - Parks Canada - Canada.ca, 访问时间为 八月 4, 2025， <https://parks.canada.ca/pn-np/bc/yoho/activ/places>\n57. Exploring the Wonders of Yoho National Park: A Must-Visit Gem, 访问时间为 八月 4, 2025， <https://yohochalets.com/exploring-the-wonders-of-yoho-national-park/>\n58. Things to Do in Yoho National Park | PlanetWare, 访问时间为 八月 4, 2025， <https://www.planetware.com/british-columbia/yoho-national-park-cdn-bc-bcyo.htm>\n59. Hiking - Banff National Park, 访问时间为 八月 4, 2025， <https://parks.canada.ca/pn-np/ab/banff/activ/randonnee-hiking>\n60. Banff Hiking Trails for Beginner, Intermediate, and Advanced Hikers - AMA Travel, 访问时间为 八月 4, 2025， <https://www.amatravel.ca/articles/easy-intermediate-hard-hikes-banff>\n61. The Banff Canoe Club > Home, 访问时间为 八月 4, 2025， <https://banffcanoeclub.com/>\n62. Banff Canoes, Kayaks & SUPs Rentals | Banff Adventures, 访问时间为 八月 4, 2025， <https://www.banffadventures.com/rentals/canoes-kayaks-sups/>\n63. Canoeing | Banff, AB - Official Website, 访问时间为 八月 4, 2025， <https://banff.ca/99/Canoeing>\n64. Wildlife in Banff National Park - Banff & Lake Louise Tourism, 访问时间为 八月 4, 2025， <https://www.banfflakelouise.com/wildlife>\n",
  "all_source_links": [
    "https://abearandbisoninn.com/driving-from-calgary-to-canmore",
    "https://abearandbisoninn.com/driving-from-calgary-to-canmore-via-bow-valley-trail",
    "https://accounts.google.com/SignOutOptions?hl=zh-CN&continue=https://gemini.google.com/&ec=GBRAkgU",
    "https://adventures.com/canada/attractions/waterfalls/takakkaw-falls",
    "https://banff.ca/99/Canoeing",
    "https://banffcanoeclub.com",
    "https://banffeveryday.com/is-the-drive-from-calgary-to-banff-easy-a-complete-guide",
    "https://banffnationalpark.com/wildlife-banff-national-park",
    "https://calgaryhomes.ca/blog/calgary-to-banff.html",
    "https://canmorealberta.com/places-to-stay/hotels",
    "https://capturetheatlas.com/top-things-to-do-in-yoho-canada",
    "https://crmr.com/activities/hikes/johnston-canyon-falls",
    "https://destinationlesstravel.com/calgary-to-lake-louise",
    "https://everydaylillie.com/2023/01/04/calgary-to-cochrane-to-canmore-drive",
    "https://explorewithalec.com/yoho-national-park-itinerary",
    "https://icefieldsparkway.com",
    "https://illuminatedexperiences.com/calgary-to-canmore",
    "https://irockersup.ca/blogs/stories/emerald-lake-activities",
    "https://parks.canada.ca/pn-np/ab/banff/activ/randonnee-hiking",
    "https://parks.canada.ca/pn-np/ab/banff/activ/randonnee-hiking/lakelouise",
    "https://parks.canada.ca/pn-np/ab/banff/visit/les10-top10",
    "https://parks.canada.ca/pn-np/ab/banff/visit/parkbus/louise",
    "https://parks.canada.ca/pn-np/bc/yoho/activ",
    "https://parks.canada.ca/pn-np/bc/yoho/activ/places",
    "https://parks.canada.ca/pn-np/bc/yoho/activ/randonnee-hike/jour-day",
    "https://parks.canada.ca/voyage-travel/reserve",
    "https://roamtransit.com/fares/reservations",
    "https://snaphappytravel.com/best-stops-on-the-drive-from-banff-to-jasper",
    "https://thebanffblog.com/banff-vs-canmore",
    "https://thebanffblog.com/banff-vs-lake-louise",
    "https://thebanffblog.com/calgary-to-banff",
    "https://thebanffblog.com/calgary-to-canmore",
    "https://thebanffblog.com/calgary-to-lake-louise",
    "https://thebanffblog.com/emerald-lake",
    "https://thebanffblog.com/jasper-itinerary",
    "https://thebanffblog.com/johnston-canyon-hike",
    "https://thebanffblog.com/moraine-lake-shuttle",
    "https://thebanffblog.com/takakkaw-falls-in-yoho",
    "https://thecreativeadventurer.com/the-easy-essential-guide-to-hiking-johnston-canyon-in-banff-national-park",
    "https://travelwiththesmile.com/blog/emerald-lake-yoho",
    "https://travelwiththesmile.com/blog/takakkaw-falls-yoho-national-park",
    "https://travelwithwes.com/post/takakkaw-falls-yoho-national-park-guide-with-photos",
    "https://turo.com/blog/canada/wayfaring/calgary-to-banff-drive-the-ultimate-road-trip-guide",
    "https://wanderlog.com/drive/between/58048/76078/calgary-to-lake-louise-drive",
    "https://wereintherockies.com/should-you-stay-in-banff-or-canmore",
    "https://www.aircanada.com/en-ca/flights-from-toronto-to-calgary",
    "https://www.alamo.com/en/car-rental-locations/ca/ab/calgary-international-airport-c5a1.html",
    "https://www.amatravel.ca/articles/easy-intermediate-hard-hikes-banff",
    "https://www.banffadventures.com/rentals/canoes-kayaks-sups",
    "https://www.banffjaspercollection.com/attractions/banff-gondola",
    "https://www.banffjaspercollection.com/brewster-express/stories/road-from-calgary-to-banff",
    "https://www.banfflakelouise.com/blog/9-bucket-list-hikes-banff-national-park",
    "https://www.banfflakelouise.com/blog/how-to-get-to-Banff-Lake-Louise-from-Calgary",
    "https://www.banfflakelouise.com/experiences/johnston-canyon",
    "https://www.banfflakelouise.com/sightseeing",
    "https://www.banfflakelouise.com/wildlife",
    "https://www.bluebirdbanff.com",
    "https://www.booking.com/landmark/ca/banff-trail-c-train.html",
    "https://www.booking.com/searchresults.en-gb.html?ss=Banff",
    "https://www.enterprise.com/en/car-rental-locations/ca/ab/calgary-international-airport-c5ei.html",
    "https://www.expedia.com/Banff-Trail-Calgary-Hotels.0-n553248635921598916-0.Travel-Guide-Filter-Hotels",
    "https://www.expedia.com/Banff-Trail-Station-Hotels.d6237018.Travel-Guide-Hotels",
    "https://www.expedia.com/Car-Rentals-In-Calgary-Intl.d4413785.Car-Rental-Guide",
    "https://www.expedia.com/lp/flights/ytz/yyc/toronto-to-calgary",
    "https://www.expedia.com/lp/flights/yyz/yyc/toronto-to-calgary",
    "https://www.fairmont.com/en/hotels/banff/fairmont-banff-springs.html",
    "https://www.fairmont.com/en/hotels/lake-louise/fairmont-chateau-lake-louise.html",
    "https://www.fodors.com/community/canada/lake-louise-or-banff-582859",
    "https://www.google.com/travel/flights/flights-from-toronto-to-calgary.html",
    "https://www.hertz.com/us/en/location/canada/alberta/calgary/yyct11",
    "https://www.hotels.com/de1755389/hotels-near-banff-trail-station-calgary-canada",
    "https://www.hotels.com/nh11423579/hotels-in-banff-trail-calgary-alberta",
    "https://www.johnstoncanyon.com/guide-johnston-canyon-trail",
    "https://www.kayak.com/flight-routes/Toronto-Pearson-Intl-YYZ/Calgary-YYC",
    "https://www.laidbacktrip.com/posts/takakkaw-falls-yoho-national-park",
    "https://www.mywanderingvoyage.com/blog/top-10-spots-on-my-jasper-to-banff-roadtrip",
    "https://www.planetware.com/british-columbia/yoho-national-park-cdn-bc-bcyo.htm",
    "https://www.reddit.com/r/Banff/comments/1eqnlud/banff_vs_canmore_vs_calgary_vs_golden_vs_lake",
    "https://www.reddit.com/r/Banff/comments/1j8hrxg/staying_in_lake_louise_or_canmore_late_may_travels",
    "https://www.skilouise.com/how-to-get-to-lake-louise",
    "https://www.skilouise.com/lodging-hotels",
    "https://www.skyscanner.com/routes/ytoa/yyc/toronto-to-calgary.html",
    "https://www.tourguidecanada.com/calgary-to-banff.html",
    "https://www.tourguidecanada.com/lake-louise-alberta.html",
    "https://www.travelbanffcanada.com/johnston-canyon-hike-banff-national-park",
    "https://www.tripadvisor.com/Restaurants-g154911-Banff_Banff_National_Park_Alberta.html",
    "https://www.trivago.com/en-US/odr/hotels-canmore-canada?search=200-34584",
    "https://www.uber.com/global/en/r/airports/yyc/car-rentals",
    "https://www.viamichelin.com/routes/results/calgary-t2g-_-alberta-canada-to-canmore-t1w-_-alberta-canada",
    "https://www.yyc.com/en-us/transportation/car-rentals",
    "https://yohochalets.com/exploring-the-wonders-of-yoho-national-park"
  ],
  "summary_citations": [
    "https://abearandbisoninn.com/driving-from-calgary-to-canmore",
    "https://abearandbisoninn.com/driving-from-calgary-to-canmore-via-bow-valley-trail",
    "https://accounts.google.com/SignOutOptions?hl=zh-CN&continue=https://gemini.google.com/&ec=GBRAkgU",
    "https://adventures.com/canada/attractions/waterfalls/takakkaw-falls",
    "https://banff.ca/99/Canoeing",
    "https://banffcanoeclub.com",
    "https://banffeveryday.com/is-the-drive-from-calgary-to-banff-easy-a-complete-guide",
    "https://banffnationalpark.com/wildlife-banff-national-park",
    "https://calgaryhomes.ca/blog/calgary-to-banff.html",
    "https://canmorealberta.com/places-to-stay/hotels",
    "https://capturetheatlas.com/top-things-to-do-in-yoho-canada",
    "https://crmr.com/activities/hikes/johnston-canyon-falls",
    "https://destinationlesstravel.com/calgary-to-lake-louise",
    "https://everydaylillie.com/2023/01/04/calgary-to-cochrane-to-canmore-drive",
    "https://explorewithalec.com/yoho-national-park-itinerary",
    "https://icefieldsparkway.com",
    "https://illuminatedexperiences.com/calgary-to-canmore",
    "https://irockersup.ca/blogs/stories/emerald-lake-activities",
    "https://parks.canada.ca/pn-np/ab/banff/activ/randonnee-hiking",
    "https://parks.canada.ca/pn-np/ab/banff/activ/randonnee-hiking/lakelouise",
    "https://parks.canada.ca/pn-np/ab/banff/visit/les10-top10",
    "https://parks.canada.ca/pn-np/ab/banff/visit/parkbus/louise",
    "https://parks.canada.ca/pn-np/bc/yoho/activ",
    "https://parks.canada.ca/pn-np/bc/yoho/activ/places",
    "https://parks.canada.ca/pn-np/bc/yoho/activ/randonnee-hike/jour-day",
    "https://parks.canada.ca/voyage-travel/reserve",
    "https://roamtransit.com/fares/reservations",
    "https://snaphappytravel.com/best-stops-on-the-drive-from-banff-to-jasper",
    "https://thebanffblog.com/banff-vs-canmore",
    "https://thebanffblog.com/banff-vs-lake-louise",
    "https://thebanffblog.com/calgary-to-banff",
    "https://thebanffblog.com/calgary-to-canmore",
    "https://thebanffblog.com/calgary-to-lake-louise",
    "https://thebanffblog.com/emerald-lake",
    "https://thebanffblog.com/jasper-itinerary",
    "https://thebanffblog.com/johnston-canyon-hike",
    "https://thebanffblog.com/moraine-lake-shuttle",
    "https://thebanffblog.com/takakkaw-falls-in-yoho",
    "https://thecreativeadventurer.com/the-easy-essential-guide-to-hiking-johnston-canyon-in-banff-national-park",
    "https://travelwiththesmile.com/blog/emerald-lake-yoho",
    "https://travelwiththesmile.com/blog/takakkaw-falls-yoho-national-park",
    "https://travelwithwes.com/post/takakkaw-falls-yoho-national-park-guide-with-photos",
    "https://turo.com/blog/canada/wayfaring/calgary-to-banff-drive-the-ultimate-road-trip-guide",
    "https://wanderlog.com/drive/between/58048/76078/calgary-to-lake-louise-drive",
    "https://wereintherockies.com/should-you-stay-in-banff-or-canmore",
    "https://www.aircanada.com/en-ca/flights-from-toronto-to-calgary",
    "https://www.alamo.com/en/car-rental-locations/ca/ab/calgary-international-airport-c5a1.html",
    "https://www.amatravel.ca/articles/easy-intermediate-hard-hikes-banff",
    "https://www.banffadventures.com/rentals/canoes-kayaks-sups",
    "https://www.banffjaspercollection.com/attractions/banff-gondola",
    "https://www.banffjaspercollection.com/brewster-express/stories/road-from-calgary-to-banff",
    "https://www.banfflakelouise.com/blog/9-bucket-list-hikes-banff-national-park",
    "https://www.banfflakelouise.com/blog/how-to-get-to-Banff-Lake-Louise-from-Calgary",
    "https://www.banfflakelouise.com/experiences/johnston-canyon",
    "https://www.banfflakelouise.com/sightseeing",
    "https://www.banfflakelouise.com/wildlife",
    "https://www.bluebirdbanff.com",
    "https://www.booking.com/landmark/ca/banff-trail-c-train.html",
    "https://www.booking.com/searchresults.en-gb.html?ss=Banff",
    "https://www.enterprise.com/en/car-rental-locations/ca/ab/calgary-international-airport-c5ei.html",
    "https://www.expedia.com/Banff-Trail-Calgary-Hotels.0-n553248635921598916-0.Travel-Guide-Filter-Hotels",
    "https://www.expedia.com/Banff-Trail-Station-Hotels.d6237018.Travel-Guide-Hotels",
    "https://www.expedia.com/Car-Rentals-In-Calgary-Intl.d4413785.Car-Rental-Guide",
    "https://www.expedia.com/lp/flights/ytz/yyc/toronto-to-calgary",
    "https://www.expedia.com/lp/flights/yyz/yyc/toronto-to-calgary",
    "https://www.fairmont.com/en/hotels/banff/fairmont-banff-springs.html",
    "https://www.fairmont.com/en/hotels/lake-louise/fairmont-chateau-lake-louise.html",
    "https://www.fodors.com/community/canada/lake-louise-or-banff-582859",
    "https://www.google.com/travel/flights/flights-from-toronto-to-calgary.html",
    "https://www.hertz.com/us/en/location/canada/alberta/calgary/yyct11",
    "https://www.hotels.com/de1755389/hotels-near-banff-trail-station-calgary-canada",
    "https://www.hotels.com/nh11423579/hotels-in-banff-trail-calgary-alberta",
    "https://www.johnstoncanyon.com/guide-johnston-canyon-trail",
    "https://www.kayak.com/flight-routes/Toronto-Pearson-Intl-YYZ/Calgary-YYC",
    "https://www.laidbacktrip.com/posts/takakkaw-falls-yoho-national-park",
    "https://www.mywanderingvoyage.com/blog/top-10-spots-on-my-jasper-to-banff-roadtrip",
    "https://www.planetware.com/british-columbia/yoho-national-park-cdn-bc-bcyo.htm",
    "https://www.reddit.com/r/Banff/comments/1eqnlud/banff_vs_canmore_vs_calgary_vs_golden_vs_lake",
    "https://www.reddit.com/r/Banff/comments/1j8hrxg/staying_in_lake_louise_or_canmore_late_may_travels",
    "https://www.skilouise.com/how-to-get-to-lake-louise",
    "https://www.skilouise.com/lodging-hotels",
    "https://www.skyscanner.com/routes/ytoa/yyc/toronto-to-calgary.html",
    "https://www.tourguidecanada.com/calgary-to-banff.html",
    "https://www.tourguidecanada.com/lake-louise-alberta.html",
    "https://www.travelbanffcanada.com/johnston-canyon-hike-banff-national-park",
    "https://www.tripadvisor.com/Restaurants-g154911-Banff_Banff_National_Park_Alberta.html",
    "https://www.trivago.com/en-US/odr/hotels-canmore-canada?search=200-34584",
    "https://www.uber.com/global/en/r/airports/yyc/car-rentals",
    "https://www.viamichelin.com/routes/results/calgary-t2g-_-alberta-canada-to-canmore-t1w-_-alberta-canada",
    "https://www.yyc.com/en-us/transportation/car-rentals",
    "https://yohochalets.com/exploring-the-wonders-of-yoho-national-park"
  ]
}