{
  "query": "Conduct a comprehensive search and understanding of detailed information related to the teaching-free laser welding robot, including product introductions, market acceptance, recognized advantages by the market, etc.; focus on introducing the detailed specifics, advantages, quality, and competitive strengths of the welding arm.",
  "chain_of_research": {
    "plan_1": {
      "title": "Research Approach\nInitial Research Focus\nNext Steps",
      "description": "I'm starting a comprehensive investigation into teaching-free laser welding robots, with a particular emphasis on the welding arm. My approach will involve understanding the core principles, identifying key manufacturers and their products, assessing market acceptance, and then diving deep into the specifics of the welding arm's design, advantages, and competitive strengths. I'll also look for relevant case studies and future trends in this technology.\nMy initial steps will focus on three key areas. First, I'll explore the fundamental principles and operational mechanisms of these robots, differentiating them from traditional welding systems. Second, I'll identify leading manufacturers and their product offerings, noting core features and innovations. Finally, I'll investigate the market's acceptance of this technology, including the industries that are adopting it and the perceived benefits.\nI'm planning to execute a series of searches to gather this foundational information. I'll be looking for academic papers, industry reports, and manufacturer websites to ensure the quality and relevance of the information I collect."
    },
    "search_1": [
      "https://en.huahengrobotics.com/news_details/1931744544595263488.html",
      "https://esab.com/us/nam_en/esab-university/articles/transform-your-welding-shop-with-cobot-welding-a-comprehensive-guide",
      "https://shop.adhmt.com/the-future-of-laser-welding-machines-trends-and-innovations-in-the-industry",
      "https://pclgroupcncmachine.com/drag-teaching-robots-vs-robotic-welding-a-comprehensive-guide",
      "https://arxiv.org/pdf/2402.14388",
      "https://www.mtiwelding.com/blog/comparing-low-force-friction-welding-to-laser-welding",
      "https://commons.und.edu/cgi/viewcontent.cgi?article=8090&context=theses",
      "https://laser-welder.net/laser-welding/robotic-laser-welding",
      "https://www.lasertechnologies.co.in/laser-welding/ai-in-laser-welding",
      "https://www.openpr.com/news/4103986/global-laser-welding-industrial-robot-market-insight-growth",
      "https://www.gminsights.com/industry-analysis/robotics-laser-welding-market",
      "https://kirinlaser.com/innovations-in-laser-welding-technology-you-need-to-know",
      "https://www.kuka.com/en-de/applications/automated-welding/laser-welding",
      "https://www.daihen-usa.com",
      "https://en.siasun.com/siasun-teach-free-welding-robot.html",
      "https://www.ligentrobot.com/weldingrobot",
      "https://photonweld.com/photonweld-robot-and-cobot-laser-welding/photonweld-r-series-pp-plug-and-play-laser-welding-units-for-robot-and-cobot-plug-in-laser-welding-modules"
    ],
    "observation_1": "I've started by gathering information on the fundamental principles of teaching-free laser welding robots. I'm learning that these systems aim to overcome the complexities of traditional welding by leveraging advanced technologies like AI and machine learning for dynamic parameter modification and real-time adjustments. Some sources highlight simplified programming methods like 'drag teaching' and intuitive interfaces, which reduce the need for extensive manual programming. A key insight is the use of 3D scanning sensors and visual recognition algorithms for intelligent identification and autonomous path planning, which truly embodies the 'teaching-free' concept.",
    "plan_2": {
      "title": "Market Landscape and Key Players\nRefining My Research Focus",
      "description": "I'm also building an understanding of the market acceptance and key players in the laser welding robot sector. The market is experiencing significant growth, driven by the shift towards smart factories and the demand for precision, speed, and efficiency in industries like automotive, aerospace, and electronics. While some manufacturers offer simplified programming, I've identified a specific product, the SIASUN Teach-Free Welding Robot, that explicitly aligns with the 'teaching-free' approach through its intelligent identification and path planning capabilities. This is a crucial finding as it provides a concrete example of the technology I'm researching.\nMoving forward, I recognize the need to delve deeper into the specifics of the welding arm itself, which is a core part of my research. I also need to find more specific case studies that demonstrate the real-world impact and performance of teaching-free laser welding robots, particularly highlighting the contribution of the welding arm. My next steps will involve a deep dive into the SIASUN technology, followed by targeted searches for detailed information on welding arm design, materials, precision, and competitive strengths, as well as specific industry applications and future innovations related to the welding arm."
    },
    "search_2": [
      "https://aijourn.com/the-future-of-laser-welding-in-automation",
      "https://dplaser.com/laser-welding-robotic-boost-production-2025",
      "https://www.smu.edu/-/media/site/lyle/rcam/publications/development-of-a-real-time-laser-based-machine-vision-system-to-monitor-and-control-welding-processes.pdf",
      "https://arxiv.org/pdf/2405.00685",
      "https://laser-welder.net/laser-welding/robotic-laser-welding-processes-advantages-and-technologies",
      "https://meltonmachine.com/solutions/robotic-laser-systems/robotic-laser-welding",
      "https://pmc.ncbi.nlm.nih.gov/articles/PMC12155970",
      "https://ojs.aaai.org/index.php/AAAI/article/view/26834/26606",
      "https://www.openpr.com/news/4103986/global-laser-welding-industrial-robot-market-insight-growth",
      "https://www.automate.org/robotics/industry-insights/robots-and-laser-welding-the-perfect-fit",
      "https://www.igoldenlaser.com/laser-robotic-welding-machine",
      "https://www.kuka.com/en-de/applications/automated-welding/laser-welding",
      "https://www.evsint.com/welding-robot-applications-in-manufacturing-streamline-production",
      "https://ifr.org/case-studies/industrial-robots/press@ifr.org",
      "https://en.siasun.com/siasun-teach-free-welding-robot.html"
    ],
    "observation_2": "I've gained a more in-depth understanding of how teaching-free laser welding robots operate. A key insight is the integration of 3D scanning sensors, advanced visual recognition algorithms, and arc tracking technology, which allows for accurate and instantaneous location of weld seams, intelligent path planning, and real-time adjustments. This eliminates the need for manual teaching and enables autonomous program generation. I've also learned about the underlying academic principles, including dual-modal perception frameworks and neural network architectures for precise weld seam detection and real-time torch control, often utilizing structured laser light for 3D position calculation.",
    "plan_3": {
      "title": "Insights into Welding Arm and Head Technology\nMarket Trends and Applications\nRefining Focus on Welding Arm Specifics",
      "description": "While still seeking more granular details, I've started to uncover specifics about the welding arm and head. These systems typically employ multi-axis robotic arms for precise positioning and weld path control. I've noted that welding heads can feature sealed internal structures to prevent dust and easily replaceable protective lenses, with some manufacturers like Ruifa/Hanwei providing components. The integration of laser optics within the welding head is crucial for achieving pinpoint precision and versatility, enabling deep penetration welding with minimal heat distortion and high process speeds.\nMy research confirms that the laser welding industrial robot market is experiencing significant growth, driven by the demand for automation, precision, and efficiency in sectors like automotive, aerospace, and electronics. AI and IoT integration are emerging trends, enhancing sensing capabilities, real-time adaptability, and overall precision. I've seen examples of how robotic welding, including cobots with simplified programming, can significantly boost productivity and reduce reliance on skilled labor, even if not all examples are strictly 'teaching-free laser welding.'\nMy next steps will focus on obtaining more detailed information about the welding arm itself. I need to understand the specific design choices, materials used for the arm (e.g., for rigidity or lightweight properties), and the internal mechanisms that contribute to its precision. I also aim to find more direct case studies that specifically highlight the benefits and competitive strengths derived from the teaching-free aspect and the welding arm's capabilities in real-world applications. Finally, I will explore how future trends like adaptive optics and advanced sensor integration will directly impact the design and performance of the welding arm."
    },
    "search_3": [
      "https://m.youtube.com/watch?v=sVtZGl8yWUc",
      "https://www.ligentrobot.com/blog/best-welding-arm-materials.html",
      "https://www.cs.rochester.edu/u/nelson/courses/csc_robocon/robot_manual/materials.html",
      "https://www.leapion.com/An-Introduction-to-Laser-Welding-Robot-id43044057.html",
      "https://www.igoldenlaser.com/laser-robotic-welding-machine",
      "https://www.thefabricator.com/thefabricator/article/automationrobotics/anatomy-of-an-automated-welding-system",
      "https://laser-welder.net/laser-welding/robotic-laser-welding",
      "https://standardbots.com/blog/automate-spot-welding-a-blueprint-for-implementing-robotic-welders",
      "https://kcrobotics.com/robotic-welding-aerospace",
      "https://en.huahengrobotics.com/news_details/1931744544595263488.html",
      "https://laser-welder.net/laser-welding/robotic-laser-welding-processes-advantages-and-technologies",
      "https://www.researchgate.net/publication/387602732_ADVANCED_TECHNIQUES_AND_APPLICATIONS_IN_ROBOTIC_LASER_WELDING_FOR_HIGH_PRECISION_MANUFACTURING_YUKSEK_HASSASIYETLI_IMALAT_ICIN_ROBOT_LAZER_KAYNAKTA_GELISMIS_TEKNIKLER_VE_UYGULAMALARI",
      "https://www.evsint.com/laser-welding-robots-and-welding-turntables-for-superior-results",
      "https://www.fanuc.eu/eu-en/fanuc-arc-welding-robots-cobots",
      "https://www.fanucamerica.com/solutions/applications/welding-robots/arc-welding-robots",
      "https://evsrobot.en.made-in-china.com/product/NEwUBOADEMkT/China-Kuka-Automatic-Laser-Welding-Robot-Machine-Arm-Laser-Welding-Machine.html",
      "https://www.kuka.com/en-us/applications/automated-welding/arc-welding/kuka-arc-welding-robots",
      "https://www.borunte.net/news/how-does-a-industrial-robotic-arm-ensure-smoot-81906931.html",
      "https://standardbots.com/blog/how-do-robotic-arms-work-a-comprehensive-guide"
    ],
    "observation_3": "I've made good progress in understanding the specifics of the welding arm within teaching-free laser welding systems. I've learned that these arms are typically multi-axis (e.g., 6-axis articulated models) and are designed for high repeatability and precision. The integration of the laser welding head, with its optics (mirrors and lenses), is crucial for focusing and guiding the laser beam. The arm's ability to precisely move the laser head, even in complex or hard-to-reach areas, is a key enabler of the technology's benefits. I'm also seeing how AI and machine learning are being integrated to allow these arms to dynamically adjust parameters like laser power, welding speed, and focus location in real-time, ensuring consistent weld quality without human intervention.",
    "plan_4": {
      "title": "Market Acceptance and Advantages\nAddressing Information Gaps and Next Steps",
      "description": "My research confirms the strong market acceptance of robotic laser welding, with significant growth projected, particularly in the automotive, aerospace, and electronics sectors. The recognized advantages include greater accuracy, faster production rates, ability to manage intricate tasks, consistent weld quality, reduced labor costs, and improved safety. For teaching-free systems specifically, the benefits extend to simplified programming, reduced training time, and enhanced flexibility for varied tasks, making them suitable for high-mix, low-volume environments and even small shops. The ability to operate 24/7 and reduce errors due to human factors like fatigue are also significant benefits.\nWhile I have a solid foundation, I still need to delve deeper into the specific design choices and materials of the welding arm that contribute to its precision and durability in a welding environment. I also need more direct case studies that explicitly highlight the welding arm's contribution to performance improvements in teaching-free scenarios. My next steps will involve revisiting existing relevant sources for more granular details on welding arm integration, materials, and precision mechanisms. I will also conduct new targeted searches to find specific metrics on welding arm accuracy, speed, and competitive comparisons, as well as case studies that directly address the impact of teaching-free welding robot arms on production outcomes."
    },
    "search_4": [
      "https://www.youtube.com/watch?v=-uauALvIGSU",
      "https://www.controleng.com/new-developments-in-robotic-welding-cobots-industrial-robots",
      "https://swantonweld.com/five-advantages-of-robotic-welding",
      "https://laser-welder.net/laser-welding/robotic-laser-welding-processes-advantages-and-technologies",
      "https://www.onealmfgservices.com/benefits-of-robotic-welding-technology-in-mass-production",
      "https://www.iimtcobot.com/news/what-sensors-does-a-welding-robot-have.html",
      "https://jucat.fi/features/laser-tracking",
      "https://pmc.ncbi.nlm.nih.gov/articles/PMC11857260",
      "https://standardbots.com/blog/robotic-welding-programming",
      "https://www.accteklaser.com/what-welding-defects-can-occur-in-laser-welding-how-to-solve-it",
      "https://pclgroupcncmachine.com/teaching-free-robotic-welding-station",
      "https://en.siasun.com/siasun-teach-free-welding-robot.html",
      "https://www.fanucamerica.com/solutions/applications/welding-robots/arc-welding-robots",
      "https://www.ipgphotonics.com/newsroom/stories/laser-welding-cobots-vs-traditional-robots",
      "https://dplaser.com/the-difference-between-laser-welding-vs-robotic-laser-welding",
      "https://www.ligentrobot.com/blog/best-welding-arm-materials.html",
      "https://www.igoldenlaser.com/laser-robotic-welding-machine",
      "https://laser-welder.net/laser-welding/robotic-laser-welding",
      "https://www.borunte.net/news/how-does-a-industrial-robotic-arm-ensure-smoot-81906931.html",
      "https://eureka.patsnap.com/article/feedback-systems-in-robotic-welding-applications",
      "https://www.mckinsey.com/industries/industrials-and-electronics/our-insights/a-leap-in-automation-the-new-technology-behind-general-purpose-robots",
      "https://ris.utwente.nl/ws/files/6086329/thesis_de_Graaf.pdf",
      "https://standardbots.com/blog/laser-welding-robots",
      "https://standardbots.com/blog/automate-spot-welding-a-blueprint-for-implementing-robotic-welders",
      "https://standardbots.com/blog/choosing-the-right-welding-robot-for-your-business",
      "https://www.theseus.fi/bitstream/10024/152520/1/Jouttijarvi_Juho_ja_Vimalraj_Melvin.pdf",
      "https://usedrobotstrade.com/blog/research-on-return-on-investment-in-robotic-welding-cell-solutions",
      "https://www.thefabricator.com/thefabricator/article/laserwelding/hand-held-laser-welding-to-code",
      "https://www.mdpi.com/1996-1944/18/4/860",
      "https://michale.pl/en/products/robot-siasun-sr25a-12-2-01",
      "https://en.siasun.com/industrial-robotic-intelligent-welding-system-for-engineering-machinery.html"
    ],
    "observation_4": "I've now developed a comprehensive understanding of teaching-free laser welding robots. I've confirmed that these systems leverage 3D scanning, visual recognition, AI/ML, and arc tracking to achieve autonomous path planning and real-time adjustments, effectively eliminating the need for manual teaching. This intelligent identification and path planning, as exemplified by products like the SIASUN Teach-Free Welding Robot, is a core competitive strength, simplifying programming and enhancing operational efficiency.",
    "plan_5": {
      "title": "Detailed Insights into the Welding Arm\nMarket Acceptance and Competitive Landscape\nConcluding Research and Synthesizing Findings",
      "description": "I've gathered significant details about the welding arm itself. These are typically 6-axis articulated arms, designed for high repeatability and precision. The arm's crucial role is to precisely position the integrated welding head, which contains optics (mirrors, lenses) and various sensors (laser sensors, vision systems, arc tracking). The use of encoders, gyroscopes, and force sensors ensures precise position, orientation, and force control. I've also noted the importance of lightweight materials like carbon fiber composites for enhanced speed and energy efficiency, contributing to the arm's overall performance and quality attributes like millimeter-level accuracy and sub-pixel precision.\nThe market for robotic laser welding is experiencing robust growth, driven by the demand for automation, precision, and efficiency across industries such as automotive, aerospace, and electronics. The 'teaching-free' aspect is a significant competitive advantage, reducing programming time and increasing flexibility compared to traditional robots. Leading manufacturers like FANUC, KUKA, and OTC DAIHEN are integrating advanced features, including hollow wrist designs and smart functions, to enhance their offerings. The benefits of these systems, such as increased productivity, reduced errors, lower labor costs, and improved safety, are well-recognized.\nWhile I have a strong grasp of the principles, products, market acceptance, and detailed specifics of the welding arm, I've identified a remaining gap in highly specific, quantifiable case studies that directly link the 'teaching-free' aspect and the welding arm's unique capabilities to significant ROI or performance improvements in real-world applications. Given the proprietary nature of such detailed data, I believe I've reached a point of saturation with publicly available information. I will now proceed to synthesize all the gathered information into a comprehensive report."
    }
  },
  "final_report": "# **The Dawn of Autonomy: A Comprehensive Analysis of Teaching-Free Laser Welding Robots and Their Impact on Modern Manufacturing**\n\n## **I. Executive Summary**\n\nTeaching-free laser welding robots represent a profound advancement in industrial automation, moving beyond traditional \"teach-and-repeat\" methods to intelligent, self-optimizing systems. This innovation directly addresses long-standing challenges in welding, such as programming complexity, human variability, and the need for adaptability across diverse production requirements. These systems are not merely incremental improvements but signify a fundamental transformation, enabling broader adoption of robotic welding, especially in previously challenging High-Mix, Low-Volume (HMLV) manufacturing environments.\n\nThe market for laser welding industrial robots is experiencing robust expansion, projected to reach USD 6 @https://pclgroupcncmachine.com/teaching-free-robotic-welding-station/>  billion by 2033 from USD 3 @https://www.gminsights.com/industry-analysis/robotics-laser-welding-market>  billion in 2024, reflecting a Compound Annual Growth Rate (CAGR) of approximately 8 @https://pclgroupcncmachine.com/teaching-free-robotic-welding-station/> % from 2026 to 2033 @https://www.openpr.com/news/4103986/global-laser-welding-industrial-robot-market-insight-growth>  The robotics laser welding industry specifically was valued at USD 1 @https://pclgroupcncmachine.com/teaching-free-robotic-welding-station/>  billion in 2023 and is estimated to register a CAGR of over 8 @https://pclgroupcncmachine.com/teaching-free-robotic-welding-station/> % between 2024 and 2032 @https://www.gminsights.com/industry-analysis/robotics-laser-welding-market>  This significant growth is primarily driven by the increasing demand for enhanced precision, speed, efficiency, and safety across critical manufacturing sectors. Central to achieving these multifaceted benefits is the welding arm, which serves as the primary interface with the workpiece. Advancements in its design, the materials used in its construction, and its integrated sensing capabilities directly contribute to the system's overall performance and competitive strength. This allows for automation in scenarios where traditional, rigidly programmed robots struggled, thereby opening new avenues for efficiency and quality in manufacturing.\n\n## **II. Introduction to Teaching-Free Laser Welding Robotics**\n\n### **Defining \"Teaching-Free\" Automation: A Paradigm Shift in Robotic Welding**\n\nTeaching-free robotic welding systems represent a new generation of automation where robots learn and optimize their welding processes autonomously, without the need for extensive manual programming or \"teaching\" by human operators @https://en.siasun.com/siasun-teach-free-welding-robot.html>  Unlike traditional systems that rely on pre-programmed settings or cumbersome teach pendants, which can take weeks or months to master 6, these advanced robots leverage artificial intelligence (AI), machine learning (ML), and sophisticated sensor technologies to perceive, analyze, and adapt to real-time welding conditions @https://en.siasun.com/siasun-teach-free-welding-robot.html>  This capability allows them to intelligently plan welding paths, automatically generate efficient programs, and execute tasks autonomously, even for complex or irregular geometries @https://en.siasun.com/siasun-teach-free-welding-robot.html>  The user interfaces are often intuitive, incorporating drag-and-drop programming or \"teach-by-touch\" methods, significantly simplifying the programming process for non-experts @https://esab.com/us/nam_en/esab-university/articles/transform-your-welding-shop-with-cobot-welding-a-comprehensive-guide/> \n\n### **Evolution from Traditional Robotic Welding: Addressing Limitations of Manual Programming and \"Teach-and-Repeat\" Models**\n\nTraditional robotic welding, while a significant leap in its time (developed in the 1960s-70s to optimize production costs and increase output), has predominantly been used in low-mix, high-volume production due to its efficiency in repetitive tasks @https://pclgroupcncmachine.com/drag-teaching-robots-vs-robotic-welding-a-comprehensive-guide/>  Programming these systems often involves complex coding in languages like Python or C++, or proprietary robot interfaces, requiring extensive expertise and lengthy programming periods @https://esab.com/us/nam_en/esab-university/articles/transform-your-welding-shop-with-cobot-welding-a-comprehensive-guide/>  Any changes in the welding process or part geometry necessitate new code, leading to significant operational downtime @https://esab.com/us/nam_en/esab-university/articles/transform-your-welding-shop-with-cobot-welding-a-comprehensive-guide/>  This \"teach-and-repeat\" model proves inadequate when tackling large-scale, complex, or highly customized welding tasks, limiting overall production efficiency and quality improvement @https://en.siasun.com/siasun-teach-free-welding-robot.html> \n\nThe human factor in traditional welding is also critical. Welders must actively gather information on the current situation, compare it with predicted scenarios, and adapt to numerous parameters, including welding current, speed, voltage, torch position and orientation, filler material deposition, shielding gas, workpiece dimensions, and even human factors like physical or cognitive fatigue @https://arxiv.org/pdf/2402.14388>  The transition to \"teaching-free\" is a direct response to these inherent limitations and the complexities introduced by human variability. By automating weld path generation and parameter adjustment, these systems aim to standardize and optimize a highly variable process. This fundamental shift allows for the automation of tasks previously deemed too complex or inconsistent for robots, thereby mitigating labor shortages and associated costs by reducing reliance on a shrinking pool of highly skilled human welders @https://www.openpr.com/news/4103986/global-laser-welding-industrial-robot-market-insight-growth>  This transformation in approach simplifies programming from complexity to simplicity, enabling quick adjustments and adaptability, which is crucial for modern manufacturing demands @https://en.siasun.com/siasun-teach-free-welding-robot.html> \n\n## **III. Core Technologies and Operational Principles**\n\n### **Intelligent Identification & Path Planning**\n\nThe cornerstone of teaching-free operation lies in advanced perception systems that enable robots to \"see\" and \"understand\" the welding environment. This involves the use of 3D scanning sensors coupled with sophisticated visual recognition algorithms @https://en.siasun.com/siasun-teach-free-welding-robot.html>  These systems accurately and instantaneously locate weld seam positions, shapes, and quantities @https://en.siasun.com/siasun-teach-free-welding-robot.html> \n\nKey technologies include point or line laser sensors, which achieve millimeter-level accuracy in pinpointing weld start and end points @https://en.siasun.com/siasun-teach-free-welding-robot.html>  Stereo vision systems, integrated with deep learning models like improved U-Net, facilitate robust weld segmentation and efficient acquisition of full 3D weld information, enabling automatic weld recognition and autonomous path planning @https://en.siasun.com/siasun-teach-free-welding-robot.html>  This dual-modal perception framework, combining 2D image autonomous recognition with 3D point cloud precise planning, effectively overcomes challenges such as redundant point cloud processing and insufficient robustness under complex working conditions, including noise interference and groove deformation @https://en.siasun.com/siasun-teach-free-welding-robot.html>  Once weld seam information is identified, the system intelligently plans optimal welding paths, even for complex or irregular structural components like H-beams and steel columns @https://en.siasun.com/siasun-teach-free-welding-robot.html>  This autonomous path generation is a critical differentiator from traditional methods that require manual teaching of every point @https://en.siasun.com/siasun-teach-free-welding-robot.html> \n\n### **Real-time Adaptive Control and Feedback Mechanisms**\n\nTeaching-free systems are characterized by their ability to dynamically adjust welding parameters in real-time without human interaction @https://en.huahengrobotics.com/news_details/1931744544595263488.html>  This is achieved through the integration of AI and machine learning algorithms that evaluate incoming data, learn from patterns, and modify critical parameters such as laser power, welding speed, and focus location @https://www.lasertechnologies.co.in/laser-welding/ai-in-laser-welding> \n\nA comprehensive array of sensors provides the necessary real-time feedback:\n\n* **Optical Sensors:** These utilize cameras or laser-based systems for seam tracking, weld inspection, and detecting deviations in weld paths or joint gaps, ensuring precise torch positioning @https://www.iimtcobot.com/news/what-sensors-does-a-welding-robot-have.html> \n* **Laser-Based Feedback Systems:** These measure the distance between the welding tool and workpiece, which is crucial for maintaining correct standoff distance and ensuring consistent weld penetration and bead quality @https://eureka.patsnap.com/article/feedback-systems-in-robotic-welding-applications> \n* **Force/Torque Sensors:** These provide real-time feedback on forces exerted by the torch, enabling precise control of parameters like speed, penetration depth, and bead geometry @https://www.iimtcobot.com/news/what-sensors-does-a-welding-robot-have.html> \n* **Temperature Sensors:** These monitor heat generated during welding, allowing for real-time adjustments to optimize weld quality and prevent overheating or distortion @https://www.iimtcobot.com/news/what-sensors-does-a-welding-robot-have.html> \n* **Touch Sensors:** Integrated into the end effector, these are used for precise positioning or manipulation, detecting contact with the workpiece for accurate reference point location or seam tracking @https://www.iimtcobot.com/news/what-sensors-does-a-welding-robot-have.html> \n\nThis predictive control ensures consistent weld quality by reducing downtime and rework, even in fluctuating production situations @https://www.lasertechnologies.co.in/laser-welding/ai-in-laser-welding>  AI-powered vision systems also check finished weld seams for flaws, eliminating the need for manual inspection and increasing manufacturing efficiency @https://www.lasertechnologies.co.in/laser-welding/ai-in-laser-welding> \n\nThe deep integration of perception and intelligence allows the robot to handle variations, anomalies, and complex conditions in workpieces or environments that would typically cause failures or require human intervention in traditional automated systems. For example, AI systems automatically modify parameters when anomalies are identified, and high accuracy is maintained under complex working conditions such as noise interference and groove deformation @https://www.lasertechnologies.co.in/laser-welding/ai-in-laser-welding>  This means the robot can \"self-correct\" 9 and maintain consistent weld quality even with imperfect input or dynamic conditions, a critical capability for real-world manufacturing environments where perfect part fit-up is rare. This capability is fundamental to realizing the full potential of Industry 4.0 and smart factories 1, where systems are expected to be highly autonomous, self-optimizing, and resilient. It signifies a profound shift from rigid, pre-programmed automation to truly intelligent, flexible, and adaptive manufacturing systems that can respond dynamically to production challenges, reducing downtime and enhancing overall system robustness.\n\n## **IV. The Laser Welding Arm: Detailed Specifics, Quality, and Advantages**\n\n### **Design and Articulation**\n\nThe core of a teaching-free laser welding robot is its multi-axis robotic arm, typically a six-axis articulated model @https://standardbots.com/blog/choosing-the-right-welding-robot-for-your-business>  This configuration provides the necessary degrees of freedom for precise positioning and manipulation of the laser welding head across complex, three-dimensional workpieces, enabling welding in various orientations and hard-to-reach areas @https://www.igoldenlaser.com/laser-robotic-welding-machine/> \n\nIntegrated components on the arm include the laser head, which contains optics like mirrors and lenses to focus and guide the laser beam onto the material @https://laser-welder.net/laser-welding/robotic-laser-welding/>  The laser beam itself is often delivered via flexible optical fibers from a high-performance laser source, such as a fiber laser or CO2 laser @https://laser-welder.net/laser-welding/robotic-laser-welding/> \n\nInnovative designs, such as SIASUN's hollow arc-shaped arm, minimize interference with workpieces, allowing for greater operational flexibility and more compact working arrangements, which is ideal for space-limited environments @https://michale.pl/en/products/robot-siasun-sr25a-12-2-01/>  The integration of the wire feeder directly into the robot body further reduces overall weight and improves wire feeding stability and welding quality @https://michale.pl/en/products/robot-siasun-sr25a-12-2-01/> \n\n### **Materials for High-Precision Arms**\n\nThe selection of materials for welding robot arms is critical for achieving high precision, stability, and durability, directly influencing the arm's quality and competitive strengths. Each material presents a unique set of properties, advantages, and limitations, requiring careful consideration based on the robot's performance requirements, working environment, and cost considerations.\n\n**Table 1: Comparison of Welding Arm Materials**\n\n| Material | Key Properties | Advantages for Welding Arms | Limitations/Drawbacks |\n| --- | --- | --- | --- |\n| **Aluminum Alloy** | Light weight, good electrical conductivity, strong corrosion resistance, good machinability, high strength 39 | Reduced operational energy consumption, increased operating speed and efficiency, ease of processing into complex shapes 39 | Poor wear resistance, susceptibility to corrosion and oxidation, limited application in extreme environments 39 |\n| **Stainless Steel** | Good surface finish, high strength and ductility, excellent corrosion resistance 39 | Stable performance in harsh working environments, extended robot lifespan, suitable for high-end arms 39 | High hardness, difficult to process, higher production costs 39 |\n| **Carbon Steel** | Relatively low hardness, easy processing, low cost 39 | Meets basic mechanical performance requirements, cost-effective for mid- to low-end arms 39 | Relatively weak wear resistance, prone to rust, shorter service life 39 |\n| **Carbon Fiber Composites** | High strength, light weight, low creep, good machinability 39 | Significantly enhanced motion stability and accuracy, reduced operational energy consumption, improved work efficiency, high-precision applications 39 | Relatively high cost, requires specialized processing techniques and equipment, limits widespread use 39 |\n| **Magnesium Alloy** | Low density, high strength, high elastic modulus, good heat dissipation, damping properties 39 | Significantly reduced arm self-weight, improved robot motion performance and work efficiency 39 | Lower toughness compared to steel and aluminum alloys, unsuitable for heavy-load handling 39 |\n\nUnderstanding these trade-offs is crucial for manufacturers. For example, while carbon steel offers cost-effectiveness, its limitations in wear and corrosion resistance can compromise long-term quality in demanding environments. Conversely, carbon fiber composites, despite their higher cost, provide superior performance attributes like enhanced motion stability and accuracy, directly contributing to the precision and overall quality of the welding arm. These material choices reflect strategic decisions to balance performance, durability, and economic viability in the design of high-precision robotic welding systems.\n\n### **Precision Mechanisms and Quality Assurance**\n\nThe exceptional precision and smooth movement of teaching-free welding arms are achieved through a sophisticated combination of mechanical design and advanced sensor integration. This intricate interplay allows the robot to execute tasks with remarkable accuracy and consistency @https://www.iimtcobot.com/news/what-sensors-does-a-welding-robot-have.html> \n\nKey mechanisms contributing to precision include:\n\n* **Encoders:** These devices measure the precise position and movement of the robot by tracking the rotation of the motor shaft, converting this mechanical motion into electronic signals for the control system. This enables the robot to know the exact arm position at any given moment and maintain it with high precision. Both absolute encoders, which provide exact position, and incremental encoders, which measure changes from a known starting point, are utilized @https://www.borunte.net/news/how-does-a-industrial-robotic-arm-ensure-smoot-81906931.html> \n* **Gyroscopes:** These sensors measure the angular velocity and orientation of the arm, detecting the rotation of a spinning disc in three dimensions. This information allows the control system to adjust the speed and direction of the robot's movements, ensuring smooth and precise operation @https://www.borunte.net/news/how-does-a-industrial-robotic-arm-ensure-smoot-81906931.html> \n* **Force Sensors:** These detect the force applied to the arm during operation, measuring the pressure and direction of that force. This data is critical for adjusting the arm's movements, ensuring it applies the correct force and speed required for a given welding task @https://www.iimtcobot.com/news/what-sensors-does-a-welding-robot-have.html> \n\nThe control system functions as the \"brain\" of the robotic arm, interpreting the vast amounts of data received from these sensors in real-time. It then sends precise commands to the motors and other components, directing the arm's movements to ensure the required precision and speed. This system often integrates seamlessly with other manufacturing components, such as conveyors and fixtures, to optimize the entire production process @https://www.borunte.net/news/how-does-a-industrial-robotic-arm-ensure-smoot-81906931.html> \n\nTeaching-free laser welding robots boast impressive accuracy and repeatability metrics. For instance, some systems achieve a repeatability accuracy of ±0.02mm 12 or ±0.08mm @https://www.evsint.com/laser-welding-robots-and-welding-turntables-for-superior-results/>  Advanced vision systems can achieve pixel-level precision, with accuracies up to 91% within ±1 pixel (0.023mm) for weld seam detection @https://ojs.aaai.org/index.php/AAAI/article/view/26834/26606>  Furthermore, systems are capable of predicting welding instability with 98 @https://www.openpr.com/news/4103986/global-laser-welding-industrial-robot-market-insight-growth> % accuracy @https://www.evsint.com/welding-robot-applications-in-manufacturing-streamline-production/>  Sensor-guided systems have been shown to improve accuracy beyond the absolute accuracy of the robot arm, compensating for errors in the robot's geometric model @https://ris.utwente.nl/ws/files/6086329/thesis_de_Graaf.pdf> \n\nThe integration of sophisticated sensor arrays and advanced control algorithms within the welding arm is paramount for achieving and maintaining the micron/millimeter-level precision and consistency that differentiates laser welding, particularly in dynamic and adaptive \"teaching-free\" environments. This level of real-time, adaptive control ensures that the theoretical advantages of laser welding are consistently realized in practical manufacturing environments. The continuous feedback from sensors allows for dynamic adjustments to maintain weld quality despite inevitable imperfections in parts, material variations, or environmental factors @https://en.huahengrobotics.com/news_details/1931744544595263488.html>  This capability enables \"adaptive precision,\" where the robot intelligently adjusts to maintain perfection despite variations, actively correcting for issues like part misalignment or thermal distortion @https://ris.utwente.nl/ws/files/6086329/thesis_de_Graaf.pdf>  This leads to significantly reduced rework and material waste 6, enhancing overall product reliability and safety, which is paramount for critical components in industries like automotive and aerospace.\n\nThe precision of the welding arm, combined with the focused energy of the laser, leads to several critical improvements in weld quality:\n\n* **Minimal Heat Distortion and Narrow Heat-Affected Zone (HAZ):** The laser's high power density and narrow focus melt materials locally, significantly reducing thermal impact on surrounding areas. This results in cleaner welds with less warping and improved finishes, especially on thin or delicate materials @https://www.lasertechnologies.co.in/laser-welding/ai-in-laser-welding> \n* **Deep Penetration and High Strength Welds:** High power densities create a \"keyhole\" effect, where the laser beam vaporizes the metal, resulting in narrow, deep welds with uniform structure and high strength @https://laser-welder.net/laser-welding/robotic-laser-welding/> \n* **Reduced Defects:** Precise control minimizes common welding defects such as porosity, cracks, undercuts, incomplete fusion, and spatter @https://esab.com/us/nam_en/esab-university/articles/transform-your-welding-shop-with-cobot-welding-a-comprehensive-guide/>  Automated inspection systems can catch problems with up to 90% higher accuracy than manual checks, further ensuring quality @https://www.evsint.com/welding-robot-applications-in-manufacturing-streamline-production/> \n* **Improved Surface Morphology:** Advanced techniques like Adjustable-Ring-Mode (ARM) lasers and Laser Stir Welding (LSW) can significantly improve weld surface smoothness, refine grain structure, and eliminate porosity, enhancing both aesthetic and structural integrity @https://shop.adhmt.com/the-future-of-laser-welding-machines-trends-and-innovations-in-the-industry/> \n\nInnovations like adaptive optics (AO) further enhance weld integrity by allowing real-time adjustments to the laser beam's shape and focus, optimizing the welding process and reducing defects caused by variations in material properties @https://kirinlaser.com/innovations-in-laser-welding-technology-you-need-to-know/>  The integration of AI with adaptive optics can predict optimal laser parameters based on real-time sensor data, further streamlining the process and reducing the need for manual adjustments @https://kirinlaser.com/innovations-in-laser-welding-technology-you-need-to-know/> \n\n## **V. Market Acceptance and Industry Impact**\n\n### **Key Market Advantages**\n\nTeaching-free laser welding robots are gaining significant market acceptance due to a compelling array of advantages that address critical manufacturing needs:\n\n* **Enhanced Productivity and Efficiency:** These robots significantly increase production throughput due to faster welding speeds, outpacing traditional methods @https://www.lasertechnologies.co.in/laser-welding/ai-in-laser-welding>  Their ability to operate continuously (24/7) without fatigue or breaks maximizes output and reduces cycle times, leading to higher revenues and profitability for fabricators @https://en.huahengrobotics.com/news_details/1931744544595263488.html> \n* **Reduced Labor Intensity and Costs:** By automating complex welding tasks and eliminating the need for tedious manual teaching, these systems significantly cut down on labor expenses and reduce the physical demands on human welders @https://www.openpr.com/news/4103986/global-laser-welding-industrial-robot-market-insight-growth>  This directly addresses the global challenge of finding and retaining skilled welding personnel @https://www.openpr.com/news/4103986/global-laser-welding-industrial-robot-market-insight-growth> \n* **Improved Safety:** Robotic welding systems remove human operators from hazardous environments involving high heat, fumes, sparks, and radiation, thereby significantly reducing the risk of workplace accidents and improving overall worker safety. This can also lead to lower insurance premiums and compensation payouts @https://en.huahengrobotics.com/news_details/1931744544595263488.html> \n* **Increased Flexibility and Adaptability:** Teaching-free systems excel in handling intricate welding tasks, complex geometries, and a wide range of materials, including those traditionally difficult to weld like aluminum and copper @https://www.lasertechnologies.co.in/laser-welding/ai-in-laser-welding>  Their ability to adapt to different welding requirements and switch between tasks with ease makes them ideal for high-mix, low-volume (HMLV) production environments, where frequent reprogramming is a necessity @https://pclgroupcncmachine.com/drag-teaching-robots-vs-robotic-welding-a-comprehensive-guide/> \n* **Reduced Programming Time and Ease of Use:** A key advantage of \"teaching-free\" and collaborative robot (cobot) systems is simplified programming, often achieved through intuitive user interfaces, drag-and-drop programming, or even \"teach-by-touch\" methods, eliminating the need for specialized coding skills @https://pclgroupcncmachine.com/teaching-free-robotic-welding-station/>  This drastically reduces setup time and accelerates deployment, with some systems being deployed in less than a day @https://standardbots.com/blog/robotic-welding-programming> \n\n### **Market Size and Growth Projections**\n\nThe Laser Welding Industrial Robot Market is experiencing significant growth, driven by increased automation across global manufacturing @https://www.openpr.com/news/4103986/global-laser-welding-industrial-robot-market-insight-growth>  The market was valued at USD 3 @https://www.gminsights.com/industry-analysis/robotics-laser-welding-market>  billion in 2024 and is expected to reach USD 6 @https://pclgroupcncmachine.com/teaching-free-robotic-welding-station/>  billion by 2033, reflecting a robust Compound Annual Growth Rate (CAGR) of about 8 @https://pclgroupcncmachine.com/teaching-free-robotic-welding-station/> % from 2026 to 2033 @https://www.openpr.com/news/4103986/global-laser-welding-industrial-robot-market-insight-growth>  The robotics laser welding industry specifically was valued at USD 1 @https://pclgroupcncmachine.com/teaching-free-robotic-welding-station/>  billion in 2023 and is estimated to register a CAGR of over 8 @https://pclgroupcncmachine.com/teaching-free-robotic-welding-station/> % between 2024 and 2032 @https://www.gminsights.com/industry-analysis/robotics-laser-welding-market>  This growth is underpinned by the global shift toward smart factories, the demand for lightweight and high-strength material welding, and an increased focus on quality and efficiency in manufacturing processes @https://www.openpr.com/news/4103986/global-laser-welding-industrial-robot-market-insight-growth> \n\n### **Key Industries and Applications**\n\nLaser welding robots are rapidly adopted across various sectors where high-quality and high-throughput welding are essential:\n\n* **Automotive:** The largest adopter, accounting for about 35% of industrial robot sales, deploying robots for lightweight vehicle structures, high-speed assembly lines, Body-in-White (BIW) assembly, and EV battery welding, where precision and heat control are critical @https://www.openpr.com/news/4103986/global-laser-welding-industrial-robot-market-insight-growth> \n* **Aerospace:** Utilizes laser welding for high-strength, safety-critical joints in lightweight materials, complex components, and additive manufacturing processes @https://www.openpr.com/news/4103986/global-laser-welding-industrial-robot-market-insight-growth> \n* **Electronics:** Employs laser welding for precision assembly of components, especially for small parts, enclosures, and battery tab connections, where accuracy and minimal thermal distortion are essential @https://www.openpr.com/news/4103986/global-laser-welding-industrial-robot-market-insight-growth> \n* **Medical Devices:** Favors laser welding for its high accuracy, minimal thermal distortion, and ability to join extremely small parts and delicate materials, crucial for sterile applications and intricate components @https://www.openpr.com/news/4103986/global-laser-welding-industrial-robot-market-insight-growth> \n* **Construction and Heavy Industry:** Applications include welding large-scale, complex structural components like H-beams and steel columns, where intelligent identification and path planning are highly beneficial @https://en.siasun.com/siasun-teach-free-welding-robot.html> \n\n### **Leading Manufacturers**\n\nKey players in the laser welding industrial robot market include FANUC, Yaskawa, ABB, COMAU Robotics, and KUKA Roboter GmbH, all of whom are continuously investing in R&D to develop AI-driven, more affordable, and user-friendly solutions @https://www.openpr.com/news/4103986/global-laser-welding-industrial-robot-market-insight-growth>  Other notable manufacturers offering teaching-free or highly intuitive systems include SIASUN 3, OTC DAIHEN 59, Photonweld 10, LIGENT 11, and Doosan @https://m.youtube.com/watch?v=sVtZGl8yWUc> \n\n### **Challenges to Adoption**\n\nDespite the numerous benefits, several challenges can hinder widespread adoption, particularly for small and medium manufacturers:\n\n* **High Initial Investment:** The cost of robots and system integration can be a significant barrier @https://www.openpr.com/news/4103986/global-laser-welding-industrial-robot-market-insight-growth> \n* **Need for Skilled Personnel:** While teaching-free systems reduce programming complexity, operating and maintaining advanced welding robots still requires skilled personnel, creating a potential skill gap @https://www.openpr.com/news/4103986/global-laser-welding-industrial-robot-market-insight-growth> \n* **Integration Complexity:** Integrating these advanced systems into existing production lines can be complex, requiring careful planning and execution @https://www.openpr.com/news/4103986/global-laser-welding-industrial-robot-market-insight-growth> \n\n### **Future Outlook**\n\nThe future of teaching-free laser welding robots is characterized by increasing intelligence and autonomy. AI and IoT technologies are expected to be further integrated, leading to smarter, self-correcting welding techniques and enhanced operational transparency @https://www.openpr.com/news/4103986/global-laser-welding-industrial-robot-market-insight-growth>  This will enable real-time monitoring and adjustments, potentially allowing sensors to assess weld quality by analyzing over 3,000 images per second @https://aijourn.com/the-future-of-laser-welding-in-automation/>  The market's rapid expansion and broad industry adoption underscore a fundamental shift from niche automation to a mainstream, indispensable manufacturing capability. This is driven by the compelling Return on Investment (ROI) and strategic advantages offered by autonomous systems, making them a crucial investment for manufacturers seeking to enhance productivity, reduce costs, and ensure product quality in an evolving industrial landscape @https://esab.com/us/nam_en/esab-university/articles/transform-your-welding-shop-with-cobot-welding-a-comprehensive-guide/>  Collaborative robots (cobots) will also play an increasingly significant role, working safely alongside humans and adapting to various tasks, further boosting efficiency and flexibility @https://www.ipgphotonics.com/newsroom/stories/laser-welding-cobots-vs-traditional-robots> \n\n## **VI. Conclusions**\n\nThe advent of teaching-free laser welding robots marks a pivotal moment in manufacturing automation. These systems fundamentally redefine robotic welding by moving beyond rigid, pre-programmed operations to intelligent, adaptive processes. This transformation is driven by the seamless integration of advanced sensing technologies, such as 3D scanning and multi-modal vision systems, with sophisticated AI and machine learning algorithms. This combination enables robots to autonomously identify weld seams, plan optimal paths, and dynamically adjust welding parameters in real-time, even in complex and variable production environments.\n\nThe welding arm itself is central to this paradigm shift. Its multi-axis articulation, coupled with precise internal mechanisms like encoders, gyroscopes, and force sensors, allows for micron-level positional accuracy and exceptional repeatability. The strategic selection of advanced materials, particularly carbon fiber composites, further enhances the arm's motion stability, speed, and durability. This engineering excellence directly translates into superior weld quality, characterized by minimal heat distortion, deep penetration, reduced defects, and improved surface morphology.\n\nThe market has embraced these innovations, as evidenced by robust growth projections and widespread adoption across high-precision industries like automotive, aerospace, and electronics. The compelling benefits—including significantly enhanced productivity, reduced labor costs, improved safety, increased flexibility for high-mix production, and drastically simplified programming—present a strong business case for investment. While initial investment costs and the need for skilled maintenance personnel remain considerations, the long-term advantages in quality, efficiency, and adaptability position teaching-free laser welding robots as an indispensable component of modern, smart manufacturing ecosystems. Their continued evolution promises even greater autonomy and efficiency, further solidifying their role in shaping the future of industrial production.\n\n#### 引用的著作\n\n1. Global Laser Welding Industrial Robot Market Insight, Growth, - openPR.com, 访问时间为 七月 28, 2025， <https://www.openpr.com/news/4103986/global-laser-welding-industrial-robot-market-insight-growth>\n2. Robotics Laser Welding Market Size, Share & Statistics, 2032, 访问时间为 七月 28, 2025， <https://www.gminsights.com/industry-analysis/robotics-laser-welding-market>\n3. SIASUN Teach-Free Welding Robot, 访问时间为 七月 28, 2025， <https://en.siasun.com/siasun-teach-free-welding-robot.html>\n4. Revolutionizing Industry: The Teaching-Free Robotic Welding System, 访问时间为 七月 28, 2025， <https://en.huahengrobotics.com/news_details/1931744544595263488.html>\n5. Teaching-Free Robotic Welding station - PCL Group, 访问时间为 七月 28, 2025， <https://pclgroupcncmachine.com/teaching-free-robotic-welding-station/>\n6. Understanding Cobot Welding and its Benefits - ESAB United States, 访问时间为 七月 28, 2025， <https://esab.com/us/nam_en/esab-university/articles/transform-your-welding-shop-with-cobot-welding-a-comprehensive-guide/>\n7. Drag Teaching Robots vs Robotic Welding: A Comprehensive Guide - PCL Group, 访问时间为 七月 28, 2025， <https://pclgroupcncmachine.com/drag-teaching-robots-vs-robotic-welding-a-comprehensive-guide/>\n8. How to program a robotic welding system: Step-by-step guide - Standard Bots, 访问时间为 七月 28, 2025， <https://standardbots.com/blog/robotic-welding-programming>\n9. AI in Laser Welding Technology - Laser University, 访问时间为 七月 28, 2025， <https://www.lasertechnologies.co.in/laser-welding/ai-in-laser-welding>\n10. Robotic Laser Welding: The Future of Welding Technology - PhotonWeld R6-Series Laser Welding Unit - Robotic/Cobotic plug-in Laser Welding modules - Robotic Laser Welding, 访问时间为 七月 28, 2025， <https://photonweld.com/photonweld-robot-and-cobot-laser-welding/photonweld-r-series-pp-plug-and-play-laser-welding-units-for-robot-and-cobot-plug-in-laser-welding-modules>\n11. china welding robot - Ligent robot, 访问时间为 七月 28, 2025， <https://www.ligentrobot.com/weldingrobot/>\n12. Laser Welding Robotic Boost Production 2025 - dplaser, 访问时间为 七月 28, 2025， <https://dplaser.com/laser-welding-robotic-boost-production-2025/>\n13. [Doosan Cobot Solution] Laser Welding Robot (EN) - YouTube, 访问时间为 七月 28, 2025， <https://m.youtube.com/watch?v=sVtZGl8yWUc>\n14. Laser Welding Cobots vs. Traditional Robots - IPG Photonics, 访问时间为 七月 28, 2025， <https://www.ipgphotonics.com/newsroom/stories/laser-welding-cobots-vs-traditional-robots>\n15. Types of welding robots + 5 picks for 2025 - Standard Bots, 访问时间为 七月 28, 2025， <https://standardbots.com/blog/choosing-the-right-welding-robot-for-your-business>\n16. Comparative Study Of Robotic And Manual Welding For Energy Consumption And Efficiency In A High Mix, Low Volume Manufacturing Environment, 访问时间为 七月 28, 2025， <https://commons.und.edu/cgi/viewcontent.cgi?article=8090&context=theses>\n17. Robotic Laser Welding: Processes, Advantages, and Technologies ..., 访问时间为 七月 28, 2025， <https://laser-welder.net/laser-welding/robotic-laser-welding/>\n18. arXiv:2402.14388v1 [cs.RO] 22 Feb 2024, 访问时间为 七月 28, 2025， <https://arxiv.org/pdf/2402.14388>\n19. How manufacturers are using welding robots to streamline production, 访问时间为 七月 28, 2025， <https://www.evsint.com/welding-robot-applications-in-manufacturing-streamline-production/>\n20. Robotic Laser Welding: Processes, Advantages, and Technologies, 访问时间为 七月 28, 2025， <https://laser-welder.net/laser-welding/robotic-laser-welding-processes-advantages-and-technologies/>\n21. RESEARCH ON RETURN ON INVESTMENT IN ROBOTIC WELDING CELL SOLUTIONS, 访问时间为 七月 28, 2025， <https://usedrobotstrade.com/blog/research-on-return-on-investment-in-robotic-welding-cell-solutions/>\n22. Development of a real-time laser-based machine vision system to monitor and control welding processes - SMU, 访问时间为 七月 28, 2025， <https://www.smu.edu/-/media/site/lyle/rcam/publications/development-of-a-real-time-laser-based-machine-vision-system-to-monitor-and-control-welding-processes.pdf>\n23. The active visual sensing methods for robotic welding: review, tutorial and prospect - arXiv, 访问时间为 七月 28, 2025， <https://arxiv.org/pdf/2405.00685>\n24. A Dual-Modal Robot Welding Trajectory Generation Scheme for Motion Based on Stereo Vision and Deep Learning - PubMed Central, 访问时间为 七月 28, 2025， <https://pmc.ncbi.nlm.nih.gov/articles/PMC12155970/>\n25. Accurate Detection of Weld Seams for Laser Welding in Real-World Manufacturing - AAAI Publications, 访问时间为 七月 28, 2025， <https://ojs.aaai.org/index.php/AAAI/article/view/26834/26606>\n26. Latest Innovations in Laser Welding Technology, 访问时间为 七月 28, 2025， <https://kirinlaser.com/innovations-in-laser-welding-technology-you-need-to-know/>\n27. Understanding the Sensors Used in Welding Robots, 访问时间为 七月 28, 2025， <https://www.iimtcobot.com/news/what-sensors-does-a-welding-robot-have.html>\n28. Feedback systems in robotic welding applications - Patsnap Eureka, 访问时间为 七月 28, 2025， <https://eureka.patsnap.com/article/feedback-systems-in-robotic-welding-applications>\n29. Laser tracking | Robot welding features - Jucat, 访问时间为 七月 28, 2025， <https://jucat.fi/features/laser-tracking/>\n30. How Does A Industrial Robotic Arm Ensure Smooth Speed And ..., 访问时间为 七月 28, 2025， <https://www.borunte.net/news/how-does-a-industrial-robotic-arm-ensure-smoot-81906931.html>\n31. Laser Robotic Welding Machine - iGOLDENLASER, 访问时间为 七月 28, 2025， <https://www.igoldenlaser.com/laser-robotic-welding-machine/>\n32. (PDF) ADVANCED TECHNIQUES AND APPLICATIONS IN ROBOTIC LASER WELDING FOR HIGH PRECISION MANUFACTURING YÜKSEK HASSASİYETLİ İMALAT İÇİN ROBOT LAZER KAYNAKTA GELİŞMİŞ TEKNİKLER VE UYGULAMALARI - ResearchGate, 访问时间为 七月 28, 2025， <https://www.researchgate.net/publication/387602732_ADVANCED_TECHNIQUES_AND_APPLICATIONS_IN_ROBOTIC_LASER_WELDING_FOR_HIGH_PRECISION_MANUFACTURING_YUKSEK_HASSASIYETLI_IMALAT_ICIN_ROBOT_LAZER_KAYNAKTA_GELISMIS_TEKNIKLER_VE_UYGULAMALARI>\n33. Robotic spot welding: Smart automation for 2025 - Standard Bots, 访问时间为 七月 28, 2025， <https://standardbots.com/blog/automate-spot-welding-a-blueprint-for-implementing-robotic-welders>\n34. The Difference between Laser Welding vs. Robotic Laser Welding - dplaser, 访问时间为 七月 28, 2025， <https://dplaser.com/the-difference-between-laser-welding-vs-robotic-laser-welding/>\n35. An Introduction to Laser Welding Robot - Leapion, 访问时间为 七月 28, 2025， <https://www.leapion.com/An-Introduction-to-Laser-Welding-Robot-id43044057.html>\n36. Laser welding: process, applications and advantages | KUKA AG, 访问时间为 七月 28, 2025， <https://www.kuka.com/en-de/applications/automated-welding/laser-welding>\n37. Industry Insights: Robots and Laser Welding, the Perfect Fit, 访问时间为 七月 28, 2025， <https://www.automate.org/robotics/industry-insights/robots-and-laser-welding-the-perfect-fit>\n38. SIASUN SR25A-12/2.01 robot - Michale Automation - Robotics - Lines and machines, 访问时间为 七月 28, 2025， <https://michale.pl/en/products/robot-siasun-sr25a-12-2-01/>\n39. welding robot arms: common materials and their benefits | ligent robot, 访问时间为 七月 28, 2025， <https://www.ligentrobot.com/blog/best-welding-arm-materials.html>\n40. CSC 297 Robot Construction: Materials - Computer Science : University of Rochester, 访问时间为 七月 28, 2025， <https://www.cs.rochester.edu/u/nelson/courses/csc_robocon/robot_manual/materials.html>\n41. How do robotic arms work? A comprehensive 2025 guide - Standard Bots, 访问时间为 七月 28, 2025， <https://standardbots.com/blog/how-do-robotic-arms-work-a-comprehensive-guide>\n42. Precision Pairing: Leveraging Laser Welding Robots and Welding Turntables for Superior Results - EVS Robot, 访问时间为 七月 28, 2025， <https://www.evsint.com/laser-welding-robots-and-welding-turntables-for-superior-results/>\n43. Sensor-guided robotic laser welding - https ://ris.utwen te.nl, 访问时间为 七月 28, 2025， <https://ris.utwente.nl/ws/files/6086329/thesis_de_Graaf.pdf>\n44. Laser welding robots: Key features and how they work - Standard Bots, 访问时间为 七月 28, 2025， <https://standardbots.com/blog/laser-welding-robots>\n45. What Welding Defects Can Occur in Laser Welding? How To Solve It? - AccTek Laser, 访问时间为 七月 28, 2025， <https://www.accteklaser.com/what-welding-defects-can-occur-in-laser-welding-how-to-solve-it/>\n46. Robotic Laser Welding Systems | Automated Precision Welding - Melton Machine, 访问时间为 七月 28, 2025， <https://meltonmachine.com/solutions/robotic-laser-systems/robotic-laser-welding/>\n47. Five Advantages of Robotic Welding - Swanton Welding, 访问时间为 七月 28, 2025， <https://swantonweld.com/five-advantages-of-robotic-welding/>\n48. Benefits of Robotic Welding Technology in Mass Production, 访问时间为 七月 28, 2025， <https://www.onealmfgservices.com/benefits-of-robotic-welding-technology-in-mass-production>\n49. The Future of Laser Welding Machines: Trends and Innovations in the Industry, 访问时间为 七月 28, 2025， <https://shop.adhmt.com/the-future-of-laser-welding-machines-trends-and-innovations-in-the-industry/>\n50. Deformation Control of Adjustable-Ring-Mode (ARM) Laser Welding for Aluminum Alloys - PMC - PubMed Central, 访问时间为 七月 28, 2025， <https://pmc.ncbi.nlm.nih.gov/articles/PMC11857260/>\n51. Deformation Control of Adjustable-Ring-Mode (ARM) Laser Welding for Aluminum Alloys, 访问时间为 七月 28, 2025， <https://www.mdpi.com/1996-1944/18/4/860>\n52. The Future of Laser Welding in Automation | The AI Journal, 访问时间为 七月 28, 2025， <https://aijourn.com/the-future-of-laser-welding-in-automation/>\n53. Industrial Robotic Intelligent Welding System for Engineering Machinery - SIASUN, 访问时间为 七月 28, 2025， <https://en.siasun.com/industrial-robotic-intelligent-welding-system-for-engineering-machinery.html>\n54. AI advances Robotics Automation in the Home Appliance Sector, 访问时间为 七月 28, 2025， [https://ifr.org/case-studies/industrial-robots/press@ifr.org](https://ifr.org/case-studies/industrial-robots/press%40ifr.org)\n55. FANUC Arc Welding Robots & Cobots, 访问时间为 七月 28, 2025， <https://www.fanuc.eu/eu-en/fanuc-arc-welding-robots-cobots>\n56. Comparing Low Force Friction Welding to Laser Welding, 访问时间为 七月 28, 2025， <https://www.mtiwelding.com/blog/comparing-low-force-friction-welding-to-laser-welding/>\n57. Additive Manufacturing Case Study - KC Robotics, 访问时间为 七月 28, 2025， <https://kcrobotics.com/robotic-welding-aerospace/>\n58. Welding with Robots Inside RTX's Future-tech Lab - YouTube, 访问时间为 七月 28, 2025， <https://www.youtube.com/watch?v=-uauALvIGSU>\n59. OTC DAIHEN, Inc. USA Robotic Welding Solutions, 访问时间为 七月 28, 2025， <https://www.daihen-usa.com/>\n",
  "all_source_links": [
    "https://accounts.google.com/SignOutOptions?hl=zh-CN&continue=https://gemini.google.com/&ec=GBRAkgU",
    "https://aijourn.com/the-future-of-laser-welding-in-automation",
    "https://arxiv.org/pdf/2402.14388",
    "https://arxiv.org/pdf/2405.00685",
    "https://commons.und.edu/cgi/viewcontent.cgi?article=8090&context=theses",
    "https://dplaser.com/laser-welding-robotic-boost-production-2025",
    "https://dplaser.com/the-difference-between-laser-welding-vs-robotic-laser-welding",
    "https://en.huahengrobotics.com/news_details/1931744544595263488.html",
    "https://en.siasun.com/industrial-robotic-intelligent-welding-system-for-engineering-machinery.html",
    "https://en.siasun.com/siasun-teach-free-welding-robot.html",
    "https://esab.com/us/nam_en/esab-university/articles/transform-your-welding-shop-with-cobot-welding-a-comprehensive-guide",
    "https://eureka.patsnap.com/article/feedback-systems-in-robotic-welding-applications",
    "https://evsrobot.en.made-in-china.com/product/NEwUBOADEMkT/China-Kuka-Automatic-Laser-Welding-Robot-Machine-Arm-Laser-Welding-Machine.html",
    "https://ifr.org/case-studies/industrial-robots/press%40ifr.org",
    "https://ifr.org/case-studies/industrial-robots/press@ifr.org",
    "https://jucat.fi/features/laser-tracking",
    "https://kcrobotics.com/robotic-welding-aerospace",
    "https://kirinlaser.com/innovations-in-laser-welding-technology-you-need-to-know",
    "https://laser-welder.net/laser-welding/robotic-laser-welding",
    "https://laser-welder.net/laser-welding/robotic-laser-welding-processes-advantages-and-technologies",
    "https://m.youtube.com/watch?v=sVtZGl8yWUc",
    "https://meltonmachine.com/solutions/robotic-laser-systems/robotic-laser-welding",
    "https://michale.pl/en/products/robot-siasun-sr25a-12-2-01",
    "https://myactivity.google.com/product/gemini?utm_source=gemini",
    "https://ojs.aaai.org/index.php/AAAI/article/view/26834/26606",
    "https://pclgroupcncmachine.com/drag-teaching-robots-vs-robotic-welding-a-comprehensive-guide",
    "https://pclgroupcncmachine.com/teaching-free-robotic-welding-station",
    "https://photonweld.com/photonweld-robot-and-cobot-laser-welding/photonweld-r-series-pp-plug-and-play-laser-welding-units-for-robot-and-cobot-plug-in-laser-welding-modules",
    "https://pmc.ncbi.nlm.nih.gov/articles/PMC11857260",
    "https://pmc.ncbi.nlm.nih.gov/articles/PMC12155970",
    "https://policies.google.com/terms",
    "https://ris.utwente.nl/ws/files/6086329/thesis_de_Graaf.pdf",
    "https://shop.adhmt.com/the-future-of-laser-welding-machines-trends-and-innovations-in-the-industry",
    "https://standardbots.com/blog/automate-spot-welding-a-blueprint-for-implementing-robotic-welders",
    "https://standardbots.com/blog/choosing-the-right-welding-robot-for-your-business",
    "https://standardbots.com/blog/how-do-robotic-arms-work-a-comprehensive-guide",
    "https://standardbots.com/blog/laser-welding-robots",
    "https://standardbots.com/blog/robotic-welding-programming",
    "https://support.google.com/bard/answer/13594961",
    "https://support.google.com/gemini/answer/13594961#location&zippy=%2Cwhat-location-information-do-gemini-apps-collect-why-and-how-is-it-used",
    "https://swantonweld.com/five-advantages-of-robotic-welding",
    "https://usedrobotstrade.com/blog/research-on-return-on-investment-in-robotic-welding-cell-solutions",
    "https://www.accteklaser.com/what-welding-defects-can-occur-in-laser-welding-how-to-solve-it",
    "https://www.automate.org/robotics/industry-insights/robots-and-laser-welding-the-perfect-fit",
    "https://www.borunte.net/news/how-does-a-industrial-robotic-arm-ensure-smoot-81906931.html",
    "https://www.controleng.com/new-developments-in-robotic-welding-cobots-industrial-robots",
    "https://www.cs.rochester.edu/u/nelson/courses/csc_robocon/robot_manual/materials.html",
    "https://www.daihen-usa.com",
    "https://www.evsint.com/laser-welding-robots-and-welding-turntables-for-superior-results",
    "https://www.evsint.com/welding-robot-applications-in-manufacturing-streamline-production",
    "https://www.fanuc.eu/eu-en/fanuc-arc-welding-robots-cobots",
    "https://www.fanucamerica.com/solutions/applications/welding-robots/arc-welding-robots",
    "https://www.gminsights.com/industry-analysis/robotics-laser-welding-market",
    "https://www.igoldenlaser.com/laser-robotic-welding-machine",
    "https://www.iimtcobot.com/news/what-sensors-does-a-welding-robot-have.html",
    "https://www.ipgphotonics.com/newsroom/stories/laser-welding-cobots-vs-traditional-robots",
    "https://www.kuka.com/en-de/applications/automated-welding/laser-welding",
    "https://www.kuka.com/en-us/applications/automated-welding/arc-welding/kuka-arc-welding-robots",
    "https://www.lasertechnologies.co.in/laser-welding/ai-in-laser-welding",
    "https://www.leapion.com/An-Introduction-to-Laser-Welding-Robot-id43044057.html",
    "https://www.ligentrobot.com/blog/best-welding-arm-materials.html",
    "https://www.ligentrobot.com/weldingrobot",
    "https://www.mckinsey.com/industries/industrials-and-electronics/our-insights/a-leap-in-automation-the-new-technology-behind-general-purpose-robots",
    "https://www.mdpi.com/1996-1944/18/4/860",
    "https://www.mtiwelding.com/blog/comparing-low-force-friction-welding-to-laser-welding",
    "https://www.onealmfgservices.com/benefits-of-robotic-welding-technology-in-mass-production",
    "https://www.openpr.com/news/4103986/global-laser-welding-industrial-robot-market-insight-growth",
    "https://www.researchgate.net/publication/387602732_ADVANCED_TECHNIQUES_AND_APPLICATIONS_IN_ROBOTIC_LASER_WELDING_FOR_HIGH_PRECISION_MANUFACTURING_YUKSEK_HASSASIYETLI_IMALAT_ICIN_ROBOT_LAZER_KAYNAKTA_GELISMIS_TEKNIKLER_VE_UYGULAMALARI",
    "https://www.smu.edu/-/media/site/lyle/rcam/publications/development-of-a-real-time-laser-based-machine-vision-system-to-monitor-and-control-welding-processes.pdf",
    "https://www.thefabricator.com/thefabricator/article/automationrobotics/anatomy-of-an-automated-welding-system",
    "https://www.thefabricator.com/thefabricator/article/laserwelding/hand-held-laser-welding-to-code",
    "https://www.theseus.fi/bitstream/10024/152520/1/Jouttijarvi_Juho_ja_Vimalraj_Melvin.pdf",
    "https://www.youtube.com/watch?v=-uauALvIGSU"
  ],
  "summary_citations": [
    "https://accounts.google.com/SignOutOptions?hl=zh-CN&continue=https://gemini.google.com/&ec=GBRAkgU",
    "https://aijourn.com/the-future-of-laser-welding-in-automation",
    "https://arxiv.org/pdf/2402.14388",
    "https://arxiv.org/pdf/2405.00685",
    "https://commons.und.edu/cgi/viewcontent.cgi?article=8090&context=theses",
    "https://dplaser.com/laser-welding-robotic-boost-production-2025",
    "https://dplaser.com/the-difference-between-laser-welding-vs-robotic-laser-welding",
    "https://en.huahengrobotics.com/news_details/1931744544595263488.html",
    "https://en.siasun.com/industrial-robotic-intelligent-welding-system-for-engineering-machinery.html",
    "https://en.siasun.com/siasun-teach-free-welding-robot.html",
    "https://esab.com/us/nam_en/esab-university/articles/transform-your-welding-shop-with-cobot-welding-a-comprehensive-guide",
    "https://eureka.patsnap.com/article/feedback-systems-in-robotic-welding-applications",
    "https://evsrobot.en.made-in-china.com/product/NEwUBOADEMkT/China-Kuka-Automatic-Laser-Welding-Robot-Machine-Arm-Laser-Welding-Machine.html",
    "https://ifr.org/case-studies/industrial-robots/press%40ifr.org",
    "https://ifr.org/case-studies/industrial-robots/press@ifr.org",
    "https://jucat.fi/features/laser-tracking",
    "https://kcrobotics.com/robotic-welding-aerospace",
    "https://kirinlaser.com/innovations-in-laser-welding-technology-you-need-to-know",
    "https://laser-welder.net/laser-welding/robotic-laser-welding",
    "https://laser-welder.net/laser-welding/robotic-laser-welding-processes-advantages-and-technologies",
    "https://m.youtube.com/watch?v=sVtZGl8yWUc",
    "https://meltonmachine.com/solutions/robotic-laser-systems/robotic-laser-welding",
    "https://michale.pl/en/products/robot-siasun-sr25a-12-2-01",
    "https://myactivity.google.com/product/gemini?utm_source=gemini",
    "https://ojs.aaai.org/index.php/AAAI/article/view/26834/26606",
    "https://pclgroupcncmachine.com/drag-teaching-robots-vs-robotic-welding-a-comprehensive-guide",
    "https://pclgroupcncmachine.com/teaching-free-robotic-welding-station",
    "https://photonweld.com/photonweld-robot-and-cobot-laser-welding/photonweld-r-series-pp-plug-and-play-laser-welding-units-for-robot-and-cobot-plug-in-laser-welding-modules",
    "https://pmc.ncbi.nlm.nih.gov/articles/PMC11857260",
    "https://pmc.ncbi.nlm.nih.gov/articles/PMC12155970",
    "https://policies.google.com/terms",
    "https://ris.utwente.nl/ws/files/6086329/thesis_de_Graaf.pdf",
    "https://shop.adhmt.com/the-future-of-laser-welding-machines-trends-and-innovations-in-the-industry",
    "https://standardbots.com/blog/automate-spot-welding-a-blueprint-for-implementing-robotic-welders",
    "https://standardbots.com/blog/choosing-the-right-welding-robot-for-your-business",
    "https://standardbots.com/blog/how-do-robotic-arms-work-a-comprehensive-guide",
    "https://standardbots.com/blog/laser-welding-robots",
    "https://standardbots.com/blog/robotic-welding-programming",
    "https://support.google.com/bard/answer/13594961",
    "https://support.google.com/gemini/answer/13594961#location&zippy=%2Cwhat-location-information-do-gemini-apps-collect-why-and-how-is-it-used",
    "https://swantonweld.com/five-advantages-of-robotic-welding",
    "https://usedrobotstrade.com/blog/research-on-return-on-investment-in-robotic-welding-cell-solutions",
    "https://www.accteklaser.com/what-welding-defects-can-occur-in-laser-welding-how-to-solve-it",
    "https://www.automate.org/robotics/industry-insights/robots-and-laser-welding-the-perfect-fit",
    "https://www.borunte.net/news/how-does-a-industrial-robotic-arm-ensure-smoot-81906931.html",
    "https://www.controleng.com/new-developments-in-robotic-welding-cobots-industrial-robots",
    "https://www.cs.rochester.edu/u/nelson/courses/csc_robocon/robot_manual/materials.html",
    "https://www.daihen-usa.com",
    "https://www.evsint.com/laser-welding-robots-and-welding-turntables-for-superior-results",
    "https://www.evsint.com/welding-robot-applications-in-manufacturing-streamline-production",
    "https://www.fanuc.eu/eu-en/fanuc-arc-welding-robots-cobots",
    "https://www.fanucamerica.com/solutions/applications/welding-robots/arc-welding-robots",
    "https://www.gminsights.com/industry-analysis/robotics-laser-welding-market",
    "https://www.igoldenlaser.com/laser-robotic-welding-machine",
    "https://www.iimtcobot.com/news/what-sensors-does-a-welding-robot-have.html",
    "https://www.ipgphotonics.com/newsroom/stories/laser-welding-cobots-vs-traditional-robots",
    "https://www.kuka.com/en-de/applications/automated-welding/laser-welding",
    "https://www.kuka.com/en-us/applications/automated-welding/arc-welding/kuka-arc-welding-robots",
    "https://www.lasertechnologies.co.in/laser-welding/ai-in-laser-welding",
    "https://www.leapion.com/An-Introduction-to-Laser-Welding-Robot-id43044057.html",
    "https://www.ligentrobot.com/blog/best-welding-arm-materials.html",
    "https://www.ligentrobot.com/weldingrobot",
    "https://www.mckinsey.com/industries/industrials-and-electronics/our-insights/a-leap-in-automation-the-new-technology-behind-general-purpose-robots",
    "https://www.mdpi.com/1996-1944/18/4/860",
    "https://www.mtiwelding.com/blog/comparing-low-force-friction-welding-to-laser-welding",
    "https://www.onealmfgservices.com/benefits-of-robotic-welding-technology-in-mass-production",
    "https://www.openpr.com/news/4103986/global-laser-welding-industrial-robot-market-insight-growth",
    "https://www.researchgate.net/publication/387602732_ADVANCED_TECHNIQUES_AND_APPLICATIONS_IN_ROBOTIC_LASER_WELDING_FOR_HIGH_PRECISION_MANUFACTURING_YUKSEK_HASSASIYETLI_IMALAT_ICIN_ROBOT_LAZER_KAYNAKTA_GELISMIS_TEKNIKLER_VE_UYGULAMALARI",
    "https://www.smu.edu/-/media/site/lyle/rcam/publications/development-of-a-real-time-laser-based-machine-vision-system-to-monitor-and-control-welding-processes.pdf",
    "https://www.thefabricator.com/thefabricator/article/automationrobotics/anatomy-of-an-automated-welding-system",
    "https://www.thefabricator.com/thefabricator/article/laserwelding/hand-held-laser-welding-to-code",
    "https://www.theseus.fi/bitstream/10024/152520/1/Jouttijarvi_Juho_ja_Vimalraj_Melvin.pdf",
    "https://www.youtube.com/watch?v=-uauALvIGSU"
  ]
}