{
  "query": "Provide a classification of the research topics of Nobel Prize winners in Economics, analyze all awarded works,.",
  "chain_of_research": {
    "plan_1": {
      "title": "Research Approach\nInitial Data Collection\nAnalytical Framework\nNext Steps",
      "description": "I'm embarking on a comprehensive analysis of the Nobel Prize in Economic Sciences. My approach will involve several key steps, starting with gathering foundational data and then moving into deeper levels of analysis.\nMy first step is to compile a complete list of all Nobel laureates in Economic Sciences, including the year they received the prize and the specific citation for their work. I'll be using the official Nobel Prize website as the primary source for this crucial information.\nOnce I have the foundational data, I'll classify each award into primary economic fields, analyze the chronological evolution of awarded topics, and synthesize individual awards into broader research themes. I'll also evaluate the nature of the contributions (theoretical, empirical, policy-oriented), explore intellectual lineages, and compare core assumptions of different awarded paradigms. Finally, I'll speculate on future trends in economic research that might be recognized.\nMy immediate next action is to search for and retrieve the complete list of Nobel laureates in Economic Sciences from the official Nobel Prize website. This will provide the necessary data to begin the classification and analysis phases of my research."
    },
    "search_1": [
      "https://www.nobelprize.org/prizes/economic-sciences/2024/advanced-information",
      "https://www.aeaweb.org/about-aea/honors-awards/nobel-laureates",
      "https://www.nobelprize.org/prizes/economic-sciences/2024/summary",
      "https://www.nsf.gov/about/history/nobel-prizes",
      "https://en.wikipedia.org/wiki/List_of_Nobel_Memorial_Prize_laureates_in_Economic_Sciences",
      "https://www.nobelprize.org/prizes/economic-sciences/2024/press-release",
      "https://msuweb.montclair.edu/~lebelp/NobelPrizeWinnersinEconomi.html",
      "https://en.wikipedia.org/wiki/Nobel_Memorial_Prize_in_Economic_Sciences",
      "https://www.harvard.edu/about/history/nobel-laureates/economic-sciences",
      "https://www.nobelprize.org/prizes/lists/all-nobel-prizes",
      "https://www.nobelprize.org/nomination/economic-sciences",
      "https://www.nobelprize.org/prizes/lists/all-prizes-in-economic-sciences"
    ],
    "observation_1": "I've successfully retrieved a comprehensive list of Nobel laureates in Economic Sciences, along with their award years and initial citations, primarily from the official Nobel Prize website (nobelprize.org). I've also cross-referenced this information with other reliable sources like the American Economic Association and Wikipedia to ensure accuracy and completeness.",
    "plan_2": {
      "title": "Next Steps in Classification",
      "description": "My next step is to delve deeper into the specifics of each awarded work to classify them accurately. This will involve browsing individual laureate pages on the Nobel Prize website, focusing on the 'popular science background' and 'advanced information' sections, which provide detailed explanations of their contributions. I will start with the most recent laureates and work backward to systematically gather and categorize the research topics."
    },
    "search_2": [
      "https://www.nobelprize.org/prizes/lists/all-prizes-in-economic-sciences"
    ],
    "observation_2": "I've initiated the process of gathering Nobel Prize in Economic Sciences laureate information. While I've obtained some recent laureate data, I recognize the need for a more comprehensive and structured list spanning all award years from 1969 to the present. My aim is to secure a complete dataset that includes the laureate's name, the year of the award, and the specific citation for their work.",
    "plan_3": {
      "title": "Strategic Information Gathering\nNext Steps in Research",
      "description": "To ensure a thorough analysis, I'm broadening my search strategy. I'll be looking for existing classifications of Nobel Prizes in economics, which will be invaluable in developing my own classification framework. This dual approach will allow me to gather both the raw data and potential analytical structures simultaneously.\nMy immediate next steps involve conducting targeted searches to acquire the complete list of laureates and their contributions, as well as any pre-existing classifications of economic Nobel Prizes. Once this data is secured, I will systematically extract the detailed information from the most relevant sources and begin the process of classifying each awarded work and analyzing the overarching trends."
    },
    "search_3": [
      "https://www.britannica.com/money/Winners-of-the-Nobel-Prize-for-Economics",
      "https://www.nobelprize.org/prizes/economic-sciences/2024/popular-information",
      "https://www.exploring-economics.org/en/discover/nobel-memorial-prize-economics",
      "https://www.ebsco.com/research-starters/history/nobel-memorial-prize-economic-sciences",
      "https://www.nobelprize.org/uploads/2018/06/popular-economicsciences2013-1.pdf",
      "https://www.investopedia.com/terms/n/nobel-memorial-prize-in-economic-sciences.asp",
      "https://en.wikipedia.org/wiki/Nobel_Memorial_Prize_in_Economic_Sciences",
      "https://www.nber.org/nber-news/nobel-laureates",
      "https://www.nobelprize.org/prizes/lists/all-prizes-in-economic-sciences",
      "https://en.wikipedia.org/wiki/Nobel_Prize",
      "https://treasury.gov.au/publication/economic-roundup-autumn-2006/brilliant-minds-the-nobel-prize-in-economics",
      "https://timesofindia.indiatimes.com/world/us/taught-the-world-trade-economics-peter-navarro-says-donald-trump-deserves-nobel-in-economics-cites-global-overhaul/articleshow/123039089.cms",
      "https://www.newsweek.com/nobel-prize-winners-react-trump-economics-2107563",
      "https://www.superprof.com/blog/nobel-prize-economics",
      "https://www.hec.edu/en/nobel-prize-economics-what-impact-research-and-society",
      "https://revistagt.fpl.emnuvens.com.br/get/article/view/2616",
      "https://developingeconomics.org/2024/10/22/the-nobel-illusion-why-the-nobel-prize-in-economics-needs-to-be-abolished",
      "https://www.aeaweb.org/about-aea/honors-awards/nobel-laureates",
      "https://www.chicagobooth.edu/faculty/nobel-laureates",
      "https://www.nobelprize.org/prizes/lists/all-nobel-prizes",
      "https://simple.wikipedia.org/wiki/List_of_Nobel_Prize_winners_in_Economics",
      "https://www.nobelprize.org/prizes/lists/all-prizes-in-economic-sciences/all",
      "https://en.wikipedia.org/wiki/List_of_Nobel_Memorial_Prize_laureates_in_Economic_Sciences"
    ],
    "observation_3": "I've successfully gathered a comprehensive list of Nobel laureates in Economic Sciences, including their award years and the official citations for their work. I've cross-referenced information from various sources, with a strong focus on the official Nobel Prize website (nobelprize.org) and Wikipedia, to ensure the dataset is complete and accurate from 1969 to 2024.",
    "plan_4": {
      "title": "Developing a Classification Framework\nNext Steps: Classification and Analysis",
      "description": "I'm now moving towards developing a robust classification scheme for the awarded works. My initial categories will cover key areas within economics, such as Microeconomics, Macroeconomics, Econometrics, Financial Economics, Behavioral Economics, Game Theory, Development Economics, International Trade, Public Choice/Political Economy, Economic History, Welfare Economics and Social Choice Theory, and Theory of the Firm and Industrial Organization. This framework will help me systematically categorize each prize.\nMy immediate next steps involve systematically classifying each Nobel Prize in Economic Sciences based on the developed scheme, noting whether the contribution is theoretical, empirical, or policy-oriented. I will then analyze the classified data to identify chronological trends, emerging fields, broader research themes, and intellectual connections between laureates. Finally, I will compare different economic paradigms and speculate on future directions for the prize. I will begin by browsing the Wikipedia page for a structured list and then delve into the Nobel Prize website for detailed information."
    },
    "search_4": [
      "https://treasury.gov.au/publication/economic-roundup-autumn-2006/brilliant-minds-the-nobel-prize-in-economics",
      "https://www.nobelprize.org/prizes/lists/all-prizes-in-economic-sciences/all",
      "https://en.wikipedia.org/wiki/List_of_Nobel_Memorial_Prize_laureates_in_Economic_Sciences"
    ],
    "observation_4": "I have successfully compiled a comprehensive list of Nobel laureates in Economic Sciences, including their prize year and the specific citations for their work. This initial data collection is crucial for the in-depth analysis that follows.",
    "plan_5": {
      "title": "Refining Classification Strategy\nStructured Analysis Plan",
      "description": "My next step is to refine the classification of these awarded works. I'm moving beyond a preliminary categorization to create a more detailed and consistent classification. This will involve systematically reviewing each laureate's contribution using the official Nobel Prize website's 'Press Release,' 'Popular Science Background,' and 'Advanced Information' sections to ensure accuracy and depth in my categorization.\nI've outlined a detailed plan for analyzing the data. This includes creating a definitive dataset with fields like 'Primary Field,' 'Secondary Field(s),' and 'Nature of Contribution.' I will then conduct chronological and thematic analyses, identify intellectual lineages, compare different economic paradigms, and even speculate on future trends in economic research. My immediate action is to begin browsing the individual prize pages on the Nobel Prize website, starting with the earliest awards, to gather the granular information needed for this systematic classification."
    },
    "search_5": [
      "https://www.nobelprize.org/prizes/economic-sciences/1978/summary",
      "https://www.unwe.bg/en/pages/18265/nobel-prize-in-economic-sciences.html",
      "https://www.cambridge.org/core/services/aop-cambridge-core/content/view/7081D0CD33937F3CB274DA558739A7C4/9781108838283apx_209-210.pdf/list_of_nobel_laureates.pdf",
      "https://www.raptisrarebooks.com/the-nobel-prize-in-economics",
      "https://www.nobelprize.org/prizes/economic-sciences/1971/summary",
      "https://en.wikipedia.org/wiki/List_of_Nobel_Memorial_Prize_laureates_in_Economic_Sciences",
      "https://www.nobelprize.org/prizes/economic-sciences/1970/summary",
      "https://www.youtube.com/watch?v=YaAupG_rPQg",
      "https://www.nobelprize.org/prizes/economic-sciences/1976/summary",
      "https://www.nobelprize.org/prizes/economic-sciences",
      "https://www.riksbank.se/en-gb/about-the-riksbank/the-tasks-of-the-riksbank/research/economics-prize",
      "https://swopec.hhs.se/iuiwop/abs/iuiwop0517.htm",
      "https://ideas.repec.org/p/hhs/iiessp/0668.html",
      "https://www.google.com/search?q=Sveriges+Riksbank+Prize+in+Economic+Sciences+in+Memory+of+Alfred+Nobel+1977",
      "https://www.nobelprize.org/prizes/economic-sciences/1977/summary",
      "https://www.researchgate.net/publication/46448830_The_Sveriges_Riksbank_Prize_in_Economic_Sciences_in_Memory_of_Alfred_Nobel_1969-2007",
      "https://www.google.com/search?q=Sveriges+Riksbank+Prize+in+Economic+Sciences+in+Memory+of+Alfred+Nobel+1975",
      "https://www.nobelprize.org/prizes/economic-sciences/1975/press-release",
      "https://en.wikipedia.org/wiki/Nobel_Memorial_Prize_in_Economic_Sciences",
      "https://www.nobelprize.org/prizes/economic-sciences/1975/summary",
      "https://www.wikiwand.com/en/articles/Committee_for_the_Sveriges_Riksbank_Prize_in_Economic_Sciences_in_Memory_of_Alfred_Nobel",
      "https://www.researchgate.net/publication/312444618_Sveriges_Riksbank_Prize_in_Economic_Sciences_in_Memory_of_Alfred_Nobel",
      "https://www.nobelprize.org/prizes/economic-sciences/1977/press-release",
      "https://www.nobelprize.org/prizes/economic-sciences/1974/ceremony-speech",
      "https://en.wikipedia.org/wiki/Committee_for_the_Sveriges_Riksbank_Prize_in_Economic_Sciences_in_Memory_of_Alfred_Nobel",
      "https://www.hhs.se/en/outreach/sse-initiatives/sse-and-the-and-the-nobel-prize",
      "https://www.nobelprize.org/prizes/economic-sciences/1974/summary",
      "https://www.artory.com/artists/hayek-1920th-century/the-sveriges-riksbank-prize-in-economic-sciences-in-NZXDMX7W",
      "https://www.nobelprize.org/prizes/economic-sciences/1973/press-release",
      "https://www.nobelprize.org/prizes/economic-sciences/1972/summary",
      "https://www.nobelprize.org/prizes/economic-sciences/1973/summary",
      "https://ddd.uab.cat/pub/expbib/2015/146867/nobelecon/index.html.4",
      "https://www.youtube.com/watch?v=GX55YHSjZWA"
    ],
    "observation_5": "I've successfully gathered detailed information for the Nobel Prizes in Economic Sciences from 1969 to 1978. I've systematically classified each of these early awards, identifying their primary and secondary fields, the nature of their contributions (theoretical, empirical, methodological, or policy-oriented), and the key concepts associated with their work. For instance, the 1969 prize to Frisch and Tinbergen was recognized for their methodological and theoretical contributions to econometrics and macroeconomics through dynamic models, while the 1978 prize to Simon highlighted his theoretical work in microeconomics and behavioral economics on decision-making and bounded rationality.",
    "plan_6": {
      "title": "Diverse Contributions in Early Years\nNext Steps in Classification",
      "description": "My analysis of the first decade of Nobel Prizes in Economic Sciences reveals a diverse range of foundational contributions. These include pioneering work in econometrics (Frisch, Tinbergen, Leontief), general equilibrium theory (Samuelson, Hicks, Arrow), economic history and development (Kuznets), resource allocation (Kantorovich, Koopmans), monetary theory and stabilization policy (Friedman), international trade (Ohlin, Meade), and the intersection of economics with social and institutional phenomena (Myrdal, Hayek). This initial batch showcases the breadth of economic inquiry recognized by the prize.\nHaving completed the classification for the first ten years of the prize, I will now continue this systematic process for the subsequent decades. My next step is to gather and classify the Nobel Prizes in Economic Sciences awarded from 1979 to 1988, following the same rigorous approach to identify their core contributions and themes."
    },
    "search_6": [
      "https://www.nobelprize.org/prizes/economic-sciences/1988/summary",
      "https://www.ebsco.com/research-starters/history/nobel-memorial-prize-economic-sciences",
      "https://www.nobelprize.org/prizes/lists/all-prizes-in-economic-sciences",
      "https://www.youtube.com/watch?v=YaAupG_rPQg",
      "https://www.nobelprize.org/prizes/economic-sciences/1987/summary",
      "https://www.nobelprize.org/prizes/economic-sciences/1981/summary",
      "https://www.youtube.com/watch?v=XeMoeyz7wQQ",
      "https://en.wikipedia.org/wiki/List_of_Nobel_Memorial_Prize_laureates_in_Economic_Sciences",
      "https://www.nobelprize.org/prizes/economic-sciences",
      "https://www.nobelprize.org/prizes/economic-sciences/1980/summary",
      "https://www.youtube.com/watch?v=tcHNkk_wb7I",
      "https://www.riksbank.se/en-gb/about-the-riksbank/the-tasks-of-the-riksbank/research/economics-prize",
      "https://www.google.com/search?q=Sveriges+Riksbank+Prize+in+Economic+Sciences+in+Memory+of+Alfred+Nobel+1979",
      "https://www.unwe.bg/en/pages/18265/nobel-prize-in-economic-sciences.html",
      "https://www.nobelprize.org/prizes/economic-sciences/1986/summary",
      "https://www.youtube.com/watch?v=MVr2uWMjoPk",
      "https://libertystreeteconomics.newyorkfed.org/2012/08/historical-echoes-whats-in-a-name-the-sveriges-riksbank-prize-in-economic-sciences-in-memory-of-alfr",
      "https://www.nobelprize.org/prizes/economic-sciences/1979/summary",
      "https://www.researchgate.net/publication/4901891_The_Prize_in_Economic_Science_in_Memory_of_Alfred_Nobel",
      "https://www.kva.se/en/prizes/prize-in-economic-sciences",
      "https://www.nobelprize.org/prizes/economic-sciences/1985/summary",
      "https://www.nobelprize.org/prizes/economic-sciences/1984/summary",
      "https://www.nrmpinternational.org/wp-content/uploads/2021/10/The-Sveriges-Riksbank-Prize-in-Economic-Sciences-in-Memory-of-Alfred-Nobel1.pdf",
      "https://en.wikipedia.org/wiki/G%C3%A9rard_Debreu",
      "https://www.nobelprize.org/prizes/economic-sciences/1983/summary",
      "https://www.geni.com/projects/Nobel-Prize-in-Economics-The-Sveriges-Riksbank-Prize-in-Economic-Sciences-in-Memory-of-Alfred-Nobel/10374",
      "https://testbook.com/question-answer/sveriges-riksbank-prize-in-economic-sciences-is-aw--5e073c851155380d0b679699",
      "https://ideas.repec.org/p/hhs/iuiwop/0517.html",
      "https://www.nobelprize.org/prizes/economic-sciences/1982/summary",
      "https://ideas.repec.org/p/hhs/iiessp/0668.html",
      "https://www.youtube.com/watch?v=GX55YHSjZWA"
    ],
    "observation_6": "I've made significant progress in classifying the Nobel Prizes in Economic Sciences. I have now successfully gathered and classified detailed information for laureates from 1969 to 1988. This includes identifying their primary and secondary fields, the nature of their contributions (theoretical, empirical, methodological, or policy-oriented), and the key concepts associated with their work.",
    "plan_7": {
      "title": "Continuing the Classification Process",
      "description": "My next step is to continue this systematic classification for the subsequent years. I will now focus on the Nobel laureates from 1989 to 1998. I will follow the same rigorous procedure of searching for official Nobel Prize pages, extracting the laureates' names, official citations, and summaries of their contributions, and then classifying each prize based on its primary field, secondary field(s), nature of contribution, and key concepts."
    },
    "search_7": [
      "https://www.nobelprize.org/prizes/economic-sciences/1998/banquet-video",
      "https://www.nobelprize.org/prizes/economic-sciences/1998/summary",
      "https://en.wikipedia.org/wiki/Committee_for_the_Sveriges_Riksbank_Prize_in_Economic_Sciences_in_Memory_of_Alfred_Nobel",
      "https://www.riksbank.se/en-gb/about-the-riksbank/the-tasks-of-the-riksbank/research/economics-prize",
      "https://www.nobelprize.org/prizes/economic-sciences",
      "https://www.unwe.bg/en/pages/18265/nobel-prize-in-economic-sciences.html",
      "https://www.nobelprize.org/prizes/economic-sciences/1991/summary",
      "https://www.researchgate.net/publication/46448830_The_Sveriges_Riksbank_Prize_in_Economic_Sciences_in_Memory_of_Alfred_Nobel_1969-2007",
      "https://www.worldscientific.com/doi/10.1142/9789810248543_0010",
      "https://en.wikipedia.org/wiki/Nobel_Memorial_Prize_in_Economic_Sciences",
      "https://www.kellogg.northwestern.edu/faculty/hubbard/htm/research/97nobel2.htm",
      "https://www.nobelprize.org/prizes/economic-sciences/1997/press-release",
      "https://www.google.com/search?q=Sveriges+Riksbank+Prize+in+Economic+Sciences+in+Memory+of+Alfred+Nobel+1996",
      "https://www.nber.org/news/robert-c-merton-and-myron-s-scholes-won-1997-nobel-prize-finding-ways-value-stock-options-and-other",
      "https://www.google.com/search?q=Sveriges+Riksbank+Prize+in+Economic+Sciences+in+Memory+of+Alfred+Nobel+1997",
      "https://www.kva.se/en/prizes/prize-in-economic-sciences",
      "https://www.nobelprize.org/prizes/economic-sciences/1995/summary",
      "https://ideas.repec.org/p/hhs/iiessp/0668.html",
      "https://www.nrmpinternational.org/wp-content/uploads/2021/10/The-Sveriges-Riksbank-Prize-in-Economic-Sciences-in-Memory-of-Alfred-Nobel1.pdf",
      "https://www.google.com/search?q=Sveriges+Riksbank+Prize+in+Economic+Sciences+in+Memory+of+Alfred+Nobel+1990",
      "https://www.nobelprize.org/prizes/economic-sciences/1996/summary",
      "https://www.google.com/search?q=Sveriges+Riksbank+Prize+in+Economic+Sciences+in+Memory+of+Alfred+Nobel+1994",
      "https://www.raptisrarebooks.com/the-nobel-prize-in-economics",
      "https://www.nobelprize.org/prizes/economic-sciences/1990/summary",
      "https://en.wikipedia.org/wiki/List_of_Nobel_Memorial_Prize_laureates_in_Economic_Sciences",
      "https://www.nobelprize.org/prizes/economic-sciences/1993/summary",
      "https://www.nobelprize.org/prizes/economic-sciences/1994/summary",
      "https://www.google.com/search?q=Sveriges+Riksbank+Prize+in+Economic+Sciences+in+Memory+of+Alfred+Nobel+1993",
      "https://www.youtube.com/watch?v=MVr2uWMjoPk",
      "https://www.nobelprize.org/prizes/economic-sciences/1992/summary",
      "https://www.youtube.com/watch?v=GX55YHSjZWA",
      "https://erc.org.in/uncategorized/the-nobel-prize-rewards-science-humanism-and-peace-efforts",
      "https://ideas.repec.org/p/ris/nobelp/2023_002.html"
    ],
    "observation_7": "I've successfully classified the Nobel Prizes in Economic Sciences from 1989 to 1998. This includes identifying the primary and secondary fields, the nature of the contribution (theoretical, empirical, methodological, or policy-oriented), and the key concepts for each laureate. For example, the 1990 prize recognized pioneering work in financial economics, while the 1994 prize highlighted contributions to game theory.",
    "plan_8": {
      "title": "Emerging Themes in the 90s\nNext Steps in Classification",
      "description": "During this period, I observed a strong emphasis on microeconomic foundations, with significant awards in financial economics, institutional economics (transaction costs, property rights), and the application of microeconomic analysis to non-market behavior (human capital, family economics). Game theory also emerged as a prominent field, alongside important contributions to economic history and macroeconomics, particularly the rational expectations hypothesis.\nHaving completed the classification for the 1989-1998 period, I will now proceed to gather and classify information for the Nobel laureates from 1999 to 2008. This systematic approach will continue until all awarded works have been categorized."
    },
    "search_8": [
      "https://www.nobelprize.org/prizes/economic-sciences/2008/summary",
      "https://www.youtube.com/watch?v=6ivwtz7cPwg",
      "https://www.riksbank.se/en-gb/about-the-riksbank/the-tasks-of-the-riksbank/research/economics-prize",
      "https://www.nobelprize.org/prizes/economic-sciences",
      "https://www.kva.se/app/uploads/2022/06/globalassets-priser-nobel-2001-popeken01.pdf",
      "https://www.nobelprize.org/prizes/economic-sciences/1999/summary",
      "https://en.wikipedia.org/wiki/List_of_Nobel_Memorial_Prize_laureates_in_Economic_Sciences",
      "https://www.google.com/search?q=Sveriges+Riksbank+Prize+in+Economic+Sciences+in+Memory+of+Alfred+Nobel+2001",
      "https://www.nobelprize.org/prizes/economic-sciences/2000/summary",
      "https://www.nobelprize.org/prizes/economic-sciences/2001/press-release",
      "https://libertystreeteconomics.newyorkfed.org/2012/08/historical-echoes-whats-in-a-name-the-sveriges-riksbank-prize-in-economic-sciences-in-memory-of-alfr",
      "https://www.kva.se/en/news/ekonomipriset-2007-2",
      "https://www.worldscientific.com/doi/10.1142/9789810248543_0010",
      "https://www.google.com/search?q=Sveriges+Riksbank+Prize+in+Economic+Sciences+in+Memory+of+Alfred+Nobel+2007",
      "https://ideas.repec.org/p/ris/nobelp/1999_004.html",
      "https://www.newsweek.com/nobel-prize-winners-react-trump-economics-2107563",
      "https://www.nobelprize.org/prizes/economic-sciences/2007/summary",
      "https://cris.huji.ac.il/en/prizes/the-sveriges-riksbank-prize-in-economic-sciences-in-memory-of-alf",
      "https://www.google.com/search?q=Sveriges+Riksbank+Prize+in+Economic+Sciences+in+Memory+of+Alfred+Nobel+2005",
      "https://www.nobelprize.org/prizes/economic-sciences/2005/summary",
      "https://www.innovations-report.com/global-finance/business-and-finance/report-71686",
      "https://www.google.com/search?q=Sveriges+Riksbank+Prize+in+Economic+Sciences+in+Memory+of+Alfred+Nobel+2004",
      "https://www.nobelprize.org/prizes/economic-sciences/2004/press-release",
      "https://www.researchgate.net/publication/312444618_Sveriges_Riksbank_Prize_in_Economic_Sciences_in_Memory_of_Alfred_Nobel",
      "https://www.nobelprize.org/prizes/economic-sciences/2004/banquet-video",
      "https://www.nobelprize.org/prizes/economic-sciences/2006/summary",
      "https://www.google.com/search?q=Sveriges+Riksbank+Prize+in+Economic+Sciences+in+Memory+of+Alfred+Nobel+2003",
      "https://www.nobelprize.org/prizes/economic-sciences/2003/banquet-video",
      "https://www.nobelprize.org/prizes/economic-sciences/2003/prize-announcement",
      "https://www.google.com/search?q=Sveriges+Riksbank+Prize+in+Economic+Sciences+in+Memory+of+Alfred+Nobel+2002",
      "https://www.global.hokudai.ac.jp/blog/32021",
      "https://www.nobelprize.org/prizes/economic-sciences/2002/banquet-video"
    ],
    "observation_8": "I've successfully classified the Nobel Prizes in Economic Sciences awarded between 1999 and 2008. This includes identifying the primary and secondary fields, the nature of the contribution (theoretical, methodological, empirical, or policy-oriented), and the key concepts for each laureate. For instance, this period saw significant recognition for work in international macroeconomics, econometrics, information economics, behavioral and experimental economics, and game theory.",
    "plan_9": {
      "title": "Key Insights from the Decade\nContinuing the Classification",
      "description": "This decade highlights a strong focus on understanding market imperfections and human decision-making. Awards in information economics (Akerlof, Spence, Stiglitz) shed light on asymmetric information, while behavioral and experimental economics (Kahneman, Smith) integrated psychological insights into economic analysis. Methodological advancements in econometrics (Heckman, McFadden, Engle, Granger) were also prominent, alongside foundational work in dynamic macroeconomics (Kydland, Prescott, Phelps) and the application of game theory to conflict and cooperation (Aumann, Schelling). The emergence of mechanism design theory (Hurwicz, Maskin, Myerson) and new theories in international trade and economic geography (Krugman) further diversified the recognized fields.\nHaving completed the classification for the 1999-2008 period, I will now proceed to gather and classify information for the Nobel laureates from 2009 to 2018. This systematic approach will continue until all awarded works have been categorized."
    },
    "search_9": [
      "http://archive.riksbank.se/en/Web-archive/Published/Notices/2009/Economics-prize-2009/index.html",
      "http://archive.riksbank.se/en/Web-archive/Published/Notices/2011/Economics-prize-2011/index.html",
      "https://www.remi.com/news/2024-economics-nobel-prize-winners",
      "https://www.youtube.com/watch?v=sI-KAuX9yCU",
      "https://archive.riksbank.se/en/Web-archive/Published/Notices/2010/Economics-prize-2010/index.html",
      "https://www.youtube.com/watch?v=RBkLI5i-OC8&pp=0gcJCdgAo7VqN5tD",
      "https://www.riksbank.se/en-gb/press-and-published/notices-and-press-releases/notices/2020/paul-r.-milgrom-and-robert-b.-wilson-awarded-the-prize-in-economic-sciences-for-2020",
      "https://www.google.com/search?q=Sveriges+Riksbank+Prize+in+Economic+Sciences+in+Memory+of+Alfred+Nobel+2020",
      "https://en.wikipedia.org/wiki/2021_Nobel_Memorial_Prize_in_Economic_Sciences",
      "https://en.wikipedia.org/wiki/2022_Nobel_Memorial_Prize_in_Economic_Sciences",
      "https://www.kva.se/en/news/ekonomipriset-2010-2",
      "https://www.google.com/search?q=Sveriges+Riksbank+Prize+in+Economic+Sciences+in+Memory+of+Alfred+Nobel+2009",
      "https://www.google.com/search?q=Sveriges+Riksbank+Prize+in+Economic+Sciences+in+Memory+of+Alfred+Nobel+2021",
      "https://www.riksbank.se/en-gb/press-and-published/notices-and-press-releases/notices/2024/daron-acemoglu-simon-johnson-and-james-a.-robinson-are-awarded-the-prize-in-economic-sciences-2024",
      "https://www.google.com/search?q=Sveriges+Riksbank+Prize+in+Economic+Sciences+in+Memory+of+Alfred+Nobel+2011",
      "https://www.riksbank.se/en-gb/press-and-published/notices-and-press-releases/notices/2022/ben-s.-bernanke-douglas-w.-diamond-and-philip-h.-dybvigawarded-the-prize-in-economic-sciences-for-2022",
      "https://www.lindau-nobel.org/blog-prize-in-economic-sciences-2019",
      "https://www.kva.se/en/news/ekonomipriset-2018-2",
      "https://www.google.com/search?q=Sveriges+Riksbank+Prize+in+Economic+Sciences+in+Memory+of+Alfred+Nobel+2019",
      "https://www.kva.se/en/news/ekonomipriset-2017-2",
      "https://www.youtube.com/watch?v=XeMoeyz7wQQ",
      "https://www.google.com/search?q=Sveriges+Riksbank+Prize+in+Economic+Sciences+in+Memory+of+Alfred+Nobel+2018",
      "https://www.google.com/search?q=Sveriges+Riksbank+Prize+in+Economic+Sciences+in+Memory+of+Alfred+Nobel+2016",
      "https://www.nobelprize.org/prizes/economic-sciences/2016/summary",
      "https://www.tholden.org/industrial%20organization%202014-15/jean-tirole-wins-the-2014-sveriges-riksbank-prize-in-economic-sciences-in-memory-of-alfred-nobel",
      "https://en.wikipedia.org/wiki/Jean_Tirole",
      "https://www.hhs.se/sv/om-oss/news/sse/2015/angus-deaton-awarded-the-prize-in-economic-sciences-2015-to",
      "https://www.kva.se/app/uploads/2022/06/AffischECOeng2015.pdf",
      "https://www.nrmpinternational.org/wp-content/uploads/2021/10/The-Sveriges-Riksbank-Prize-in-Economic-Sciences-in-Memory-of-Alfred-Nobel1.pdf",
      "https://www.google.com/search?q=Sveriges+Riksbank+Prize+in+Economic+Sciences+in+Memory+of+Alfred+Nobel+2013",
      "https://www.google.com/search?q=Sveriges+Riksbank+Prize+in+Economic+Sciences+in+Memory+of+Alfred+Nobel+2012",
      "https://newsroom.wiley.com/press-releases/press-release-details/2013/Wiley-Congratulates-Winners-of-the-2013-Sveriges-Riksbank-Prize-in-Economic-Sciences/default.aspx",
      "https://www.researchgate.net/publication/264729212_The_Sveriges_Riksbank_Prize_in_Economic_Sciences_in_Memory_of_Alfred_Nobel_2013_Eugene_F_Fama_Lars_Peter_Hansen_Robert_J_Shiller_A_brief_review"
    ],
    "observation_9": "I've successfully completed the initial classification of Nobel Prizes in Economic Sciences, covering all laureates from 1969 to the present. This involved systematically extracting information on their awarded work, identifying primary and secondary fields, and noting the nature of their contributions (theoretical, empirical, methodological, or policy-oriented).",
    "plan_10": {
      "title": "Transition to In-depth Analysis\nNext Steps: Deep Dive into Key Areas",
      "description": "Now that the initial classification is complete, I'm moving into a more in-depth analysis phase. This will involve a deeper dive into key contributions, tracing intellectual lineages between laureates, conducting comparative analyses of different economic paradigms, and speculating on future trends in the field.\nMy immediate next step is to begin a deep dive into the work of representative laureates within major research themes, starting with macroeconomics, microeconomics, and financial economics. I will be consulting the 'popular science background' and 'advanced information' documents on the Nobel Prize website, as well as searching for key academic papers and analyses of their work, to gain a more nuanced understanding of their impact."
    },
    "search_10": [
      "https://www.richmondfed.org/publications/research/economic_quarterly/2007/winter/hetzel",
      "https://www.hoover.org/research/milton-friedmans-long-run-impact",
      "https://www.cambridge.org/core/journals/journal-of-the-history-of-economic-thought/article/friedmans-nobel-lecture-and-the-phillips-curve-myth/53838048E89566D2757A43A488439814",
      "https://www.nobelprize.org/prizes/economic-sciences/1976/friedman/facts",
      "https://www.nobelprize.org/uploads/2018/06/lucas-lecture.pdf",
      "https://www.mercatus.org/research/policy-briefs/what-would-milton-friedman-say-about-market-monetarism",
      "https://www.nobelprize.org/uploads/2018/06/friedman-lecture-1.pdf",
      "https://www.nobelprize.org/prizes/economic-sciences/1995/ceremony-speech",
      "https://www.econlib.org/library/Enc/bios/Friedman.html",
      "https://www.investopedia.com/ask/answers/012615/what-difference-between-keynesian-economics-and-monetarist-economics.asp#:~:text=Monetarists%20believe%20in%20controlling%20the,buy%20more%20goods%20and%20services.",
      "https://www.journals.uchicago.edu/doi/abs/10.1086/260579",
      "https://www.investopedia.com/ask/answers/012615/what-difference-between-keynesian-economics-and-monetarist-economics.asp",
      "https://www.nobelprize.org/prizes/economic-sciences/1976/ceremony-speech",
      "https://www.vedantu.com/commerce/difference-between-keynesian-economics-and-monetarist-economics",
      "https://en.wikipedia.org/wiki/Milton_Friedman",
      "https://www.economicshelp.org/blog/1113/concepts/keynesianism-vs-monetarism",
      "https://www.nobelprize.org/prizes/economic-sciences/1976/friedman/lecture",
      "https://www.investopedia.com/terms/m/monetarism.asp",
      "https://www.cambridge.org/core/books/methodology-of-economics/keynesians-versus-monetarists/383E46FABAFEF3DA3A250B4B1FBDFA9F",
      "https://egc.yale.edu/events/kuznets/kuznets-10",
      "https://www.econlib.org/library/Enc/bios/Lucas.html",
      "https://www.nobelprize.org/prizes/economic-sciences/1995/lucas/lecture",
      "https://en.wikipedia.org/wiki/Robert_Lucas_Jr.",
      "https://www.econlib.org/library/Enc/RationalExpectations.html",
      "https://www.ineteconomics.org/uploads/papers/1983-Keynesianism-Monetarism-and-Rational-Expectations-Some-Reflections-and-Conjectures_Individual-Forecasting-and-Aggregate-Outcomes.pdf",
      "https://www.investopedia.com/terms/r/rationaltheoryofexpectations.asp",
      "https://www.tandfonline.com/doi/pdf/10.1080/01603477.1984.11489447",
      "https://faculty.sites.iastate.edu/tesfatsi/archive/tesfatsi/Mishkin.RationalExpReview.pdf",
      "https://www.econstor.eu/bitstream/10419/75153/1/687547210.pdf"
    ],
    "observation_10": "I've begun a deeper analysis of the intellectual context of the Nobel Prizes, starting with macroeconomics. My initial focus on Milton Friedman and Robert Lucas Jr. has provided valuable insights into the shift from Keynesian to monetarist and new classical macroeconomics, leveraging their Nobel lectures and related academic discussions.",
    "plan_11": {
      "title": "Refining Research Strategy\nNext Steps: Microeconomics and Financial Economics",
      "description": "With the initial classification complete and some early insights into macroeconomics, I'm now refining my research strategy. My plan includes a deep dive into microeconomics and financial economics, a systematic analysis of intellectual lineages, a comparative analysis of different economic paradigms, and a forward-looking assessment of future trends in economic research.\nMy immediate next step is to conduct an in-depth analysis of key laureates in microeconomics and financial economics. This will involve exploring the development of general equilibrium theory, game theory, information economics, portfolio theory, asset pricing, and option pricing, to build a more detailed understanding of these crucial areas."
    },
    "search_11": [
      "https://oxfordre.com/americanhistory/display/10.1093/acrefore/9780199329175.001.0001/acrefore-9780199329175-e-903",
      "https://www.nobelprize.org/uploads/2018/06/debreu-lecture.pdf",
      "https://www.nobelprize.org/prizes/economic-sciences/1972/hicks/lecture/Tobin",
      "https://www.nobelprize.org/uploads/2018/06/arrow-lecture.pdf",
      "https://en.wikipedia.org/wiki/Game_theory",
      "https://www.nobelprize.org/prizes/economic-sciences/1983/press-release",
      "https://en.wikipedia.org/wiki/John_Hicks",
      "https://www.nobelprize.org/prizes/economic-sciences/1983/ceremony-speech",
      "https://en.wikipedia.org/wiki/Game_theory#:~:text=Modern%20game%20theory%20began%20with,game%20theory%20and%20mathematical%20economics.",
      "https://en.wikipedia.org/wiki/General_equilibrium_theory",
      "https://www.nobelprize.org/prizes/economic-sciences/1983/debreu/lecture",
      "https://larspsyll.wordpress.com/2015/08/15/general-equilibrium-theory-a-gross-misallocation-of-intellectual-resources-and-time-2",
      "https://www.nobelprize.org/prizes/economic-sciences/1997/merton/lecture",
      "https://www.nobelprize.org/uploads/2018/06/scholes-lecture.pdf",
      "https://www.nobelprize.org/uploads/2018/06/sharpe-lecture.pdf",
      "https://www.hbs.edu/faculty/Pages/profile.aspx?facId=6511",
      "https://www.nobelprize.org/prizes/economic-sciences/1990/sharpe/lecture",
      "https://www.nobelprize.org/prizes/economic-sciences/1997/scholes/lecture",
      "https://www.chicagobooth.edu/research/fama-miller/who-we-are/merton-miller",
      "https://www.nobelprize.org/uploads/2018/06/miller-lecture.pdf",
      "https://www.nobelprize.org/uploads/2018/06/markowitz-lecture.pdf",
      "https://www.nobelprize.org/prizes/economic-sciences/1990/markowitz/lecture",
      "https://www.informs.org/Explore/History-of-O.R.-Excellence/Biographical-Profiles/Markowitz-Harry",
      "https://www.nobelprize.org/uploads/2018/06/stiglitz-lecture.pdf",
      "https://www.math.utoronto.ca/mccann/1855/papers/stiglitz-Nobel-lecture01.pdf",
      "https://www.nobelprize.org/uploads/2018/06/spence-lecture.pdf",
      "https://www.nobelprize.org/prizes/economic-sciences/2001/spence/lecture",
      "https://www.nobelprize.org/page/45/?np-prize-category=economic-sciences",
      "https://www.nobelprize.org/uploads/2018/06/selten-lecture.pdf",
      "https://www.nobelprize.org/uploads/2018/06/akerlof-lecture.pdf",
      "https://www.nobelprize.org/prizes/economic-sciences/1994/ceremony-speech",
      "https://www.nobelprize.org/prizes/economic-sciences/2001/akerlof/lecture",
      "https://www.nobelprize.org/uploads/2018/06/harsanyi-lecture.pdf",
      "https://www.nobelprize.org/uploads/2017/05/nash-lecture.pdf",
      "https://www.nobelprize.org/prizes/economic-sciences/1994/selten/lecture",
      "https://www.nobelprize.org/prizes/economic-sciences/1994/harsanyi/lecture",
      "https://www.nobelprize.org/page/62/?np-content-type=lecture"
    ],
    "observation_11": "I've completed the initial classification of all Nobel Prizes in Economic Sciences and have begun a deeper dive into the intellectual history of key fields. My initial focus on macroeconomics, particularly the contributions of Milton Friedman and Robert Lucas Jr., has provided insights into the evolution of macroeconomic thought. I am now expanding this in-depth analysis to include behavioral economics and development economics, focusing on prominent laureates in these areas.",
    "plan_12": {
      "title": "Comprehensive Analytical Framework\nNext Steps: Behavioral and Development Economics",
      "description": "My ongoing analysis will systematically explore the intellectual lineage connecting laureates and their contributions, conduct a nuanced comparative analysis of different economic paradigms (such as neoclassical versus behavioral economics), and identify core assumptions and methodologies within these schools of thought. This will allow me to highlight key points of contention and debate in the field.\nMy immediate next step is to conduct a deep dive into the work of key laureates in behavioral economics, specifically Daniel Kahneman and Richard Thaler, and in development economics, including Amartya Sen, Angus Deaton, and the collaborative work of Abhijit Banerjee, Esther Duflo, and Michael Kremer. This will provide a more detailed understanding of these important and evolving areas of economic research."
    },
    "search_12": [
      "https://www.nsf.gov/news/nsf-congratulates-laureates-2024-nobel-prize-economics",
      "https://www.nobelprize.org/prizes/economic-sciences/2017/thaler/159673-richard-thaler-interview-transcript",
      "https://www.nobelprize.org/uploads/2018/06/kahnemann-lecture.pdf",
      "https://www.nobelprize.org/prizes/economic-sciences/2017/thaler/lecture",
      "https://www.nobelprize.org/uploads/2018/06/sen-lecture.pdf",
      "https://mediaplayer.nobelprize.org/mediaplayer/?id=531",
      "https://www.nobelprize.org/prizes/economic-sciences/1998/sen/lecture",
      "https://www.nobelprize.org/prizes/economic-sciences/2017/thaler/speech",
      "https://www.nobelprize.org/prizes/economic-sciences/1998/banquet-video",
      "https://shs.cairn.info/revue-d-economie-du-developpement-2014-HS01-page-9?lang=fr",
      "https://events.trinity.edu/event/nobel_lecture_series",
      "https://www.wider.unu.edu/video/wider-annual-lecture-nobel-laureate-amartya-sen",
      "https://www.nobelprize.org/prizes/economic-sciences/2002/kahneman/lecture",
      "https://file.pide.org.pk/pdf/PDR/993/Volume4/631-638.pdf",
      "https://www.nobelprize.org/prizes/economic-sciences/1998/sen/speech",
      "https://fourcultures.com/2009/02/03/if-you-only-read-one-nobel-prize-acceptance-speech-this-week%E2%80%A6",
      "https://en.wikipedia.org/wiki/Development_economics",
      "https://www.youtube.com/watch?v=tD_5MgjIr00",
      "https://en.wikipedia.org/wiki/Economic_development",
      "https://cals.ncsu.edu/agricultural-and-resource-economics/wp-content/uploads/sites/46/2017/07/History-of-Development-Economics-Thought.pdf",
      "https://www.nobelprize.org/prizes/economic-sciences/2002/kahneman/lecture/%20style=color:",
      "https://www.imf.org/en/Publications/fandd/issues/2020/06/MIT-poverty-fighters-abhijit-banerjee-and-esther-duflo",
      "https://www.nobelprize.org/prizes/economic-sciences/2019/banerjee/lecture",
      "https://www.imf.org/en/Publications/fandd/issues/2024/03/Symposium-Rethinking-Economics-Angus-Deaton",
      "https://www.nobelprize.org/uploads/2019/10/duflo-lecture.pdf",
      "https://www.nobelprize.org/uploads/2018/06/deaton-lecture.pdf",
      "https://en.wikipedia.org/wiki/Behavioral_economics",
      "https://www.nobelprize.org/prizes/economic-sciences/2015/deaton/lecture",
      "https://www.gla.ac.uk/explore/adamsmith300/events/tercentenaryweek/angusdeatonlecture",
      "https://www.ncbi.nlm.nih.gov/books/NBK593518",
      "https://www.nobelprize.org/prizes/lists/video-prize-lectures-from-laureates-in-economic-sciences",
      "https://econ.washington.edu/news/2016/03/16/annual-nobel-prize-lecture-explored-work-2015-laureate-angus-deaton",
      "http://paulgp.com/speeches/thaler_2016_aea.pdf",
      "https://www.nobelprize.org/uploads/2019/10/popular-economicsciencesprize2019.pdf",
      "https://www.russellsage.org/research/behavioral-economics-detailed",
      "https://uen.pressbooks.pub/behavioraleconomics/front-matter/a-very-brief-history-of-the-origin-of-behavioral-economics"
    ],
    "observation_12": "I have successfully gathered a complete list of Nobel laureates in Economic Sciences from 1969 to 2024, along with their official citations and Nobel lectures. I've also completed an initial classification of all awarded works and have begun a deeper analysis of key intellectual currents within macroeconomics, microeconomics, and financial economics. This extensive data collection and preliminary analysis provide a solid foundation for the final report.",
    "plan_13": {
      "title": "Moving to Synthesis and Report Generation\nNext Steps: Report Compilation",
      "description": "Having reached a point of saturation in my research, I am now transitioning to the final phase: synthesizing all the gathered information into a comprehensive report. This report will provide a detailed classification of research topics, analyze chronological trends, identify broader research themes and schools of thought, explore intellectual lineages, compare different economic paradigms, and speculate on future directions for the prize.\nMy immediate next action is to compile the final report, structuring it to cover the introduction, detailed classification, chronological evolution, broader themes, intellectual connections, comparative analysis of paradigms, future directions, and a concluding summary of key findings."
    }
  },
  "final_report": "# **The Prize and the Profession: A Classification and Analysis of the Sveriges Riksbank Prize in Economic Sciences, 1969–2024**\n\n## **Part I: Foundations and Frameworks**\n\n### **Chapter 1: An Introduction to the Prize in Economic Sciences**\n\n#### **The Prize's Unique Genesis**\n\nThe Sveriges Riksbank Prize in Economic Sciences in Memory of Alfred Nobel, commonly known as the Nobel Prize in Economics, occupies a unique and occasionally contentious position within the world's most prestigious intellectual awards. Its origin story differs markedly from the five prizes—in Physics, Chemistry, Physiology or Medicine, Literature, and Peace—established by the 1895 will of Alfred Nobel.1 The Prize in Economic Sciences was not created until 1968, when Sweden's central bank, Sveriges Riksbank, made a substantial donation to the Nobel Foundation to establish the award in commemoration of the bank's 300th anniversary.2\n\nThis separate genesis is reflected in its official, more cumbersome title and has been a source of debate, with some critics, including descendants of the Nobel family, arguing that its association with the original prizes is a \"PR coup\" to enhance the reputation of economics.6 Alfred Nobel himself was reportedly skeptical of fields like economics, viewing them as too imprecise to be considered on par with the natural sciences.3\n\nDespite these distinctions, the prize is administered with the same rigor and ceremony as its older counterparts. The Royal Swedish Academy of Sciences, which also selects laureates in Physics and Chemistry, is responsible for choosing the recipients according to the same fundamental principle stipulated in Nobel's will: to honor those who \"shall have conferred the greatest benefit on mankind\".6 The laureates are announced alongside the other Nobel Prize winners and receive their medal and diploma from the King of Sweden at the same annual ceremony in Stockholm, granting the award equivalent prestige and public visibility.6 The first prize was awarded in 1969 to Ragnar Frisch and Jan Tinbergen \"for having developed and applied dynamic models for the analysis of economic processes\".6\n\n#### **Role and Influence**\n\nBeyond its role as a recognition of past achievement, the Prize in Economic Sciences functions as a powerful canon-forming mechanism within the discipline. The annual selection process, which begins with invitations for nominations sent to thousands of university professors, academy members, and former laureates worldwide, and culminates in a recommendation from a specialized committee of five to eight members, serves to signal which research areas, methodologies, and intellectual traditions are considered central to the progress of economic science.8 The prize does not merely reflect the state of the profession; it actively shapes it by anointing certain ideas and individuals with unparalleled authority.\n\nThis authority extends far beyond academia. Laureates are frequently elevated to the status of public intellectuals, and their prize-winning research is often invoked in policy debates on topics ranging from monetary policy and financial regulation to poverty alleviation and climate change.12 This public-facing role can sometimes create a tension with the prize's stated purpose. The Nobel committees have consistently emphasized that the awards are for specific scientific discoveries, inventions, or improvements, not for general brilliance, a lifetime of service, or direct policy actions.13 For instance, Ben Bernanke's 2022 prize was awarded for his academic research on the Great Depression, not for his policy decisions as Chairman of the Federal Reserve during the 2008 financial crisis.14 Nevertheless, in the public sphere, this distinction is often blurred, granting laureates a platform to influence policy that is unmatched by their non-laureate peers.\n\n#### **Methodology of this Report**\n\nThis report utilizes the chronological and thematic record of the Sveriges Riksbank Prize in Economic Sciences as a narrative framework to trace the intellectual history of modern economics from 1969 to 2024. By classifying and analyzing the 56 prizes awarded to 96 laureates over this period, it is possible to identify the major paradigms, pivotal debates, and evolutionary trends that have defined the discipline. The following chapters will deconstruct this history, examining how the prize has both chronicled and influenced the profession's journey from the abstract formalism of general equilibrium theory to the empirical, behavioral, and institutional focus of the 21st century.\n\n### **Chapter 2: A Taxonomy of Economic Inquiry**\n\n#### **Framework for Classification**\n\nTo analyze over five decades of Nobel-winning research in a structured manner, this report employs a comprehensive taxonomy of economic inquiry. This classification system is designed to group laureates based on the primary field to which their cited contributions belong, while also acknowledging the profound interconnectedness of economic ideas. Many laureates have produced work that spans multiple categories, and these overlaps are often as illuminating as the primary classifications themselves. The framework builds upon simpler categorization schemes to offer a more granular and analytically useful structure for understanding the evolution of the discipline.13 It serves as the organizational backbone for the detailed analysis in Part II of this report.\n\n#### **The Six Major Fields of Inquiry**\n\nThe awarded works are classified into six broad, interrelated fields. This structure allows for a thematic exploration of the prize's history, revealing how different areas of research rose to prominence, interacted with one another, and shaped the overall trajectory of economic science.\n\n1. **Foundations: General Equilibrium, Welfare, and Choice Theory:** This category encompasses the theoretical core of economics. It deals with the abstract modeling of the economy as a system of interdependent markets and rational agents. Research in this area seeks to understand the conditions under which a market economy achieves a coherent and efficient allocation of resources. It includes the highest levels of mathematical formalism in the discipline, as well as the philosophical underpinnings of welfare economics and social choice.\n2. **The Macroeconomic Debate: From Stabilization to Expectations:** This field focuses on the economy in its entirety, addressing the \"great questions\" of economic policy: inflation, unemployment, business cycles, and long-run economic growth. The prizes in this category chronicle the major ideological and methodological battles that defined late 20th-century economics, particularly the clash between Keynesian and anti-Keynesian (Monetarist and New Classical) schools of thought.\n3. **The Microeconomic Revolution: Information, Incentives, and Institutions:** This category examines the behavior of individual economic agents—consumers, firms, and governments—and the structure of markets. Its central theme is the analysis of departures from the idealized model of perfect competition. It includes the study of market power, regulation, and, most significantly, the consequences of imperfect information, transaction costs, and the institutional \"rules of the game\" that govern economic life.\n4. **Finance and the Pricing of Risk:** A highly specialized and influential branch of microeconomics, this field is concerned with the allocation of resources over time under conditions of uncertainty. It covers the foundational theories of asset pricing, portfolio choice, corporate finance, and the valuation of complex financial instruments known as derivatives.\n5. **New Tools and Methods: Econometrics, Game Theory, and Experiments:** This category recognizes contributions that are primarily methodological in nature. These laureates developed the analytical and empirical tools that have become indispensable across all other fields of economics. It includes the development of statistical methods for analyzing economic data (econometrics), the formal study of strategic interaction (game theory), and the use of controlled experiments to test economic theories.\n6. **Economics in the Real World: Development, History, and Human Behavior:** This field groups together research that applies the economic toolkit to broader social phenomena, often by relaxing core assumptions of the standard model or by integrating insights from other disciplines. It includes the study of why some countries are rich and others poor (development economics), the use of economic methods to understand the past (economic history or cliometrics), and the exploration of the psychological foundations of economic decision-making (behavioral economics).\n\nA comprehensive table classifying all laureates from 1969 to 2024 according to this framework can be found in the Appendix (Table A.1). This table serves as the empirical foundation for the narrative analysis that follows.\n\n## **Part II: Analysis of Awarded Research by Field**\n\n### **Chapter 3: The Search for Coherence: General Equilibrium and Welfare Economics**\n\nThe early history of the Prize in Economic Sciences is dominated by the recognition of a research program that sought to provide a rigorous, mathematically coherent foundation for the entire discipline: general equilibrium theory. Rooted in the 19th-century vision of Léon Walras, this intellectual project aimed to demonstrate how the independent, self-interested actions of countless individuals and firms could be coordinated through the price mechanism to produce an orderly and efficient economic outcome.15 The prizes awarded in this domain represent the apex of economic formalism, a concerted effort to prove the logical consistency of Adam Smith's \"invisible hand.\"\n\n#### **The Walrasian Vision**\n\nThe work of **Paul Samuelson (1970)** and **John Hicks (1972)** was foundational in translating the Walrasian vision into the mathematical language that would define modern economics.16 Samuelson's prize was awarded \"for the scientific work through which he has developed static and dynamic economic theory and actively contributed to raising the level of analysis in economic science\".19 His\n\n*Foundations of Economic Analysis* established the methodological approach of modeling economic agents as solving constrained optimization problems. Hicks, who shared his prize with Kenneth Arrow, was honored for \"pioneering contributions to general economic equilibrium theory and welfare theory\".21 His 1939 book,\n\n*Value and Capital*, introduced concepts like the distinction between substitution and income effects, which became standard tools, and his IS-LM model provided a framework for synthesizing Keynesian and classical macroeconomics, demonstrating the deep connections between micro- and macroeconomic theory.20\n\n#### **The Apex of Formalism: Arrow-Debreu-Allais**\n\nThe research program reached its zenith with the highly abstract work of **Kenneth Arrow (1972)**, **Gerard Debreu (1983)**, and **Maurice Allais (1988)**.21 In a landmark 1954 paper, Arrow and Debreu used advanced mathematical techniques, including convex set theory, to provide the first rigorous proof of the existence of a set of prices that would bring all markets in an economy into equilibrium simultaneously.26 This achievement, known as the Arrow-Debreu model, was a monumental intellectual feat that confirmed the logical possibility of Walras's vision.15 Debreu's 1959 monograph,\n\n*Theory of Value*, is celebrated for its axiomatic elegance and became the definitive statement of the theory.28\n\nThis work also formalized the two Fundamental Theorems of Welfare Economics. The first theorem states that under certain conditions (including perfect competition and complete markets), a market equilibrium is Pareto efficient, meaning no one can be made better off without making someone else worse off. The second states that any Pareto efficient outcome can be achieved as a market equilibrium, given an appropriate initial distribution of wealth.15 Together, these theorems provide the formal basis for the argument that competitive markets can efficiently allocate resources. Allais, who worked independently in France, was recognized for parallel contributions to the theory of markets and efficient resource utilization.24\n\nThe cluster of prizes awarded for this body of work between 1970 and 1988 marks the culmination of a research program focused on abstract theory and mathematical proof. The subsequent absence of awards for extending this core framework is telling. It suggests a significant shift in the profession's center of gravity. Having established the logical coherence of an idealized market system, the research frontier moved on to explore the myriad ways in which real-world economies depart from this ideal. The prize committee's focus evolved from asking \"Does an ideal market system work in theory?\" to \"Why do real markets fail, and what are the consequences?\"\n\n#### **The Challenge to the Utilitarian Framework: Amartya Sen**\n\nThe work of **Amartya Sen (1998)**, awarded \"for his contributions to welfare economics,\" serves as a crucial bridge between the formal world of general equilibrium and the more applied, policy-oriented concerns that would come to dominate the prize in later years.29 While trained in the rigorous methods of general equilibrium and social choice theory, Sen used these tools to launch a profound critique of the narrow informational basis of traditional welfare economics.32\n\nBuilding on Arrow's Impossibility Theorem—which showed that no voting system can convert the ranked preferences of individuals into a community-wide ranking while meeting a minimal set of fairness criteria—Sen explored the conditions under which rational social choice might be possible. He argued that making meaningful social judgments requires richer informational inputs than just individual preference orderings. One of his key insights was that interpersonal comparisons of well-being, which Arrow had excluded, were essential for evaluating social outcomes, particularly for issues of inequality and poverty.32\n\nThis led to his most influential contribution: the development of the \"capability approach.\" Sen argued that the goal of development and the standard for evaluating social welfare should not be utility or income, but rather the expansion of human capabilities—the substantive freedoms that people have to lead the kind of lives they have reason to value.32 This shifted the focus from means (like income) to ends (like the ability to be well-nourished, educated, and to participate in community life), providing a much richer framework for analyzing poverty, inequality, and development that has had a profound influence on both academic research and international policy organizations.\n\n### **Chapter 4: The Great Debates in Macroeconomics**\n\nThe history of the Nobel Prize in macroeconomics is a history of intellectual warfare. The awards in this domain do not depict a steady, cumulative progression of knowledge but rather a series of revolutionary upheavals, with the prize often serving as a definitive scorecard in the ideological and methodological battles that defined the field in the latter half of the 20th century. The central conflict was between the post-war Keynesian consensus, which advocated for active government intervention to stabilize the economy, and a powerful counter-revolution that reasserted the primacy of monetary policy and the rationality of economic agents.\n\n#### **The Post-War Keynesian Consensus and the Monetarist Counter-Revolution**\n\nThe dominant macroeconomic paradigm after World War II was Keynesianism, which held that governments could and should use fiscal policy (spending and taxes) to manage aggregate demand and combat unemployment.34 A key tool in the Keynesian policy kit was the Phillips Curve, an empirical relationship suggesting a stable trade-off between inflation and unemployment.36 This view was frontally assaulted by the Monetarist school, led by\n\n**Milton Friedman (1976)**.34\n\nFriedman's prize was awarded for his achievements in consumption analysis, monetary history, and \"his demonstration of the complexity of stabilization policy\".39 In his 1976 Nobel lecture, he directly attacked the notion of a stable Phillips Curve.40 He argued, along with\n\n**Edmund Phelps (2006)**, that any trade-off was purely temporary.42 Once workers and firms came to\n\n*expect* inflation, they would build it into their wage and price demands, causing the Phillips Curve to shift. The only way to keep unemployment below its \"natural rate\" would be through ever-accelerating inflation. This theory predicted the \"stagflation\"—simultaneous high inflation and high unemployment—that plagued many economies in the 1970s, an event that Keynesian models struggled to explain.40 Friedman's core message was that \"inflation is always and everywhere a monetary phenomenon\" and that the best central banks could do was to provide a stable, predictable growth rate for the money supply.45 His work had a transformative impact on policy, leading central banks like the U.S. Federal Reserve under Paul Volcker to adopt monetary targeting in the early 1980s to bring inflation under control.45\n\n#### **The Rational Expectations Revolution**\n\nFriedman's critique was primarily policy-oriented, but it was followed by a deeper, more profound methodological challenge from the New Classical school, spearheaded by **Robert E. Lucas, Jr. (1995)**.47 Lucas was awarded the prize \"for having developed and applied the hypothesis of rational expectations, and thereby having transformed macroeconomic analysis\".47 The theory of rational expectations posits that people form their forecasts about the future using all available information efficiently; they do not make systematic, predictable errors.51\n\nThis seemingly simple assumption had devastating implications for Keynesian macroeconomics. In a famous 1976 paper, Lucas presented what became known as the \"Lucas Critique.\" He argued that the statistical relationships observed in large-scale Keynesian econometric models—such as the Phillips Curve or the consumption function—were not deep structural parameters. Instead, they were contingent on the specific policy regime in place during the period the data were collected. If the government were to change its policy (for example, by trying to exploit the Phillips Curve to lower unemployment), people's rational expectations would adapt, the old statistical relationships would break down, and the model would give misleading predictions.50 The only way to conduct credible policy analysis, Lucas argued, was to build models based on \"deep parameters\" of preferences and technology, a program known as microfoundations.\n\n#### **New Classical and Modern Macroeconomics**\n\nThe sequence of prizes awarded after Friedman and Lucas can be seen as the committee's validation of the intellectual arc of this anti-Keynesian, \"freshwater\" school of macroeconomics. The prize to **Finn Kydland and Edward Prescott (2004)** recognized two major extensions of the rational expectations approach.54 First was their work on the \"time inconsistency\" of economic policy, which showed that even well-meaning policymakers have an incentive to deviate from announced plans (e.g., promising low inflation but then using surprise inflation to boost employment), leading rational agents to distrust such announcements and ultimately producing worse outcomes.55 Second was their development of Real Business Cycle (RBC) theory, which attempted to explain economic fluctuations as the efficient response of the economy to real, supply-side shocks (like changes in technology), rather than as the result of demand-side failures requiring government intervention.55\n\nWhile RBC models were influential, their ability to match the data was debated. The prize to **Thomas Sargent and Christopher Sims (2011)** recognized the development of more sophisticated empirical methods to navigate this landscape.56 Sargent's work focused on using historical analysis to understand the effects of major shifts in policy regimes, while Sims developed a technique called Vector Autoregression (VAR), which allows for the analysis of macroeconomic time series with fewer restrictive theoretical assumptions, providing a way to study cause and effect in the macroeconomy that attempts to address the Lucas Critique.57\n\n#### **Crises, Growth, and Institutions**\n\nMore recent prizes in macroeconomics have moved beyond the traditional stabilization debate to address long-run growth and financial stability, often integrating insights from other fields. The 2018 prize was shared by **Paul Romer**, for his work on endogenous growth theory, which models technological innovation as an outcome of economic incentives rather than an exogenous force, and **William Nordhaus**, for integrating climate change into long-run macroeconomic analysis, pioneering the field of climate economics.58\n\nThe 2008 financial crisis spurred renewed interest in financial market imperfections, a topic more aligned with a Keynesian worldview. This culminated in the 2022 prize to **Ben Bernanke, Douglas Diamond, and Philip Dybvig**.60 Bernanke's historical research demonstrated that bank failures were a key mechanism that propagated and amplified the initial shock of the Great Depression. Diamond and Dybvig developed the canonical theoretical model of bank runs, showing how banks' role in maturity transformation (funding long-term loans with short-term deposits) makes them inherently fragile and explaining the economic rationale for deposit insurance.60\n\nFinally, the 2024 prize to **Daron Acemoglu, Simon Johnson, and James Robinson** represents a significant broadening of the field, linking long-run prosperity to the nature of a country's political and economic institutions.62 Their work argues that \"inclusive\" institutions that protect property rights and provide broad access to economic opportunities are the fundamental cause of wealth, while \"extractive\" institutions that concentrate power and wealth in the hands of a small elite lead to stagnation.64 This work bridges macroeconomics with development, economic history, and political science, suggesting a new frontier for the discipline.\n\n### **Chapter 5: Understanding Markets, Firms, and Governments**\n\nWhile macroeconomists debated the fate of entire economies, a parallel revolution was occurring in microeconomics. This revolution systematically deconstructed the foundational model of perfect competition, which assumes perfect information, zero transaction costs, and price-taking behavior. By relaxing these unrealistic assumptions one by one, Nobel laureates in this field developed a richer, more nuanced, and more powerful set of tools for understanding how real-world markets, firms, and governments actually function. This body of work provides the theoretical underpinnings for modern analysis of regulation, corporate strategy, and institutional design.\n\n#### **The Economics of Asymmetric Information**\n\nA pivotal breakthrough came with the analysis of markets where one party to a transaction has more or better information than the other. The 2001 prize was awarded to three pioneers in this field: **George Akerlof, Michael Spence, and Joseph Stiglitz**.68 In his seminal 1970 paper, \"The Market for 'Lemons',\" Akerlof used the example of the used car market to show how asymmetric information can lead to \"adverse selection.\" Fearing they will get a low-quality car (a \"lemon\"), buyers are only willing to pay a price reflecting the average quality on the market. This low price drives sellers of high-quality cars out of the market, which lowers the average quality further, potentially causing the market to unravel and collapse entirely.68\n\nSpence analyzed how informed parties might try to overcome this problem through \"signaling.\" He showed how a costly action, such as obtaining a university degree, could serve as a credible signal of high productivity to an employer, even if the education itself did not increase productivity, provided the cost of obtaining the signal was lower for high-productivity individuals.72 Stiglitz examined the other side of the coin: \"screening,\" whereby uninformed parties (like insurance companies) design a menu of contracts (e.g., policies with different deductibles and premiums) to induce informed parties (customers) to reveal their private information (their risk level).70\n\nThis work on information was complemented by the 1996 prize to **James Mirrlees and William Vickrey** for their contributions to the \"economic theory of incentives under asymmetric information\".76 Mirrlees developed the theory of optimal income taxation, a classic principal-agent problem where the government (the principal) cannot observe individuals' earning ability (the agent's private information) and must design a tax system that balances the goals of redistribution and preserving incentives to work. Vickrey's work on auctions, including the design of the Vickrey auction, provided foundational insights into how to design mechanisms that elicit truthful bidding.57\n\n#### **The Nature of the Firm and Institutions**\n\nAnother major line of inquiry attacked the assumption of zero transaction costs to explain the very existence of institutions like the firm. **Ronald Coase (1991)** was awarded the prize for his \"discovery and clarification of the significance of transaction costs and property rights for the institutional structure and functioning of the economy\".78 In his 1937 paper, \"The Nature of the Firm,\" Coase asked a fundamental question: if markets are efficient, why do firms exist? His answer was that using the market has costs—transaction costs, such as searching for suppliers, negotiating contracts, and enforcing them. Firms emerge when it is cheaper to organize production through managerial hierarchy than through market transactions.79\n\nThis insight was developed and formalized by **Oliver Williamson (2009)**, who focused on how transaction costs, particularly in the presence of asset specificity and incomplete contracts, determine the \"boundaries of the firm\"—that is, which transactions are conducted within a firm and which are left to the market.80 The formal microeconomic tools for analyzing these issues were provided by\n\n**Oliver Hart and Bengt Holmström (2016)**, who were awarded the prize for their contributions to contract theory.82 Their work explores how to design optimal contracts when it is impossible to foresee and write down every possible contingency, leading to crucial insights into corporate governance, such as the allocation of control rights and the design of executive compensation schemes.57\n\n#### **Market Power, Regulation, and Design**\n\nThe final pillar of the new microeconomics involves the analysis of imperfect competition and the design of better market mechanisms. This research began with the Chicago School tradition, represented by **George Stigler (1982)**, who was recognized for his \"seminal studies of industrial structures, functioning of markets and causes and effects of public regulation\".79 Stigler famously argued that regulation is often \"captured\" by the industries it is supposed to regulate, serving their interests rather than the public's.\n\nA more comprehensive and modern approach was recognized with the 2014 prize to **Jean Tirole** \"for his analysis of market power and regulation\".85 Tirole's work, often using sophisticated game-theoretic tools, provided a unified framework for analyzing how to regulate industries dominated by a few powerful firms, such as telecommunications and banking, taking into account the problems of asymmetric information between regulators and firms.57\n\nThe constructive consequence of understanding market failures is the ability to design better markets. This was recognized with the 2012 prize to **Alvin Roth and Lloyd Shapley** \"for the theory of stable allocations and the practice of market design\".87 Shapley developed the foundational theoretical concepts, while Roth applied them to solve practical problems, such as designing the matching system for American medical residents and creating kidney exchange programs.87 Similarly, the 2020 prize to\n\n**Paul Milgrom and Robert Wilson** recognized their work on improving auction theory and inventing new auction formats.89 Their insights were instrumental in the design of government auctions for radio spectrum licenses, which have raised hundreds of billions of dollars worldwide.91\n\n### **Chapter 6: The Economics of Finance and Uncertainty**\n\nFinancial economics, the study of how individuals and firms allocate resources through time and manage risk, has been one of the most recognized and impactful fields in the history of the prize. The awards in this area trace a compelling intellectual narrative: the construction of a powerful paradigm based on rational investors and efficient markets, the subsequent empirical and behavioral challenges to that paradigm, and the development of sophisticated tools to adjudicate the debate.\n\n#### **The Birth of Modern Finance**\n\nThe foundations of modern financial theory were laid by the laureates of the 1990 prize: **Harry Markowitz, Merton Miller, and William Sharpe**.79 Markowitz, in his 1952 dissertation, developed portfolio theory, the first rigorous mathematical framework for understanding diversification. He showed that investors should not simply pick stocks with the highest expected return, but should instead choose portfolios based on the trade-off between expected return and risk, which he measured as the portfolio's variance. A key insight was that the risk of a portfolio depends not just on the risk of its individual assets, but on their covariances—how they move together.94\n\nWilliam Sharpe built directly on Markowitz's work to develop the Capital Asset Pricing Model (CAPM). The CAPM provides a simple, powerful prediction: the expected return of any asset is determined by the risk-free interest rate plus a risk premium that depends on the asset's \"beta\"—a measure of its systematic, non-diversifiable risk relative to the market as a whole.96 Merton Miller, working with Franco Modigliani (who won in 1985 for other work), established the foundations of modern corporate finance with the Modigliani-Miller (M&M) theorems. Their most famous result showed that, under certain assumptions (including no taxes and efficient markets), a firm's value is independent of its capital structure—that is, whether it finances itself with debt or equity.97\n\n#### **The Option Pricing Revolution**\n\nPerhaps the most technically brilliant and commercially impactful discovery in finance was the development of a method for pricing derivative securities. The 1997 prize was awarded to **Robert Merton and Myron Scholes** for this work, which was done in close collaboration with Fischer Black, who passed away before the prize was awarded and was thus ineligible.29 The Black-Scholes-Merton model provided a formula for determining the value of a stock option. Its revolutionary insight was that one could create a risk-free portfolio by combining the option with its underlying stock. By the principle of no-arbitrage, this risk-free portfolio must earn the risk-free interest rate. This logic allowed them to derive a precise formula for the option's price that did not depend on investors' risk preferences or the stock's expected return—variables that are notoriously difficult to measure.99 The formula transformed financial markets, enabling the explosive growth of the derivatives industry. More broadly, it provided a new paradigm for valuing any \"contingent claim\"—any asset whose value depends on the future value of another, more fundamental asset—with applications ranging from corporate investment decisions to loan guarantees.99\n\n#### **The Empirical Challenge to Efficient Markets**\n\nThe theoretical edifice of modern finance was built on the Efficient Market Hypothesis (EMH), the idea that asset prices fully reflect all available information. This implies that prices should follow a \"random walk\" and be impossible to predict. The 2013 prize brilliantly captured the central debate surrounding this hypothesis by awarding it jointly to its chief proponent, its most prominent critic, and a key methodologist.79\n\n**Eugene Fama** is widely regarded as the father of the EMH. His empirical work in the 1960s and 70s provided much of the initial evidence that stock prices are largely unpredictable in the short run, consistent with the theory.107 His work established the EMH as the central organizing paradigm in financial research for decades.\n\nIn stark contrast, **Robert Shiller**'s research from the early 1980s provided a powerful challenge to the EMH. He showed that stock prices are far more volatile than can be justified by subsequent changes in dividends. This \"excess volatility\" suggests that prices are driven by waves of irrational optimism and pessimism—\"bubbles\"—rather than by rational fundamentals.108 His work laid the empirical foundation for the field of behavioral finance.\n\nThe prize committee did not take a side in this profound debate; instead, it recognized the entire intellectual conflict as central to the field's progress. By including **Lars Peter Hansen**, they also honored the development of the crucial econometric tools needed to confront these competing theories with data. Hansen developed the Generalized Method of Moments (GMM), a statistical technique robust enough to test the complex, non-linear models of asset pricing that both rational and behavioral theories produce.79 The 2013 prize was thus a sophisticated acknowledgment not of a settled truth, but of a vibrant, ongoing scientific debate that defines the frontier of financial economics.\n\n### **Chapter 7: The Methodological Frontier**\n\nA significant portion of the Nobel Prizes in Economic Sciences has been awarded not for substantive discoveries about the economy, but for the creation of new tools and analytical frameworks. These methodological contributions have often been the catalysts for subsequent breakthroughs in applied fields. The prizes awarded to the \"toolmakers\" can be seen as leading indicators, prefiguring the types of empirical and theoretical work that the profession—and the prize committee—will value in the years to come. This pattern is evident across the history of econometrics, the rise of game theory, and the recent \"credibility revolution\" in empirical research.\n\n#### **The Foundations of Econometrics**\n\nThe very first prize, awarded in 1969 to **Ragnar Frisch and Jan Tinbergen**, recognized their foundational role in establishing econometrics as a distinct field.6 They were the first to build formal mathematical models and confront them with statistical data to analyze economic processes. This work was given a more rigorous foundation by\n\n**Trygve Haavelmo (1989)**, who clarified the probabilistic underpinnings of econometric models, showing how statistical inference could be used to estimate economic relationships.57\n\nThese foundational ideas were put into practice by **Lawrence Klein (1980)**, who pioneered the development of large-scale macroeconometric models. These models, consisting of hundreds of simultaneous equations, were used to forecast economic activity and simulate the effects of different fiscal and monetary policies.16 The very data used in these models were made possible by the work of laureates like\n\n**Sir Richard Stone (1984)**, who developed the comprehensive systems of national income and product accounts that are now standard in every country.110\n\n#### **Advanced Econometric Techniques**\n\nAs economic theory grew more sophisticated, so did the econometric tools needed to test it. The 2003 prize recognized two key innovations in the analysis of time-series data. **Robert Engle** developed Autoregressive Conditional Heteroskedasticity (ARCH) models, which provided a way to model and forecast periods of high and low volatility in financial markets. **Clive Granger** developed the concept of cointegration, a method for analyzing long-run relationships between non-stationary time series, such as consumption and income.112\n\nIn microeconomics, the 2000 prize honored two laureates who developed methods for analyzing individual-level data. **James Heckman** was recognized for his methods for correcting \"selection bias,\" a problem that arises when the individuals being studied are not a random sample of the population (e.g., the wages of working women are only observed for those who choose to work). **Daniel McFadden** was recognized for developing the theory and methods for analyzing \"discrete choice,\" such as an individual's choice between different modes of transportation or brands of a product.14 These microeconometric methods have become the workhorses for much of modern empirical research in labor, development, and public economics.\n\n#### **The Rise of Game Theory**\n\nOne of the most profound methodological shifts in modern economics has been the adoption of game theory—the formal analysis of strategic interaction—as a primary analytical tool. The 1994 prize was awarded to three of its pioneers: **John Nash**, for developing the central solution concept of \"Nash equilibrium,\" where no player has an incentive to deviate given the strategies of others; **John Harsanyi**, for extending the analysis to games of \"incomplete information,\" where players are uncertain about the characteristics of their opponents; and **Reinhard Selten**, for refining the Nash equilibrium concept to rule out equilibria based on non-credible threats.29\n\nThe absorption of game theory into the mainstream is evident in the subsequent prizes that relied heavily on its framework. The 2005 prize went to **Robert Aumann and Thomas Schelling** for using game theory to enhance the understanding of conflict and cooperation, with applications ranging from arms races to racial segregation.121 The 2007 prize to\n\n**Leonid Hurwicz, Eric Maskin, and Roger Myerson** recognized their foundational work in mechanism design, a subfield of game theory that essentially reverses the question: instead of predicting the outcome of a given game, it asks how to design the rules of the game to achieve a desired outcome.124 The application of these game-theoretic tools is also central to the prizes for contract theory (2016) and auction theory (2020).\n\n#### **The Empirical Turn and the Credibility Revolution**\n\nThe most recent methodological trend recognized by the prize is the \"credibility revolution\" in empirical economics, a movement focused on improving the reliability of causal claims. The 2021 prize perfectly captured this shift. Half was awarded to **David Card** for his empirical contributions, particularly his use of \"natural experiments\" to study questions like the effect of minimum wages on employment.62 The other half went to\n\n**Joshua Angrist and Guido Imbens** for developing the statistical framework—including the concept of the Local Average Treatment Effect (LATE)—that provides the theoretical justification for interpreting the results of such natural experiments.62\n\nThis emphasis on credible identification complements the prize awarded to **Vernon Smith (2002)**, who shared the prize with Daniel Kahneman. Smith was honored \"for having established laboratory experiments as a tool in empirical economic analysis,\" showing how controlled experiments could be used to test the predictions of economic theory and compare the performance of different market mechanisms.57 Together, these prizes for natural and laboratory experiments signify a profound shift in the discipline toward a more rigorous, evidence-based approach to answering economic questions.\n\n### **Chapter 8: Expanding the Domain of Economics**\n\nIn the latter half of its existence, the Nobel Prize has increasingly recognized work that pushes the boundaries of the discipline, applying the economic way of thinking to new domains and, in turn, being reshaped by insights from other social sciences. This expansion has not been a one-way street of \"economic imperialism.\" Instead, the most vibrant frontiers of modern economics—behavioral, institutional, and historical economics—are precisely those areas where the discipline has been most open to intellectual cross-pollination.\n\n#### **Reclaiming History and Institutions**\n\nAfter a period in which economic models became increasingly abstract and ahistorical, a number of laureates were recognized for re-integrating history and institutions into the core of economic analysis. An early pioneer was **Simon Kuznets (1971)**, whose prize was awarded for his \"empirically founded interpretation of economic growth\".129 Kuznets painstakingly compiled and analyzed historical national income data, identifying long-term patterns like the \"Kuznets curve,\" an inverted-U relationship between inequality and development.\n\nThis empirical tradition was transformed into the field of \"cliometrics\" or the new economic history by **Robert Fogel and Douglass North (1993)**, who were awarded the prize \"for having renewed research in economic history by applying economic theory and quantitative methods\".17 Fogel famously used economic models to re-evaluate the economic viability of slavery in the American South, while North focused on the crucial role of institutions—the formal and informal \"rules of the game\"—in shaping long-run economic performance. North's work is a direct intellectual forerunner to the 2024 prize to\n\n**Acemoglu, Johnson, and Robinson**.62 The 2023 prize to\n\n**Claudia Goldin** \"for having advanced our understanding of women's labour market outcomes\" further cements this tradition. Goldin's work is a masterful blend of economic history and labor economics, tracing the evolution of the gender gap over centuries and identifying the key economic and social forces behind it.133\n\n#### **The Evolution of Development Economics**\n\nThe study of why some countries remain poor while others grow rich has undergone a profound transformation, mirrored in the prizes awarded in the field. The early pioneers, **Sir Arthur Lewis and Theodore Schultz (1979)**, were recognized for their foundational research on the problems of developing countries.16 Lewis developed the \"dual-sector model\" of an economy with a traditional agricultural sector and a modern industrial sector, while Schultz emphasized the importance of human capital and investment in agriculture.\n\nThe field later shifted from these broad theoretical models toward a more micro-level, data-driven approach. **Angus Deaton (2015)** was awarded the prize \"for his analysis of consumption, poverty, and welfare\".136 Deaton's work demonstrated how careful analysis of household survey data could provide deep insights into individual behavior and well-being, transforming development economics into a primarily empirical field.138\n\nThe most recent evolution has been the rise of the experimental approach, recognized with the 2019 prize to **Abhijit Banerjee, Esther Duflo, and Michael Kremer**.133 They championed the use of randomized controlled trials (RCTs) to evaluate the effectiveness of specific anti-poverty interventions, such as providing textbooks, deworming pills, or microcredit.142 This approach breaks down the grand question of \"how to end poverty\" into smaller, more manageable questions that can be answered with rigorous evidence.\n\n#### **The Behavioral Challenge to *Homo Economicus***\n\nPerhaps the most fundamental challenge to the core of neoclassical economics has come from behavioral economics, which imports insights from psychology to build more realistic models of human decision-making. An early forerunner was **Herbert Simon (1978)**, a political scientist who won the prize for his research on decision-making within organizations.16 Simon introduced the concept of \"bounded rationality,\" arguing that real humans do not optimize like the fictional\n\n*Homo economicus*; instead, they \"satisfice,\" seeking solutions that are good enough given their cognitive limitations.\n\nThe modern field was founded on the work of two psychologists, Daniel Kahneman and Amos Tversky. **Daniel Kahneman (2002)** received the prize for \"having integrated insights from psychological research into economic science\".57 Their research identified systematic biases in human judgment and decision-making. Their \"prospect theory\" showed that people evaluate outcomes relative to a reference point, are loss-averse (a loss hurts more than an equivalent gain feels good), and misjudge probabilities, providing a powerful alternative to standard expected utility theory.147\n\n**Richard Thaler (2017)** was awarded the prize \"for his contributions to behavioural economics\" by systematically applying these psychological insights to a wide range of economic phenomena.79 He explored issues like limited self-control (the planner vs. the doer), fairness, and mental accounting. His work has had significant policy influence through the concept of \"nudging\"—designing choice environments to help fallible humans make better decisions without restricting their freedom, such as through automatic enrollment in retirement savings plans.153\n\n#### **Economics as a Social Science**\n\nThe prizes awarded to laureates who explicitly crossed disciplinary boundaries underscore the evolution of economics as a broader social science. **Gary Becker (1992)** was the classic exemplar of \"economic imperialism,\" receiving the prize \"for having extended the domain of microeconomic analysis to a wide range of human behaviour and interaction, including nonmarket behaviour\".79 Becker applied the rational choice framework to topics traditionally studied by sociologists and criminologists, such as marriage, family, discrimination, and crime.\n\nHowever, the intellectual traffic has not been one-way. The prize to **Elinor Ostrom (2009)**, a political scientist, was a landmark in recognizing the contributions of other disciplines to economics.2 Ostrom was honored \"for her analysis of economic governance, especially the commons.\" Her field research showed that, contrary to standard economic predictions of a \"tragedy of the commons,\" communities can and do develop sophisticated local institutions to successfully manage common-pool resources like forests and fisheries, offering a \"third way\" between privatization and government control.57 The increasing recognition of work that draws on history, psychology, and political science suggests that the most fruitful areas of future economic research may lie at these interdisciplinary intersections.\n\n## **Part III: Synthesis and Conclusion**\n\n### **Chapter 9: Thematic Evolution and Intellectual Trajectories**\n\nViewing the 56-year history of the Prize in Economic Sciences as a whole reveals several profound intellectual trajectories that chart the evolution of the discipline itself. The prize committee's selections, when viewed chronologically and thematically, narrate a story of a field moving from abstract theory toward empirical application, from idealized models of rationality toward a more nuanced understanding of human behavior, and from a focus on perfect markets to a deep appreciation for the role of imperfect institutions.\n\n#### **From Abstract Theory to Empirical Application**\n\nThe most significant macro-trend in the history of the prize is a decisive shift in emphasis from pure theory to applied empirical work. In the first two decades (1969–1988), the awards were dominated by grand theorists who built the mathematical foundations of the discipline. Laureates like Samuelson, Hicks, Arrow, and Debreu were honored for creating highly abstract models of the economy, with the primary goal of establishing logical consistency and elegance. Their work was foundational but often several steps removed from direct empirical testing or immediate policy application.\n\nBeginning in the 1990s and accelerating dramatically after 2000, the balance shifted. While theoretical contributions continued to be recognized (e.g., in contract theory and auction theory), the majority of prizes have gone to work that is deeply empirical. This \"empirical turn\" is characterized not just by the use of data, but by a focus on credible causal inference—a rigorous attempt to distinguish correlation from causation. The prizes to Heckman and McFadden (2000) for microeconometric methods, Angrist and Imbens (2021) for the methodology of natural experiments, and Banerjee, Duflo, and Kremer (2019) for the application of randomized controlled trials are the capstones of this movement. This evolution reflects a broader shift in the economics profession toward a more evidence-based science, where theoretical claims are expected to be rigorously tested against real-world data.\n\n#### **From Rational Agents to Behavioral Humans**\n\nA second major trajectory involves the reconceptualization of the economic agent. The dominant paradigm of the 1970s and 80s, particularly in macroeconomics and finance, was built on the assumption of *homo economicus*—a perfectly rational, forward-looking, and self-interested agent. The work of Lucas on rational expectations and Fama on efficient markets represents the high-water mark of this approach. These models were powerful and internally consistent, but their descriptions of human behavior were often at odds with both common sense and psychological evidence.\n\nThe prize has chronicled the systematic challenge to this paradigm. The seeds were sown with Herbert Simon's (1978) concept of bounded rationality. The challenge became a full-fledged research program with the work of psychologist Daniel Kahneman (2002), who documented systematic cognitive biases in human judgment. Finally, Richard Thaler (2017) demonstrated that these psychological quirks have significant and predictable consequences for economic outcomes in markets. This arc represents a fundamental change in the discipline's core assumptions, leading to a behavioral economics that seeks to build models based on how humans actually behave, not on how they *should* behave according to an abstract ideal of rationality.\n\n#### **From Perfect Markets to Imperfect Institutions**\n\nA third narrative arc traces the movement from the frictionless world of the Arrow-Debreu general equilibrium model to an economics where the \"grit\" in the system is the primary object of study. The early prizes celebrated the theoretical efficiency of perfect markets. However, a subsequent and sustained line of research, consistently rewarded by the prize committee, has focused on the sources and consequences of market failure.\n\nThis began with the information economics of Akerlof, Spence, and Stiglitz (2001), who showed how asymmetric information could cripple markets. It continued with the New Institutional Economics of Coase (1991) and Williamson (2009), who explained the existence of firms and other institutions as responses to transaction costs. The work of Hart and Holmström (2016) on incomplete contracts provided the micro-foundations for understanding these institutional arrangements. Most recently, the prizes to North (1993), Ostrom (2009), and Acemoglu, Johnson, and Robinson (2024) have elevated the study of political and social institutions to the forefront of economic inquiry, arguing that these \"rules of the game\" are the fundamental determinants of long-run prosperity. This represents a profound shift from viewing the market as an abstract mechanism to seeing it as a set of social institutions deeply embedded in a historical and political context.\n\n#### **Mapping the Centers of Influence**\n\nFinally, the institutional distribution of the prize highlights the networks and schools of thought that have shaped the profession. The University of Chicago, in particular, has had an outsized influence, with numerous laureates associated with the institution, especially in the fields of macroeconomics (Friedman, Lucas), finance (Fama, Miller), and the economic analysis of law and society (Coase, Stigler, Becker).79 This reflects the dominance of the \"Chicago School,\" with its emphasis on rational choice, free markets, and rigorous price theory. Similarly, the Massachusetts Institute of Technology (MIT) has been a powerhouse, particularly in macroeconomics (Samuelson, Solow, Modigliani), finance (Merton), and, more recently, development and institutional economics (Duflo, Banerjee, Acemoglu, Johnson).12 The concentration of laureates in a handful of elite U.S. universities underscores the hierarchical nature of the profession and the importance of academic networks in the dissemination and legitimation of new ideas.12\n\n### **Chapter 10: Impact, Critique, and the Shifting Frontiers of Economic Science**\n\nThe Sveriges Riksbank Prize in Economic Sciences has not only chronicled the evolution of a discipline but has also played a significant role in shaping public discourse and policy. However, its influence has not been without controversy, and the pattern of awards offers clues to the shifting frontiers of economic research as the field grapples with the complex challenges of the 21st century.\n\n#### **The Impact on Policy and Discourse**\n\nPrize-winning ideas have frequently migrated from academic journals to the halls of government and the boardrooms of corporations. Milton Friedman's monetarism profoundly influenced the conduct of central banking in the 1980s, solidifying the focus on inflation control.45 The auction theory developed by Wilson and Milgrom has been directly implemented by governments worldwide to allocate radio spectrum, raising vast sums and promoting efficient use.89 In recent years, the behavioral insights of Thaler and Kahneman have given rise to \"nudge units\" in governments across the globe, which use small changes in \"choice architecture\" to encourage behaviors like saving for retirement and conserving energy.155 In development policy, the experimental approach of Banerjee, Duflo, and Kremer has become a dominant paradigm for aid organizations seeking evidence on the effectiveness of their programs.142 The prize serves as a powerful amplifier, lending credibility to these ideas and accelerating their adoption in the real world.\n\n#### **Addressing the Critiques**\n\nThe prize has faced persistent criticism on several fronts. One major critique is that it has exhibited a strong bias toward neoclassical, free-market-oriented economics, particularly from the Chicago School.12 Critics argue that by elevating theories like the Efficient Market Hypothesis and rational expectations, the prize may have contributed to a climate of deregulation that laid the groundwork for the 2008 financial crisis.12 The list of laureates is also strikingly homogenous: it is overwhelmingly dominated by male economists based at a few elite American universities, with only three women (Elinor Ostrom, Esther Duflo, and Claudia Goldin) and very few scholars from the Global South having been recognized.4 This lack of diversity, critics contend, narrows the range of questions asked and perspectives valued by the profession. Finally, the very existence of the prize is seen by some as granting an unwarranted \"scientific\" authority to a field that is fundamentally a social science, replete with ideological disagreements and contested assumptions.12\n\n#### **The Shifting Frontiers**\n\nThe pattern of the most recent awards suggests that the frontiers of economics are shifting to address these critiques and engage more directly with complex, real-world problems. The prizes for integrating climate change (Nordhaus, 2018), for using historical methods to understand gender inequality (Goldin, 2023), and for analyzing the deep institutional roots of national prosperity (Acemoglu, Johnson, and Robinson, 2024) point to a discipline that is becoming more empirical, more interdisciplinary, and more engaged with the grand challenges of our time.58\n\nThe future of economic science, as reflected through the lens of its most prestigious prize, appears to lie not in the further refinement of abstract models of idealized markets, but in the messy, data-rich, and institution-laden world where economics intersects with history, psychology, politics, and the natural environment. The journey of the prize from the mathematical elegance of general equilibrium to the historical contingency of institutional development is, in essence, the story of economics itself growing up—a discipline increasingly willing to trade the certainty of abstract models for the relevance of understanding a complex and ever-changing world.\n\n### **Appendix**\n\n#### **Table A.1: Comprehensive List of Laureates and Classification (1969-2024)**\n\n| Year | Laureate(s) | Official Prize Citation | Primary Classification | Secondary Classification(s) |\n| --- | --- | --- | --- | --- |\n| 1969 | Ragnar Frisch, Jan Tinbergen | \"for having developed and applied dynamic models for the analysis of economic processes\" 16 | New Tools and Methods: Econometrics | The Macroeconomic Debate |\n| 1970 | Paul A. Samuelson | \"for the scientific work through which he has developed static and dynamic economic theory and actively contributed to raising the level of analysis in economic science\" 19 | Foundations: General Equilibrium | The Macroeconomic Debate |\n| 1971 | Simon Kuznets | \"for his empirically founded interpretation of economic growth which has led to new and deepened insight into the economic and social structure and process of development\" 130 | Economics in the Real World: History | The Macroeconomic Debate |\n| 1972 | John R. Hicks, Kenneth J. Arrow | \"for their pioneering contributions to general economic equilibrium theory and welfare theory\" 21 | Foundations: General Equilibrium | Foundations: Welfare & Choice |\n| 1973 | Wassily Leontief | \"for the development of the input-output method and for its application to important economic problems\" 161 | New Tools and Methods: Econometrics | The Macroeconomic Debate |\n| 1974 | Gunnar Myrdal, Friedrich von Hayek | \"for their pioneering work in the theory of money and economic fluctuations and for their penetrating analysis of the interdependence of economic, social and institutional phenomena\" 162 | The Macroeconomic Debate | Microeconomics: Institutions |\n| 1975 | Leonid V. Kantorovich, Tjalling C. Koopmans | \"for their contributions to the theory of optimum allocation of resources\" 163 | New Tools and Methods: Econometrics | Foundations: General Equilibrium |\n| 1976 | Milton Friedman | \"for his achievements in the fields of consumption analysis, monetary history and theory and for his demonstration of the complexity of stabilization policy\" 39 | The Macroeconomic Debate | Economics in the Real World: History |\n| 1977 | Bertil Ohlin, James E. Meade | \"for their pathbreaking contribution to the theory of international trade and international capital movements\" 164 | The Macroeconomic Debate |  |\n| 1978 | Herbert A. Simon | \"for his pioneering research into the decision-making process within economic organizations\" 146 | Economics in the Real World: Behavior | Microeconomics: Institutions |\n| 1979 | Theodore W. Schultz, Sir Arthur Lewis | \"for their pioneering research into economic development research with particular consideration of the problems of developing countries\" 135 | Economics in the Real World: Development |  |\n| 1980 | Lawrence R. Klein | \"for the creation of econometric models and the application to the analysis of economic fluctuations and economic policies\" 109 | New Tools and Methods: Econometrics | The Macroeconomic Debate |\n| 1981 | James Tobin | \"for his analysis of financial markets and their relations to expenditure decisions, employment, production and prices\" 165 | The Macroeconomic Debate | Finance and Risk |\n| 1982 | George J. Stigler | \"for his seminal studies of industrial structures, functioning of markets and causes and effects of public regulation\" 84 | Microeconomics: Institutions |  |\n| 1983 | Gerard Debreu | \"for having incorporated new analytical methods into economic theory and for his rigorous reformulation of the theory of general equilibrium\" 23 | Foundations: General Equilibrium |  |\n| 1984 | Sir Richard Stone | \"for having made fundamental contributions to the development of systems of national accounts and hence greatly improved the basis for empirical economic analysis\" 111 | New Tools and Methods: Econometrics | The Macroeconomic Debate |\n| 1985 | Franco Modigliani | \"for his pioneering analyses of saving and of financial markets\" 166 | The Macroeconomic Debate | Finance and Risk |\n| 1986 | James M. Buchanan, Jr. | \"for his development of the contractual and constitutional bases for the theory of economic and political decision-making\" 167 | Microeconomics: Institutions | Foundations: Welfare & Choice |\n| 1987 | Robert M. Solow | \"for his contributions to the theory of economic growth\" 168 | The Macroeconomic Debate |  |\n| 1988 | Maurice Allais | \"for his pioneering contributions to the theory of markets and efficient utilization of resources\" 24 | Foundations: General Equilibrium |  |\n| 1989 | Trygve Haavelmo | \"for his clarification of the probability theory foundations of econometrics and his analyses of simultaneous economic structures\" 57 | New Tools and Methods: Econometrics |  |\n| 1990 | Harry M. Markowitz, Merton H. Miller, William F. Sharpe | \"for their pioneering work in the theory of financial economics\" 93 | Finance and Risk |  |\n| 1991 | Ronald H. Coase | \"for his discovery and clarification of the significance of transaction costs and property rights for the institutional structure and functioning of the economy\" 78 | Microeconomics: Institutions |  |\n| 1992 | Gary S. Becker | \"for having extended the domain of microeconomic analysis to a wide range of human behaviour and interaction, including nonmarket behaviour\" 156 | Economics in the Real World: Behavior |  |\n| 1993 | Robert W. Fogel, Douglass C. North | \"for having renewed research in economic history by applying economic theory and quantitative methods in order to explain economic and institutional change\" 131 | Economics in the Real World: History | Microeconomics: Institutions |\n| 1994 | John C. Harsanyi, John F. Nash, Jr., Reinhard Selten | \"for their pioneering analysis of equilibria in the theory of non-cooperative games\" 117 | New Tools and Methods: Game Theory |  |\n| 1995 | Robert E. Lucas, Jr. | \"for having developed and applied the hypothesis of rational expectations, and thereby having transformed macroeconomic analysis and deepened our understanding of economic policy\" 47 | The Macroeconomic Debate |  |\n| 1996 | James A. Mirrlees, William S. Vickrey | \"for their fundamental contributions to the economic theory of incentives under asymmetric information\" 77 | Microeconomics: Information & Incentives |  |\n| 1997 | Robert C. Merton, Myron S. Scholes | \"for a new method to determine the value of derivatives\" 57 | Finance and Risk |  |\n| 1998 | Amartya Sen | \"for his contributions to welfare economics\" 31 | Foundations: Welfare & Choice | Economics in the Real World: Development |\n| 1999 | Robert A. Mundell | \"for his analysis of monetary and fiscal policy under different exchange rate regimes and his analysis of optimum currency areas\" 169 | The Macroeconomic Debate |  |\n| 2000 | James J. Heckman, Daniel L. McFadden | \"for his development of theory and methods for analyzing selective samples\" and \"for his development of theory and methods for analyzing discrete choice\" 115 | New Tools and Methods: Econometrics |  |\n| 2001 | George A. Akerlof, A. Michael Spence, Joseph E. Stiglitz | \"for their analyses of markets with asymmetric information\" 70 | Microeconomics: Information & Incentives |  |\n| 2002 | Daniel Kahneman, Vernon L. Smith | \"for having integrated insights from psychological research into economic science...\" and \"for having established laboratory experiments as a tool in empirical economic analysis...\" 57 | Economics in the Real World: Behavior | New Tools and Methods: Experiments |\n| 2003 | Robert F. Engle, Clive W.J. Granger | \"for methods of analyzing economic time series with time-varying volatility (ARCH)\" and \"for methods of analyzing economic time series with common trends (cointegration)\" 57 | New Tools and Methods: Econometrics | Finance and Risk |\n| 2004 | Finn E. Kydland, Edward C. Prescott | \"for their contributions to dynamic macroeconomics: the time consistency of economic policy and the driving forces behind business cycles\" 55 | The Macroeconomic Debate |  |\n| 2005 | Robert J. Aumann, Thomas C. Schelling | \"for having enhanced our understanding of conflict and cooperation through game-theory analysis\" 123 | New Tools and Methods: Game Theory |  |\n| 2006 | Edmund S. Phelps | \"for his analysis of intertemporal tradeoffs in macroeconomic policy\" 43 | The Macroeconomic Debate |  |\n| 2007 | Leonid Hurwicz, Eric S. Maskin, Roger B. Myerson | \"for having laid the foundations of mechanism design theory\" 126 | New Tools and Methods: Game Theory | Microeconomics: Information & Incentives |\n| 2008 | Paul R. Krugman | \"for his analysis of trade patterns and location of economic activity\" 170 | The Macroeconomic Debate |  |\n| 2009 | Elinor Ostrom, Oliver E. Williamson | \"for her analysis of economic governance, especially the commons\" and \"for his analysis of economic governance, especially the boundaries of the firm\" 80 | Microeconomics: Institutions |  |\n| 2010 | Peter A. Diamond, Dale T. Mortensen, Christopher A. Pissarides | \"for their analysis of markets with search frictions\" 171 | The Macroeconomic Debate |  |\n| 2011 | Thomas J. Sargent, Christopher A. Sims | \"for their empirical research on cause and effect in the macroeconomy\" 57 | The Macroeconomic Debate | New Tools and Methods: Econometrics |\n| 2012 | Alvin E. Roth, Lloyd S. Shapley | \"for the theory of stable allocations and the practice of market design\" 57 | Microeconomics: Institutions | New Tools and Methods: Game Theory |\n| 2013 | Eugene F. Fama, Lars Peter Hansen, Robert J. Shiller | \"for their empirical analysis of asset prices\" 57 | Finance and Risk | New Tools and Methods: Econometrics |\n| 2014 | Jean Tirole | \"for his analysis of market power and regulation\" 57 | Microeconomics: Institutions |  |\n| 2015 | Angus S. Deaton | \"for his analysis of consumption, poverty, and welfare\" 57 | Economics in the Real World: Development |  |\n| 2016 | Oliver Hart, Bengt Holmström | \"for their contributions to contract theory\" 83 | Microeconomics: Institutions | Microeconomics: Information & Incentives |\n| 2017 | Richard H. Thaler | \"for his contributions to behavioural economics\" 151 | Economics in the Real World: Behavior |  |\n| 2018 | William D. Nordhaus, Paul M. Romer | \"for integrating climate change into long-run macroeconomic analysis\" and \"for integrating technological innovations into long-run macroeconomic analysis\" 58 | The Macroeconomic Debate |  |\n| 2019 | Abhijit Banerjee, Esther Duflo, Michael Kremer | \"for their experimental approach to alleviating global poverty\" 57 | Economics in the Real World: Development | New Tools and Methods: Experiments |\n| 2020 | Paul R. Milgrom, Robert B. Wilson | \"for improvements to auction theory and inventions of new auction formats\" 89 | Microeconomics: Institutions | New Tools and Methods: Game Theory |\n| 2021 | David Card, Joshua D. Angrist, Guido W. Imbens | \"for his empirical contributions to labour economics\" and \"for their methodological contributions to the analysis of causal relationships\" 127 | New Tools and Methods: Econometrics | Economics in the Real World: Behavior |\n| 2022 | Ben Bernanke, Douglas W. Diamond, Philip Dybvig | \"for research on banks and financial crises\" 61 | The Macroeconomic Debate | Finance and Risk |\n| 2023 | Claudia Goldin | \"for having advanced our understanding of women’s labour market outcomes\" 134 | Economics in the Real World: History | Economics in the Real World: Behavior |\n| 2024 | Daron Acemoglu, Simon Johnson, James A. Robinson | \"for studies of how institutions are formed and affect prosperity\" 66 | Microeconomics: Institutions | The Macroeconomic Debate |\n\n#### 引用的著作\n\n1. Nobel Memorial Prize in Economic Sciences | EBSCO Research Starters, 访问时间为 八月 6, 2025， <https://www.ebsco.com/research-starters/history/nobel-memorial-prize-economic-sciences>\n2. Nobel Memorial Prize in Economics: What It is, Methodology, FAQs - Investopedia, 访问时间为 八月 6, 2025， <https://www.investopedia.com/terms/n/nobel-memorial-prize-in-economic-sciences.asp>\n3. Nobel memorial prize in economic sciences - A critical overview, 访问时间为 八月 6, 2025， <https://www.exploring-economics.org/en/discover/nobel-memorial-prize-economics/>\n4. The Sveriges Riksbank Prize in Economic Sciences in Memory of Alfred Nobel, 访问时间为 八月 6, 2025， <https://www.nobelprize.org/prizes/economic-sciences/>\n5. Economics prize | Sveriges Riksbank - Riksbanken, 访问时间为 八月 6, 2025， <https://www.riksbank.se/en-gb/about-the-riksbank/the-tasks-of-the-riksbank/research/economics-prize/>\n6. Nobel Memorial Prize in Economic Sciences - Wikipedia, 访问时间为 八月 6, 2025， <https://en.wikipedia.org/wiki/Nobel_Memorial_Prize_in_Economic_Sciences>\n7. Historical Echoes: What's in a Name? The Sveriges Riksbank Prize in Economic Sciences in Memory of Alfred Nobel - Liberty Street Economics - Federal Reserve Bank of New York, 访问时间为 八月 6, 2025， <https://libertystreeteconomics.newyorkfed.org/2012/08/historical-echoes-whats-in-a-name-the-sveriges-riksbank-prize-in-economic-sciences-in-memory-of-alfr/>\n8. Nomination and selection of economic sciences laureates - NobelPrize.org, 访问时间为 八月 6, 2025， <https://www.nobelprize.org/nomination/economic-sciences/>\n9. Nobel Prize - Wikipedia, 访问时间为 八月 6, 2025， <https://en.wikipedia.org/wiki/Nobel_Prize>\n10. The Prize in Economic Sciences in Memory of Alfred Nobel--1969 - 1998 - S-WoPEc, 访问时间为 八月 6, 2025， <https://swopec.hhs.se/iuiwop/abs/iuiwop0517.htm>\n11. Committee for the Sveriges Riksbank Prize in Economic Sciences in Memory of Alfred Nobel, 访问时间为 八月 6, 2025， <https://en.wikipedia.org/wiki/Committee_for_the_Sveriges_Riksbank_Prize_in_Economic_Sciences_in_Memory_of_Alfred_Nobel>\n12. The Nobel Illusion: Why the Nobel Prize in Economics Needs to be Abolished, 访问时间为 八月 6, 2025， <https://developingeconomics.org/2024/10/22/the-nobel-illusion-why-the-nobel-prize-in-economics-needs-to-be-abolished/>\n13. Brilliant minds: the Nobel Prize in Economics | Treasury.gov.au, 访问时间为 八月 6, 2025， <https://treasury.gov.au/publication/economic-roundup-autumn-2006/brilliant-minds-the-nobel-prize-in-economics>\n14. Nobel Prize Winners React to Idea of Trump Winning Economics Award - Newsweek, 访问时间为 八月 6, 2025， <https://www.newsweek.com/nobel-prize-winners-react-trump-economics-2107563>\n15. General equilibrium theory - Wikipedia, 访问时间为 八月 6, 2025， <https://en.wikipedia.org/wiki/General_equilibrium_theory>\n16. List of Nobel Prize winners in Economics - Simple English Wikipedia, the free encyclopedia, 访问时间为 八月 6, 2025， <https://simple.wikipedia.org/wiki/List_of_Nobel_Prize_winners_in_Economics>\n17. Nobel Prize Winners in Economics - Raptis Rare Books, 访问时间为 八月 6, 2025， <https://www.raptisrarebooks.com/the-nobel-prize-in-economics/>\n18. List of Nobel Memorial Prize laureates in Economic Sciences - Wikipedia, 访问时间为 八月 6, 2025， <https://en.wikipedia.org/wiki/List_of_Nobel_Memorial_Prize_laureates_in_Economic_Sciences>\n19. The Sveriges Riksbank Prize in Economic Sciences in Memory of Alfred Nobel 1970, 访问时间为 八月 6, 2025， <https://www.nobelprize.org/prizes/economic-sciences/1970/summary/>\n20. John Hicks - Wikipedia, 访问时间为 八月 6, 2025， <https://en.wikipedia.org/wiki/John_Hicks>\n21. The Sveriges Riksbank Prize in Economic Sciences in Memory of Alfred Nobel 1972, 访问时间为 八月 6, 2025， <https://www.nobelprize.org/prizes/economic-sciences/1972/summary/>\n22. en.wikipedia.org, 访问时间为 八月 6, 2025， <https://en.wikipedia.org/wiki/G%C3%A9rard_Debreu>\n23. The Sveriges Riksbank Prize in Economic Sciences in Memory of Alfred Nobel 1983, 访问时间为 八月 6, 2025， <https://www.nobelprize.org/prizes/economic-sciences/1983/summary/>\n24. The Sveriges Riksbank Prize in Economic Sciences in Memory of Alfred Nobel 1988, 访问时间为 八月 6, 2025， <https://www.nobelprize.org/prizes/economic-sciences/1988/summary/>\n25. arrow-lecture.pdf - Nobel Prize, 访问时间为 八月 6, 2025， <https://www.nobelprize.org/uploads/2018/06/arrow-lecture.pdf>\n26. The Prize in Economics 1983 - Presentation Speech - NobelPrize.org, 访问时间为 八月 6, 2025， <https://www.nobelprize.org/prizes/economic-sciences/1983/ceremony-speech/>\n27. Gerard Debreu - Prize Lecture, 访问时间为 八月 6, 2025， <https://www.nobelprize.org/uploads/2018/06/debreu-lecture.pdf>\n28. The Prize in Economics 1983 - Presentation Speech - NobelPrize.org, 访问时间为 八月 6, 2025， <https://www.nobelprize.org/prizes/economic-sciences/1983/press-release/>\n29. All Nobel Prizes - NobelPrize.org, 访问时间为 八月 6, 2025， <https://www.nobelprize.org/prizes/lists/all-nobel-prizes/>\n30. The Nobel Banquet 1998 - NobelPrize.org, 访问时间为 八月 6, 2025， <https://www.nobelprize.org/prizes/economic-sciences/1998/banquet-video/>\n31. The Sveriges Riksbank Prize in Economic Sciences in Memory of Alfred Nobel 1998, 访问时间为 八月 6, 2025， <https://www.nobelprize.org/prizes/economic-sciences/1998/summary/>\n32. Amartya Sen - Nobel Lecture, 访问时间为 八月 6, 2025， <https://www.nobelprize.org/uploads/2018/06/sen-lecture.pdf>\n33. WIDER Annual Lecture by Nobel Laureate Amartya Sen, 访问时间为 八月 6, 2025， <https://www.wider.unu.edu/video/wider-annual-lecture-nobel-laureate-amartya-sen>\n34. Keynesian Economics vs. Monetarism: What's the Difference? - Investopedia, 访问时间为 八月 6, 2025， <https://www.investopedia.com/ask/answers/012615/what-difference-between-keynesian-economics-and-monetarist-economics.asp>\n35. Keynesianism vs Monetarism - Economics Help, 访问时间为 八月 6, 2025， <https://www.economicshelp.org/blog/1113/concepts/keynesianism-vs-monetarism/>\n36. FRIEDMAN'S NOBEL LECTURE AND THE PHILLIPS CURVE MYTH | Journal of the History of Economic Thought - Cambridge University Press, 访问时间为 八月 6, 2025， <https://www.cambridge.org/core/journals/journal-of-the-history-of-economic-thought/article/friedmans-nobel-lecture-and-the-phillips-curve-myth/53838048E89566D2757A43A488439814>\n37. www.google.com, 访问时间为 八月 6, 2025， <https://www.google.com/search?q=Sveriges+Riksbank+Prize+in+Economic+Sciences+in+Memory+of+Alfred+Nobel+1979>\n38. Milton Friedman - Wikipedia, 访问时间为 八月 6, 2025， <https://en.wikipedia.org/wiki/Milton_Friedman>\n39. The Sveriges Riksbank Prize in Economic Sciences in Memory of Alfred Nobel 1976, 访问时间为 八月 6, 2025， <https://www.nobelprize.org/prizes/economic-sciences/1976/summary/>\n40. Milton Friedman - Prize Lecture, 访问时间为 八月 6, 2025， <https://www.nobelprize.org/uploads/2018/06/friedman-lecture-1.pdf>\n41. Nobel Lecture: Inflation and Unemployment | Journal of Political Economy: Vol 85, No 3, 访问时间为 八月 6, 2025， <https://www.journals.uchicago.edu/doi/abs/10.1086/260579>\n42. 2006 Economic Sciences Prize Highlights Innovative Research - Innovations Report, 访问时间为 八月 6, 2025， <https://www.innovations-report.com/global-finance/business-and-finance/report-71686/>\n43. The Sveriges Riksbank Prize in Economic Sciences in Memory of Alfred Nobel 2006, 访问时间为 八月 6, 2025， <https://www.nobelprize.org/prizes/economic-sciences/2006/summary/>\n44. Keynesian Economics vs Monetarist Economics: Definitions, Differences, and FAQs, 访问时间为 八月 6, 2025， <https://www.vedantu.com/commerce/difference-between-keynesian-economics-and-monetarist-economics>\n45. Milton Friedman's Long-Run Impact - Hoover Institution, 访问时间为 八月 6, 2025， <https://www.hoover.org/research/milton-friedmans-long-run-impact>\n46. What Would Milton Friedman Say about Market Monetarism? - Mercatus Center, 访问时间为 八月 6, 2025， <https://www.mercatus.org/research/policy-briefs/what-would-milton-friedman-say-about-market-monetarism>\n47. The Sveriges Riksbank Prize in Economic Sciences in Memory of Alfred Nobel 1995, 访问时间为 八月 6, 2025， <https://www.nobelprize.org/prizes/economic-sciences/1995/summary/>\n48. The Prize in Economics 1995 - Presentation Speech - NobelPrize.org, 访问时间为 八月 6, 2025， <https://www.nobelprize.org/prizes/economic-sciences/1995/ceremony-speech/>\n49. Robert E. Lucas, Jr., University of Chicago - Yale Economic Growth Center, 访问时间为 八月 6, 2025， <https://egc.yale.edu/events/kuznets/kuznets-10>\n50. Robert E. Lucas - Econlib, 访问时间为 八月 6, 2025， <https://www.econlib.org/library/Enc/bios/Lucas.html>\n51. Rational Expectations - Econlib, 访问时间为 八月 6, 2025， <https://www.econlib.org/library/Enc/RationalExpectations.html>\n52. Rational Expectations Theory Definition and How It Works - Investopedia, 访问时间为 八月 6, 2025， <https://www.investopedia.com/terms/r/rationaltheoryofexpectations.asp>\n53. the rational expectations revolution: a review article of: preston j. miller, ed., 访问时间为 八月 6, 2025， <https://faculty.sites.iastate.edu/tesfatsi/archive/tesfatsi/Mishkin.RationalExpReview.pdf>\n54. www.google.com, 访问时间为 八月 6, 2025， <https://www.google.com/search?q=Sveriges+Riksbank+Prize+in+Economic+Sciences+in+Memory+of+Alfred+Nobel+2004>\n55. The Prize in Economic Sciences 2004 - Press release - NobelPrize.org, 访问时间为 八月 6, 2025， <https://www.nobelprize.org/prizes/economic-sciences/2004/press-release/>\n56. Economics prize 2011 - Sveriges Riksbank, 访问时间为 八月 6, 2025， <http://archive.riksbank.se/en/Web-archive/Published/Notices/2011/Economics-prize-2011/index.html>\n57. All prizes in economic sciences - NobelPrize.org, 访问时间为 八月 6, 2025， <https://www.nobelprize.org/prizes/lists/all-prizes-in-economic-sciences/all/>\n58. The Prize in Economic Sciences 2018 - Kungl. Vetenskapsakademien, 访问时间为 八月 6, 2025， <https://www.kva.se/en/news/ekonomipriset-2018-2/>\n59. www.google.com, 访问时间为 八月 6, 2025， <https://www.google.com/search?q=Sveriges+Riksbank+Prize+in+Economic+Sciences+in+Memory+of+Alfred+Nobel+2018>\n60. 2022 Nobel Memorial Prize in Economic Sciences - Wikipedia, 访问时间为 八月 6, 2025， <https://en.wikipedia.org/wiki/2022_Nobel_Memorial_Prize_in_Economic_Sciences>\n61. Ben S. Bernanke, Douglas W. Diamond and Philip H. Dybvig awarded the Prize in Economic Sciences for 2022 | Sveriges Riksbank - Riksbanken, 访问时间为 八月 6, 2025， <https://www.riksbank.se/en-gb/press-and-published/notices-and-press-releases/notices/2022/ben-s.-bernanke-douglas-w.-diamond-and-philip-h.-dybvigawarded-the-prize-in-economic-sciences-for-2022/>\n62. All prizes in economic sciences - NobelPrize.org, 访问时间为 八月 6, 2025， <https://www.nobelprize.org/prizes/lists/all-prizes-in-economic-sciences/>\n63. The Sveriges Riksbank Prize in Economic Sciences in Memory of Alfred Nobel 2024, 访问时间为 八月 6, 2025， <https://www.nobelprize.org/prizes/economic-sciences/2024/summary/>\n64. The Prize in Economic Sciences 2024 - Press release - NobelPrize.org, 访问时间为 八月 6, 2025， <https://www.nobelprize.org/prizes/economic-sciences/2024/press-release/>\n65. 2024 Economics Nobel Prize Winners - REMI, 访问时间为 八月 6, 2025， <https://www.remi.com/news/2024-economics-nobel-prize-winners/>\n66. Daron Acemoglu, Simon Johnson and James A. Robinson are awarded the Prize in Economic Sciences 2024 | Sveriges Riksbank - Riksbanken, 访问时间为 八月 6, 2025， <https://www.riksbank.se/en-gb/press-and-published/notices-and-press-releases/notices/2024/daron-acemoglu-simon-johnson-and-james-a.-robinson-are-awarded-the-prize-in-economic-sciences-2024/>\n67. The Prize in Economic Sciences 2024 - Popular science background - NobelPrize.org, 访问时间为 八月 6, 2025， <https://www.nobelprize.org/prizes/economic-sciences/2024/popular-information/>\n68. The Prize in Economic Sciences 2001 - Kungl. Vetenskapsakademien, 访问时间为 八月 6, 2025， <https://www.kva.se/app/uploads/2022/06/globalassets-priser-nobel-2001-popeken01.pdf>\n69. www.google.com, 访问时间为 八月 6, 2025， <https://www.google.com/search?q=Sveriges+Riksbank+Prize+in+Economic+Sciences+in+Memory+of+Alfred+Nobel+2001>\n70. The Prize in Economic Sciences 2001 - Press release - NobelPrize.org, 访问时间为 八月 6, 2025， <https://www.nobelprize.org/prizes/economic-sciences/2001/press-release/>\n71. George A. Akerlof - Nobel Lecture, 访问时间为 八月 6, 2025， <https://www.nobelprize.org/uploads/2018/06/akerlof-lecture.pdf>\n72. A. Michael Spence - Nobel Lecture, 访问时间为 八月 6, 2025， <https://www.nobelprize.org/uploads/2018/06/spence-lecture.pdf>\n73. A. Michael Spence – Prize Lecture - NobelPrize.org, 访问时间为 八月 6, 2025， <https://www.nobelprize.org/prizes/economic-sciences/2001/spence/lecture/>\n74. Joseph E. Stiglitz - Nobel Lecture, 访问时间为 八月 6, 2025， <https://www.nobelprize.org/uploads/2018/06/stiglitz-lecture.pdf>\n75. Joseph E. Stiglitz - Nobel Lecture - Department of Mathematics | University of Toronto, 访问时间为 八月 6, 2025， <https://www.math.utoronto.ca/mccann/1855/papers/stiglitz-Nobel-lecture01.pdf>\n76. www.google.com, 访问时间为 八月 6, 2025， <https://www.google.com/search?q=Sveriges+Riksbank+Prize+in+Economic+Sciences+in+Memory+of+Alfred+Nobel+1996>\n77. The Sveriges Riksbank Prize in Economic Sciences in Memory of Alfred Nobel 1996, 访问时间为 八月 6, 2025， <https://www.nobelprize.org/prizes/economic-sciences/1996/summary/>\n78. The Sveriges Riksbank Prize in Economic Sciences in Memory of Alfred Nobel 1991, 访问时间为 八月 6, 2025， <https://www.nobelprize.org/prizes/economic-sciences/1991/summary/>\n79. Nobel Laureates | The University of Chicago Booth School of Business, 访问时间为 八月 6, 2025， <https://www.chicagobooth.edu/faculty/nobel-laureates>\n80. Economics prize 2009 - Sveriges Riksbank, 访问时间为 八月 6, 2025， <http://archive.riksbank.se/en/Web-archive/Published/Notices/2009/Economics-prize-2009/index.html>\n81. The Sveriges Riksbank Prize in Economic Sciences in Memory of Alfred Nobel 2009, 访问时间为 八月 6, 2025， <https://www.youtube.com/watch?v=sI-KAuX9yCU>\n82. www.google.com, 访问时间为 八月 6, 2025， <https://www.google.com/search?q=Sveriges+Riksbank+Prize+in+Economic+Sciences+in+Memory+of+Alfred+Nobel+2016>\n83. The Sveriges Riksbank Prize in Economic Sciences in Memory of Alfred Nobel 2016, 访问时间为 八月 6, 2025， <https://www.nobelprize.org/prizes/economic-sciences/2016/summary/>\n84. The Sveriges Riksbank Prize in Economic Sciences in Memory of Alfred Nobel 1982, 访问时间为 八月 6, 2025， <https://www.nobelprize.org/prizes/economic-sciences/1982/summary/>\n85. Jean Tirole wins the 2014 Sveriges Riksbank Prize in Economic, 访问时间为 八月 6, 2025， <https://www.tholden.org/industrial%20organization%202014-15/jean-tirole-wins-the-2014-sveriges-riksbank-prize-in-economic-sciences-in-memory-of-alfred-nobel/>\n86. en.wikipedia.org, 访问时间为 八月 6, 2025， <https://en.wikipedia.org/wiki/Jean_Tirole>\n87. The Sveriges Riksbank Prize in Economic Sciences in Memory of Alfred Nobel - NRMP International, 访问时间为 八月 6, 2025， <https://www.nrmpinternational.org/wp-content/uploads/2021/10/The-Sveriges-Riksbank-Prize-in-Economic-Sciences-in-Memory-of-Alfred-Nobel1.pdf>\n88. www.google.com, 访问时间为 八月 6, 2025， <https://www.google.com/search?q=Sveriges+Riksbank+Prize+in+Economic+Sciences+in+Memory+of+Alfred+Nobel+2012>\n89. Paul R. Milgrom and Robert B. Wilson awarded the Prize in Economic Sciences for 2020, 访问时间为 八月 6, 2025， <https://www.riksbank.se/en-gb/press-and-published/notices-and-press-releases/notices/2020/paul-r.-milgrom-and-robert-b.-wilson-awarded-the-prize-in-economic-sciences-for-2020/>\n90. www.google.com, 访问时间为 八月 6, 2025， <https://www.google.com/search?q=Sveriges+Riksbank+Prize+in+Economic+Sciences+in+Memory+of+Alfred+Nobel+2020>\n91. Nobel Prize in Economics: What Impact on Research and Society? - HEC Paris, 访问时间为 八月 6, 2025， <https://www.hec.edu/en/nobel-prize-economics-what-impact-research-and-society>\n92. www.google.com, 访问时间为 八月 6, 2025， <https://www.google.com/search?q=Sveriges+Riksbank+Prize+in+Economic+Sciences+in+Memory+of+Alfred+Nobel+1990>\n93. The Sveriges Riksbank Prize in Economic Sciences in Memory of Alfred Nobel 1990, 访问时间为 八月 6, 2025， <https://www.nobelprize.org/prizes/economic-sciences/1990/summary/>\n94. Harry M. Markowitz - Prize Lecture, 访问时间为 八月 6, 2025， <https://www.nobelprize.org/uploads/2018/06/markowitz-lecture.pdf>\n95. Markowitz, Harry - INFORMS.org, 访问时间为 八月 6, 2025， <https://www.informs.org/Explore/History-of-O.R.-Excellence/Biographical-Profiles/Markowitz-Harry>\n96. William F. Sharpe - Prize Lecture, 访问时间为 八月 6, 2025， <https://www.nobelprize.org/uploads/2018/06/sharpe-lecture.pdf>\n97. Fama-Miller Center for Research in Finance Merton Miller - Chicago Booth, 访问时间为 八月 6, 2025， <https://www.chicagobooth.edu/research/fama-miller/who-we-are/merton-miller>\n98. Merton H. Miller - Prize Lecture, 访问时间为 八月 6, 2025， <https://www.nobelprize.org/uploads/2018/06/miller-lecture.pdf>\n99. Background on the Bank of Sweden Prize in Economic Sciences in Memory of Alfred Nobel 1997 - Kellogg School of Management, 访问时间为 八月 6, 2025， <https://www.kellogg.northwestern.edu/faculty/hubbard/htm/research/97nobel2.htm>\n100. The Prize in Economic Sciences 1997 - Press release - NobelPrize.org, 访问时间为 八月 6, 2025， <https://www.nobelprize.org/prizes/economic-sciences/1997/press-release/>\n101. Robert C. Merton and Myron S. Scholes Won 1997 Nobel Prize for Finding Ways to Value Stock Options and Other Financial Contracts | NBER, 访问时间为 八月 6, 2025， <https://www.nber.org/news/robert-c-merton-and-myron-s-scholes-won-1997-nobel-prize-finding-ways-value-stock-options-and-other>\n102. www.google.com, 访问时间为 八月 6, 2025， <https://www.google.com/search?q=Sveriges+Riksbank+Prize+in+Economic+Sciences+in+Memory+of+Alfred+Nobel+1997>\n103. Robert C. Merton – Prize Lecture - NobelPrize.org, 访问时间为 八月 6, 2025， <https://www.nobelprize.org/prizes/economic-sciences/1997/merton/lecture/>\n104. Myron S. Scholes - Nobel Lecture, 访问时间为 八月 6, 2025， <https://www.nobelprize.org/uploads/2018/06/scholes-lecture.pdf>\n105. www.google.com, 访问时间为 八月 6, 2025， <https://www.google.com/search?q=Sveriges+Riksbank+Prize+in+Economic+Sciences+in+Memory+of+Alfred+Nobel+2013>\n106. Wiley Congratulates Winners of the 2013 Sveriges Riksbank Prize in, 访问时间为 八月 6, 2025， <https://newsroom.wiley.com/press-releases/press-release-details/2013/Wiley-Congratulates-Winners-of-the-2013-Sveriges-Riksbank-Prize-in-Economic-Sciences/default.aspx>\n107. (PDF) The Sveriges Riksbank Prize in Economic Sciences in Memory of Alfred Nobel 2013: Eugene F. Fama, Lars Peter Hansen, Robert J. Shiller. A brief review - ResearchGate, 访问时间为 八月 6, 2025， <https://www.researchgate.net/publication/264729212_The_Sveriges_Riksbank_Prize_in_Economic_Sciences_in_Memory_of_Alfred_Nobel_2013_Eugene_F_Fama_Lars_Peter_Hansen_Robert_J_Shiller_A_brief_review>\n108. Trendspotting in asset markets - Nobel Prize, 访问时间为 八月 6, 2025， <https://www.nobelprize.org/uploads/2018/06/popular-economicsciences2013-1.pdf>\n109. The Sveriges Riksbank Prize in Economic Sciences in Memory of Alfred Nobel 1980, 访问时间为 八月 6, 2025， <https://www.nobelprize.org/prizes/economic-sciences/1980/summary/>\n110. Prize in Economic Sciences - Kungl. Vetenskapsakademien, 访问时间为 八月 6, 2025， <https://www.kva.se/en/prizes/prize-in-economic-sciences/>\n111. The Sveriges Riksbank Prize in Economic Sciences in Memory of Alfred Nobel 1984, 访问时间为 八月 6, 2025， <https://www.nobelprize.org/prizes/economic-sciences/1984/summary/>\n112. www.google.com, 访问时间为 八月 6, 2025， <https://www.google.com/search?q=Sveriges+Riksbank+Prize+in+Economic+Sciences+in+Memory+of+Alfred+Nobel+2003>\n113. The Nobel Banquet 2003 - NobelPrize.org, 访问时间为 八月 6, 2025， <https://www.nobelprize.org/prizes/economic-sciences/2003/banquet-video/>\n114. The Prize in Economics 2003 - Prize announcement - NobelPrize.org, 访问时间为 八月 6, 2025， <https://www.nobelprize.org/prizes/economic-sciences/2003/prize-announcement/>\n115. The Sveriges Riksbank Prize in Economic Sciences in Memory of Alfred Nobel 2000, 访问时间为 八月 6, 2025， <https://www.nobelprize.org/prizes/economic-sciences/2000/summary/>\n116. www.google.com, 访问时间为 八月 6, 2025， <https://www.google.com/search?q=Sveriges+Riksbank+Prize+in+Economic+Sciences+in+Memory+of+Alfred+Nobel+1994>\n117. The Sveriges Riksbank Prize in Economic Sciences in Memory of Alfred Nobel 1994, 访问时间为 八月 6, 2025， <https://www.nobelprize.org/prizes/economic-sciences/1994/summary/>\n118. John C. Harsanyi - Prize Lecture, 访问时间为 八月 6, 2025， <https://www.nobelprize.org/uploads/2018/06/harsanyi-lecture.pdf>\n119. The Prize in Economics 1994 - Presentation Speech - NobelPrize.org, 访问时间为 八月 6, 2025， <https://www.nobelprize.org/prizes/economic-sciences/1994/ceremony-speech/>\n120. Reinhard Selten - Prize Lecture, 访问时间为 八月 6, 2025， <https://www.nobelprize.org/uploads/2018/06/selten-lecture.pdf>\n121. The Sveriges Riksbank Prize in Economic Sciences in Memory of Alfred Nobel 2005 - The Hebrew University of Jerusalem, 访问时间为 八月 6, 2025， <https://cris.huji.ac.il/en/prizes/the-sveriges-riksbank-prize-in-economic-sciences-in-memory-of-alf>\n122. www.google.com, 访问时间为 八月 6, 2025， <https://www.google.com/search?q=Sveriges+Riksbank+Prize+in+Economic+Sciences+in+Memory+of+Alfred+Nobel+2005>\n123. The Sveriges Riksbank Prize in Economic Sciences in Memory of Alfred Nobel 2005, 访问时间为 八月 6, 2025， <https://www.nobelprize.org/prizes/economic-sciences/2005/summary/>\n124. The Prize in Economic Sciences 2007 - Kungl. Vetenskapsakademien, 访问时间为 八月 6, 2025， <https://www.kva.se/en/news/ekonomipriset-2007-2/>\n125. www.google.com, 访问时间为 八月 6, 2025， <https://www.google.com/search?q=Sveriges+Riksbank+Prize+in+Economic+Sciences+in+Memory+of+Alfred+Nobel+2007>\n126. The Sveriges Riksbank Prize in Economic Sciences in Memory of Alfred Nobel 2007, 访问时间为 八月 6, 2025， <https://www.nobelprize.org/prizes/economic-sciences/2007/summary/>\n127. 2021 Nobel Memorial Prize in Economic Sciences - Wikipedia, 访问时间为 八月 6, 2025， <https://en.wikipedia.org/wiki/2021_Nobel_Memorial_Prize_in_Economic_Sciences>\n128. www.google.com, 访问时间为 八月 6, 2025， <https://www.google.com/search?q=Sveriges+Riksbank+Prize+in+Economic+Sciences+in+Memory+of+Alfred+Nobel+2021>\n129. UNWE :: Nobel Prize in Economic Sciences, 访问时间为 八月 6, 2025， <https://www.unwe.bg/en/pages/18265/nobel-prize-in-economic-sciences.html>\n130. The Sveriges Riksbank Prize in Economic Sciences in Memory of Alfred Nobel 1971, 访问时间为 八月 6, 2025， <https://www.nobelprize.org/prizes/economic-sciences/1971/summary/>\n131. The Sveriges Riksbank Prize in Economic Sciences in Memory of Alfred Nobel 1993, 访问时间为 八月 6, 2025， <https://www.nobelprize.org/prizes/economic-sciences/1993/summary/>\n132. www.google.com, 访问时间为 八月 6, 2025， <https://www.google.com/search?q=Sveriges+Riksbank+Prize+in+Economic+Sciences+in+Memory+of+Alfred+Nobel+1993>\n133. Harvard's Laureates in Economic Science, 访问时间为 八月 6, 2025， <https://www.harvard.edu/about/history/nobel-laureates/economic-sciences/>\n134. 2023 prize lecture in economic sciences | Claudia Goldin - YouTube, 访问时间为 八月 6, 2025， <https://www.youtube.com/watch?v=RBkLI5i-OC8&pp=0gcJCdgAo7VqN5tD>\n135. The Sveriges Riksbank Prize in Economic Sciences in Memory of Alfred Nobel 1979, 访问时间为 八月 6, 2025， <https://www.nobelprize.org/prizes/economic-sciences/1979/summary/>\n136. Angus Deaton awarded the Prize in Economic Sciences 2015 - hhs.se - Handelshögskolan i Stockholm, 访问时间为 八月 6, 2025， <https://www.hhs.se/sv/om-oss/news/sse/2015/angus-deaton-awarded-the-prize-in-economic-sciences-2015-to/>\n137. The Sveriges Riksbank Prize in Economic Sciences in Memory of Alfred Nobel 2015, 访问时间为 八月 6, 2025， <https://www.kva.se/app/uploads/2022/06/AffischECOeng2015.pdf>\n138. Rethinking Economics or Rethinking My Economics by Angus Deaton - International Monetary Fund (IMF), 访问时间为 八月 6, 2025， <https://www.imf.org/en/Publications/fandd/issues/2024/03/Symposium-Rethinking-Economics-Angus-Deaton>\n139. Angus Deaton - Prize Lecture: Measuring and Understanding Behavior, Welfare, and Poverty, 访问时间为 八月 6, 2025， <https://www.nobelprize.org/uploads/2018/06/deaton-lecture.pdf>\n140. Sveriges Riksbank Prize in Economic Sciences 2019: Experimental Research, Development Economics and Poverty Reduction - Lindau Nobel Laureate Meetings, 访问时间为 八月 6, 2025， <https://www.lindau-nobel.org/blog-prize-in-economic-sciences-2019/>\n141. www.google.com, 访问时间为 八月 6, 2025， <https://www.google.com/search?q=Sveriges+Riksbank+Prize+in+Economic+Sciences+in+Memory+of+Alfred+Nobel+2019>\n142. Poverty Fighters: Abhijit Banerjee and Esther Duflo - IMF F&D, 访问时间为 八月 6, 2025， <https://www.imf.org/en/Publications/fandd/issues/2020/06/MIT-poverty-fighters-abhijit-banerjee-and-esther-duflo>\n143. Abhijit Banerjee – Prize Lecture - NobelPrize.org, 访问时间为 八月 6, 2025， <https://www.nobelprize.org/prizes/economic-sciences/2019/banerjee/lecture/>\n144. Esther Duflo - Prize lecture in economic sciences 2019, 访问时间为 八月 6, 2025， <https://www.nobelprize.org/uploads/2019/10/duflo-lecture.pdf>\n145. Research to help the world's poor - Nobel Prize, 访问时间为 八月 6, 2025， <https://www.nobelprize.org/uploads/2019/10/popular-economicsciencesprize2019.pdf>\n146. The Sveriges Riksbank Prize in Economic Sciences in Memory of Alfred Nobel 1978, 访问时间为 八月 6, 2025， <https://www.nobelprize.org/prizes/economic-sciences/1978/summary/>\n147. Daniel Kahneman - Nobel Lecture, 访问时间为 八月 6, 2025， <https://www.nobelprize.org/uploads/2018/06/kahnemann-lecture.pdf>\n148. Prize Lecture by Daniel Kahneman (38 minutes) - Media Player at Nobelprize.org, 访问时间为 八月 6, 2025， <https://mediaplayer.nobelprize.org/mediaplayer/?id=531>\n149. Daniel Kahneman – Prize Lecture - NobelPrize.org, 访问时间为 八月 6, 2025， <https://www.nobelprize.org/prizes/economic-sciences/2002/kahneman/lecture/>\n150. If you only read one Nobel Prize Acceptance Speech this week… - Four Cultures, 访问时间为 八月 6, 2025， <https://fourcultures.com/2009/02/03/if-you-only-read-one-nobel-prize-acceptance-speech-this-week%E2%80%A6/>\n151. The Prize in Economic Sciences 2017 - Kungl. Vetenskapsakademien, 访问时间为 八月 6, 2025， <https://www.kva.se/en/news/ekonomipriset-2017-2/>\n152. Announcement of the Sveriges Riksbank Prize in Economic Sciences in Memory of Alfred Nobel 2017 - YouTube, 访问时间为 八月 6, 2025， <https://www.youtube.com/watch?v=XeMoeyz7wQQ>\n153. Transcript from an interview with Richard H. Thaler - NobelPrize.org, 访问时间为 八月 6, 2025， <https://www.nobelprize.org/prizes/economic-sciences/2017/thaler/159673-richard-thaler-interview-transcript/>\n154. Richard H. Thaler – Prize Lecture - NobelPrize.org, 访问时间为 八月 6, 2025， <https://www.nobelprize.org/prizes/economic-sciences/2017/thaler/lecture/>\n155. Richard H. Thaler – Banquet speech - NobelPrize.org, 访问时间为 八月 6, 2025， <https://www.nobelprize.org/prizes/economic-sciences/2017/thaler/speech/>\n156. The Sveriges Riksbank Prize in Economic Sciences in Memory of Alfred Nobel 1992, 访问时间为 八月 6, 2025， <https://www.nobelprize.org/prizes/economic-sciences/1992/summary/>\n157. www.google.com, 访问时间为 八月 6, 2025， <https://www.google.com/search?q=Sveriges+Riksbank+Prize+in+Economic+Sciences+in+Memory+of+Alfred+Nobel+2009>\n158. The Contributions of Milton Friedman to Economics - Federal Reserve Bank of Richmond, 访问时间为 八月 6, 2025， <https://www.richmondfed.org/publications/research/economic_quarterly/2007/winter/hetzel>\n159. 2017 Prize Lecture in Economic Sciences - YouTube, 访问时间为 八月 6, 2025， <https://www.youtube.com/watch?v=tD_5MgjIr00>\n160. NSF congratulates laureates of the 2024 Nobel Prize in economics, 访问时间为 八月 6, 2025， <https://www.nsf.gov/news/nsf-congratulates-laureates-2024-nobel-prize-economics>\n161. The Sveriges Riksbank Prize in Economic Sciences in Memory of Alfred Nobel 1973, 访问时间为 八月 6, 2025， <https://www.nobelprize.org/prizes/economic-sciences/1973/summary/>\n162. The Sveriges Riksbank Prize in Economic Sciences in Memory of Alfred Nobel 1974, 访问时间为 八月 6, 2025， <https://www.nobelprize.org/prizes/economic-sciences/1974/summary/>\n163. The Sveriges Riksbank Prize in Economic Sciences in Memory of Alfred Nobel 1975, 访问时间为 八月 6, 2025， <https://www.nobelprize.org/prizes/economic-sciences/1975/summary/>\n164. The Sveriges Riksbank Prize in Economic Sciences in Memory of Alfred Nobel 1977, 访问时间为 八月 6, 2025， <https://www.nobelprize.org/prizes/economic-sciences/1977/summary/>\n165. The Sveriges Riksbank Prize in Economic Sciences in Memory of Alfred Nobel 1981, 访问时间为 八月 6, 2025， <https://www.nobelprize.org/prizes/economic-sciences/1981/summary/>\n166. The Sveriges Riksbank Prize in Economic Sciences in Memory of Alfred Nobel 1985, 访问时间为 八月 6, 2025， <https://www.nobelprize.org/prizes/economic-sciences/1985/summary/>\n167. The Sveriges Riksbank Prize in Economic Sciences in Memory of Alfred Nobel 1986, 访问时间为 八月 6, 2025， <https://www.nobelprize.org/prizes/economic-sciences/1986/summary/>\n168. The Sveriges Riksbank Prize in Economic Sciences in Memory of Alfred Nobel 1987, 访问时间为 八月 6, 2025， <https://www.nobelprize.org/prizes/economic-sciences/1987/summary/>\n169. The Sveriges Riksbank Prize in Economic Sciences in Memory of Alfred Nobel 1999, 访问时间为 八月 6, 2025， <https://www.nobelprize.org/prizes/economic-sciences/1999/summary/>\n170. The Sveriges Riksbank Prize in Economic Sciences in Memory of Alfred Nobel 2008, 访问时间为 八月 6, 2025， <https://www.nobelprize.org/prizes/economic-sciences/2008/summary/>\n171. Economics prize 2010 - Sveriges Riksbank, 访问时间为 八月 6, 2025， <https://archive.riksbank.se/en/Web-archive/Published/Notices/2010/Economics-prize-2010/index.html>\n",
  "all_source_links": [
    "http://archive.riksbank.se/en/Web-archive/Published/Notices/2009/Economics-prize-2009/index.html",
    "http://archive.riksbank.se/en/Web-archive/Published/Notices/2011/Economics-prize-2011/index.html",
    "http://paulgp.com/speeches/thaler_2016_aea.pdf",
    "https://accounts.google.com/SignOutOptions?hl=zh-CN&continue=https://gemini.google.com/app/b018ec52094f7b88&ec=GBRAkgU",
    "https://archive.riksbank.se/en/Web-archive/Published/Notices/2010/Economics-prize-2010/index.html",
    "https://cals.ncsu.edu/agricultural-and-resource-economics/wp-content/uploads/sites/46/2017/07/History-of-Development-Economics-Thought.pdf",
    "https://cris.huji.ac.il/en/prizes/the-sveriges-riksbank-prize-in-economic-sciences-in-memory-of-alf",
    "https://dashscope.aliyuncs.com/compatible-mode/v1",
    "https://ddd.uab.cat/pub/expbib/2015/146867/nobelecon/index.html.4",
    "https://developingeconomics.org/2024/10/22/the-nobel-illusion-why-the-nobel-prize-in-economics-needs-to-be-abolished",
    "https://econ.washington.edu/news/2016/03/16/annual-nobel-prize-lecture-explored-work-2015-laureate-angus-deaton",
    "https://egc.yale.edu/events/kuznets/kuznets-10",
    "https://en.wikipedia.org/wiki/2021_Nobel_Memorial_Prize_in_Economic_Sciences",
    "https://en.wikipedia.org/wiki/2022_Nobel_Memorial_Prize_in_Economic_Sciences",
    "https://en.wikipedia.org/wiki/Behavioral_economics",
    "https://en.wikipedia.org/wiki/Committee_for_the_Sveriges_Riksbank_Prize_in_Economic_Sciences_in_Memory_of_Alfred_Nobel",
    "https://en.wikipedia.org/wiki/Development_economics",
    "https://en.wikipedia.org/wiki/Economic_development",
    "https://en.wikipedia.org/wiki/G%C3%A9rard_Debreu",
    "https://en.wikipedia.org/wiki/Game_theory",
    "https://en.wikipedia.org/wiki/Game_theory#:~:text=Modern%20game%20theory%20began%20with,game%20theory%20and%20mathematical%20economics.",
    "https://en.wikipedia.org/wiki/General_equilibrium_theory",
    "https://en.wikipedia.org/wiki/Jean_Tirole",
    "https://en.wikipedia.org/wiki/John_Hicks",
    "https://en.wikipedia.org/wiki/List_of_Nobel_Memorial_Prize_laureates_in_Economic_Sciences",
    "https://en.wikipedia.org/wiki/Milton_Friedman",
    "https://en.wikipedia.org/wiki/Nobel_Memorial_Prize_in_Economic_Sciences",
    "https://en.wikipedia.org/wiki/Nobel_Prize",
    "https://en.wikipedia.org/wiki/Robert_Lucas_Jr.",
    "https://erc.org.in/uncategorized/the-nobel-prize-rewards-science-humanism-and-peace-efforts",
    "https://events.trinity.edu/event/nobel_lecture_series",
    "https://faculty.sites.iastate.edu/tesfatsi/archive/tesfatsi/Mishkin.RationalExpReview.pdf",
    "https://file.pide.org.pk/pdf/PDR/993/Volume4/631-638.pdf",
    "https://fourcultures.com/2009/02/03/if-you-only-read-one-nobel-prize-acceptance-speech-this-week%E2%80%A6",
    "https://ideas.repec.org/p/hhs/iiessp/0668.html",
    "https://ideas.repec.org/p/hhs/iuiwop/0517.html",
    "https://ideas.repec.org/p/ris/nobelp/1999_004.html",
    "https://ideas.repec.org/p/ris/nobelp/2023_002.html",
    "https://larspsyll.wordpress.com/2015/08/15/general-equilibrium-theory-a-gross-misallocation-of-intellectual-resources-and-time-2",
    "https://libertystreeteconomics.newyorkfed.org/2012/08/historical-echoes-whats-in-a-name-the-sveriges-riksbank-prize-in-economic-sciences-in-memory-of-alfr",
    "https://mediaplayer.nobelprize.org/mediaplayer/?id=531",
    "https://msuweb.montclair.edu/~lebelp/NobelPrizeWinnersinEconomi.html",
    "https://newsroom.wiley.com/press-releases/press-release-details/2013/Wiley-Congratulates-Winners-of-the-2013-Sveriges-Riksbank-Prize-in-Economic-Sciences/default.aspx",
    "https://oxfordre.com/americanhistory/display/10.1093/acrefore/9780199329175.001.0001/acrefore-9780199329175-e-903",
    "https://revistagt.fpl.emnuvens.com.br/get/article/view/2616",
    "https://shs.cairn.info/revue-d-economie-du-developpement-2014-HS01-page-9?lang=fr",
    "https://simple.wikipedia.org/wiki/List_of_Nobel_Prize_winners_in_Economics",
    "https://swopec.hhs.se/iuiwop/abs/iuiwop0517.htm",
    "https://testbook.com/question-answer/sveriges-riksbank-prize-in-economic-sciences-is-aw--5e073c851155380d0b679699",
    "https://timesofindia.indiatimes.com/world/us/taught-the-world-trade-economics-peter-navarro-says-donald-trump-deserves-nobel-in-economics-cites-global-overhaul/articleshow/123039089.cms",
    "https://treasury.gov.au/publication/economic-roundup-autumn-2006/brilliant-minds-the-nobel-prize-in-economics",
    "https://uen.pressbooks.pub/behavioraleconomics/front-matter/a-very-brief-history-of-the-origin-of-behavioral-economics",
    "https://www.aeaweb.org/about-aea/honors-awards/nobel-laureates",
    "https://www.artory.com/artists/hayek-1920th-century/the-sveriges-riksbank-prize-in-economic-sciences-in-NZXDMX7W",
    "https://www.britannica.com/money/Winners-of-the-Nobel-Prize-for-Economics",
    "https://www.cambridge.org/core/books/methodology-of-economics/keynesians-versus-monetarists/383E46FABAFEF3DA3A250B4B1FBDFA9F",
    "https://www.cambridge.org/core/journals/journal-of-the-history-of-economic-thought/article/friedmans-nobel-lecture-and-the-phillips-curve-myth/53838048E89566D2757A43A488439814",
    "https://www.cambridge.org/core/services/aop-cambridge-core/content/view/7081D0CD33937F3CB274DA558739A7C4/9781108838283apx_209-210.pdf/list_of_nobel_laureates.pdf",
    "https://www.chicagobooth.edu/faculty/nobel-laureates",
    "https://www.chicagobooth.edu/research/fama-miller/who-we-are/merton-miller",
    "https://www.ebsco.com/research-starters/history/nobel-memorial-prize-economic-sciences",
    "https://www.econlib.org/library/Enc/RationalExpectations.html",
    "https://www.econlib.org/library/Enc/bios/Friedman.html",
    "https://www.econlib.org/library/Enc/bios/Lucas.html",
    "https://www.economicshelp.org/blog/1113/concepts/keynesianism-vs-monetarism",
    "https://www.econstor.eu/bitstream/10419/75153/1/687547210.pdf",
    "https://www.exploring-economics.org/en/discover/nobel-memorial-prize-economics",
    "https://www.geni.com/projects/Nobel-Prize-in-Economics-The-Sveriges-Riksbank-Prize-in-Economic-Sciences-in-Memory-of-Alfred-Nobel/10374",
    "https://www.gla.ac.uk/explore/adamsmith300/events/tercentenaryweek/angusdeatonlecture",
    "https://www.global.hokudai.ac.jp/blog/32021",
    "https://www.google.com/search?q=Sveriges+Riksbank+Prize+in+Economic+Sciences+in+Memory+of+Alfred+Nobel+1975",
    "https://www.google.com/search?q=Sveriges+Riksbank+Prize+in+Economic+Sciences+in+Memory+of+Alfred+Nobel+1977",
    "https://www.google.com/search?q=Sveriges+Riksbank+Prize+in+Economic+Sciences+in+Memory+of+Alfred+Nobel+1979",
    "https://www.google.com/search?q=Sveriges+Riksbank+Prize+in+Economic+Sciences+in+Memory+of+Alfred+Nobel+1990",
    "https://www.google.com/search?q=Sveriges+Riksbank+Prize+in+Economic+Sciences+in+Memory+of+Alfred+Nobel+1993",
    "https://www.google.com/search?q=Sveriges+Riksbank+Prize+in+Economic+Sciences+in+Memory+of+Alfred+Nobel+1994",
    "https://www.google.com/search?q=Sveriges+Riksbank+Prize+in+Economic+Sciences+in+Memory+of+Alfred+Nobel+1996",
    "https://www.google.com/search?q=Sveriges+Riksbank+Prize+in+Economic+Sciences+in+Memory+of+Alfred+Nobel+1997",
    "https://www.google.com/search?q=Sveriges+Riksbank+Prize+in+Economic+Sciences+in+Memory+of+Alfred+Nobel+2001",
    "https://www.google.com/search?q=Sveriges+Riksbank+Prize+in+Economic+Sciences+in+Memory+of+Alfred+Nobel+2002",
    "https://www.google.com/search?q=Sveriges+Riksbank+Prize+in+Economic+Sciences+in+Memory+of+Alfred+Nobel+2003",
    "https://www.google.com/search?q=Sveriges+Riksbank+Prize+in+Economic+Sciences+in+Memory+of+Alfred+Nobel+2004",
    "https://www.google.com/search?q=Sveriges+Riksbank+Prize+in+Economic+Sciences+in+Memory+of+Alfred+Nobel+2005",
    "https://www.google.com/search?q=Sveriges+Riksbank+Prize+in+Economic+Sciences+in+Memory+of+Alfred+Nobel+2007",
    "https://www.google.com/search?q=Sveriges+Riksbank+Prize+in+Economic+Sciences+in+Memory+of+Alfred+Nobel+2009",
    "https://www.google.com/search?q=Sveriges+Riksbank+Prize+in+Economic+Sciences+in+Memory+of+Alfred+Nobel+2011",
    "https://www.google.com/search?q=Sveriges+Riksbank+Prize+in+Economic+Sciences+in+Memory+of+Alfred+Nobel+2012",
    "https://www.google.com/search?q=Sveriges+Riksbank+Prize+in+Economic+Sciences+in+Memory+of+Alfred+Nobel+2013",
    "https://www.google.com/search?q=Sveriges+Riksbank+Prize+in+Economic+Sciences+in+Memory+of+Alfred+Nobel+2016",
    "https://www.google.com/search?q=Sveriges+Riksbank+Prize+in+Economic+Sciences+in+Memory+of+Alfred+Nobel+2018",
    "https://www.google.com/search?q=Sveriges+Riksbank+Prize+in+Economic+Sciences+in+Memory+of+Alfred+Nobel+2019",
    "https://www.google.com/search?q=Sveriges+Riksbank+Prize+in+Economic+Sciences+in+Memory+of+Alfred+Nobel+2020",
    "https://www.google.com/search?q=Sveriges+Riksbank+Prize+in+Economic+Sciences+in+Memory+of+Alfred+Nobel+2021",
    "https://www.harvard.edu/about/history/nobel-laureates/economic-sciences",
    "https://www.hbs.edu/faculty/Pages/profile.aspx?facId=6511",
    "https://www.hec.edu/en/nobel-prize-economics-what-impact-research-and-society",
    "https://www.hhs.se/en/outreach/sse-initiatives/sse-and-the-and-the-nobel-prize",
    "https://www.hhs.se/sv/om-oss/news/sse/2015/angus-deaton-awarded-the-prize-in-economic-sciences-2015-to",
    "https://www.hoover.org/research/milton-friedmans-long-run-impact",
    "https://www.imf.org/en/Publications/fandd/issues/2020/06/MIT-poverty-fighters-abhijit-banerjee-and-esther-duflo",
    "https://www.imf.org/en/Publications/fandd/issues/2024/03/Symposium-Rethinking-Economics-Angus-Deaton",
    "https://www.ineteconomics.org/uploads/papers/1983-Keynesianism-Monetarism-and-Rational-Expectations-Some-Reflections-and-Conjectures_Individual-Forecasting-and-Aggregate-Outcomes.pdf",
    "https://www.informs.org/Explore/History-of-O.R.-Excellence/Biographical-Profiles/Markowitz-Harry",
    "https://www.innovations-report.com/global-finance/business-and-finance/report-71686",
    "https://www.investopedia.com/ask/answers/012615/what-difference-between-keynesian-economics-and-monetarist-economics.asp",
    "https://www.investopedia.com/ask/answers/012615/what-difference-between-keynesian-economics-and-monetarist-economics.asp#:~:text=Monetarists%20believe%20in%20controlling%20the,buy%20more%20goods%20and%20services.",
    "https://www.investopedia.com/terms/m/monetarism.asp",
    "https://www.investopedia.com/terms/n/nobel-memorial-prize-in-economic-sciences.asp",
    "https://www.investopedia.com/terms/r/rationaltheoryofexpectations.asp",
    "https://www.journals.uchicago.edu/doi/abs/10.1086/260579",
    "https://www.kellogg.northwestern.edu/faculty/hubbard/htm/research/97nobel2.htm",
    "https://www.kva.se/app/uploads/2022/06/AffischECOeng2015.pdf",
    "https://www.kva.se/app/uploads/2022/06/globalassets-priser-nobel-2001-popeken01.pdf",
    "https://www.kva.se/en/news/ekonomipriset-2007-2",
    "https://www.kva.se/en/news/ekonomipriset-2010-2",
    "https://www.kva.se/en/news/ekonomipriset-2017-2",
    "https://www.kva.se/en/news/ekonomipriset-2018-2",
    "https://www.kva.se/en/prizes/prize-in-economic-sciences",
    "https://www.lindau-nobel.org/blog-prize-in-economic-sciences-2019",
    "https://www.math.utoronto.ca/mccann/1855/papers/stiglitz-Nobel-lecture01.pdf",
    "https://www.mercatus.org/research/policy-briefs/what-would-milton-friedman-say-about-market-monetarism",
    "https://www.nber.org/nber-news/nobel-laureates",
    "https://www.nber.org/news/robert-c-merton-and-myron-s-scholes-won-1997-nobel-prize-finding-ways-value-stock-options-and-other",
    "https://www.ncbi.nlm.nih.gov/books/NBK593518",
    "https://www.newsweek.com/nobel-prize-winners-react-trump-economics-2107563",
    "https://www.nobelprize.org/nomination/economic-sciences",
    "https://www.nobelprize.org/page/45/?np-prize-category=economic-sciences",
    "https://www.nobelprize.org/page/62/?np-content-type=lecture",
    "https://www.nobelprize.org/prizes/economic-sciences",
    "https://www.nobelprize.org/prizes/economic-sciences/1970/summary",
    "https://www.nobelprize.org/prizes/economic-sciences/1971/summary",
    "https://www.nobelprize.org/prizes/economic-sciences/1972/hicks/lecture/Tobin",
    "https://www.nobelprize.org/prizes/economic-sciences/1972/summary",
    "https://www.nobelprize.org/prizes/economic-sciences/1973/press-release",
    "https://www.nobelprize.org/prizes/economic-sciences/1973/summary",
    "https://www.nobelprize.org/prizes/economic-sciences/1974/ceremony-speech",
    "https://www.nobelprize.org/prizes/economic-sciences/1974/summary",
    "https://www.nobelprize.org/prizes/economic-sciences/1975/press-release",
    "https://www.nobelprize.org/prizes/economic-sciences/1975/summary",
    "https://www.nobelprize.org/prizes/economic-sciences/1976/ceremony-speech",
    "https://www.nobelprize.org/prizes/economic-sciences/1976/friedman/facts",
    "https://www.nobelprize.org/prizes/economic-sciences/1976/friedman/lecture",
    "https://www.nobelprize.org/prizes/economic-sciences/1976/summary",
    "https://www.nobelprize.org/prizes/economic-sciences/1977/press-release",
    "https://www.nobelprize.org/prizes/economic-sciences/1977/summary",
    "https://www.nobelprize.org/prizes/economic-sciences/1978/summary",
    "https://www.nobelprize.org/prizes/economic-sciences/1979/summary",
    "https://www.nobelprize.org/prizes/economic-sciences/1980/summary",
    "https://www.nobelprize.org/prizes/economic-sciences/1981/summary",
    "https://www.nobelprize.org/prizes/economic-sciences/1982/summary",
    "https://www.nobelprize.org/prizes/economic-sciences/1983/ceremony-speech",
    "https://www.nobelprize.org/prizes/economic-sciences/1983/debreu/lecture",
    "https://www.nobelprize.org/prizes/economic-sciences/1983/press-release",
    "https://www.nobelprize.org/prizes/economic-sciences/1983/summary",
    "https://www.nobelprize.org/prizes/economic-sciences/1984/summary",
    "https://www.nobelprize.org/prizes/economic-sciences/1985/summary",
    "https://www.nobelprize.org/prizes/economic-sciences/1986/summary",
    "https://www.nobelprize.org/prizes/economic-sciences/1987/summary",
    "https://www.nobelprize.org/prizes/economic-sciences/1988/summary",
    "https://www.nobelprize.org/prizes/economic-sciences/1990/markowitz/lecture",
    "https://www.nobelprize.org/prizes/economic-sciences/1990/sharpe/lecture",
    "https://www.nobelprize.org/prizes/economic-sciences/1990/summary",
    "https://www.nobelprize.org/prizes/economic-sciences/1991/summary",
    "https://www.nobelprize.org/prizes/economic-sciences/1992/summary",
    "https://www.nobelprize.org/prizes/economic-sciences/1993/summary",
    "https://www.nobelprize.org/prizes/economic-sciences/1994/ceremony-speech",
    "https://www.nobelprize.org/prizes/economic-sciences/1994/harsanyi/lecture",
    "https://www.nobelprize.org/prizes/economic-sciences/1994/selten/lecture",
    "https://www.nobelprize.org/prizes/economic-sciences/1994/summary",
    "https://www.nobelprize.org/prizes/economic-sciences/1995/ceremony-speech",
    "https://www.nobelprize.org/prizes/economic-sciences/1995/lucas/lecture",
    "https://www.nobelprize.org/prizes/economic-sciences/1995/summary",
    "https://www.nobelprize.org/prizes/economic-sciences/1996/summary",
    "https://www.nobelprize.org/prizes/economic-sciences/1997/merton/lecture",
    "https://www.nobelprize.org/prizes/economic-sciences/1997/press-release",
    "https://www.nobelprize.org/prizes/economic-sciences/1997/scholes/lecture",
    "https://www.nobelprize.org/prizes/economic-sciences/1998/banquet-video",
    "https://www.nobelprize.org/prizes/economic-sciences/1998/sen/lecture",
    "https://www.nobelprize.org/prizes/economic-sciences/1998/sen/speech",
    "https://www.nobelprize.org/prizes/economic-sciences/1998/summary",
    "https://www.nobelprize.org/prizes/economic-sciences/1999/summary",
    "https://www.nobelprize.org/prizes/economic-sciences/2000/summary",
    "https://www.nobelprize.org/prizes/economic-sciences/2001/akerlof/lecture",
    "https://www.nobelprize.org/prizes/economic-sciences/2001/press-release",
    "https://www.nobelprize.org/prizes/economic-sciences/2001/spence/lecture",
    "https://www.nobelprize.org/prizes/economic-sciences/2002/banquet-video",
    "https://www.nobelprize.org/prizes/economic-sciences/2002/kahneman/lecture",
    "https://www.nobelprize.org/prizes/economic-sciences/2002/kahneman/lecture/%20style=color:",
    "https://www.nobelprize.org/prizes/economic-sciences/2003/banquet-video",
    "https://www.nobelprize.org/prizes/economic-sciences/2003/prize-announcement",
    "https://www.nobelprize.org/prizes/economic-sciences/2004/banquet-video",
    "https://www.nobelprize.org/prizes/economic-sciences/2004/press-release",
    "https://www.nobelprize.org/prizes/economic-sciences/2005/summary",
    "https://www.nobelprize.org/prizes/economic-sciences/2006/summary",
    "https://www.nobelprize.org/prizes/economic-sciences/2007/summary",
    "https://www.nobelprize.org/prizes/economic-sciences/2008/summary",
    "https://www.nobelprize.org/prizes/economic-sciences/2015/deaton/lecture",
    "https://www.nobelprize.org/prizes/economic-sciences/2016/summary",
    "https://www.nobelprize.org/prizes/economic-sciences/2017/thaler/159673-richard-thaler-interview-transcript",
    "https://www.nobelprize.org/prizes/economic-sciences/2017/thaler/lecture",
    "https://www.nobelprize.org/prizes/economic-sciences/2017/thaler/speech",
    "https://www.nobelprize.org/prizes/economic-sciences/2019/banerjee/lecture",
    "https://www.nobelprize.org/prizes/economic-sciences/2024/advanced-information",
    "https://www.nobelprize.org/prizes/economic-sciences/2024/popular-information",
    "https://www.nobelprize.org/prizes/economic-sciences/2024/press-release",
    "https://www.nobelprize.org/prizes/economic-sciences/2024/summary",
    "https://www.nobelprize.org/prizes/lists/all-nobel-prizes",
    "https://www.nobelprize.org/prizes/lists/all-prizes-in-economic-sciences",
    "https://www.nobelprize.org/prizes/lists/all-prizes-in-economic-sciences/all",
    "https://www.nobelprize.org/prizes/lists/video-prize-lectures-from-laureates-in-economic-sciences",
    "https://www.nobelprize.org/uploads/2017/05/nash-lecture.pdf",
    "https://www.nobelprize.org/uploads/2018/06/akerlof-lecture.pdf",
    "https://www.nobelprize.org/uploads/2018/06/arrow-lecture.pdf",
    "https://www.nobelprize.org/uploads/2018/06/deaton-lecture.pdf",
    "https://www.nobelprize.org/uploads/2018/06/debreu-lecture.pdf",
    "https://www.nobelprize.org/uploads/2018/06/friedman-lecture-1.pdf",
    "https://www.nobelprize.org/uploads/2018/06/harsanyi-lecture.pdf",
    "https://www.nobelprize.org/uploads/2018/06/kahnemann-lecture.pdf",
    "https://www.nobelprize.org/uploads/2018/06/lucas-lecture.pdf",
    "https://www.nobelprize.org/uploads/2018/06/markowitz-lecture.pdf",
    "https://www.nobelprize.org/uploads/2018/06/miller-lecture.pdf",
    "https://www.nobelprize.org/uploads/2018/06/popular-economicsciences2013-1.pdf",
    "https://www.nobelprize.org/uploads/2018/06/scholes-lecture.pdf",
    "https://www.nobelprize.org/uploads/2018/06/selten-lecture.pdf",
    "https://www.nobelprize.org/uploads/2018/06/sen-lecture.pdf",
    "https://www.nobelprize.org/uploads/2018/06/sharpe-lecture.pdf",
    "https://www.nobelprize.org/uploads/2018/06/spence-lecture.pdf",
    "https://www.nobelprize.org/uploads/2018/06/stiglitz-lecture.pdf",
    "https://www.nobelprize.org/uploads/2019/10/duflo-lecture.pdf",
    "https://www.nobelprize.org/uploads/2019/10/popular-economicsciencesprize2019.pdf",
    "https://www.nrmpinternational.org/wp-content/uploads/2021/10/The-Sveriges-Riksbank-Prize-in-Economic-Sciences-in-Memory-of-Alfred-Nobel1.pdf",
    "https://www.nsf.gov/about/history/nobel-prizes",
    "https://www.nsf.gov/news/nsf-congratulates-laureates-2024-nobel-prize-economics",
    "https://www.raptisrarebooks.com/the-nobel-prize-in-economics",
    "https://www.remi.com/news/2024-economics-nobel-prize-winners",
    "https://www.researchgate.net/publication/264729212_The_Sveriges_Riksbank_Prize_in_Economic_Sciences_in_Memory_of_Alfred_Nobel_2013_Eugene_F_Fama_Lars_Peter_Hansen_Robert_J_Shiller_A_brief_review",
    "https://www.researchgate.net/publication/312444618_Sveriges_Riksbank_Prize_in_Economic_Sciences_in_Memory_of_Alfred_Nobel",
    "https://www.researchgate.net/publication/46448830_The_Sveriges_Riksbank_Prize_in_Economic_Sciences_in_Memory_of_Alfred_Nobel_1969-2007",
    "https://www.researchgate.net/publication/4901891_The_Prize_in_Economic_Science_in_Memory_of_Alfred_Nobel",
    "https://www.richmondfed.org/publications/research/economic_quarterly/2007/winter/hetzel",
    "https://www.riksbank.se/en-gb/about-the-riksbank/the-tasks-of-the-riksbank/research/economics-prize",
    "https://www.riksbank.se/en-gb/press-and-published/notices-and-press-releases/notices/2020/paul-r.-milgrom-and-robert-b.-wilson-awarded-the-prize-in-economic-sciences-for-2020",
    "https://www.riksbank.se/en-gb/press-and-published/notices-and-press-releases/notices/2022/ben-s.-bernanke-douglas-w.-diamond-and-philip-h.-dybvigawarded-the-prize-in-economic-sciences-for-2022",
    "https://www.riksbank.se/en-gb/press-and-published/notices-and-press-releases/notices/2024/daron-acemoglu-simon-johnson-and-james-a.-robinson-are-awarded-the-prize-in-economic-sciences-2024",
    "https://www.russellsage.org/research/behavioral-economics-detailed",
    "https://www.superprof.com/blog/nobel-prize-economics",
    "https://www.tandfonline.com/doi/pdf/10.1080/01603477.1984.11489447",
    "https://www.tholden.org/industrial%20organization%202014-15/jean-tirole-wins-the-2014-sveriges-riksbank-prize-in-economic-sciences-in-memory-of-alfred-nobel",
    "https://www.unwe.bg/en/pages/18265/nobel-prize-in-economic-sciences.html",
    "https://www.vedantu.com/commerce/difference-between-keynesian-economics-and-monetarist-economics",
    "https://www.wider.unu.edu/video/wider-annual-lecture-nobel-laureate-amartya-sen",
    "https://www.wikiwand.com/en/articles/Committee_for_the_Sveriges_Riksbank_Prize_in_Economic_Sciences_in_Memory_of_Alfred_Nobel",
    "https://www.worldscientific.com/doi/10.1142/9789810248543_0010",
    "https://www.youtube.com/watch?v=6ivwtz7cPwg",
    "https://www.youtube.com/watch?v=GX55YHSjZWA",
    "https://www.youtube.com/watch?v=MVr2uWMjoPk",
    "https://www.youtube.com/watch?v=RBkLI5i-OC8&pp=0gcJCdgAo7VqN5tD",
    "https://www.youtube.com/watch?v=XeMoeyz7wQQ",
    "https://www.youtube.com/watch?v=YaAupG_rPQg",
    "https://www.youtube.com/watch?v=sI-KAuX9yCU",
    "https://www.youtube.com/watch?v=tD_5MgjIr00",
    "https://www.youtube.com/watch?v=tcHNkk_wb7I"
  ],
  "summary_citations": [
    "http://archive.riksbank.se/en/Web-archive/Published/Notices/2009/Economics-prize-2009/index.html",
    "http://archive.riksbank.se/en/Web-archive/Published/Notices/2011/Economics-prize-2011/index.html",
    "http://paulgp.com/speeches/thaler_2016_aea.pdf",
    "https://accounts.google.com/SignOutOptions?hl=zh-CN&continue=https://gemini.google.com/app/b018ec52094f7b88&ec=GBRAkgU",
    "https://archive.riksbank.se/en/Web-archive/Published/Notices/2010/Economics-prize-2010/index.html",
    "https://cals.ncsu.edu/agricultural-and-resource-economics/wp-content/uploads/sites/46/2017/07/History-of-Development-Economics-Thought.pdf",
    "https://cris.huji.ac.il/en/prizes/the-sveriges-riksbank-prize-in-economic-sciences-in-memory-of-alf",
    "https://dashscope.aliyuncs.com/compatible-mode/v1",
    "https://ddd.uab.cat/pub/expbib/2015/146867/nobelecon/index.html.4",
    "https://developingeconomics.org/2024/10/22/the-nobel-illusion-why-the-nobel-prize-in-economics-needs-to-be-abolished",
    "https://econ.washington.edu/news/2016/03/16/annual-nobel-prize-lecture-explored-work-2015-laureate-angus-deaton",
    "https://egc.yale.edu/events/kuznets/kuznets-10",
    "https://en.wikipedia.org/wiki/2021_Nobel_Memorial_Prize_in_Economic_Sciences",
    "https://en.wikipedia.org/wiki/2022_Nobel_Memorial_Prize_in_Economic_Sciences",
    "https://en.wikipedia.org/wiki/Behavioral_economics",
    "https://en.wikipedia.org/wiki/Committee_for_the_Sveriges_Riksbank_Prize_in_Economic_Sciences_in_Memory_of_Alfred_Nobel",
    "https://en.wikipedia.org/wiki/Development_economics",
    "https://en.wikipedia.org/wiki/Economic_development",
    "https://en.wikipedia.org/wiki/G%C3%A9rard_Debreu",
    "https://en.wikipedia.org/wiki/Game_theory",
    "https://en.wikipedia.org/wiki/Game_theory#:~:text=Modern%20game%20theory%20began%20with,game%20theory%20and%20mathematical%20economics.",
    "https://en.wikipedia.org/wiki/General_equilibrium_theory",
    "https://en.wikipedia.org/wiki/Jean_Tirole",
    "https://en.wikipedia.org/wiki/John_Hicks",
    "https://en.wikipedia.org/wiki/List_of_Nobel_Memorial_Prize_laureates_in_Economic_Sciences",
    "https://en.wikipedia.org/wiki/Milton_Friedman",
    "https://en.wikipedia.org/wiki/Nobel_Memorial_Prize_in_Economic_Sciences",
    "https://en.wikipedia.org/wiki/Nobel_Prize",
    "https://en.wikipedia.org/wiki/Robert_Lucas_Jr.",
    "https://erc.org.in/uncategorized/the-nobel-prize-rewards-science-humanism-and-peace-efforts",
    "https://events.trinity.edu/event/nobel_lecture_series",
    "https://faculty.sites.iastate.edu/tesfatsi/archive/tesfatsi/Mishkin.RationalExpReview.pdf",
    "https://file.pide.org.pk/pdf/PDR/993/Volume4/631-638.pdf",
    "https://fourcultures.com/2009/02/03/if-you-only-read-one-nobel-prize-acceptance-speech-this-week%E2%80%A6",
    "https://ideas.repec.org/p/hhs/iiessp/0668.html",
    "https://ideas.repec.org/p/hhs/iuiwop/0517.html",
    "https://ideas.repec.org/p/ris/nobelp/1999_004.html",
    "https://ideas.repec.org/p/ris/nobelp/2023_002.html",
    "https://larspsyll.wordpress.com/2015/08/15/general-equilibrium-theory-a-gross-misallocation-of-intellectual-resources-and-time-2",
    "https://libertystreeteconomics.newyorkfed.org/2012/08/historical-echoes-whats-in-a-name-the-sveriges-riksbank-prize-in-economic-sciences-in-memory-of-alfr",
    "https://mediaplayer.nobelprize.org/mediaplayer/?id=531",
    "https://msuweb.montclair.edu/~lebelp/NobelPrizeWinnersinEconomi.html",
    "https://newsroom.wiley.com/press-releases/press-release-details/2013/Wiley-Congratulates-Winners-of-the-2013-Sveriges-Riksbank-Prize-in-Economic-Sciences/default.aspx",
    "https://oxfordre.com/americanhistory/display/10.1093/acrefore/9780199329175.001.0001/acrefore-9780199329175-e-903",
    "https://revistagt.fpl.emnuvens.com.br/get/article/view/2616",
    "https://shs.cairn.info/revue-d-economie-du-developpement-2014-HS01-page-9?lang=fr",
    "https://simple.wikipedia.org/wiki/List_of_Nobel_Prize_winners_in_Economics",
    "https://swopec.hhs.se/iuiwop/abs/iuiwop0517.htm",
    "https://testbook.com/question-answer/sveriges-riksbank-prize-in-economic-sciences-is-aw--5e073c851155380d0b679699",
    "https://timesofindia.indiatimes.com/world/us/taught-the-world-trade-economics-peter-navarro-says-donald-trump-deserves-nobel-in-economics-cites-global-overhaul/articleshow/123039089.cms",
    "https://treasury.gov.au/publication/economic-roundup-autumn-2006/brilliant-minds-the-nobel-prize-in-economics",
    "https://uen.pressbooks.pub/behavioraleconomics/front-matter/a-very-brief-history-of-the-origin-of-behavioral-economics",
    "https://www.aeaweb.org/about-aea/honors-awards/nobel-laureates",
    "https://www.artory.com/artists/hayek-1920th-century/the-sveriges-riksbank-prize-in-economic-sciences-in-NZXDMX7W",
    "https://www.britannica.com/money/Winners-of-the-Nobel-Prize-for-Economics",
    "https://www.cambridge.org/core/books/methodology-of-economics/keynesians-versus-monetarists/383E46FABAFEF3DA3A250B4B1FBDFA9F",
    "https://www.cambridge.org/core/journals/journal-of-the-history-of-economic-thought/article/friedmans-nobel-lecture-and-the-phillips-curve-myth/53838048E89566D2757A43A488439814",
    "https://www.cambridge.org/core/services/aop-cambridge-core/content/view/7081D0CD33937F3CB274DA558739A7C4/9781108838283apx_209-210.pdf/list_of_nobel_laureates.pdf",
    "https://www.chicagobooth.edu/faculty/nobel-laureates",
    "https://www.chicagobooth.edu/research/fama-miller/who-we-are/merton-miller",
    "https://www.ebsco.com/research-starters/history/nobel-memorial-prize-economic-sciences",
    "https://www.econlib.org/library/Enc/RationalExpectations.html",
    "https://www.econlib.org/library/Enc/bios/Friedman.html",
    "https://www.econlib.org/library/Enc/bios/Lucas.html",
    "https://www.economicshelp.org/blog/1113/concepts/keynesianism-vs-monetarism",
    "https://www.econstor.eu/bitstream/10419/75153/1/687547210.pdf",
    "https://www.exploring-economics.org/en/discover/nobel-memorial-prize-economics",
    "https://www.geni.com/projects/Nobel-Prize-in-Economics-The-Sveriges-Riksbank-Prize-in-Economic-Sciences-in-Memory-of-Alfred-Nobel/10374",
    "https://www.gla.ac.uk/explore/adamsmith300/events/tercentenaryweek/angusdeatonlecture",
    "https://www.global.hokudai.ac.jp/blog/32021",
    "https://www.google.com/search?q=Sveriges+Riksbank+Prize+in+Economic+Sciences+in+Memory+of+Alfred+Nobel+1975",
    "https://www.google.com/search?q=Sveriges+Riksbank+Prize+in+Economic+Sciences+in+Memory+of+Alfred+Nobel+1977",
    "https://www.google.com/search?q=Sveriges+Riksbank+Prize+in+Economic+Sciences+in+Memory+of+Alfred+Nobel+1979",
    "https://www.google.com/search?q=Sveriges+Riksbank+Prize+in+Economic+Sciences+in+Memory+of+Alfred+Nobel+1990",
    "https://www.google.com/search?q=Sveriges+Riksbank+Prize+in+Economic+Sciences+in+Memory+of+Alfred+Nobel+1993",
    "https://www.google.com/search?q=Sveriges+Riksbank+Prize+in+Economic+Sciences+in+Memory+of+Alfred+Nobel+1994",
    "https://www.google.com/search?q=Sveriges+Riksbank+Prize+in+Economic+Sciences+in+Memory+of+Alfred+Nobel+1996",
    "https://www.google.com/search?q=Sveriges+Riksbank+Prize+in+Economic+Sciences+in+Memory+of+Alfred+Nobel+1997",
    "https://www.google.com/search?q=Sveriges+Riksbank+Prize+in+Economic+Sciences+in+Memory+of+Alfred+Nobel+2001",
    "https://www.google.com/search?q=Sveriges+Riksbank+Prize+in+Economic+Sciences+in+Memory+of+Alfred+Nobel+2002",
    "https://www.google.com/search?q=Sveriges+Riksbank+Prize+in+Economic+Sciences+in+Memory+of+Alfred+Nobel+2003",
    "https://www.google.com/search?q=Sveriges+Riksbank+Prize+in+Economic+Sciences+in+Memory+of+Alfred+Nobel+2004",
    "https://www.google.com/search?q=Sveriges+Riksbank+Prize+in+Economic+Sciences+in+Memory+of+Alfred+Nobel+2005",
    "https://www.google.com/search?q=Sveriges+Riksbank+Prize+in+Economic+Sciences+in+Memory+of+Alfred+Nobel+2007",
    "https://www.google.com/search?q=Sveriges+Riksbank+Prize+in+Economic+Sciences+in+Memory+of+Alfred+Nobel+2009",
    "https://www.google.com/search?q=Sveriges+Riksbank+Prize+in+Economic+Sciences+in+Memory+of+Alfred+Nobel+2011",
    "https://www.google.com/search?q=Sveriges+Riksbank+Prize+in+Economic+Sciences+in+Memory+of+Alfred+Nobel+2012",
    "https://www.google.com/search?q=Sveriges+Riksbank+Prize+in+Economic+Sciences+in+Memory+of+Alfred+Nobel+2013",
    "https://www.google.com/search?q=Sveriges+Riksbank+Prize+in+Economic+Sciences+in+Memory+of+Alfred+Nobel+2016",
    "https://www.google.com/search?q=Sveriges+Riksbank+Prize+in+Economic+Sciences+in+Memory+of+Alfred+Nobel+2018",
    "https://www.google.com/search?q=Sveriges+Riksbank+Prize+in+Economic+Sciences+in+Memory+of+Alfred+Nobel+2019",
    "https://www.google.com/search?q=Sveriges+Riksbank+Prize+in+Economic+Sciences+in+Memory+of+Alfred+Nobel+2020",
    "https://www.google.com/search?q=Sveriges+Riksbank+Prize+in+Economic+Sciences+in+Memory+of+Alfred+Nobel+2021",
    "https://www.harvard.edu/about/history/nobel-laureates/economic-sciences",
    "https://www.hbs.edu/faculty/Pages/profile.aspx?facId=6511",
    "https://www.hec.edu/en/nobel-prize-economics-what-impact-research-and-society",
    "https://www.hhs.se/en/outreach/sse-initiatives/sse-and-the-and-the-nobel-prize",
    "https://www.hhs.se/sv/om-oss/news/sse/2015/angus-deaton-awarded-the-prize-in-economic-sciences-2015-to",
    "https://www.hoover.org/research/milton-friedmans-long-run-impact",
    "https://www.imf.org/en/Publications/fandd/issues/2020/06/MIT-poverty-fighters-abhijit-banerjee-and-esther-duflo",
    "https://www.imf.org/en/Publications/fandd/issues/2024/03/Symposium-Rethinking-Economics-Angus-Deaton",
    "https://www.ineteconomics.org/uploads/papers/1983-Keynesianism-Monetarism-and-Rational-Expectations-Some-Reflections-and-Conjectures_Individual-Forecasting-and-Aggregate-Outcomes.pdf",
    "https://www.informs.org/Explore/History-of-O.R.-Excellence/Biographical-Profiles/Markowitz-Harry",
    "https://www.innovations-report.com/global-finance/business-and-finance/report-71686",
    "https://www.investopedia.com/ask/answers/012615/what-difference-between-keynesian-economics-and-monetarist-economics.asp",
    "https://www.investopedia.com/ask/answers/012615/what-difference-between-keynesian-economics-and-monetarist-economics.asp#:~:text=Monetarists%20believe%20in%20controlling%20the,buy%20more%20goods%20and%20services.",
    "https://www.investopedia.com/terms/m/monetarism.asp",
    "https://www.investopedia.com/terms/n/nobel-memorial-prize-in-economic-sciences.asp",
    "https://www.investopedia.com/terms/r/rationaltheoryofexpectations.asp",
    "https://www.journals.uchicago.edu/doi/abs/10.1086/260579",
    "https://www.kellogg.northwestern.edu/faculty/hubbard/htm/research/97nobel2.htm",
    "https://www.kva.se/app/uploads/2022/06/AffischECOeng2015.pdf",
    "https://www.kva.se/app/uploads/2022/06/globalassets-priser-nobel-2001-popeken01.pdf",
    "https://www.kva.se/en/news/ekonomipriset-2007-2",
    "https://www.kva.se/en/news/ekonomipriset-2010-2",
    "https://www.kva.se/en/news/ekonomipriset-2017-2",
    "https://www.kva.se/en/news/ekonomipriset-2018-2",
    "https://www.kva.se/en/prizes/prize-in-economic-sciences",
    "https://www.lindau-nobel.org/blog-prize-in-economic-sciences-2019",
    "https://www.math.utoronto.ca/mccann/1855/papers/stiglitz-Nobel-lecture01.pdf",
    "https://www.mercatus.org/research/policy-briefs/what-would-milton-friedman-say-about-market-monetarism",
    "https://www.nber.org/nber-news/nobel-laureates",
    "https://www.nber.org/news/robert-c-merton-and-myron-s-scholes-won-1997-nobel-prize-finding-ways-value-stock-options-and-other",
    "https://www.ncbi.nlm.nih.gov/books/NBK593518",
    "https://www.newsweek.com/nobel-prize-winners-react-trump-economics-2107563",
    "https://www.nobelprize.org/nomination/economic-sciences",
    "https://www.nobelprize.org/page/45/?np-prize-category=economic-sciences",
    "https://www.nobelprize.org/page/62/?np-content-type=lecture",
    "https://www.nobelprize.org/prizes/economic-sciences",
    "https://www.nobelprize.org/prizes/economic-sciences/1970/summary",
    "https://www.nobelprize.org/prizes/economic-sciences/1971/summary",
    "https://www.nobelprize.org/prizes/economic-sciences/1972/hicks/lecture/Tobin",
    "https://www.nobelprize.org/prizes/economic-sciences/1972/summary",
    "https://www.nobelprize.org/prizes/economic-sciences/1973/press-release",
    "https://www.nobelprize.org/prizes/economic-sciences/1973/summary",
    "https://www.nobelprize.org/prizes/economic-sciences/1974/ceremony-speech",
    "https://www.nobelprize.org/prizes/economic-sciences/1974/summary",
    "https://www.nobelprize.org/prizes/economic-sciences/1975/press-release",
    "https://www.nobelprize.org/prizes/economic-sciences/1975/summary",
    "https://www.nobelprize.org/prizes/economic-sciences/1976/ceremony-speech",
    "https://www.nobelprize.org/prizes/economic-sciences/1976/friedman/facts",
    "https://www.nobelprize.org/prizes/economic-sciences/1976/friedman/lecture",
    "https://www.nobelprize.org/prizes/economic-sciences/1976/summary",
    "https://www.nobelprize.org/prizes/economic-sciences/1977/press-release",
    "https://www.nobelprize.org/prizes/economic-sciences/1977/summary",
    "https://www.nobelprize.org/prizes/economic-sciences/1978/summary",
    "https://www.nobelprize.org/prizes/economic-sciences/1979/summary",
    "https://www.nobelprize.org/prizes/economic-sciences/1980/summary",
    "https://www.nobelprize.org/prizes/economic-sciences/1981/summary",
    "https://www.nobelprize.org/prizes/economic-sciences/1982/summary",
    "https://www.nobelprize.org/prizes/economic-sciences/1983/ceremony-speech",
    "https://www.nobelprize.org/prizes/economic-sciences/1983/debreu/lecture",
    "https://www.nobelprize.org/prizes/economic-sciences/1983/press-release",
    "https://www.nobelprize.org/prizes/economic-sciences/1983/summary",
    "https://www.nobelprize.org/prizes/economic-sciences/1984/summary",
    "https://www.nobelprize.org/prizes/economic-sciences/1985/summary",
    "https://www.nobelprize.org/prizes/economic-sciences/1986/summary",
    "https://www.nobelprize.org/prizes/economic-sciences/1987/summary",
    "https://www.nobelprize.org/prizes/economic-sciences/1988/summary",
    "https://www.nobelprize.org/prizes/economic-sciences/1990/markowitz/lecture",
    "https://www.nobelprize.org/prizes/economic-sciences/1990/sharpe/lecture",
    "https://www.nobelprize.org/prizes/economic-sciences/1990/summary",
    "https://www.nobelprize.org/prizes/economic-sciences/1991/summary",
    "https://www.nobelprize.org/prizes/economic-sciences/1992/summary",
    "https://www.nobelprize.org/prizes/economic-sciences/1993/summary",
    "https://www.nobelprize.org/prizes/economic-sciences/1994/ceremony-speech",
    "https://www.nobelprize.org/prizes/economic-sciences/1994/harsanyi/lecture",
    "https://www.nobelprize.org/prizes/economic-sciences/1994/selten/lecture",
    "https://www.nobelprize.org/prizes/economic-sciences/1994/summary",
    "https://www.nobelprize.org/prizes/economic-sciences/1995/ceremony-speech",
    "https://www.nobelprize.org/prizes/economic-sciences/1995/lucas/lecture",
    "https://www.nobelprize.org/prizes/economic-sciences/1995/summary",
    "https://www.nobelprize.org/prizes/economic-sciences/1996/summary",
    "https://www.nobelprize.org/prizes/economic-sciences/1997/merton/lecture",
    "https://www.nobelprize.org/prizes/economic-sciences/1997/press-release",
    "https://www.nobelprize.org/prizes/economic-sciences/1997/scholes/lecture",
    "https://www.nobelprize.org/prizes/economic-sciences/1998/banquet-video",
    "https://www.nobelprize.org/prizes/economic-sciences/1998/sen/lecture",
    "https://www.nobelprize.org/prizes/economic-sciences/1998/sen/speech",
    "https://www.nobelprize.org/prizes/economic-sciences/1998/summary",
    "https://www.nobelprize.org/prizes/economic-sciences/1999/summary",
    "https://www.nobelprize.org/prizes/economic-sciences/2000/summary",
    "https://www.nobelprize.org/prizes/economic-sciences/2001/akerlof/lecture",
    "https://www.nobelprize.org/prizes/economic-sciences/2001/press-release",
    "https://www.nobelprize.org/prizes/economic-sciences/2001/spence/lecture",
    "https://www.nobelprize.org/prizes/economic-sciences/2002/banquet-video",
    "https://www.nobelprize.org/prizes/economic-sciences/2002/kahneman/lecture",
    "https://www.nobelprize.org/prizes/economic-sciences/2002/kahneman/lecture/%20style=color:",
    "https://www.nobelprize.org/prizes/economic-sciences/2003/banquet-video",
    "https://www.nobelprize.org/prizes/economic-sciences/2003/prize-announcement",
    "https://www.nobelprize.org/prizes/economic-sciences/2004/banquet-video",
    "https://www.nobelprize.org/prizes/economic-sciences/2004/press-release",
    "https://www.nobelprize.org/prizes/economic-sciences/2005/summary",
    "https://www.nobelprize.org/prizes/economic-sciences/2006/summary",
    "https://www.nobelprize.org/prizes/economic-sciences/2007/summary",
    "https://www.nobelprize.org/prizes/economic-sciences/2008/summary",
    "https://www.nobelprize.org/prizes/economic-sciences/2015/deaton/lecture",
    "https://www.nobelprize.org/prizes/economic-sciences/2016/summary",
    "https://www.nobelprize.org/prizes/economic-sciences/2017/thaler/159673-richard-thaler-interview-transcript",
    "https://www.nobelprize.org/prizes/economic-sciences/2017/thaler/lecture",
    "https://www.nobelprize.org/prizes/economic-sciences/2017/thaler/speech",
    "https://www.nobelprize.org/prizes/economic-sciences/2019/banerjee/lecture",
    "https://www.nobelprize.org/prizes/economic-sciences/2024/advanced-information",
    "https://www.nobelprize.org/prizes/economic-sciences/2024/popular-information",
    "https://www.nobelprize.org/prizes/economic-sciences/2024/press-release",
    "https://www.nobelprize.org/prizes/economic-sciences/2024/summary",
    "https://www.nobelprize.org/prizes/lists/all-nobel-prizes",
    "https://www.nobelprize.org/prizes/lists/all-prizes-in-economic-sciences",
    "https://www.nobelprize.org/prizes/lists/all-prizes-in-economic-sciences/all",
    "https://www.nobelprize.org/prizes/lists/video-prize-lectures-from-laureates-in-economic-sciences",
    "https://www.nobelprize.org/uploads/2017/05/nash-lecture.pdf",
    "https://www.nobelprize.org/uploads/2018/06/akerlof-lecture.pdf",
    "https://www.nobelprize.org/uploads/2018/06/arrow-lecture.pdf",
    "https://www.nobelprize.org/uploads/2018/06/deaton-lecture.pdf",
    "https://www.nobelprize.org/uploads/2018/06/debreu-lecture.pdf",
    "https://www.nobelprize.org/uploads/2018/06/friedman-lecture-1.pdf",
    "https://www.nobelprize.org/uploads/2018/06/harsanyi-lecture.pdf",
    "https://www.nobelprize.org/uploads/2018/06/kahnemann-lecture.pdf",
    "https://www.nobelprize.org/uploads/2018/06/lucas-lecture.pdf",
    "https://www.nobelprize.org/uploads/2018/06/markowitz-lecture.pdf",
    "https://www.nobelprize.org/uploads/2018/06/miller-lecture.pdf",
    "https://www.nobelprize.org/uploads/2018/06/popular-economicsciences2013-1.pdf",
    "https://www.nobelprize.org/uploads/2018/06/scholes-lecture.pdf",
    "https://www.nobelprize.org/uploads/2018/06/selten-lecture.pdf",
    "https://www.nobelprize.org/uploads/2018/06/sen-lecture.pdf",
    "https://www.nobelprize.org/uploads/2018/06/sharpe-lecture.pdf",
    "https://www.nobelprize.org/uploads/2018/06/spence-lecture.pdf",
    "https://www.nobelprize.org/uploads/2018/06/stiglitz-lecture.pdf",
    "https://www.nobelprize.org/uploads/2019/10/duflo-lecture.pdf",
    "https://www.nobelprize.org/uploads/2019/10/popular-economicsciencesprize2019.pdf",
    "https://www.nrmpinternational.org/wp-content/uploads/2021/10/The-Sveriges-Riksbank-Prize-in-Economic-Sciences-in-Memory-of-Alfred-Nobel1.pdf",
    "https://www.nsf.gov/about/history/nobel-prizes",
    "https://www.nsf.gov/news/nsf-congratulates-laureates-2024-nobel-prize-economics",
    "https://www.raptisrarebooks.com/the-nobel-prize-in-economics",
    "https://www.remi.com/news/2024-economics-nobel-prize-winners",
    "https://www.researchgate.net/publication/264729212_The_Sveriges_Riksbank_Prize_in_Economic_Sciences_in_Memory_of_Alfred_Nobel_2013_Eugene_F_Fama_Lars_Peter_Hansen_Robert_J_Shiller_A_brief_review",
    "https://www.researchgate.net/publication/312444618_Sveriges_Riksbank_Prize_in_Economic_Sciences_in_Memory_of_Alfred_Nobel",
    "https://www.researchgate.net/publication/46448830_The_Sveriges_Riksbank_Prize_in_Economic_Sciences_in_Memory_of_Alfred_Nobel_1969-2007",
    "https://www.researchgate.net/publication/4901891_The_Prize_in_Economic_Science_in_Memory_of_Alfred_Nobel",
    "https://www.richmondfed.org/publications/research/economic_quarterly/2007/winter/hetzel",
    "https://www.riksbank.se/en-gb/about-the-riksbank/the-tasks-of-the-riksbank/research/economics-prize",
    "https://www.riksbank.se/en-gb/press-and-published/notices-and-press-releases/notices/2020/paul-r.-milgrom-and-robert-b.-wilson-awarded-the-prize-in-economic-sciences-for-2020",
    "https://www.riksbank.se/en-gb/press-and-published/notices-and-press-releases/notices/2022/ben-s.-bernanke-douglas-w.-diamond-and-philip-h.-dybvigawarded-the-prize-in-economic-sciences-for-2022",
    "https://www.riksbank.se/en-gb/press-and-published/notices-and-press-releases/notices/2024/daron-acemoglu-simon-johnson-and-james-a.-robinson-are-awarded-the-prize-in-economic-sciences-2024",
    "https://www.russellsage.org/research/behavioral-economics-detailed",
    "https://www.superprof.com/blog/nobel-prize-economics",
    "https://www.tandfonline.com/doi/pdf/10.1080/01603477.1984.11489447",
    "https://www.tholden.org/industrial%20organization%202014-15/jean-tirole-wins-the-2014-sveriges-riksbank-prize-in-economic-sciences-in-memory-of-alfred-nobel",
    "https://www.unwe.bg/en/pages/18265/nobel-prize-in-economic-sciences.html",
    "https://www.vedantu.com/commerce/difference-between-keynesian-economics-and-monetarist-economics",
    "https://www.wider.unu.edu/video/wider-annual-lecture-nobel-laureate-amartya-sen",
    "https://www.wikiwand.com/en/articles/Committee_for_the_Sveriges_Riksbank_Prize_in_Economic_Sciences_in_Memory_of_Alfred_Nobel",
    "https://www.worldscientific.com/doi/10.1142/9789810248543_0010",
    "https://www.youtube.com/watch?v=6ivwtz7cPwg",
    "https://www.youtube.com/watch?v=GX55YHSjZWA",
    "https://www.youtube.com/watch?v=MVr2uWMjoPk",
    "https://www.youtube.com/watch?v=RBkLI5i-OC8&pp=0gcJCdgAo7VqN5tD",
    "https://www.youtube.com/watch?v=XeMoeyz7wQQ",
    "https://www.youtube.com/watch?v=YaAupG_rPQg",
    "https://www.youtube.com/watch?v=sI-KAuX9yCU",
    "https://www.youtube.com/watch?v=tD_5MgjIr00",
    "https://www.youtube.com/watch?v=tcHNkk_wb7I"
  ]
}